0,1,2,3,4,5,correct,choiceA_probs,choiceB_probs,choiceC_probs,choiceD_probs
"In a hypothetical syllogism, when the minor premise affirms the antecedent",no valid conclusion can be drawn,the conclusion must affirm the consequent,the conclusion must deny the consequent,the conclusion must deny the antecedent,B,False,0.0480697937309742,0.19011971354484558,0.40248343348503113,0.35519036650657654
"Moses Maimonides, ""The Guide of the Perplexed"": God, may He be exalted ... existed alone, and nothing else. ...Afterwards, through His will and His volition, He brought into existence out of nothing all the beings as they are, time itself being one of the created things. For time is consequent upon motion, and motion is an accident of what is moved. Furthermore, what is moved...is itself created in time ....",Equivocation,Appeal to Authority,Inconsisteny,Slippery Slope,C,False,0.02792399562895298,0.23380474746227264,0.23380474746227264,0.4949646294116974
"John Stuart Mill: Each person's happiness is a good to that person, and the general happiness, therefore, a good to the aggregate of all persons.",Fallacy of Composition,Fallacy of Division,Gambler's Fallacy,Equivocation,A,False,0.03567849099636078,0.14111116528511047,0.18119032680988312,0.6324163675308228
_Circulus in probando_ is another name for,The fallacy of accident,False dilemma,Begging the question,Guilt by association,C,False,0.02515583299100399,0.18587785959243774,0.2106272429227829,0.5725441575050354
Arguing that an idea should be accepted or rejected only because of the source of the idea commits which of the following fallacies?,genetic fallacy,appeal to popularity,scare tactics,appeal to emotions,A,False,0.005930368788540363,0.038670863956213,0.07224668562412262,0.8801447749137878
"At the end of the course, Professor Jones told us that we were the best class he had ever had. That's why I'm sure that the 0.0 the appeared on my grade report is a mistake. Surely, if we were as good a class as Professor Jones said we were, none of us deserved to fail.",Fallacy of Composition,Fallacy of Division,Questionable Cause,Appeal to Gallery (Provicialism),B,False,0.01699570193886757,0.11082589626312256,0.12558217346668243,0.722675621509552
Which of the following best describes the fallacy of equivocation?,A form of loaded language that uses an emotionally charged restatement of the claim in place of support for the claim.,Changing the meaning of a word or phrase from one part of the argument to another.,Confusing figurative language with literal language.,Referring to an act committed by an opponent in negative terms while referring to the same act committed by the arguer or supporters in favorable terms.,B,False,0.11602625250816345,0.16881722211837769,0.24562759697437286,0.45889273285865784
The fallacy of appeal to emotions consists of,trying to make an opponent's argument seem ridiculous,defending wrongdoing by claiming the opposing arguer does the same thing,arguing that an argument should be rejected because the source of the argument,trying to get someone else to agree to a claim only by arousing that person's feelings about the subject,D,True,0.011691782623529434,0.052398934960365295,0.11092855036258698,0.8196572661399841
"""To be valid, the minor premise must either agree with the antecedent, or disagree with the consequent"" is a requirement for",a disjunctive syllogism,a categorical syllogism,a conditional syllogism,disjunctive enthymeme,C,False,0.11906033754348755,0.2520507574081421,0.15287649631500244,0.4708927571773529
Which of the following fallacies happens when someone concludes that someone couldn't have done something good because he or she has negative qualities?,Laudatory personality,Guilt by association,Reprehensible personality,Circular reasoning,C,False,0.009768389165401459,0.11900334805250168,0.09267989546060562,0.7759992480278015
Another name for the bandwagon appeal is,appeal to beliefs,appeal to authority,appeal to the people,common man appeal,C,False,0.004522508475929499,0.0908370092511177,0.0378664992749691,0.8618375658988953
A valid disjunctive syllogism has which of the following characteristics?,The minor premise must either affirm the antecedent or deny the consequent,The minor premise must either accept an alternative or reject an alternative,One of the premises is missing,It reaches a truthful conclusion,B,False,0.045821413397789,0.1812272071838379,0.2053573578596115,0.5582190752029419
Appeal to beliefs is another name for which of the following fallacies?,ad nauseam,appeal to tradition,solid slope,self evident truths,D,True,0.02190927416086197,0.08665286004543304,0.16188885271549225,0.72553551197052
When a claim is supported only by asserting that unidentified experts accept the claim the arguer has committed which of the following fallacies?,appeal to tradition,ad vericundiam,appeal to anonymous authority,snob appeal,C,False,0.007093112450093031,0.05938990041613579,0.2072911262512207,0.723517119884491
The black-or-white fallacy is another name for,The fallacy of accident,False dilemma,Begging the question,Circular reasoning,B,False,0.05125146359205246,0.17888519167900085,0.1393159180879593,0.6243706345558167
The false sign fallacy is,arguing that what is true of part of an object is necessarily true of the entire object,arguing that two things are similar enough that what is true of one is true of the other,arguing that since something is inexpensive it is necessarily of low quality,reasoning by sign when there is really not a direct relationship between the alleged sign and the subject of the argument,D,True,0.10457366704940796,0.19536931812763214,0.22138245403766632,0.4686666429042816
""" _Ad novitatem_ "" is",arguing that what is true of a few members of a class is true of all members of the class,drawing a conclusion by applying irrelevant criteria to a subject,substituting individual stories for a larger sample as support for a claim,"arguing that something must be good because it is new, or must be bad because it is old",D,False,0.04767860099673271,0.35229986906051636,0.24213193356990814,0.35229986906051636
"When someone tries to support a proposition with information that really has nothing to do with the claim being made, that person has probably committed which of the following fallacies?",straw person,genetic fallacy,irrelevant conclusion,ignoratio elenchi,C,False,0.0026013446040451527,0.09170056134462357,0.13342350721359253,0.7677993774414062
Applying irrelevant standards to the subject of the argument is the fallacy of,ad crumenam,ad antiquitatem,false criteria,hasty generalization,C,False,0.009720236994326115,0.09222303330898285,0.3647492229938507,0.5307069420814514
"If you argued something is flawed because it fails to do something, when it was never intended to do that, you may have committed which of the following fallacies?",ad ignorantium,Many questions,Extension,Compound proposition,C,False,0.014582048170268536,0.12209398299455643,0.15677179396152496,0.7026024460792542
""" _Ad antiquitatem_ "" is",a specific type of false cause fallacy that argues that since two event happened at the same time one event must have caused the other,"a specific type of false sign fallacy that reasons something is necessarily better because it is old, or is worse because it is new","a specific type of false sign fallacy that reasons something is necessarily better because it is new, or is worse because it is old",arguing that what is true of an individual part of an object must be true of the entire object,B,False,0.06667939573526382,0.15995556116104126,0.18125338852405548,0.5582997798919678
""" _Ad crumenam_ "" is",basing a conclusion on an analogy when the items being compared are not similar enough to sustain the analogy,"a specific type of false sign fallacy that reasons someone is necessarily better because he or she is wealthy, or is worse because he or she is poor",drawing a firm conclusion without enough evidence to support that conclusion,a specific type of false cause that involves mistakenly attributing the cause of an event to a simple cause when the cause is more complex,B,False,0.0146676329895854,0.08440639823675156,0.25999000668525696,0.6236835718154907
The fallacy of laudatory personality is a specific type of,The fallacy of accident,False dilemma,Begging the question,Circular reasoning,A,False,0.026903823018074036,0.1366288810968399,0.1366288810968399,0.6938587427139282
Appeal to ignorance is a fallacy that involves,"determining the conclusion one wants first, then accepting only evidence supporting that conclusion, or interpreting all evidence as support for that conclusion.",arguing something is inferior just because it doesn't do something it was never intended to do.,arguing that a claim must be true because there is no evidence that it is false.,arguing about something when you are ignorant about the subject,C,True,0.04961284622550011,0.10503039509057999,0.4154032766819,0.4154032766819
Which of the following statements is **not** true?,A formally valid syllogism may be materially untrue,A formally valid syllogism must be materially true,A materially true conclusion may arise from a formally valid syllogism,The formal validity of a syllogism does not guarantee it is materially true,B,False,0.0853673592209816,0.14074696600437164,0.20478565990924835,0.5566650629043579
"""The minor premise must affirm the antecedent or deny the consequent"" is a validity requirement of which type of argument?",Toulmin,Categorical,Disjunctive,Conditional (or hypothetical),D,True,0.062114324420690536,0.1913256049156189,0.2168002873659134,0.5200768709182739
Which of the following describes the fallacy of appeal to loyalty?,arguing that someone should do something because it will make him or her better liked by others,responding to an argument with an expression of derision,arguing that an idea should be accepted only because of who originated the idea,arguing that someone should do something to be loyal to a person or a group,D,True,0.022178350016474724,0.08771707117557526,0.053203094750642776,0.8322364687919617
Arguing in favor of a claim based only on the evidence that some regular people believe the claim is one way to commit which of the following fallacies?,poisoning the well,common person appeal,ad numerum,suppressed evidence,B,False,0.02495230734348297,0.18437400460243225,0.14359061419963837,0.6435284614562988
The appeal to fear involves,arguing something should be done only because it will make the person doing it feel good,arguing someone should do something only because of ill will towards someone else,"arguing actions should be taken to avoid exaggerated, unlikely, or irrelevant negative results",characterizing an opponents position in a way that makes it seem silly,C,False,0.024405576288700104,0.05166660249233246,0.10937820374965668,0.8082016706466675
"It's silly to pass laws against discrimination, since it is obvious that we can't live without it. We discriminate between pleasant and unpleasant tastes in selecting our food, between pleasant and unpleasant sounds in selecting our music, between harmonious and unharmonious colors in decorating our homes, between interesting and uninteresting people in choosing our friends, and so on. We can't live without discriminating.",Prejudicial Language,Equivocation,Inconsistency,Straw Man,B,False,0.05862108990550041,0.2627215087413788,0.18056568503379822,0.49082836508750916
The fallacy of guilt by association is a specific type of,Fallacy of accident,Laudatory personality,Begging the question,Circular reasoning,A,False,0.011193878017365932,0.08271218836307526,0.28869393467903137,0.6111650466918945
Appeal to compassion is,an appeal to emotion that argues against a position based only on negative personal feelings toward the position,an appeal to emotion that argues a conclusion should be made based only on feeling sorry for someone,an appeal to emotion that argues an action should be taken based only on the need to be loyal to someone,arguing that an idea should be accepted based only on who originated the idea,B,False,0.016869813203811646,0.033549629151821136,0.07102455943822861,0.8652563095092773
"When someone uses highly emotionally charged terms during an argument, without giving any reasons why those terms fit the subject, that person may have committed which of the following fallacies?",Special pleading,Amphiboly,Equivocation,Loaded language,D,True,0.01753152348101139,0.11431989073753357,0.35213005542755127,0.5123462080955505
Arguing that someone couldn't have done something good because she holds a particular position commits the fallacy of,Guilt by association,False dilemma,Reprehensible personality,False dichotomy,C,False,0.01217166893184185,0.13085776567459106,0.10191214084625244,0.7530345320701599
""" _Ad antiquitatem_ "" is a specific kind of",False cause,False sign,False analogy,Hasty Generalization,B,False,0.02391774207353592,0.2571399509906769,0.2913777530193329,0.4239521026611328
The hasty conclusion fallacy is,arguing that a single event caused another when the cause is really several events,making an argument without enough evidence to support the conclusion,substituting individual stories for a larger sample in support of a claim,reasoning that applies irrelevant criteria to the subject of the argument.,B,False,0.05900992453098297,0.2059648633003235,0.2333887815475464,0.49408403038978577
""" _Ad lazarum_ "" is","a specific type of false sign that argues there is necessarily an inverse relationship between cost and quality, so something is necessarily a better value because it costs less",arguing that what is true of an entire object must also be true of every individual part of that object,a specific type of false analogy that reasons what is true about nature must be true about humans,drawing a conclusion without enough evidence to support that conclusion,A,False,0.021369576454162598,0.12297341227531433,0.1393471360206604,0.7076631784439087
"All things that are spoiled are inedible. Timothy is spoiled. So, Timothy is inedible.",Equivocation,Attacking the Person (ad hominem),Fallacy of Division,Questionable Cause,A,False,0.008158568292856216,0.06417211145162582,0.22398267686367035,0.6899152398109436
"Which of the statements below is correct about the following argument?

""If the sky is blue there won't be rain. The sky is blue today. Therefore, there won't be rain.""",It is a formally valid categorical syllogism,It is a formally invalid disjunctive syllogism,It is a formally valid conditional syllogism,It is a formally invalid conditional syllogism,C,False,0.05122782289981842,0.1577928066253662,0.1577928066253662,0.624082624912262
Which of the following best describes the snob appeal fallacy?,reasoning that a claim is true based only on the evidence that it has been made so often.,arguing someone should accept a claim based only on the evidence that he or she has the favorable characteristics to understand the truth of the claim.,arguing a claim should be accepted based only on evidence that unidentified authorities accept it.,"arguing that someone should accept an idea or product based only on evidence that prestigious people accept it, or that non-prestigious people reject it.",D,True,0.021977141499519348,0.05974006652832031,0.26773640513420105,0.6422662734985352
"""Each term must be used twice, no more and no less,"" is a test of validity for which type of syllogism?",Enthymeme,Categorical,Disjunctive,Conditional,B,True,0.09968261420726776,0.3479264974594116,0.18623164296150208,0.3479264974594116
"The universe, like a watch, must have a maker.",Fallacy of Accident,Questionable Analogy,Questionable Cause,Fallacy of Composition,B,False,0.008901693858206272,0.07453296333551407,0.10844482481479645,0.8013049364089966
The natural law fallacy is a specific type of,false analogy,false cause,false criteria,false sign,A,False,0.04384944960474968,0.22268587350845337,0.1965196281671524,0.5341956615447998
"Given the following major premise, which of the following minor premises could lead to a valid conclusion?

""Either I'm going to do well on this test or I'm going to be mad.""","""I won't do well on the test""","""I won't take the test""","""My birthday is today""",both A and B,A,False,0.02189730294048786,0.09219107776880264,0.11837568134069443,0.6812050938606262
Men are better drivers than women are. The proof of this is that men are more capable than women of managing cars on the road.,Begging the question,Ad hominem (Attacking the Person),False Dilemma,Appeal to Pity,A,False,0.003357857232913375,0.0361003652215004,0.3881155550479889,0.5647047758102417
"In a faulty analogy, the things being compared are...",Sufficiently similar,Sufficiently similar in irrelevant ways,Complete opposites,Not sufficiently similar in relevant ways,D,True,0.10195697844028473,0.19048070907592773,0.24458208680152893,0.4569394588470459
Which of the following describes the _tu quoque_ fallacy?,summarizing an opponent's position in a way that makes it seem silly,attempting to gain agreement based only on the feelings aroused in the argument,responding to charges of wrongdoing by saying the accuser does the same thing,arguing against a position based only on negative personal feelings toward the position,C,False,0.012462533079087734,0.09208635985851288,0.11824122816324234,0.7710296511650085
Responding to charges of wrongdoing by saying the accuser or others do the same thing describes which of the following fallacies?,ignoratio elenchi,ad baculum,ad misericordiam,tu quoque,D,True,0.013549760915338993,0.16506987810134888,0.2401752471923828,0.5761504769325256
"The fallacy that involves reasoning that determines the conclusion one wants first, then accepts only evidence supporting that conclusion, or interprets all evidence as support for that conclusion is known as",ad ignorantium,a priori,plurium interrogationum,Extension,B,False,0.02114931493997574,0.12170591205358505,0.057489801198244095,0.7936221957206726
The genetic fallacy consists of,arguing that a conclusion should be made based on feeling sorry for someone when that feeling is irrelevant to the conclusion,responding to charges of wrongdoing by saying the accuser does something just as bad,arguing that an idea should be accepted or rejected based only on who originated the idea.,causing confusion during refutation because of a real or feigned lack of ability to engage in refutation,C,False,0.05285011604428291,0.09873701632022858,0.11188369989395142,0.7295733690261841
Another name for the fallacy of begging the question is,Dito simpliciter,Bifurcation,Reprehensible personality,Circular reasoning,D,True,0.009889334440231323,0.10632036626338959,0.09382739663124084,0.7856071591377258
The fallacy of _ignoratio elenchi_ is also known as,argument against the person,appeal to compassion,ignorance of refutation,"the ""you too"" fallacy",C,False,0.017079010605812073,0.1185518130660057,0.1724918782711029,0.682218611240387
"William Safire in American Heritage Magazine (December 1987): ...The greatness of Lincoln was his purposefulness. He saw something that few others saw: that the democratic experiment centered on the Union and that majority rule was everything. The minute you allowed secession, you made democracy an absurdity---because what would happen would be continued subdivision.",Slippery Slope,Questionable Analogy,Appeal to Authority,Straw Man,A,False,0.025463363155722618,0.21320214867591858,0.3515108823776245,0.3983140289783478
"So, how long have you been beating your wife?",Attacking the Person (ad hominem),False Dilemma,Prejudicial Language,Appeal to Force,C,False,0.010421219281852245,0.10525057464838028,0.09288331121206284,0.7777024507522583
"""Misuse of statistics,"" ""questionable statistics,"" and ""questionable use of statistics"" are all other names for the fallacy of",appeal to a pride,significance,poisoning the well,slippery slope,B,False,0.028235001489520073,0.2364087998867035,0.08696992695331573,0.6426256895065308
"E.F. Schumacher, famous economist, in an article in the Atlantic (April 1979): Fifteen months [after I had advised that rural India should have a technology intermediate between the hoe and the tractor,] an all-India conference on intermediate technology was arranged. (They still didn't like the term [intermediate], so they called it appropriate technology. That's all right: when I come to India and somebody says, ""Oh, Mr. Schumacher, I don't believe in appropriate technology"", I just look him straight in the face and say, ""Oh, that's splendid. Do you believe in inappropriate technology?"")",Equivocation,Inconsistency,Appeal to Authority,Prejudicial Language,A,False,0.03770572692155838,0.11614179611206055,0.16898533701896667,0.6683499813079834
"We must assume that he is a Communist, because he says that he is not, and we know that Communists are taught always to deny party membership.",Argument from Ignorance,Affirming the Consequent,Denying the Antecedent,Begging the Question,B,False,0.018654394894838333,0.15619134902954102,0.33065709471702576,0.48110321164131165
"If someone argues that something should be done in a certain way because that's the way it's always been done, that person has committed which of the following fallacies?",slippery slope,appeal to tradition,argument from authority,ad nauseam,B,False,0.011842618696391582,0.0875057727098465,0.16348230838775635,0.7326768636703491
False analogy is another name for which fallacy?,Over generalization,Composition,Concomitant variation,Imperfect analogy,D,True,0.02253624238073826,0.146954745054245,0.07865921407938004,0.7462978363037109
"Which of the following fallacies happen if someone argues that you are a reasonable and intelligent person, so of course you understand his claim is true?",significance,argument from authority,appeal to pride,slippery slope,C,False,0.008693677373230457,0.05668989196419716,0.044150132685899734,0.8867791295051575
"Which fallacy happens when someone argues in favor of a two part proposition, only supports one part of the proposition, then asserts that the entire proposition has been supported.",a priori,Complex proposition,Extension,Appeal to ignorance,B,False,0.0009962626500055194,0.015584170818328857,0.017659179866313934,0.9641584753990173
Which of the following is a test of the validity of a conditional syllogism?,Every term must be used twice--no more and no less,"If one premise is negative, the conclusion must be negative",The minor premise must affirm the antecedent or deny the consequent,The alternatives presented must be mutually exclusive,C,False,0.06639064103364944,0.23172610998153687,0.2625800669193268,0.4329213500022888
Which of the following fallacies happens when someone attributes the cause of an event to a simple cause when the cause is actually more complicated?,complex cause,hasty generalization,post hoc,division,A,False,0.0239544864743948,0.20056846737861633,0.29182541370391846,0.48113876581192017
Which of the following is another name for the fallacy of amphiboly?,Misusing ambiguity,Reification,Figure of speech,Special pleading,A,False,0.016710858792066574,0.10896848142147064,0.15854820609092712,0.7105637788772583
"Tan ah Tiat, forty-nine years old, a native of Kuala Lumpar, Malaysia, was charged with possession of opium. Arguing for acquittal, he told the judge that his opium habit did no harm, as he was too old to work anyway. Asked how he lived, he replied that he lived on the earnings of his grandmother.",Straw Man,False Dilemma,Inconsistency,Appeal to Authority,C,False,0.014191837050020695,0.09254240244626999,0.2850506901741028,0.6034522652626038
Which of the following best describes the fallacy of self-evident truths?,arguing that a claim is true based only on evidence that an authority figure accepts the claim.,arguing a claim should be accepted based only on evidence that unidentified authorities accept it.,"arguing that a claim should be accepted based on evidence that is not presented, but is asserted to be well known or obvious.",arguing someone should accept a claim based only on the evidence that he or she has the favorable characteristics to understand the truth of the claim.,C,False,0.030767425894737244,0.12168752402067184,0.2919132113456726,0.5453656315803528
""" _Ad lazarum_ "" is a specific kind of",Anecdotal evidence,Complex cause,False criteria,False sign,D,True,0.011012302711606026,0.13415731489658356,0.25063884258270264,0.6012513041496277
"We're perfectly entitled to believe there is a God. After all, every effort by atheists to prove otherwise has failed.",Appeal to Authority,Denying the Antecedent,Attacking the Person (ad hominem),Argument from Ignorance,D,True,0.015212520025670528,0.14433236420154572,0.09919808804988861,0.7329802513122559
"When someone makes an argument, and the only evidence he or she uses to support the claim is the testimony that an authority figure believes the claim, the arguer has committed which fallacy?",Questionable use of statistics,Apple polishing,Self evident truths,Argument from authority,D,True,0.008654383942484856,0.05643366277217865,0.04980253800749779,0.8827710747718811
When someone changes the meaning of a word or phrase from one part of the argument to another that person may have committed which of the following fallacies?,Special pleading,Hypostatization,Question begging epithets,Equivocation,D,True,0.017355991527438164,0.12824437022209167,0.11317528039216995,0.7379955053329468
Another name for the fallacy of accident is,Laudatory personality,Guilt by association,Either-or fallacy,Dicto simpliciter,D,True,0.010831101797521114,0.23157921433448792,0.1093902513384819,0.6294974684715271
"""Each term must be used twice, no more and no less"" is a requirement for",valid categorical syllogism,a valid disjunctive syllogism,a valid conditional syllogism,a materially true hypothetical syllogism,A,False,0.12045115232467651,0.22503237426280975,0.22503237426280975,0.42041581869125366
