0,1,2,3,4,5,correct,choiceA_probs,choiceB_probs,choiceC_probs,choiceD_probs
What is the rationale for the exhaustion of local remedies in international human rights?,The local remedies rule aims to free up international tribunals to deal with the most serious cases,The local remedies rule aims to dissuade applicants abusing the system from filing unnecessary petitions,The local remedies rule aims on the one hand to restrict the volume of petitions to international tribunals while at the same time building up the capacity of local courts,The local remedies rule helps demonstrate that national courts are always better placed than international ones to deal with cases,C,False,2.6465729607849653e-09,9.056073946300813e-11,1.9171708665055576e-10,1.1628229629190301e-10
Which of the following cases best illustrates the 'living instrument principle' used by the European Court of Human Rights?,Golder v UK (1978),A v UK (2009),Goodwin v UK (2002),Osman v UK (1998),C,False,1.5229964844820643e-08,7.582551808660298e-10,1.1861107651611746e-08,2.7894650478366145e-10
Is the recognition of foreign judgments subject to the same rules as those applicable to the incorporation and transformation of treaties?,Foreign judgments are enforced on the basis of the doctrine of incorporation,Foreign judgments are enforced on the basis of the doctrine of transformation,The recognition of foreign judgments is dependent on the existence of appropriate bilateral or multilateral treaties,The courts exercise discretion as to the enforcement of foreign judgments on the basis of the rule of comity,C,False,0.007569616194814444,8.409083966398612e-05,0.0005483411950990558,4.501058720052242e-05
What was the most important finding by the House of Lords in the Pinochet case?,The Pinochet case confirmed that former heads of State enjoy absolute immunity,The Pinochet case confirmed that all public acts enjoy immunity,The Pinochet case confirmed that former heads of State cease to enjoy personal immunity once removed from office,The Pinochet case confirmed that in respect of immunities there is no difference between a current and a former head of State,C,True,1.818961425925636e-09,3.1608812789407637e-10,2.335592830249311e-09,8.592165867682411e-10
Which one of the statements below is false?,The war crimes trials at Nuremberg and Tokyo took place immediately after the First World War,The war crimes trials introduced a 'crime against humanity' as an offence,The war crimes trials held individuals legally responsible for acts such as war crimes and crimes against humanity,"The war crimes trials found that ""superior orders"" could not be used as a defence for war crimes or crimes against humanity",A,False,1.2501528701136522e-09,1.3176514046531196e-10,9.23744991609965e-09,3.581747953784742e-10
Which State exercises jurisdiction over vessels on the high seas?,All States may exercise jurisdiction over foreign vessels on the high seas,States may exercise jurisdiction over foreign vessels on the high seas only in cases of criminal activity that concerns them,"The flag State is to exercise exclusive jurisdiction over its vessels on the high seas, with the exception of specific cases, such as piracy",The flag State is the only State to exercise exclusive jurisdiction over its vessels on the high seas with no exception,C,False,3.288717607574654e-06,6.825515441732932e-08,3.927812883830484e-07,2.699543699691276e-07
Should treaties assume a particular form?,Treaties should always be designated as such and assume a particular form,"Treaties should always assume a particular form, no matter how they are designated",Treaties do not have to assume a particular form or designated as such,"Treaties have to be designated as such, no matter what form they assume",C,False,0.0052132937125861645,2.1305540940375067e-05,0.00048491189954802394,0.00029411393916234374
What is the fundamental premise of monist theory?,Monism posits that international law is superior to domestic laws,Monism posits that international and domestic law are part of the same legal order,Monism posits that domestic laws are superior to international law,Monism posits that domestic and international law never clash,B,False,0.001497666584327817,1.0091197509609628e-05,0.00013930469867773354,6.935572400834644e-06
Where do we find the 'general principles of law recognized by civilized nations' (article 38 ICJ Statute)?,We look for established principles of law recognized only among the most civilised nations,"We look for established principles of law, which are common to all major legal systems",We look for general principles of international law recognized by international courts and tribunals,We look for general principles of law recognized by all nations,B,False,6.144133294583298e-06,2.3823389483368373e-07,4.222796633257531e-06,2.845298219256165e-08
When does an illegal act of violence on the high seas fall short of qualifying as piracy?,When it is committed against a public vessel of another State,When it is committed for 'private ends',When it is committed by a warship even when its crew has mutinied and taken control of the ship,When it is not committed against another vessel and when it is not committed for 'private ends',D,False,4.538970460998826e-05,1.0674634722818155e-06,7.887547326390631e-06,2.2598203486268176e-06
"What is the meaning of ""armed attack"" in Article 51 UN Charter?",Armed attack includes all types of armed force,Armed attack includes all high intensity instances of armed force,Armed attack includes terrorist attacks,"An ""armed attack"" gives the right to invade the aggressor State",B,False,2.260297151224222e-06,1.1253356291263117e-07,1.4449597074417397e-07,3.653429914152184e-08
Who is an 'injured State' in the law of international responsibility?,A State is 'injured' in case that it has suffered a damage from the internationally wrongful conduct,A State is 'injured' in cases that there has been a violation of a peremptory norm of international law,A State is 'injured' should it acknowledge the existence of the internationally wrongful conduct,"A State is 'injured' if the obligation breached was owed to it individually or if it was owed to a group of States, including that State, and it was specially affected",D,False,4.05865202557365e-10,3.3315444153414475e-11,2.020683967374204e-11,1.3887944613766301e-11
What is personal (ratione personae) immunity?,Personal immunity is afforded to all physical persons,Personal immunity is that which is afforded in a personal capacity and hence does not cover conduct of the State as such,Personal immunity is afforded only to particular persons irrespective if their conduct was undertaken in a private or public capacity,Personal immunity is afforded to State officials for conduct undertaken in a public capacity,C,True,5.1352362788747996e-05,2.897102149290731e-06,0.0008032860932871699,1.0111878509633243e-05
Which of the following statements best describes the UN Human Rights Council?,The UN Human Rights Council has the power to impose economic sanctions on a state for human rights violations,The UN Human Rights Council scrutinises the human rights records of member states on the Council and each member state of the UN,The UN Human Rights Council replaced the Economic and Social Committee of the UN,The UN Human Rights Council consists of 27 member states,B,False,2.1444580852403305e-05,8.314966066791385e-07,1.370906147712958e-06,3.058904951558361e-07
When a reservation is considered as invalid under the law of treaties?,A reservation is invalid when the majority of the State parties objects to it,A reservation is invalid only when an international tribunal says so,A reservation is invalid only when is incompatible with a peremptory norm of international law (jus cogens),A reservation is invalid when it is incompatible with the object and purpose of the treaty,D,False,1.147595321526751e-05,1.3706071513297502e-06,0.00020341614435892552,3.2879156606213655e-06
What kind of rights do coastal States enjoy over their continental shelf?,The coastal State enjoy ipso facto and ab initio sovereign rights over its continental shelf for the purpose of exploring it and exploiting its natural resources,The coastal State may exercise sovereign rights over its continental shelf only upon its declaration,The coastal State exercise sovereign rights over its continental shelf for the purpose of exploiting its fishing resources,The coastal State may exercise only limited rights over its continental shelf and only upon the consent of its neighbouring States,A,True,1.1861118309752783e-08,4.5990550257002383e-10,7.582559025109958e-10,4.5990550257002383e-10
Are there any limits to the application of article 103 of the UN Charter?,"No, there are no limits to article 103","Yes, Article 103 cannot trump multilateral treaties","Yes, article 103 of the UN Charter cannot trump jus cogens norms","Yes, when a case is submitted to the ICJ, article 103 ceases to have any effect",C,True,4.2777878461741636e-11,1.0815941892117209e-11,2.1724398668876432e-10,1.3887944613766301e-11
Can countries rely on their domestic law as an excuse to violate their obligations under international law?,Domestic law always prevails over international law,Only customary international law prevails over domestic law,Obligations under international law prevail over domestic law,Constitutional obligations always prevail over obligations under international law,C,True,6.958163339731982e-06,2.2589847503695637e-06,0.0005527553730644286,5.040476480644429e-07
What is meant by an international organisation's implied powers?,Implied are those powers which are necessary in order for an organisation to carry out the tasks conferred upon it and which are not stipulated in its charter,It refers to new powers assumed unilaterally by the organisation,It refers to powers conferred upon the organisation by the international Community,Implied powers are those whose determination depends on an expansive interpretation of an organisation's charter,A,True,2.9022583021287574e-06,4.691063892892089e-08,1.63734199531973e-07,3.653403624070961e-08
What are the criteria for statehood under the 1933 Montevideo Convention?,It requires that the entity in question is not an aggressor and that it is peaceful,It requires recognition by the majority of other nations,"It requires a permanent population, a defined territory, a government and a capacity to enter into foreign relations",It requires stable and indissoluble borders as well as recognition,C,False,2.8453314371290617e-08,5.905296807107163e-10,1.2501514268237202e-09,2.7894647702808584e-10
