0,1,2,3,4,5,correct,choiceA_probs,choiceB_probs,choiceC_probs,choiceD_probs
How are the members of the arbitral tribunal appointed?,All the members of the arbitral tribunal are appointed by the parties,All the members of the arbitral tribunal are appointed by the parties,"All the members of the arbitral tribunal are appointed by an impartial third party, such as the president of the ICJ",All the members of the arbitral tribunal are appointed by the parties from a restricted list of arbitrators,A,False,4.691161237246888e-08,8.152014174811484e-09,4.4508490759653796e-07,2.5109972767722866e-08
Are the peremptory norms of international law the only norms that set out obligations erga omnes?,Yes,"No, acts of international organizations also set out such obligations","No, decisions of international courts also set out such obligations","No, even though all peremptory norms set out obligations erga omnes, the latter may also spring from treaties regulating objective regimes or unilateral acts",D,False,1.2751885947182018e-07,2.2159456491976925e-08,3.9278575059142895e-07,1.2751885947182018e-07
What is the constitutive theory of recognition?,Recognition is determinative of statehood,Recognition requires constitutional approval by third nations,Recognition requires that the constitution of the recognised State includes sufficient human rights guarantees,Countries wishing to be recognised must possess a valid constitution,A,True,0.00015836379316169769,4.220252321829321e-06,6.601584755117074e-05,3.533573908498511e-05
The enforcement mechanism of the International Covenant on Civil and Political Rights (and Protocol) consists of,A reporting mechanism only,Judgment of an international tribunal,Right to individual petition only,A reporting mechanism and right to individual petition,D,False,0.0002956790558528155,2.7502435841597617e-05,0.0004874923615716398,0.00012325735588092357
Is piracy under international (jure gentium) law subject to universal jurisdiction?,Piracy jure gentium is subject to flag State jurisdiction,Piracy jure gentium is subject to universal jurisdiction,Piracy jure gentium is subject to port State jurisdiction,Piracy jure gentium is subject to nationality-based jurisdiction,B,False,0.00010887758253375068,1.9941626305808313e-06,4.005381924798712e-05,1.2095206329831854e-06
What are self-executing treaties?,Self-executing treaties are adopted only by the executive,Self-executive treaties are clear and precise enough so as not to require any further implementing measures,Self-executing rely on implementing measures stipulated in the treaty Itself,Self-executing treaties follow the doctrine of transformation,B,False,0.000898614467587322,3.4843062167055905e-05,0.012404989451169968,2.1133386326255277e-05
"Is the ICJ hostile to the idea that an armed attack may arise through a series of lower intensity, yet cumulative, instances of armed force?",The ICJ was not hostile to the accumulation theory,"The concept of an armed attack refers to a single attack, not multiple smaller instances of armed force",In the Nicaragua case the ICJ dismissed the accumulation theory,The ICJ has never addressed this issue,A,True,0.0015000508865341544,3.527781518641859e-05,0.00015810420154593885,1.6664060240145773e-05
Is there any priority among international courts and tribunals?,"According to the lis pendens rule, the court or the tribunal that seizes first the dispute has exclusive jurisdiction to adjudicate it",The International Court of Justice has by definition priority over any other court or tribunal,"Since there is no lis pendens rule in international law and all depends on the consent of the parties to a dispute, there is no priority or hierarchy among international courts and tribunals",Regional or special courts have priority over all others in line of the principle of lex specialis,C,False,1.7603389323994634e-06,2.2159397872201225e-08,2.8453229106162325e-08,7.194103091023862e-09
Do third States enjoy any fishing rights within the Exclusive Economic Zone of another State?,"When the coastal State cannot harvest the 'total allowable catch', the coastal State is to give other State access to that surplus with priority to be given to developing and land-locked States",Third States may never have access to fisheries within another State's EEZ,The coastal State is to give access to fisheries within its EEZ only to neighbouring States,"Third States are free to fish within another EEZ, except from certain designated areas",A,True,1.5534799331362592e-06,2.845297508713429e-08,9.931064681723001e-08,2.510966190527597e-08
What is the purpose of sovereign immunity?,The purpose of immunity is to protect foreign Heads of State from embarrassment,Immunity protects a State from being invaded by another,Immunity shields States from being sued in the courts of other States,The purpose of immunity is to offer impunity in respect of all crimes,C,False,3.927812883830484e-07,9.23733090019141e-09,1.955542927589704e-08,2.6465398761388315e-09
What is passive personality jurisdiction?,It is jurisdiction based on the nationality of the offender,It is jurisdiction based on where the offence was committed,It is jurisdiction based on the nationality of the victims,It is jurisdiction based on the country where the legal person was Registered,C,False,0.0003346369485370815,6.129089342721272e-06,4.528818681137636e-05,2.25476605919539e-06
Which of the following types of rights have been described as first generation rights?,Social and economic rights,Civil and political rights,Cultural rights,People's rights,B,False,7.888574145908933e-06,1.6372213451631978e-07,8.938925930124242e-06,7.337517331507115e-07
What is the problem of 'fragmentation' of international law?,Fragmentation of international law concerns the possibility of different legal regimes apply the same rules of international law,"It is possible for several legal regimes (ie foreign investment law and human rights law) to exist and develop in isolation of each other, ultimately culminating in the production of divergent rules of international law",Fragmentation is when States assume different interpretations of the same rule of international law,Fragmentation is when States disagree to abide by a certain rule of international law,B,False,5.315784790127509e-08,6.691585618945339e-10,4.058651470462138e-10,4.5990550257002383e-10
What is functional (ratione materiae) immunity?,Functional immunity covers the person but not the act,Functional immunity covers the act and incidentally also the person committing the act,Functional immunity covers the State and incidentally also the act,Functional immunity covers both private and public acts as long as they are sanctioned by the State,B,False,1.4449653917836258e-07,7.194058682102877e-09,8.764157399809847e-08,2.3355688494319793e-09
What is the meaning of implied authorisation?,Presumption of Security Council approval of armed force when a State has been forewarned,Implicit authorisation on the basis of a specific number of votes by UNSC members,Presumption that all unlawful attacks will be subject to armed force by a resolution of the UNSC,In cases of repeated unlawful attacks the UNSC shall authorise neighbouring States to take whatever measures they deem necessary to rectify the situation,A,False,4.450785979770444e-07,9.931046918154607e-08,5.42216730536893e-06,2.1024025897986576e-07
Which philosopher called the idea of natural rights 'nonsense on stilts'?,Alan Gerwith,Emmanuel Kant,John Locke,Jeremy Bentham,D,False,1.493094675675266e-10,6.5602007333354084e-12,2.5946095966178362e-11,5.1090889331695255e-12
Who has the authority to conclude a treaty on the part of States?,"Treaties are concluded by the competent representatives of States. Heads of States, heads of governments, ministers of foreign affairs and heads of diplomatic missions are presumed to have such authority",Treaties may only negotiated and concluded by the heads of State and ministers of foreign affairs,Treaties are negotiated and signed only by the persons that bear the necessary 'full powers' and no person is presumed to hold such authority,Treaties are concluded only by members of the diplomatic missions of States,A,True,3.850741503441668e-09,1.0261878152784121e-10,5.905303468445311e-10,9.056076027968984e-11
Who is a 'persistent objector'?,The State which persistently objects to the rule in question after its formation,The State which denies to be bound by the rule in question for a short period,The State which persistently and publicly objects to the formation of a rule of customary law from its outset,The State which accepts the formation of a rule of customary law but it retains objections as to its content,C,True,1.4735707736690529e-05,1.7599294324099901e-06,0.00010888298129430041,2.901633251894964e-06
What is the meaning of collective security?,The right to self-defence by more than one nation acting in concert,The right of one's allies to defend the victim State,The authorisation of armed force by the UN Security Council,The authorisation of peacekeeping missions by the UN General Assembly,C,False,1.125349484709659e-07,8.152003516670447e-09,1.955564243871777e-08,2.6465685198928668e-09
The European Convention on Human Rights is predominantly concerned with which of the following?,Economic and social rights,Environmental rights,Civil and political rights,Economic freedom,C,False,4.450818380519195e-07,6.3487517465432575e-09,2.1024177954132028e-07,2.5109798684752604e-08
Is the jurisdiction of international tribunals regulated by the same principles applicable to national courts?,The jurisdictional principles applicable to national courts are also common to international tribunals,The jurisdiction of all international tribunals is regulated by the UN Security Council,"International tribunals share some, but not all, of the jurisdictional principles applicable to national courts",The jurisdiction of international tribunals is dictated solely by their founding treaties,D,False,0.00010889162513194606,3.288242169219302e-06,1.8922526578535326e-05,4.450151322998863e-07
What is the meaning of collective rights?,Collective rights belong to distinct groups of people,Collective rights are those that belong to particular groups as opposed to the individual members of the group,Minority rights are collective rights,Collective rights entail a right of the group as such as well as individual rights of the group's members,B,False,1.0467399391700383e-08,2.3355923861601013e-09,1.7257825390970538e-08,2.061153026033935e-09
Are States under any obligation when they conduct negotiations?,States are under no obligation as to how they conduct their negotiation,States are under an obligation so to conduct themselves that the negotiations are meaningful,States are under an obligation to find a solution of the dispute whenever they conduct negotiations,States are under an obligation to inform the UN Secretary-General about the progress of their negotiations,B,False,1.9555672636784038e-08,1.2501523150021399e-09,4.139935683156182e-08,9.736196293630428e-10
What is the major difference between naturalism and positivism?,"On the one hand, naturalism is based on a set of rules that are of universal and objective scope and on the other hand, positivism is based on a structured and coherent legal system that is created by States in light of their interests and desires","While naturalism serves only the theory human rights law, positivism has a wider and more general scope","Naturalism concerns the underpinning values of the international society, while positivism the international rules as such","Naturalism is a school of thought advocated outside of Europe, while positivism is Euro-centric theory",A,True,1.2501527590913497e-09,2.594609249673141e-11,6.5601998659736704e-12,5.7893555401034025e-12
What is an 'internationally wrongful conduct'?,An international wrongful conduct is an action or omission which is in breach of a rule of international criminal law,"An international wrongful conduct is every breach of an international obligation of the State, whether attributable to it or not","An internationally wrongful conduct consists of an action or omission attributable to the State, which constitutes a breach of an international obligation of the State","An internationally wrongful conduct is the conduct that cannot be excused on grounds of necessity, force majeure etc.",C,False,1.1474136954348069e-05,4.4490053596746293e-07,6.959416168683674e-06,1.370390350530215e-06
What is the effects doctrine?,It posits that jurisdiction exists only when it is effective,The effects doctrine serves to confer jurisdiction on the State which has an effective link with the harmful conduct,The effects doctrine serves to confer jurisdiction on the State sharing the nationality of the offender,The effects doctrine serves to confer jurisdiction to the State on whose territory the conduct produces effects,D,False,0.00033475711825303733,1.6666575902490877e-05,0.0013239900581538677,5.13366685481742e-05
Which persons are considered as 'de facto' organs of the State under the law of international responsibility?,'De facto organs' are the individuals that are empowered by law to exercise elements of governmental authority,"'De facto organs' are the persons, which are, in fact, acting on the instructions of, or under the direction or control of, that State in carrying out the conduct attributable to the State",'De facto organs' are the de jure organs of the State that act without due authority or ultra vires,"'De facto organs' are the organs, whose acts or omission cannot be attributed to the State",B,False,7.194133289090132e-09,1.0261879540562902e-10,1.6918980105806725e-10,1.0261879540562902e-10
What is the fundamental prerequisite for the incorporation of custom under English law?,Custom is incorporated if it is not in conflict with existing legislation,Custom is superior to English law and is always incorporated,Custom must first be recognised by Parliament before the courts can bring it into the domestic sphere,Custom is incorporated with the passing of implementing legislation,A,True,2.3823645278753247e-07,9.237430376174416e-09,9.931173394761572e-08,1.6052245088715722e-09
Was the use of armed force permitted prior to the United Nations Charter?,Armed force was prohibited,Armed force was permitted with no restrictions,Armed force was permitted subject to few restrictions,Armed force was not regulated under international law prior to 1945,C,False,2.510998520222074e-08,2.3355923861601013e-09,1.6052276174960411e-09,3.5817471211174734e-10
What is the protective principle of jurisdiction?,It is jurisdiction based on the harm to national interests by conduct committed abroad,It is jurisdiction in order to protect one's nationals abroad,It is jurisdiction in order to protect international human rights,It is jurisdiction based on the nationality of the offender,A,True,2.144390055036638e-05,1.855261047012391e-07,3.2885286600503605e-06,7.733877538385059e-08
Which one of the following statements is correct?,The Council of Europe was established in 1950 and consists of 27 member states,The Council of Europe was established in 1949 and consists of 47 member states,The Council of Europe was established in 1959 and consists of 34 member states,The Council of Europe was established in 1984 and consists of 19 member states,B,False,2.8453344569356886e-08,9.736199624299502e-10,1.0467401168057222e-08,9.736199624299502e-10
What is the 'equitable result' in the law and practice of maritime delimitation?,It is the only method of delimitation that international courts and tribunals follow,"An equitable result is what a judge or the arbitrator would decide ex aequo et bono, i.e. upon their discretion and in light of what they consider as fair and equitable in a delimitation case","It is the end result that all delimitations of areas of continental shelf and EEZ should achieve, after, however, drawing a provisional 'equidistance line' and adjusting the zone in the light of the relevant circumstances and the proportionality test.",Achieving an equitable result is an old method of delimitation which is currently not applicable,C,False,0.003168293973430991,4.519328285823576e-05,0.0008010701276361942,4.203629941912368e-06
What is a derogation?,Derogations are exemptions from particular human rights obligations contained in a treaty,A derogation refers to the ability of rights holders to bring a claim against the State for breach of an obligation,A State may suspend particular rights by means of a derogation in circumstances that threaten its existence,Derogations are enforcement clauses in human rights treaties,C,False,3.2886830467759864e-06,1.4449464913468546e-07,5.714874191653507e-07,2.6995152779818454e-07
What is an act jure gestionis?,Acts jure gestionis are those undertaken by States in a private capacity,All purchases by the State are acts jure gestionis,All acts undertaken by State corporations are jure gestionis,All conduct undertaken by government officials in their free time is considered jus gestionis.,A,False,2.789468100949932e-10,1.0261879540562902e-10,3.850741947530878e-09,8.592166977905435e-10
What is the meaning of cultural relativism?,Culture relativism posits that human rights apply equally to all without restrictions,Culture relativism posits that human rights have a cultural origin,Cultural relativism posits that the application of human rights is relative to the laws in each nation,Cultural relativism posits that local culture should validate the existence and practice of all human rights,D,False,4.691161592518256e-08,5.602792896297615e-09,8.152015951168323e-09,4.944447073995661e-09
Is recognition of governments prevalent in contemporary international practice?,Recognition of governments is very prevalent in contemporary practice,Recognition of governments has largely been replaced by functional Recognition,Government recognition is common in respect of rebel entities,Only democratic governments are recognised in contemporary practice,B,False,0.00020342260540928692,2.259821030747844e-06,3.2880202525120694e-06,5.713722543987387e-07
What is the legal nature of the Universal Declaration of Human Rights (UDHR)?,The UDHR is a multilateral treaty,The UDHR is a UN General Assembly resolution,The UDHR is a UN Security Council resolution,The UDHR is a declaration adopted by several States at an international conference,B,False,2.561186420280137e-06,6.825330700621635e-08,1.2751397093779815e-07,3.2240581759879205e-08
Under what circumstances do human rights violations taking place outside the territory of ECHR member States fall within the remit of the ECHR?,The ECHR applies outside Europe where human rights are violated by ECHR member States abroad,The ECHR applies extraterritorially in circumstances where a member State exercises effective control,The ECHR applies extraterritorially where a member State has contributed forces to a UN peacekeeping mission,The ECHR applies extraterritorially where human rights violations are taking place in former colonies of member States,B,False,1.1032560420787263e-09,1.0261879540562902e-10,2.4616969573898473e-10,2.940077695190446e-11
What does the principle 'pacta sunt servanda' mean?,Parties to a treaty should be cognizant of its terms and not misinterpret them,Parties to a treaty should safeguard the object and purpose of the treaty,Parties to a treaty should adhere to its terms in good faith,Parties to a treaty should not violate the most important provisions of the treaty,C,True,1.8922417439171113e-05,7.337018246289517e-07,6.604572990909219e-05,5.714074973184324e-07
What was the consequence from the absence of implementing legislation in the Tin Council case?,The International Tin Council was headquartered in London and hence the absence of implementing legislation was inconsequential,The constitutive treaties of international organisations are subject to the doctrine of incorporation,The absence of implementing legislation with respect to the Council's founding treaty meant that individuals did not derive rights and duties from it in the English legal system,The absence of implementing legislation in England in respect of an international organisation is inconsequential under international law,C,False,9.056077415747765e-11,1.783247334519178e-11,2.5946095966178362e-11,7.433680407342713e-12
Which of the following statements is true?,The Human Rights Act 1998 incorporates the European Convention on Human Rights into UK law,The Human Rights Act 1998 allows a court to invalidate primary legislation,The Human Rights Act 1998 allows any person with a reasonable case to bring a case before a court,The Human Rights Act 1998 incorporates the EU charter of fundamental rights into UK law,A,True,2.1724398668876432e-10,2.5946095966178362e-11,1.3176514046531196e-10,2.940077695190446e-11
What forms may the obligation of reparation take?,"Reparation may take only the form of pecuniary compensation, including the interest",Reparation denotes only the physical restitution of the wrongful act,"Reparation includes restitution, compensation, and satisfaction, either alone or alongside other forms of reparation",The form of reparation is a matter for the responsible State to decide,C,True,1.3709321819987963e-06,6.825469256455108e-08,3.2886953249544604e-06,1.1860886495185241e-08
What is jus cogens?,"They are peremptory norms of international law, from which no derogations are allowed and which can never be altered even with the consent of the States",They are rules of international law that are laid down in multilateral treaties with a wide participation,They are the decisions of the UN Security Council,They are the rules of international law on which the ICJ founds its decisions,A,True,1.725781828554318e-08,4.058649527571845e-10,2.4616955696110665e-10,2.4616955696110665e-10
What is 'unilateral acts'?,They are acts that States perform as practice in the context of custom,They are acts creating unilateral legal obligations to the acting State,Unilateral acts are simply political acts of State devoid of any legal effect,Unilateral acts are those that State perform in order to be bound by a treaty,B,False,4.4508405494525505e-07,4.944437304033045e-09,1.344037414696686e-08,4.944437304033045e-09
Is extra-territorial abduction a ground for refusal of otherwise lawful jurisdiction by English courts?,Such abduction constitutes abuse of process and leads to a stay of proceedings,Such abduction gives rise to the abductor's liability but does not lead to a stay of proceedings,The stay of proceedings under such circumstances would prevent the administration of justice in respect of international criminals,"The courts may, but will seldom, stay proceedings in cases of extra-territorial abduction",A,True,9.609301196178421e-05,1.0674970098989434e-06,3.725930582731962e-06,2.381907648896231e-07
What is the meaning of 'secondary rules' in the law of international responsibility?,"Secondary rules are the rules of interpretation of international law, including the law of international responsibility","Secondary rules are the rules that govern the legal consequences arising from a breach of the primary rules, ie of the international obligations of the States",Secondary rules are the rules that govern exclusively the concept of attribution in the law of international responsibility,Secondary rules are the rules that govern exclusively the law of countermeasures,B,False,9.931178368560722e-08,2.6465694080712865e-09,9.736184081177157e-10,5.905294031549602e-10
What does the doctrine of incorporation suggest in respect of treaties?,The doctrine of incorporation requires that all treaties undergo legislative transformation before they become domestic law,The doctrine of incorporation does not require any further action at the domestic level,The doctrine of incorporation treats treaties as inferior to domestic law,The doctrine of incorporation suggests that ratified treaties automatically pass into the sphere of domestic law,D,False,0.001167973387055099,7.869742148614023e-06,3.112543708994053e-05,1.4702614862471819e-05
Are the provisional measures issued by the ICJ binding upon the parties?,"No, according to the literal interpretation of the relevant provision of the State, the provisional measures are not binding","No, unless the parties have agreed so beforehand",It depends upon the Court whether the provisional measures will be binding,"Yes, it has been consistently held by the Court since the La Grand case (2001) that they are binding",D,False,2.335593052293916e-09,1.493094675675266e-10,2.5946095966178362e-11,1.3887944613766301e-11
When are countermeasures illegal?,"Countermeasures are illegal when inter alia are disproportionate or in violation of a peremptory norm of international law (e.g. the use of force, human rights)",Countermeasures are illegal when they are taken in the course of an armed conflict,Countermeasures are illegal when they violate bilateral treaties,Countermeasures are illegal when the responsible State does not consent to them,A,True,0.0008039541426114738,4.780486051458865e-06,2.4277311240439303e-05,1.6685535229044035e-05
What is the difference between political and legal means of dispute settlement?,"The outcome arising from legal methods, ie arbitration or adjudication by the ICJ, is final and binding upon the parties, whereas this is not the case with diplomatic methods","The political methods are pursued upon the consent of then parties to the dispute, whereas the legal methods not","The political means lead to a final settlement of the dispute, whereas this is not the case with the legal methods","The legal methods of dispute settlement are pursued only in respect of significant disputes, whereas the political means are employed in all disputes",A,True,6.475889335888496e-07,1.1861003734736641e-08,4.363419847663863e-09,3.850704199948041e-09
