0,1,2,3,4,5,correct,choiceA_probs,choiceB_probs,choiceC_probs,choiceD_probs
Which State ordinarily exercises jurisdiction in respect of crimes committed on board vessels?,The coastal State,The flag State,All States enjoy such jurisdiction,The International Tribunal for the Law of the Sea,B,False,1.7257825390970538e-08,7.582558469998446e-10,1.2501525370467448e-09,9.056075334079594e-11
What is the meaning of justiciability?,Justiciability refers to the possibility of enforcement of a particular right by the relevant rights holders,Justiciability refers to the just nature or cause of a particular right,Justiciability refers to the courts' assessment of whether the non-enforcement of a particular rights conforms to principles of justice,Justiciability refers to the obligation of a State to enforce a particular Right,A,True,8.939280633057933e-06,2.1023173246703664e-07,7.337808369811682e-07,5.043197006671107e-07
In what way is Responsibility to Protect (R2P) different from humanitarian intervention?,R2P is essentially the same as humanitarian intervention,R2P requires a call for assistance by the State in distress,R2P is less arbitrary because it requires some UNSC input and its primary objective is to avert a humanitarian crisis,"R2P always involves armed force, whereas humanitarian intervention does not",C,True,2.7414376745582558e-05,1.884160519693978e-05,8.444221748504788e-05,2.2503088530356763e-06
What is the 'Lotus principle'?,"The so-called Lotus principle is that 'restrictions upon the independence of States cannot therefore be presumed', or, as it has been construed, 'whatever is not prohibited is permitted in international law'",The so-called Lotus principle is that States are free to choose the Court that they will submit their disputes,The so-called Lotus principle is that States are not prohibited to assert their enforcement jurisdiction on the high seas,The so-called Lotus principle is that customary law derives from the combination of State practice and opinio juris,A,True,1.444978749987058e-07,2.335590609803262e-09,1.8189596495687965e-09,1.6052261742061091e-09
Which of these statements best describes the UK Constitution?,The UK Constitution's only source of power is that of the sovereign,The UK Constitution gives the judiciary the power to overturn acts of parliament,The UK Constitution is uncodified and can be found in a number of sources,The UK Constitution is based on a Bill of Rights,C,False,6.348800152267131e-09,9.736200734522527e-10,2.646573848963385e-09,1.3176514046531196e-10
What is the obligation of the peaceful settlement of disputes?,"It is an obligation of result, that is, States are under a strict obligation to resolve their disputes as soon as possible","It is an obligation of conduct, ie States have an obligation to try to resolve their disputes through peaceful means. This does not entail an obligation to resolve their disputes",It is a peremptory norm of international law and all States have a legal interest to safeguard its application in any given dispute,It is an obligation which concerns solely international courts and tribunals,B,False,2.5109972767722866e-08,5.211408526939465e-10,4.5990522501426767e-10,2.789466158059639e-10
Which one of the following statements is false?,Protocol 14 changed the committee that hears admissibility cases from a three judge to a one judge formation,Protocol 14 added a new criterion for admissibility,Protocol 14 abolished the Commission of Human Rights,Protocol 14 extended the judicial term of office for the European Court of Human Rights,C,False,3.16088155649652e-10,1.783247334519178e-11,2.2897348947448215e-11,8.423464183116014e-12
Which is a 'rock' under the UN Convention of the Law of the Sea (UNCLOS)?,Rocks are the islands that are less than 10 square miles,Rocks are the islands that do not have any maritime zone,Rocks are the islands which cannot sustain human habitation or economic life of their own and according to article 121 (3) have no Exclusive Economic Zone or continental shelf.,Rocks are the small islands that can sustain human habitation,C,False,1.2098606703148107e-06,1.955557671351471e-08,2.8453195355382377e-08,3.3982496816520325e-09
What is the meaning of international legal personality?,It means that only States are considered subjects of international law,It means having rights and duties under international law and a capacity to enforce these by or against the relevant actor,It means that an entity may challenge the authority of States,"It is a term that is meant to denote legal, as opposed, to physical persons under international law",B,False,2.5109976320436544e-08,2.6465722946511505e-09,1.1861112980682265e-08,2.0611521378555153e-09
Which of the following is a treaty-based human rights mechanism?,The UN Human Rights Committee,The UN Human Rights Council,The UN Universal Periodic Review,The UN special mandates,A,True,7.582560135332983e-10,6.224144116773189e-11,5.905304023556823e-10,3.3315444153414475e-11
The UN Vienna Declaration 1993 declared that,Third generation rights are of primary importance,Civil and political rights are core rights,"All types of rights are indivisible, interrelated and interdependent",Social and economic rights are non-enforceable,C,False,0.0024400653783231974,1.1299744073767215e-05,3.943997944588773e-05,1.1299744073767215e-05
What is the principal source of immunity in respect of international organisations (IOs)?,The principal source of immunity for IOs is the UN Charter,The principal sources of immunity for IOs are headquarters agreements and multilateral treaties providing specific immunities,The principal source of immunity for IOs is customary law,The principal source of immunity for IOs is the Vienna Convention on Diplomatic Immunities,B,False,2.2602548597205896e-06,3.6533613467781834e-08,1.3439965584893798e-08,6.348590542160082e-09
Is there any hierarchy or priority among States under international law?,"Yes, the States that were the founding members of the United Nations are vested with more powers and authority","Yes, the Permanent Five Members of the UN Security Council (UK, USA, France, Russia, China) are in a superior position than the other States","No, all States are considered equal as sovereign States (the principle of sovereign equality, enshrined in article 2, para 1 UN Charter)",Whether there will be any hierarchy among States is a matter of each international organization to decide,C,False,3.927849547835649e-07,1.5229925764970176e-08,1.7257766771194838e-08,5.60277646499685e-09
What is the declaratory theory of recognition?,Recognition is determinate for the existence of statehood,Recognition is simply declaratory of statehood but not determinate,Recognition is merely a declaration of interest,Recognition requires a declaration by the newly-created State,B,False,0.00587000697851181,2.1170551917748526e-05,7.389249367406592e-05,9.48798333411105e-05
"What is the function of ""standard-setting in human rights diplomacy?",Standard-setting means putting forward binding legal standards,Standard-setting means merely proposing binding legal standards,Standard-setting means putting forward non-binding legal standards,Standard-setting means setting certain standards of conduct in human rights treaties,C,False,5.211412412720051e-10,3.3315444153414475e-11,1.3176514046531196e-10,5.4927885156930145e-11
What dimension did the Kadi judgment introduce with respect to the incorporation of UN Security Council resolutions?,The Kadi judgment demanded that UNSC resolutions are construed in accordance with human rights,The Kadi judgment demanded that all UNSC resolutions be incorporated without any further implementing legislation,The Kadi judgment required that important UNSC resolutions be transformed and not merely incorporated,The Kadi judgment claimed that UNSC resolutions are not binding if they violate human rights,A,True,7.338198884099256e-07,3.2241793235243676e-08,1.275187742066919e-07,1.725778986383375e-08
Magna Carta was,An agreement in 1689 which guaranteed freedom of speech in Parliament,"An agreement in 1215 between the King and his barons, which guaranteed certain protections for subjects",A constitutional document in the 19th century guaranteeing the right to vote,A document setting a complete Bill of Rights for England,B,False,1.2501525370467448e-09,7.052878420177322e-11,3.1608807238292513e-10,1.6918975942470382e-10
Do individuals (physical) persons enjoy international legal personality in the same manner as States and international organisations?,"Individuals enjoy international legal personality, but this is limited",Individuals enjoy unlimited international legal personality,Individuals do not enjoy any international legal personality,Individuals can only bring claims before international courts,A,True,3.120143446722068e-05,6.475651161963469e-07,2.902185769926291e-06,5.3155382317982e-08
Is there any hierarchy or priority among the various methods of peaceful settlement of disputes?,"Yes, all the political methods (e.g. negotiation, mediation, inquiry, conciliation) should be exhausted prior to resorting to legal methods","Legal methods prevail over the political methods, since they are binding upon the parties",There is no hierarchy among these methods and the choice belongs to the disputing States,It is a matter of an impartial third party to decide which method will have priority over the other,C,False,1.2098624893042143e-06,7.1941057555591215e-09,2.6465638569561634e-09,5.211392428705608e-10
Which of the following statements is false?,In the 1990's it became apparent the European Court of Human Rights had to be reformed because it wasn't examining enough cases,In the 1990's it became apparent the European Court of Human Rights had to be reformed because the workload had increased,In the 1990's it became apparent the European Court of Human Rights had to be reformed because it was a part time court that could not process the growing number of complaints,In the 1990's it became apparent the European Court of Human Rights had to be reformed because of the growth in the number of individuals who could access the Court after the increase in the number of member states,D,False,2.2159484913686356e-08,5.211411302497027e-10,9.736198514076477e-10,2.172439311776131e-10
What is the meaning of proportionality in relation to the options available to the victim State?,The victim State may use the same means and intensity of force as the aggressor,The victim State may use any means to defeat and incapacitate the aggressor,The victim State may only use such means and force as it is necessary to defeat the aggressor,The victim State can do nothing without Security Council approval,C,True,7.734406182180464e-08,1.955564243871777e-08,6.475939358097094e-07,6.3487872736800455e-09
What is the ordinary geographical scope of jurisdiction?,Jurisdiction is ordinarily extra-territorial,Jurisdiction is ordinarily on the high seas,Jurisdiction is ordinarily territorial,Jurisdiction is determined by the location of the offender.,C,True,8.152016839346743e-09,9.736196293630428e-10,3.653480362686423e-08,2.3355919420708915e-09
Which are the formal sources of international law?,"Custom, treaties and judicial decisions","Custom, general principles of law and theory","Treaties, custom and general principles of law","Treaties, custom and General Assembly Resolutions",C,False,8.938471182773355e-06,7.733292761713528e-08,3.28827968587575e-06,2.8449193223423208e-08
What is the purpose of baselines under the law of the sea?,The determination of baselines is used for the measuring of the internal waters of coastal States,"The determination of baselines is instrumental to the establishment of all maritime zones, since they constitute the starting point for measuring the breadth of each zone",The determination of baselines is instrumental to the safe navigation of vessels on the high seas,Baselines are drawn only in cases of maritime delimitation between opposing State before an international court or tribunal,B,False,3.653481428500527e-08,2.172439311776131e-10,1.9171711440613137e-10,1.4930942593416319e-10
What is the difference between conciliation and mediation?,"Conciliation is the continuation of mediation with the difference that conciliation produces a binding result, while mediation not","Conciliation is conducted exclusively by representatives of the UN Secretary-General, while mediation may also be conducted by third States' officials","Mediation is usually conducted by a person appointed with the consent of the parties, while conciliation involves a commission, which proceeds to an impartial examination of the dispute and proposes settlement terms","Conciliation is a method of dispute settlement pursued only by virtue of a treaty, while mediation may also be on an ad hoc basis",C,False,1.6373660116641986e-07,4.944416431840182e-09,2.646555863350386e-09,1.1032484925621588e-09
"In Osman v UK (1998), the European Court laid down a test, which can be used to apply a general positive obligation on a state. Which of the following statements is not part of the Osman test?",The risk must emanate from a state agent,If a real and imminent risk (of death/harm),A state should take reasonable steps to prevent death/harm occurring,A state knows or ought to have known,A,False,6.475709142250707e-07,2.1023548413268145e-07,2.753541775746271e-05,1.2098216757294722e-06
Who is entitled to request an advisory opinion of the ICJ?,"Only the principal organs of the UN may request an advisory opinion (Security Council, General Assembly, ECOSOC, Trusteeship Council, Secretariat)",All international organizations may request an advisory opinion,"The General Assembly and the Security Council may request advisory opinions on any legal question, as well as 'other organs of the United Nations and specialized agencies, which may at any time be so authorized by the General Assembly, may also request advisory opinions of the Court on legal questions arising within the scope of their activities'",The principal organs of the UN may request an advisory opinion as well as the State that have been authorized by the General Assembly,C,False,2.845333035850217e-08,2.3355917200262866e-09,1.4166078310395847e-09,4.058649527571845e-10
What is the purpose of universal jurisdiction?,Its aim is to establish certain offences as universal,Its aim is to deter the commission of certain international crimes,Its aim is to provide jurisdiction to all States in respect of particular crimes,Its aim is to provide jurisdiction to all States in respect of all international crimes,C,False,1.186109876982755e-08,5.905293476438089e-10,6.691573961603581e-10,1.250150649667603e-09
Are all acts of State organs attributed to the State under the law international responsibility?,"The conduct of any State organ shall be considered an act of that State, even in the case that this conduct was unauthorized or ultra vires",Only the conduct of the higher echelons of the government of State shall be attributable to it,"The conduct of any State organs shall be considered an act of that State, provided that it is intra vires",Only the conduct of the executive branch of the State shall be considered an act of that State.,A,True,4.363462036138799e-09,1.0261878152784121e-10,7.052879114066712e-11,2.2897345478001263e-11
What is a 'treaty' according to the Vienna Convention on the Law of Treaties (VCLT)?,"Treaties are all agreements concluded between States, international organizations and non-State entities (e.g. corporations)",Treaties are agreements concluded between States in written form and governed by international law,Treaties are both the written and oral agreements between States,Treaties are agreements concluded between States in written form governed either by international or domestic law,B,False,0.012396515347063541,7.371238461928442e-05,7.371238461928442e-05,3.481926250969991e-05
Is the unlawful homicide committed by Minister of country X abroad an act jure imperii or jure gestionis?,Such conduct is a public act (jure imperii),Such conduct never attracts immunity,Such conduct is a private act (jure gestionis),Such conduct is a public act but is shielded by immunity,C,True,2.9022378384979675e-06,1.855338638279136e-07,1.0129804650205187e-05,7.734201545872565e-08
What was the outcome before the European Court of Human Rights in the Al-Adsani case?,The Court held that the right to a fair trial trumped the privilege of immunity,The Court held that immunity trumped the right to a fair trial,The Court held that immunities were not in conflict with the right to a fair trial,"The Court held that human rights considerations prevailed over all other contrary rules of international law, including most immunities",C,False,6.691586174056852e-10,1.3176514046531196e-10,3.16088155649652e-10,1.1628233792526643e-10
What other criteria were imposed by the Badinter Commission on the former Yugoslav republics?,The Commission required a commitment to submit disputes to the ICJ,The Commission required a change in boundaries,The Commission required a commitment to human rights and democracy,The Commission required an exchange of ethnic populations,C,True,4.6911537765481626e-08,2.335587723223398e-09,1.1253492004925647e-07,2.335587723223398e-09
How treaties are to be interpreted?,Treaties are to be interpreted in good faith in accordance with the ordinary meaning to be given to the terms of the treaty in their context and in the light of its object and purpose,Treaties are to be interpreted only in accordance with the ordinary meaning of their terms,"Treaties are to be interpreted in accordance with the intention of the parties, as evidenced in the preparatory works of the treaty",Treaties are to be interpreted only in light of its object and purpose,A,True,9.422337257092295e-07,4.363407857255197e-09,3.3982252567454907e-09,3.850693541807004e-09
When coastal States do enforce their criminal jurisdiction over foreign vessels in their ports?,Port States generally do not enforce their criminal jurisdiction over crimes that do not infringe their customs laws or disrupt peace and public order.,Port States enforce their jurisdiction in all cases of delinquent vessels,"Port States enforce their jurisdiction only in respect of very serious crimes, such as drug trafficking",Port States are not entitled to enforce their jurisdiction over any foreign vessel,A,True,0.000552583544049412,4.219027232466033e-06,5.417338343249867e-06,2.8996923902013805e-06
What is the value of the Resolutions of the UN General Assembly in terms as a 'source' of international law?,GA Resolutions are considered as additional sources of international law and thus binding upon States,GA Resolutions are equivalent to treaties,GA Resolutions reflect always customary law,"GA Resolutions are considered as material source, in the sense that they may enunciate statements of customary law",D,False,1.7603351807338186e-06,6.023535803478808e-08,1.85537984975781e-07,7.734372786671884e-08
"Do treaties bind third States, ie non-State parties?",Treaties may create only rights for third States,Treaties create both obligations and rights for third States,Treaties do no create obligations or rights for third States without their consent,"Treaties do not create any obligations or rights for third States, even when the latter consent.",C,False,3.1608812789407637e-10,3.331544068396752e-11,1.3176512658752415e-10,4.847367993110474e-11
Which of the following articles are not qualified rights?,Article 3,Article 8,Article 9,Article 11,A,False,3.850727736676163e-09,5.21139298381712e-10,4.363446493016454e-09,1.5229923988613336e-08
What is dualism?,Dualism suggests that international and domestic law are part of a unified legal system,"Under dualism, international and domestic laws comprise distinct legal Systems",Dualism suggests that international and domestic law are distinct but equal in hierarchy,Dualism suggests that international and domestic law are distinct legal systems whereby domestic law always prevails,B,False,4.005920345662162e-05,1.0675418025130057e-06,6.961246526770992e-06,1.0675418025130057e-06
What is an act jure imperii?,An act is jure imperii when undertaken by an international organisation,An act is jure imperii when undertaken in an official State capacity,All acts undertaken by State officials are acts jure imperii,An act is jure imperii when undertaken by a State corporation,B,False,3.581747953784742e-10,3.775134718719819e-11,2.789468100949932e-10,1.573710259328287e-11
What is the relationship between the formal sources of international law?,There is no hierarchy between the formal sources of international law,Treaties supersede custom,Custom supersedes treaties,General Principles of Law supersede both custom and treaties,A,False,0.0006245269905775785,7.45891229598783e-05,0.0014981623971834779,5.809005961054936e-05
What was the particular advantage of UNSC Resolution 678 over a collective defensive action under Article 51 UN Charter during the Gulf War?,Resolution 678 allowed the allies to attack Iraq with nuclear and chemical weapons,Resolution 678 is narrower than the inherent right of self-defence under Article 51 UN Charter,Resolution 678 was faster to adopt and negotiate.,Resolution 678 is broader because it authorised the use of force with respect to any matter threatening the peace and security of the Gulf region.,D,False,7.194131512733293e-09,6.691584508722315e-10,4.599054470588726e-10,2.78946754583842e-10
How can customary law be related to treaty provisions?,Treaties may only codify customary law,Customary law is a different source of international and it cannot be embodied in treaties,"Treaties may 1) codify customary law, 2) 'crystallise' customary law, 3) lead to the emergence of customary law",Customary law can emerge only from few multilateral treaties,C,True,1.9555539410021083e-08,3.850713969910657e-09,9.422386142432515e-07,1.2501437662848502e-09
What does it mean for a State to be sovereign?,Sovereignty means being recognised by all other States,Sovereignty means to be able to enter into treaties and join the UN,Sovereignty means freedom to determine one's own affairs without external interference,Sovereignty means possessing the right to defend oneself,C,False,0.00020315975416451693,3.721000666701002e-06,1.2987568879907485e-05,1.7576762729731854e-06
What is the meaning of functional recognition?,Recognition is a function as opposed to a power,Recognition is reciprocal between two States,Recognition is only afforded to particular administrative acts not to the entity's declared statehood,"Recognition is only afforded to the government, not the State",C,True,4.537089625955559e-05,2.2588840238313423e-06,0.00013975219917483628,1.1471559446363244e-05
"What is the meaning of ""act of State"" doctrine?",The act of State doctrine denotes that all State acts attract immunity,The act of State doctrine denotes that the assessment as to the existence of an alleged tort committed by a State belongs to the executive and not the courts,The act of State doctrine denotes that the courts are well placed to assess the existence of an alleged tort committed by the State,The act of State doctrine is a legal mechanism that allows the courts to provide immunity to public acts of foreign States,B,False,2.69956444753916e-07,2.8453202460809734e-08,1.444972923536625e-07,1.046734876553046e-08
How can the structure of the international society be displayed?,The structure of the international society follows the vertical model of the domestic legal orders,"International society consists of a constellation of sovereign States and other international organizations, which are dispersed in a rather horizontal order of authority","International society is so anarchical that there is no order of authority, neither vertical nor horizontal",The structure of the international society resembles the structure of the most powerful nations in the world,B,False,4.006244125775993e-05,1.553389779473946e-06,7.888763320806902e-06,7.337692977671395e-07
Are there any limitations to the incorporation of customary crimes under English law?,There are no limitations to the incorporation of customary crimes,Customary crimes must be contained in a multilateral treaty in order to be automatically incorporated,The courts may freely incorporate customary crimes into the domestic sphere,The situation is not clear-cut but an act of parliament would most probably be required,D,False,2.061153470123145e-09,4.5990555808117506e-10,9.23744991609965e-09,6.691586174056852e-10
What is the function of the contiguous zone?,The contiguous zone functions as security zone of the coastal State,"The contiguous zone is a zone, in which the coastal State may explore and exploit its mineral resources","The contiguous zone is a zone in which the coastal State is permitted to prevent and punish infringements of customs, fiscal, immigration or sanitary laws",The contiguous zone is a zone in which the coastal State safeguards its archaeological and historical objects,C,False,3.119345637969673e-05,9.41960706768441e-07,8.937074198911432e-06,5.420609340944793e-06
Which of the examples below has not been developed by the European Court of Human Rights as a situation where the state has a positive obligation to protect?,When the applicant is in the custody of the state,Where the state must investigate claims against it,The development of a legal framework to protect those within the state,To provide housing for all those homeless within a state,D,False,1.4449746288391907e-07,1.955560513522414e-08,2.9023092338320566e-06,3.6534679281885474e-08
Which case was the first to define the meaning of the doctrine of 'margin of appreciation' as applied by the European Court of Human Rights?,Goodwin v UK (2002),Airey v Ireland (1979),Osman v UK ( 1998),Handyside v UK (1976),D,False,4.22258608523407e-06,8.76369767865981e-08,1.5534027397734462e-06,1.3439565016426513e-08
