0,1,2,3,4,5,correct,choiceA_probs,choiceB_probs,choiceC_probs,choiceD_probs
Prochaska and DiClemente’s (1982) stages of change (transtheoretical) model predicts that a person in the ________ stage plans to take action within the next six months that will alter his/her problematic behavior.,action,contemplation,preparation,precontemplation,B,True,0.24149583280086517,0.5112466812133789,0.14647462964057922,0.10067043453454971
What is termed “catharsis” in psychoanalytic theory might be described by behaviorists as,a decrease in affective responses because of therapeutic directions to the client to make such decreases,redirection of anxiety because of therapeutic influences,reduction of emotional response by an extinction procedure,inhibition of emotional response because of learned cognitive controls,C,True,0.06787081062793732,0.3446764051914215,0.4425732493400574,0.14368249475955963
Research on EMDR (eye movement desensitization and reprocessing) suggests that its effectiveness for alleviating the symptoms of PTSD is attributable to which of the following?,imaginal exposure,higher-order conditioning,relaxation training,fixed visual attention,A,False,0.16512703895568848,0.2722484767436981,0.5086271166801453,0.05360890179872513
"The items for 2 machinist proficiency test have been based on 2 job analysis of machinists in 50 plants, each employing five or more machinists doing comparable work. Such 2 procedure would contribute directly to the test's",concurrent validity,predictive validity,empirical validity,content validity,D,False,0.1592300832271576,0.2974809408187866,0.43283218145370483,0.10943711549043655
The procedure involving repeated presentation of a stimulus to the client until the attractiveness of that stimulus is reduced is best described as,stimulus satiation,response-prevention,flooding,implosion,A,False,0.030858881771564484,0.06532825529575348,0.7958610653877258,0.10770808160305023
"Exposing individuals to arguments against their views, arguments that are then strongly refuted, may serve to",increase their attitudinal ambivalence,weaken their resistance to later persuasive appeals,render them indifferent to the attitude object,inoculate chem against later persuasive appeals,D,False,0.05454796180129051,0.19039109349250793,0.6645302176475525,0.08993437886238098
The function of the correction for attenuation is to,provide an estimate of the predictive validity of a test-thar is independent of chance factors in any specific validation sample,show how adding or subtracting items affects the reliability of a test,estimate the correlation between wo variables if one or both could be measured without error,correct an obtained correlation coefficient for restriction of range in either variable,C,True,0.04850490018725395,0.3584054410457611,0.4602016806602478,0.1318499892950058
In a study in which depressed individuals presenting for outpatient mental health treatment are randomly assigned to either cognitive behavioral or brief dynamic treatment and both groups are assessed at pretest and posttest:,A mixed model analysis of variance (ANOVA) could be used to analyze the data,The design includes one between-subjects factor and one within-subjects factor,Each factor comprises two levels,All of the above,D,False,0.15404532849788666,0.41873857378959656,0.2877945303916931,0.13594450056552887
"As described by Kobasa et al. (1982), the personality characteristic of hardiness is characterized by which of the following?","conﬁdence, competence, and control","commitment, challenge, and control","common sense, commitment, and capability","capability, challenge. and commitment",B,False,0.06675155460834503,0.2640075087547302,0.5589038729667664,0.11005469411611557
"Humanistic and existential therapists view ulcers, hypertension, and tension headaches as",strictly physical phenomena,symptoms of a loss of contact with personal values,"perceived, rather than actual, physical symptoms",responses to specific stressors in the physical environment,B,False,0.04021989554166794,0.1802530586719513,0.7129146456718445,0.06631138920783997
"The belief that a child's misbehavior has one of four goals — i.e., attention, revenge, power, or to display inadequacy — is most consistent with:",Beck’s cognitive-behavioral therapy.,Adler’s individual psychology,Perls’s Gestalt therapy.,Mahler’s object relations theory.,B,False,0.09217467904090881,0.25055673718452454,0.6010544300079346,0.055906765162944794
"When serving as an expert witness in a child custody case, a psychologist's primary concern should be:",what the child desires.,maintaining a position of neutrality.,the best interests of the child.,the best interests of the person who hired the psychologist.,C,True,0.10293453931808472,0.10293453931808472,0.7605891227722168,0.0334179550409317
Selye (1956) proposed that which of the following endocrine glands mediate the general adaptation syndrome?,thyroid and thymus,adrenal and pituitary,thyroid and parathyroid,pancreas and pineal,B,False,0.08316072821617126,0.15536469221115112,0.696296215057373,0.06476563960313797
"During a Developmental Research, the variables are assessed as a function of time. How does the cross-sectional design works?",some people are studied over a long period of time,different group divided by age are assessed at the same time,combines longitudinal and cross-sequential design,representative samples of different ages are assessed multiple times,B,False,0.0850290060043335,0.26190778613090515,0.6282840967178345,0.02436121739447117
"You receive a call from Mrs. Wang who is very upset because her 14-year-old daughter witnessed the assault of her best friend three days ago and is very distraught. The girl hasn’t slept, won’t eat, and can’t stop crying. You have limited experience working with adolescents and in providing crisis intervention services. However, there is no one else in the community who is more experienced than you are. As an ethical psychologist, you will:",agree to see Mrs. Wang’s daughter in therapy since you’ve had some experience providing crisis intervention experiences.,inform Mrs. Wang about your lack of experience and let her decide if she wants you to provide therapy to her daughter.,inform Mrs. Wang that you cannot see her daughter because of your lack of experience.,see Mrs. Wang’s daughter in therapy only until the crisis has ended or until you locate alternative services.,D,False,0.21206089854240417,0.34962931275367737,0.2722916007041931,0.16515320539474487
The correlation between two sets of test scores indicates the,extent to which skill in one test results in skill in another,accuracy of the two sets of test scores,extent to which skill in both tests is the result of a third skill,proportion of variance in one test associated with variance in the other test,D,False,0.07013581693172455,0.3561790883541107,0.5182374715805054,0.054621826857328415
The following measure of general cognitive abilities would be most appropriate for use with a nonverbal adolescent:,Stanford-Binet Intelligence Scales–5,Leiter–R,Kaufman Assessment Battery for Children–II,Wechsler Intelligence Scale for Children–IV,B,False,0.1980663388967514,0.22443853318691254,0.5384000539779663,0.039001572877168655
"Dr. A. Praise is hired to perform a court-ordered evaluation of a defendant in a criminal case. She discusses the purpose of the evaluation with the defendant who then says he does not want to cooperate. According to the Specialty Guidelines for Forensic Psychology, Dr. Praise should:",remind the defendant that he has no choice since the evaluation is court-ordered.,refuse to conduct the evaluation unless she obtains a signed consent from the defendant.,refuse to conduct the evaluation unless she obtains a signed consent from the defendants attorney.,postpone the evaluation and advise the defendant to contact his attorney.,D,False,0.08620911091566086,0.23434068262577057,0.49609920382499695,0.18250471353530884
A student who is chronically depressed is most likely to attribute the low score she received on her final exam to:,her lack of ability.,the lack of time she had to study.,the difficulty of some exam items.,the instructor's ineptitude.,A,False,0.03317747265100479,0.16848911345005035,0.6663873791694641,0.13121944665908813
"When using the Premack Principle to modify a behavior, the reinforcer is:",applied intermittently.,a generalized conditioned reinforcer.,a behavior that occurs frequently.,a stimulus that naturally elicits the desired behavior.,C,True,0.07003012299537659,0.4029955267906189,0.45665374398231506,0.07003012299537659
American Psychological Association?,non-White research participants,the elderly,clients with a physical disability,people afﬂicted with a chronic disease,C,True,0.0359930582344532,0.08634284883737564,0.43848520517349243,0.43848520517349243
"According to Irvin Yalom, ________in group therapy is the analogue of the therapist-client relationship in individual therapy.",universality,identification,cohesiveness,alliance,C,True,0.05320993438363075,0.11264543235301971,0.7345404624938965,0.09940924495458603
"""A 14-year old boy is arrested for the third time for shoplifting. His mother seems unconcerned and says """"he's just going through a phase."""" His father decides to go fishing on the day of the boy's court hearing, and his sister says she can't attend his court hearing because she has too much homework. From the perspective of structural family therapy, this family is best described as:""",disengaged.,closed.,"""emotionally """"cut-off.""""""",skewed.,A,False,0.02645193599164486,0.1724882870912552,0.6822044253349304,0.11854934692382812
Magical thinking would predispose a child of what age range to infer chat his or her father died because of the child’s own misbehavior,12 years,3-6 years,7-12 years,13-18 years,B,False,0.040609486401081085,0.2648071050643921,0.6352392435073853,0.059086453169584274
Which of the following is true?,"Spirituality has been shown to act as a protective factor against disease, and it is imperative to put effort toward understanding and incorporating spirituality into clinical practice",Incorporating spirituality into evidence-based treatments has only been effective for religious individuals,"Yoga, meditation, mindfulness, and acupuncture techniques are not very effective treatment for pain associated with a chronic illness",All choices are false,A,False,0.20255714654922485,0.1577516496181488,0.37842655181884766,0.2600885331630707
The largest proportion of variation in therapy outcome is accounted for by,"pre-existing client factors, such as the motivation to-change","therapeutic technique variables, such as the ability to be directive and still keep the patient in therapy","therapist personality factors, such as warmth and empathy","therapist—client interactions, such as the (favorable) combination of 2 cold therapists with a manipulative client",A,False,0.04142176732420921,0.21035709977149963,0.6479454636573792,0.09936565905809402
"In contrast to traditional approaches to psychotherapy, culturally sensitive approaches attempt to understand a client’s experience of an illness within the client’s cultural context. In other words, culturally sensitive approaches adopt an ______ perspective.",emic,etic,emetic,endogenous,A,False,0.11932025104761124,0.2526009678840637,0.5347562432289124,0.09292669594287872
LISREL (linear structural relations analysis) would be the appropriate method of analysis if your causal model:,includes measured (observed) attributes only.,includes latent traits only.,includes both measured (observed) attributes and latent traits.,includes both correlated and uncorrelated attributes.,C,True,0.13800173997879028,0.2578212022781372,0.5458074808120728,0.057527683675289154
"When evaluating a defendant’s competence to stand trial, the focus of the evaluation is on the defendant’s:",ability to distinguish right from wrong.,ability to comprehend the charges against him/her.,mental state at the time he/she committed the crime.,DSM-IV diagnosis.,B,False,0.21047770977020264,0.12766118347644806,0.6483169794082642,0.013455389998853207
The match between a child’s temperament and the demands and responses of the environment in which she develops is known as ___________.,Attachment,Goodness of fit,Bidirectionality,Developmental contextualism,B,False,0.15762867033481598,0.10833649337291718,0.706442654132843,0.02739175409078598
Replacing a “failure identity” with a “success identity” is a goal of treatment for practitioners of _______ therapy.,Gestalt,reality,solution-focused,Adlerian,B,True,0.04623372107744217,0.4386533200740814,0.4386533200740814,0.07622651010751724
Bartering as a form of payment for psychological services is,allowable only if it is not clinically contraindicated and the relationship is not exploitative,not allowable under any circumstance,allowable only if the dollar value of the psychological service and of the payment service or goods are established in advance,allowable only if the psychologist feels char a client would be denied services if barbering were not allowed,A,False,0.05754600465297699,0.15642626583576202,0.7010538578033447,0.08372894674539566
The most dangerous physiological complication of Bulimia Nervosa is,edema,dehydration,gastrointestinal disturbance,electrolyte imbalance,D,False,0.08775398880243301,0.1639460325241089,0.6484191417694092,0.09943829476833344
The major advantage of using a forced-choice method as an employee performance appraisal technique is that:,it is easy to develop and use.,it provides specific information for employee feedback.,it helps alleviate leniency and other biases.,it provides an objective measure of job performance.,C,False,0.1309196501970291,0.31405994296073914,0.27715691924095154,0.27715691924095154
"Social influence occurs when an individual’s attitude, thoughts, feelings, or behaviors are affected by the persuasive effect of others. There are many responses. Which type of social influence represents the Milgram effect?",Conformity,Obedience,Compliance,Power,B,False,0.026613179594278336,0.06384170055389404,0.6863629817962646,0.2228294312953949
A psychologist is asked to see a 10-year-old child for counseling in a school setting. Which of the following statements describes the best way for the psychologist to meet the prescribed ethical responsibility,The child provides verbal assent to participate in therapy,Both the parent(s) and the child provide written consent to therapy for the child,The parent(s) provide(s) written consent and the child assents verbally to participate in therapy,The parent(s) provide(s) written and verbal consent to therapy for the child,C,True,0.0782470852136612,0.16564907133579254,0.655154824256897,0.10047124326229095
"If a client has difficulty in learning new adaptive responses due to interference from old learning, this is a case of",reminiscence,retroactive inhibition,latent learning,proactive inhibition,D,False,0.060274288058280945,0.12760066986083984,0.648009717464447,0.16384251415729523
__________ is the most frequent cause of many of the ethical complaints brought against psychotherapy supervisors.,Sexual harassment,Breach of confidentiality,Lack of timely feedback,Incompetence,C,True,0.03049105405807495,0.12059446424245834,0.47696036100387573,0.3714570999145508
"Alice A., who has a master's degree in clinical psychology but is not licensed, is hired by a community mental health clinic to, among other things, administer several standard psychological tests to adult clients. According to ethical guidelines, this is:",acceptable as long as a professional clinical psychologist co-signs Alice’s evaluations.,acceptable as long as a professional clinical psychologist supervises Alice’s activities.,unacceptable since Alice is not a licensed psychologist.,unacceptable since Alice does not have a doctoral degree.,B,False,0.04829738289117813,0.16857442259788513,0.6667248010635376,0.11585938930511475
It is characteristic of brief crisis-oriented therapy to,explore early childhood experiences related to the problem,try to ensure that the client becomes calm and relaxed,agree upon clear-cut goals and keep the sessions focused on these goals,"be open and nondirective, allowing the client the greatest latitude in exploring all aspects of the crisis situation",C,True,0.0442311093211174,0.2246241271495819,0.6105915904045105,0.12023261189460754
A child with an insecure/anxious-avoidant pattern of attachment:,is very distressed when separated from his/her mother and continues to be highly anxious when she returns.,is more anxious when his/her mother is present than absent and resists contact with her when she returns following separation.,is very distressed when separated from his/her mother but pulls away from her when she returns.,shows little distress when separated from his/her mother and turns away from her when she returns.,D,False,0.04329095408320427,0.31987932324409485,0.4654216468334198,0.17121906578540802
"In order to deal with the legal issue of age discrimination, iris important for the psychologist to know that, with regard to the firing of an employee, evidence of age discrimination exists",only when company policy reflects adverse impact on older workers,"whenever the employee's age, instead of work performance, is the basis for firing",whenever the affected employee can demonstrate substantial economic loss,only when the majority of employees in a given age group are adversely affected economically,B,False,0.04961882531642914,0.2519851624965668,0.604481041431427,0.09270016849040985
"According to Kubler-Ross, when a terminally ill patient is informed of his/her condition, the patient's initial reaction will likely be",“I hate everybody and everything!”,“No. it’s not possible!”,“I give up: I'm powerless!”,"“If you help me, God, I’ll reform my life!”",B,False,0.054251063615083694,0.1474696844816208,0.5832539200782776,0.2145671397447586
"In terms of EEOC guidelines, a substantially different rate of selection or promotion that results in disadvantage to people of a particular gender, race, or ethnicity is evidence of:",test bias.,adverse impact.,criterion deficiency.,situation specificity.,B,False,0.1842789649963379,0.23661886155605316,0.5009220838546753,0.07681889832019806
Students in an introductory psychology class are required to participate in one of the university's ongoing research projects. This practice is:,ethical as long as students can choose to participate in an alternative activity instead.,ethical as long as students are free to choose the research project they participate in.,ethical as long as informed consents are obtained from students before they participate.,clearly unethical.,A,False,0.02212439477443695,0.06014034152030945,0.5705956816673279,0.34608379006385803
The central ingredient of the most effective behavioral treatment for agoraphobic is,deep muscle relaxation,prolonged exposure in vivo,shaping of the desired behavior with an implemented reward system,exposure in fantasy,B,True,0.0484887920320034,0.5907144546508789,0.35828641057014465,0.0024141150061041117
The primary function of the psychology licensing board is best described as:,developing laws that govern the practice of psychology.,providing sanctions for unethical and illegal behavior on the part of psychologists.,protecting the public welfare.,accrediting graduate programs in psychology.,C,False,0.18073126673698425,0.4335517883300781,0.20479537546634674,0.18073126673698425
A rattle that a 4-month-old is playing with is hidden underneath a blanket in front of the child. She looks at her mother. This child has not yet developed ___________.,Conservation,Egocentrism,Hand–eye coordination,Object permanence,D,False,0.08971567451953888,0.0480213388800621,0.5850196480751038,0.2763437330722809
Tonic-clonic seizures most frequently occur in which type of epilepsy,Simple partial,Complex partial,Grand mal,Perit mal,C,True,0.166952446103096,0.3534383177757263,0.40049809217453003,0.0788627490401268
"When a qualitative research is done, the theory is developed from the data, not before and helps refine hypotheses. From your knowledge about this type of research, which one out of the following statements about CASE STUDIES can not be correct?","Case studies are used for attitude measurement, preferences, & satisfaction",Case studies are based on the assumption that the case can be generalized,Case studies are most useful as pilot study to identify variables that can be studies in other ways,Case studies are the a detailed examination of a single case,A,False,0.05796647444367409,0.09557055681943893,0.706176221370697,0.1390543282032013
What factors increase the likelihood of burnout?,External locus of control and insufficient praise,Positive environment and micro-management,Age and quality of life,Lack of control and insufficient reward,D,False,0.03802908584475517,0.1171378344297409,0.5249752998352051,0.318413645029068
"""You would use a """"multitrait-multimethod matrix"""" in order to:""",compare a test''s predictive and concurrent validity.,determine if a test has adequate convergent and discriminant validity.,identify the common factors underlying a set of related constructs.,test hypotheses about the causal relationships among variables.,B,False,0.08831969648599625,0.3493112027645111,0.5082448124885559,0.053568605333566666
"A client whom Dr. Oliver Olivetti has been seeing for several months has recently changed jobs, and the client has learned that her new insurance plan does not begin covering pre-existing conditions for 12 months. The client asks Dr. Olivetti if he could write his bills so that it appears that she has just started therapy. If Dr. Olivetti complies with the client's request, he is acting:",ethically since he is taking the client’s welfare into consideration.,ethically only if not to do so would require the client to quit therapy.,ethically only if the insurance forms do not require him to sign a statement saying that treatment began after the effective date of the insurance.,unethically.,D,False,0.10355982184410095,0.21923615038394928,0.5259202122688293,0.15067866444587708
A person in the pseudoindependent stage of White racial identity is currently ___________.,Developing an awareness of the role of Whites in perpetrating racism,Unaware of race and racism,Exploring what it means to be White and confronting own biases,Attempting to resolve moral dilemmas associated with an awareness of race and racism,A,False,0.01838746666908264,0.038926269859075546,0.8859577775001526,0.05663738399744034
The most common treatment for ADHD is drug treatment using CNS stimulants. In relation to treatment for ADHD which of the following statements is incorrect?,A limitation of stimulant therapy is that not all children improve.,For reducing activity levels a higher dose of the stimulant is required.,Improvements may only be short-lived following treatment.,A lower dose of the treatment has the effect of improving social behaviors.,D,False,0.05353139340877533,0.16488830745220184,0.5078917145729065,0.27185487747192383
"The empirical literature suggests that when mothers give their children’s developmental and social histories, the mothers’ memories are most accurate about",school relations,interpersonal relations,child-rearing practices,motor development and weight gain,D,False,0.1097673773765564,0.43413838744163513,0.43413838744163513,0.021614477038383484
An examinee who makes a number of confabulatory responses on the Rorschach has overgeneralized from a part of the inkblot to the whole. Such responses suggest which of the following?,a need for immediate gratification,high intelligence and creativity,a high degree of defensiveness or denial,"brain damage, intellectual disability, or emotional disturbance",D,False,0.028601519763469696,0.06861148029565811,0.7376429438591003,0.16459038853645325
"In research study, a mother and her infant are alone in a room. A stranger enters and the mother leaves the room. When the mother returns to the room, the infant begins to cry and initially continues to do so even after being picked up by the mother. Eventually the infant settles down and returns to playing, apparently happily, with the toys provided. Which attachment classification is most likely to be appropriate for this infant",Disorganized,Anxious resistant,Avoidant,Secure,B,False,0.06542479991912842,0.07413601130247116,0.7033829092979431,0.15694594383239746
The following has been shown to be the most effective means of symptom reduction for obsessive-compulsive disorder:,Dialectical behavior therapy,Antidepressant medications,Exposure and response prevention therapy,Combination of exposure and response prevention therapy and antidepressant Medications,C,True,0.032626599073410034,0.07826714217662811,0.841451108455658,0.04747142642736435
A psychologist is appointed by the Court to examine a defendant. The psychologist should,begin the evaluation by informing the defendant that anything that is discussed maybe talked about in open court,begin the evaluation by asking the defendant to indicate information that should be kept confidential,refuse to do the evaluation unless the Court agrees thar it will be kept confidential,discuss confidentiality only if the defendant asks about it,A,False,0.11716251820325851,0.2480330765247345,0.46338674426078796,0.1704704761505127
Which of the following best describes elaborative rehearsal?,making new information meaningful,consciously repeating new information,practicing a new skill past the point of mastery,“thinking aloud” while studying,A,False,0.040287189185619354,0.43312808871269226,0.4907984435558319,0.03555332124233246
A functional analysis is conducted in order to identify _______ variables.,controlling,moderator,dependent,organismic,A,False,0.1312510073184967,0.14872686564922333,0.5882261395454407,0.1312510073184967
