0,1,2,3,4,5,correct,choiceA_probs,choiceB_probs,choiceC_probs,choiceD_probs
Which of the following statements expresses a relationship between aging and sexual functioning,Aging is related to an increase in vaginal lubrication,Aging is associated with an increase in the frequency and number of orgasmic contractions in both sexes,There is no significant relationship between aging and sexual responses in either sex,Aging is related to some loss of erectile rigidity in the male,D,False,0.05868184193968773,0.3826536536216736,0.49133703112602234,0.06649523228406906
"According to Piaget, children are ___________.",“Blank slates”,Less intelligent than adults,“Little scientists”,Shaped by culture,C,True,0.014607646502554417,0.06546693295240402,0.7975504994392395,0.12230832874774933
"If a test has a standard error of measurement of 15 points, itis correct to conclude that",about 68% of the observed scores for the test population lie within 15 points of the mean score,about 68% of the individuals with a given cure score will have observed scores within 15 points of the true score,"about 15% of the scores are in error (i.e., they are not measuring the trait reliably)",differences of up to 30 points represent the same true score,B,True,0.10629798471927643,0.6117027401924133,0.19859080016613007,0.08278495818376541
Any substance that can have a negative impact on fetal development is ___________.,An Apgar,A teratogen,Only a problem in the first 6 weeks,A controlled substance,B,True,0.06328017264604568,0.46758073568344116,0.3641522526741028,0.1043313667178154
"If you were hired by a large company to develop a new training program, your first step would probably be to conduct a:",needs analysis.,job evaluation.,summative evaluation.,formative evaluation.,A,True,0.3155170977115631,0.2784428596496582,0.3155170977115631,0.09039716422557831
Practitioners of Gestalt psychotherapy consider a client’s desire to talk about his/her past as:,a useful strategy for helping the client understand the present.,a way for the client to avoid coming to terms with the present.,"""the """"second layer"""" of therapy.""","""a way for achieving """"closure"""" near the end of therapy.""",B,False,0.07735949009656906,0.23828403651714325,0.4451731741428375,0.23828403651714325
"In regard to memory, aging is most closely associated with a decline in",the efficiency of controlled memory processes,"metamemory skills, or knowledge about memory",recognition memory,the amount of factual memory knowledge available,A,False,0.04437975212931633,0.4210633635520935,0.4771273136138916,0.05698473006486893
"A 66-year-old client who is depressed, has rhythmic hand movements, and has a flattened affect is probably suffering from",Parkinson's disease,Vascular Dementia,a right frontal lobe tumor,Alzheimer's disease,A,False,0.02572956681251526,0.05446949973702431,0.7519282102584839,0.1677778661251068
"One Friday afternoon, just before leaving on a weekend tip, a psychologist receives a call from a therapy client who claims to have taken an overdose of pills in a suicide attempt. The psychologist: tells the client to call a physician immediately and to come in at 9:00 A.M. on Monday for a session. The psychologist makes no other attempt to intervene, and the client dies later that evening without making any other calls for assistance. In this situation, the psychologist's behavior was clearly","unethical, because the client's needs were not addressed more directly","unethical, because the psychologist should have delayed the trip and given the client an appointment for that afternoon","unethical, because the psychologist should have called a physician directly","ethical, because it was not possible to determine whether or not the client was being manipulative",A,False,0.09932184964418411,0.18555767834186554,0.504397988319397,0.21026436984539032
A family therapist using the structural approach of Salvador Minuchin would most likely:,clarify boundaries between family members in order to reduce enmeshment.,work initially with the most differentiated family member.,"""use a multiple-therapist team to prevent any one therapist from becoming """"triangulated"""" into the family system.""","""issue specific """"directives"""" designed to counteract dysfunctional processes.""",A,False,0.08767536282539368,0.30601707100868225,0.3929336965084076,0.21032226085662842
"A researcher interested in examining the potential impact of parent alcoholism on child and family development recruits 12-year-olds (n = 100), 13-year-olds (n = 100), and 14-year-olds (n = 100)—half of whom have an alcoholic parent and half of whom do not—into a multiple-year longitudinal study assessing various outcomes. This study is best characterized as:",A true experiment,A cross-sequential cohort design,A natural experiment,A cross-sectional cohort design,B,False,0.14509348571300507,0.23921871185302734,0.5738558769226074,0.04156998172402382
Focal damage to the portion of the left frontal lobe known as Broca's area is likely to impair,recall of words,verbal comprehension,verbal learning,production of speech,D,False,0.086990125477314,0.34405264258384705,0.44177234172821045,0.12656989693641663
"According to Gerald Patterson and his colleagues (1992), which of the following is a key contributor to aggressive behavior in children?",the child’s intelligence.,the child’s “basic personality.”,the strength of the parent-child attachment.,the parents’ childrearing behaviors,D,False,0.08712584525346756,0.2368326336145401,0.6437777876853943,0.03205180913209915
A person who received a Level 4 rating on the Rancho Los Amigos Scale of Cognitive Functioning:,is nonresponsive to visual or auditory stimuli and seems to be in a state of deep sleep.,"is confused and incoherent, may exhibit bizarre behavior, and is unable to care for him/herself.","is alert and oriented and can remember and integrate remote and recent events but may have some impairment in judgment, planning, and abstract reasoning.","is functioning at an intellectual level that is superior for his/her age, education, and demographic background.",B,False,0.005432245321571827,0.03542269021272659,0.9135632514953613,0.04548363387584686
A psychologist who already has an established therapeutic relationship with a child is asked to act as an expert witness in a divorce proceeding involving custody of the child. The psychologist's best course of action would be to:,decline the request to testify.,agree to testify only if she obtains consent from both parents.,agree to testify only if she can evaluate all of the involved parties.,agree to testify only if her familiarity with the child won''t bias her testimony.,A,False,0.05695023760199547,0.17541907727718353,0.693795919418335,0.07312554866075516
"Motivation is a complex process involving weighing alternatives, costs, and benefits. From your knowledge about GOAL-SETTING THEORY, which one out of the following statements is incorrect?",goals serve 2 purposes: they are a basis for motivation and they direct behaviors,goal attainment is maximized when goals are specific and highly difficult,goal attainment is maximized when frequent feedback is given,worker participation in goal-setting is also good,B,False,0.032934073358774185,0.08952409774065018,0.6614986062049866,0.21475714445114136
"The STATISTICS are a method of measuring variables and organizing and analyzing data statistical method can be descriptive or inferential and have a scale of measurement. From your knowledge about statistics measurement, what is the RATIO DATA?",Ratio Data is scaled and at equal distances but no absolute zero,"Ratio Data orders the amount of variable, but no info about how much",Ratio Data is an interval data with an absolute zero,Ratio Data divides variables into unordered categories,C,True,0.03417803347110748,0.08198883384466171,0.7778884172439575,0.10527575016021729
"Aronson and Mills examined the effects severity of initiation into a group on subsequent attitudes toward the group. Results of their study indicated that, compared to women who underwent a mild initiation, women who underwent a severe initiation as a precondition of group membership:",rated the group as less interesting and enjoyable.,rated the group as more interesting and enjoyable.,were more likely to drop out of the group.,were more likely to dislike fellow group members.,B,False,0.09581729024648666,0.29513803124427795,0.4294233024120331,0.17901025712490082
"A graduate student’s dissertation chair, Dr. X, turns out to be of little help, and the student ends up obtaining advice and assistance from an associate professor, Dr. Z. Dr. X does review the dissertation when it is completed and she is listed as the dissertation chair. Several months later, the student decides to write an article for a professional journal that is based his dissertation research. In terms of publication credit:",Dr. Z should be listed as first author if her contribution was substantial.,Dr. Z should be listed as second author if her contribution warrants it.,Dr. X should be listed as second author since she was the student’s official dissertation chair.,Dr. Y and Dr. Z should be listed as co-authors.,B,False,0.13693907856941223,0.2899000346660614,0.4779643416404724,0.09411675482988358
The TRANSTHEORETICAL MODEL OF CHANGE was originally developed to treat addictive behaviors and 5 stages people pass through in the process of change. Which stage is correctly defined?,PRECONTEMPLATION: intend to take action in next 6 months,PREPARATION: consider change in next 6 months,ACTION: time and effort into modifying behavior,MAINTENANCE: behavior change lasted at least 8 months,C,True,0.12661607563495636,0.344178169965744,0.4419335126876831,0.08702186495065689
"When a psychologist doesn’t feel he or she is competent to accept a case, the most justifiable option is to:",Try his or her best,Refer out,Read a chapter on the issue,Charge the client less,B,True,0.16267196834087372,0.44218820333480835,0.26820069551467896,0.12668904662132263
A personnel director decides to raise a selection test’s cutoff score when using the test to assist in hiring decisions. Most likely the personnel director has made this decision in order to:,increase the number of true positives.,decrease the number of false positives.,increase the number of false negatives.,decrease the number of true negatives.,B,True,0.09117195755243301,0.40860435366630554,0.40860435366630554,0.09117195755243301
"Dr. Jones, a clinical psychologist, has been seeing Lisa L. in therapy for one month. Dr. Jones considers Lisa to be a very attractive woman and finds himself having sexual fantasies about her. As an ethical psychologist, Dr. Jones should:",recognize that such attraction is normal but proceed with caution.,confess his attraction to Lisa and make it a topic for mutual examination in therapy.,recognize that such attraction is inappropriate and refer Lisa to another therapist without explaining the reason to her.,continue working with Lisa but consult with a colleague if he believes his attraction might be interfering with his objectivity.,D,False,0.030019983649253845,0.3657182455062866,0.5321168899536133,0.07201419025659561
Parametric Tests are used when data is interval or ration. When is it used the ONE-WAY ANOVA?,used when there is 1 IV and means of more than 2 groups,used when there is 2 IV and means of more than 4 groups,used when there is 3 IV and means of more than 5 groups,used when there is 4 IV and means of more than 6 groups,A,False,0.09693130850791931,0.15981270372867584,0.6320714950561523,0.10983755439519882
"A father brings his 22-year-old son to you for evaluation. Within the past 6 weeks, this formerly socially active young man has quit his job as a restaurant manager, has become withdrawn, and now spends most of his time in his room watching TV. He reports that he occasionally receives messages from aliens through the TV. Based on this information, which of the following is the most appropriate DSM-IV diagnosis",Schizophreniform Disorder,Brief Reactive Psychosis,Schizophrenia,Antisocial Personality Disorder,A,False,0.030095933005213737,0.06371309608221054,0.8795320987701416,0.02655956894159317
Identify the only construct that is not pertinent to developmental models on intelligence:,Investment theory,The positive manifold,G theory,Primary mental ability theory,A,False,0.05907581374049187,0.11036815494298935,0.71969074010849,0.11036815494298935
Thomas and Chess’s (1977) “goodness-of-fit” model predicts that maladjustment in children is due to:,a mismatch between the child’s basic temperament and his/her parents’ childrearing practices.,a mismatch between the child’s attachment behaviors and his/her parents’ response to those behaviors.,inconsistencies in the parenting styles of the child’s caregivers.,inconsistencies in the child’s sense of self and the feedback the child receives from caregivers about his/her behavior.,A,False,0.10702980309724808,0.3735707104206085,0.4796742796897888,0.039374060928821564
The STANDARD SCORES express raw score distance from mean by SD and considered the most satisfactory type of NR score. Which statement out of the following ones is about T-scores?,Shows how many standard deviations a score is above or below the mean: a score of +1.0 means it’s 1 SD above the mean,"M=50, SD=10- it is used on many psychological tests, MMPI","standard nine: M=5, SD=approx 2","M=100, SD=15 or 16",B,True,0.1946200728416443,0.36359816789627075,0.22053343057632446,0.22053343057632446
Trend analysis is a type of analysis of variance that is used when:,a study’s independent variable is quantitative.,a study’s dependent variable is qualitative.,a cross-sectional research design has been used.,a factorial research design has been used.,A,False,0.09322279691696167,0.36870333552360535,0.4734244644641876,0.06407102942466736
"When performing a(n) ________ task, group members select a solution offered by one of the group members as the group’s solution.",compensatory,disjunctive,conjunctive,additive,B,False,0.04668242484331131,0.1629376858472824,0.7302359938621521,0.05994142219424248
A therapist instructs a client who suffers from insomnia to polish his hardwood floors for at least two hours whenever he wakes up during the night. Apparently this therapist is familiar with the work of:,Luigia Boscolo.,Milton Erickson.,Salvador Minuchin.,Marquis de Sade.,B,False,0.22442524135112762,0.1542450487613678,0.6100509762763977,0.011173473671078682
A patient wishes to use data from your recent neuropsychological evaluation in a civil hearing in which he is suing the supermarket where he slipped and fell. Which answer should be the first step in fulfilling this request after a release has been duly executed?,Provide the data and test forms to the patient,Provide the data and test forms to the patient’s attorney,Provide the data to an appropriately qualified psychologist as indicated on the release form,"Provide all data and test forms, if contacted directly by the attorney",C,False,0.1502184122800827,0.40833595395088196,0.2476682811975479,0.19288425147533417
"Female applicants consistently obtain lower scores on a selection test than do male applicants. However, when they are hired, females perform as well on the job as do males. This situation illustrates which of the following?",differential validity,differential selection,adverse impact,unfairness,D,False,0.058403585106134415,0.20384854078292847,0.6278977394104004,0.10911225527524948
The correction for attenuation formula is used to measure the impact of increasing:,a test’s reliability on its validity.,a test’s validity on its reliability.,the number of test items on the test’s validity.,the number of test items on the test’s reliability.,A,False,0.10900282114744186,0.33575230836868286,0.4311144948005676,0.12351638078689575
A child diagnosed with conduct disorder cannot receive an additional diagnosis of:,ADHD,Rett’s disorder,Oppositional defiant disorder,Asperger syndrome,C,True,0.07027091085910797,0.13128334283828735,0.6667118668556213,0.13128334283828735
The presence of manic episodes is required for a diagnosis of:,Depression,Bipolar I,Bipolar II,Dysthymia,B,False,0.16631293296813965,0.1467706561088562,0.6577804088592529,0.028900856152176857
"On the basis of his investigation of the relationship between affiliation and anxiety, Schachter concluded that which of the following best accounted for the desire of high-anxiety research participants to wait with other high-anxiety participants?",demand characteristics,evaluation apprehension,relief from discomfort,social comparison,D,False,0.05152655020356178,0.17984533309936523,0.627721905708313,0.14006368815898895
"A psychologist in private practice is going through a difficult divorce and, as a result, has started drinking and is often depressed. He should:",plunge deeper into his work to take his mind off his own problems.,seek professional consultation and consider temporarily suspending his practice.,explain the situation to his clients and offer to refer them to other therapists.,immediately refer his clients to other therapists.,B,False,0.040053367614746094,0.20340779423713684,0.5529196858406067,0.20340779423713684
A physician refers an asthmatic patient to you for therapy and requests regular progress reports. The most appropriate course of action for you to take is to,"comply with this request, since a physician must be involved whenever you treat someone for a physical condition",tell the physician chat psychological reports can be sent only to a psychiatrist or to another psychologist,tell the physician thar you can send progress reports only with a written release by the patient,"comply with this request, since the physician needs your input for best treatment of the patient's physical condition",C,False,0.25034019351005554,0.25034019351005554,0.13399747014045715,0.3642428517341614
"As used in personnel selection, “adverse impact” means that",a group covered by law is hired at a rate less than 80% of that of the group with the best selection,selection interviews are “adverse” for groups covered by law and result in differential selection rates,adverse conditions exist for selection of groups covered bylaw,the total selection process results in unequal results for one or more groups covered by law,A,False,0.08826430886983871,0.3955731689929962,0.3490920960903168,0.16489943861961365
"A stroke that affects the posterior region of the corpus callosum, thus disconnecting the visual centers of the brain from the language centers of the brain, may result in this syndrome:",Agraphia without alexia,Alexia without agraphia,Aphasia,Apraxia,B,False,0.03927936404943466,0.064760722219944,0.7889471054077148,0.10677237808704376
Research suggests children’s successful adjustment to the divorce of their parents is most related to:,the frequency of contact with the noncustodial parent.,the quality of the parent-child relationships prior to the divorce.,the child’s ability to understand the cause(s) of the divorce.,the degree of post-divorce conflict between the parents.,D,False,0.16225366294384003,0.4410511255264282,0.34349095821380615,0.05267604440450668
"Dr. Sam Solo is the only psychologist in a small town, and his son is enrolled in the town's only elementary school. Dr. Solo receives a call from his son's teacher who says she would like to begin therapy with him. As an ethical psychologist, Dr. Solo should:",tell the teacher that he is ethically prohibited from seeing her because to do so would constitute a multiple (dual) relationship.,"begin therapy with her and discuss the potential for conflicts during the initial session and, if necessary, in subsequent sessions.",begin therapy with her but seek consultation if any problems arise.,begin therapy with her but take special precautions to ensure that client confidentiality is maintained.,B,True,0.14197544753551483,0.495542973279953,0.34058138728141785,0.021772639825940132
An agonist is ___________.,A drug that cannot produce 100% of the biological response,A drug that has no effect,Another name for antianxiety medication,A drug that binds to a receptor producing a change in activity,D,False,0.1307031363248825,0.16782614588737488,0.5857707858085632,0.11534509807825089
"Research in the workplace has shown that a subordinate’s participation in goal setting leads to the selection of goals that, when compared to goals set for subordinates unilaterally by their supervisors, are",more challenging,Of about the same level of difficulty,never accomplished,less challenging,A,False,0.1900484710931778,0.27651888132095337,0.402332603931427,0.13061827421188354
You are a consultant asked to design an intervention program in a recently integrated housing project where antagonism and hostility between old and new residents are extremely high. The goal is to improve relations through contact. You would be more likely to facilitate that goal if you could arrange interactions that provide opportunities,"at the outset for contact that is rather casual and superficial, thus providing a “warm-up” phase",which make explicit the status hierarchy chat is implicit in the interactions between the wo groups,which provide an open airing and all-out discussion about what each group believes to be the negative crits of the other,for each group of residents co disconfirm negative traits of the other group,D,False,0.05761289969086647,0.3756833076477051,0.4257049560546875,0.13820615410804749
Which of the following is true of low-context communication?,It is grounded in the situation,It relies heavily on nonverbal cues,It is a less unifying form of communication,It is more typical of culturally diverse groups in the United States,C,True,0.14611557126045227,0.12894654273986816,0.5778982639312744,0.14611557126045227
"A former client owes you over $600.00 in therapy fees and you are considering using a collection agency to collect the money she owes you. As an ethical psychologist, you should:",decide not to do so because using a collection agency is prohibited by the ethical guidelines.,do so only if you had informed the client at the beginning of therapy that you would do so if she did not pay her fees in a timely manner.,contact the client first to inform her of your intent to use a collection agency if she does not pay her outstanding fees by a specific date.,use a collection agency only as a “last resort.”,C,True,0.048552919179201126,0.2794027626514435,0.5914956331253052,0.08005023002624512
"If you believe another psychologist has committed an ethical violation, you should first:",Report it to the APA Ethics Committee,Report it to his or her state professional standards board,Wait to see whether he or she commits a second violation,Discuss your concerns with him or her,D,False,0.21961373090744019,0.24885496497154236,0.28198960423469543,0.24885496497154236
Research on the counseling of minority group member clients indicates thar they,remain in counseling for approximately the same length of time as nonminority dents,rarely seek counseling services,remain in counseling for a significantly longer time than non- minority clients,terminate counseling significantly earlier than do non-minority clients,D,False,0.016204897314310074,0.034305766224861145,0.884757399559021,0.06409161537885666
A psychologist at a pain clinic is helping design a medication reduction schedule to address the learned aspects of a patient's medication use. The psychologist’s best recommendation would be to administer medication,"in the patient’s food, because reduction will occur sooner as the patient's awareness of the medication decreases","at specific times, because then the medication will not be given in response to pain","only when requested by the patient, because reduction will occur sooner if less medication is given","by injection, because as administration becomes more painful, less medication will be requested",B,False,0.03919123113155365,0.2255299985408783,0.6130540370941162,0.12071749567985535
Research on women who have had abortions indicates that,subsequent problems in sexual adjustment and in relationships with men are common,most women who have abortions think no more about the event than they would about having a wisdom tooth removed,the psychological consequences are no worse than they are for women who have chosen to continue their pregnancies and give birth,"the experience frequently has serious psychological consequences, usually in the form of guilt and depression",C,True,0.023063452914357185,0.05532634258270264,0.8654496669769287,0.05532634258270264
"Behaviorist views have been criticized by other approaches for a number of reasons. Ethologists argued that the behaviorists ignored innate, built-in biases in learning due to evolution, but also disagreed with:",the use of the animals in laboratory experiments,the use of the humans in laboratory experiments,the use of the trial-and-error system,the use of the operant conditioning principle,A,False,0.18304936587810516,0.20742207765579224,0.4975797235965729,0.11102505028247833
An aspect of development that is more plastic is an aspect that is .,More or less fixed and difficult to change,Not heavily influenced by the environment,Relatively malleable,Irrelevant to developmental processes,C,True,0.010551461949944496,0.12854312360286713,0.83820641040802,0.022337444126605988
"From a behavioral perspective, phobic reactions to benign objects or events are acquired when those objects or events become associated with a stimulus that naturally produces a fear response. In other words, phobic reactions are due to:",negative reinforcement.,negative punishment.,stimulus generalization.,classical conditioning.,D,False,0.07746411114931107,0.09946589171886444,0.734959065914154,0.08777834475040436
