0,1,2,3,4,5,correct,choiceA_probs,choiceB_probs,choiceC_probs,choiceD_probs
Equity theory predicts that a person's satisfaction in a close personal relationship is related to the person's:,perceptions of his/her own contribution/reward ratio and the ratio of his/her partner.,perceptions of the relative utility of the relationship.,comparisons between his/her current relationship and past relationships.,comparisons between his/her own relationship outcomes and the relationship outcomes of others.,A,False,0.19293086230754852,0.2477281242609024,0.5244404077529907,0.033526353538036346
A widely used procedure for matching client aptitudes to job requirements is the,profile similarity index,multiple cut-off technique,profile coding method,test-by-test matching procedure,B,True,0.09248337149620056,0.4696693420410156,0.28486886620521545,0.15247930586338043
"In Gestalt therapy, transference is usually",created ab a fantasy of the client,considered a sign that therapy is progressing favorably,worked through via dream work,interpreted to the patient early in treatment,A,False,0.07821618020534515,0.3505406081676483,0.5100335478782654,0.06091482192277908
"If a psychologist acts as both a fact witness for the plaintiff and an expert witness for the court in a criminal trial, she has acted:",unethically by accepting dual roles.,ethically as long as she did not have a prior relationship with the plaintiff.,ethically as long as she clarifies her roles with all parties.,ethically as long as she obtains a waiver from the court.,C,True,0.019016213715076447,0.09657230228185654,0.8085899353027344,0.0752105787396431
"When helping a patient to resolve ambivalence, build commitment, and reach a decision to change, which of the following basic principle is not used at Motivational Interviewing:",Does not support self-efficacy for change,Empathy through reflective listening,Roll with resistance,Avoid direct confrontation,A,False,0.011633570306003094,0.08596111088991165,0.719743549823761,0.18197965621948242
"The Frequency Distribution provides a summary of a set of data and indicates the number of cases that fall at a given score within a given range. From your knowledge about this topic, which statement out of the following ones is about the SKEWED DISTRIBUTION?",It is commonly called the bell-shaped curve,"It is symmetrical (half falls above the mean, half below)",It has asymmetrical frequency distributions,It is used most common with a large number of data points,C,True,0.0898686870932579,0.2768150568008423,0.5171586275100708,0.11539369076490402
"A research project compared the performance of learning disabled and of normal students on ten scales of the Wechsler Intelligence Scale for Children ~ Revised (WISC-R). Ten univariate analyses of variance (ANOVAs) were run to test for differences between the two groups, but use of a multivariate analysis of variance (MANOVA) would have been more desirable because MANOVA",usually offers greater protection against Type Il error,does not require multiple-comparison follow-up tests in order to interpret significant effects,usually offers greater protection against a Type I error,is conceptually and computationally a simpler and more efficient approach,C,True,0.011516704224050045,0.05161428824067116,0.554905891418457,0.3813808858394623
"An employee is receiving counseling from a psychologist through his company's employee assistance program. In this situation, the psychologist can let the employee's supervisor know that the employee is receiving treatment:",under no circumstance.,only if the employee was referred to the program by the supervisor.,only if the supervisor has signed a waiver.,as long as no other information about the treatment is given to the supervisor.,B,False,0.03902031108736992,0.17487689852714539,0.6103803515434265,0.17487689852714539
"Group A consists of people whose measured interests are highly similar to the interests of engineers, Group B consists of people whose measured interests are highly dissimilar to those of engineers. Which of the following statements would be justified, given that both Group A and Group B entered engineering",Group A members would be more likely to persist in the occupation,Group A and Group B would nor differ in success at or satisfaction with the occupation,Group A members would be more likely to succeed in the occupation,"Group B members would achieve levels of success equal to those of Group A, but would do so more slowly",A,False,0.05235564708709717,0.18273916840553284,0.6378223896026611,0.12559466063976288
"You have been seeing Leticia Lopez in therapy for several months. Leticia is 24 years old and lives with her widowed mother, who is paying for Leticia’s therapy. One day, Leticia's mother calls and says she is very concerned about Leticia and wants to know what she can do to help Leticia feel better about herself. Mrs. Lopez asks that you not tell Leticia that she has called. Your best course of action in this situation would be to:",Give Mrs. Lopez the specific advice she has requested.,Tell Mrs. Lopez to ask Leticia what she (Mrs. Lopez) can do to help her.,Tell Mrs. Lopez that it would be best if you discussed this matter with Leticia.,suggest that Mrs. Lopez accompany Leticia to her next therapy session.,C,False,0.3305152654647827,0.20046763122081757,0.29167869687080383,0.1769120693206787
"""On the basis of the results of the t-test a psychologist uses to analyze the data she collects, the psychologist concludes that her results are """"significant at the .01 level."""" This means that:""",there is a 1% chance that she will incorrectly reject the null hypothesis.,there is a 1% chance that she will incorrectly retain the null hypothesis.,there is a 99% chance that she will incorrectly reject the null hypothesis.,there is a 99% chance that she will incorrectly retain the null hypothesis.,A,False,0.15348020195960999,0.25304609537124634,0.47275233268737793,0.11953050643205643
"You have been treating a teenage male you suspect may have some neurologic difficulties. You inform his parents about your concerns and suggest they send him to a neurologist for an evaluation. Sometime later, the neurologist contacts you and requests your progress notes. You should ___________.",Tell the neurologist the parents need to request the records,Send the records as requested,Inform the neurologist that you would need a release of information signed by your client’s parents,Ask your client whether he wishes to have the records released to the neurologist,C,True,0.06787106394767761,0.23689331114292145,0.3905710279941559,0.30417701601982117
Studies show that the effect of the presence of others on an individual's performance is to,facilitate the performance of novel and difficult tasks,facilitate the performance of easy tasks,hinder the performance of all tasks,hinder the performance of easy tasks,B,False,0.03987414389848709,0.37831535935401917,0.48576653003692627,0.09565309435129166
A psychologist is subpoenaed to testify at a deposition about a current therapy client. This means that the psychologist:,must testify about the client as requested.,must appear at the deposition as requested.,must provide the requested documents.,can expect to receive a court order within 60 days.,B,False,0.19780154526233673,0.326119601726532,0.3695419132709503,0.10587552934885025
An employee expects greater consistency in the behavior of his boss than is warranted. The employee’s expectation is best accounted for by which of the following?,overjustification hypothesis,self-serving bias,fundamental attribution bias,self-verification theory,C,True,0.08408625423908234,0.2285701185464859,0.5483112335205078,0.1386347860097885
The term “insanity” is a:,"legal, non-psychiatric term for certain types of mental disorders.","legal, non-psychiatric term for a psychotic disorder with an unknown etiology.",popular (lay) term for a severe mental illness.,psychiatric term that refers to an organic mental disorder.,A,False,0.1614217758178711,0.30157557129859924,0.43878984451293945,0.09790725260972977
Amnesic Disorders describe conditions where there is memory impairment with no other significant cognitive impairments. Which of the following statements is incorrect in relation to Amnesic Disorders?,These disorders cause a loss of recall of learned information = anterograde amnesia.,Someone with condition confabulates to fill in gaps in the memory.,These disorders can be caused by any pathological process that affects brain areas associated with memory.,Amnesic disorders can be associated with hypnotics and sedatives,A,False,0.007846466265618801,0.03984764590859413,0.9069281816482544,0.04515329375863075
An assessment that uses primarily observational methods to examine and understand the physical and psychological variables that impact behavior in a given environment or setting is a:,Functional behavioral assessment,Work sample,Norm-referenced test,Ecological assessment,D,False,0.05931542441248894,0.07616251707077026,0.5627691149711609,0.3012286126613617
"In classical psychoanalytic theory, a maladaptive behavior that emerges as a compromise between an unconscious impulse and the resulting defense process is called",fixation,regression,repression,symptom,D,False,0.06663951277732849,0.14107584953308105,0.6322580575942993,0.15985988080501556
"""According to the elaboration likelihood model, a person is most likely to rely on the “central route"""" for processing information when:""",he thinks the message is boring.,everyone else in the group agrees with the message.,"""the message is within his “latitude of acceptance.""""""",he is in a neutral or slightly negative mood.,D,False,0.0288389939814806,0.21309293806552887,0.6563724279403687,0.10065797716379166
"For deception in an experiment to be permissible, it is essential that the",merits or value of the scientific investigation warrants the type of deception used,investigator include a careful explanation of the deception within 3 years following the experiment,deception does not involve withholding information about the purpose of the research,deception docs nor significantly mislead participants,A,False,0.15975217521190643,0.4342513978481293,0.3381953239440918,0.06659460812807083
Research that demonstrates parents who play more roughly with male children and are more protective of female children is most consistent with which theory of gender-role identity development?,Psychodynamic,Social learning,Cognitive development,Gender schema,B,False,0.034824494272470474,0.20040112733840942,0.6994686722755432,0.06506071984767914
"Children begin to deliberately and regularly use rehearsal, elaboration, and organization as memory strategies by _____ years of age.",2 to 3,5 to 7,9 to 10,13 to 15,C,True,0.048953477293252945,0.3617200255393982,0.5262995362281799,0.06285751610994339
You regularly waive the co-payment for your low-income clients who are covered by insurance and believe this is acceptable since you normally bill your clients on a sliding fee scale. This is:,a common and ethical practice.,ethical as long as you don't bill the insurance company for an increased hourly fee in order to collect your full fee.,ethical as long as the insurance company does not explicitly prohibit such arrangements.,ethical only if the insurance company is aware of the arrangement.,D,False,0.04763619601726532,0.14672981202602386,0.6575973629951477,0.14672981202602386
"Among women, which of the following subgroups has been shown to be the most frequent users of suicide prevention services",Young ethnic minority women,Elderly ethnic minority women,Young Caucasian women,Elderly Caucasian women,C,True,0.03496374934911728,0.07401825487613678,0.7957712411880493,0.09504131972789764
You are conducting a multiple regression analysis and find that one of your predictors has a negative regression coefficient. This means that:,you should eliminate that predictor from the regression equation.,the predictor has an inverse relationship with the criterion.,the predictor is uncorrelated with the other predictors included in the analysis.,you have made a mistake in your data entry or calculations.,B,False,0.14330054819583893,0.3033672869205475,0.4413967728614807,0.11160258203744888
"In a two-variable situation in which one variable is dichotomous and the other is interval and continuous, which of the following correlation procedures is most appropriate",Point-biserial,Spearman's rho,Phi coefficient,Kendal's tau,A,False,0.0388454794883728,0.17409338057041168,0.7802323698997498,0.006750332657247782
"Dr. Sam Stone has been hired by a consulting firm to assist with an ongoing research project being conducted at a large company. Dr. Stone is to work directly under the project director, Dr. Thompson, a licensed organizational psychologist. Dr. Thompson asks Dr. Stone to review the preliminary report she has prepared for the project; and, in doing so, Dr. Stone discovers that some of the reported data is misleading and may be inaccurate. Dr. Stone expresses his concerns to Dr. Thompson and is told that “it will be taken care of.” Subsequently, Dr. Stone learns that the report was submitted to the company without any changes. Dr. Stone reviews the ethical guidelines and decides that pursuing the matter further isn't necessary. Dr. Stone's conclusion:",is correct since this situation is not covered by ethical guidelines.,is correct since he has already attempted to resolve the matter in an informal manner as proscribed by ethical guidelines.,is correct since it is the project director’s responsibility to provide the company with complete and accurate data.,is incorrect because he has a responsibility to ensure that the company is provided with complete and accurate data.,D,False,0.20737433433532715,0.18300722539424896,0.4974651634693146,0.11099948734045029
"In personnel selection, the selection ratio is defined as the",ratio of successful co unsuccessful workers,ratio of the number of successful selected workers to the difficulty level of the job,percent of workers correctly placed in the group hired to do the job,ratio of the number of workers needed to the number of applicants available,D,False,0.06694933772087097,0.3399967849254608,0.4946924149990082,0.09741070121526718
Quasi-experimental designs are distinguished from true experimental designs on the basis of whether there is,random selection of participants from the population,use of control or comparison groups,random assignment of participants to groups,use of valid and reliable measures of outcome,C,True,0.12910239398479462,0.3976633846759796,0.4506116509437561,0.02243463136255741
"To serve as an expert witness in a court case, a psychologist must:",be board certified as an expert witness.,be qualified by the court to offer opinions and conclusions about the case.,have been hired by the person he/she will be testifying about.,testify only about what he/she personally observed or obtained.,B,True,0.11008665710687637,0.5590662360191345,0.23305346071720123,0.09715113043785095
"The reticular formation and reticular activating system are associated with all of the following functions, EXCEPT:",Decussation of auditory stimuli,Alertness,Consciousness,Pain,A,False,0.04785894975066185,0.1013173907995224,0.6606723666191101,0.18928581476211548
Which is NOT an example of children actively shaping their own development?,Children selecting the contexts in which they participate,Children imposing their subjective appraisal on the context,Children affecting what takes place in the context,Children being conditioned to modify their behavior to the context,D,False,0.03157704696059227,0.027866646647453308,0.814382791519165,0.12488965690135956
"If adverse impact on some minority group has been observed, which of the following types of tests probably has the best chance of withstanding legal challenge",Projective,Empirically keyed,Work sample,Multiple-choice,C,True,0.1650789976119995,0.2721692621707916,0.508479118347168,0.05359330028295517
The Buckley Amendment establishes:,the right of parents or legal guardians of a child to inspect the child’s school records.,the right of patients to have access to their own hospital records.,the requirement for employers to make reasonable modifications to tests for applicants with disabilities.,the requirement for schools to provide a “free appropriate public education” to students with disabilities.,A,False,0.1248011663556099,0.23315928876399994,0.43559888005256653,0.2057623416185379
"In a study where groups of children competed against each other, intergroup hostility was lessened by finding tasks that required the efforts of all the children. This approach is an example of",integrative demands,superordinate goals,threat reduction,intergroup contact,B,False,0.03554658964276314,0.14058949053287506,0.7139723896980286,0.10949121415615082
"According to Bronfenbrenner’s (1979) ecological model, the ______ consists of interactions between elements of the microsystem (e.g., between the family and the school).",mesosystem,exosystem,macrosystem,endosystem,A,False,0.1931387037038803,0.21885478496551514,0.5250053405761719,0.06270294636487961
"When preparing a psychological testing report, a psychologist is ethically bound to include",only data for which independent corroborating evidence exists,interpretations of the data and limiting circumstances involving the test administration,"raw data, where this is appropriate in the psychologist’s professional judgment",any potential pathology chat the psychologist has cause to suspect may develop,B,False,0.0544537752866745,0.24404489994049072,0.585433304309845,0.11527863889932632
Which of the following is the best example of constant error,A subject consistently provides wrong answers to every test item,A psychometrician consistently underestimates IQ scores by 10 points,A test item is answered incorrectly by every student in a given class,A test-retest reliability coefficient is low for several samples,B,False,0.11456233263015747,0.24252848327159882,0.45310282707214355,0.18888135254383087
"A 38-year-old person is afraid to travel on public transportation. A program of treatment that relies on graduated exposure to traveling by bus, with actual real-life behavioral activities increased across trials, is called",flooding,modeling,reinforced practice,implosion,C,True,0.029413720592856407,0.13182313740253448,0.7585898637771606,0.07995478063821793
"You want to start treating clients who believe they have been abducted by aliens, but you have never worked with members of this population before. Your best course of action would be to:",start seeing these clients and consult with someone who is familiar with this population if you run into any problems.,start seeing these clients after establishing a consultative relationship with someone who is familiar with this population.,take a continuing education class related to the treatment of members of this population.,place an ad in the National Enquirer to let members of this population know about the availability of your services.,B,False,0.06031142547726631,0.2702970504760742,0.5049813389778137,0.16394343972206116
A 40-year-old therapist becomes attracted to a 38-year-old client and soon realizes that the feelings are mutual. They discuss the situation and agree to terminate therapy and begin dating. They eventually get married. This is:,ethical since they terminated therapy before beginning to date and since the relationship is a serious one.,ethical since the client is an adult and voluntarily agreed to stop therapy.,unethical because the therapist began dating a former client before the required two-year time limit.,unethical unless the therapist and client both received counseling while dating.,C,True,0.08330607414245605,0.32948195934295654,0.4793933928012848,0.10696712881326675
"Transformed scores increase the interpretability of raw scores and allow comparison to the rest of the distribution. From your knowledge about Transformed Scores, which statement is not about the Z SCOREs?",raw scores stated in SD terms,score minus the mean divided by the SD,permits comparisons across different measures and tests,tells you how many SDs away from the mean a score is,D,False,0.002384130610153079,0.01996207982301712,0.9618269205093384,0.015546483919024467
Down Syndrome is caused by:,a dominant gene.,two recessive genes.,a chromosomal abnormality.,an X-linked gene.,C,True,0.1125110313296318,0.23818586766719818,0.571378231048584,0.07732763141393661
Stress Inoculation Training involves both skills training and modification of maladaptive cognitions. Which of the following steps is incorrectly defined by a young inexperienced therapist:,PRACTICE→ applies learning to real or imagines situations done on a gradual basis,"SKILLS ACQUISITION→ learning relaxation, self-statements, escape routes not necessary with rehearsing them",COGNITION PREPARATION→ education on how faulty cognitions prevent adaptive coping,"SKILLS ACQUISITION→ learning and rehearsing new skills relaxation, self-statements, escape routes",B,False,0.04390161857008934,0.19675341248512268,0.47198688983917236,0.2862745225429535
Which of the following best describes ethical guidelines regarding barter as a substitute for the collection of fees for professional psychological services?,Barter may be acceptable when certain conditions are met.,The barter of goods (but not services) is prohibited by ethical guidelines.,The barter of services (but not goods) is prohibited by ethical guidelines.,Barter of any kind is prohibited by ethical guidelines.,A,False,0.13338343799114227,0.11771047115325928,0.4655539393424988,0.28237274289131165
"According to the theory of planned behavior, the three components of a person's behavioral intention are:","attitude toward the behavior, subjective norms, and perceived behavioral control.","degree of Liking or attraction, beliefs, and action tendencies.","level of ability, degree of motivation, and extent of behavioral control.","attitudinal strength, social desirability, and perceived self-efficacy.",A,False,0.17417645454406738,0.4178276062011719,0.3687315583229065,0.03886402025818825
The 1976 Tarasoff decision established:,the right of a parent to inspect and request modifications to his/her child’s school records.,a psychologist’s “duty to protect” the intended victim of a therapy client.,the “80% rule” as a standard for determining the fairness of a selection test or other employment procedure.,a psychologist’s duty to report suspected or known cases of child abuse.,B,True,0.2247108370065689,0.32695233821868896,0.32695233821868896,0.12027905136346817
"According to one criterion of discrimination, under which of the following conditions would it be safe to assume that a selection test does not discriminate against a particular racial group",No one from the group has applied for a position with the organization using the test,‘The test manual demonstrates chat the test is valid for a wide variety of jobs,“The test rejects applicants from different racial groups in the same proportion,Iris not feasible to conduct separate validity studies on male and female employees,C,True,0.07098322361707687,0.3604825437068939,0.46286872029304504,0.1032799780368805
A measure of __________ would be most useful for determining the likelihood that employees will remain on the job for a long period of time.,job satisfaction,job productivity,intelligence,motivation,A,False,0.03897805139422417,0.19794687628746033,0.4748498797416687,0.28801101446151733
Which of the following contributes to a favorable prognosis for psychotherapy,Along history of neurosis,Dependency,Strong reinforcement of symptoms,Misery,D,False,0.04345152899622917,0.1718541383743286,0.6796963214874268,0.10423480719327927
"In some circumstances, it is proposed chat heredity determines the timing and general nature of a behavior, bur thar environmental experiences at a critical time determine the specific stimulus-response connection which is learned. This form of learning is called",critical learning,maturation,imprinting,social learning,C,False,0.4775315821170807,0.12073888629674911,0.17567406594753265,0.225569948554039
"In the research on leadership of children’s groups, which of the following was a major finding concerning group behavior",Children easily adapt to change from an autocratic to a democratic organization,The presence or absence of the leader in the autocratic group made no difference,Laissez-faire groups maintained a task orientation longer than autocratic groups,#NAME?,D,False,0.054497670382261276,0.14814002811908722,0.6639175415039062,0.13073310256004333
Longitudinal studies of children with specific reading disabilities show that,these children usually have subtle hearing disorders,reading chills usually do not reach normal levels as these children reach adulthood,these children usually excel in sports,the reading impairments usually accompanied by a low vocabulary level,B,False,0.07349663972854614,0.1555923968553543,0.5430707931518555,0.22638559341430664
Which of the following changes would be characteristic of the “classic aging pattern” as it applies to performance on psychometric tests of intelligence,"Verbal functions are preserved relatively well, bur performance decreases on tests of perceptual-integrative ability","The ability to quickly organize and integrate perceptual stimuli declines, while flexibility of thought improves","Memory retrieval mechanisms remain relatively intact, except for recall of remote memories",Tasks requiring short-term or primary memory show 2 consistent decline,A,False,0.040584977716207504,0.33981382846832275,0.5602582693099976,0.0590507872402668
The inability to recognize objects by touch alone is most likely the result of damage to the,medulla oblongara,corpus callosum,parietal cortex,pons,C,True,0.0667979046702385,0.23314759135246277,0.43557703495025635,0.26419082283973694
