0,1,2,3,4,5,correct,choiceA_probs,choiceB_probs,choiceC_probs,choiceD_probs
"Dr. Ja-Hoon Jang is conducting a research study that involves interviewing junior high school students about their relationships with peers. Prior to beginning the study, Dr. Jang obtained informed consents from the parents of the students as well as assents from the students themselves. During the course of the study, one of the students says he doesn’t want to complete the interview. Dr. Jang should:",tell the student that he cannot withdraw from the study since one of his parents has signed an informed consent.,tell the student that he cannot withdraw from the study since he (the student) agreed to participate at the beginning of the study.,contact the student’s parents to ask them to encourage their son to complete the interview.,allow the student to withdraw from the study.,D,False,0.10862014442682266,0.29526016116142273,0.3345735967159271,0.26056617498397827
The research on leadership indicates that,there are no consistent findings except under extreme conditions,effective leaders need to integrate themselves fully into the group,a large number of situational factors are important in determining effective leadership,"democratic leadership is the most effective, in agreement with Lewin’s early findings",C,True,0.05805167555809021,0.29481077194213867,0.5507789850234985,0.09571103006601334
Konrad Lorenz’s (1957) research on “imprinting” led to the search for __________ in human infants.,a critical period for attachment,a biological explanation for language acquisition.,a sensitive period for social referencing,a biological mechanism for recognition memory.,A,False,0.091556116938591,0.36211147904396057,0.46496033668518066,0.08079798519611359
"According to the Standards for Educational and Psychological Testing, when interpreting and reporting test results, one should",focus attention on the confidence interval of a score rather than on the obtained score itself,"use descriptive labels, because such labels readily communicate specific meanings to most people","stress the obtained score, since it is the best estimate of the true score",exclude the potential effects of situational and demographic variables from consideration,A,False,0.08695373684167862,0.5003842115402222,0.34390872716903687,0.06771963834762573
"Compared to individuals in their 20s, which of the following is an advantage to having children after the age of 30?",Older parents typically have more income for additional expenses due to established careers,Older mothers have fewer medical complications during pregnancy and birth,Older parents have not had time to build up expectations about children’s behavior,Older parents have more physical energy and time to play with their young children,A,False,0.06774695217609406,0.1625165045261383,0.5005860924720764,0.26794442534446716
"The belief that a child's misbehavior has one of four goals — i.e., attention, revenge, power, or to display inadequacy — is most consistent with:",Beck’s cognitive-behavioral therapy.,Adler’s individual psychology.,Perls’s Gestalt therapy.,Mahler’s object relations theory.,B,False,0.10785724967718124,0.2931864261627197,0.5477443337440491,0.05094815790653229
The best conclusion that can be drawn about the four-day ( compressed) workweek is that it has:,long-lasting positive effects on attitudes and productivity.,long-lasting negative effects on attitudes and productivity.,positive effects on attitudes but little or no impact on productivity.,"positive effects on attitudes initially but, over time, increasingly negative effects on both attitudes and productivity.",C,True,0.17626596987247467,0.19973552227020264,0.42284008860588074,0.19973552227020264
"One of the key areas of debate in the early stages of Developmental Psychology was the so called, Nature vs. Nurture debate. Academics agreed that there was interaction between these two factors but there was wide disagreement concerning the degree of interaction. Which of the following terms, that relate to either genetic or environmentally caused changes, describes the differences in timing of physical changes that are found in children belonging to different cohorts?",Sensitive period.,Secular trends.,Canalization?,Critical period.,B,False,0.18475325405597687,0.12697891891002655,0.502211332321167,0.18475325405597687
A person with Wernicke's aphasia has impaired language comprehension and:,nonfluent and unintelligible speech.,nonfluent but intelligible speech.,fluent but unintelligible speech.,fluent and intelligible speech.,C,True,0.03753020241856575,0.1484348177909851,0.6652386784553528,0.1484348177909851
The primary purpose of a realistic job preview is to:,increase the number of applicants for a job.,develop an accurate job description.,reduce on-the-job conflicts between managers and employees.,reduce employee dissatisfaction and turnover.,D,False,0.07018006592988968,0.35640379786491394,0.5185644626617432,0.054656289517879486
Most babies say their first words at about _____ months of age.,7,9,12,15,C,True,0.046550534665584564,0.12653745710849762,0.6426102519035339,0.18411092460155487
Which of the following best describes the best ethical position on bartering with clients?,Bartering is ethical because both parties benefit,Psychologists should never barter for services,Bartering is ethical and acceptable if it is not clinically contraindicated and not exploitative,Bartering is ethical only if the client is not otherwise able to pay for services,C,True,0.06969916075468063,0.10141168534755707,0.7493366599082947,0.0789794996380806
A psychologist has been asked to oversee a group that will be designing training programs to enable outplaced workers to fil existing jobs in community organizations. The firs: step the group should cake is to,determine the skill levels and job satisfaction of currently employed people in the community,evaluate the self-esteem of each outplaced worker,perform job analyses for all jobs for which training will be offered,develop training objectives for all jobs for which training will be offered,C,True,0.07077974081039429,0.11669605225324631,0.592631459236145,0.21801696717739105
Which of the following is most likely a violation of ethical guidelines?,a brochure containing client testimonials mailed to potential attendees at a conference for adult children of alcoholics,an advertisement offering a free initial therapy session that is published in the campus newspaper just prior to final exams,uninvited in-person solicitations for therapy of hurricane victims that destroyed their homes,a display ad for psychotherapy services in the yellow pages of the local telephone directory,C,True,0.02862832322716713,0.21153630316257477,0.44782233238220215,0.30778348445892334
Information disclosed by a child client to a psychologist may be kept confidential except when the client reports,sexual abuse,frequent homosexual activities,strong feelings of attraction to the therapist,extreme feelings of depression,A,False,0.044893380254507065,0.09503928571939468,0.4826493561267853,0.3758876919746399
Vocational interest inventories are generally not recommended as,educational decision-making aids,employment selection devices,aids to seif-understanding,occupational information sources,B,False,0.04352663457393646,0.10441496223211288,0.6008666753768921,0.25047847628593445
Which of the following is the proper comparison rate for studying the effectiveness of a new psychotherapy,Incidence in the population of the disorder being eared,Relapse in those who experience spontaneous remission,Cure rate for the currently most effective therapists,Cure rare for current treatment modalities,D,False,0.06131075695157051,0.18885043263435364,0.5817002654075623,0.16665992140769958
"In a skewed smooth distribution with a tail exended to the left, the statistic with the highest value is the",standard deviation,mode,median,mean,B,False,0.10319636762142181,0.13250677287578583,0.5938541293144226,0.1701420694589615
"Carol and Jim are experiencing marital difficulties. They have two school-aged children, a boy and a gid. According to meta-analysis of research on the relationship between marital discord and child behavior problems, it would be expected that",neither child is more likely to manifest an immediate behavior problem than are children of stable marriages,the girl is more likely than the boy to manifest an immediate behavior problem,the boy is more likely than the girl to manifest an immediate behavior problem,both children ore equally likely to manifest an immediate behavior problem,C,True,0.0749157965183258,0.23075690865516663,0.5535570383071899,0.1399611383676529
What are the four tenets of analytical psychotherapy according to Jung?,"Self-regulating psyche, the unconscious, family, therapist–patient relationship","Self-regulating psyche, the unconscious, therapist–patient relationship, stages of self-improvement","Id, ego, superego, libido","Archetypes, unconscious, self-esteem, social needs",B,False,0.3360323905944824,0.3360323905944824,0.20381395518779755,0.12361942231655121
Anxiety induced by reading about an automobile accident some months after having had such an accident best described as an instance of,mediated generalization,higher-order conditioning,latent learning,response shaping,A,False,0.12731711566448212,0.26953035593032837,0.5035489797592163,0.09915466606616974
"A psychologist who shares an office with another psychologist reruns around midnight to retrieve some papers and unexpectedly comes upon the colleague engaging in sexual relations with one of that colleague's clients. According to ethics codes published by the American and Canadian Psychological Associations, the first psychologist should",speak with the colleague privately to resolve this incident informally,"report the colleague to the appropriate local, state/provincial, or national ethics committee",say nothing further regarding this incident unless there is 2 complaint from the client,contact the colleague's client to offer assistance and/or professional advice,B,True,0.07837066799402237,0.397999107837677,0.21303357183933258,0.3099620044231415
An educational psychologist designs a screening test to identify underachieving first- and second-grade children who have a learning disability. The psychologist will probably be most concerned that her test has adequate __________ validity.,content,construct,concurrent,predictive,C,False,0.04111325740814209,0.1266377568244934,0.3900717496871948,0.44200921058654785
"Following the retirement of his business partner, Dr. Sheldon Smythe is the only psychologist in a small town, and the next closest mental health professional works in a town that is over 100 miles away. Several of Dr. Smythe’s new clients have problems for which he has limited training and experience. Dr. Smythe should:",refuse to see the clients.,see these clients but use only interventions that he has experience using.,see the clients and obtain supervision or consultation by telephone.,agree to see these clients only if they are experiencing a crisis.,C,True,0.01190932746976614,0.053373903036117554,0.8349083662033081,0.09971558302640915
Research into ___________ has helped us understand paradoxical reward.,Frustration,Conditioning,Attachment,Homeostasis,A,False,0.06522809714078903,0.1773083657026291,0.6188669800758362,0.13808788359165192
Dr. Mansfield Mayhem receives a subpoena requiring him to testify about a current therapy client at a trial. Dr. Mayhem contacts the client who states that she does not want him to release any confidential information to the court. Dr. Mayhem should:,notify the attorney who issued the subpoena that the client has asserted the privilege and request that he be released from subpoena.,do nothing further until he receives an order from the court to appear at the trial.,notify the court that he will not be appearing at the trial because the client does not want him to do so.,advise the attorney who issued the subpoena that he cannot appear as requested because the client has not given him permission to do so.,A,False,0.06943836063146591,0.12972792983055115,0.7465327382087708,0.05407865345478058
A psychologist working in an elementary school setting asked to evaluate the effectiveness of a new school program that has served 200 to 300 children per year for the past 5 years. Appropriate pre- and postintervention measures are available for each child. The psychologist should choose the dependent variables for the evaluation by,averaging the scores from the tests to increase the reliability and therefore the validity of the measures,choosing from among the tests by selecting the test with the highest reliability,"asking the school principal to provide guidance on the selection of criteria, because the principal will have continuing responsibility for the results","using professional judgment to select from among the tests or combinations of tests, depending upon the goals of the program",D,False,0.07657928019762039,0.3432044982910156,0.3432044982910156,0.2358807921409607
Non- Parametric Tests are used when a study involves nominal or ordinal data or when assumptions of a parametric test are severely violated. When are the CHI-SQUARE TESTS used?,used if research includes nominal (categorical) data,used for rank-ordered data with 2 IVs,when 2 correlated groups are being compared using rank-ordered data,used for an analysis of variance for rank-ordered data,A,False,0.028586087748408318,0.08805134892463684,0.7372449040412903,0.145172119140625
A small bit of meat powder in the dog’s mouth was Pavlov’s ___________.,US,CS,UR,CR,A,False,0.06839558482170105,0.14479345083236694,0.5726692080497742,0.2106732428073883
The American health care system is primarily dominated by which network?,The public sector,The private sector,The VA system,"None, all are equally important",B,False,0.2433154433965683,0.1302373707294464,0.583683431148529,0.04228188470005989
Which of the following is the primary ethical principle guiding the conduct of the practitioner's professional life,Duty to the client,Confidentiality,Duty to the profession,Legal defensibility,A,False,0.21719016134738922,0.14927245676517487,0.5903840065002441,0.042767275124788284
The classic triad of symptoms in Parkinson’s disease is:,"Tremor, executive dysfunction, and rigidity","Tremor, rigidity, and gait imbalance","Tremor, gait imbalance, and paresis","Tremor, rigidity, and bradykinesia",D,False,0.17970257997512817,0.2962794303894043,0.48848220705986023,0.035385534167289734
The research indicates that which of the following therapist factors has the greatest impact on therapy progress?,amount of personal therapy,self-esteem,emotional detachment,empathy,D,False,0.09929309785366058,0.18550395965576172,0.504252016544342,0.21020349860191345
"According to Moscovici (1985), group members espousing the minority position are most likely to change the opinion of the majority when:","""members supporting the minority position have accumulated “idiosyncrasy credits.""""""",members supporting the minority position are consistent in expressing their opinion without appearing dogmatic.,the number of people representing the minority is only slightly less than the number of people representing the majority.,the minority leader is viewed by members of the majority as having legitimate power.,B,True,0.04696086421608925,0.4455522894859314,0.39319851994514465,0.11265325546264648
"A person who is low in self-monitoring (Snyder, 1987) will rely on which of the following when deciding how to act in a particular social situation?",his/her life scripts.,"his/her own feelings, attitudes, and beliefs.",the emotional reactions and behaviors of the people he/she is interacting with.,internal working models that were acquired during infancy and early childhood.,B,False,0.08790657669305801,0.2389548271894455,0.5732228755950928,0.09961118549108505
"When one uses a time-series design to evaluate a program, fluctuation in the outcome slope can be accounted for by various alternative hypotheses. According to Campbell and Stanley, the most probable alternative is that",a simultaneous event produced the fluctuation,"participants dropped out of the group, reducing the size of the sample",aging effects were unduly influential,test—retest reliability is inadequate,A,False,0.2871040999889374,0.2871040999889374,0.3686489760875702,0.05653415247797966
"There are specific research designs and strategies used to gain the desired information. From your knowledge about the research designs and strategies, how does the CORRELATIONAL RESEARCH work?",investigators randomly assigns subjects to different groups and they receive different levels of a manipulated variable,involves the use of intact groups,does not have any internal validity; can’t infer causal relationship,assessing variables as a function of time,C,False,0.15940552949905396,0.382394015789032,0.29780876636505127,0.15940552949905396
"According to Harry Stack Sullivan, which of the following cognitive experiences characterizes schizophrenic behavior:",Parataxic Mode: private symbols and causal connections,Parataxic Distortion Mode: dealing w/ other like they’re from early life,"Prototaxic Mode: discrete, unconnected states, before language",Basic anxiety: feeling of helplessness/isolation in a hostile world,C,True,0.07013112306594849,0.11562667042016983,0.6653856039047241,0.14846760034561157
"The research indicates that, when Total Quality Management (TQM) fails to live up to its potential, this is most often because:",the team leader lacks adequate leadership skills.,there was too much reliance on team (versus individual) effort.,employees were not sufficiently involved in decision-making.,pay and other benefits were not adequately linked to team performance.,C,True,0.0678253322839737,0.12671439349651337,0.5678945183753967,0.23673366010189056
Tonotopic processing of auditory stimuli occurs at which site:,Striate cortex,Heschel’s convolutions,Calcarine sulcus,Pre-central gyrus,B,False,0.38170334696769714,0.26234060525894165,0.3368520140647888,0.019003890454769135
"A person who has difficulty performing a purposeful skilled movement, such as opening a door with a key, despite having intact motor and sensory functioning, most likely has which of the following disorders:",Transcortical motor aphasia,Apraxia,Pure alexia,Agraphia,B,False,0.11090394109487534,0.2660447359085083,0.49703696370124817,0.1256706267595291
One of the most frequent findings of studies on human beings with “split brains” is that,The right hemisphere is predominantly concerned with verbal information,certain kinds of visuospatial tasks are performed beer by the right hemisphere than by the left,the right hemisphere provides backup for the left in some tasks but excels the left in none,"aside from the long-known localization of speech functions, the two hemispheres appear to be essentially equivalent as information processors",B,False,0.07893136888742447,0.14746321737766266,0.583228349685669,0.18934650719165802
The risk of withdrawal delirium is greatest following discontinuation of which of the following substances,Cocaine,LSD,Phenobarbital,Heroin,C,True,0.04965744912624359,0.09277232736349106,0.6049515604972839,0.2521813213825226
"In organizations, the level of affective commitment is likely to be least predictive of which of the following?",job satisfaction,productivity,job motivation,turnover,B,False,0.03718123957514763,0.06946370005607605,0.5816124677658081,0.31131473183631897
___________ has implications for internal validity and ___________ has implications for external validity.,"Causality, generalizability","Random assignment, random selection","Random selection, random assignment","Temporal precedence, nonspuriousness",B,False,0.10239161550998688,0.24562475085258484,0.5199875831604004,0.13147345185279846
Form A of a standardized personality test was given in the fall and again in the spring co the same group of people. The reliability estimate that resulted from this research is referred to as,external consistency,equivalence,stability,internal consistency,C,True,0.11397971957921982,0.3978283107280731,0.45079854130744934,0.03700379654765129
The term “privilege” is best described as:,a general term referring to the right to privacy.,an ethical term referring to an obligation not to reveal conﬁdential information.,the legal equivalent of the ethical concept of confidentiality.,a legal term referring to the protection of conﬁdential information in legal proceedings.,D,False,0.0690537542104721,0.14618681371212006,0.6551638245582581,0.1290093958377838
You receive a letter from the Ethics Committee asking for information about a former client who has filed a complaint against her current therapist. You stopped seeing the client over seven years ago you should:,cooperate with the Committee's request by sending it a copy of the client’s file.,cooperate with the Committee's request by sending it the information you believe to be relevant to the case.,cooperate with the Committee's request by sending it the information you believe to be relevant to the case after confirming that the client has signed a release.,inform the Committee that the information you have about the client is obsolete and that you're ethically obligated not to release it.,C,True,0.15910086035728455,0.2972395122051239,0.43248093128204346,0.10934830456972122
"In terms of age, Erikson’s ________ stage of psychosocial development corresponds to Freud’s phallic stage.",industry vs. inferiority,autonomy vs. shame and doubt,basic trust vs. mistrust,initiative vs. guilt.,D,False,0.05316782370209694,0.23828168213367462,0.6477167010307312,0.0602470338344574
"Dr. Pavel Petrovich, a licensed psychologist, has been seeing a client in therapy for over fourteen months with no apparent change in the client's symptoms. Dr. Petrovich should:",advise the client that he is ethically obligated to terminate therapy.,raise for discussion the possibility of termination and referral to another therapist.,search the literature for discussions of similar cases that have been treated and reported by others.,continue seeing the client since fourteen months is not an unusually long time for therapy to continue without a significant change in symptoms.,B,False,0.051176492124795914,0.22935715317726135,0.6234573125839233,0.09561027586460114
"According to Freud's notion of______, dreams and slips of the tongue are meaningful goal-directed phenomena.",psychic dynamogenesis,reciprocal determinism,psychic determinism,ptyalism,C,True,0.06858830899000168,0.27127203345298767,0.6507477760314941,0.00928241852670908
"Research comparing heterogeneous and homogeneous work groups has found that, in general, heterogeneous groups:",are more creative and better at decision-making.,are more creative but less productive overall.,make better decisions but are less productive overall.,are more creative but worse at decision-making.,A,False,0.07273495942354202,0.11991966515779495,0.6090023517608643,0.19771412014961243
"A psychologist emphasizes that parents should use appropriate consequences when dealing with their children’s misbehavior. In addition, the psychologist explains that the goal of misbehavior can be to confirm an assumed disability, or to get attention, power, or revenge. Which of the following theoretical orientations is being used",Rogerian,Transactional analysis,Adlerian,Psychodynamic,C,True,0.0744968131184578,0.12282447516918182,0.7068061232566833,0.09565579891204834
"There are specific research designs and strategies used to gain the desired information. From your knowledge about the research designs and strategies, in which case is the MULTIPLE BASELINE DESIGN used?",when reversal is not possible,when assignment is not possible,when selection is not possible,when there are not enough data available,A,False,0.06199655681848526,0.1685241162776947,0.6665258407592773,0.10221505165100098
"To incorporate the value of personalismo into therapy, a therapist will:",integrate members of the extended family into the intervention.,maintain a neutral attitude even when family members are discussing unpleasant topics.,display genuine interest in the client by asking about his/her family and work or school.,establish credibility early in therapy by demonstrating knowledge of indigenous healing practices.,C,True,0.03749854117631912,0.24452121555805206,0.5865759253501892,0.13088278472423553
The mother of a previous client of yours asks for a copy of her daughter's records. The daughter saw you for two years and died three months ago when she was 38 years old. You should:,send the mother a copy of the records as requested.,send the mother only the information you believe will not be harmful.,allow the mother to inspect the records in your office.,not release any information to the mother without appropriate authorization.,D,False,0.17373035848140717,0.2864329516887665,0.252776175737381,0.2864329516887665
"According to Fiedler’s contingency model of leadership, high LPC leaders:",are always more effective than low LPC leaders.,are more effective than low LPC leaders in moderately favorable situations.,elicit less trust from supervisees than do low LPC leaders.,elicit less intrinsic motivation from supervisees than do low LPC leaders.,B,False,0.12378714978694916,0.26205742359161377,0.489587664604187,0.12378714978694916
