0,1,2,3,4,5,correct,choiceA_probs,choiceB_probs,choiceC_probs,choiceD_probs
The access matrix approach to protection has the difficulty that,"the matrix, if stored directly, is large and can be clumsy to manage",it is not capable of expressing complex protection requirements,deciding whether a process has access to a resource is undecidable,there is no way to express who has rights to change the access matrix itself,A,False,0.23964433372020721,0.2114853858947754,0.3077094256877899,0.23964433372020721
An integer c is a common divisor of two integers x and y if and only if c is a divisor of x and c is a divisor of y. Which of the following sets of integers could possibly be the set of all common divisors of two integers?,"{-6,-2, -1, 1, 2, 6}","{-6, -2, -1, 0, 1, 2, 6}","{-6, -3, -2, -1, 1, 2, 3, 6}","{-6, -3, -2, -1, 0, 1, 2, 3, 6}",C,True,0.18811966478824615,0.21316751837730408,0.45127561688423157,0.14650774002075195
"In the NoNicks operating system, the time required by a single file-read operation has four nonoverlapping components:
disk seek time-25 msec
disk latency time-8 msec
disk transfer time- 1 msec per 1,000 bytes
operating system overhead-1 msec per 1,000 bytes + 10 msec
In version 1 of the system, the file read retrieved blocks of 1,000 bytes. In version 2, the file read (along with the underlying layout on disk) was modified to retrieve blocks of 4,000 bytes. The ratio of-the time required to read a large file under version 2 to the time required to read the same large file under version 1 is approximately",1:4,1:3.5,1:1,1.1:1,B,False,0.2924041748046875,0.2924041748046875,0.2924041748046875,0.12189219146966934
"You want to cluster 7 points into 3 clusters using the k-Means Clustering algorithm. Suppose after the first iteration, clusters C1, C2 and C3 contain the following two-dimensional points: C1 contains the 2 points: {(0,6), (6,0)} C2 contains the 3 points: {(2,2), (4,4), (6,6)} C3 contains the 2 points: {(5,5), (7,7)} What are the cluster centers computed for these 3 clusters?","C1: (3,3), C2: (4,4), C3: (6,6)","C1: (3,3), C2: (6,6), C3: (12,12)","C1: (6,6), C2: (12,12), C3: (12,12)","C1: (0,0), C2: (48,48), C3: (35,35)",A,False,0.03344682604074478,0.05514448508620262,0.3173346221446991,0.592859148979187
Any set of Boolean operators that is sufficient to represent all Boolean expressions is said to be complete. Which of the following is NOT complete?,"{AND, NOT}","{NOT, OR}","{AND, OR}",{NAND},C,True,0.05576236918568611,0.06318704038858414,0.4668926000595093,0.41203126311302185
"Consider the collection of all undirected graphs with 10 nodes and 6 edges. Let M and m, respectively, be the maximum and minimum number of connected components in any graph in the collection. If a graph has no selfloops and there is at most one edge between any pair of nodes, which of the following is true?","M = 10, m = 10","M = 10, m = 1","M = 7, m = 4","M = 6, m = 4",C,True,0.11445270478725433,0.24229638278484344,0.5129414200782776,0.12969189882278442
"Resolution theorem proving for showing that a formula of propositional logic is not satisfiable has which of the following properties?
I. It is a sound proof system in the sense that there does not exist a proof of the unsatisfiability of a satisfiable formula of propositional logic.
II. It is a complete proof system in the sense that there is a proof of unsatisfiability for every unsa tisfiable formula of propositional logic.
III. It is a succinct proof system in the sense that whenever an unsatisfiable formula F of propositional logic has a resolution proof, F also has a proof whose length is polynomial in the length of F.",I only,III only,I and II only,I and III only,C,True,0.06628663837909698,0.10928818583488464,0.4322431683540344,0.33663132786750793
"Which of the following statements describe(s) properties of a purely segmented memory system?
I. It divides memory into units of equal size.
II. It permits implementation of virtual memory.
III. It suffers from internal fragmentation.",I only,II only,III only,I and III,B,False,0.0018783980049192905,0.0074292076751589775,0.015727633610367775,0.9730342626571655
Which of the following statements about floating-point arithmetic is NOT true?,It is inherently nonassociative because some numbers have no exact representation.,It is inherently nonassociative because there have to be upper and lower bounds on the size of numbers.,Associativity can be achieved with appropriate roundoff conventions.,Some rational numbers have no exact representation.,C,True,0.1349097043275833,0.1962924748659134,0.41555115580558777,0.25204452872276306
"Suppose sharing of tiles in a multilevel directory structure is achieved with directory entries that are links pointing to a node containing information about a shared file. Information in this node includes (1) the owner of the file, (2) a count of the number of links to the tile, and (3) the disk block numbers of the file. What is a primary drawback to this approach to sharing?","If the owner modifies the file, another user who does not share will see the changes.","If the owner renames the file, other users will not be able to access it.","If the owner is allowed to delete a file, dangling links may result.","If any user who shares the file appends to it, others who share it will not be able to access the new disk blocks.",C,True,0.2227361500263214,0.25239312648773193,0.3240791857242584,0.1965639591217041
"Mergesort works by splitting a list of n numbers in half, sorting each half recursively, and merging the two halves. Which of the following data structures will allow mergesort to work in O(n log n) time?
I. A singly linked list
II. A doubly linked list
III. An array",,III only,I and II only,"I, II, and III",D,True,0.0818038135766983,0.07219161838293076,0.285523384809494,0.4707484841346741
"If p(x) is the minimal-degree interpolating polynomial for the real-valued function f(x) at the n + 1 distinct real numbers x0, .... xn what is the maximum possible degree of p(x)?",n,n + 1,n + 2,2n,A,False,0.0603858083486557,0.23883050680160522,0.3937649130821228,0.30666443705558777
"An internal hash table has 5 buckets, numbered 0, 1, 2, 3, 4. Keys are integers, and the hash function h(i) = i mod 5 is used, with linear resolution of collisions (i.e., if bucket h(i) is filled, the buckets h(i) + 1, h(i) + 2, ... are tried successively with all bucket numbers computed modulo 5). If elements with keys 13, 8, 24, 10, and 3 are inserted, m that order, into an initially blank hash table, then the content of the bucket numbered 2 is",3,8,10,13,A,False,0.18037980794906616,0.23161225020885468,0.3818640410900116,0.20439709722995758
TCP protocol is responsible (among other things) for,Routing packets through the network,Reliable delivery of packets between directly connected machines,Reliable delivery of large (multi-packet) messages between machines that are not necessarily directly connected,Dealing with differences among operating system architectures,C,True,0.2656879425048828,0.16114787757396698,0.5624613165855408,0.010301838628947735
"Let A and B be two sets of words (strings) from Σ*, for some alphabet of symbols Σ. Suppose that B is a subset of A. Which of the following statements must always be true of A and B ?
I. If A is finite, then B is finite.
II. If A is regular, then B is regular.
III. If A is context-free, then B is context-free.",I only,II only,III only,I and II only,A,False,0.08732358366250992,0.1439722329378128,0.18486401438713074,0.5694212317466736
"For all strings x, the function x^M is defined recursively as follows.
e^M= e, and
if w is a string and a is a string with length 1, then
(aw)^M = aw^Ma.
Let a be a string with length 1, and let x and y be arbitrary strings. Which of the following is true?",a^M = a,(ax)^M = (xa)^M,(xy)^M = y^Mx^M,None of the above,D,False,0.1176312193274498,0.13329364359378815,0.5973806381225586,0.15104147791862488
Which of the following is NOT a reasonable justification for choosing to busy-wait on an asynchronous event?,The wait is expected to be short.,A busy-wait loop is easier to code than an interrupt handler.,There is no other work for the processor to do.,The program executes on a time-sharing system.,D,False,0.0897570475935936,0.0792103260755539,0.5165161490440369,0.31328290700912476
The language {ww | w in (0 + 1)*} is,not accepted by any Turing machine,"accepted by some Turing machine, but by no pushdown automaton","accepted by some pushdown automaton, but not context-free","context-free, but not regular",B,False,0.048538777977228165,0.08002691715955734,0.5913233757019043,0.2793214023113251
Which of the following statements about Ethernets is typically FALSE?,Ethernets use circuit switching to send messages.,Ethernets use buses with multiple masters.,Ethernet protocols use a collision-detection method to ensure that messages are transmitted properly.,Networks connected by Ethernets are limited in length to a few hundred meters.,A,False,0.11965874582529068,0.17410244047641754,0.417650043964386,0.2870464026927948
"Let P be a procedure that for some inputs calls itself (i.e., is recursive). If P is guaranteed to terminate, which of the following statements must be true?
I. P has a local variable.
II. P has an execution path where it does not call itself.
III. P either refers to a global variable or has at least one parameter.",I only,II only,I and II only,II and III only,D,True,0.04251890257000923,0.11557836085557938,0.3141745626926422,0.5179862976074219
Which of the following comes closest to being a perfectly secure encryption scheme?,"The Caesar Cipher, a substitution cipher","DES (Data Encryption Standard), a symmetric-key algorithm","Enigma, a transposition cipher",One-time pad,D,False,0.08888785541057587,0.14655129611492157,0.7442489266395569,0.019833561033010483
"Of the following problems concerning a given undirected graph G, which is currently known to be solvable in polynomial time?",Finding a longest simple cycle in G,Finding a shortest cycle in G,Finding ALL spanning trees of G,Finding a largest clique in G,B,False,0.3377761244773865,0.12426088750362396,0.4914613366127014,0.045713022351264954
The IP protocol is primarily concerned with,Routing packets through the network,Reliable delivery of packets between directly connected machines,Reliable delivery of large (multi-packet) messages between machines that are not necessarily directly connected,Dealing with differences among operating system architectures,A,False,0.18770185112953186,0.1461823433637619,0.6551437973976135,0.010589413344860077
"Of the following, which best approximates the ratio of the number of nonterminal nodes to the total number of nodes in a complete K-ary tree of depth N?",1/K,K-1/K,log_10 (1/N),N-1/m,A,False,0.12866319715976715,0.16520681977272034,0.5766284465789795,0.12866319715976715
"Consider a computer system in which processes can request and release one or more resources. Once a process has been granted a resource, the process has exclusive use of that resource until it is released. If a process requests a resource that is already in use, the process enters a queue for that resource, waiting until the resource is available. Which of the following will NOT deal effectively with the problem of deadlock?",Giving priorities to processes and ordering the wait queues by priority,"Having a process request all its required resources when it first begins, and restarting if it cannot obtain them all",Numbering the resources and requiring that processes request resources in order of increasing number,Having processes time out and restart after a random interval of waiting,A,False,0.13436053693294525,0.22152307629585266,0.4689643383026123,0.17252235114574432
"""Magic memory""' has two operations: Read and Clear. Both are indivisible and mutually exclusive. Clear sets the magic memory to zero. Read returns a value that represents the number of Read operations since the last Clear operation. Which of the following is (are) true of ""Magic memory""?
I. It can provide the functionality of an atomic Test-and-Set.
II. It can be used to coordinate processes running on a shared-memory multiprocessor.
III. It is only useful on a multiprocessor.",I only,II only,III only,I and II,D,True,0.01504316832870245,0.04633622244000435,0.01504316832870245,0.8213291168212891
Which of the following is the name of the data structure in a compiler that is responsible for managing information about variables and their attributes?,Abstract Syntax Tree (AST),Attribute Grammar,Symbol Table,Semantic Stack,C,False,0.42848843336105347,0.20240360498428345,0.33370712399482727,0.0351724736392498
Which of the following algorithms has running time Θ(n^2) in the worst case but Θ(n log n) on average?,Bubblesort,Mergesort,Heapsort,Quicksort,D,False,0.07827068120241165,0.07827068120241165,0.6553523540496826,0.1877616047859192
"Languages with a structure that implements abstract data types (e.g., a C++ class) can prevent access to components of this structure by all operations except those that are part of this structure. However, definitions of such a structure often contain declarations of components of the structure (e.g., the header file for a C++ class may contain declarations of its private components). For such a language, an object's name could be bound at run time to stack storage for its component values (direct representation) or to a stack pointer referencing heap storage for its component values (indirect representation). Which of the following statements about comparisons between direct and indirect representations is (are) true?
I. Indirect representation noticeably increases compilation time.
II. Direct representation decreases the time needed to access components of a variable.
III. When the storage size of some private component of a variable changes, indirect representation minimizes the number of recompilations of source modules that must be performed.",I only,III only,I and II only,II and III only,D,True,0.07380679249763489,0.15624898672103882,0.330779105424881,0.37482184171676636
Which of the following is NOT a property of bitmap graphics?,Fast hardware exists to move blocks of pixels efficiently.,Realistic lighting and shading can be done.,All line segments can be displayed as straight.,Polygons can be filled with solid colors and textures.,C,True,0.13140656054019928,0.19119539856910706,0.45865392684936523,0.2166527807712555
Which of the following is true of interrupts?,"They are generated when memory cycles are ""stolen"".",They are used in place of data channels.,They can indicate completion of an I/O operation.,They cannot be generated by arithmetic operations.,C,True,0.21297121047973633,0.12917356193065643,0.5789157152175903,0.07834772020578384
"In a height-balanced binary search tree, the heights of the left and right descendents of any node differ by at most 1. Which of the following are true of such a tree?
I. Worst-case search time is logarithmic in the number of nodes.
II. Average-case search time is logarithmic in the number of nodes.
III. Best-case search time is proportional to the height of the tree.
IV. The height of the tree is logarithmic in the number of nodes.",I and III only,II and III only,II and IV only,"I, II, and IV",D,True,0.04340004175901413,0.09187788516283035,0.08108194917440414,0.7692841291427612
"Bob writes down a number between 1 and 1,000. Mary must identify that number by asking ""yes/no"" questions of Bob. Mary knows that Bob always tells the truth. If Mary uses an optimal strategy, then she will determine the answer at the end of exactly how many questions in the worst case?","1,000",999,500,10,D,False,0.12132246792316437,0.2910374701023102,0.4798396825790405,0.10706670582294464
"Which of the following is (are) true about virtual memory systems that use pages?
I. The virtual address space can be larger than the amount of physical memory.
II. Programs must be resident in main memory throughout their execution.
III. Pages correspond to semantic characteristics of the program.",I only,II only,I and II,I and III,A,False,0.047657132148742676,0.047657132148742676,0.24202290177345276,0.6578863859176636
Which of the following is usually NOT represented in a subroutine's activation record frame for a stack-based programming language?,Values of local variables,A heap area,The return address,Stack pointer for the calling activation record,B,False,0.14110000431537628,0.15988725423812866,0.4924874007701874,0.2052992880344391
Which of the following statements about a remote procedure call is true?,It is used to call procedures with addresses that are farther than 2^16 bytes away.,It cannot return a value.,It cannot pass parameters by reference.,It cannot call procedures implemented in a different language.,C,True,0.17724989354610443,0.1380423605442047,0.4252004027366638,0.2578970789909363
"Of the following sorting algorithms, which has a running time that is LEAST dependent on the initial ordering of the input?",Insertion sort,Quicksort,Merge sort,Selection sort,C,True,0.16742102801799774,0.2149728536605835,0.5156930685043335,0.10154598206281662
"A particular parallel program computation requires 100 seconds when executed on a single processor. If 40 percent of this computation is ""inherently sequential"" (i.e., will not benefit from additional processors), then the theoretically best possible elapsed times for this program running with 2 and 4 processors, respectively, are",20 and 10 seconds,30 and 15 seconds,50 and 25 seconds,70 and 55 seconds,D,False,0.07961233705282211,0.2452232986688614,0.4581374228000641,0.21640880405902863
"Consider the representation of six-bit numbers by two's complement, one's complement, or by sign and magnitude. In which representation is there overflow from the addition of the integers 011000 and 011000?",Two's complement only,Sign and magnitude and one's complement only,Two's complement and one's complement only,All three representations,D,False,0.3102443218231201,0.08888647705316544,0.5115063786506653,0.08888647705316544
"Of the following, which best characterizes computers that use memory-mapped I/O?",The computer provides special instructions for manipulating I/O ports.,I/O ports are placed at addresses on the bus and are accessed just like other memory locations.,"To perform an I/O operation, it is sufficient to place the data in an address register and call the channel to perform the operation.",Ports are referenced only by memory-mapped instructions of the computer and are located at hardwired memory locations.,B,False,0.24755172431468964,0.21846362948417664,0.46248748898506165,0.07092475146055222
Many cryptographic protocols base their security on assumptions about the computational difficulty of integer factorization. Integer factorization serves this purpose because we believe that,"integer multiplication is a function whose inverse, factorization, remains difficult for a large class of inputs",P = NP,"even if P = NP, integer factorization is still likely not to be polynomial-time computable",testing primality is computationally intractable,A,True,0.42569485306739807,0.25819697976112366,0.25819697976112366,0.057611532509326935
Which of the following sets of bit strings CANNOT be described with a regular expression?,All bit strings whose number of zeros is a multiple of five,All bit strings starting with a zero and ending with a one,All bit strings with an even number of zeros,All bit strings with more ones than zeros,D,False,0.19284361600875854,0.15018676221370697,0.46260780096054077,0.19284361600875854
"Which of the following conditions can be expressed by a Boolean formula in the Boolean variables p_1, p_2, p_3, p_4 and the connectives ∧,∨ (without ¬)?
I. At least three of p_1, p_2, p_3, p_4 are true.
II. Exactly three of p_1, p_2, p_3, p_4 are true.
III. An even number of p_1, p_2, p_3, p_4 are true.",I only,II only,III only,I and III,A,False,0.0010820196475833654,0.0040201907977461815,0.023134596645832062,0.8681193590164185
"Two alternatives for interconnecting a set of processors with bidirectional links are (1) the fully interconnected network, in which each processor is directly connected to every other processor, and (2) the ring network, in which each processor is connected to two other processors. The worst-case path length for a network is the maximum, over all pairs of nodes in the network, of the minimum length paths (measured in number of links) between the nodes. For each type of interconnection of n processors, a figure of merit can be formed as the product of the number of links required for the network times the worst-case path length connecting any two processors. The ratio of this figure of merit for the fully interconnected network compared to that of the ring network, for even n > 2, is",1/(n^2),1/(n(n-1)),1/n,(n-1)/n,D,False,0.2639921307563782,0.2991422712802887,0.3389725983142853,0.09711728245019913
"For a connected, undirected graph G = (V, E), which of the following must be true?
I. Σ_{v∈V} degree(v) is even.
II. |E| ≥ |V| − 1
III. G has at least one vertex with degree 1.",I only,II only,III only,I and II,D,True,0.057364899665117264,0.07365798205137253,0.06500294804573059,0.7918980121612549
"In multiprogrammed systems it is advantageous if some programs such as editors and compilers can be shared by several users. Which of the following must be true of multiprogrammed systems in order that a single copy of a program can be shared by several users?
I. The program is a macro.
II. The program is recursive.
III. The program is reentrant.",I only,II only,III only,II and III only,C,False,0.03162066638469696,0.20619264245033264,0.26475661993026733,0.49463045597076416
Which of the following decimal numbers has an exact representation in binary notation?,0.1,0.2,0.3,0.5,D,False,0.16716694831848145,0.10139186680316925,0.45440682768821716,0.27561166882514954
"Function signatures describe the types of the arguments to a function as well as the return value of the function. For instance, the addition function on reals has a signature of
add : real x real -> real
since it takes two real numbers and returns a real number. But, for a language that allows functions as return values, addition could be considered to have the signature
add : real -> (real -> real)
which means that add takes a single real (the first operand) and returns a new function that itself takes a single real (the second operand) and returns a real (the result). This process of reducing a function with multiple arguments to a function with fewer arguments is called currying. Which of the following is correct?",Currying can be applied to any function to the point where it has exactly one input argument.,Currying cannot be applied to functions of more than two arguments.,Currying cannot be applied to functions that return functions as arguments.,Currying cannot be applied w functions that haw arguments that are functions.,A,False,0.20179617404937744,0.1571590155363083,0.37700486183166504,0.2591114044189453
"Array A contains 256 elements of 4 bytes each. Its first element is stored at physical address 4,096.
Array B contains 512 elements of 4 bytes each. Its first element is stored at physical address 8,192.
Assume that only arrays A and B can be cached in an initially empty, physically addressed, physically tagged, direct-mapped, 2K-byte cache with an 8-byte block size. The following loop is then executed.
for (i = 0; i < 256; i++)
        A[i] = A[i] + B[2*i];
During the execution of the loop, how many bytes will be written to memory if the cache has a write-back policy?",0,256,1024,2000,A,False,0.17428433895111084,0.19749000668525696,0.4737538993358612,0.15380537509918213
"In which of the following representations of numbers by 8-bit words is the addition of the integers 109 and -42 within range?
I. One's complement
II. Two's complement
III. Sign and magnitude",I only,II only,I and II only,"I, II, and III",D,True,0.04212677478790283,0.08918237686157227,0.3527231812477112,0.5132091641426086
If a malicious process is granted temporary administrator-level access to a system,the threat is over as soon as the process is killed,the threat is over after the operating system is rebooted,the thread is over after rebooting the machine and replacing files that show a virus infection,the threat is often permanent until the entire disk is wiped clean,D,True,0.08174659311771393,0.13477735221385956,0.3663628101348877,0.4151434600353241
"Which of the following statements about horizontal versus vertical microarchitecture is (are) true?
I. Programs for horizontal architectures require more time steps than those for vertical architectures.
II. Horizontal microinstructions are unencoded.
III. Horizontal microinstructions usually have a single opcode and multiple operand specifiers.",I only,II only,III only,II and III only,B,False,0.018646659329533577,0.17691458761692047,0.17691458761692047,0.6174925565719604
"A ""strictly binary tree"" is a binary tree in which every node that is not a leaf has two children. Suppose that for a class of strictly binary trees there exists c > 0 such that, for any tree in the class, the ratio of the lengths of any two root-to-leaf paths is bounded above by c. Which of the following best characterizes the height h of any tree in this class, where N is the number of nodes in the tree and N > 1 ?",h <= log2(N),h = 1/c * log2(N),h < c log2(N),h > c log2(N),C,False,0.3465726971626282,0.23819571733474731,0.26991111040115356,0.14447300136089325
Which of the following sorting algorithms has average-case and worst-case running times of O(n log n)?,Bubble sort,Insertion sort,Merge sort,Quicksort,C,True,0.11253637075424194,0.14449955523014069,0.5043529868125916,0.23823949694633484
