0,1,2,3,4,5,correct,choiceA_probs,choiceB_probs,choiceC_probs,choiceD_probs
"Consider the following equations concerning a stack module that has the operations Push, Pop, Top, and IsEmpty. Which of the equations does NOT represent the conventional semantics of a stack?","IsEmpty(Push(Stack,Elem)) = true","Pop(Push(Stack,Elem)) = Stack","Top(Push(Stack,Elem)) = Elem","IsEmpty(Push(Push(Stack,Elem1),Elem2)) = false",A,False,0.11554908007383347,0.1483679562807083,0.45700547099113464,0.27718785405158997
"Assume that any assignment statement can be executed in unit time. If as many identical processors as needed are used, what is the minimum number of time units needed to execute the assignments
A := B + C
B := A - B
C := A * E
D := A/F
E := B - C
F := A + B
with the same result as if the assignments were executed in the order shown?",1,2,3,4,C,True,0.14811091125011444,0.1678316742181778,0.45621371269226074,0.2155001163482666
"Two expressions E and F are said to be unifiable if there are substitutions for the variables of E and F that make the expressions lexically identical. In the following three expressions, only w, x, y, and z are variables.
I. f(w,w)
II. f(x,1)
III. f(y,g(z))
Which pairs of these expressions is (are) pairs of unifiable expressions?","(I, II) only","(I, III) only","(II, III) only","(I, II) and (I, III) only",D,False,0.14225322008132935,0.18265675008296967,0.43817079067230225,0.23453593254089355
Which of the following instruction-set features is NOT generally considered an obstacle to aggressive pipelining of an integer unit?,Condition codes set by every instruction,Variable-length encoding of instructions,Instructions requiring widely varying numbers of cycles to execute,Several different classes (sets) of registers,D,False,0.137942373752594,0.137942373752594,0.5455726385116577,0.17712150514125824
"Let k >= 2. Let L be the set of strings in {0, 1}^* such that x \in L if and only if the number of 0's in x is divisible by k and the number of 1's in x is odd. The minimum number of states in a deterministic finite automaton (DFA) that recognizes L is",k + 2,2k,k log k,k^2,B,False,0.12438356876373291,0.23237907886505127,0.5574484467506409,0.0854874923825264
"Let G = (V, E) be a finite directed acyclic graph with |E| > 0. Which of the following must be true?
I. G has a vertex with no incoming edge.
II. G has a vertex with no outgoing edge.
III. G has an isolated vertex, that is, one with neither an incoming edge nor an outgoing edge.",I only,II only,III only,I and II only,D,True,0.06379644572734833,0.11918744444847107,0.19650688767433167,0.6052838563919067
"Let T be a depth-first search tree of a connected undirected graph G. For each vertex v of T, let pre(v) be the number of nodes visited up to and including v during a preorder traversal of T, and post(v) be the number of nodes visited up to and including v during a postorder traversal of T. The lowest common ancestor of vertices u and v in T is a vertex w of T such that w is an ancestor of both u and v, and no child of w is an ancestor of both u and v. Let (u, v) be an edge in G that is not in T, such that pre(u) < pre(v). Which of the following statements about u and v must be true?
I. post(u) < post(v)
II. u is an ancestor of v in T.
III. If w is the lowest common ancestor of u and v in T, then w = u.",I only,II only,III only,II and III,D,True,0.016774803400039673,0.08518947660923004,0.38179275393486023,0.49023160338401794
"In systems with support for automatic memory management, a garbage collector typically has the responsibility for reclaiming allocated memory objects whose contents cannot affect any future legal computation. Such objects are identified by determining that they cannot be reached from a root set. Which of the following is NOT part of the root set in a typical garbage collector?",Actual parameters of the active procedures,Dynamically allocated objects on the heap,Global variables of the program,Local variables on the call stack,B,False,0.19168953597545624,0.16916540265083313,0.5210661292076111,0.11626557260751724
"In the Internet Protocol (IP) suite of protocols, which of the following best describes the purpose of the Address Resolution Protocol?",To translate Web addresses to host names,To determine the IP address of a given host name,To determine the hardware address of a given host name,To determine the hardware address of a given IP address,D,False,0.08051731437444687,0.21886874735355377,0.6741632223129272,0.02614014409482479
Which of the following language features requires that stack-based storage allocation be used rather than static allocation?,Recursive procedures,Arbitrary goto's,Two-dimensional arrays,Integer-valued functions,A,False,0.08074454963207245,0.07125680893659592,0.6760658621788025,0.1709362119436264
"Which of the following is not a sentence that is generated by the grammar A -> BC, B -> x|Bx, C -> B|D, D -> y|Ey, E -> z?",xyz,xy,xxzy,xxxxy,A,False,0.1700333207845688,0.11686207354068756,0.4621984660625458,0.2473970204591751
Let T (n) be defined by T(1) = 7 and T(n + 1) = 3n + T(n) for all integers n ≥ 1. Which of the following represents the order of growth of T(n) as a function of n?,Θ(n),Θ(n log n),Θ(n^2),Θ(n^2 log n),C,True,0.13136106729507446,0.2780913710594177,0.5195430517196655,0.0703125074505806
"Which of the following problems is (are) decidable?
I. Given a (finite) string w, is w a prefix of the decimal expansion of π?
II. Given a program and an input, is the program’s output the decimal expansion of π?
III. Given a program that takes as input a prefix of the decimal expansion of π, is the program’s output always the same for every prefix?",I only,II only,III only,I and II only,A,False,0.0985456183552742,0.1841074824333191,0.208621084690094,0.5004559755325317
"Which of the following statements about circuits is (are) true?
I. Combinational circuits may have feedback; sequential circuits do not.
II. Combinational circuits have a ""memoryless"" property; sequential circuits do not.
III. Both sequential and combinational circuits must be controlled by an external clock.",I only,II only,I and II only,II and III only,B,False,0.056268081068992615,0.1191195398569107,0.28575292229652405,0.5338566899299622
"Two single-user workstations are attached to the same local area network. On one of these workstations, file pages are accessed over the network from a file server; the average access time per page is 0.1 second. On the other of these workstations, file pages are accessed from a local disk; the average access time per page is 0.05 second. A particular compilation requires 30 seconds of computation and 200 file page accesses. What is the ratio of the total time required by this compilation if run on the diskless (file server) workstation to the total time required if run on the workstation with the local disk, if it is assumed that computation is not overlapped with file access?",1/1,5/4,5/3,10/5,B,False,0.13365602493286133,0.2497023046016693,0.363314688205719,0.2497023046016693
"Assume that a debugger places a breakpoint at a load instruction at virtual address 0x77E81234 (hexadecimal notation) in a debugged process P. If the text segment of P begins at 0x77E80000 in P’s virtual address space and if the debugger has mapped this same text segment at 0x01000000 in its virtual address space, which of the following is the virtual address used by the debugger in its WRITE operation, along with a description of how the debugger has mapped the virtual memory page containing this address?",0x01001234; page mapped with READ/WRITE access,0x01001234; page mapped with COPY-ON-WRITE access,0x76E81234; page mapped with READ/WRITE access,0x76E81234; page mapped with COPY-ON-WRITE access,A,False,0.1387266218662262,0.2936842739582062,0.4273080825805664,0.1387266218662262
"Which of the following considerations applies (apply) to choosing the page size in a paging system?
I. An advantage of larger pages is that they lead to smaller page tables.
II. An advantage of smaller pages is that they lead to less waste due to internal fragmentation.
III. Normally, the dominant factor in disk access time is not dependent on page length, so longer pages can be used advantageously.",I only,II only,I and III only,"I, II, and III",D,True,0.025507992133498192,0.10088607668876648,0.18848000466823578,0.6578598022460938
"Two processors, M-5 and M-7, implement the same instruction set. Processor M-5 uses a 5-stage pipeline and a clock cycle of 10 nanoseconds. Processor M-7 uses a 7-stage pipeline and a clock cycle of 7.5 nanoseconds. Which of the following is (are) true?
I. M-7’s pipeline has better maximum throughput than M-5’s pipeline.
II. The latency of a single instruction is shorter on M-7’s pipeline than on M-5’s pipeline.
III. Programs executing on M-7 will always run faster than programs executing on M-5.",I only,II only,I and III,II and III,A,False,0.03174440935254097,0.052337680011987686,0.2069995403289795,0.6376034617424011
"Which of the following pairs of 8-bit, two's-complement numbers will result in overflow when the members of the pairs are added?","11111111, 00000001","00000001, 10000000","11111111, 10000001","10000001, 10101010",D,False,0.14979727566242218,0.16974256932735443,0.4614081084728241,0.21795377135276794
"Two computers communicate with each other by sending data packets across a local area network. The size of these packets is 1,000 bytes. The network has the capacity to carry 1,000 packets per second. The CPU time required to execute the network protocol to send one packet is 10 milliseconds. The maximum rate at which one computer can send data to another is approximately","10,000 bytes/second","25,000 bytes/ second","100,000 bytes/ second","500,000 bytes/ second",C,False,0.2434753179550171,0.31262850761413574,0.2758936882019043,0.16733798384666443
"Consider the following grammar.
S → ( S )
S → x
Which of the following statements is (are) true?
I. The grammar is ambiguous.
II. The grammar is suitable for top-down parsing.
III. The grammar is suitable for bottom-up parsing.",I only,II only,III only,II and III only,D,True,0.010390753857791424,0.18418051302433014,0.2087038904428482,0.567315936088562
Hash tables can contribute to an efficient average-case solution for all of the problems described below EXCEPT:,"Counting distinct values: Given a set of n keys, determine the number of distinct key values.","Dynamic dictionary: Support the operations of insert, delete, and search in a dictionary.","Range search: Given values a and b, find all the records whose key value is in the range a, b.","Symbol table lookup: Given a program identifier, find its type and address.",C,True,0.09732924401760101,0.14161323010921478,0.4942787289619446,0.26456835865974426
"Let A be a finite set with m elements, and let B be a finite set with n elements. The number of distinct functions mapping A into B is",n^m,n!/(n - m)!,n!,n!/(m!(n - m)!),A,False,0.04758482053875923,0.2738317549228668,0.5115850567817688,0.166087344288826
"To compute the matrix product M_1M_2, where M_1 has p rows and q columns and where M_2 has q rows and r columns, takes time proportional to pqr, and the result is a matrix of p rows and r columns. Consider the product of three matrices N_1N_2N_3 that have, respectively, w rows and x columns, x rows and y columns, and y rows and z columns. Under what condition will it take less time to compute the product as (N_1N_2)N_3 (i.e., multiply the first two matrices first) than to compute it as N_1(N_2 N_3)?","There is no such condition; i.e., they will always take the same time.",1/x + 1/z < 1/w + 1/y,x > y,1/w + 1/x < 1/y + 1/z,B,False,0.061999671161174774,0.10222017019987106,0.5191168785095215,0.3148603141307831
"The hit ratio of a cache memory is the percentage of accesses (reads and writes) for which data are found in the cache. Write-through is a policy whereby every write operation updates main memory. Write-back is a policy whereby a write operation to a line found in the cache does not affect main memory until the line is evicted from the cache. Write-allocation is a policy whereby a cache line is allocated and loaded on a write-miss. If it is assumed that write-allocation is always used, which of the following is true?",Write-back usually results in a better hit ratio than write-through.,Write-through usually results in a better hit ratio than write-back.,The percentage of write operations resulting in a main memory operation will never be larger for write-back than for write-through.,The percentage of write operations resulting in a main memory operation will never be larger for writethrough than for write-back.,C,True,0.22664238512516022,0.12131292372941971,0.423423707485199,0.22664238512516022
"A particular disk unit uses a bit string to record the occupancy or vacancy of its tracks, with O denoting vacant and 1 denoting occupied. A 32-bit segment of this string has the hexadecimal value D4FE2003. The percentage of occupied tracks for the corresponding part of the disk, to the nearest percent, is",12%,25%,38%,44%,D,False,0.08125802874565125,0.10433737188577652,0.5298689007759094,0.28361839056015015
"An Euler circuit of an undirected graph is a circuit in which each edge of the graph appears exactly once. Which of the following undirected graphs must have an Euler circuit?
I. A complete graph with 12 vertices
II. A complete graph with 13 vertices
III. A tree with 13 vertices",I only,II only,III only,I and II,B,False,0.10841470211744308,0.17874562740325928,0.09567563980817795,0.550575315952301
Which of the following characteristics of a programming language is best specified using a context-free grammar?,Identifier length,Maximum level of nesting,Operator precedence,Type compatibility,C,True,0.17937329411506653,0.08472993969917297,0.6260743141174316,0.10879538953304291
"Which of the following statements about datagrams sent by a node in a network using IPv4 protocol is (are) true?
I. Datagrams at the source must be the size of the smallest maximum transmission unit (MTU) of all the links on a path to the destination.
II. Datagrams may be fragmented during routing.
III. Datagrams are reassembled only at the destination.",I only,II only,III only,II and III,D,True,0.004338419530540705,0.08713947981595993,0.07690032571554184,0.8267564177513123
A starvation-free job-scheduling policy guarantees that no job waits indefinitely for service. Which of the following job-scheduling policies is starvation-free?,Round-robin,Priority queuing,Shortest job first,Youngest job first,A,False,0.08358287066221237,0.0947117954492569,0.6998308300971985,0.12161234766244888
"Of the following, which gives the best upper bound for the value of f(N) where f is a solution to the recurrence f(2N + 1) = f(2N) = f(N) + log N for N >= 1, with f(1) = 0?",O(log N),O(N log N),O(log N) + 0(1),O((log N)^2),D,False,0.28399473428726196,0.32180818915367126,0.32180818915367126,0.07180511206388474
"Company X shipped 5 computer chips, 1 of which was defective, and Company Y shipped 4 computer chips, 2 of which were defective. One computer chip is to be chosen uniformly at random from the 9 chips shipped by the companies. If the chosen chip is found to be defective, what is the probability that the chip came from Company Y?",2 / 9,4 / 9,1 / 2,2 / 3,D,False,0.11770555377006531,0.31995686888694763,0.4108327329158783,0.15113693475723267
"Which of the following problems can be solved by a standard greedy algorithm?
I. Finding a minimum spanning tree in an undirected graph with positive-integer edge weights
II. Finding a maximum clique in an undirected graph
III. Finding a maximum flow from a source node to a sink node in a directed graph with positive-integer edge capacities",I only,II only,III only,I and II only,A,False,0.07909195125102997,0.10155608505010605,0.1477632224559784,0.6622288227081299
"A program that checks spelling works in the following way. A hash table has been defined in which each entry is a Boolean variable initialized to false. A hash function has been applied to each word in the dictionary, and the appropriate entry in the hash table has been set to true. To check the spelling in a document, the hash function is applied to every word in the document, and the appropriate entry in the hash table is examined. Which of the following is (are) correct?
I. true means the word was in the dictionary.
II. false means the word was not in the dictionary.
III. Hash table size should increase with document size.",I only,II only,I and II only,II and III only,B,False,0.0675913617014885,0.12627728283405304,0.34325724840164185,0.44075101613998413
"One approach to handling fuzzy logic data might be to design a computer using ternary (base-3) logic so that data could be stored as “true,” “false,” and “unknown.” If each ternary logic element is called a flit, how many flits are required to represent at least 256 different values?",4,5,6,7,C,True,0.11698193103075027,0.1928706020116806,0.4083070456981659,0.2806250751018524
"Local caching of files is common in distributed file systems, but it has the disadvantage that",Temporary inconsistencies among views of a file by different machines can result,The file system is likely to be corrupted when a computer crashes,A much higher amount of network traffic results,Caching makes file migration impossible,A,True,0.391617089509964,0.18498681485652924,0.2375277727842331,0.18498681485652924
"Array A contains 256 elements of 4 bytes each. Its first element is stored at physical address 4,096.
Array B contains 512 elements of 4 bytes each. Its first element is stored at physical address 8,192.
Assume that only arrays A and B can be cached in an initially empty, physically addressed, physically tagged, direct-mapped, 2K-byte cache with an 8-byte block size. The following loop is then executed.
for (i = 0; i < 256; i++)
        A[i] = A[i] + B[2*i];
During the execution of the loop, how many bytes will be written to memory if the cache has a write-through policy?",0,256,1024,2048,C,True,0.15745805203914642,0.17842337489128113,0.4850049614906311,0.17842337489128113
"At time 0, five jobs are available for execution on a single processor, with service times of 25, 15, 5, 3, and 2 time units. Which of the following is the minimum value of the average completion time of these jobs?",50,208/5,92/5,10,C,True,0.11458825320005417,0.24258334934711456,0.4532053470611572,0.18892408907413483
"Let G = (V, E) be a connected, undirected graph, and let a and b be two distinct vertices in V. Let P_1 be the problem of finding a shortest simple path between a and b, and let P_2 be the problem of finding a longest simple path between a and b. Which of the following statements about P_1 and P_2 is true?",Both P_1 and P_2 can be solved in polynomial time.,P_1 can be solved in polynomial time but P_2 is not known to be solvable in polynomial time.,P_1 is not known to be solvable in polynomial time but P_2 can be solved in polynomial time.,It is not known whether either P_1 or P_2 can be solved in polynomial time.,B,False,0.14096425473690033,0.15973342955112457,0.5575244426727295,0.14096425473690033
A major advantage of direct mapping of a cache is its simplicity. The main disadvantage of this organization is that,it does not allow simultaneous access to the intended data and its tag,it is more expensive than other types of cache organizations,the cache hit ratio is degraded if two or more blocks used alternately map onto the same block frame in the cache,its access time is greater than that of other cache organizations,C,False,0.28030532598495483,0.28030532598495483,0.21830199658870697,0.21830199658870697
"Let M be a single-tape, deterministic Turing machine with tape alphabet {blank,0,1}, and let C denote the (possibly infinite) computation of M starting with a blank tape. The input to each problem below is M, together with a positive integer n. Which of the following problems is (are) decidable?
I. The computation C lasts for at least n steps.
II. The computation C lasts for at least n steps, and M prints a 1 at some point after the nth step.
III. M scans at least n distinct tape squares during the computation C.",,III only,I and II only,I and III only,D,False,0.09081583470106125,0.08014469593763351,0.46120089292526245,0.31697845458984375
"A 3-way, set-associative cache is",one in which each main memory word can be stored at any of 3 cache locations,effective only if 3 or fewer processes are running alternately on the processor,possible only with write-back,faster to access than a direct-mapped cache,A,True,0.35791948437690735,0.2459942251443863,0.2787479758262634,0.11619943380355835
"Consider an object-oriented language in which all entities are objects. Two relationships arise: (1) the instance relationship, between an object and the class of which that object is a member, and (2) the subclass relationship, between a class and the superclass from which that class inherits properties. In such a language, when a message is sent to an object requesting execution of one of its methods (procedures), the method is located by following",one instance link and then zero or more subclass links,one or more instance links and then one or more subclass links,one or more instance links,one subclass link and then one or more instance links,A,True,0.28765010833740234,0.28765010833740234,0.28765010833740234,0.13587628304958344
"In a pipelined RISC computer where all arithmetic instructions have the same CPI (cycles per instruction), which of the following actions would improve the execution time of a typical program?
I. Increasing the clock cycle rate
II. Disallowing any forwarding in the pipeline
III. Doubling the sizes of the instruction cache and the data cache without changing the clock cycle time",I only,II only,III only,I and III,D,True,0.00897060614079237,0.02438463270664215,0.04555648937821388,0.9150266051292419
"A microcomputer used for data acquisition and control is required to digitize and process four analog input signals and to output their average continually; i.e., in real time. The time for an external analog-to-digital converter (which is triggered by a CPU instruction) to digitize one input is 12 microseconds, and only one digitization occurs at a time. Five CPU instructions, including the triggering instruction, must be executed for each signal digitized. Ten CPU instructions are executed in order to average each set of four samples and output this value. The time to convert the output from digital to analog form is to be ignored. If it is assumed that suitable data buffering is employed, then the maximum average instruction execution time that allows the microcomputer to keep up with the input-output data rates, is",0.8 microseconds,1.2 microseconds,1.6 microseconds,2.4 microseconds,C,True,0.23477578163146973,0.30145806074142456,0.38707980513572693,0.07622052729129791
"Suppose that a certain software product has a mean time between failures of 10,000 hours and has a mean time to repair of 20 hours. If the product is used by 100 customers, what is its availability?",80%,90%,98%,99.80%,D,False,0.028281908482313156,0.18442121148109436,0.44240349531173706,0.3445441722869873
