0,1,2,3,4,5,correct,choiceA_probs,choiceB_probs,choiceC_probs,choiceD_probs
Statement 1| Linear regression estimator has the smallest variance among all unbiased estimators. Statement 2| The coefficients α assigned to the classifiers assembled by AdaBoost are always non-negative.,"True, True","False, False","True, False","False, True",D,False,0.06211972236633301,0.10241810232400894,0.5893755555152893,0.2456882745027542
Statement 1| RoBERTa pretrains on a corpus that is approximate 10x larger than the corpus BERT pretrained on. Statement 2| ResNeXts in 2018 usually used tanh activation functions.,"True, True","False, False","True, False","False, True",C,True,0.07271642982959747,0.06417201459407806,0.6088471412658691,0.2538052499294281
"Statement 1| Support vector machines, like logistic regression models, give a probability distribution over the possible labels given an input example. Statement 2| We would expect the support vectors to remain the same in general as we move from a linear kernel to higher order polynomial kernels.","True, True","False, False","True, False","False, True",B,False,0.07760371267795563,0.14498282968997955,0.5060397386550903,0.2708635926246643
"A machine learning problem involves four attributes plus a class. The attributes have 3, 2, 2, and 2 possible values each. The class has 3 possible values. How many maximum possible different examples are there?",12,24,48,72,D,False,0.05891896411776543,0.12473144382238388,0.6334385871887207,0.181483194231987
"As of 2020, which architecture is best for classifying high-resolution images?",convolutional networks,graph networks,fully connected networks,RBF networks,A,False,0.21689563989639282,0.10245422273874283,0.5895833969116211,0.09041554480791092
Statement 1| The log-likelihood of the data will always increase through successive iterations of the expectation maximation algorithm. Statement 2| One disadvantage of Q-learning is that it can only be used when the learner has prior knowledge of how its actions affect its environment.,"True, True","False, False","True, False","False, True",B,False,0.07835988700389862,0.10061608254909515,0.5790055990219116,0.241365447640419
Let us say that we have computed the gradient of our cost function and stored it in a vector g. What is the cost of one gradient descent update given the gradient?,O(D),O(N),O(ND),O(ND^2),A,False,0.016366446390748024,0.05041220784187317,0.8935776948928833,0.03926106542348862
"Statement 1| For a continuous random variable x and its probability distribution function p(x), it holds that 0 ≤ p(x) ≤ 1 for all x. Statement 2| Decision tree is learned by minimizing information gain.","True, True","False, False","True, False","False, True",B,False,0.048041053116321564,0.08975251019001007,0.5852598547935486,0.27645719051361084
Consider the Bayesian network given below. How many independent parameters are needed for this Bayesian Network H -> U <- P <- W?,2,4,8,16,C,True,0.054626863449811935,0.13104301691055298,0.6654914021492004,0.14849121868610382
"As the number of training examples goes to infinity, your model trained on that data will have:",Lower variance,Higher variance,Same variance,None of the above,A,False,0.10325149446725845,0.06262519955635071,0.7629310488700867,0.07096364349126816
Statement 1| The set of all rectangles in the 2D plane (which includes non axisaligned rectangles) can shatter a set of 5 points. Statement 2| The VC-dimension of k-Nearest Neighbour classifier when k = 1 is infinite.,"True, True","False, False","True, False","False, True",A,False,0.0761946588754654,0.12562376260757446,0.563006579875946,0.23469606041908264
_ refers to a model that can neither model the training data nor generalize to new data.,good fitting,overfitting,underfitting,all of the above,C,True,0.2578103244304657,0.10747133195400238,0.37511178851127625,0.2578103244304657
Statement 1| The F1 score can be especially useful for datasets with class high imbalance. Statement 2| The area under the ROC curve is one of the main metrics used to assess anomaly detectors.,"True, True","False, False","True, False","False, True",A,False,0.06886924803256989,0.11354617774486542,0.5766351222991943,0.240377277135849
"Statement 1| The back-propagation algorithm learns a globally optimal neural network with hidden layers. Statement 2| The VC dimension of a line should be at most 2, since I can find at least one case of 3 points that cannot be shattered by any line.","True, True","False, False","True, False","False, True",B,False,0.04522310942411423,0.10848459601402283,0.5509302616119385,0.29489174485206604
High entropy means that the partitions in classification are,pure,not pure,useful,useless,B,False,0.05161122977733612,0.03130379319190979,0.8073354959487915,0.10926097631454468
"Statement 1| Layer Normalization is used in the original ResNet paper, not Batch Normalization. Statement 2| DCGANs use self-attention to stabilize training.","True, True","False, False","True, False","False, True",B,False,0.11088866740465164,0.12565332651138306,0.49696850776672363,0.26600807905197144
"In building a linear regression model for a particular data set, you observe the coefficient of one of the features having a relatively high negative value. This suggests that",This feature has a strong effect on the model (should be retained),This feature does not have a strong effect on the model (should be ignored),It is not possible to comment on the importance of this feature without additional information,Nothing can be determined.,C,True,0.18476006388664246,0.12698359787464142,0.5022298693656921,0.18476006388664246
"For a neural network, which one of these structural assumptions is the one that most affects the trade-off between underfitting (i.e. a high bias model) and overfitting (i.e. a high variance model):",The number of hidden nodes,The learning rate,The initial choice of weights,The use of a constant-term unit input,A,False,0.18254248797893524,0.06715362519025803,0.7219695448875427,0.02799379639327526
"For polynomial regression, which one of these structural assumptions is the one that most affects the trade-off between underfitting and overfitting:",The polynomial degree,Whether we learn the weights by matrix inversion or gradient descent,The assumed variance of the Gaussian noise,The use of a constant-term unit input,A,False,0.10926900804042816,0.06627500802278519,0.8073948621749878,0.016756944358348846
"Statement 1| As of 2020, some models attain greater than 98% accuracy on CIFAR-10. Statement 2| The original ResNets were not optimized with the Adam optimizer.","True, True","False, False","True, False","False, True",A,False,0.05733571574091911,0.10711721330881119,0.5439861416816711,0.29117482900619507
The K-means algorithm:,Requires the dimension of the feature space to be no bigger than the number of samples,Has the smallest value of the objective function when K = 1,Minimizes the within class variance for a given number of clusters,Converges to the global optimum if and only if the initial means are chosen as some of the samples themselves,C,True,0.03537999466061592,0.03537999466061592,0.8052449822425842,0.12348832190036774
Statement 1| VGGNets have convolutional kernels of smaller width and height than AlexNet's first-layer kernels. Statement 2| Data-dependent weight initialization procedures were introduced before Batch Normalization.,"True, True","False, False","True, False","False, True",A,False,0.08669012784957886,0.11131233721971512,0.4988672733306885,0.30257830023765564
"What is the rank of the following matrix? A = [[1, 1, 1], [1, 1, 1], [1, 1, 1]]",0,1,2,3,B,False,0.03418787568807602,0.08201244473457336,0.7781124711036682,0.10530606657266617
"Statement 1| Density estimation (using say, the kernel density estimator) can be used to perform classification. Statement 2| The correspondence between logistic regression and Gaussian Naive Bayes (with identity class covariances) means that there is a one-to-one correspondence between the parameters of the two classifiers.","True, True","False, False","True, False","False, True",C,True,0.10704335570335388,0.15574714541435242,0.47973501682281494,0.256783664226532
Suppose we would like to perform clustering on spatial data such as the geometrical locations of houses. We wish to produce clusters of many different sizes and shapes. Which of the following methods is the most appropriate?,Decision Trees,Density-based clustering,Model-based clustering,K-means clustering,B,False,0.03638293221592903,0.09889905899763107,0.8280717134475708,0.03638293221592903
"Statement 1| In AdaBoost weights of the misclassified examples go up by the same multiplicative factor. Statement 2| In AdaBoost, weighted training error e_t of the tth weak classifier on training data with weights D_t tends to increase as a function of t.","True, True","False, False","True, False","False, True",A,False,0.09889927506446838,0.1120675578713417,0.4432357847690582,0.3451923727989197
MLE estimates are often undesirable because,they are biased,they have high variance,they are not consistent estimators,None of the above,B,False,0.11081165075302124,0.04076533019542694,0.7225826978683472,0.1255660355091095
"Computational complexity of Gradient descent is,",linear in D,linear in N,polynomial in D,dependent on the number of iterations,C,True,0.04188355803489685,0.04746029153466225,0.8412537574768066,0.06905431300401688
Averaging the output of multiple decision trees helps _.,Increase bias,Decrease bias,Increase variance,Decrease variance,D,False,0.03902039676904678,0.12019128352403641,0.7837455868721008,0.05677434429526329
The model obtained by applying linear regression on the identified subset of features may differ from the model obtained at the end of the process of identifying the subset during,Best-subset selection,Forward stepwise selection,Forward stage wise selection,All of the above,C,True,0.29878243803977966,0.10991591215133667,0.4926089346408844,0.09700044244527817
Neural networks:,Optimize a convex objective function,Can only be trained with stochastic gradient descent,Can use a mix of different activation functions,None of the above,C,True,0.14556296169757843,0.08828839659690857,0.6523679494857788,0.11336454004049301
"Say the incidence of a disease D is about 5 cases per 100 people (i.e., P(D) = 0.05). Let Boolean random variable D mean a patient “has disease D” and let Boolean random variable TP stand for ""tests positive."" Tests for disease D are known to be very accurate in the sense that the probability of testing positive when you have the disease is 0.99, and the probability of testing negative when you do not have the disease is 0.97. What is P(TP), the prior probability of testing positive.",0.0368,0.473,0.078,None of the above,C,True,0.1904177963733673,0.1680431216955185,0.5865281224250793,0.05455561354756355
"Statement 1| After mapped into feature space Q through a radial basis kernel function, 1-NN using unweighted Euclidean distance may be able to achieve better classification performance than in original space (though we can’t guarantee this). Statement 2| The VC dimension of a Perceptron is smaller than the VC dimension of a simple linear SVM.","True, True","False, False","True, False","False, True",B,False,0.10705368965864182,0.1557621955871582,0.4797813296318054,0.25680845975875854
The disadvantage of Grid search is,It can not be applied to non-differentiable functions.,It can not be applied to non-continuous functions.,It is hard to implement.,It runs reasonably slow for multiple linear regression.,D,False,0.07057731598615646,0.09062305837869644,0.521499752998352,0.31630557775497437
Predicting the amount of rainfall in a region based on various cues is a ______ problem.,Supervised learning,Unsupervised learning,Clustering,None of the above,A,False,0.2540685534477234,0.10591152310371399,0.609478771686554,0.03034416027367115
Which of the following sentence is FALSE regarding regression?,It relates inputs to outputs.,It is used for prediction.,It may be used for interpretation.,It discovers causal relationships,D,False,0.04105912148952484,0.06769504398107529,0.7277902960777283,0.16239197552204132
Which one of the following is the main reason for pruning a Decision Tree?,To save computing time during testing,To save space for storing the Decision Tree,To make the training set error smaller,To avoid overfitting the training set,D,False,0.040073178708553314,0.031209023669362068,0.8048913478851318,0.12343408912420273
Statement 1| The kernel density estimator is equivalent to performing kernel regression with the value Yi = 1/n at each point Xi in the original data set. Statement 2| The depth of a learned decision tree can be larger than the number of training examples used to create the tree.,"True, True","False, False","True, False","False, True",B,False,0.05732840672135353,0.10710356384515762,0.5439168214797974,0.2911376953125
Suppose your model is overfitting. Which of the following is NOT a valid way to try and reduce the overfitting?,Increase the amount of training data.,Improve the optimisation algorithm being used for error minimisation.,Decrease the model complexity.,Reduce the noise in the training data.,B,False,0.056458622217178345,0.08214681595563889,0.5356644988059998,0.3248969614505768
Statement 1| The softmax function is commonly used in mutliclass logistic regression. Statement 2| The temperature of a nonuniform softmax distribution affects its entropy.,"True, True","False, False","True, False","False, True",A,False,0.0703308954834938,0.13139541447162628,0.5196789503097534,0.2781640887260437
Which of the following is/are true regarding an SVM?,"For two dimensional data points, the separating hyperplane learnt by a linear SVM will be a straight line.","In theory, a Gaussian kernel SVM cannot model any complex separating hyperplane.","For every kernel function used in a SVM, one can obtain an equivalent closed form basis expansion.",Overfitting in an SVM is not a function of number of support vectors.,A,False,0.05748400464653969,0.06513791531324387,0.5453930497169495,0.33079761266708374
"Which of the following is the joint probability of H, U, P, and W described by the given Bayesian Network H -> U <- P <- W? [note: as the product of the conditional probabilities]","P(H, U, P, W) = P(H) * P(W) * P(P) * P(U)","P(H, U, P, W) = P(H) * P(W) * P(P | W) * P(W | H, P)","P(H, U, P, W) = P(H) * P(W) * P(P | W) * P(U | H, P)",None of the above,C,True,0.25319352746009827,0.15356962382793427,0.473027765750885,0.11960014700889587
"Statement 1| Since the VC dimension for an SVM with a Radial Base Kernel is infinite, such an SVM must be worse than an SVM with polynomial kernel which has a finite VC dimension. Statement 2| A two layer neural network with linear activation functions is essentially a weighted combination of linear separators, trained on a given dataset; the boosting algorithm built on linear separators also finds a combination of linear separators, therefore these two algorithms will give the same result.","True, True","False, False","True, False","False, True",B,False,0.0941462367773056,0.13698197901248932,0.4781140685081482,0.2899908423423767
Statement 1| The ID3 algorithm is guaranteed to find the optimal decision tree. Statement 2| Consider a continuous probability distribution with density f() that is nonzero everywhere. The probability of a value x is equal to f(x).,"True, True","False, False","True, False","False, True",B,False,0.07185634225606918,0.10455034673213959,0.6016457676887512,0.22133313119411469
"Given a Neural Net with N input nodes, no hidden layers, one output node, with Entropy Loss and Sigmoid Activation Functions, which of the following algorithms (with the proper hyper-parameters and initialization) can be used to find the global optimum?",Stochastic Gradient Descent,Mini-Batch Gradient Descent,Batch Gradient Descent,All of the above,D,False,0.28066354990005493,0.09111811220645905,0.5941647291183472,0.03352048248052597
"Adding more basis functions in a linear model, pick the most probably option:",Decreases model bias,Decreases estimation bias,Decreases variance,Doesn’t affect bias and variance,A,False,0.03525478392839432,0.04526803642511368,0.9092328548431396,0.010100665502250195
Consider the Bayesian network given below. How many independent parameters would we need if we made no assumptions about independence or conditional independence H -> U <- P <- W?,3,4,7,15,D,False,0.052645716816186905,0.1431059092283249,0.6413561105728149,0.1621602326631546
Another term for out-of-distribution detection is?,anomaly detection,one-class detection,train-test mismatch robustness,background detection,A,False,0.09865317493677139,0.05983617901802063,0.7289538979530334,0.11178869754076004
"Statement 1| We learn a classifier f by boosting weak learners h. The functional form of f’s decision boundary is the same as h’s, but with different parameters. (e.g., if h was a linear classifier, then f is also a linear classifier). Statement 2| Cross validation can be used to select the number of iterations in boosting; this procedure may help reduce overfitting.","True, True","False, False","True, False","False, True",D,False,0.07086309045553207,0.11683347076177597,0.5933293700218201,0.21827369928359985
Statement 1| Highway networks were introduced after ResNets and eschew max pooling in favor of convolutions. Statement 2| DenseNets usually cost more memory than ResNets.,"True, True","False, False","True, False","False, True",D,False,0.04999028518795967,0.10582944005727768,0.47429463267326355,0.36938101053237915
"If N is the number of instances in the training dataset, nearest neighbors has a classification run time of",O(1),O( N ),O(log N ),O( N^2 ),B,False,0.043549541383981705,0.06336421519517899,0.8747159242630005,0.018154149875044823
"Statement 1| The original ResNets and Transformers are feedforward neural networks. Statement 2| The original Transformers use self-attention, but the original ResNet does not.","True, True","False, False","True, False","False, True",A,False,0.06977689266204834,0.10152477025985718,0.5155853629112244,0.31271833181381226
"Statement 1| RELUs are not monotonic, but sigmoids are monotonic. Statement 2| Neural networks trained with gradient descent with high probability converge to the global optimum.","True, True","False, False","True, False","False, True",D,False,0.10705386102199554,0.1557624340057373,0.4797821044921875,0.2568088471889496
The numerical output of a sigmoid node in a neural network:,"Is unbounded, encompassing all real numbers.","Is unbounded, encompassing all integers.",Is bounded between 0 and 1.,Is bounded between -1 and 1.,C,True,0.020873352885246277,0.018420668318867683,0.8875575065612793,0.0728551596403122
Which of the following can only be used when training data are linearly separable?,Linear hard-margin SVM.,Linear Logistic Regression.,Linear Soft margin SVM.,The centroid method.,A,False,0.11246643960475922,0.11246643960475922,0.6471997499465942,0.1274411678314209
Which of the following are the spatial clustering algorithms?,Partitioning based clustering,K-means clustering,Grid based clustering,All of the above,D,False,0.284151554107666,0.09225049614906311,0.5308650135993958,0.09225049614906311
Statement 1| The maximum margin decision boundaries that support vector machines construct have the lowest generalization error among all linear classifiers. Statement 2| Any decision boundary that we get from a generative model with classconditional Gaussian distributions could in principle be reproduced with an SVM and a polynomial kernel of degree less than or equal to three.,"True, True","False, False","True, False","False, True",D,False,0.08086501806974411,0.13332389295101166,0.465346097946167,0.3198274075984955
Statement 1| L2 regularization of linear models tends to make models more sparse than L1 regularization. Statement 2| Residual connections can be found in ResNets and Transformers.,"True, True","False, False","True, False","False, True",D,False,0.07593893259763718,0.09750751405954361,0.5611170530319214,0.2650529444217682
"Suppose we like to calculate P(H|E, F) and we have no conditional independence information. Which of the following sets of numbers are sufficient for the calculation?","P(E, F), P(H), P(E|H), P(F|H)","P(E, F), P(H), P(E, F|H)","P(H), P(E|H), P(F|H)","P(E, F), P(E|H), P(F|H)",B,False,0.32372352480888367,0.2521161437034607,0.3668268024921417,0.05625471472740173
Which among the following prevents overfitting when we perform bagging?,The use of sampling with replacement as the sampling technique,The use of weak classifiers,The use of classification algorithms which are not prone to overfitting,The practice of validation performed on every classifier trained,B,False,0.05024978518486023,0.0569404698908329,0.7860389351844788,0.10637879371643066
"Statement 1| PCA and Spectral Clustering (such as Andrew Ng’s) perform eigendecomposition on two different matrices. However, the size of these two matrices are the same. Statement 2| Since classification is a special case of regression, logistic regression is a special case of linear regression.","True, True","False, False","True, False","False, True",B,False,0.09290681779384613,0.11929473280906677,0.5346418619155884,0.25254693627357483
"Statement 1| The Stanford Sentiment Treebank contained movie reviews, not book reviews. Statement 2| The Penn Treebank has been used for language modeling.","True, True","False, False","True, False","False, True",A,False,0.0463390052318573,0.08657266199588776,0.5645246505737305,0.3021682798862457
"What is the dimensionality of the null space of the following matrix? A = [[3, 2, −9], [−6, −4, 18], [12, 8, −36]]",0,1,2,3,C,True,0.04651952534914017,0.12645317614078522,0.7276878356933594,0.09848184138536453
What are support vectors?,The examples farthest from the decision boundary.,The only examples necessary to compute f(x) in an SVM.,The data centroid.,All the examples that have a non-zero weight αk in a SVM.,B,False,0.1394345462322235,0.09583187103271484,0.6249022483825684,0.1394345462322235
Statement 1| Word2Vec parameters were not initialized using a Restricted Boltzman Machine. Statement 2| The tanh function is a nonlinear activation function.,"True, True","False, False","True, False","False, True",A,False,0.07033155858516693,0.13139665126800537,0.519683837890625,0.2781667411327362
"If your training loss increases with number of epochs, which of the following could be a possible issue with the learning process?",Regularization is too low and model is overfitting,Regularization is too high and model is underfitting,Step size is too large,Step size is too small,C,True,0.10200803726911545,0.10200803726911545,0.5180395841598511,0.2772866189479828
"Say the incidence of a disease D is about 5 cases per 100 people (i.e., P(D) = 0.05). Let Boolean random variable D mean a patient “has disease D” and let Boolean random variable TP stand for ""tests positive."" Tests for disease D are known to be very accurate in the sense that the probability of testing positive when you have the disease is 0.99, and the probability of testing negative when you do not have the disease is 0.97. What is P(D | TP), the posterior probability that you have disease D when the test is positive?",0.0495,0.078,0.635,0.97,C,True,0.07248683273792267,0.11951057612895966,0.687735915184021,0.11951057612895966
"Statement 1| Traditional machine learning results assume that the train and test sets are independent and identically distributed. Statement 2| In 2017, COCO models were usually pretrained on ImageNet.","True, True","False, False","True, False","False, True",A,False,0.0660247951745987,0.08477751165628433,0.5528188347816467,0.2959026098251343
"Statement 1| The values of the margins obtained by two different kernels K1(x, x0) and K2(x, x0) on the same training set do not tell us which classifier will perform better on the test set. Statement 2| The activation function of BERT is the GELU.","True, True","False, False","True, False","False, True",A,False,0.07680431008338928,0.08703069388866425,0.5675113797187805,0.2680734097957611
Which of the following is a clustering algorithm in machine learning?,Expectation Maximization,CART,Gaussian Naïve Bayes,Apriori,A,False,0.08161734789609909,0.06356365233659744,0.6030751466751099,0.25139912962913513
"You've just finished training a decision tree for spam classification, and it is getting abnormally bad performance on both your training and test sets. You know that your implementation has no bugs, so what could be causing the problem?",Your decision trees are too shallow.,You need to increase the learning rate.,You are overfitting.,None of the above.,A,False,0.05559631064534187,0.04329845309257507,0.7674834132194519,0.1333686113357544
K-fold cross-validation is,linear in K,quadratic in K,cubic in K,exponential in K,A,False,0.028894415125250816,0.02549923211336136,0.8444185853004456,0.10085142403841019
"Statement 1| Industrial-scale neural networks are normally trained on CPUs, not GPUs. Statement 2| The ResNet-50 model has over 1 billion parameters.","True, True","False, False","True, False","False, True",B,False,0.056980740278959274,0.09394534677267075,0.4770938754081726,0.37156108021736145
"Given two Boolean random variables, A and B, where P(A) = 1/2, P(B) = 1/3, and P(A | ¬B) = 1/4, what is P(A | B)?",1/6,1/4,3/4,1,D,False,0.05758407339453697,0.20098817348480225,0.6190871596336365,0.12190548330545425
Existential risks posed by AI are most commonly associated with which of the following professors?,Nando de Frietas,Yann LeCun,Stuart Russell,Jitendra Malik,C,True,0.24465881288051605,0.07942907512187958,0.6650515198707581,0.010749556124210358
