0,1,2,3,4,5,correct,choiceA_probs,choiceB_probs,choiceC_probs,choiceD_probs
Statement 1| Maximizing the likelihood of logistic regression model yields multiple local optimums. Statement 2| No classifier can do better than a naive Bayes classifier if the distribution of the data is known.,"True, True","False, False","True, False","False, True",B,False,0.07142747193574905,0.11776399612426758,0.52778160572052,0.28250113129615784
"For Kernel Regression, which one of these structural assumptions is the one that most affects the trade-off between underfitting and overfitting:",Whether kernel function is Gaussian versus triangular versus box-shaped,Whether we use Euclidian versus L1 versus L∞ metrics,The kernel width,The maximum height of the kernel function,C,True,0.1417398899793625,0.08596959710121155,0.7198145985603333,0.052143197506666183
"Statement 1| The SVM learning algorithm is guaranteed to find the globally optimal hypothesis with respect to its object function. Statement 2| After being mapped into feature space Q through a radial basis kernel function, a Perceptron may be able to achieve better classification performance than in its original space (though we can’t guarantee this).","True, True","False, False","True, False","False, True",A,False,0.09208966791629791,0.11824548244476318,0.46766993403434753,0.32142454385757446
"For a Gaussian Bayes classifier, which one of these structural assumptions is the one that most affects the trade-off between underfitting and overfitting:",Whether we learn the class centers by Maximum Likelihood or Gradient Descent,Whether we assume full class covariance matrices or diagonal class covariance matrices,Whether we have equal class priors or priors estimated from the data.,Whether we allow classes to have different mean vectors or we force them to share the same mean vector,B,False,0.17101292312145233,0.1509183794260025,0.5968937277793884,0.08078078180551529
Statement 1| Overfitting is more likely when the set of training data is small. Statement 2| Overfitting is more likely when the hypothesis space is small.,"True, True","False, False","True, False","False, True",D,False,0.05936148017644882,0.110901840031147,0.5632060766220093,0.26603972911834717
"Statement 1| Besides EM, gradient descent can be used to perform inference or learning on Gaussian mixture model. Statement 2 | Assuming a fixed number of attributes, a Gaussian-based Bayes optimal classifier can be learned in time linear in the number of records in the dataset.","True, True","False, False","True, False","False, True",A,False,0.0628717765212059,0.0914779007434845,0.5965108275413513,0.24866269528865814
"Statement 1| In a Bayesian network, the inference results of the junction tree algorithm are the same as the inference results of variable elimination. Statement 2| If two random variable X and Y are conditionally independent given another random variable Z, then in the corresponding Bayesian network, the nodes for X and Y are d-separated given Z.","True, True","False, False","True, False","False, True",C,True,0.0697629526257515,0.10150448977947235,0.5154823660850525,0.31265586614608765
"Given a large dataset of medical records from patients suffering from heart disease, try to learn whether there might be different clusters of such patients for which we might tailor separate treatments. What kind of learning problem is this?",Supervised learning,Unsupervised learning,Both (a) and (b),Neither (a) nor (b),B,False,0.3356872498989105,0.07490195333957672,0.5534546971321106,0.03538117557764053
What would you do in PCA to get the same projection as SVD?,Transform data to zero mean,Transform data to zero median,Not possible,None of these,A,False,0.15996018052101135,0.10993891209363937,0.6326547861099243,0.09702076017856598
"Statement 1| The training error of 1-nearest neighbor classifier is 0. Statement 2| As the number of data points grows to infinity, the MAP estimate approaches the MLE estimate for all possible priors. In other words, given enough data, the choice of prior is irrelevant.","True, True","False, False","True, False","False, True",C,True,0.07243753224611282,0.10539598017930984,0.5352450013160706,0.28649601340293884
"When doing least-squares regression with regularisation (assuming that the optimisation can be done exactly), increasing the value of the regularisation parameter λ the testing error.",will never decrease the training error.,will never increase the training error.,will never decrease the testing error.,will never increase,A,False,0.04138506203889847,0.06021491065621376,0.5041732788085938,0.3926505148410797
Which of the following best describes what discriminative approaches try to model? (w are the parameters in the model),"p(y|x, w)","p(y, x)","p(w|x, w)",None of the above,A,False,0.19041727483272552,0.11549390107393265,0.6646215319633484,0.029201433062553406
Statement 1| CIFAR-10 classification performance for convolution neural networks can exceed 95%. Statement 2| Ensembles of neural networks do not improve classification accuracy since the representations they learn are highly correlated.,"True, True","False, False","True, False","False, True",C,True,0.0941724106669426,0.1370200514793396,0.4782469868659973,0.2900714576244354
Which of the following points would Bayesians and frequentists disagree on?,The use of a non-Gaussian noise model in probabilistic regression.,The use of probabilistic modelling for regression.,The use of prior distributions on the parameters in a probabilistic model.,The use of class priors in Gaussian Discriminant Analysis.,C,True,0.1474839746952057,0.1013641506433487,0.5833104252815247,0.16712124645709991
"Statement 1| The BLEU metric uses precision, while the ROGUE metric uses recall. Statement 2| Hidden markov models were frequently used to model English sentences.","True, True","False, False","True, False","False, True",A,False,0.054555494338274,0.08994679898023605,0.6646219491958618,0.19041739404201508
Statement 1| ImageNet has images of various resolutions. Statement 2| Caltech-101 has more images than ImageNet.,"True, True","False, False","True, False","False, True",C,True,0.03822942078113556,0.08093168586492538,0.5980087518692017,0.28247934579849243
Which of the following is more appropriate to do feature selection?,Ridge,Lasso,both (a) and (b),neither (a) nor (b),B,False,0.13126035034656525,0.07025860249996185,0.6665951013565063,0.13126035034656525
Suppose you are given an EM algorithm that finds maximum likelihood estimates for a model with latent variables. You are asked to modify the algorithm so that it finds MAP estimates instead. Which step or steps do you need to modify?,Expectation,Maximization,No modification necessary,Both,B,False,0.17560632526874542,0.12069233506917953,0.4773474335670471,0.2254829704761505
"For a Gaussian Bayes classifier, which one of these structural assumptions is the one that most affects the trade-off between underfitting and overfitting:",Whether we learn the class centers by Maximum Likelihood or Gradient Descent,Whether we assume full class covariance matrices or diagonal class covariance matrices,Whether we have equal class priors or priors estimated from the data,Whether we allow classes to have different mean vectors or we force them to share the same mean vector,B,False,0.13238312304019928,0.13238312304019928,0.6722970008850098,0.06253335624933243
"Statement 1| For any two variables x and y having joint distribution p(x, y), we always have H[x, y] ≥ H[x] + H[y] where H is entropy function. Statement 2| For some directed graphs, moralization decreases the number of edges present in the graph.","True, True","False, False","True, False","False, True",B,False,0.05933857709169388,0.1423458456993103,0.5629887580871582,0.2346886247396469
Which of the following is NOT supervised learning?,PCA,Decision Tree,Linear Regression,Naive Bayesian,A,False,0.10203927755355835,0.09004934877157211,0.4035731554031372,0.4035731554031372
Statement 1| A neural network's convergence depends on the learning rate. Statement 2| Dropout multiplies randomly chosen activation values by zero.,"True, True","False, False","True, False","False, True",A,False,0.07489734888076782,0.13992667198181152,0.48839202523231506,0.2962247431278229
"Which one of the following is equal to P(A, B, C) given Boolean random variables A, B and C, and no independence or conditional independence assumptions between any of them?",P(A | B) * P(B | C) * P(C | A),"P(C | A, B) * P(A) * P(B)","P(A, B | C) * P(C)","P(A | B, C) * P(B | A, C) * P(C | A, B)",C,False,0.1505817025899887,0.11727313697338104,0.31878143548965454,0.40932345390319824
Which of the following tasks can be best solved using Clustering.,Predicting the amount of rainfall based on various cues,Detecting fraudulent credit card transactions,Training a robot to solve a maze,All of the above,B,False,0.37285900115966797,0.0571797750890255,0.5425066351890564,0.027009813115000725
"After applying a regularization penalty in linear regression, you find that some of the coefficients of w are zeroed out. Which of the following penalties might have been used?",L0 norm,L1 norm,L2 norm,either (a) or (b),D,False,0.17225666344165802,0.15201598405838013,0.530587911605835,0.09220234304666519
"A and B are two events. If P(A, B) decreases while P(A) increases, which of the following is true?",P(A|B) decreases,P(B|A) decreases,P(B) decreases,All of above,B,False,0.11426788568496704,0.061163194477558136,0.6575663685798645,0.1662588119506836
"Statement 1| When learning an HMM for a fixed set of observations, assume we do not know the true number of hidden states (which is often the case), we can always increase the training data likelihood by permitting more hidden states. Statement 2| Collaborative filtering is often a useful model for modeling users' movie preference.","True, True","False, False","True, False","False, True",A,False,0.08064532279968262,0.10355063527822495,0.5958928465843201,0.2192167490720749
"You are training a linear regression model for a simple estimation task, and notice that the model is overfitting to the data. You decide to add in $\ell_2$ regularization to penalize the weights. As you increase the $\ell_2$ regularization coefficient, what will happen to the bias and variance of the model?",Bias increase ; Variance increase,Bias increase ; Variance decrease,Bias decrease ; Variance increase,Bias decrease ; Variance decrease,B,False,0.03318960219621658,0.04261629283428192,0.7553918361663818,0.16855069994926453
"Which PyTorch 1.8 command(s) produce $10\times 5$ Gaussian matrix with each entry i.i.d. sampled from $\mathcal{N}(\mu=5,\sigma^2=16)$ and a $10\times 10$ uniform matrix with each entry i.i.d. sampled from $U[-1,1)$?","\texttt{5 + torch.randn(10,5) * 16} ; \texttt{torch.rand(10,10,low=-1,high=1)}","\texttt{5 + torch.randn(10,5) * 16} ; \texttt{(torch.rand(10,10) - 0.5) / 0.5}","\texttt{5 + torch.randn(10,5) * 4} ; \texttt{2 * torch.rand(10,10) - 1}","\texttt{torch.normal(torch.ones(10,5)*5,torch.ones(5,5)*16)} ; \texttt{2 * torch.rand(10,10) - 1}",C,True,0.1954716295003891,0.15223343670368195,0.3651890456676483,0.2844095230102539
"Statement 1| The ReLU's gradient is zero for $x<0$, and the sigmoid gradient $\sigma(x)(1-\sigma(x))\le \frac{1}{4}$ for all $x$. Statement 2| The sigmoid has a continuous gradient and the ReLU has a discontinuous gradient.","True, True","False, False","True, False","False, True",A,False,0.06205025687813759,0.10230357199907303,0.5195404291152954,0.315117210149765
Which is true about Batch Normalization?,"After applying batch normalization, the layer’s activations will follow a standard Gaussian distribution.",The bias parameter of affine layers becomes redundant if a batch normalization layer follows immediately afterward.,The standard weight initialization must be changed when using Batch Normalization.,Batch Normalization is equivalent to Layer Normalization for convolutional neural networks.,B,False,0.03684169054031372,0.06882933527231216,0.6530345678329468,0.2402380257844925
Suppose we have the following objective function: $\argmin_{w} \frac{1}{2} \norm{Xw-y}^2_2 + \frac{1}{2}\gamma \norm{w}^2_2$ What is the gradient of $\frac{1}{2} \norm{Xw-y}^2_2 + \frac{1}{2}\lambda \norm{w}^2_2$ with respect to $w$?,$\nabla_w f(w) = (X^\top X + \lambda I)w - X^\top y + \lambda w$,$\nabla_w f(w) = X^\top X w - X^\top y + \lambda$,$\nabla_w f(w) = X^\top X w - X^\top y + \lambda w$,$\nabla_w f(w) = X^\top X w - X^\top y + (\lambda+1) w$,C,True,0.1850128322839737,0.16327324509620667,0.34564945101737976,0.3050345778465271
Which of the following is true of a convolution kernel?,Convolving an image with $\begin{bmatrix}1 & 0 & 0\\ 0 & 1 & 0 \\ 0 & 0 & 1 \end{bmatrix}$ would not change the image,Convolving an image with $\begin{bmatrix}0 & 0 & 0\\ 0 & 1 & 0 \\ 0 & 0 & 0 \end{bmatrix}$ would not change the image,Convolving an image with $\begin{bmatrix}1 & 1 & 1\\ 1 & 1 & 1 \\ 1 & 1 & 1 \end{bmatrix}$ would not change the image,Convolving an image with $\begin{bmatrix}0 & 0 & 0\\ 0 & 0 & 0 \\ 0 & 0 & 0 \end{bmatrix}$ would not change the image,B,False,0.1975063979625702,0.10571755468845367,0.3256329596042633,0.3689905107021332
Which of the following is false?,"Semantic segmentation models predict the class of each pixel, while multiclass image classifiers predict the class of entire image.",A bounding box with an IoU (intersection over union) equal to $96\%$ would likely be considered at true positive.,"When a predicted bounding box does not correspond to any object in the scene, it is considered a false positive.",A bounding box with an IoU (intersection over union) equal to $3\%$ would likely be considered at false negative.,D,False,0.06971251964569092,0.10143110156059265,0.5836957693099976,0.24332058429718018
Which of the following is false?,"The following fully connected network without activation functions is linear: $g_3(g_2(g_1(x)))$, where $g_i(x) = W_i x$ and $W_i$ are matrices.","Leaky ReLU $\max\{0.01x,x\}$ is convex.",A combination of ReLUs such as $ReLU(x) - ReLU(x-1)$ is convex.,The loss $\log \sigma(x)= -\log(1+e^{-x})$ is concave,C,True,0.13850776851177216,0.13850776851177216,0.4266339838504791,0.29322096705436707
"We are training fully connected network with two hidden layers to predict housing prices. Inputs are $100$-dimensional, and have several features such as the number of square feet, the median family income, etc. The first hidden layer has $1000$ activations. The second hidden layer has $10$ activations. The output is a scalar representing the house price. Assuming a vanilla network with affine transformations and with no batch normalization and no learnable parameters in the activation function, how many parameters does this network have?",111021,110010,111110,110011,A,False,0.061429351568222046,0.1473613679409027,0.6604278087615967,0.13004593551158905
Statement 1| The derivative of the sigmoid $\sigma(x)=(1+e^{-x})^{-1}$ with respect to $x$ is equal to $\text{Var}(B)$ where $B\sim \text{Bern}(\sigma(x))$ is a Bernoulli random variable. Statement 2| Setting the bias parameters in each layer of neural network to 0 changes the bias-variance trade-off such that the model's variance increases and the model's bias decreases,"True, True","False, False","True, False","False, True",C,True,0.10348274558782578,0.15056651830673218,0.5255287885665894,0.21907298266887665
