0,1,2,3,4,5,correct,choiceA_probs,choiceB_probs,choiceC_probs,choiceD_probs
How many human polyomaviruses are known at present?,100,1,10,unknown,A,False,0.18837441504001617,0.16623982787132263,0.24187752604484558,0.3987886309623718
AIDS activism in the U.S. resulted in:,Food and Drug Administration reforms,Easier access to investigational drugs,Changes in the way medicine was practiced in the U.S.,All of the above,D,True,0.3295130729675293,0.05726078897714615,0.22647081315517426,0.37338724732398987
"Globally, the most deaths are caused by:",Respiratory infections,Diarrheal diseases,Malaria,Tuberculosis,B,False,0.12539592385292053,0.03592653572559357,0.49595049023628235,0.3408614695072174
What happens during the 'incubation period'?,The virus is cleared from the body by the immune system,Virus replication happens at an intracellular level,This period commonly lasts for a few days,This period commonly lasts for a few hours,B,False,0.14237640798091888,0.1613335907459259,0.30141082406044006,0.38701915740966797
Newborn infants in countries with limited access to safe water and low levels of education should be:,Exclusively formula fed for six months,Exclusively breast fed for six months,Should receive both breast milk and other foods as tolerated in the first 6,months,B,False,0.08035583794116974,0.13248439133167267,0.4624159336090088,0.317813515663147
Achieving effective change in a community is usually dependent on which of the following segments of society?,Innovators,Early adapters,Middle adapters,Late adapters,A,False,0.0728665441274643,0.1361326277256012,0.4193180203437805,0.37004685401916504
“Contingency management” is”:,A strategy of last resort for reducing high-risk behaviors,Paying drug users for negative urine specimens,Paying sex workers to use condoms,Paying drug users to use condoms,B,False,0.058965541422367096,0.058965541422367096,0.7183473110198975,0.16028496623039246
Typical clinical symptoms following infection with astroviruses include which of the following?,Acute pneumonia,Gastroenteritis in children,Hepatitis,rashes,B,False,0.0983658954501152,0.06760582327842712,0.3890446424484253,0.4408453404903412
Which of the following is the most special characteristic of the adaptive immune system?,Antibodies,T cells,Memory T cells,Clonal expansion of pre-existing antibodies and/or T cells,D,True,0.10518308728933334,0.1350577473640442,0.2859172523021698,0.47139787673950195
Chemotherapy is now an option for clinical care of patients. Typical drug regimens now include which of the following?,Interferon and ribavirin,Lamivudine and ribavirin,Combinations of adefovir and entecavir and/or tenofovir (DAA),Interferons alone,B,False,0.49886804819107056,0.1429280936717987,0.26702484488487244,0.0866902619600296
"There were no new cases of Ebola virus in the United States from January 1, 1997 through January 1, 1998. Which of the following epidemiologic terms does this statement describe?",Incidence,Lifetime expectancy,Lifetime prevalence,Period prevalence,C,True,0.2534092664718628,0.07260296493768692,0.41780126094818115,0.2534092664718628
How were retroviruses discovered?,In chickens as Rous sarcoma,In humans as HTLV-1,In mice causing leukaemia,In cats causing leukaemia,C,False,0.08145474642515182,0.08145474642515182,0.3650549054145813,0.46873974800109863
Most surveillance systems use which of the following study designs?,Cohort,Serial cross-sectional,Mortality,Syndromic,B,False,0.12274274230003357,0.09559213370084763,0.5500947833061218,0.22931362688541412
Polio can be eradicated by which of the following?,Attention to sewage control and hygiene,Killed polio vaccine,Live polio vaccine,Combination of the killed and live vaccines.,A,False,0.06406756490468979,0.10562954843044281,0.5364311337471008,0.2871309220790863
Public health ethics is:,Patient-centered,Population-centered,Subject-centered,Must respect the rights of individuals,B,False,0.20704689621925354,0.059319932013750076,0.23461487889289856,0.4966796934604645
How many people globally are currently infected with hepatitis B?,350 million,2 billion,"100,000",1 million,A,False,0.17645175755023956,0.1557181179523468,0.37354835867881775,0.2909197509288788
"In a study, a group of people are exposed to an environmental toxin but are not treated observed over time on a standard set of measures to ascertain the potential effects of the toxin. This type of study design is called",Clinical trial,Double-blind,Longitudinal,Prospective cohort,D,False,0.18126839399337769,0.09702596813440323,0.5583459734916687,0.1599687933921814
Which disease do polyomaviruses predominantly cause?,Tumours,Brain pathology,No disease at all,Kidney infections,C,False,0.16855944693088531,0.09022336453199387,0.21643461287021637,0.5191996693611145
How are antibody producing cells stimulated?,Interacting with a virus short peptide,Interacting with a T helper cell.,Interacting with a plasma cell,Interacting with a virus infected cell,B,False,0.14963765442371368,0.16956168413162231,0.3589620888233185,0.3167829215526581
The single most important key to the success of the Multicenter AIDS Cohort (MACS) is:,The brilliance of the principal investigator,The commitment of the staff,The commitment of the participants,The quality of the laboratories,C,True,0.2818220555782318,0.13312332332134247,0.36186668276786804,0.21948324143886566
Picornavirus replication as a positive strand RNA virus is particularly typified by which of the following?,Virions carry RNA transcriptase enzyme into the cell,The virion RNA is translated into a single large polyprotein,The virion RNA acting as mRNA,The virus exits by apoptosis of the cell,C,True,0.20154109597206116,0.12224084138870239,0.3765283226966858,0.2932405471801758
Why are members of the astrovirus family only recently recognised as significant enteric viruses for humans?,The genome has been identified by the new method of deep sequencing,A new vector has been discovered,They infect a wide range of domestic animals and so contaminate meat,Knowledge of their replication as positive sense ssRNA viruses is now complete,A,False,0.09595917165279388,0.10873597115278244,0.1582099199295044,0.6257323622703552
Which virus infection was not first identified by clinical observation?,HIV,Rubella teratogenicity,Microcephaly and Zika,Hepatitis C,D,True,0.08681108802556992,0.041006654500961304,0.30300047993659973,0.5660793781280518
The particular quality of the U.S. health care system is its:,"Systematic, democratic approach","Fragmented, uncoordinated approach",The result of rationale decisions by informed legislators,a. and c. above,B,False,0.007611365988850594,0.01254902221262455,0.01943630538880825,0.12674064934253693
The three key intervention strategies according to Professor Shoptaw are:,"Behavioral intervention, treatment and structural interventions","Condoms, drug therapy and regulation of commercial sex establishments","Drug replacement therapy, community intervention and needle exchange","HIV testing, drug therapy and condom use",A,False,0.33922991156578064,0.06679832190275192,0.20575334131717682,0.38439783453941345
Measles has been controlled in many countries by which of the following?,By hygiene,By MMR vaccine,By new molecular peptide vaccines,By humanised monoclonal antibodies to F protein,B,False,0.15623213350772858,0.15623213350772858,0.4246829152107239,0.2575832009315491
How can the spread of filoviruses be restricted?,New antivirals,New humanised monoclonal antibodies,Hygiene and social distancing,New vaccines,C,False,0.24180614948272705,0.11422113329172134,0.24180614948272705,0.3986709415912628
Most pandemics have arisen from influenza viruses from which of the following animals?,Pigs,Wild birds,Bats,Humans,A,False,0.07609773427248001,0.12546396255493164,0.5622904300689697,0.2343975156545639
PreP is an effective strategy for reducing the incidence of HIV in:,Women,Drug users,Pregnant women,a. and b. above,B,False,0.009616062976419926,0.00022614814224652946,0.017965171486139297,0.009616062976419926
The replication of hepatitis B includes which of the following stages?,Movement of intact virus to the cellular cytoplasm for replication,Conversion of relaxed circular viral DNA in to covalently closed circular (CCC) DNA in the nucleus,Virions produced in the cytoplasm by cellular DNA polymerase,Oncogenic activity to transform liver cells.,C,False,0.2805200219154358,0.21846921741962433,0.24755805730819702,0.24755805730819702
How does the papilloma family of viruses cause cancer?,"Replicate in dividing cells and encodes three oncogenic proteins E5, E6 and E7",Integrates viral genome into cellular DNA,Has an oncogene able to initiate cancer,Acts as a co factor for a cellular oncogene,B,False,0.16412484645843506,0.23880022764205933,0.44613751769065857,0.14483964443206787
The noroviruses typically cause which of the following?,Diarrhoea,Rash,Projectile vomiting and diarrhoea,Disease of the central nervous system,C,True,0.19226601719856262,0.11661523580551147,0.40702715516090393,0.2797453999519348
Deep nucleotide sequencing (NGS) is now cheap enough for general application. What will the technique mainly be useful for?,Speedy vaccine development,Identifying genetic variation,Giving details on virus excretion in symptomless carriers,Quickly identifying new viruses,D,True,0.10550576448440552,0.10550576448440552,0.3682512938976288,0.41728338599205017
Determinants of acquiring an HIV infection from an infected person per sexual act include:,Viral RNA level,Presence of other infections,Condom use,All of the above,D,False,0.2176329642534256,0.09072291851043701,0.40659189224243164,0.27944624423980713
How is next generation sequencing (NGS) most often used?,To identify a newly discovered virus,To search for drug resistant mutants,To identify quasi species viruses,Cannot be used,D,True,0.08622489869594574,0.046152859926223755,0.3009544610977173,0.562256932258606
Which of the following HPV viruses are known to cause cervical cancer?,Viruses of all 5 clades,"Types 14, 16, 18, 31, 45",None are oncogenic per se,Types 1-180,C,True,0.19441813230514526,0.11792055517435074,0.36322087049484253,0.32054129242897034
Which member of the paramyxovirus family can cause very serious croup?,Measles,Meta pneumo virus,Hendra,Respiratory syncytial virus (RSV),B,False,0.10425393283367157,0.06323320418596268,0.46723368763923645,0.3638819754123688
Which of the following is the cause of delay in HIV testing among the Latino population?,Stigma attached to the disease,Machismo,Drug abuse,All of the above,D,True,0.25429895520210266,0.0825587809085846,0.28815844655036926,0.37000277638435364
Describe the morphology of a togavirus.,Enveloped spherical particles with an icosahedral structure,Non-enveloped with an icosahedral structure,Filamentous virus with protruding glycoproteins,Small round viruses,A,False,0.31400907039642334,0.07939392328262329,0.35581886768341064,0.24455051124095917
A good surveillance system should provide information about:,Who is being infected,Where the infected individuals are,How rapidly infection is spreading,All of the above,D,False,0.39198869466781616,0.046816371381282806,0.20981642603874207,0.34592878818511963
What has so far prevented polio being eradicated from the world?,Inability to vaccinate in some countries,Poor quality (unsafe) vaccines,Genetic variation,Expense,A,False,0.04839717596769333,0.07041747868061066,0.35760945081710815,0.5203186869621277
The range of disease caused by the family is wide but identify the exception from the following:,Aplastic crisis in anaemia patients,Fifth disease at 'Slapped cheek' syndrome,Foetal infection with teratogenicity,Serious pneumonia,A,False,0.11786516010761261,0.0917934775352478,0.4661657512187958,0.3203907310962677
Which of the following drugs inhibit herpes viruses?,Amantadine,Acyclovir,Oseltamivir,Azidothymidine,D,False,0.26594746112823486,0.182782843708992,0.34148329496383667,0.20712009072303772
The three countries with the most drug injectors are:,"Bolivia, Argentina, Thailand","China, the U.S. and Russia","Afghanistan, Iraq and Myanmar","Lithuania, Estonia and Latvia",B,False,0.1487065851688385,0.07959689944982529,0.24517571926116943,0.5190369486808777
"Officials at a large community hospital report an increased incidence of acute lymphocytic leukemia (ALL) among children aged 5 – 12. They point out that some households in the community are exposed to chemical waste from a nearby factory. They believe that chemical waste causes leukemia. If a study is designed to evaluate the hospital officials’ claim, which of the following subjects are most likely to comprise the control group?",Children exposed to the chemical waste who do not suffer from ALL,Children not exposed to the chemical waste who do not suffer from ALL,Children from the hospital’s outpatient clinic who do not suffer from ALL,Children not exposed to the chemical waste who suffer from ALL,B,False,0.12660981714725494,0.1842162162065506,0.5007514953613281,0.1842162162065506
Lassa and Ebola are emergent viruses in W. Africa. What is their origin?,Humans,Primates,Fruit bats,Pigs,B,False,0.09432434290647507,0.10688348114490509,0.3730599880218506,0.4227323532104492
Antivirals can be used prophylactically or therapeutically in persons in which of the following circumstances?,If administered within 4 days of clinical signs,If used within 48 hours of first clinical signs,Used for the obese,Used in children under the age of 2 years where high virus spread is noted,C,True,0.14014022052288055,0.33617886900901794,0.38094058632850647,0.14014022052288055
Papillomaviruses cause warts and cancer but how do they most often infect humans?,Are water borne,Are airborne,Via scratches and breaks in the skin,Are nosocomial and spread in hospitals,C,False,0.2283516526222229,0.1778404414653778,0.2587563097476959,0.3322496712207794
There are 57 serotypes of adenovirus currently recognised. Which has the most important clinical impact?,Diarrhoea,Eye infections,Respiratory tract infections,Haemorrhagic cystitis,C,True,0.17937587201595306,0.03117084875702858,0.626083254814148,0.15829864144325256
How are new polyomaviruses detailed,Shot gun sequencing,Cultivation in human neural cells,Deep pyro sequencing (NGS),Monoclonal antibody techniques,A,False,0.15426738560199738,0.19808322191238403,0.41934216022491455,0.22445769608020782
Describe the YF vaccine.,Killed virus vaccine,Live attenuated virus vaccine developed by Pasteurian passage,Live attenuated vaccine produced by direct mutation of the virus genome,Experimental vaccine only,B,False,0.1413935124874115,0.12477932870388031,0.6336817741394043,0.09717825055122375
What is the biggest risk factor for infection with Ebola?,Working in a category IV laboratory,Attending a funeral of a victim outside,Nursing a patient at home,Attending football matches or large gatherings,A,False,0.14993968605995178,0.19252635538578033,0.4075782597064972,0.24720871448516846
"The influenza virus is mainly controlled in special ""risk"" sectors by:",Hygiene,Vaccination,Antiviral drugs,Humanised monoclonal antibodies,B,False,0.14124661684036255,0.1813642680644989,0.4929991364479065,0.1813642680644989
"A case-control study is conducted to assess the association between alcohol consumption and lung cancer patients with lung cancer and 100 controls are asked about their past alcohol consumption. According to the study results, alcohol consumption is strongly associated with lung cancer (OR = 2.5). The researchers then divide the study subjects into two groups: smokers and non-smokers. Subsequent statistical analysis does not reveal any association between alcohol consumption and lung cancer within either group. The scenario described is an example of which of the following?",Observer bias,Confounding,Placebo effect,Nonresponse bias,B,False,0.13529621064662933,0.11939848959445953,0.41674166917800903,0.32455873489379883
How are arenaviruses spread?,Sexual contact,Blood,Aerosols of urine from infected small mammals,Mosquito bites,A,False,0.09365637600421906,0.09365637600421906,0.1982705444097519,0.6107162833213806
Which areas of the world are rabies free?,USA,Norway,EU,"Island nations, UK, NZ and Australia",D,False,0.09633421897888184,0.025928005576133728,0.4892255663871765,0.3810092508792877
The risk of perinatal transmission of HIV-1 infection during breast feeding is increased due to:,Mixed feeding,Very early introduction of solids,Both a and b,None of them,C,True,0.13536863029003143,0.03020482137799263,0.6066800951957703,0.22318515181541443
How is the parvovirus family targeted to reduce disease?,Transfusion blood is screened,Vaccine has been developed,A range of new antivirals,Social distancing,A,False,0.18552103638648987,0.12750662863254547,0.23821374773979187,0.44504183530807495
Who discovered the first virus?,The microscopist Antonie van Leeuwenhoek,The bacteriologist Charles Chamberland,The botanist Dmitri Iwanowsky,The virologist Jonas Salk,C,True,0.09878726303577423,0.09878726303577423,0.72994464635849,0.06789542734622955
Structural interventions typically target:,Policies,The environment,Availability,All of the above,D,False,0.3203568160533905,0.09178376197814941,0.36301183700561523,0.2201777994632721
What is the main clinical picture of hepatitis A?,Rash,Limb paralysis,Jaundice and abdominal discomfort,Upper respiratory tract infection,C,True,0.11018085479736328,0.05204574763774872,0.49379631876945496,0.3393809199333191
If the human norovirus cannot be cultured in cell cultures how can it best be studied?,Animal models,Volunteer studies,In cells using replicon systems,Deductions from the 3 human ORF's of the virus genome,B,False,0.07879799604415894,0.0613679476082325,0.4534512162208557,0.4001692831516266
"Any systematic error in the design, conduct, or analysis of a study that results in a mistaken estimate of an exposure’s effect on the risk of disease is called:",Confounding,Bias,Interaction,Stratification,C,True,0.17787767946720123,0.10788825899362564,0.48352164030075073,0.22839945554733276
Describe the coronavirus structure.,Club shaped glycoprotein spikes protrude through a lipid bilayer,An icosahedral structure with an envelope,An icosahedral large pleomorphic virus,Large regimented barrel shaped virus,C,False,0.1919170767068863,0.11640358716249466,0.27923768758773804,0.4062884449958801
SARS is described as a zoonotic virus - what does this mean?,Such viruses are confined to animals,They do not cause disease in humans,They emerge from animals to cross the species barrier infrequently,They cause pandemics,A,False,0.13057754933834076,0.061680469661951065,0.4022071659564972,0.4022071659564972
Which of the following coronaviruses has caused thousands of deaths around the world as an 'emergent' virus?,MERS,SARS,OC43,HKU1,A,False,0.1434360146522522,0.06775438040494919,0.34408509731292725,0.44181403517723083
Clinical infection by an arenavirus is characterised by which one of the following?,Pantropic infection,Signs of malaria,Short (2-3 days) incubation,Hepatitis,A,False,0.1395457535982132,0.074693463742733,0.4870625436306,0.295418381690979
How does rubella cause foetal abnormalities?,By crossing the placenta early in pregnancy and infecting the foetus,By only infecting the placenta,By inducing cytokines and chemokines in the mother,By raising the temperature of the mother and inducing an abnormal immune reaction to the foetus,A,True,0.3500940501689911,0.14594091475009918,0.14594091475009918,0.3500940501689911
Which of the following is an unusual feature of the replication cycle in coronaviruses?,The RNAs all terminate in a common 3´ and produce nested set transcripts,They take advantage of recombination with the long RNA genome,They are not highly mutable,They use capped cellular mRNA's,B,False,0.19828976690769196,0.13628244400024414,0.3704540431499481,0.28850990533828735
Which replication strategy is paralleled by some other viruses?,Cytoplasmic replication and 'snatched caps' are used as primers for RNA transcription,Replicates in cytoplasmic tubules,Extracellular replication,Replicates in the nucleus,C,True,0.09641926735639572,0.08508969098329544,0.4321211576461792,0.38134557008743286
The characteristic of a generalized epidemic is:,High rates in drug users,High rates in MSM,High rates in pregnant women,High rate in STD clinic attendees,C,False,0.17579761147499084,0.12082381546497345,0.32843318581581116,0.3721635341644287
An updated version of classification shows the parvovirus family as having how many genera?,Having 5 genera,A very large number of virus types,Only a single virus,Only three viruses,B,False,0.24193115532398224,0.18841618299484253,0.35200774669647217,0.21350349485874176
The largest Latino community in the U.S. is:,Puerto Rican,Mexican,Cuban,Brazilian,B,False,0.10560472309589386,0.049884140491485596,0.6886292695999146,0.15365396440029144
How can epidemics of astrovirus mainly be controlled?,By vaccination,Using passive antibody,Basic knowledge of hand washing and food hygiene,Quarantine,C,False,0.13765116035938263,0.12147671729326248,0.25716620683670044,0.48044973611831665
"500 women aged 40 – 54 who present for routine check-ups are asked about their meat consumption the women turn out to be vegetarian. During the ensuing 5 years, 5 vegetarians and 43 non-vegetarians develop colorectal cancer. Which of the following best describes the study design?",Case series report,Cohort study,Case-control study,Cross-sectional study,A,False,0.2288663387298584,0.2019738405942917,0.4275785982608795,0.13881444931030273
In the absence of treatment the risk of HIV transmission from an infected mother to her fetus/infant was highest in which of the following areas?,Africa,North America,Europe,Japan,A,False,0.12742306292057037,0.05311783775687218,0.6471077799797058,0.16361446678638458
Poliovirus can most easily become more virulent by which of the following processes?,Mutation of the RNA genome at only a few positions,Recombining with another enterovirus,Altering its protein coat,Multiple nucleotide deletions and substitutions,A,False,0.12385187298059464,0.2041972130537033,0.43228548765182495,0.2313857525587082
A virus such as influenza which emerges suddenly and spreads globally is called:,Epidemic,Endemic,Pandemic,Zoonotic,B,False,0.06691994518041611,0.031610745936632156,0.6349188089370728,0.26467353105545044
"Of the following factors, which are the most important factors for virus spread and infection?",Age,Sex,Genetic factors,Travel,D,False,0.04548901319503784,0.031264111399650574,0.48905301094055176,0.43158775568008423
How do viruses of the calcivirus family replicate?,As negative strand RNA viruses,As positive strand RNA viruses,Retroviruses,Using genetic reassortment,B,False,0.06943539530038834,0.061276525259017944,0.513062059879303,0.35262206196784973
The parvoviruses have a rather unique genome; what form does it take?,Circular ds DNA,Small linear ss DNA,ds DNA genome,RNA genome with RT,D,False,0.10784903913736343,0.06541375070810318,0.6206284165382385,0.20148853957653046
How can the morphology of filoviruses be described?,Very large ball like structure,Long filamentous threads,Icosahedral virion,Floppy membranes without defined morphology,C,True,0.11408955603837967,0.07841251790523529,0.4512329399585724,0.3514205515384674
What is the usual direction of 'knowledge' in a cell?,From protein to DNA,From DNA to DNA,From DNA to RNA to protein,Random,C,True,0.10014041513204575,0.07798943668603897,0.5762683153152466,0.24022437632083893
Why are drug combinations essential for HIV?,Single drugs are not completely inhibitory,Mutations negate the effect of one drug,Combinations of antibiotics are effective versus TB,The virus cannot mutate vs a combination,C,False,0.10653537511825562,0.0940171405673027,0.37184497714042664,0.42135557532310486
"Many virus infections result in immune pathology, this is caused predominantly by which of the following?",A cytokine storm,Antibody mediated reactions,A response of killer T cells (CD-8),A decline in function of the immune system,A,False,0.1309274435043335,0.1483602523803711,0.4032849371433258,0.3140786290168762
David Baltimore is a molecular biologist. What did he discover?,The structure of DNA,X-ray crystallographic techniques,The enzyme reverse transcriptase,The anti HIV drug zidovudine,C,True,0.1483042985200882,0.13087806105613708,0.403132826089859,0.31396016478538513
Identify the most commonly used diagnostic technique in the virus laboratory:,Virus isolation in cell culture,Deep sequencing (NGS),Reverse transcriptase (RT) PCR,Immuno-serology,B,False,0.3691420257091522,0.1975875049829483,0.3257666826248169,0.10576096922159195
The major risk group for HIV infection among Latinos is:,Heterosexual males,Homosexual males,Females,Injection drug users,B,False,0.13154847919940948,0.04839397966861725,0.3575858175754547,0.4591493010520935
"In HIV-associated tuberculosis cases, treatment with antiretrovirals should begin:",Before antiretroviral drugs are started,After antiretroviral drugs are started,Concurrently with antiretroviral drugs,Doesn’t make any difference,C,True,0.2544040083885193,0.1981300562620163,0.3701556622982025,0.17484915256500244
A “benefit” of research may accrue:,To the participant,To his/her family,To society,All of the above,D,True,0.16053588688373566,0.059057846665382385,0.3398544490337372,0.4363817274570465
What is the current best option for preventing future outbreaks of Ebola?,"Rebuild scientific, medical and nursing infrastructure and train staff",Early and accurate diagnosis with molecular kits,Develop effective vaccines,Arrange rapid intervention into West Africa with EU and USA army teams,D,False,0.22495631873607635,0.1546100676059723,0.3273094892501831,0.2888496220111847
Where are arenaviruses predominately located in the world?,SE Asia,Russia,Africa and S. America,N. America,A,False,0.1352468878030777,0.07239244133234024,0.5349118113517761,0.2526744604110718
