0,1,2,3,4,5,correct,choiceA_probs,choiceB_probs,choiceC_probs,choiceD_probs
The most important element of ethical research on human subjects is:,Beneficence,Justice,A methodologically sound study design,Informed consent,D,False,0.40084654092788696,0.05424867942929268,0.35374584794044495,0.18934650719165802
The characteristic of injecting drug users in Asia is/are:,Strong family support,Low failure rate for rehabilitation centers,Remaining a member of the community,Both a and c,D,True,0.057552121579647064,0.07389838993549347,0.2922738194465637,0.546039342880249
"Viruses have encouraged us to change our world, as we have now:",Eradicated smallpox,Eradicated polio,Increased hygiene,A better understanding of how cellular genes aid virus replication and so become a target for new drugs,A,False,0.07490947842597961,0.09618566930294037,0.3357209861278534,0.4884711503982544
What is the most important factor for virus classification?,The geometry of the virus,How many proteins the virus has,The disease a virus causes,Chemistry of the DNA and RNA,D,False,0.15328103303909302,0.08204542100429535,0.5350033640861511,0.22302256524562836
The major issue for HIV infection among the Latino population is:,Late detection of HIV status,Cultural beliefs,Immigration,All of the above,D,False,0.19106696546077728,0.10227078199386597,0.45834583044052124,0.24533486366271973
Disease can most often be prevented by which of the following:,Vaccines,Antivirals,Hygiene,mosquito nets,A,False,0.13974878191947937,0.12332786619663239,0.5527171492576599,0.17944097518920898
Results of surveillance should be distributed to:,Decision makers,The public,The data collectors,All of the above,D,True,0.20717331767082214,0.052381616085767746,0.2347581386566162,0.49698296189308167
Which is a major characteristic of the bunyavirus family?,"Amplify by persistent infection of midgets, mosquitoes, sand flies, ticks",Predominantly mosquito borne,Genetic recombination or reassortment,Spread to humans via bites of mice and rats,A,False,0.1861637383699417,0.14498446881771088,0.3941085934638977,0.27086663246154785
The group that permits analysis of the entire natural history of HIV/AIDS is:,Persistent seronegatives,Long-term survivors,Seroconverters,Long-term survivors with low levels of CD4+ cells,C,True,0.046215519309043884,0.0863419622182846,0.5630202889442444,0.3013630509376526
The chance of acquiring HIV infection from factor VIII in the United States in 2011 is 0% primarily because:,All donors for factor VIII are screened,Factor VIII is subject to detergent “washing” prior to release,Factor VIII is made synthetically,Factor VIII is important from countries with no reported HIV,C,True,0.18369121849536896,0.1621069610118866,0.44065234065055847,0.20814943313598633
The prevalence of HIV among Latino-Americans compared to other ethic groups in the U.S. is:,Highest,Higher than all other ethnic groups except African-Americans,Higher than in all other ethnic groups except African-Americans and,Native Americans,B,False,0.09790284186601639,0.06728757172822952,0.438770055770874,0.38721323013305664
What is the rubella syndrome?,A description of the 3 day rash of German measles,"The teratogenic lesions of cataracts, deafness, mental retardation and microcephaly in the foetus",Combination of rash and post infection encephalitis,Side effects of the MMR vaccine,B,False,0.077740877866745,0.03672219067811966,0.5744317173957825,0.3074711561203003
What is the most common way for a virus to kill a cell?,Dissolves the cellular membrane,Induces apoptosis via caspases,Fragments cellular DNA,Totally blocks cellular transcription,B,False,0.3630916476249695,0.1335739642381668,0.249549001455307,0.249549001455307
The influenza virus has complicated genetics mainly characterised by which of the following?,Genetic reassortment amongst 8 genes,High levels of recombination,Rapid adsorption and fusion from without via a hydrophobic peptide,High fidelity RNA replicase enzyme,B,False,0.14432352781295776,0.11239927262067795,0.3923119902610779,0.3462141156196594
The highest risk of HIV infection among drug users in the U.S. is in:,The east coast,"The central United States (Kansas, Missouri etc.)",Southern California,"The Pacific Northwest (Washington, Oregon, Idaho)",A,False,0.19424206018447876,0.19424206018447876,0.5280046463012695,0.08097213506698608
"A study is conducted to assess the relationship between race and end-stage renal disease pathologists independently study specimens from 1,000 kidney biopsies. The first group of pathologists is aware of the race of the patient from whom the biopsy came, while the second group is blinded as to the patient’s race. The first group reports ‘hypertensive nephropathy’ much more frequently for black patients than the second group. Which of the following types of bias is most likely present in this study?",Confounding,Nonresponse bias,Recall bias,Referral bias,A,False,0.23582150042057037,0.18365797400474548,0.34311825037002563,0.23582150042057037
What is urban yellow fever (YF)?,Part of a cycle of mosquitoes biting humans in cities,Part of a cycle of mosquitoes biting humans and monkeys in forested areas,A mutant of the YF virus,A YF species that has adapted to new mosquitoes,A,False,0.11925099045038223,0.11925099045038223,0.6056065559387207,0.15312130749225616
The current testing policy of the Centers for Disease Control and the World Health Organization is:,“Opt-in”,“Opt-out”,Mandatory testing of prisoners,Mandatory testing of high-risk groups,B,False,0.1523081660270691,0.19556757807731628,0.28454911708831787,0.3653683066368103
Common cold viruses are ubiquitous and invade by which route?,Faecal oral route,Respiratory and surface route,Cuts in the skin,Sexual transmission,B,False,0.13982316851615906,0.13982316851615906,0.3354182839393616,0.3800787329673767
Assembly is a vital late replication stage for a virus and is often accomplished by which of the following?,Use of cellular scaffolding in the nucleus and cytoplasm,Snatching cellular lipids and membranes,Master plan embedded in the viral genome,Random interactions between cellular and virus proteins,A,False,0.13267560303211212,0.11708580702543259,0.5247421860694885,0.21874506771564484
The biggest single determinant of HIV transmission to the infant is:,Mother’age,Mother’s viral load,Mother’s immune status,Father’s viral load,B,False,0.17025218904018402,0.17025218904018402,0.46279340982437134,0.192920982837677
What does the reproductive number of a virus tell us?,How virulent the infection will be,How many people will die,How many contacts will be infected from one case,How long the 'incubation period' will be,C,False,0.09476056694984436,0.13787581026554108,0.3307468891143799,0.42468738555908203
PreP is most effective for which group:,Men with frequent unprotected sex,Men with infrequent unprotected sex,Women with frequent unprotected sex,Women with infrequent unprotected sex,A,False,0.17926275730133057,0.23017795383930206,0.430029034614563,0.15819884836673737
A special feature of adaptive immunity is:,Speed of response to a foreign protein,Ability to distinguish self and non self,Ability to distinguish viruses and bacteria,Short memory,B,False,0.13834621012210846,0.22809433937072754,0.5471698641777039,0.0839112251996994
As regards the range of diseases caused by viruses:,Each member of the 'family' causes the same disease.,Members of many families can cause the same sort of disease.,Most virus disease are now controlled by vaccines.,Most viruses can cross placenta and be teratogenic.,B,False,0.15364129841327667,0.13558796048164368,0.28703972697257996,0.4176402986049652
Which is the exception in the following range of disease symptoms caused by bunyaviruses?,Pneumonias,Haemorrhagic fever,Hepatitis,Impaired renal function,D,False,0.13540580868721008,0.06396117061376572,0.4726127088069916,0.3248216509819031
There is no vaccine against HIV because of which of the following?,The virus is so antigenically variable,Such a vaccine would be too expensive,The virus can be controlled by a change in sexual habits,Latency can abrogate any vaccine effect,B,False,0.08939225226640701,0.07888839393854141,0.31200963258743286,0.5144169330596924
The requirements for an effective surveillance system include:,A diagnostic algorithm,Staff members,A sampling frame,All of the above,D,True,0.2780013680458069,0.04263289272785187,0.31501683592796326,0.35696083307266235
MERS has four special characteristics and here we have one exception - which is it?,Spread by faecal oral route,Aerosol droplet transmission,Reservoir in bats,A conduit to humans via camels,C,True,0.17322023212909698,0.17322023212909698,0.32361799478530884,0.32361799478530884
The major beneficiary of Medicaid in the U.S. is:,Single men,The elderly,Women and children,Undocumented residents,C,True,0.07119126617908478,0.03810593858361244,0.526036262512207,0.3615390956401825
Which of the following is the most important for controlling disease caused by norovirus?,A norovirus vaccine,Attention to handwashing and hygiene,Quarantine,New antiviral drugs,B,False,0.1407468616962433,0.15948711335659027,0.43353086709976196,0.26294976472854614
Why do vigorous CD8 cell responses in chronically infected HIV-positive individuals fail to eliminate the virus?,CTL exhaustion,Epitope escape,Suboptimal CTL,Absence of dendritic cells,B,False,0.11385077238082886,0.10047294199466705,0.5102437138557434,0.27311378717422485
The most widespread and important retrovirus is HIV-1; which of the following is true?,Infecting only gay people,Infecting only males,Infecting every country in the world,Infecting only females,A,False,0.11788426339626312,0.09180834889411926,0.32044264674186707,0.4662413001060486
The first acquired immune cell to respond defensively to HIV infection is:,CD4+,CD8+,CD57,NK cells,B,False,0.11748725175857544,0.10368213057518005,0.4100707769393921,0.361886203289032
Which of the following is a special feature of the rabies vaccine?,The vaccine has not changed since the time of L. Pasteur,The original air dried spinal cord of infected rabbits was a killed vaccine,The vaccine still needs 16 doses given into the peritoneal cavity,The modern rabies vaccine is grown in human diploid cells from an aborted embryo,B,False,0.09866932034492493,0.11180699616670609,0.3902447521686554,0.3902447521686554
Most viral vaccines are produced by which of the following techniques?,Traditional cell culture,Molecular biology,Animal tissues in vitro,VLPs (virus like particles),B,False,0.13369405269622803,0.22042423486709595,0.32071536779403687,0.32071536779403687
The treatment of hepatitis C has been revolutionised most recently by which of the following?,The use of interferon,A new vaccine,Monoclonal antibodies,Direct-acting Antivirals such as daclatasvir and sofosbuvir,A,False,0.19785819947719574,0.15409213304519653,0.41886579990386963,0.2242027223110199
Chikungunya has spread widely from Asia and Africa into the Caribbean in recent years. This has been mainly facilitated by:,Mutation in the virus allowing replication in the mosquito Aedes albopictus,Air Travel,Climate change,Poor mosquito control and the absence of DTT,A,False,0.08507314324378967,0.15893757343292236,0.48956218361854553,0.2620437741279602
The successful anti-cancer HPV vaccine consists of:,Live virus attenuated by specific mutagenesis,Whole virus chemically inactivated vaccine,Self-assemble of virus L1 protein into VLP,Sub unit chemically inactivated vaccine,A,False,0.12551942467689514,0.14223214983940125,0.3866270184516907,0.3411971628665924
The rotavirus is an important cause of which of the following?,Respiratory infection in adults,Gastroenteritis in children,Diarrhoea and vomiting in adults,Cancer,B,False,0.21537292003631592,0.14802350103855133,0.35508993268013,0.2765443027019501
The surveillance testing strategy associated with the least selection bias is:,Compulsory,Unlinked anonymous,Voluntary anonymous,Voluntary confidential,A,False,0.07345347106456757,0.15550099313259125,0.4789767861366272,0.29051411151885986
"In a medical class of 147 students, the distribution of scores on a biochemistry final examination has a mean equal to 67, a median equal to 76, a mode equal to 80, a standard deviation equal to 5.5, and a variance equal to 30.25. Three students were unable to take the test on the scheduled date and were given a different form of the exam 1 week later. Which parameter is most likely to be the least biased estimator of central tendency for this distribution of biochemistry test scores?",Mean,Median,Mode,Standard deviation,A,False,0.2392507940530777,0.08801543712615967,0.5064939260482788,0.1644344925880432
What disease do herpes viruses not cause?,Infantile paralysis,Encephalitis,Sexually transmitted disease,Cancer,A,False,0.053690627217292786,0.036900993436574936,0.39672306180000305,0.5094025135040283
The purpose of a double-blind or double-masked study is to:,Achieve comparability of treated and untreated subjects,Reduce the effects of sampling variation,Avoid observer and subject bias,Avoid observer bias and sampling variation,B,False,0.14103111624717712,0.1598091870546341,0.49224695563316345,0.20519906282424927
Nipah is a zoonotic paramyxovirus; where did it originate?,Originating in pigs,Originating in bats,Coming from humans,Coming from horses,C,True,0.14286455512046814,0.16188673675060272,0.3883461058139801,0.3024442493915558
What is the genome structure of the polyomavirus family?,Circular ds DNA with T antigen coding regions,Circular ssDNA,RNA genome with RT,Segmented RNA genome,C,True,0.1294270008802414,0.06113698333501816,0.45174458622932434,0.3518190383911133
Interferons are very special defence mechanisms which operate by:,Binding to viruses,Binding to neighbouring cells,Producing a long lasting state of resistance,Inhibiting virus induced enzymes,B,False,0.2249411791563034,0.17518435418605804,0.4202454388141632,0.17518435418605804
Genetic characteristics of the bunyavirus family include which one of the following?,Three segmented negative stranded RNA viruses with anti-sense expression,Highly mutable RNA viruses,Emerging viruses via arthropod vector,Use an RT enzyme,A,False,0.21244323253631592,0.07815349102020264,0.5774805545806885,0.12885332107543945
"The basic code of ethical research (respect for persons, beneficence, and justice) was first established by the:",Nuremberg Code,Declaration of Helsinki,CIOMS,Belmont Report,D,True,0.17280420660972595,0.17280420660972595,0.28490597009658813,0.36582648754119873
The paramyxovirus family employ what strategy at virus entry?,Initiate a fusion 'from without' using virus F protein,Has fusion from within a cytoplasmic vacuole at low pH,Viruses can puncture plasma membranes at entry,A fusion mediated by M protein,D,False,0.27050283551216125,0.11276237666606903,0.30651986598968506,0.30651986598968506
The risk of acquiring HIV from a unit of blood in the United States is now:,"1/10,000 units","1/200,000 units","1/500,000 unit",1 per 2 million units,D,False,0.21367177367210388,0.2421218454837799,0.3522852063179016,0.18856468796730042
What is the essential pathology of astroviruses?,Very restricted replication in the gut,Can cause infection of the central nervous system,Sequence diversity allows widespread replication,Can cause infection in the upper respiratory tract,A,False,0.16930949687957764,0.19185279309749603,0.316311776638031,0.316311776638031
Which of the following are goals of vaccination?,Prevent infection,Prevent disease,Prevent transmission,All of the above,D,False,0.3361952304840088,0.07501529157161713,0.38095909357070923,0.20391272008419037
Randomization of study subjects in a clinical trial is most helpful for controlling for which of the following?,Placebo effect,Recall bias,Non-compliance,Effect modification (interaction),A,False,0.10270563513040543,0.1163807287812233,0.4602947235107422,0.3163556456565857
A quasi species virus such as influenza and HIV has which of the following characteristics?,A fragmented or segmented genome,Co-existence of innumerable genetic variants,Possesses RNA and DNA,A very large genome,B,False,0.06978746503591537,0.06978746503591537,0.45507141947746277,0.40159910917282104
Positive stranded RNA viruses have which of the following characteristics?,Their genome RNA can be translated directly as mRNA,They have to transcribe their genome RNA to a mirror image copy as a mRNA,This genome is circular,Their RNA genome is segmented,A,False,0.1281842291355133,0.05343513563275337,0.506978452205658,0.3074979782104492
What is the genetic structure of rotavirus?,Circular DNA containing virus,RNA virus with RT,ds RNA virus,ds RNA virus in segments,B,False,0.06039433553814888,0.08787324279546738,0.73575359582901,0.1128314733505249
Are/were viruses:,The most abundant form of life on earth?,Discovered before bacteria?,Grown in animals in the laboratory?,The cause of all human disease?,A,False,0.14352858066558838,0.11178016662597656,0.2366386204957962,0.5009639263153076
It is unlikely that a 'cure' of HIV is possible with current drugs because:,Even in combination current drugs do not completely block viral replication,They do not penetrate to cells,They cannot block viral transcription from integrated viral DNA,They cannot penetrate to the CNS,B,False,0.08277226984500885,0.10628171265125275,0.3273707330226898,0.47632157802581787
Which viruses appear to be hypermutable?,DNA viruses,'Emerging' viruses,Influenza and HIV,RNA viruses,D,False,0.10799834877252579,0.03506192937493324,0.4271417558193207,0.4271417558193207
How are herpes infections controlled?,Chemotherapy,Vaccines,Hygiene and social distancing,No method,A,False,0.11614733934402466,0.0704469159245491,0.405394047498703,0.405394047498703
"A new drug with in vitro activity against HIV is tested on a population of patients with Western-blot confirmed HIV infections. Out of the 200 individuals in the patient population, 100 are chosen by lottery to receive the drug. The drug, which is tasteless, is administered in a cup of orange juice; the other patients receive pure orange juice. Neither the nurses, doctors, nor the patients know which patients receive the drug. At the end of the study period, the number of CD4+ T cells is determined for all of the subjects. This is an example of a",Case-control study,Case report,Cohort study,Cross-sectional study,A,True,0.4675411283969879,0.10432253032922745,0.3213360011577606,0.10432253032922745
What is the most successful and most widely used 'travel' vaccine for international visitors?,Influenza,MMR,Yellow Fever,Rabies,B,False,0.1397930234670639,0.07482580840587616,0.5528920888900757,0.23047971725463867
What is a virus pandemic?,A sharp and rapid epidemic involving more than one country,An outbreak which recurs again and again,A rapid global outbreak starting from a single focus,A characteristic of common cold virus and HIV,C,True,0.1520850956439972,0.11844399571418762,0.530829131603241,0.19528114795684814
Benefits of opioid replacement therapy as an approach for HIV prevention include:,Reducing craving for and use of illicit opioids,More sharing of injecting paraphernalia,Reducing frequency of injection drug use,Both a and c,D,True,0.03907950222492218,0.018459850922226906,0.13640084862709045,0.7849327921867371
Papilloma viruses are characterised by what genetic feature?,A genome of ds circular DNA encoding around 8 ORF,A virus with RT able to integrate and cause cancer,A variable ds RNA virus,A large DNA containing virus,A,False,0.1342540979385376,0.08142922818660736,0.5309852361679077,0.25081968307495117
"As part of the Women’s Health Study, researchers investigated the role of systemic inflammation in predicting cardiovascular disease in women (N Engl J Med. 2002;347[20]:1557-1565). Researchers used a prospective study design with a large sample size. Blood levels of C-reactive protein (CRP) were measured at baseline and women were followed for an average of 8 years. The following table shows the relative risk estimates of cardiovascular event (heart attack or stroke) within 5 years by quintile of CRP level for the 30,000 women. The first quintile is used as the reference category.  1 0.49 mg/dL Relative Risk Number of women  1.0 6000  2 >0.49-1.08 mg/dL 1.8 6000  Quintile of CRP Level 3 >1.08-2.09 mg/dL 2.3 6000  4 >2.09-4.19 mg/dL 3.2 6000  5 >4.19 mg/dL 4.5 6000  Based on the relative risk data above, one can conclude:",There is no risk of heart attack/stroke for women with CRP levels in the first quintile.,Decreasing CRP level appears to increase the risk of heart attack/stroke.,Increasing CRP level appears to increase the risk of heart attack/stroke.,There appears to be no association between CRP levels and heart attack/stroke.,A,False,0.20960433781147003,0.23751282691955566,0.30497249960899353,0.23751282691955566
What is the morphology of the Dane particle?,Double shelled icosahedron,Lipid membrane free icosahedron,Flexuous and filamentous morphology,Numerous small particles,C,True,0.22792211174964905,0.10766278207302094,0.48251110315322876,0.17750594019889832
The adenovirus virion has which unique structural feature?,Icosahedron,Icosahedron with slender fibres,'Complex' structure not yet fully explored,Flexuous lipid containing structure,B,False,0.18017779290676117,0.08510995656251907,0.2970629632472992,0.4322240650653839
"A city has a population of 250,000 cases and 400 deaths each year from this disease. There are 2,500 deaths per year from all causes. The prevalence of this disease is given by","400/250,000","600/250,000","1,000/250,000","2,500/250,000",D,False,0.29113250970840454,0.17658080160617828,0.37382155656814575,0.15583200752735138
Which unique form does the rabies virus take?,The virion has a dumbbell appearance,It is shaped like a bullet from a gun,The virus is star shaped,The virion is very pleomorphic,D,False,0.2912043035030365,0.07362797111272812,0.3739137351512909,0.25698691606521606
Which of the following diseases is not caused by togaviruses?,Chikungunya,Rubella (German measles),Western Equine encephalitis,Yellow Fever,D,False,0.1021694615483284,0.06196891516447067,0.5188593864440918,0.31470412015914917
Why are the viruses of this family called astroviruses?,Because of the nucleotide sequence of their genomes,The superficial appearance of a 'star' on negative straining electron microscopy,"Because of isolation in very large numbers of mammals including dromedaries, cats and cattle",Because they are more common in developing countries with poor hygiene,B,False,0.1368432343006134,0.12076371908187866,0.25565680861473083,0.47762978076934814
Why do emerging viruses like Zika and Ebola continue to plague us?,These viruses mutate and hence emerge,We disturb forests where they quietly exist as a zoonosis,Mosquitoes are the main culprit to encourage virus spread,The viruses can be halted by new vaccines,B,False,0.14271993935108185,0.05250373110175133,0.16172288358211517,0.6396263837814331
