0,1,2,3,4,5,correct,choiceA_probs,choiceB_probs,choiceC_probs,choiceD_probs
"In a hypothetical population's gene pool, an autosomal gene, which had previously been fixed, undergoes a mutation that introduces a new allele, one inherited according to incomplete dominance. Natural selection then causes stabilizing selection at this locus. Consequently, what should happen over the course of many generations?",The proportions of both types of homozygote should decrease.,The proportion of the population that is heterozygous at this locus should remain constant.,The population's average heterozygosity should increase.,Both A and C,D,True,0.1209699735045433,0.0647505596280098,0.19944578409194946,0.6143362522125244
Which of the following is the correct characteristic of arteries?,They are thin-walled blood vessels.,They contain valves that prevent backflow.,They always carry oxygenated blood.,They carry blood away from the heart.,D,False,0.1577780395746231,0.09569721668958664,0.48599061369895935,0.2601320445537567
Which of the following statements about trypsin is NOT true?,It is an organic compound made of proteins.,It is a catalyst that alters the rate of a reaction.,It is operative over a wide pH range.,The rate of catalysis is affected by the concentration of substrate.,C,True,0.012462400831282139,0.04349805414676666,0.5299147963523865,0.41269803047180176
Transcription-affecting DNA region that may be located thousands of basepairs away from the promoter.,Enhancer,Repressor,Operator,Promoter,A,False,0.021947557106614113,0.015084320679306984,0.7268033027648926,0.23595847189426422
Which of the following are traits that are affected by more than one gene?,Heterozygous traits,Pleiotropic traits,Polygenic traits,Blended alleles,C,True,0.059592850506305695,0.03189775347709656,0.6406835317611694,0.26707664132118225
A student conducts an experiment to test the efficiency of a certain enzyme. Which of the following protocols would probably not result in a change in the enzyme’s efficiency?,Bringing the temperature of the experimental setup from 20°C to 50°C,Adding an acidic solution to the setup,Adding substrate but not enzyme,Placing the substrate and enzyme in a container with double the capacity,D,False,0.09600938856601715,0.2609805762767792,0.37972450256347656,0.2609805762767792
"Kangaroo rats are better able to concentrate urine than humans are. It would be expected that, compared to the nephrons of human kidneys, the nephrons of kangaroo-rat kidneys would have","thicker walls, which are impermeable to water",shorter loops of Henle,longer loops of Henle,shorter collecting ducts,C,True,0.187617227435112,0.11379559338092804,0.5099964737892151,0.187617227435112
"The geneticist Mary Lyon hypothesized the existence of structures visible just under the nuclear membrane in mammals, which were later named Barr bodies. Which of the following statement is NOT correct about Barr bodies?","In the early female embryo, one copy of the X chromosome becomes inactivated in every body cell.",The same chromosome in every cell of a normal female is inactivated.,A male with the XXY genotype will have one Barr body.,Barr bodies consist of highly methylated DNA.,B,False,0.07163873314857483,0.15165922045707703,0.4122524559497833,0.36381152272224426
An animal cell that is permeable to water but not salts has an internal NaCl concentration of 10%. If placed in freshwater the cell will,plasmolyze,swell and eventually lyse,endocytose water into a large central vacuole,shrivel,B,False,0.12731286883354187,0.09915135055780411,0.5035321712493896,0.2695213556289673
Chemiosmosis occurs in I.Mitochondria II. Nuclei III. Chloroplasts,I only,II only,III only,I and III,D,True,0.005000682082027197,0.009342504665255547,0.03260854259133339,0.9529613256454468
All of the following are examples of events that can prevent interspecific breeding EXCEPT,the potential mates experience geographic isolation,the potential mates experience behavioral isolation,the potential mates have different courtship rituals,the potential mates have similar breeding seasons,D,True,0.07747290283441544,0.07747290283441544,0.2704070210456848,0.572451651096344
The relatives of a group of pelicans from the same species that separated from each other because of an unsuccessful migration are reunited 150 years later and find that they are unable to produce offspring. This is an example of,allopatric speciation.,sympatric speciation.,genetic drift.,gene flow.,A,False,0.14518523216247559,0.099784255027771,0.44720199704170227,0.30735716223716736
"If two modern organisms are distantly related in an evolutionary sense, then one should expect that",they live in very different habitats.,they should share fewer homologous structures than two more closely related organisms.,their chromosomes should be very similar.,they shared a common ancestor relatively recently.,B,False,0.10539595782756805,0.13533109426498413,0.535244882106781,0.22312325239181519
"When water evaporates from the surface of a pond, what happens to the remaining liquid water?",The surface water cools.,The surface water warms.,The surface water temperature remains unchanged.,The pH of the remaining water decreases.,A,False,0.1463797390460968,0.061020150780677795,0.5789430737495422,0.21298128366470337
Members of which of the following groups are most likely to be surrounded by a protein coat?,Viruses,Bacteria,Eukaryotes,Archaea,A,False,0.07579408586025238,0.021715370938181877,0.7191143035888672,0.1818205714225769
Villi and microvilli are present in the small intestine and aid in reabsorption by,increasing the surface area of the small intestine,decreasing the surface area of the small intestine,making the small intestine more hydrophilic,making the small intestine more hydrophobic,A,False,0.17492400109767914,0.09363006055355072,0.4754927158355713,0.2545129060745239
The transfer of DNA between two bacterial cells connected by sex pili is known as,specialized transduction.,conjugation.,transformation.,generalized transduction.,B,False,0.058009613305330276,0.04517793282866478,0.8007979989051819,0.09564168006181717
"More than a dozen species of Darwin's finches with various specialized adaptations inhabit the Galápagos Islands. Each species possesses a specialized adaptation for obtaining food. Why is it that similar adaptations do not exist among the finches of the South American mainland, the presumed origin of the Galápagos finch ancestor?",The various foods available on the mainland are different than those on the Galápagos Islands.,South American predators limited evolution of the mainland finch.,Reproductive isolation is not possible on the mainland.,The available niches that the Darwin's finches exploited on the Galápagos Islands were already occupied by other species of birds on the mainland.,D,True,0.06013328209519386,0.04132896289229393,0.16345921158790588,0.7325733304023743
Which of the events described below agrees with the idea of catastrophism?,The gradual uplift of the Himalayas by the collision of the Australian crustal plate with the Eurasian crustal plate,The formation of the Grand Canyon by the Colorado River over millions of years,The gradual deposition of sediments many kilometers thick on the floors of seas and oceans,"The sudden demise of the dinosaurs, and various other groups, by the impact of a large extraterrestrial body with Earth",D,False,0.15338675677776337,0.1738099455833435,0.4169483780860901,0.25289198756217957
Which of the following statements correctly describes what happens to the preRNA during RNA processing?,Introns are removed in the nucleus. A 5′ cap and the poly-A tail are added after the preRNA leaves the nucleus.,Introns are removed and both a 5′ cap and a poly-A tail are added before the preRNA leaves the nucleus.,"Exons are removed and a 5′ cap is added before the preRNA leaves the nucleus. After leaving the nucleus, the poly-A tail is added.","Point mutations are repaired, exons are removed, and both a 5′ cap and a poly-A tail are added before the preRNA leaves the nucleus.",B,False,0.0760977491736412,0.05926498398184776,0.5622905492782593,0.30097246170043945
A small population of birds is blown to an isolated island by a hurricane and establishes a colony. The gene pool of the newly established population of birds is likely to reflect the effects of which of the following?,Directed mutation,Genetic drift,Adaptive radiation,Disruptive selection,B,False,0.08659281581640244,0.11118736863136292,0.6398391723632812,0.16177669167518616
"Nymphaea odorata, a water lily, is an aquatic plant whose leaves and flowers float on the surface of the water. Which of the following characteristics would be expected for leaves of this plant?",stomata on the top surface and relatively few water-conducting (xylem) cells,stomata on the top surface and relatively many water-conducting (xylem) cells,stomata on the bottom surface and relatively few water-conducting (xylem) cells,stomata on the bottom surface and relatively many water-conducting (xylem) cells,A,False,0.0627865269780159,0.09135385602712631,0.5257051587104797,0.31885629892349243
Which of the following statements is not correct about lipids?,Lipids consist of fatty acids and glycerol.,Steroids are examples of lipids.,The molecules of a saturated fatty acid are packed so close together that they form a solid at room temperature.,"The head of a phospholipid is hydrophobic, and the tails are hydrophilic.",D,False,0.014733363874256611,0.05142449215054512,0.5528653860092163,0.3799784779548645
Heterozygote advantage should be most closely linked to which of the following?,sexual selection,stabilizing selection,random selection,directional selection,B,False,0.056858908385038376,0.10622642189264297,0.6112908720970154,0.2248813807964325
"African lungfish often live in small, stagnant, freshwater pools. With reduced gills, they differ from other fish in that they breathe air. They also differ in that they release the nitrogen waste urea instead of ammonia. Which of the following statements correctly explains how this is an advantage for lungfish?",Urea is insoluble in water and sinks to the bottom of the small pools. Thus the poisonous substance is isolated from the fish.,"Ammonia, which is highly toxic, would endanger lungfish that inhabit the small pools.",Other fish in the small pools can use urea as an energy source.,The highly toxic urea makes the pool uninhabitable to competitors.,B,False,0.04727284610271454,0.053567156195640564,0.4485122859477997,0.4485122859477997
Which of the following statements about the immune system is NOT correct?,"Innate immunity, also known as the adaptive immune response, relies on circulating phagocytes engulfing foreign substances.",Adaptive immunity is a slower response than innate immunity.,Innate immunity activates a humoral response.,Dendritic cells are antigen presenting cells.,A,False,0.05017264187335968,0.08272070437669754,0.6112279295921326,0.25479769706726074
Which of the following is most correct concerning cell differentiation in vertebrates?,"Cells in different tissues contain different sets of genes, leading to structural and functional differences.",Differences in the timing and expression levels of different genes leads to structural and functional differences.,Differences in the reading frame of mRNA leads to structural and functional differences.,Differences between tissues result from spontaneous morphogenesis.,B,False,0.15044961869716644,0.15044961869716644,0.5950397849082947,0.10340240597724915
"All of the following support the endosymbiotic theory that ancestors of mitochondria and chloroplasts were once independent, free-living prokaryotes EXCEPT:",Mitochondria and chloroplasts divide independently of the eukaryotic host cell by a process similar to binary fission.,Mitochondria and chloroplasts have ribosomes that more closely resemble those of bacteria than of eukaryotic cells.,Mitochondria and chloroplasts function independently from the eukaryotic host cell.,"Mitochondria, chloroplasts, and bacteria have a single, circular chromosome without histones or proteins.",C,False,0.12843836843967438,0.2117590457201004,0.3081075847148895,0.34913164377212524
"The frequency of a particular allele in a population of 1,000 birds in Hardy-Weinberg equilibrium is 0.3. If the population remains in equilibrium, what would be the expected frequency of that allele after 500 years?",It will increase if the allele is favorable or will decrease if it is unfavorable for individuals in that population.,Not enough information is provided to determine if the frequency of the allele will remain the same or change.,The frequency of the allele will remain at 0.3 because the population is at Hardy-Weinberg equilibrium.,The frequency of the allele will remain the same; this is an example of the bottleneck effect.,C,True,0.17115077376365662,0.0337015837430954,0.6769144535064697,0.11763007938861847
Which of the following best accounts for the ability of legumes to grow well in nitrogen-poor soils?,These plants make their own proteins.,These plants have a mutualistic relationship with nitrogen-fixing bacteria.,These plants are capable of directly converting nitrogen gas into nitrates.,These plants do not require nitrogen to make plant proteins.,B,False,0.0570576973259449,0.25571486353874207,0.6134280562400818,0.07326353341341019
"To ensure that hatchling sea turtles orient to the sea rather than inland, which of the following is the most environmentally sound practice around sea turtle nest sites?",Digging troughs in the sand from the nests to the sea,Minimizing artificial lighting in the area,Scattering preferred turtle foods between the nests and the sea,Building low fences on the sand dunes,B,False,0.14095503091812134,0.14095503091812134,0.6317166090011597,0.0854935497045517
"In general, animal cells differ from plant cells in that animal cells have",a cell wall made of cellulose,lysosomes,large vacuoles that store water,centrioles within centrosomes,D,False,0.17662888765335083,0.20014674961566925,0.32998618483543396,0.2912117838859558
Which of the following disorders will most likely result from X chromosome aneuploidy in women?,Cystic fibrosis,Hemophilia,Turner syndrome,Tay-Sachs disease,C,True,0.06774810701608658,0.04109130799770355,0.7283608317375183,0.16251927614212036
Which statement about the beak size of finches on the island of Daphne Major during prolonged drought is true?,"Each bird evolved a deeper, stronger beak as the drought persisted.","Each bird developed a deeper, stronger beak as the drought persisted.",Each bird's survival was strongly influenced by the depth and strength of its beak as the drought persisted.,"Each bird that survived the drought produced only offspring with deeper, stronger beaks than seen in the previous generation.",C,True,0.004686129745095968,0.008754842914640903,0.6954833269119263,0.2899205684661865
"The normal pH of the cytosol is about 7.2. Most enzymes in the lysosome, however, are only active at a pH of 5. This suggests that",only acidic substances can undergo enzymatic processing in lysosomes,most enzymes in the lysosome are incapable of catalyzing substrates inside the lysosome,enzymes in the lysosome are released to the cytosol,protons are actively pumped into the lysosome,D,True,0.13940006494522095,0.09580817818641663,0.334403395652771,0.42938244342803955
A feature of amino acids NOT found in carbohydrates is the presence of,carbon atoms,oxygen atoms,nitrogen atoms,hydrogen atoms,C,True,0.03720688074827194,0.047774579375982285,0.5136251449584961,0.40001165866851807
"A researcher grows a population of ferns in her laboratory. She notices, after a few generations, a new variant that has a distinct phenotype. When she tries to breed the original phenotype with the new one, no offspring are produced. When she breeds the new variants, however, offspring that look like the new variant result. What kind of speciation does this example illustrate?",Allopatric,Sympatric,Isolated,Polyploidy,B,False,0.11037438362836838,0.05907914787530899,0.7197313904762268,0.11037438362836838
Natural selection is based on all of the following except,genetic variation exists within populations.,the best-adapted individuals tend to leave the most offspring.,individuals who survive longer tend to leave more offspring than those who die young.,"individuals adapt to their environments and, thereby, evolve.",D,False,0.020124005153775215,0.061986301094293594,0.45802026987075806,0.45802026987075806
"In chick embryos, the extraembryonic membrane that provides nourishment to the fetus is the",amnion,chorion,placenta,egg yolk,D,False,0.041734710335731506,0.05358842760324478,0.5084328651428223,0.39596793055534363
A certain species of land snail exists as either a cream color or a solid brown color. Intermediate individuals are relatively rare. Which of the following terms best describes this?,artificial selection,directional selection,stabilizing selection,disruptive selection,D,False,0.1714741736650467,0.1335442215204239,0.41134515404701233,0.2827131152153015
"Once a plasmid has incorporated specific genes, such as the gene coding for the antibiotic ampicillin, into its genome, the plasmid may be cloned by",inserting it into a virus to generate multiple copies,treating it with a restriction enzyme in order to cut the molecule into small pieces,inserting it into a suitable bacterium in order to produce multiple copies,running it on a gel electrophoresis in order to determine the size of the gene of interest,C,True,0.09251266717910767,0.22192637622356415,0.6032583713531494,0.08164214342832565
Which of the following pairs of scientists pioneered the ecological discipline known as island biogeography?,Robert MacArthur and E. O. Wilson,James Watson and Francis Crick,Matthias Schleiden and Theodor Schwann,Alfred Hershey and Martha Chase,A,False,0.35163697600364685,0.08890774101018906,0.5116287469863892,0.04758888855576515
The acrosome and cortical reactions that occur immediately after fertilization ensure which of the following?,The sperm will fertilize the ovum.,The zygote will begin to divide normally.,One and only one sperm will fertilize the egg.,"The zygote will not divide into two embryos, producing twins.",C,True,0.16642802953720093,0.16642802953720093,0.45239824056625366,0.21369780600070953
snRNPs are most closely associated with which of the following?,Cell division,Apoptosis,Replication of DNA,RNA processing,D,False,0.10178776830434799,0.08982738852500916,0.4025784134864807,0.4025784134864807
Transpiration is a result of special properties of water. The special properties of water include all of the following EXCEPT,cohesion,adhesion,capillary action,hydrophobicity,D,True,0.039838146418333054,0.045142535120248795,0.4283004403114319,0.48532798886299133
Which of the following statements best explains why Mendel's principle of segregation was deemed a law?,Mendel's work with pea plants and his conclusions have been described in many sources.,The patterns of trait inheritance observed in pea plants were repeatedly demonstrated in other eukaryotes.,Chromosomes were found to contain the genetic information for traits.,The discovery of the structure of D N A supported Mendel's observations and laws.,B,False,0.09006509184837341,0.1906677931547165,0.5872981548309326,0.131043940782547
Protein that prevents the binding of RNA polymerase to the promoter site.,Enhancer,Repressor,Operator,Promoter,B,False,0.010206116363406181,0.019067535176873207,0.8107722401618958,0.1596505045890808
Which of these is the smallest unit that natural selection can change?,a species' gene frequency,a population's gene frequency,an individual's genome,an individual's genotype,B,False,0.09179875254631042,0.026300782337784767,0.5986030101776123,0.28276005387306213
Which of these is the smallest unit upon which natural selection directly acts?,a species' gene frequency,a population's gene frequency,an individual's genome,an individual's phenotype,D,False,0.106263168156147,0.026867540553212166,0.6115024089813232,0.2549121081829071
A chemical agent is found to denature all enzymes in the synaptic cleft. What effect will this agent have on acetylcholine?,Acetylcholine will not be released from the presynaptic membrane.,Acetylcholine will not bind to receptor proteins on the postsynaptic membrane.,Acetylcholine will not diffuse across the cleft to the postsynaptic membrane.,Acetylcholine will not be degraded in the synaptic cleft.,D,False,0.043864309787750244,0.07232002168893814,0.6861532926559448,0.19658620655536652
"The reaction A + B → C is catalyzed by enzyme K. If the reaction is in equilibrium, which of the following would allow more product C to be produced?",removing some of reactant A,removing some of reactant C,adding more enzyme K,increasing the temperature of the system,B,False,0.040290530771017075,0.12410356849431992,0.6302499771118164,0.20461219549179077
A new plant was discovered and determined to have an unusually low number of stomata on the undersides of its leaves. For what environment would this plant most likely be best adapted?,Cold and rainy,Humid and sunny,Hot and humid,Hot and dry,D,False,0.05977692827582359,0.06773613393306732,0.7282320857048035,0.14339739084243774
Which of the following adaptive features would least likely be found in an animal living in a hot arid environment?,Long loops of Henle to maximize water reabsorption,Storage of water in fatty tissues,Large ears to aid in heat dispersion,Short loops of Henle to maximize water secretion,D,False,0.08780262619256973,0.09949341416358948,0.5052692890167236,0.30646130442619324
"Certain populations of finches have long been isolated on the Galapagos Islands off the western coast of South America. Compared with the larger stock population of mainland finches, these separate populations exhibit far greater variation over a wider range of species. The variation among these numerous finch species is the result of",convergent evolution,divergent evolution,disruptive selection,stabilizing selection,B,False,0.14217804372310638,0.05926863104104996,0.7220397591590881,0.07610242813825607
Memory loss would most likely be due to a malfunction of which part of the brain?,Medulla,Cerebellum,Cerebrum,Pons,C,False,0.04221884161233902,0.04221884161233902,0.16697874665260315,0.7483468055725098
The major difference between cartilage and bone is that cartilage,is a part of the skeletal system,is composed of collagen and salts,lacks blood vessels and nerves,secretes a matrix,C,False,0.030682876706123352,0.012790526263415813,0.25690460205078125,0.69833904504776
Viral transduction is the process by which viruses carry bacterial DNA from one bacterial cell to another. In what way does this process play a role in bacterial evolution?,By making the bacterial cell more resistant to predators,By directly creating new species of bacteria,By increasing genetic variation of the bacteria,By selecting for viruses better able to infect bacteria,C,True,0.11447270214557648,0.11447270214557648,0.5813403725624084,0.18873359262943268
Cattle breeders have improved the quality of meat over the years by which process?,artificial selection,directional selection,stabilizing selection,A and B,D,True,0.05917494371533394,0.013203714974224567,0.20654085278511047,0.7208983898162842
"The fluidity of the plasma membrane can vary in response to temperature changes. For bacteria and yeast cells, which of the following would be a viable strategy to maintain homeostasis of the plasma membrane in a temperature-varying environment?",Increase the concentration of solutes in the cytosol.,Change the ratio of phospholipids with double covalent bonds in their tails to those without double covalent bonds in their tails.,Replace phospholipids with glucose molecules.,Exchange phospholipids from one side of the plasma membrane to the other.,B,False,0.12312856316566467,0.2300344556570053,0.48698291182518005,0.1581002026796341
"You are told that in a population of guinea pigs, 4 percent are black (recessive) and 96 percent are brown. Which of the following is the frequency of the heterozygous condition?",16 percent,32 percent,40 percent,48 percent,B,False,0.007110724225640297,0.059537362307310104,0.7253135442733765,0.2078058123588562
"Of the following anatomical structures, which is homologous to the wing of a bird?",Dorsal fin of a shark,Hindlimb of a kangaroo,Wing of a butterfly,Flipper of a cetacean,D,False,0.04963207244873047,0.03865349665284157,0.7763762474060059,0.13491395115852356
Darwin's mechanism of natural selection required long time spans in order to modify species. From whom did Darwin get the concept of Earth's ancient age?,Georges Cuvier,Charles Lyell,Alfred Wallace,Thomas Malthus,B,False,0.04775077849626541,0.07872772216796875,0.6591790914535522,0.21400412917137146
"A researcher is experimenting with nerve transmission using neurons from a giant squid. At the beginning of the experiment, the axon is at rest and has a threshold measured at –70 mV at 37oC. The axon receives one stimulus that triggers one action potential in the axon. Subsequent stimuli are much stronger. Which of the following statements explains what happens when several strong stimuli are experienced by the axon?",The axon becomes hyperpolarized to –90 mV.,The axon becomes hyperpolarized to –50 mV.,The strength of the action potential becomes greater.,The frequency of the action potential increases.,D,False,0.09096366167068481,0.19257012009620667,0.523459792137146,0.19257012009620667
Refer to question 15 for details on the squirrel population. Which of the following conditions is required to keep this population in Hardy-Weinberg equilibrium?,Random mating,Genetic drift,Mutation,Gene flow,A,False,0.07818933576345444,0.060893915593624115,0.5098584890365601,0.3504202961921692
