0,1,2,3,4,5,correct,choiceA_probs,choiceB_probs,choiceC_probs,choiceD_probs
"In a population of giraffes, an environmental change occurs that favors individuals that are tallest. As a result, more of the taller individuals are able to obtain nutrients and survive to pass along their genetic information. This is an example of",directional selection.,stabilizing selection.,sexual selection.,disruptive selection.,A,False,0.14388151466846466,0.14388151466846466,0.5021958351135254,0.20934636890888214
Which of the changes below following the start codon in an mRNA would most likely have the greatest deleterious effect?,a deletion of a single nucleotide,a deletion of a nucleotide triplet,a single nucleotide substitution of the nucleotide occupying the first codon position,a single nucleotide substitution of the nucleotide occupying the third codon position,A,False,0.0702177956700325,0.13118411600589752,0.6662079691886902,0.13118411600589752
The energy given up by electrons as they move through the electron transport chain is used to,break down glucose,make glucose,produce ATP,make NADH,C,True,0.10950024425983429,0.06641525030136108,0.7140312790870667,0.10950024425983429
"During the period when life is believed to have begun, the atmosphere on primitive Earth contained abundant amounts of all the following gases EXCEPT",oxygen,hydrogen,ammonia,methane,A,False,0.01793384738266468,0.048749253153800964,0.40817251801490784,0.5241038799285889
Convergent evolution is best exemplified by which of the following?,The pectoral fins of fish and the front legs of cats,The presence of a notochord in all chordate embryos,The wings of an insect and the wings of a bird,The leaves of an oak tree and the spines of a cactus,C,True,0.16065873205661774,0.23375707864761353,0.3401145339012146,0.2648814618587494
Which of the following would most likely provide examples of mitotic cell divisions?,cross section of muscle tissue,cross section of an anther (site of pollen production in a flower),longitudinal section of a shoot tip,cross section of a leaf,C,True,0.05817225202918053,0.07469464838504791,0.4870702922344208,0.37933072447776794
Invertebrate immune systems possess which of the following?,Cytotoxic T-lymphocytes,Phagocytes,B-cells,Helper T-cells,B,False,0.05744030699133873,0.06508839130401611,0.6997661590576172,0.1769285947084427
Two unrelated species evolve in a way that makes them more similar.,Divergent evolution,Convergent evolution,Parallel evolution,Coevolution,B,False,0.02445014752447605,0.02445014752447605,0.8096776604652405,0.14070087671279907
Which of the following is the most likely benefit of periodic natural wildfires in some forest ecosystems?,"The fires remove dead and decaying plant matter, reducing the risk of more intense and destructive fires.",The fires leach nutrients from the soil‚ preventing the germination of plants that might compete with native species.,The fires drive off herbivores whose plant-based diets reduce the amount of vegetation.,The fires dry out the soil and decrease the chance of flooding after heavy rains.,A,False,0.11384741961956024,0.10046998411417007,0.51022869348526,0.27310577034950256
"In a hypothetical environment, fishes called pike-cichlids are visual predators of algae-eating fish (i.e., they locate their prey by sight). If a population of algae-eaters experiences predation pressure from pike-cichlids, which of the following should least likely be observed in the algae-eater population over the course of many generations?",Selection for drab coloration of the algae-eaters,Selection for nocturnal algae-eaters (active only at night),"Selection for larger female algae-eaters, bearing broods composed of more, and larger, young",Selection for algae-eaters that become sexually mature at smaller overall body sizes,C,False,0.3069038689136505,0.1449711173772812,0.3069038689136505,0.23901696503162384
A man contracts the same flu strain for the second time in a single winter season. The second time he experiences fewer symptoms and recovers more quickly. Which cells are responsible for this rapid recovery?,Helper T cells,Cytotoxic T cells,Memory cells,Plasma cells,C,False,0.01618390530347824,0.030235517770051956,0.4173884093761444,0.5359373092651367
"The same gene that causes various coat patterns in wild and domesticated cats also causes the cross-eyed condition in these cats, the cross-eyed condition being slightly maladaptive. In a hypothetical environment, the coat pattern that is associated with crossed eyes is highly adaptive, with the result that both the coat pattern and the cross-eyed condition increase in a feline population over time. Which statement is supported by these observations?",Evolution is progressive and tends toward a more perfect population.,Phenotype is often the result of compromise.,Natural selection reduces the frequency of maladaptive genes in populations over the course of time.,"Polygenic inheritance is generally maladaptive, and should become less common in future generations.",B,False,0.03208650276064873,0.052901703864336014,0.6444746851921082,0.26865699887275696
Which of the following statements is correct?,Water flows from hypertonic to hypotonic.,Germinating seeds use less oxygen than do nongerminating seeds.,The rate of transpiration decreases with an increase in air movement.,Smaller DNA fragments migrate more rapidly than do larger DNA fragments on gel electrophoresis.,D,False,0.07603829354047775,0.1253659576177597,0.4958319664001465,0.30073729157447815
A gas phase is generally absent from which of the following biogeochemical cycles?,Water,Carbon,Sulfur,Phosphorus,D,False,0.04627148061990738,0.04627148061990738,0.7238078117370605,0.18300727009773254
Which of the following is a property that is shared by Zika fever‚ West Nile fever‚ and malaria?,The diseases are caused by viruses.,The diseases occur only in individuals who visit or live in tropical countries.,The pathogens that cause the diseases have developed resistance to antibiotics.,The pathogens that cause the diseases are primarily transmitted by the bite of an infected mosquito.,D,True,0.0505552813410759,0.07355749607086182,0.17645525932312012,0.6978940963745117
"If the HMS Beagle had completely bypassed the Galapagos Islands, Darwin would have had a much poorer understanding of the",relative stability of a well-adapted population's numbers over many generations.,ability of populations to undergo modification as they adapt to a particular environment.,tendency of organisms to produce the exact number of offspring that the environment can support.,unlimited resources that support population growth in most natural environments.,B,False,0.16214953362941742,0.08679239451885223,0.5659574866294861,0.18373948335647583
Which of the following statements about lipids is correct?,Unsaturated fatty acids are linked to heart disease.,Lipids make up most cell surface receptors.,Phospholipids are water soluble.,Steroids are lipids that consist of glycerol and fatty acids.,C,True,0.015763089060783386,0.03337046504020691,0.5915055871009827,0.3587662875652313
All of the following are examples of connective tissue EXCEPT,ligaments,muscle,blood,cartilage,B,False,0.018988627940416336,0.03547542542219162,0.2313288450241089,0.7125430107116699
The light reactions of photosynthesis supply the Calvin cycle with which of the following?,The light reactions provide oxygen for the light-independent reactions.,ATP and NADPH provide the power and raw materials for the Calvin cycle.,Water entering the plant through the roots provides hydrogen directly to the Calvin cycle.,CO2 released by the light-dependent reactions provides the raw material for the Calvin cycle.,B,False,0.0760611891746521,0.12540368735790253,0.636852502822876,0.16102153062820435
"When the first tiny prokaryotic cell took up residence inside a larger prokaryotic cell, it heralded the advent of the eukaryotic cell and led to an explosion of new life on Earth. Since then, most cells on Earth have internal organelles. Which of the following best summarizes an advantage of having internal membranes and organelles?",DNA can reproduce more efficiently.,"Even though prokaryotes do not have mitochondria, they contain structures that carry out the same function.",Organelles separate specific reactions in the cell and increase metabolic efficiency.,Compartmentalization enables prokaryotes to reproduce more quickly.,C,True,0.009270231239497662,0.025199100375175476,0.9455892443656921,0.01962507888674736
Which of the following is correct about vaccination?,It increases the number of different receptors that recognize a particular pathogen.,It increases the number of different macrophages specific to the antigen.,It increases the number of epitopes that the immune system can recognize.,It increases the number of lymphocytes with receptors that can recognize and bind to the antigen.,D,False,0.12464256584644318,0.10999666154384613,0.5586091876029968,0.20550085604190826
"The calypso orchid, Calypso bulbosa, grows in close association with mycorrhizae fungi. The fungi penetrate the roots of the flower and take advantage of the plant's food resources. The fungi concentrate rare minerals, such as phosphates, in the roots and make them readily accessible to the orchid. This situation is an example of",parasitism,commensalism,mutualism,endosymbiosis,C,True,0.10755680501461029,0.03956793621182442,0.7947432398796082,0.057571008801460266
"Mules are relatively long-lived and hardy organisms that cannot, generally speaking, perform successful meiosis. Consequently, which statement about mules is true?",They have a relative evolutionary fitness of zero.,Their offspring have less genetic variation than the parents.,Mutations cannot occur in their genomes.,"If crossing-over happens in mules, then it must be limited to prophase of mitosis.",A,False,0.06944958865642548,0.12974892556667328,0.3996548354625702,0.3996548354625702
ADH is a hormone secreted by the kidneys that reduces the amount of water excreted in the urine. ADH is released in times of dehydration. This is an example of,innate behavior.,maintaining homeostasis.,failure to respond to the environment.,positive feedback.,B,False,0.0359896756708622,0.09783008694648743,0.7228720188140869,0.14234192669391632
All of the following statements are true EXCEPT,thyroxine increases the rate of metabolism,insulin decreases storage of glycogen,vasopressin stimulates water reabsorption in the kidney,epinephrine increases blood sugar levels and heart rate,B,False,0.05498876795172691,0.10273254662752151,0.16937732696533203,0.6699003577232361
Which of the following statements best describes what a Barr body is and its significance?,It is an inactivated Y chromosome and results in a man being sterile.,"It is an inactivated Y chromosome, and the person who has it appears female.",It is an inactivated X chromosome and results in females with half their cells having one X inactivated and the other half of their cells having the other X inactivated.,It is an inactivated X chromosome and results in females who are sterile.,C,True,0.061495549976825714,0.061495549976825714,0.6611394882202148,0.2146405726671219
A heterotroph,"obtains its energy from sunlight, harnessed by pigments",obtains its energy by oxidizing organic molecules,makes organic molecules from CO2,obtains its energy by consuming exclusively autotrophs,B,False,0.11648320406675339,0.13199277222156525,0.670314610004425,0.08005766570568085
Which of the following reactions occurs in the forward direction during glycolysis but in the reverse direction during fermentation?,pyruvate → lactate,pyruvate → ethanol,NAD+ + H+ + 2e- → NADH,ADP + P → ATP,C,True,0.0640074610710144,0.17399033904075623,0.6072859168052673,0.15354593098163605
"A researcher grows a population of ferns in her laboratory. She notices, after a few generations, a new variant that has a distinct phenotype. When she tries to breed the original phenotype with the new one, no offspring are produced. When she breeds the new variants, however, offspring that look like the new variant result. What originally caused the change in the variant?",Karyotyping,Balance polymorphism,Mutation,Polyploidy,C,True,0.0367196686565876,0.06054050102829933,0.7375342845916748,0.16456614434719086
Which of the following statements most accurately explains what EcoR1 is?,It is a bacterium that lives in the human large intestine.,"It is the best-studied bacteriophage, a virus that attacks E. coli.",It is a restriction enzyme extracted from E. coli.,It is a type of DNA used extensively in research.,C,True,0.007755220402032137,0.03067249059677124,0.8963816165924072,0.0649336650967598
Which of the following pairs of structures is least likely to represent homology?,The wings of a bat and the arms of a human,The hemoglobin of a baboon and that of a gorilla,The mitochondria of a plant and those of an animal,The wings of a bird and those of an insect,D,True,0.0336906760931015,0.04901963844895363,0.31964820623397827,0.5971814393997192
The development of an egg without fertilization is known as,meiosis,parthenogenesis,embryogenesis,vegetative propagation,B,False,0.058309271931648254,0.02754334919154644,0.71035236120224,0.20351937413215637
"In minks, the gene for brown fur (B) is dominant over the gene for silver fur (b). Which set of genotypes represents a cross that could produce offspring with silver fur from parents that both have brown fur?",BB BB,BB Bb,Bb Bb,Bb bb,C,True,0.025400275364518166,0.0782383605837822,0.6550817489624023,0.24099113047122955
"Male satin bowerbirds adorn structures that they build, called ""bowers,"" with parrot feathers, flowers, and other bizarre ornaments in order to attract females. Females inspect the bowers and, if suitably impressed, allow males to mate with them. The evolution of this male behavior is due to",frequency-dependent selection.,artificial selection.,sexual selection.,natural selection.,C,False,0.09243165701627731,0.07198585569858551,0.36557433009147644,0.46940672397613525
Which of the following best explains why a population is described as the evolutionary unit?,Genetic changes can only occur at the population level.,The gene pool in a population remains fixed over time.,"Natural selection affects individuals, not populations.","Individuals cannot evolve, but populations can.",D,False,0.058705493807792664,0.08541599661111832,0.5569822192192078,0.2981311082839966
"If, on average, 46% of the loci in a species' gene pool are heterozygous, then the average homozygosity of the species should be",23%,46%,54%,92%,C,True,0.019445504993200302,0.06787147372961044,0.643946647644043,0.26843690872192383
Which of these is a statement that Darwin would have rejected?,Environmental change plays a role in evolution.,The smallest entity that can evolve is an individual organism.,Individuals can acquire new characteristics as they respond to new environments or situations.,Inherited variation in a population is a necessary precondition for natural selection to operate.,B,False,0.012793764472007751,0.03940756618976593,0.616438090801239,0.3299555480480194
Which of the following contributes the MOST to genetic variability in a population?,Sporulation,Binary fission,Vegetative propagation,Mutation,D,True,0.12343797832727432,0.10893363505601883,0.33553922176361084,0.4308408796787262
Which of the following statements most detracts from the claim that the human appendix is a completely vestigial organ?,The appendix can be surgically removed with no immediate ill effects.,The appendix might have been larger in fossil hominids.,The appendix has a substantial amount of defensive lymphatic tissue.,Individuals with a larger-than-average appendix leave fewer offspring than those with a below-average-sized appendix.,C,True,0.021009016782045364,0.08309227228164673,0.6957230567932129,0.1993280053138733
"According to the heterotroph hypothesis, which event had to occur before oxygen filled the atmosphere?",Heterotrophs had to remove carbon dioxide from the air.,"Autotrophs, which make their own food, had to evolve.",Heterotrophs had to evolve.,Autotrophs had to convert atmospheric nitrogen to nitrate.,B,False,0.03893300145864487,0.07273641973733902,0.6901039481163025,0.19771809875965118
Two related species evolve in a way that makes them less similar.,Divergent evolution,Convergent evolution,Parallel evolution,Coevolution,A,False,0.024781091138720512,0.02808065339922905,0.8206369876861572,0.12584877014160156
Which of the following statements best summarizes evolution as it is viewed today?,It is goal-directed.,It represents the result of selection for acquired characteristics.,It is synonymous with the process of gene flow.,It is the differential survival and reproduction of the most-fit phenotypes.,D,False,0.06485507637262344,0.13729819655418396,0.422908216714859,0.3732151985168457
Mosquitoes resistant to the pesticide DDT first appeared in India in 1959 within 15 years of widespread spraying of the insecticide. Which of the following statement best explains how the resistant mosquitoes arose?,Some mosquitoes experienced a mutation after being exposed to DDT that made them resistant to the insecticide. Then their population expanded because these moquitoes had no competition.,Some mosquitoes were already resistant to DDT when DDT was first sprayed. Then their population expanded because all the susceptible mosquitoes had been exterminated.,DDT is generally a very effective insecticide. One can only conclude that it was manufactured improperly.,"Although DDT is effective against a wide range of insects, it is not effective against mosquitoes.",B,False,0.30664870142936707,0.18599185347557068,0.39374473690986633,0.11280976235866547
DNA sequences in many human genes are very similar to the sequences of corresponding genes in chimpanzees. The most likely explanation for this result is that,humans and chimpanzees share a relatively recent common ancestor.,humans evolved from chimpanzees.,chimpanzees evolved from humans.,convergent evolution led to the DNA similarities.,A,True,0.6526800990104675,0.16502337157726288,0.12852032482624054,0.053575243800878525
Yeast cells carry out both aerobic and anaerobic respiration. A yeast cell that is fed on glucose is moved from an aerobic to an anaerobic environment. Which of the following statements is correct and gives the correct reason for it?,The cell dies because it cannot make ATP.,The cell would need to consume glucose at a much greater rate because aerobic respiration is much more efficient as compared with anaerobic respiration.,The cell would need to consume another food source other than glucose because it will not be able to make adequate ATP with only glucose.,The cell will begin to divide rapidly because larger cells require more oxygen and glucose than smaller ones.,B,False,0.03167201578617096,0.0860934630036354,0.720851719379425,0.16084377467632294
A researcher conducts a survey of a biome and finds 35 percent more species than she has found in any other biome. Which biome is she most likely to be in?,Tundra,Tiaga,Tropical rainforest,Temperate deciduous forest,C,True,0.015514854341745377,0.022573979571461678,0.8470823168754578,0.11464012414216995
Which statement about variation is true?,All phenotypic variation is the result of genotypic variation.,All genetic variation produces phenotypic variation.,All nucleotide variability results in neutral variation.,All new alleles are the result of nucleotide variability.,D,False,0.08538932353258133,0.09675878286361694,0.43364277482032776,0.38268840312957764
Which of the following best explains why people can digest starch but cannot digest cellulose even though both molecules are composed of glucose monomers?,The bonds linking the monomers of starch differ in shape from the bonds linking the monomers of cellulose.,Molecules of starch are much smaller than molecules of cellulose.,"Starch is an intracellular molecule, while cellulose is an extracellular molecule.","Starch is hydrated by water, but cellulose is not.",A,False,0.11413029581308365,0.11413029581308365,0.6567745804786682,0.11413029581308365
"In humans, fertilization normally occurs in the",ovary,fallopian tube,uterus,placenta,B,False,0.015383558347821236,0.025363199412822723,0.5094335079193115,0.44957348704338074
Which of the following is a biotic factor that could affect the growth rate of a population?,Volcanic eruption,Glacier melting,Destruction of the ozone layer,Sudden reduction in the animal food resource,C,True,0.08771395683288574,0.07740730047225952,0.6481233239173889,0.18569044768810272
"As a young biologist, Charles Darwin had expected the living plants of temperate South America would resemble those of temperate Europe, but he was surprised to find that they more closely resembled the plants of tropical South America. The biological explanation for this observation is most properly associated with the field of",meteorology.,embryology.,vertebrate anatomy.,biogeography.,D,False,0.014894113875925541,0.011599547229707241,0.8131910562515259,0.16012680530548096
"It has been observed that organisms on islands are different from, but closely related to, similar forms found on the nearest continent. This is taken as evidence that",0,common environments are inhabited by the same organisms.,the islands were originally part of the continent.,the island forms and mainland forms are converging.,A,False,0.06235619634389877,0.11649671196937561,0.4607534408569336,0.3588351309299469
The Krebs cycle in humans occurs in the,mitochondrial matrix,inner mitochondrial membrane,outer mitochondrial membrane,intermembrane space,A,False,0.22497084736824036,0.07303734123706818,0.47626328468322754,0.22497084736824036
"Ichthyosaurs were aquatic dinosaurs. Fossils show us that they had dorsal fins and tails, as do fish, even though their closest relatives were terrestrial reptiles that had neither dorsal fins nor aquatic tails. The dorsal fins and tails of ichthyosaurs and fish are",homologous.,examples of convergent evolution.,adaptations to a common environment.,B and C only,D,True,0.03720494359731674,0.07876285910606384,0.03720494359731674,0.8467805981636047
During which phase of the cell cycle does the quantity of DNA in a eukaryotic cell typically double?,G_1,G_2,M,S,D,False,0.030241884291172028,0.03426854684948921,0.7799484729766846,0.1535809487104416
"Two trees of the same species growing close together will use the same resources, such as light, water, and nutrients. If any of these resources becomes limiting, then each tree will receive less of it than if the trees were growing farther apart. This scenario is an example of which of the following?",Parasitism,Commensalism,Natural selection,Intraspecific competition,D,False,0.07265931367874146,0.06412162631750107,0.5368837714195251,0.32563647627830505
Short sequence by promoter that assists transcription by interacting with regulatory proteins.,Enhancer,Repressor,Operator,Promoter,C,True,0.04894566163420677,0.026198722422122955,0.6756739616394043,0.24856659770011902
"Catastrophism, meaning the regular occurrence of geological or meteorological disturbances (catastrophes), was Cuvier's attempt to explain the existence of",evolution.,the fossil record.,uniformitarianism.,the origin of new species.,B,False,0.3906828463077545,0.3042641282081604,0.26851215958595276,0.0363391637802124
Hydrangea flowers have one gene for flower color. Plants of the same genetic variety have flowers that range in color from blue to pink with the color varying due to the type of soil in which they are grown. Which of the following statement best explains this phenomenon?,The alleles for flower color show incomplete dominance where neither trait is dominant; expression of the genes shows a blending of traits.,The alleles for flower color are codominant; both traits show depending on the environment.,"In this case, the environment alters the expression of a trait.",The genes for flower color show polygenic inheritance.,C,True,0.039911724627017975,0.07456492632627487,0.6243244409561157,0.26025715470314026
"When imbalances occur in the sex ratio of sexual species that have two sexes (i.e., other than a 50:50 ratio), the members of the minority sex often receive a greater proportion of care and resources from parents than do the offspring of the majority sex. This is most clearly an example of",sexual selection.,disruptive selection.,balancing selection.,frequency-dependent selection.,D,False,0.1139371246099472,0.10054916888475418,0.6556629538536072,0.12910768389701843
"Although mutations occur at a regular and predictable rate, which of the following statements is the LEAST likely reason the frequency of mutation appears to be low?",Some mutations produce alleles that are recessive and may not be expressed.,Some undesirable phenotypic traits may be prevented from reproducing.,Some mutations cause such drastic phenotypic changes that they are removed from the gene pool.,The predictable rate of mutation results in ongoing variability in a gene pool.,D,False,0.0489286370575428,0.10358192026615143,0.6754389405250549,0.17077770829200745
Crossover would most likely occur in which situation?,Two genes (1 and 2) are located right next to each other on chromosome A.,"Gene 1 is located on chromosome A, and gene 2 is on chromosome B.",Genes 1 and 2 are located near each other on the X chromosome.,Gene 1 is located on chromosome A; gene 2 is located far away but on the same chromosome.,D,False,0.1313866227865219,0.27814552187919617,0.5196442008018494,0.07032619416713715
Which aspects of cell structure best reveals the unity of all life?,All cells are surrounded by a plasma membrane.,All cells have at least one nucleus.,All cells carry out cellular respiration in mitochondria.,The surface-to-volume ratio of all cells is the same.,A,False,0.20526005327701569,0.10986778885126114,0.2986516058444977,0.38347625732421875
