0,1,2,3,4,5,correct,choiceA_probs,choiceB_probs,choiceC_probs,choiceD_probs
This biome contains plants whose roots cannot go deep due to the presence of a permafrost.,Desert,Tundra,Taiga,Deciduous forests,C,True,0.010645970702171326,0.013669696636497974,0.8457142114639282,0.12969447672367096
This biome contains trees that drop their leaves during the winter months.,Desert,Tundra,Taiga,Deciduous forests,D,False,0.011255279183387756,0.011255279183387756,0.894117534160614,0.08316588401794434
A change in a neuron membrane potential from +50 millivolts to -70 millivolts is considered,depolarization,repolarization,hyperpolarization,an action potential,B,False,0.031088562682271004,0.027435559779405594,0.8017845749855042,0.13932925462722778
All of the following play a role in morphogenesis EXCEPT,apoptosis,homeotic genes,operons,inductive effects,C,False,0.0394689105451107,0.05067908391356468,0.42433077096939087,0.48082977533340454
"Most animal cells, regardless of species, are relatively small and about the same size. Relative to larger cells, why is this?",Smaller cells avoid excessive osmosis and subsequent lysis.,Smaller cells have a smaller surface-to-volume ratio.,Smaller cells have a larger surface-to-volume ratio.,Smaller cells fit together more tightly.,C,True,0.31324559450149536,0.11523661017417908,0.3549537658691406,0.21529033780097961
Which of the following is (are) required when performing a polymerase chain reaction (P C R) on a DNA sample?,Reverse transcriptase,A vacuum chamber,Primers complementary to certain portions of the DNA,DNA ligase,C,True,0.05926553159952164,0.06715664267539978,0.6371645331382751,0.23439975082874298
"Each of the following has a better chance of influencing gene frequencies in small populations than in large populations, but which one most consistently requires a small population as a precondition for its occurrence?",Mutation,Non-random mating,Genetic drift,Natural selection,C,True,0.2826747000217438,0.13352607190608978,0.411289244890213,0.17145086824893951
"No two people are genetically identical, except for identical twins. The chief cause of genetic variation among human individuals is",new mutations that occurred in the preceding generation.,the reshuffling of alleles in sexual reproduction.,genetic drift due to the small size of the population.,geographic variation within the population.,B,False,0.1352028101682663,0.15320485830307007,0.6059369444847107,0.1052960455417633
"Two genes (B and E) determine coat color in Labrador retrievers. Alleles B and b code for how much melanin is present. The dominant allele B codes for black fur, the recessive allele b codes for brown hair. A second gene consisting of two alleles, E and e, codes for the deposition of pigment in the hair. In this case, the alleles for pigment deposition (E or e) are said to be epistatic to the gene that codes for black or brown pigment. If the dominant allele (E) is not present, regardless of the genotype at the black/brown locus, the animal's fur will be yellow.",BBEe will be brown.,BbEe will be brown.,Bbee will be brown.,BBee will be yellow.,D,False,0.06228809058666229,0.04851001873612404,0.6696600914001465,0.21740680932998657
Which of the following statements is NOT correct about ancient Earth?,Earth was formed about 4? billion years ago.,Amino acid synthesis could have been stimulated by volcanic eruption.,"The first cells formed about 3? billion years ago, according to the fossil record.",The presence of free oxygen facilitated the rapid formation of organic molecules.,D,False,0.018505457788705826,0.039176054298877716,0.612816572189331,0.32801711559295654
"In modern terminology, diversity is understood to be a result of genetic variation. Sources of variation for evolution include all of the following except",mistakes in translation of structural genes.,mistakes in DNA replication.,translocations and mistakes in meiosis.,recombination at fertilization.,A,False,0.06147220358252525,0.07893187552690506,0.583232045173645,0.2754993140697479
"DDT was once considered a ""silver bullet"" that would permanently eradicate insect pests. Today, instead, DDT is largely useless against many insects. Which of these would have been required for this pest eradication effort to be successful in the long run?",Larger doses of DDT should have been applied.,All habitats should have received applications of DDT at about the same time.,The frequency of DDT application should have been higher.,None of the individual insects should have possessed genomes that made them resistant to DDT.,D,False,0.11368586868047714,0.10032741725444794,0.5095046758651733,0.272718220949173
"Within a few weeks of treatment with the drug 3TC, a patient's HIV population consists entirely of 3TC-resistant viruses. How can this result best be explained?",HIV can change its surface proteins and resist vaccines.,The patient must have become reinfected with 3TC-resistant viruses.,HIV began making drug-resistant versions of reverse transcriptase in response to the drug.,"A few drug-resistant viruses were present at the start of treatment, and natural selection increased their frequency.",D,False,0.03343656659126282,0.0551275834441185,0.7610127925872803,0.14985229074954987
"The higher the proportion of loci that are ""fixed"" in a population, the lower is that population's",nucleotide variability.,genetic polyploidy.,average heterozygosity.,A and C only,D,True,0.04212547093629837,0.04212547093629837,0.069453164935112,0.8461127281188965
The resting membrane potential depends on which of the following? I. Active transport II. Selective permeability III. Differential distribution of ions across the axonal membrane,III only,I and II only,II and III only,"I, II, and III",D,True,0.006484974175691605,0.013728691264986992,0.13025419414043427,0.8493640422821045
Which of the following statements about the light-dependent reactions of photosynthesis is correct?,They provide the carbon that becomes incorporated into sugar.,"They produce PGA, which is converted to glucose by carbon fixation in the light-independent reactions.","Water is split apart, providing hydrogen ions and electrons to NADP for temporary storage.",They occur in the stroma of chloroplasts.,C,False,0.10949678719043732,0.433068186044693,0.29764312505722046,0.15931689739227295
"When we say that an individual organism has a greater fitness than another individual, we specifically mean that the organism",lives longer than others of its species.,competes for resources more successfully than others of its species.,mates more frequently than others of its species.,leaves more viable offspring than others of its species.,D,False,0.2825438976287842,0.1334642767906189,0.4658361077308655,0.11778181046247482
Most Swiss starlings produce four to five eggs in each clutch. Those producing fewer or more than this have reduced fitness. Which of the following terms best describes this?,artificial selection,directional selection,stabilizing selection,disruptive selection,C,False,0.10578809678554535,0.09335765987634659,0.3258502781391144,0.47410932183265686
Members of two different species possess a similar-looking structure that they use in a similar fashion to perform the same function. Which information would best help distinguish between an explanation based on homology versus one based on convergent evolution?,The two species live at great distance from each other.,"The two species share many proteins in common, and the nucleotide sequences that code for these proteins are almost identical.",The sizes of the structures in adult members of both species are similar in size.,Both species are well adapted to their particular environments.,B,False,0.028965814039111137,0.0694853737950325,0.8465051651000977,0.054115261882543564
"When driving from east to west in the U.S. from a forest ecosystem to grasslands, trees gradually give way to grasses. Which of the following is the critical factor responsible for this shift?",Amount of sunlight,Availability of oxygen,Availability of water,Length of growing season,C,True,0.03641880303621292,0.06803927570581436,0.731491208076477,0.16321775317192078
"Within a cell, the amount of protein synthesized using a given mRNA molecule depends in part on which of the following?",DNA methylation suppresses the expression of genes.,"Transcription factors mediate the binding of RNA polymerase and the initiation of transcription, which will determine how much protein is manufactured.",The speed with which mRNA is degraded will determine how much protein is synthesized.,The location and number of ribosomes in a cell will solely determine how much protein is synthesized.,C,True,0.07626073062419891,0.07626073062419891,0.6385232210159302,0.207298144698143
All of the following are modes of asexual reproduction EXCEPT,sporulation,fission,budding,meiosis,D,True,0.06023716926574707,0.09931430965662003,0.3927956819534302,0.44509583711624146
"A rooster with gray feathers and a hen with the same phenotype produce 17 gray, 7 black, and 8 white chicks. What is the simplest explanation for the inheritance of these colors in chickens?",The trait for gray is epistatic over the trait for black.,The trait for gray is epistatic over the trait for white.,The traits for black and white color demonstrate incomplete dominance.,The traits for black and white color demonstrate codominance.,C,True,0.024703290313482285,0.09770341217517853,0.8180606365203857,0.05926011502742767
Which of the following statements about cellular respiration is correct?,Most CO2 produced during cellular respiration is released from glycolysis.,Protons are pumped through ATP synthase by active transport.,The final electron acceptor of the electron transport chain is NAD+.,ATP is formed because an endergonic reaction is coupled with an exergonic reaction.,D,False,0.05895031988620758,0.12479782104492188,0.6337756514549255,0.18157978355884552
Which of the following principles is NOT part of Darwin's theory of evolution by natural selection?,Evolution is a gradual process that occurs over a long period of time.,Every population has tremendous variation.,Mutations are the main source of all variation in a population.,"Organisms will overpopulate area, giving rise to competition.",C,True,0.011951707303524017,0.015346297062933445,0.5758655667304993,0.39578622579574585
"In Darwin's thinking, the more closely related two different organisms are, the",more similar their habitats are.,less similar their DNA sequences are.,more recently they shared a common ancestor.,less likely they are to have the same genes in common.,C,True,0.03241457790136337,0.07775852829217911,0.8359830379486084,0.05344260483980179
Which of the following is most likely to increase the rate of diffusion of an uncharged solute across the plasma membrane of a cell?,Decreasing the number of different solutes in the solution that bathes the cells,Increasing the concentration gradient of the solute across the membrane,Increasing the ratio of phospholipids to proteins in the membrane,Decreasing the membrane potential across the membrane,B,True,0.13239090144634247,0.5933347940444946,0.21827571094036102,0.05518873408436775
"In a certain pond, there are long-finned fish and short-finned fish. A horrific summer thunderstorm leads to the death of a disproportionate number of long-finned fish to the point where the relative frequency of the two forms has drastically shifted. This is an example of",gene flow.,natural selection.,genetic drift.,stabilizing selection.,C,True,0.11681859940290451,0.31754589080810547,0.4620265066623688,0.10309205204248428
A form of species interaction in which one of the species benefits while the other is unaffected is called,parasitism.,mutualism.,commensalism.,symbiosis.,C,True,0.01858752965927124,0.014475981704890728,0.5432072281837463,0.4230502247810364
Chemical substances released by organisms that elicit a physiological or behavioral response in other members of the same species are known as,auxins,hormones,pheromones,enzymes,C,True,0.02441100776195526,0.05167810618877411,0.4903082251548767,0.4326954782009125
"In reference to a segment of DNA, which of the following molecules contains the fewest number of nucleotides?",a single strand of the original DNA segment,a single strand of the original DNA segment after a point mutation,the primary RNA transcript (before splicing) from the original DNA,a single strand of complementary DNA (cDNA) made from the original DNA,D,False,0.1113487258553505,0.1429745852947235,0.44039273262023926,0.3026772141456604
All viruses contain at least these two principal components:,DNA and proteins,nucleic acid and a capsid,DNA and cell membrane,RNA and cell wall,B,False,0.05509331449866295,0.0334157831966877,0.760539710521698,0.14975914359092712
Imagine an organism whose 2n = 96. Meiosis would leave this organism’s cells with how many chromosomes?,192,96,48,24,C,True,0.029518287628889084,0.08023902773857117,0.6718331575393677,0.2181122899055481
Which of the following represents an idea that Darwin learned from the writings of Thomas Malthus?,All species are fixed in the form in which they are created.,Populations tend to increase at a faster rate than their food supply normally allows.,Earth changed over the years through a series of catastrophic upheavals.,The environment is responsible for natural selection.,B,False,0.029994552955031395,0.08153364807367325,0.6024567484855652,0.28458040952682495
Which of the following would most likely describe the fate of a vesicle formed as a result of phagocytosis?,The vesicle merges with a mitochondrion.,The vesicle merges with a lysosome.,"The vesicle is shuttled to the nucleus, and its contents become part of the nucleolus.",The vesicle releases its contents to the cytoplasm to be digested.,B,False,0.13879743218421936,0.13879743218421936,0.2938341796398163,0.42752620577812195
"A population undergoes a shift in which those who are really tall and those who are really short decrease in relative frequency compared to those of medium size, due to a change in the availability of resources. This is an example of",directional selection.,stabilizing selection.,disruptive selection.,sympatric speciation.,B,False,0.1400158703327179,0.23084715008735657,0.5537735223770142,0.07494509965181351
Which of the following theories is based on the notion that mitochondria and chloroplasts evolved from prokaryotic cells?,Fluid mosaic model,Endosymbiotic model,Taxonomic model,Respiration feedback model,B,False,0.04191897436976433,0.10055838525295258,0.7430315613746643,0.11394758522510529
The nucleotide sequence of a DNA molecule is 5′-C-A-T-3′. A mRNA molecule with a complementary codon is transcribed from the DNA in the process of protein synthesis a tRNA pairs with a mRNA codon. What is the nucleotide sequence of the tRNA anticodon?,5′-G-T-A-3′,5′-G-U-A-3′,5′-C-A-U-3′,5-′U-A-C-3′,C,True,0.13477785885334015,0.13477785885334015,0.5330567955970764,0.196100652217865
"During drought years on the Galapagos, small, easily eaten seeds become rare, leaving mostly large, hard-cased seeds that only birds with large beaks can eat. If a drought persists for several years, what should one expect to result from natural selection?",Small birds gaining larger beaks by exercising their mouth parts.,Small birds mutating their beak genes with the result that later-generation offspring have larger beaks.,"Small birds anticipating the long drought and eating more to gain weight and, consequently, growing larger beaks.",More small-beaked birds dying than larger-beaked birds. The offspring produced in subsequent generations have a higher percentage of birds with large beaks.,D,False,0.04925726354122162,0.033853985369205475,0.8731058239936829,0.0434693805873394
Which of the following is NOT a characteristic of asexual reproduction in animals?,Daughter cells have the same number of chromosomes as the parent cell.,Daughter cells are identical to the parent cell.,The parent cell produces diploid cells.,The daughter cells fuse to form a zygote.,D,False,0.03819958493113518,0.06298046559095383,0.6771038174629211,0.21982342004776
"A biologist studied a population of squirrels for 15 years. During that time, the population was never fewer than 30 squirrels and never more than 45. Her data showed that over half of the squirrels born did not survive to reproduce, because of competition for food and predation. In a single generation, 90% of the squirrels that were born lived to reproduce, and the population increased to 80. Which inference(s) about this population might be true?",The amount of available food may have increased.,The number of predators may have decreased.,"The squirrels of subsequent generations should show greater levels of genetic variation than previous generations, because squirrels that would not have survived in the past will now survive.","A, B, and C",D,True,0.01713578775525093,0.02200278826057911,0.02493242360651493,0.9355823397636414
"Which group is composed entirely of individuals who maintained that species are fixed (i.e., unchanging)?","Aristotle, Cuvier, and Lamarck","Linnaeus, Cuvier, and Lamarck","Lyell, Linnaeus, and Lamarck","Aristotle, Linnaeus, and Cuvier",D,True,0.1359654664993286,0.056678835302591324,0.19782857596874237,0.6093549132347107
"Except for identical twins, no two people are genetically identical. Which of the following statements most accurately describes the main source of variation in humans?",The main source of variation in humans is genetic drift.,Changes in the environment cause rapid changes in different human populations.,Shuffling of alleles is responsible for the greatest variation in humans.,Mutations are responsible for the greatest changes in different human populations.,C,True,0.032002322375774384,0.07676957547664642,0.7283694744110107,0.16252119839191437
"An eager AP Biology student interested in studying osmosis and the movement of water in solutions took a dialysis bag containing a 0.5 M solution and placed it into a beaker containing a 0.6 M solution. If this bag were instead placed into a beaker of distilled water, what would be the expected result?","There will be a net flow of water out of the bag, causing it to decrease in size.","There will be a net flow of water into the bag, causing it to swell in size.",The bag will remain the exact same size because no water will move at all.,The solute will flow out of the dialysis bag into the beaker.,B,False,0.15761564671993256,0.0955987274646759,0.6233819723129272,0.12275117635726929
Crossing-over during meiosis permits scientists to determine,the chance for variation in zygotes,the rate of mutations,the distance between genes on a chromosome,which traits are dominant or recessive,C,True,0.12549005448818207,0.12549005448818207,0.6372911334037781,0.11074458062648773
"An organism exposed to wild temperature fluctuations shows very little, if any, change in its metabolic rate. This organism is most probably a",ectotherm.,endotherm.,thermophyle.,ascospore.,B,False,0.07977961003780365,0.14904792606830597,0.6679864525794983,0.1024390459060669
What was the prevailing notion prior to the time of Lyell and Darwin?,"Earth is a few thousand years old, and populations are unchanging.","Earth is a few thousand years old, and populations gradually change.","Earth is millions of years old, and populations rapidly change.","Earth is millions of years old, and populations are unchanging.",A,False,0.08159065991640091,0.07200349867343903,0.7741106152534485,0.07200349867343903
"On Andros Islands in the Bahamas, populations of mosquito fish, Gambusia hubbsi, colonized a series of ponds. These ponds are no longer connected. However, the environments are very similar except that some ponds contain predatory fish, while others do not. In high predation ponds, selection has favored the evolution of a body shape that enables rapid bursts of speed. In low predation ponds, another body type is favored—one that is well-suited to swim for long periods of time.",Reproductive isolation caused geographic isolation.,Reproductive isolation was not complete.,Allopatric isolation brought about reproductive isolation.,Sympatric isolation brought about reproductive isolation.,C,False,0.36446499824523926,0.2504929006099701,0.2504929006099701,0.1340791881084442
Which of the following statement is supported by the information given in the pedigree?,The P generation mother is X-X.,The P generation father is X-Y.,"If parents 1 and 2 in row II have another child, the chance that the child would be afflicted with alkaptonuria is 25%.",The genotype of woman 1 is X-X.,C,True,0.09284102916717529,0.2859705090522766,0.36719340085983276,0.25236809253692627
"A proficient engineer can easily design skeletal structures that are more functional than those currently found in the forelimbs of such diverse mammals as horses, whales, and bats. That the actual forelimbs of these mammals do not seem to be optimally arranged is because","natural selection has not had sufficient time to create the optimal design in each case, but will do so given enough time.",natural selection operates in ways that are beyond the capability of the human mind to comprehend.,"in many cases, phenotype is not merely determined by genotype, but by the environment as well.",natural selection is generally limited to modifying structures that were present in previous generations and in previous species.,D,False,0.18082261085510254,0.18082261085510254,0.3378210961818695,0.29812607169151306
Which of the following pieces of evidence most strongly supports the common origin of all life on Earth?,All organisms require energy.,All organisms use essentially the same genetic code.,All organisms reproduce.,All organisms show heritable variation.,B,False,0.05409042909741402,0.07870111614465714,0.5131957530975342,0.352713942527771
Organisms in which of the following phyla have a true coelom?,Platyhelminthes,Porifera,Annelida,Nematoda,B,False,0.1295553743839264,0.10089781880378723,0.580626904964447,0.18850195407867432
"A certain autosomal recessive trait is expressed in 1% of a population. Assuming that the population is in Hardy-Weinberg equilibrium, what percent of the population are carriers but do not express the trait?",10%,18%,27%,50%,B,False,0.023371674120426178,0.0924367606639862,0.46943262219429016,0.41427284479141235
Which of the following properties is responsible for holding together the water molecules in a vertical column of water in xylem vessels of a plant?,the strong adhesion property of water,the strong cohesion of property of water,the high heat capacity of water,the strong cohesion property of cellulose in the xylem cell wall,B,False,0.13107052445411682,0.09008336812257767,0.5874173641204834,0.19070649147033691
Which of the following statements is NOT correct about apoptosis?,"Apoptosis, a special type of cell division, requires multiple cell signaling.",The fact that apoptosis is widespread across several kingdoms is evidence that it evolved early in the evolution of eukaryotes.,Apoptosis plays a crucial role in the development of fingers in embryonic development.,Apoptosis prevents an aging and dying cell from damaging neighboring cells.,A,False,0.058152951300144196,0.07466986775398254,0.4869087040424347,0.3792048692703247
All of the following organs in the digestive system secrete digestive enzymes EXCEPT the,mouth,stomach,gall bladder,small intestine,C,False,0.045509155839681625,0.035442568361759186,0.20395790040493011,0.711883008480072
All of the following are stimulated by the sympathetic nervous system EXCEPT,dilation of the pupil of the eye,constriction of blood vessels,increased secretion of the sweat glands,increased peristalsis in the gastrointestinal tract,D,True,0.1465238779783249,0.1881403923034668,0.3101910650730133,0.3514925241470337
"In the inherited disorder called Pompe disease, glycogen breakdown in the cytosol occurs normally and blood glucose levels are normal, yet glycogen accumulates in lysosomes. This suggests a malfunction with",enzymes in the lysosomes,enzymes in the mitochondria,membrane transport during exocytosis,membrane transport during endocytosis,A,False,0.22689178586006165,0.12144641578197479,0.4238896369934082,0.22689178586006165
A trend toward the decrease in the size of plants on the slopes of mountains as altitudes increase is an example of,a cline.,a bottleneck.,relative fitness.,genetic drift.,A,False,0.05362601950764656,0.10018659383058548,0.4490051567554474,0.39624565839767456
Which of the following is an example of a cline?,The hybrid tomato plant is stronger and produces better fruit than the pure genotype.,There are two distinct varieties in one population of snail that inhabits an island in the Pacific Ocean.,Males of some species have long antlers to fight other males for females.,"In one species of rabbit, the ones that evolved in the cold, snowy north are white, while the ones that evolved in the south are brown.",D,False,0.0696684792637825,0.1013670340180397,0.7490067481994629,0.07894472777843475
"A healthy man and woman are worried about having children because they are both carriers of sickle-cell disease. If the couple have a biological child, what is the chance that the child will inherit sickle-cell disease?",100%,75%,50%,25%,D,False,0.047637034207582474,0.12949088215827942,0.5803378820419312,0.2419208139181137
"Females with Turner's syndrome have a high incidence of hemophilia, a recessive, X-linked trait. Based on this information, it can be inferred that females with this condition",have an extra X chromosome,have an extra Y chromosome,lack an X chromosome,have red blood cells that clump,C,True,0.06879689544439316,0.07795709371566772,0.7396363615989685,0.11342691630125046
