0,1,2,3,4,5,correct,choiceA_probs,choiceB_probs,choiceC_probs,choiceD_probs
Which of the following closes and seals off the lower airway during swallowing?,Alveoli,Epiglottis,Larynx,Uvula,B,False,0.08649472147226334,0.05944690480828285,0.49774280190467834,0.3420933187007904
Which orbital wall is most likely to collapse in a 'blow out' fracture?,The roof,The floor,The lateral wall,The medial wall,B,False,0.11754874885082245,0.06291931867599487,0.6764464378356934,0.13320018351078033
The walls of the maxillary sinus are sinus is related to,the floor of the orbit.,the floor of the orbit and the upper posterior teeth.,"the floor of the orbit, the upper posterior teeth and the infratemporal fossa.","the floor of the orbit, the upper posterior teeth, the infratemporal fossa and the hard palate.",C,True,0.200774148106575,0.08369511365890503,0.4250388741493225,0.200774148106575
Which of one of the following statements about the postnatal growth of the maxilla is correct?,Pneumatisation by enlargement of the developing maxillary sinus ceases at puberty,Space is created for the eruption of the permanent molars by resorption of the maxillary tuberosity,The zygomaticomaxillary sutures contribute to increase in height and length of the maxilla,The intermaxillary suture closes about eight years postnatally,C,True,0.14684565365314484,0.1885535567998886,0.31087225675582886,0.2743437886238098
The seventh cranial nerve supplies,taste buds on the posterior third of the tongue.,muscles of the soft palate.,muscles of the lower lip.,the parotid salivary gland.,C,True,0.2109460085630417,0.05333550274372101,0.4465726912021637,0.2708600163459778
Which of the following paranasal sinuses open into the middle meatus?,The anterior ethmoidal sinuses,The anterior ethmoidal and frontal sinuses,"The anterior ethmoidal, frontal and maxillary sinuses","The anterior ethmoidal, frontal, maxillary and sphenoidal sinuses",C,True,0.17132049798965454,0.07141700387001038,0.4109765291213989,0.24926987290382385
"Which of the following is a structural, fibrous protein found in the dermis?",Collagen,Heparin,Lipocyte,Melanin,A,False,0.1419578194618225,0.046086959540843964,0.5614540576934814,0.23404887318611145
Palatine shelf elevation is due to the effect of,descent of the tongue.,changes in flexure of the developing brain.,hydrophilic molecules increasing turgor pressure in the palatine shelves.,a combination of these three processes.,D,False,0.2537071704864502,0.1198427826166153,0.5370980501174927,0.05660971626639366
On which surfaces of the teeth is dental plaque most likely to accumulate in the mouth of a patient with poor oral hygiene?,The palatal surfaces of the upper molars and lingual surfaces of the lower incisors.,The buccal surfaces of the upper molars and lingual surfaces of the lower incisors.,The palatal surfaces of the upper molars and labial surfaces of the lower incisors.,The buccal surfaces of the upper molars and labial surfaces of the lower incisors.,B,False,0.26194679737091064,0.10919567197561264,0.3811303377151489,0.18003323674201965
Laryngeal oedema is usually confined to the larynx above the vocal folds because,there are numerous mucous glands in the vestibular folds.,the mucosa covering the vocal folds is tightly attached to underlying tissues.,fluid will drain rapidly into the thorax below the vocal folds.,the mucosa above the vocal folds is more vascular than that below the vocal folds.,B,False,0.3280586004257202,0.19897760450839996,0.19897760450839996,0.25549229979515076
The coronary arteries,arise from the arch of the aorta and fill during diastole.,arise from the ascending aorta and fill during systole.,arise from the arch of the aorta and fill during systole.,arise from the ascending aorta and fill during diastole.,D,False,0.4857451021671295,0.11537458002567291,0.1576983481645584,0.20248867571353912
Which muscle is the most active during a right lateral excursion of the mandible?,Left lateral pterygoid muscle,Right lateral pterygoid muscle,Left medial pterygoid muscle,Right medial pterygoid muscle,A,False,0.28653037548065186,0.10540863126516342,0.36791226267814636,0.2231500744819641
The phrenic nerves innervate the,diaphragm.,diaphragm and parietal pleura.,"diaphragm, parietal pleura and pericardium.","diaphragm, parietal pleura, pericardium and intercostals muscles.",C,True,0.2065190225839615,0.07597409188747406,0.38582831621170044,0.300483375787735
Parasympathetic preganglionic nerves leave the central nervous system with the,third cranial nerves.,fourth cranial nerves.,fifth cranial nerves.,sixth cranial nerves.,A,False,0.12559537589550018,0.033803537487983704,0.3868609666824341,0.4383709132671356
"In a patient with a normal healthy mouth, you would expect the mucosa covering the alveolar process supporting the mandibular teeth to be",light pink in colour on both sides of the mucogingigival junction.,light pink below the mucogingival junction and red above it.,red below the mucogingival junction and light pink above it.,red on both sides of the mucogingival junction.,C,True,0.1437479555606842,0.1437479555606842,0.3448334038257599,0.3448334038257599
Macrostomia results from failure of fusion of,maxillary and mandibular processes.,left and right mandibular processes.,maxillary and frontonasal processes.,mandibular and hyoid arches.,A,True,0.41767749190330505,0.0725814625620842,0.3252875506877899,0.17411388456821442
You suspect that your patient has an enlarged submandibular salivary gland. You expect the enlarged gland,to be palpable intraorally..,to be palpable extraorally.,to be palpable both intra- and extraorally.,only to be detectable by radiographical examination.,C,True,0.2567519545555115,0.19995860755443573,0.4796757698059082,0.03264234587550163
Osteoclasts,deposit bone and differentiate from periosteal mesenchymal cells.,resorb bone and differentiate from periosteal mesenchymal cells.,deposit bone and differentiate from monocytes.,resorb bone and differentiate from monocytes.,D,False,0.3880860507488251,0.08659370243549347,0.26672738790512085,0.23538608849048615
The lateral pterygoid muscle,is attached to the coronoid process and elevates the mandible.,is attached to the condylar process and elevates the mandible.,is attached to the coronoid process and protrudes the mandible.,is attached to the condylar process and protrudes the mandible.,D,False,0.32812535762786865,0.07321466505527496,0.3718147575855255,0.19901810586452484
"In the fetus, the ductus arteriosus passes blood from the",pulmonary vein to the aorta.,aorta to pulmonary vein.,pulmonary artery to the aorta.,aorta to the pulmonary artery.,C,True,0.2679823935031891,0.1434406340122223,0.30366382002830505,0.2679823935031891
Which of the following bones develop by endochondral ossification?,The ribs,The ribs and sternum,"The ribs, sternum and clavicle","The ribs, sternum, clavicle and vertebrae",B,False,0.1793859750032425,0.07477919012308121,0.33513709902763367,0.37976008653640747
The mucosa of the hard palate is,keratinised and has submucosa and minor salivary glands posterolaterally.,non-keratinised and has submucosa and minor salivary glands posteromedially.,keratinised and lacks submucosa and minor salivary glands.,non-keratinised and lacks submucosa and minor salivary glands.,A,False,0.27068057656288147,0.1278604418039322,0.5056979060173035,0.06843876838684082
The head of the sixth rib articulates with,The inferior articular facet of T5 and superior articular facet of T6.,The inferior articular demifacet of T5 and superior articular facet of T6.,The inferior articular demifacet of T5 and the superior articular demifacet of T6.,The superior and inferior demifacets of T6.,C,False,0.3897148370742798,0.09853534400463104,0.23637400567531586,0.23637400567531586
Which of the following is located beneath the diaphragm in the left upper quadrant of the abdominal cavity?,Appendix,Duodenum,Spleen,Pancreas,C,True,0.11535222828388214,0.04243571311235428,0.5169727802276611,0.3135598599910736
Proprioceptive nerve endings in synovial joints are located in,articular cartilage and synovial membrane.,synovial membrane and capsule.,capsule and ligaments.,ligaments and articular discs.,D,False,0.36367174983024597,0.10419370234012604,0.36367174983024597,0.1516009271144867
The thoracic cage is a structural unit important for which of the following functions?,Alimentation,Menstruation,Mentation,Respiration,D,True,0.07649730145931244,0.059576161205768585,0.26700183749198914,0.5652428865432739
A patient is admitted after a head injury and sinks rapidly into a coma. An MRI scan indicates an extradural haemorrhage because extravasated blood can be detected between the,skull bones and dura mater.,dura mater and arachnoid.,arachnoid and pia mater.,pia mater and brain surface.,A,True,0.3653131425380707,0.10466396808624268,0.3223876953125,0.17256170511245728
A successful infraorbital nerve block will produce anaesthesia of the,maxillary anterior teeth.,maxillary anterior teeth and their labial gingivae.,"maxillary anterior teeth, their labial gingivae and the upper lip.","maxillary anterior teeth, their labial gingivae, the upper lip and anterior hard palate.",C,True,0.24277198314666748,0.09507087618112564,0.35323113203048706,0.24277198314666748
Which of the following foramina pierce the sphenoid bone?,The foramen ovale,The foramen ovale and rotundum,"The foramen ovale, rotundum and spinosum","The foramen ovale, rotundum and spinosum and foramen lacerum",C,True,0.20853693783283234,0.07671644538640976,0.4414726793766022,0.20853693783283234
Which of the following is a disorder characterized by uncontrollable episodes of falling asleep during the day?,Dyslexia,Epilepsy,Hydrocephalus,Narcolepsy,D,False,0.06356419622898102,0.043686989694833755,0.46967941522598267,0.41449064016342163
Which of the following allows gas exchange in the lungs?,Alveoli,Bronchi,Bronchioles,Capillaries,A,False,0.12458519637584686,0.045832328498363495,0.383749395608902,0.43484506011009216
"A patient has a fracture in which the radius is bent but not displaced, and the skin is intact. This type of fracture is known as which of the following?","Closed, greenstick","Complex, comminuted","Compound, transverse","Open, spiral",A,False,0.12657180428504944,0.18416090309619904,0.3898686170578003,0.2679525315761566
Fertilization of an ovum by a spermatozoon occurs in which of the following structures?,Cervix,Fallopian tube,Ovary,Uterus,B,False,0.12844757735729218,0.08828063309192657,0.44832608103752136,0.3081297278404236
Ectoderm gives rise to,the neural tube.,ectomesenchymal cells.,dental enamel.,all three structures.,D,False,0.39557287096977234,0.039167020469903946,0.39557287096977234,0.14552314579486847
"In men, which of the following structures is located at the neck of the bladder and surrounds the urethra?",Epididymis,Prostate,Scrotum,Seminal vesicle,B,False,0.4427817761898041,0.06790278851985931,0.39075353741645813,0.06790278851985931
"Which of the following options completes the following statement? ""The right atrioventricular valve…""",is a semilunar valve,is prevented from everting by papillary muscles.,is open during systole.,prevents blood returning from the pulmonary trunk as the heart relaxes.,B,False,0.08792107552289963,0.12792442739009857,0.30687472224235535,0.44650009274482727
Which one of the following brain areas is supplied by branches of the subclavian arteries?,The frontal lobe,The parietal lobe,The hypothalamus,The cerebellum,D,False,0.12057367712259293,0.03914454206824303,0.540373682975769,0.289241224527359
Which of the following structures is part of the small intestine?,Ascending colon,Cecum,Ileum,Sigmoid colon,C,True,0.1293323040008545,0.04757869243621826,0.4514140784740448,0.35156163573265076
During an inferior alveolar nerve block the needle ideally passes,posterior and medial to medial pterygoid.,anterior and lateral to medial pterygoid.,through medial pterygoid.,inferior to medial pterygoid.,B,False,0.3415226638317108,0.20714396238327026,0.3415226638317108,0.09784788638353348
Patients with which of the following diseases are treated with injections of vitamin B-12?,Bell's palsy,Crohn's disease,Pernicious anemia,Graves' disease,C,True,0.12367285043001175,0.09631651639938354,0.38093918561935425,0.38093918561935425
Which of the following bones has a process that joins with the zygomatic bone to form the zygomatic arch?,The maxillary bone,The temporal bone,The sphenoid bone,The frontal bone,B,False,0.24341429769992828,0.03294254466891289,0.4013223350048065,0.3125501573085785
Parasympathetic preganglionic axons leave the CNS with the,cervical spinal nerves.,thoracic spinal nerves.,lumbar spinal nerves.,sacral spinal nerves.,D,False,0.275931179523468,0.042315416038036346,0.35430264472961426,0.3126709759235382
A patient with damage to their cervical sympathetic chain will show the following signs and symptoms.,Pupillary constriction,Pupillary constriction and vasodilation of facial vessels,"Pupillary constriction, vasodilation of facial vessels and increased facial sweating","Pupillary constriction, vasodilation of facial vessels, increased facial sweating and decreased lacrimation",B,False,0.016208892688155174,0.023583801463246346,0.1637040227651596,0.7336704730987549
Which of the following cranial nerves is related to the sense of smell?,Abducens,Hypoglossal,Olfactory,Trochlear,C,True,0.11641544103622437,0.04852917790412903,0.591206431388855,0.2174927145242691
Where are the vital centres located in the brainstem?,midbrain,pons,medulla oblongata,cerebellum,C,False,0.06700347363948822,0.024649200960993767,0.26500385999679565,0.6357112526893616
Saliva contains an enzyme that acts upon which of the following nutrients?,Starches,Proteins,Fats,Minerals,A,False,0.09539707005023956,0.06556539237499237,0.5489723086357117,0.25931617617607117
During swallowing the,auditory tube opens.,cricopharyngeus muscle contracts.,rima glottis opens.,gag reflex is suspended.,A,False,0.20754088461399078,0.1258798986673355,0.3877373933792114,0.2664877772331238
The dorsal roots of all spinal nerves contain,sensory neuronal processes.,sensory and autonomic neuronal processes.,motor neuronal processes.,motor and autonomic neuronal processes.,A,False,0.26772674918174744,0.11160510778427124,0.3895401060581207,0.2085057944059372
Which of the following is the master gland of the endocrine system?,Adrenal,Pancreas,Pineal,Pituitary,D,True,0.11889473348855972,0.04956269636750221,0.2852136492729187,0.5328491926193237
Loss of somatic sensation over the anterior two-thirds of the tongue indicates damage to the,lingual branch of the mandibular trigeminal nerve.,chorda tympani branch of the facial nerve.,lingual branch of the glossopharyngeal nerve.,hypoglossal nerve.,A,True,0.2911537289619446,0.09452377259731293,0.2911537289619446,0.2911537289619446
"In men, specimens for gonococcal cultures are most commonly obtained from which of the following structures?",Anus,Bladder,Urethra,Testicle,C,True,0.21692988276481628,0.10247042030096054,0.35765689611434937,0.27854347229003906
Which of the following structures should be visible on a dental panoramic radiograph?,The mandibular canal,The mandibular canal and maxillary sinus,"The mandibular canal, maxillary sinus and hard palate","The mandibular canal, maxillary sinus, hard palate and zygomatic arch",D,False,0.2505553066730499,0.07178530097007751,0.4680989384651184,0.17220398783683777
