0,1,2,3,4,5,correct,choiceA_probs,choiceB_probs,choiceC_probs,choiceD_probs
A lesion causing compression of the facial nerve at the stylomastoid foramen will cause ipsilateral,paralysis of the facial muscles.,paralysis of the facial muscles and loss of taste.,"paralysis of the facial muscles, loss of taste and lacrimation.","paralysis of the facial muscles, loss of taste, lacrimation and decreased salivation.",A,False,0.08980236947536469,0.05446789413690567,0.31344109773635864,0.516776978969574
"A ""dished face"" profile is often associated with",a protruding mandible due to reactivation of the condylar cartilage by acromegaly.,a recessive maxilla due to failure of elongation of the cranial base.,an enlarged frontal bone due to hydrocephaly.,defective development of the maxillary air sinus.,B,True,0.1765960156917572,0.3299247920513153,0.291157603263855,0.1765960156917572
Which of the following best describes the structure that collects urine in the body?,Bladder,Kidney,Ureter,Urethra,A,False,0.1511228084564209,0.055594973266124725,0.5274704098701477,0.24915939569473267
Which of the following structures is derived from ectomesenchyme?,Motor neurons,Skeletal muscles,Melanocytes,Sweat glands,C,True,0.05495116114616394,0.04849423095583916,0.5213621258735657,0.35832661390304565
Which of the following describes the cluster of blood capillaries found in each nephron in the kidney?,Afferent arteriole,Glomerulus,Loop of Henle,Renal pelvis,B,False,0.1156047061085701,0.061878740787506104,0.4572254717350006,0.3560875654220581
A patient suffers a broken neck with damage to the spinal cord at the level of the sixth cervical vertebra.,They will be unable to breathe without life support.,They will only be able to breathe quietly.,It is impossible to predict an effect on breathing.,Breathing will be unaffected.,B,False,0.09879837930202484,0.0769442617893219,0.5685454607009888,0.23700501024723053
Which of the following anatomical regions of abdomen lies just distal to the sternum?,Epigastric,Hypochondriac,Hypogastric,Lumbar,A,False,0.054140787571668625,0.022569239139556885,0.4000493288040161,0.5136735439300537
Which of the following best describes the human body's defense mechanism against environmental bacteria?,Hair in the nose,Mucous membranes,Osteoblasts,Saliva,B,False,0.03282869607210159,0.04776546731591225,0.45318615436553955,0.45318615436553955
The palatine processes begin to fuse at,six weeks post-fertilization.,eight weeks post-fertilization.,ten weeks post-fertilization.,twelve weeks post-fertilization.,C,False,0.19358986616134644,0.15076792240142822,0.28167158365249634,0.3616734743118286
Primary motor cortex activity results in,bilateral contraction of antigravity limb muscles.,bilateral contraction of limb musculature.,contraction of ipsilateral limb musculature.,contraction of contralateral limb musculature.,D,False,0.3520176112651825,0.07854574918746948,0.3106544613838196,0.24193793535232544
You notice that your patient's submandibular lymph nodes are enlarged. You would look for potential infection sites in the,hard palate.,hard palate and upper lip.,"hard palate, upper lip and upper central incisor.","hard palate, upper lip, upper central incisor and lower first molar.",D,False,0.2619854509830475,0.08505421876907349,0.3363959789276123,0.2619854509830475
A patient suffers damage to the orbit in a road traffic incident resulting in damage to the third cranial nerve. Which of the following signs will be present?,Pupillary constriction and a medial strabismus,Pupillary dilatation and a medial strabismus,Pupillary constriction and a lateral strabismus,Pupillary dilatation and a lateral strabismus,D,False,0.14095613360404968,0.23239736258983612,0.38315847516059875,0.20508995652198792
Which of the following statements is true of the temporomandibular joint?,It has an articular disc of hyaline cartilage,Its articular surfaces are covered by hyaline cartilage,Proprioceptive information is carried by the chorda tympani and deep temporal nerves,Proprioceptive information is carried by the masseteric and auriculotemporal nerves.,D,False,0.34600043296813965,0.14423443377017975,0.14423443377017975,0.2694654166698456
Laryngoscopic examination of the vocal folds after suspected recurrent laryngeal nerve damage usually shows that the vocal fold on the injured side is tensed and in an intermediate position between adduction and abduction. This is because,cricothyroid muscle is still functional but the interarytenoid muscles are fully active.,cricothyroid muscle is still functional but the interarytenoids are weak.,cricothyroid muscle is paralyzed but the interarytenoids are fully active.,cricothyroid muscle is paralyzed but the interarytenoids are weak.,B,False,0.33244261145591736,0.2933795750141144,0.20163662731647491,0.13858269155025482
Which one of the following statements about the growth of the mandible is correct?,The mental symphysis closes at about 1 year postnatally,The condylar growth cartilage ceases activity at puberty,The ossification centre appears about 8 weeks I.U.L medial to Meckel's cartilage,The functional matrix acting on the angle of the mandible is the lateral pterygoid muscle,A,False,0.06494073569774628,0.10058217495679855,0.3978102207183838,0.3510662615299225
Which of the following statements is true of the pupillary light reflex?,Its efferent limb is carried in the optic nerve,It is mediated by the inferior colliculi in the midbrain,It is a consensual reflex,Its afferent limb is carried in the oculomotor nerve,C,False,0.1885698139667511,0.1468583047389984,0.27436745166778564,0.35229477286338806
Which muscles are normally active during quiet inspiration?,External and internal intercostal muscles,External intercostal muscles and diaphragm,Internal intercostal muscles and diaphragm,External and internal intercostal muscles and diaphragm,B,False,0.1501188427209854,0.09105168282985687,0.3601163923740387,0.3601163923740387
Male hormones are produced by which of the following?,Glans penis,Prepuce,Prostate,Testes,D,False,0.26799148321151733,0.12659022212028503,0.34410786628723145,0.23650166392326355
Oxygenated blood is carried to the heart by which of the following structures?,Aorta,Carotid arteries,Inferior vena cava,Pulmonary veins,D,True,0.12195111811161041,0.09497562795877457,0.3314974904060364,0.4256511926651001
Which of the following allows air to pass into the lungs?,Aorta,Esophagus,Trachea,Pancreas,C,True,0.040195297449827194,0.027625797316432,0.4896789491176605,0.43214017152786255
Where is the sinoatrial node located?,Between the left atrium and the left ventricle,Between the right atrium and the right ventricle,In the upper wall of the right atrium,In the upper wall of the left ventricle,C,False,0.3584083616733551,0.11635816097259521,0.3584083616733551,0.14940683543682098
"In relation to the rib, the corresponding intercostal nerve lies",deep to its superior border.,superficial to its superior border.,deep to its inferior border.,superficial to its inferior border.,C,True,0.19258719682693481,0.14998705685138702,0.35980024933815,0.2802127003669739
The regional lymphatic drainage of the left side of the tip of the tongue is to the,left submental lymph node.,left and right submental lymph nodes.,left submandibular lymph node.,left and right submandibular lymph nodes.,B,False,0.34161877632141113,0.11090738326311111,0.3871047794818878,0.14240790903568268
Gastrulation is the process of,mesoderm formation and occurs after neurulation.,ectomesenchyme formation and occurs before neurulation.,mesoderm formation and occurs before neurulation.,ectomesenchyme formation and occurs after neurulation.,B,False,0.15745095908641815,0.17841532826423645,0.25959277153015137,0.3777052164077759
The spheno-occipital synchondrosis,is a secondary growth cartilage.,influences the position of the viscerocranium.,ceases activity at 7 years of age.,can be reactivated in patients affected by acromegaly.,B,False,0.2543037533760071,0.19805197417736053,0.19805197417736053,0.3265324831008911
Which of the following substances is found in greater quantity in exhaled air?,Carbon dioxide,Carbon monoxide,Nitrogen,Oxygen,C,True,0.1269035041332245,0.0529012493789196,0.5019130706787109,0.3044256865978241
Which of the following conditions is characterized by the presence of kidney stones (renal calculi)?,Glomerulonephritis,Interstitial nephritis,Nephrolithiasis,Polycystic kidney,C,True,0.2333822399377823,0.0757681205868721,0.4940701723098755,0.18175828456878662
A pulse may be felt on a patient's face where the,facial artery crosses the mandible.,facial artery crosses the maxilla.,superficial temporal artery crosses the maxilla.,superficial temporal artery crosses the orbital rim.,A,False,0.2387530654668808,0.21069884300231934,0.3936372399330139,0.14481106400489807
A patient sustains severe blunt trauma to the left upper abdomen and requires surgery. Which one of the following organs is most likely to be involved?,Appendix,Gallbladder,Spleen,Urinary bladder,C,True,0.09960666298866272,0.04705085977911949,0.5731968283653259,0.2707590162754059
Which statement concerning the atrioventricular bundle is correct?,It is formed of autonomic nerve processes and is the only electrical connection between the atria and the ventricles.,It is formed of Purkinje fibres and is the only electrical connection between the atria and the ventricles,It is formed of autonomic nerve processes and forms one of several electrical connections between the atria and ventricles.,It is formed of Purkinje fibres and forms one of several electrical connections between the atria and ventricles.,B,False,0.17730240523815155,0.17730240523815155,0.2923222482204437,0.2923222482204437
Which of the following terms describes the motion of bending the forearm toward the body?,Abduction,Eversion,Flexion,Pronation,C,False,0.3406068682670593,0.0591885931789875,0.3406068682670593,0.23409543931484222
Food is prevented from entering the larynx during the pharyngeal phase of swallowing by,constriction of the laryngeal entrance.,upward movement of the epiglottis.,downward movement of the larynx.,increase in respiratory rate.,A,True,0.48141542077064514,0.17710286378860474,0.257683128118515,0.06515249609947205
At which of the following locations does bile enter the digestive tract?,Gastroesophageal sphincter,Duodenum,Ileocecum,Jejunum,B,False,0.1532716006040573,0.1193680465221405,0.3244760036468506,0.3676794767379761
In which of the following positions does a patient lie face down?,Dorsal,Erect,Lateral,Prone,B,False,0.08817410469055176,0.047196198254823685,0.3951689600944519,0.44778507947921753
Complete bilateral cleft palate is due to failure of fusion of the,palatine processes.,palatine and frontonasal processes.,"palatine, frontonasal and secondary nasal processes.","palatine, frontonasal, secondary nasal processes and mandibular processes.",C,True,0.22985418140888214,0.03524927794933319,0.42942413687705994,0.26045891642570496
The auditory tube,connects the inner ear and nasopharynx.,is derived from the second pharyngeal pouch.,is opened by the action of levator veli palatini.,is closed by the action of tensor veli palatini.,C,False,0.5645880103111267,0.09811067581176758,0.14275020360946655,0.16175717115402222
Which of the following is the lymphoid organ that is a reservoir for red blood cells and filters organisms from the blood?,Appendix,Gallbladder,Pancreas,Spleen,D,True,0.05100269615650177,0.027299778535962105,0.42704036831855774,0.48390012979507446
Which of the following cavities are separated by the diaphragm?,Abdominal and pelvic,Cranial and spinal,Thoracic and abdominal,Pericardial and pleural,C,True,0.19085058569908142,0.10215495526790619,0.3565558195114136,0.31465938687324524
The walls of bronchioles contain,"cartilage, smooth muscle and respiratory epithelium.",cartilage and smooth muscle.,cartilage and respiratory epithelium.,smooth muscle and respiratory epithelium.,D,False,0.28369250893592834,0.09210146963596344,0.32146573066711426,0.28369250893592834
"Which of the following organs removes bilirubin from the blood, manufactures plasma proteins, and is involved with the production of prothrombin and fibrinogen?",Gallbladder,Kidney,Liver,Spleen,C,True,0.18699823319911957,0.10009292513132095,0.5083138346672058,0.18699823319911957
Which of the following conditions is characterized by incompetence of the esophageal sphincter?,Crohn's disease,Esophageal varices,Gastroesophageal reflux disease,Pyloric stenosis,C,True,0.1361968070268631,0.05010400339961052,0.4753735363483429,0.32671916484832764
The muscles of the soft palate are innervated by branches of the,trigeminal and glossopharyngeal nerves.,facial and glossopharyngeal nerves.,trigeminal and vagus nerves.,facial and vagus nerves.,C,True,0.2867051959037781,0.09307955950498581,0.32487955689430237,0.25301647186279297
Which of the following is the large bone found superior to the patella and inferior to the ischium?,Calcaneus,Femur,Symphysis pubis,Tibia,B,False,0.1034180149435997,0.055355675518512726,0.3609643280506134,0.4634873867034912
A successful inferior alveolar nerve block will produce anaesthesia of the,lower lip.,lower lip and mandibular teeth.,"lower lip, mandibular teeth and labial gingivae of the anterior mandibular teeth.","lower lip, mandibular teeth and labial gingivae of the anterior and buccal gingivae of the posterior mandibular teeth.",C,True,0.06380699574947357,0.0528978630900383,0.501880943775177,0.34493741393089294
The mucosa of the upper larynx is innervated by the,internal laryngeal nerve which is the afferent limb of the cough reflex.,external laryngeal nerve which is the afferent limb of the gag reflex.,internal laryngeal nerve which is the afferent limb of the gag reflex.,external laryngeal nerve which is the afferent limb of the cough reflex.,A,True,0.34448927640914917,0.20894330739974976,0.19628405570983887,0.19628405570983887
The bones of the viscerocranium develop initially by,endochondral ossification and follow the somatic growth pattern.,endochondral ossification and follow the neural growth pattern.,intramembranous ossification and follow the somatic growth pattern.,intramembranous ossification and follow the neural growth pattern.,C,False,0.34368228912353516,0.14326807856559753,0.2676600217819214,0.18395987153053284
The physician directs the medical assistant to complete a request form for an X-ray study of the fibula. The procedure will be performed on which of the following structures?,Heel,Lower leg,Toes,Thigh,B,False,0.14207568764686584,0.1609928458929062,0.49589285254478455,0.18242880702018738
Which cells in the blood do not have a nucleus?,Lymphocyte,Monocyte,Erythrocyte,Basophil,C,False,0.054343752562999725,0.0373498797416687,0.3127267360687256,0.5842504501342773
The coronal suture joins the,frontal and parietal bones.,left and right parietal bones.,parietal and occipital bones.,"parietal, squamous temporal and greater wing of the sphenoid.",A,False,0.1941220462322235,0.043314483016729355,0.46567457914352417,0.28244590759277344
"If you run your finger down the anterior midline of a patient's extended neck from chin to sternal notch, you should be able to palpate, in order, the","hyoid bone, cricoid cartilage, thyroid cartilage.","thyroid cartilage, cricoid cartilage, hyoid bone.","hyoid bone, thyroid cartilage, cricoid cartilage.","thyroid cartilage, hyoid bone, cricoids cartilage.",C,False,0.484346866607666,0.22878926992416382,0.17818127572536469,0.05784698575735092
Which of the following bony structures may be palpated in a live patient?,The supraorbital foramen,The infraorbital foramen,The mental foramen,All of the above,D,False,0.2998085916042328,0.0758034884929657,0.33972764015197754,0.2645801603794098
Which of the following structures accompany the oesophagus through the diaphragm?,The phrenic nerves,The splanchnic nerves,The sympathetic trunks,The vagus nerves,D,True,0.1559220850467682,0.07365236431360245,0.33008700609207153,0.42384010553359985
Which sequence describes the systemic circulation?,Left ventricle → aorta → arteries → veins → capillaries,Left ventricle → aorta → arteries →capillaries → veins,Right ventricle → pulmonary trunk → arteries → capillaries →veins,Right ventricle → pulmonary trunk → arteries → veins → capillaries,B,False,0.27499765157699585,0.18900294601917267,0.24268458783626556,0.18900294601917267
The anatomic location of the spinal canal is,caudal,dorsal,frontal,transverse,B,False,0.03182019665837288,0.018130602315068245,0.4392642676830292,0.4977516233921051
The parotid duct runs,deep to masseter and enters the mouth opposite the upper second molar.,superficial to masseter and enters the mouth opposite the upper second molar.,deep to masseter and enters the mouth opposite the upper second premolar.,superficial to masseter and enters the mouth opposite the upper second premolar.,B,False,0.29973527789115906,0.14158491790294647,0.33964455127716064,0.18179863691329956
"If the foot is abducted, it is moved in which direction?",Inward,Outward,Upward,Downward,D,False,0.2396584004163742,0.1282798945903778,0.4477408230304718,0.16471466422080994
The infraorbital nerve,is a terminal branch of the maxillary division of the trigeminal nerve.,is a terminal branch of the maxillary branch of the facial nerve.,carries parasympathetic secretomotor neurons to the lacrimal gland.,innervates the inferior part of the orbicularis oculi muscle.,A,False,0.2727625072002411,0.12884388864040375,0.24071206152439117,0.30908042192459106
Which of the following best describes the process whereby the stomach muscles contract to propel food through the digestive tract?,Absorption,Emulsion,Peristalsis,Regurgitation,C,True,0.07596694678068161,0.05916311591863632,0.4953666925430298,0.34046024084091187
Which of the following is the point at which an impulse is transmitted from one neuron to another neuron?,Dendrite,Glial cell,Nerve center,Synapse,D,True,0.07167553156614304,0.06325343996286392,0.32122746109962463,0.5296145081520081
Which of the following muscles initiates elevation of the mandible?,Masseter,Temporalis,Lateral pterygoid,Medial pterygoid.,D,False,0.24389684200286865,0.06987760961055756,0.3548678159713745,0.3131697475910187
Which of the following is an accessory organ of the gastrointestinal system that is responsible for secreting insulin?,Adrenal gland,Gallbladder,Liver,Pancreas,D,False,0.04621502384543419,0.03599229454994202,0.5630142092704773,0.3414854109287262
A malignant tumour is damaging the patient's glossopharyngeal nerve. They will experience,loss of taste over the anterior two-thirds of the tongue.,loss of somaesthetic sensation over the anterior two thirds of the tongue.,loss of taste and somaesthetic sensation over the posterior third of the tongue.,paralysis of the muscles of the tongue.,C,True,0.1399587243795395,0.17971055209636688,0.4311031997203827,0.23075293004512787
A possible effect of damage to the third cranial nerve by trauma to the orbit is,a convergent strabismus.,ptosis.,pupillary contriction.,bitemporal hemianopia.,B,False,0.08006026595830917,0.07065293937921524,0.5220584869384766,0.31664448976516724
Blood flows from the right ventricle of the heart into which of the following structures?,Inferior vena cava,Left ventricle,Pulmonary arteries,Pulmonary veins,C,True,0.14312298595905304,0.0983668863773346,0.38904857635498047,0.3433341681957245
A patient is stabbed in the neck. You suspect damage to the accessory nerve in the posterior triangle. You would test nerve function by asking the patient to,extend their neck against resistance.,extend their neck without impairment.,lift their shoulders against resistance.,lift their shoulders without impairment.,C,True,0.23684608936309814,0.16278178989887238,0.34460902214050293,0.23684608936309814
Which of the following muscles are derived from the first brachial arch?,The muscles of mastication,The muscles of mastication and anterior belly of digastric,The muscles of mastication and anterior and posterior bellies of digastric,"The muscles of mastication, anterior and posterior bellies of digastric and geniohyoid",B,False,0.071831613779068,0.03611920028924942,0.6014387011528015,0.22125695645809174
Which of the following best describes the location where the carotid pulse can be found?,In front of the ears and just above eye level,In the antecubital space,In the middle of the groin,On the anterior side of the neck,D,False,0.1896197348833084,0.07904526591300964,0.354256272315979,0.354256272315979
"In the brain stem, pathways for:",nociception decussate in the medial lemniscus,skilled movements decussate in the medial lemniscus,skilled motor movements decussate in the pyramids.,discriminative touch decussate in the pyramids.,C,False,0.3200840353965759,0.09762010723352432,0.24928168952465057,0.24928168952465057
The respiratory tract is crossed by the isthmus of the thyroid gland at the level of the,thyroid cartilage.,cricothyroid membrane.,cricoid cartilage.,tracheal rings.,D,False,0.3071116805076599,0.0997045636177063,0.3071116805076599,0.2710250914096832
You notice a lesion on the labial alveolar mucosa of the lower right lateral incisor tooth of one of your patients and decide to take a biopsy to send for oral pathology report Which nerve would require local anaesthesia in order to carry out a pain-free biopsy?,The incisive nerve,The mental nerve,The buccal nerve,The lingual nerve,B,False,0.339311808347702,0.0972144603729248,0.4356849789619446,0.11015841364860535
The major concentrations of proprioceptive receptors providing information about position of the TMJ are located in,the capsule and ligaments of the TMJ and the medial pterygoid muscle.,the capsule and ligaments of the TMJ and the lateral pterygoid muscle.,the articular disc of the TMJ and the medial pterygoid muscle.,the articular disc of the TMJ and the lateral pterygoid muscle.,B,False,0.2758440673351288,0.24343153834342957,0.35419079661369324,0.07903064787387848
Which of the following is a substance that aids the transmission of nerve impulses to the muscles?,Acetylcholine,Cholecystokinin,Deoxyribose,Oxytocin,A,False,0.11438148468732834,0.06937587261199951,0.39923059940338135,0.39923059940338135
"In the spinal cord, motor neuron cell bodies are located in",Lamina I.,Lamina II.,Lamina V.,Lamina IX,D,True,0.14782840013504028,0.030986515805125237,0.27617982029914856,0.515971839427948
"When you examine a patient who has suffered an unfavourable fracture of the body of the mandible, you would expect the",anterior fragment to be displaced downwards by the action of the digastric muscle.,posterior fragment to be displaced anteriorly by the action of the lateral pterygoid muscle.,anterior fragment to be displaced backwards by action of the temporalis muscle.,posterior fragment to be displaced medially by action of the medial pterygoid muscle.,A,True,0.2646108865737915,0.15077072381973267,0.2646108865737915,0.2646108865737915
Examination of a patient indicates that they have a medially directed strabismus (squint). This could be due to damage to the,oculomotor nerve.,trochlear nerve.,ophthalmic trigeminal nerve.,abducens nerve.,D,False,0.3531935513019562,0.16683682799339294,0.3116922080516815,0.14723296463489532
"A patient cuts a peripheral motor nerve in their wrist when they fall through a plate glass window. If the nerve does not regenerate, after about 6 months the muscles it normally innervates will show signs of which of the four options below?",spastic paralysis,flaccid paralysis,atrophy,contracture,C,True,0.12683306634426117,0.06788884848356247,0.4426908791065216,0.3447680175304413
A patient suffers a CVA in the area of the left internal capsule conveying motor neurons to the right leg. The patient's leg will exhibit,spastic paralysis.,flaccid paralysis.,tremor.,hyporeflexia.,A,False,0.11307305842638016,0.0880613848567009,0.3946637511253357,0.3946637511253357
The crown of a very carious tooth suddenly fractures while the patient is standing eating at a take-away food outlet and a fragment is inhaled. It is more likely to enter the,right lung because the right main bronchus is wider and more vertical than the left.,left lung because the left main bronchus is wider and more vertical than the right.,right lung or left lung because the two main bronchi are of equal size and at the same angulation.,right or left lung because there are no factors predisposing to the fragment going in one particular direction.,A,False,0.08151116967201233,0.17255914211273193,0.5315195918083191,0.14305655658245087
"Calcium, potassium, and sodium are classified as which of the following?",Androgens,Catecholamines,Electrolytes,Estrogens,C,True,0.15502989292144775,0.07323092967271805,0.3718973696231842,0.3718973696231842
Noradrenaline is the neurotransmitter between which of the two structures below?,parasympathetic pre- and post-ganglionic neurons,sympathetic pre- and post-ganglionic neurons,parasympathetic post-ganglionic neurons and target organs,sympathetic post-ganglionic neurons and target organs,D,True,0.09921737015247345,0.2697007656097412,0.2697007656097412,0.3056110143661499
Which of the following are mucus-producing glands located on each side of the vaginal opening?,Adrenal,Bartholin's,Bulbourethral,Corpus luteum,B,False,0.17158213257789612,0.08104966580867767,0.3632393777370453,0.3632393777370453
"When an emergency opening into the airway is required, the cricothyroid membrane should be pierced immediately",superior to the thyroid cartilage.,inferior to the thyroid cartilage.,inferior to the cricoid cartilage.,superior to the thyroid isthmus.,B,False,0.27750635147094727,0.14853845536708832,0.31445589661598206,0.2448984980583191
Cerebrospinal fluid circulates around the brain between the,skull and dura mater.,dura mater and arachnoid mater.,arachnoid and pia maters.,pia mater and brain surface.,C,False,0.49622827768325806,0.06308834254741669,0.20685872435569763,0.20685872435569763
