0,1,2,3,4,5,correct,choiceA_probs,choiceB_probs,choiceC_probs,choiceD_probs
Which of the following is the direct energy source that allows ATP synthase to produce ATP in mitochondria?,NADH diffusing from the mitochondrial intermembrane space to the matrix,The reduction of NAD+ during the conversion of pyruvate to acetyl-CoA,H+ ions flowing down a gradient across the mitochondrial inner membrane,The energy of electrons passing along the electron transport chain,C,True,0.1491801142692566,0.16904322803020477,0.5900188088417053,0.09048232436180115
Which of the following cells is most closely associated with phagocytosis?,Neutrophils,Plasma cells,B cells,Memory cells,A,False,0.027143865823745728,0.023954376578330994,0.6177915334701538,0.3306799829006195
Lampreys attach to the skin of lake trout and absorb nutrients from its body. This relationship is an example of,commensalism,parasitism,mutualism,gravitropism,B,False,0.050017718225717545,0.03437663987278938,0.6904732584953308,0.22416384518146515
Which of the following is correct about organisms that are the first to colonize a habitat undergoing ecological succession?,They are the fiercest competitors in the area.,They maintain the habitat as it is for their own kind.,They change the habitat in a way that makes it more habitable for other organisms.,They are small invertebrates.,C,True,0.011946859769523144,0.03679891675710678,0.9490566253662109,0.002076053060591221
"Unlike large populations, small populations are vulnerable to various processes that draw populations down an extinction vortex toward smaller and smaller populations until no individuals survive. Which of the following statements correctly identifies the factors that endanger a population?",Inbreeding and loss of genetic variation threaten a population.,Migration of new individuals into the population threatens a population.,Mutation reduces the health of a population.,Breeding with individuals from a different population may cause the extinction of the first population due to a decrease in diversity.,A,False,0.05267675966024399,0.14319027960300446,0.30313384532928467,0.4997831881046295
Fossil evidence indicates that horses have gradually increased in size over geologic time. Which of the following terms best describes this?,artificial selection,directional selection,stabilizing selection,disruptive selection,B,False,0.13567833602428436,0.1197357177734375,0.32547542452812195,0.41791871190071106
Which describes an African butterfly species that exists in two strikingly different color patterns?,artificial selection,directional selection,stabilizing selection,disruptive selection,D,True,0.05210278183221817,0.066901296377182,0.384990394115448,0.49433743953704834
"Regarding meiosis and mitosis, one difference between the two forms of cellular reproduction is that in meiosis","there is one round of cell division, whereas in mitosis there are two rounds of cell division","separation of sister chromatids occurs during the second division, whereas in mitosis separation of sister chromatids occurs during the first division","chromosomes are replicated during interphase, whereas in mitosis chromosomes are replicated during prophase","spindle fibers form during prophase, whereas in mitosis the spindle fibers form during metaphase",B,False,0.150738924741745,0.11739558726549149,0.3191142976284027,0.4097508490085602
Which of the following about meiosis is NOT true?,Meiosis produces two haploid gametes.,Homologous chromosomes join during synapsis.,Sister chromatids separate during meiosis I.,Crossing-over increases genetic variation in gametes.,C,True,0.04618002474308014,0.0761379823088646,0.43814387917518616,0.43814387917518616
Oligomycin is an antibiotic that blocks proton channels in the cristae of mitochondria by binding to ATP synthase. Which of the following would be the first expected response after the application of oligomycin to cells?,Water production would increase.,H+ would increase inside the intermembrane space (the compartment between inner and outer membranes).,H+ would increase in the matrix (inside mitochondrial inner membrane).,H+ would increase outside mitochondria.,B,False,0.09248479455709457,0.22185949981212616,0.5322132706642151,0.15248166024684906
"If neutral variation is truly ""neutral,"" then it should have no effect on",nucleotide diversity.,average heterozygosity.,our ability to measure the rate of evolution.,relative fitness.,D,False,0.2189273089170456,0.1504664123058319,0.40901005268096924,0.2189273089170456
Which of the following characteristics would allow you to distinguish a prokaryotic cell from an animal cell?,Ribosomes,Cell membrane,Chloroplasts,Cell wall,D,False,0.05748932063579559,0.034869033843278885,0.48135218024253845,0.42479178309440613
"This process leads to the net production of two pyruvate, two ATP, and two NADH.",Glycolysis,Chemiosmosis,Fermentation,Calvin cycle,A,False,0.01452709175646305,0.021136794239282608,0.8987593054771423,0.06510590761899948
"When oxygen becomes unavailable, this process regenerates NAD+, allowing respiration to continue.",Glycolysis,Chemiosmosis,Fermentation,Calvin cycle,C,True,0.01034225057810545,0.024809768423438072,0.8215866684913635,0.14277034997940063
"Before the human genome was sequenced by the Human Genome Project, scientists expected that they would find about 100,000 genes. In fact, they discovered that humans have only about 24,000 genes. How can we exhibit so many different traits from so few genes?",Modification of histone proteins usually increases the function of genes.,Epigenetics enables one gene to produce many different traits.,This is proof that pseudogenes and introns are expressed.,A single gene can produce more than one trait because of alternative splicing,D,False,0.11004888266324997,0.205598384141922,0.3841083347797394,0.29914388060569763
Which of the following must exist in a population before natural selection can act upon that population?,Genetic variation among individuals,Variation among individuals caused by environmental factors,Sexual reproduction,B and C only,A,False,0.017924867570400238,0.08033367991447449,0.03794694319367409,0.8636684417724609
You observe a species that gives birth to only one offspring at a time and has a relatively long life-span for its body size. Which of the following is probably also true of this organism?,It lives in a newly colonized habitat.,It is an aquatic organism.,It requires relatively high parental care of offspring.,The age at which the offspring themselves can give birth is relatively young.,C,True,0.06686872243881226,0.2059701830148697,0.3848029375076294,0.33958739042282104
A piece of potato is dropped into a beaker of pure water. Which of the following describes the initial condition when the potato enters the water?,The water potential of the pure water is negative.,The water potential of the pure water is positive.,The water potential of the potato is positive.,The water potential of the potato is negative.,D,False,0.21801987290382385,0.14984270930290222,0.4615480303764343,0.16979405283927917
"In most ecosystems, net primary productivity is important because it represents the",energy available to producers,total solar energy converted to chemical energy by producers,biomass of all producers,energy available to heterotrophs,D,False,0.1123460978269577,0.07721427083015442,0.5705406069755554,0.23783668875694275
"During a study session about evolution, one of your fellow students remarks, ""The giraffe stretched its neck while reaching for higher leaves; its offspring inherited longer necks as a result."" Which statement is most likely to be helpful in correcting this student's misconception?",Characteristics acquired during an organism's life are generally not passed on through genes.,Spontaneous mutations can result in the appearance of new traits.,Only favorable adaptations have survival value.,Disuse of an organ may lead to its eventual disappearance.,A,False,0.10753560811281204,0.25796452164649963,0.3753361403942108,0.25796452164649963
Incomplete dominance and epistasis are two terms that define genetic relationships. Which of the following statements best describes the differences or similarities between the two terms?,Both terms describe inheritance controlled by the interaction of multiple alleles at different loci.,Both terms describe inheritance controlled by the interaction of multiple genes at different loci.,Incomplete dominance describes the interaction of two genes at different loci; epistasis describes the interaction of two alleles.,Incomplete dominance describes the interaction of two alleles on one gene; epistasis describes the interaction of two genes and their respective alleles.,D,False,0.0163576677441597,0.03924000263214111,0.7881565690040588,0.15519721806049347
Which of the following statements about the DNA in one of your liver cells is correct?,Your liver cells contain the same DNA as your white blood cells.,Most of the DNA in your liver cells will be transcribed but not translated.,Most of the DNA in your liver cells will be transcribed in the nucleus and translated in the cytoplasm.,"DNA in your liver cells contains genes unique to storing glycogen, while other cells do not contain those genes.",A,False,0.07736728340387344,0.16378654539585114,0.5716712474822998,0.18559446930885315
Energy is harvested during cellular respiration in stages. Which of the following correctly states which phase of cellular respiration harvests the most energy and the correct explanation why?,The most energy is released during the Krebs cycle because it is here that pyruvate is completely broken down into CO2.,"The most energy is released during the Krebs cycle because in addition to the production of ATP, both FADH2 and NADH are produced. Each of those molecules will release 2 ATPs and 3 ATPs, respectively.","The most energy is released during oxidative phosphorylation because in addition to the phosphorylation of ADP into ATP, all the potential energy held in NADH and FADH is transferred to ATP.",The most energy is released during oxidative phosphorylation because H2O is completely broken down into H+ and O2.,C,True,0.14841842651367188,0.0900203213095665,0.4034430682659149,0.3560372591018677
Which of the following best explains why drinking breast milk is beneficial to a human infant?,Breast milk contains vitamins that repair mutations originating in the sperm or egg.,Breast milk contains maternal antibodies that protect against gastrointestinal pathogens.,Breast milk contains maternal vaccines that destroy common childhood pathogens.,Breast milk contains red blood cells with adult hemoglobin that are beneficial to the infant's developing brain.,B,False,0.13520200550556183,0.10529541969299316,0.534734308719635,0.22291041910648346
"During oxidative phosphorylation, the energy needed to drive ATP synthesis comes from one source. Which of the following statements states the immediate source of that energy?",Electrons flow down an electron transport chain as they are attracted to oxygen.,The transfer of a phosphate group to ADP is exergonic.,The bonding of electrons to oxygen at the end of the chain releases energy.,The proton gradient across the membrane where the ATP synthase is embedded represents potential energy.,D,False,0.10016515851020813,0.10016515851020813,0.6531588435173035,0.14573945105075836
"Easily produced genetic variation is key to the rapid evolution of viral and microbial populations. Furthermore, pathogens that need to escape the immune system rely on this variation to generate new surface antigens that go unrecognized by the host’s immune system. Which of the following is an example of this antigenic variation?","HIV, which can remain integrated into the host genome for many years","The flu virus, which changes its envelope proteins","MRSA, which has become resistant to many antibiotics","Multiple sclerosis, which attacks the cells of the nervous system",B,False,0.16097262501716614,0.11063476651906967,0.3861532509326935,0.34077903628349304
"If a couple has had three sons and the woman is pregnant with their fourth child, what is the probability that child 4 will also be male?",1/2,1/4,1/8,1/16,A,False,0.132490873336792,0.19277310371398926,0.5240116119384766,0.15013183653354645
Which of the following is an incorrect statement about gel electrophoresis?,DNA migrates from positive charge to negative charge.,Smaller DNA travels faster.,The DNA migrates only when the current is running.,"The longer the current is running, the farther the DNA will travel.",A,False,0.021872328594326973,0.036061376333236694,0.6392031311988831,0.3019382059574127
Which of the following observations helped Darwin shape his concept of descent with modification?,Species diversity declines farther from the equator.,Fewer species live on islands than on the nearest continents.,Birds can be found on islands located farther from the mainland than the birds' maximum nonstop flight distance.,South American temperate plants are more similar to the tropical plants of South America than to the temperate plants of Europe.,D,False,0.05941750854253769,0.05243576318025589,0.49749669432640076,0.38745081424713135
Which of the following statements about post-transcriptional modification are incorrect?,A poly-A tail is added to the 3′ end of the mRNA.,A guanine cap is added to the 5′ end of the mRNA.,Introns are removed from the mRNA.,Posttranscriptional modification occurs in the cytoplasm.,D,False,0.026802102103829384,0.06429490447044373,0.5383346080780029,0.36999163031578064
Photosynthesis requires,"glucose, light, CO2","light, CO2, water","water, soil, O2","O2, water, light",B,False,0.09574926644563675,0.09574926644563675,0.37869569659233093,0.42911842465400696
"The first simple cells evolved approximately 3.5 billion years ago, followed by the more complex eukaryotic cells 2.1 billion years ago. Which of the following statements is correct?","Eukaryotic organelles helped create separate environments for metabolic reactions, thus increasing their metabolic efficiency.",Prokaryotic and eukaryotic cells have no structural similarities.,The organelles in larger eukaryotic cells took care of the problems of having a larger surface area–to–volume ratio.,Eukaryotic cells are able to multiply faster based on their more complex structure.,A,False,0.053509749472141266,0.041673436760902405,0.5076863765716553,0.39538657665252686
The sequence of amino acids in hemoglobin molecules of humans is more similar to the hemoglobin of chimpanzees than it is to the hemoglobin of dogs. This similarity suggests that,humans and dogs are more closely related than humans and chimpanzees,humans and chimpanzees are more closely related than humans and dogs,humans are related to chimpanzees but not to dogs,humans and chimpanzees are closely analogous,B,False,0.11073151230812073,0.02470754086971283,0.8182013630867004,0.0461597666144371
Basepair sequence that signals the start site for gene transcription.,Enhancer,Repressor,Operator,Promoter,D,False,0.02118711918592453,0.01869756542146206,0.7016209959983826,0.25811195373535156
Those being hunted adopt a coloring scheme that allows them to blend in to the colors of the environment.,Aposomatic coloration,Batesian mimicry,Deceptive markings,Cryptic coloration,D,False,0.06401077657938004,0.04985164850950241,0.6881807446479797,0.19716708362102509
"A baby duck runs for cover when a large object is tossed over its head. After this object is repeatedly passed overhead, the duck learns there is no danger and stops running for cover when the same object appears again. This is an example of",imprinting.,fixed-action pattern.,agonistic behavior.,habituation.,D,False,0.05279328674077988,0.2088015079498291,0.5008887648582458,0.23660312592983246
Stretching out from the equator is a wide belt of tropical rain forests that are being cut down to provide exotic woods for export to the U.S. and to make land available to graze beef cattle. Which of the following statements is a negative consequence of clear-cutting the tropical rain forests?,Indigenous populations will have access to modern conveniences.,There will be less precipitation in those clear-cut areas.,U.S. markets will have access to less expensive beef.,Deforestation will allow more sunlight to penetrate areas that were kept dark by dense vegetation.,B,False,0.04669208824634552,0.07698224484920502,0.14382176101207733,0.7303872108459473
The theory of evolution is most accurately described as,an educated guess about how species originate.,"one possible explanation, among several scientific alternatives, about how species have come into existence.",an opinion that some scientists hold about how living things change over time.,"an overarching explanation, supported by much evidence, for how populations change over time.",D,False,0.06650931388139725,0.09677048772573471,0.6310228109359741,0.20486311614513397
Which of the following statements explains how a point mutation can have no negative impact in the protein formed from a sequence in DNA?,"The first codon of a gene is always AUG, a leader sequence; a mutation in that sequence will have no effect on the protein produced.",Several codons code for the same amino acid.,DNA polymerase and DNA ligase carry out excision repair before transcription.,RNA processing will repair point mutations before mRNA leaves the nucleus.,B,False,0.08882185816764832,0.1464424878358841,0.31001877784729004,0.45107463002204895
Which of the following statements correctly characterizes an autoimmune disease?,T cells attack healthy body cells.,An aneurysm is a weakness in the wall of a blood vessel that causes it to balloon out. The vessel can rupture and cause a hemorrhage.,"Several factors cause hypertension: smoking, being overweight, lack of physical activity, and too much salt in the diet.","Alzheimer's disease is caused by the buildup of plaque within the brain, causing brain cells to die.",A,False,0.04655171185731888,0.0410817451775074,0.34397321939468384,0.5671159625053406
All of the following play an important role in regulating respiration in humans EXCEPT,an increase in the amount of CO2 in the blood,a decrease in the amount of O2 in the blood,a decrease in the plasma pH level,strenuous exercise,B,False,0.11940829455852509,0.22308407723903656,0.3678034543991089,0.28644561767578125
Water and minerals that reach the xylem in the center of a plant root must first,move through neighboring phloem vessels,cross open stomata in the root epidermis,cross the endodermis of the root cortex,pass through the pith of the root cap,C,True,0.13018622994422913,0.10138913244009018,0.45439454913139343,0.31230053305625916
A lizard lacking a chemical defense mechanism that is colored in the same way as a lizard that has a defense mechanism is displaying,aposometric coloration.,cryptic coloration.,Batesian mimicry.,Müllerian mimicry.,C,True,0.17405617237091064,0.08221831172704697,0.6075156927108765,0.13555508852005005
"Logically, which of these should cast the most doubt on the relationships depicted by an evolutionary tree?",None of the organisms depicted by the tree ate the same foods.,Some of the organisms depicted by the tree had lived in different habitats.,"The skeletal remains of the organisms depicted by the tree were incomplete (i.e., some bones were missing).",Relationships between DNA sequences among the species did not match relationships between skeletal patterns.,D,False,0.044567499309778214,0.030630765482783318,0.6971530318260193,0.22633244097232819
Sexual dimorphism is most often a result of,pansexual selection.,stabilizing selection.,intrasexual selection.,intersexual selection.,D,False,0.11792600154876709,0.19442710280418396,0.46640637516975403,0.22031478583812714
Which of the following statements about meiosis is correct?,The daughter cells are genetically identical to the parent cells.,Homologues pair during prophase II.,DNA replication occurs before meiosis I and meiosis II.,The number of chromosomes is reduced.,D,False,0.13406658172607422,0.09214252978563309,0.6008447408676147,0.17214490473270416
"Stomata allow gases, such as H2O and CO2, to exchange between the inside of a plant leaf and the surrounding environment. Which of the following occurs under normal daytime environmental conditions?",H2O diffuses out of the leaf faster than CO2 enters.,H2O diffuses out of the leaf slower than CO2 enters.,CO2 diffuses out of the leaf faster than H2O enters.,H2O exchanges with CO2 at equal rates.,A,False,0.20555488765239716,0.11002558469772339,0.5587560534477234,0.12467533349990845
Which of these makes determining the evolutionary relatedness of different species based on the amino acid sequence of homologous proteins generally less accurate than determinations of relatedness based on the nucleotide sequences of homologous genes?,Silent mutations,Gene duplications,Translocation events that change gene sequences,Crossing-over,A,False,0.046601325273513794,0.06780453026294708,0.442141056060791,0.442141056060791
An animal that is harmless copies the appearance of an animal that is dangerous as a defense mechanism to make predators think twice about attacking.,Aposomatic coloration,Batesian mimicry,Deceptive markings,Cryptic coloration,B,False,0.043119583278894424,0.06273861974477768,0.6745038032531738,0.21897931396961212
The pH of two lakes is measured. Lake A has a pH of 8.0; Lake B has a pH of 6.0. Which of the following statements is correct about these lakes?,Lake B is alkaline.,Lake B is 100 times more alkaline than Lake A.,The hydrogen ion concentration of Lake B is 104 M.,The pH of both lakes will decrease in response to acid rain.,D,False,0.06770023703575134,0.0869288221001625,0.5002408623695374,0.34381020069122314
A plant grows in the opposite direction of the gravitational force. This is an example of,positive thignotropism,negative phototropism,positive phototropism,negative gravitropism,D,True,0.06989447772502899,0.06989447772502899,0.4022149443626404,0.45576924085617065
Which of the following is known to be involved in the photoperiodic flowering response of angiosperms?,Auxin,Cytochrome,Phytochrome,Gibberellins,C,True,0.048925258219242096,0.055439580231904984,0.6753923296928406,0.21926778554916382
"In plants, the tendency of climbing vines to twine their tendrils around a trellis is called",thigmotropism,hydrotropism,phototropism,geotropism,A,False,0.072724349796772,0.038926541805267334,0.689989447593689,0.19768528640270233
Which of the following is not an observation or inference on which natural selection is based?,There is heritable variation among individuals.,Poorly adapted individuals never produce offspring.,Species produce more offspring than the environment can support.,Individuals whose characteristics are best suited to the environment generally leave more offspring than those whose characteristics are less suited.,B,False,0.014235752634704113,0.03414979577064514,0.416029691696167,0.534192681312561
Microtubules are protein filaments assembled from tubulin protein subunits. The chemical colchicine prevents the assembly of microtubules by binding to tubulin protein subunits. Which of the following cellular processes would be most impaired by the application of colchicine?,the alignment and separation of chromosomes during mitosis,the coordination of ribosomes and mRNA during protein synthesis,the movement of substances across the plasma membrane,the accumulation of protons inside the thylakoids of chloroplasts during chemiosmosis,A,False,0.05649310722947121,0.08219698816537857,0.6073581576347351,0.25318455696105957
The principle inorganic compound found in living things is,carbon,oxygen,water,glucose,C,False,0.01587335579097271,0.02617073990404606,0.36127591133117676,0.5956432819366455
Which of the following statements is an inference of natural selection?,Subsequent generations of a population should have greater proportions of individuals that possess traits better suited for success.,An individual organism undergoes evolution over the course of its lifetime.,Habitats do not generally have unlimited resources.,Natural populations tend to reproduce to their full biological potential.,A,False,0.08022668957710266,0.19245384633541107,0.40742477774620056,0.31730273365974426
"Recently, seasonal dead zones in low-oxygen waters have been occurring annually in the Gulf of Mexico near the mouth of the Mississippi River. The dead zones result from the rapid growth of photosynthetic phytoplankton (algal blooms) and their subsequent decay by oxygen-depleting microbes in the water column. Which of the following factors most likely triggers the algal blooms and the associated dead zones?",A decrease in the light level in surface waters as day length starts to shorten after the summer solstice,Increased predation by marine larvae and other zooplankton during the summer months,A summer influx of nutrients derived from chemical fertilizers that are high in nitrogen and phosphorus,Decreased competition from other marine phytoplankton during the summer months,C,True,0.14504048228263855,0.18623565137386322,0.39426085352897644,0.27097126841545105
Which of the following best summarizes the process of allopatric speciation?,differential changes in allele frequencies → reproductive isolation → reproductive barriers → new species,catastrophic event → reproductive isolation → reproductive barriers → new species,reproductive isolation → differential changes in allele frequencies → reproductive barriers → new species,geographic isolation → reproductive isolation → differential changes in allele frequencies → reproductive barriers → new species,D,False,0.5276891589164734,0.28245165944099426,0.15118548274040222,0.038225676864385605
