0,1,2,3,4,5,correct,choiceA_probs,choiceB_probs,choiceC_probs,choiceD_probs
The Barkhausen criterion for an oscillator,Loop gain should be unity,Loop gain should be less than unity,The phase of a feedback signal with respect to input should be 0° or 360°,Both A and C,D,False,0.921741783618927,0.002016301965340972,0.03573980554938316,0.040498510003089905
Potentiometer method of DC voltage measurement is more accurate than direct measurement using a voltmeter because,It loads the circuit moderately.,It loads the circuit to maximum extent.,It uses centre zero galvanometer instead of voltmeter.,It does not load the circuit at all.,D,False,0.5413010120391846,0.0830112025141716,0.3720304071903229,0.003647257573902607
Which of these sets of logic gates are designated as universal gates?,"NOR, NAND.","XOR, NOR, NAND.","OR, NOT, AND.","NOR, NAND, XNOR.",A,False,0.4485248625278473,0.036817166954278946,0.5082452893257141,0.0063978638499975204
"A single phase one pulse controlled circuit has a resistance R and counter emf E load 400 sin(314 t) as the source voltage. For a load counter emf of 200 V, the range of firing angle control is",30° to 150°.,30° to 180°.,60° to 120°.,60° to 180°.,A,False,0.24264541268348694,0.24264541268348694,0.45332127809524536,0.06135036423802376
A box which tells the effect of inputs on control sub system is known as,Data Box.,Logical box.,Decision box.,State box.,C,True,0.013690990395843983,0.003922534640878439,0.9598125219345093,0.022572627291083336
Two infinite parallel metal plates are charged with equal surface charge density of the same polarity. The electric field in the gap between the plates is,same as that produced by one plate.,double the field produced by one plate.,dependent on coordinates of field points.,zero.,D,False,0.057024870067834854,0.03458733111619949,0.8920190930366516,0.01633789949119091
The resistance in the circuit of the moving coil of a dynamometer wattmeter should be,Low.,Very low.,High.,Almost zero.,C,True,0.038326699286699295,0.020514803007245064,0.5290837287902832,0.41205084323883057
The following are the necessary requirements of an oscillator,Amplitude stability,Frequency stability,Power stability,Both A and B,D,False,0.9952538013458252,6.574298458872363e-05,2.7405756554799154e-05,0.004608939867466688
The normal voltage used in directional heating is,1.5 KV.,15 KV.,33 KV.,66 KV.,A,False,0.2811073064804077,0.10341358929872513,0.5951041579246521,0.020363343879580498
LC oscillators are used for produce a waveform with frequency ranging from,1MHz to 500 MHz,100 KHz to 500 MHz,1 KHz to 1 MHz,1MHz to 100 GHz,A,True,0.8799676895141602,0.09274791181087494,0.02657272294163704,0.0007081390358507633
A working diode must have,High resistance when forward or reverse biased,"Low resistance when forward biased, while high resistance when reverse bias","High resistance when forward biased, while low resistance when reverse bias",Low resistance when forward or reverse biased,B,False,0.7634922862052917,0.04307328909635544,0.17035816609859467,0.02305546961724758
What is the name of the fluorescent material that gives red colour fluorescence?,Zinc silicate.,Calcium silicate.,Zinc sulphide.,Magnesium silicate.,D,False,0.5200128555297852,0.11603055149316788,0.35739925503730774,0.006545995827764273
How many bits are required to store one BCD digit ?,1,2,3,4,D,False,0.3954367935657501,0.0687166079878807,0.34897175431251526,0.18679112195968628
Commutator in DC generator is used for,collecting of current,reduce losses,increase efficiency,convert AC armature current in to DC,D,False,0.10624014586210251,0.06443790346384048,0.7850143909454346,0.044287484139204025
1 F is theoretically equal to,1 ohm of resistance,ratio of 1 V to 1 C,ratio of 1 C to 1 V,none of these,C,True,0.17695794999599457,0.01865123026072979,0.7930704951286316,0.011312542483210564
How many entries will be in the truth table of a 3 input NAND gate ?,3,6,8,9,C,True,0.3829663097858429,0.06654956191778183,0.4917384684085846,0.058729786425828934
In decimal number system what is MSD,First digit from left to right,First digit from right to left,Middle digit,Mean of all digits,A,True,0.4646585285663605,0.09149668365716934,0.41005972027778625,0.03365975245833397
"In Digital Logic Designs, GAL is abbreviated as",General Advance Logic,General Array Logic,Generic Advance Logic,Generic Array Logic,D,False,0.05276670306921005,0.008092035539448261,0.9353121519088745,0.0038224069867283106
Inintel 8085A microprocessor ALE signal is made high to,Enable the data bus to be used as low order address bus,To latch data D0-D7 from data bus,To disable data bus,To achieve all the functions listed above,A,True,0.9823710918426514,0.0006156781455501914,0.008499175310134888,0.008499175310134888
For an SCR gate cathode characteristic is a straight line of 130. For triggered source volume of 15 V and allowable gate power dissipation of 0.5 W compute the gate source resistance?,111.9 ohm,11.19 ohm,108 ohm,115 ohm,A,True,0.5613475441932678,0.03588574752211571,0.38580816984176636,0.01695122756063938
The concept of V/f control of inverters driving induction motors resuls in,constant torque operation,speed reversal,reduced magnetic loss,hormonic elimination,A,False,0.12987814843654633,0.06135009601712227,0.7473971843719482,0.06135009601712227
"The energy stored in the magnetic field in a solenoid 30 cm long and 3 cm diameter wound with 1000 turns of wire carrying a current at 10 amp, is",0.015 joule.,0.15 joule.,0.015 joule.,1.15 joule.,B,True,0.281780481338501,0.5965292453765869,0.10366123169660568,0.018013622611761093
"While operating on variable frequency supplies, the AC motor requires variable voltage in order to",protect the insulation.,avoid effect of saturation.,improve the capabilities of the inverter.,protect thyristor from dV / dt.,B,False,0.5489042401313782,0.10808565467596054,0.33292725682258606,0.01005353219807148
Which of the following windings are necessary in case of all dc machines?,closed winding,lap winding,wave winding,open type winding,A,True,0.6136988401412964,0.10664486140012741,0.25582775473594666,0.023795686662197113
Relaxation Voltage controlled oscillators are used to generate,Sinusoidal wave,Triangular wave,Sawtooth wave,Both B and C,D,False,0.014052240177989006,0.9851381778717041,0.0007927732076495886,9.97954066406237e-06
The supply frequency usually employed for high frequency eddy current heating is,1 KHz.,5 KHz.,10 MHz.,10 KHz to 400 KHz.,D,False,0.07657086104154587,0.2358548641204834,0.6411198973655701,0.04644257202744484
In the toggle mode a JK flip-flop has,"J = 0, K = 0.","J = 1, K = 1.","J = 0, K = 1.","J = 1, K = 0.",B,False,0.04747940972447395,0.07828030735254288,0.8415926098823547,0.03263208642601967
Electric drive is becoming more and more popular because,all of below.,it provide smooth and easy control.,it is cheaper in cost.,it is simple and reliable.,A,True,0.7064955234527588,0.03985775262117386,0.2024143636226654,0.05117836594581604
A step up chopper has input voltage 110 V and output voltage 150 V. The value of duty cycle is,0.32.,0.67.,0.45.,0.27.,B,False,0.04403099790215492,0.08226072788238525,0.7804680466651917,0.09321361780166626
A Binary number system has how many digits.,0,1,2,10,C,True,0.06356076896190643,0.08161363750696182,0.603047788143158,0.25138771533966064
"Lowest critical frequency is due to pole and it may be present at the origin or nearer to the origin, then the type of network is",LC.,RL.,RC.,Any of the above.,C,False,0.9943041205406189,0.0024646336678415537,0.003164652269333601,6.568025855813175e-05
Advantages of open loop control system is/are,simple and economical.,accurate.,reliable.,all of the above.,A,True,0.8436285853385925,0.019840242341160774,0.0889177918434143,0.04759426787495613
"The voltage induced in an inductor is represented as,",product of its inductance and current through it.,ratio of its inductance to current through it.,ratio of current through it to its inductance.,product of its inductance and rate of change of current through it.,D,False,0.5704177021980286,0.09912372380495071,0.3053225874900818,0.025062404572963715
"If a Hexadecimal number needs to convert to binary. For each hexadecimal digit, there will be how many bits",1,2,4,8,C,True,0.26963889598846436,0.12736839056015015,0.5037517547607422,0.09919459372758865
Induction heating takes place in,conducting but non-magnetic materials.,conducting materials which may be either magnetic or non-magentic materials.,insulating materials.,conducting and magnetic materials.,B,False,0.08941560983657837,0.061454396694898605,0.8483517169952393,0.0007735966355539858
In a lap winding dc machine number of conductors are 100 and number of parallel paths are 10. Find the average pitch,10,100,50,1,A,False,0.2311393916606903,0.2619152367115021,0.4318252205848694,0.07503996044397354
Magnetic flux has the unit of,Newton,Ampere turn,Weber,Tesla,C,True,0.021855255588889122,0.01702088862657547,0.929309070110321,0.031799208372831345
"In balanced bridge, if the positions of detector and source are interchanged, the bridge will still remain balanced. This can be explained from which theorem",Reciprocity theorem,Thevinin's theorem,Norton's theorem,Compensation theorem,A,False,0.23428629338741302,0.040712855756282806,0.7216525673866272,0.0033419146202504635
A D-flip-flop is said to be transparent when,the output is LOW,the output is HIGH,the output follows clock,the output follow input,D,False,0.05155923217535019,0.04550086334347725,0.8065220713615417,0.0963253304362297
A Lissajous pattern on an oscilloscope has 5 horinzontal tangencies and 2 vertical tangencies. The frequency of horizontal input is 100 Hz. The frequency of the vertical will be,500 Hz.,250 Hz.,400 Hz.,625 Hz.,B,False,0.19467896223068237,0.1718035787343979,0.599653422832489,0.03383013233542442
Speed control by variation of field flux results in,constant power drive.,constant torque drive.,variable power drive.,none of the above.,A,True,0.5325080752372742,0.03857475519180298,0.4147177040576935,0.014190859161317348
Which of the following memories uses one transistor and one capacitor as basic memory unit,SRAM,DRAM,Both SRAM and DRAM,,B,False,0.7565975189208984,0.13147692382335663,0.10239434242248535,0.009524157270789146
"What will be the number of lamps, each having 300 lumens, required to obtain an average illuminance of 50 lux on a 4m * 3m rectangular room?",2,4,5,6,A,False,0.26400840282440186,0.14131350815296173,0.5589057207107544,0.03572964668273926
"The output of the system has an effect upon the input quantity, then the system is a",open loop control system.,closed loop control system.,either A or B.,none of the above.,B,False,0.21271274983882904,0.022419758141040802,0.742440402507782,0.022419758141040802
"A sinusoidal signal is analog signal, because",it can have a number of values between the negative and positive peaks,it is negative for one half cycle,it is positive for one half cycle,it has positive as well as negative values,A,True,0.9184388518333435,0.05181477591395378,0.02773445099592209,0.002009076764807105
FM stands for,frequent modulation.,frequency modulation.,frequency moderator.,frequent moderator.,B,False,0.9782097935676575,0.008463173173367977,0.01231384463608265,0.0010107818525284529
Stack is also known as,FIFO memory,Flash memory,LIFO memory,LILO memory,C,False,0.4795530140399933,0.039364106953144073,0.4795530140399933,0.0015263122040778399
"In Ward-Leonard system, the lower limit of the speed imposed by",Field resistance.,Armature resistance.,Residual magnetism of the generator.,None of above.,C,False,0.7806410789489746,0.020803378894925117,0.19737696647644043,0.0011736463056877255
Colpitts oscillator is also called as,Tank circuit oscillator,LC oscillator,Resonant circuit oscillator,All of the above,D,False,0.997158408164978,0.001924968557432294,0.0009092907421290874,6.9425204856088385e-06
An SCR has half cycle surge current rating of 3000 A for 50 Hz supply. One cycle surge current will be,1500 A.,6000 A.,2121.32 A.,4242.64 A.,C,True,0.06658047437667847,0.29839301109313965,0.631697952747345,0.0033148466609418392
Both the ALU and control section of CPU employ which special purpose storage location?,Buffers,Decoders,Accumulators,Registers,C,True,0.31117475032806396,0.06943247467279434,0.4527565836906433,0.1665598601102829
Systematic errors are,environmental errors.,observational errors.,instrument errors.,all of the above.,D,False,0.804375171661377,0.014732644893229008,0.08478051424026489,0.09606891125440598
Which of the following is/are the disadvantages of an open loop control system?,Inaccurate.,Unreliable.,both A and B.,none of the above.,C,True,0.04492449387907982,0.007806706707924604,0.902332603931427,0.04492449387907982
A diode (p-n junction) when reverse biased act as,On Switch,Zener diode,Capacitor,Off Switch,D,False,0.10995220392942429,0.024533655494451523,0.6327313184738159,0.23276886343955994
Piezoelectric effect is carried out in,composite filter.,crystal filter.,m derived.,constant k prototype.,B,False,0.8830622434616089,0.0821375772356987,0.03424003720283508,0.0005534386145882308
The resistivity of the conductor depends on,area of the conductor.,length of the conductor.,type of material.,none of these.,C,False,0.8889240026473999,0.03446732461452484,0.07296732813119888,0.0036328292917460203
The smallest change in measured variable to which instrument will respond is,resolution.,accuracy.,precision.,sensitivity.,A,False,0.23307369649410248,0.002933965064585209,0.7179175615310669,0.04589493200182915
"In electronic communications, ""AM"" stands for",Amp Modification,Amplitude Method,Amplitude Modulation,Ampere Method,C,False,0.8063170909881592,0.011501495726406574,0.17991366982460022,0.0022647790610790253
Which system is also known as automatic control system?,Open loop control system,Closed loop control system,Either A or B,Nether A nor B,B,False,0.0801440179347992,0.0018848067848011851,0.24686098098754883,0.6710376143455505
A combinational PLD with a fixed AND array and a programmable OR array is called a,PLD,PROM,PAL,PLA,B,False,0.5774485468864441,0.017437433823943138,0.39687418937683105,0.008236860856413841
A null type instrument as compared to a deflected type instrument has,a lower sensitivity.,a faster response.,a higher accuracy.,all of the above.,C,False,0.5252189040184021,0.04311259090900421,0.15047773718833923,0.2811294198036194
"Length of the cable is doubled, its capacitance C will be",one-fourth.,one-half.,doubled.,unchanged.,C,True,0.25973793864250183,0.10827487707138062,0.6230789422988892,0.008887743577361107
Electrons in p-type material of a semi-conductor are called as,either minority carriers or majority carriers,minority carriers,majority carriers,valance carriers,B,False,0.8690168857574463,0.023158514872193336,0.10378926992416382,0.004024346824735403
________ is the most detrimental impurity in the magnetic materials,Carbon.,Sulphur.,Oxygen.,Nitrogen.,A,False,0.2215181589126587,0.004597462248057127,0.7731742858886719,0.0007050437270663679
Voltage controlled oscillators are used commonly in,Pulse Modulators Frequency Modulators Phase Clocked loops,Frequency Modulators,Phase Clocked loops,All the above,D,False,0.9989314675331116,0.0010321935405954719,3.531972106429748e-05,6.469032882705505e-07
Low frequency supply is necessary for direct core type induction furnaces because,With normal frequeny supply the electromagnetic forces causes severe stirring action in the molten metal.,Magnetic coupling between the primary and secondary circuit is poor.,Both A and B.,None of the above.,C,True,0.09299531579017639,0.02351289801299572,0.8823149800300598,0.0011706382501870394
"The moving coil-meters, damping is provided by",the aluminium frame of the coil.,the coil spring attached to the moving.,eddy current disk.,damping vane in the airtight chamber.,A,True,0.5290178060531616,0.2498903125524521,0.22052741050720215,0.0005466328002512455
Which of the following is the analogous quantity for mass element in force-voltage analogy?,Resistance.,Inductance.,Capacitance.,All of the above.,B,False,0.676064670085907,0.04897396266460419,0.24871033430099487,0.0262138731777668
A latch is ________ sensitive,both level and edge,edge,level,,C,True,0.19128040969371796,0.029333800077438354,0.7565286755561829,0.022845188155770302
What is used to protect the SCR from over current ?,CB and fuse.,Heat sink.,Snubber circuit.,Voltage clamping device.,A,False,0.0687011331319809,0.04721755161881447,0.7386068105697632,0.14544029533863068
The errors mainly caused by human mistakes are,gross error.,instrumental error.,observational error.,systematic error.,A,False,0.09597903490066528,0.01667865738272667,0.5523212552070618,0.33499979972839355
Electrical analogous quantity for dash-pot in force-current analogy is,resistance.,conductance.,inductance.,capacitance.,B,False,0.032903511077165604,0.029037244617938995,0.8485926985740662,0.08944100886583328
Which lamp has the best Colour Rendering Index (CRI)?,LED,Fluorescent,Incandescent,High pressure sodium vapour,C,False,0.8501249551773071,0.029089676216244698,0.11505190283060074,0.005728096701204777
Power dissipation in ideal inductor is,Maximum,Minimum,Zero,A finite value,C,True,0.04594961553812027,0.16037991642951965,0.4940049350261688,0.2996291518211365
For intermittent work which of the following furnace is suitable?,Core less furnace.,Indirect arc furnace.,Either of above.,Nither of above.,B,False,0.27794307470321655,0.11586390435695648,0.5884054899215698,0.01776830665767193
In electrical resistance welding material of electrode should have,higher electrical conductivities.,higher thermal conductivities.,sufficient strength to sustain high pressure at elevated temperatures.,all of above.,D,False,0.8870469927787781,0.01624683290719986,0.09349405765533447,0.0031991908326745033
Which of the following are the passive elements?,Resistor,Bulb,Both,None of these.,C,True,0.39015626907348633,0.07682632654905319,0.5009706020355225,0.03202597796916962
The main advantage of dielectric heating is that,heating occurs in the material itself.,heating occurs due to high frequency.,it can be used for drying the explosives.,None of the above.,A,True,0.6568185687065125,0.05391494929790497,0.2738026976585388,0.015446892008185387
Materials used in heat sink should have,high thermal conductivity.,large surface area.,high melting point.,All of these.,D,False,0.9744223356246948,0.007439806126058102,0.01784716732800007,0.0002884726272895932
Conductor is static and the field is varying then emf will be induced. This principle is called,virtually induced emf.,dynamically induced emf.,static induced emf.,none of these,C,False,0.9764411449432373,0.013928184285759926,0.009572693146765232,5.692130798706785e-05
"Four identical alternators each are rated for 20 MVA, 11 KV having a subtransient reactance of 16% are working in parallel. The short circuit level at the busbar is",500 MVA,400 MVA,125 MVA,100 MVA,A,True,0.38791829347610474,0.1832396239042282,0.38791829347610474,0.0408862866461277
"According to the Bohr model, an electron gains or losses energy only by",moving faster or slower in an allowed orbit.,jumping from one allowed orbit to another.,being completely removed from an atom.,jumping from one atom to another atom.,B,False,0.9535720944404602,0.03262944146990776,0.013601974584162235,0.00019402176258154213
A three-state buffer has the following output states,"1, 0, float","High, Low, Float",Both A and B,"Set, Reset, Halt",C,True,0.017665807157754898,0.009455825202167034,0.9645203351974487,0.008344735950231552
"By using which of the following elements, mechanical translational systems are obtained?",mass element,spring element,dash-pot,all of the above,D,False,0.9523348212242126,0.015393058769404888,0.02875802107155323,0.003434655722230673
"Four capacitors each of 40 µF are connected in parallel, the equivalent capacitance of the system will be",160 µF,10 µF,40 µF,5 µF,A,False,0.2523757219314575,0.32405683398246765,0.3672045171260834,0.05631263926625252
"The resistance of a conductor of diameter d and length l is R Ω. If the diameter of the conductor is halved and its length is doubled, the resistance will be",R Ω,2R Ω,4R Ω,8R Ω,C,True,0.1371452808380127,0.08318281918764114,0.6964812278747559,0.08318281918764114
A single phase full bridge inverter can operated in load commutation mode in case load consist of,RL.,RLC underdamped.,RLC overdamped.,RLC critically damped.,B,False,0.8181309700012207,0.024705415591597557,0.14216983318328857,0.014984591864049435
A microprocessor is ALU,and control unit on a single chip.,and memory on a single chip.,register unit and I/O device on a single chip.,register unit and control unit on a single chip.,D,False,0.08938433229923248,0.05421433970332146,0.8480550050735474,0.008314038626849651
"To obtain a high value of capacitance, the permittivity of dielectric medium should be",low,zero,high,unity,C,True,0.17191743850708008,0.014111842960119247,0.7704805135726929,0.04346753656864166
Deflection method direct measurements are most widely used as these are,least time consuming.,most simple.,most simple and least time consuming.,most accurate.,C,True,0.006964120548218489,0.008942107670009136,0.5532286167144775,0.430854856967926
Purely mechanical instrument cannot be used for dynamic measurements because they have,high inertia.,higher response time.,large time constant.,all of the above.,D,False,0.9068108797073364,0.045147452503442764,0.045147452503442764,0.0028861803002655506
Advantages of higher transmission voltage is/are,Power transfer capability of the transmission line is increased,Transmission line losses are reduced,Area of cross section and volume of the conductor is reduced,all of the above,D,False,0.9864194989204407,0.005865464452654123,0.003139557084068656,0.004568028729408979
Under over voltage condition impedance offered by the voltage clamping device is,high.,low.,moderate.,infinity.,B,False,0.3741576075553894,0.12147118896245956,0.48042789101600647,0.02391909435391426
A long wire composed of a smooth round conductor runs above and parallel to the ground (assumed to be a large conducting plane). A high voltage exists between the conductor and the ground. The maximum electric stress occurs at,lower surface of the conductor.,upper surface of the conductor.,the ground surface.,midway between the conductor and ground.,A,True,0.5197690725326538,0.2782123386859894,0.19121237099170685,0.010787462815642357
In a dc machine 6 pole wave winding is used. The number of parallel paths are?,6,4,2,1,C,False,0.762776792049408,0.15019965171813965,0.08039607852697372,0.00659931218251586
Which of the following is a digital device,Regulator of a fan,Microphone,Resistance of a material,Light switch,D,False,0.06295670568943024,0.029738640412688255,0.8690904378890991,0.03818517178297043
Instantaneous power in inductor is proportional to the,product of the instantaneous current and rate of change of current.,square of instantaneous current.,square of the rate of change of current.,temperature of the inductor.,A,True,0.9185241460800171,0.06653766334056854,0.0148465596139431,8.828087447909638e-05
Which of the following is a variable displacement transducer?,tachometer,potentiometer,synchros,none of the above,B,False,0.6194074749946594,0.04486972838640213,0.3315449357032776,0.004173534456640482
"Five capacitors each of 5 µF are connected in series, the equivalent capacitance of the system will be",5 µF,25 µF,10 µF,1 µF,D,False,0.4081503748893738,0.1501501500606537,0.4081503748893738,0.03350302577018738
Susceptibility is negative for,non magnetic substances.,diamagnetic substances.,ferromagnetic substances.,none of above.,B,False,0.04525331035256386,0.03110211342573166,0.9089370369911194,0.01469159871339798
One of the following is the primary function of an oscillator,produces sinusoidal oscillations,generates non sinusoidal waveforms,generates sustained oscillations at a constant amplitude and specific frequency,none of the above,C,False,0.8201290369033813,0.01502118818461895,0.1614929735660553,0.003351680003106594
The metal surfaces for electrical resistance welding must be,rough.,clean.,moistened,coloured,B,False,0.20397965610027313,0.058441150933504105,0.6283016204833984,0.1091824397444725
The latching current of SCR is 20 mA. Its holding current will be,23 mA.,40 mA.,10 mA.,60 mA.,C,True,0.026560267433524132,0.06371477246284485,0.8795552849769592,0.03009672649204731
"In force-current analogy, electrical analogous quantity for displacement (x) is",voltage.,inductance.,capacitance.,flux.,D,False,0.04055437445640564,0.05900627002120018,0.8145564198493958,0.08585360646247864
Feedback circuit in an oscillator can be accomplished by,Resistive coupling between input and output,Capacitive coupling between input and output,Inductive coupling between input and output,Any one or combinations of the above methods,D,False,0.9435798525810242,0.01958337426185608,0.03658656030893326,0.0002465182915329933
"Lowest critical frequency is due to zero and it may be present at the origin or nearer to the origin, then the type of network is",LC circuit.,RC circuit.,RLC circuit.,RL Circuit.,D,False,0.4766041040420532,0.030468281358480453,0.4766041040420532,0.01630849577486515
What is the value of dielectric constant of air?,Less than 1,0.,1.,none of these.,C,False,0.9083932042121887,0.05124804005026817,0.039912011474370956,0.0004433824506122619
Temperature variation is a/an,Digital quantity,Analog quantity,Either Digital or Analog quantity,,B,False,0.6398402452468872,0.01504760142415762,0.18331731855869293,0.16177695989608765
The illumination at a point 5 meters below a lamp in 6 lux. The candle power of the lamp is,30,140.,150.,200.,C,True,0.13922058045864105,0.1787627637386322,0.6239433288574219,0.05803576856851578
