0,1,2,3,4,5,correct,choiceA_probs,choiceB_probs,choiceC_probs,choiceD_probs
For a dc machine shunt resistance and armature resistance values are,high and high,high and low,low and low,low and high,B,False,0.10243602842092514,0.24573127925395966,0.5202131271362305,0.13153046369552612
The change of cross sectional area of conductor in magnetic field will affect,reluctance of conductor.,resistance of conductor.,(A) and (B) both in the same way.,none of above.,C,True,0.24170851707458496,0.0327116884291172,0.5116969347000122,0.21330700814723969
Which of the following is used in SCR to protect from high dV / dt?,Snubber circuit.,Fuse.,Equalizing circuit.,Circuit breaker.,A,False,0.3442564606666565,0.06778811663389206,0.5008901953697205,0.08704166114330292
"What are the sets of commands in a program which are not translated into machine instructions during assembly process, called?",Mnemonics,Directives,Identifiers,Operands,B,False,0.4455431401729584,0.07742378115653992,0.23848207294940948,0.23848207294940948
Speed of data transmission in 4-G network of telecom is,386 kbps - 2 mbps.,2 mbps.,2 mbps – 1 gbps.,100 mbps - 1 gbps.,D,False,0.5151289701461792,0.27572867274284363,0.1475869119167328,0.06152338162064552
Which of the followings is/are active element?,Voltage source,Current source,Both,None of these.,C,False,0.45372089743614197,0.07884486764669418,0.45372089743614197,0.013701184652745724
Electrical analogous quantity for spring element (K) in force-voltage analogy is,L,R,1/C,C,C,False,0.13350993394851685,0.11782210320234299,0.2826405465602875,0.4659954607486725
A quartz crystal oscillator consists of,only series resonant frequency.,only parallel resonant frequency.,both series and parallel frequencies.,neither series nor parallel frequency.,C,True,0.19103509187698364,0.04830123484134674,0.755558431148529,0.00509091280400753
Which of the following oscillators are used for low frequency (LF) applications,LC oscillators,RC oscillators,Both LC and RC Oscillators,,B,False,0.7748320698738098,0.020648576319217682,0.19590823352336884,0.008607607334852219
The solid angle subtended by an area of 2400 cm^2 on the surface of a sphere of diameter 1.2 m is,3 / 2.,1 / 3.,2 / 3.,2 / 5.,C,False,0.16218474507331848,0.38906100392341614,0.38906100392341614,0.05966443940997124
Relative error is same as,ratio of absolute error and true value.,absolute error.,true error.,none of the above.,A,True,0.9557538032531738,0.025469975546002388,0.017505241557955742,0.0012680754298344254
If holding current of a thyristor is 2 mA then latching current should be,0.01 A.,0.002 A.,0.009 A.,0.004 A.,D,False,0.08123145252466202,0.13392801582813263,0.7707025408744812,0.014115910045802593
"In an intel 8085A, which is the first machine cycle of an instruction?",An op-code fetch cycle,A memory read cycle,A memory write cycle,An I/O read cycle,A,False,0.07208622992038727,0.03405112400650978,0.7750000357627869,0.11885010451078415
Which of the following are the disadvantages of a closed loop control system?,Reduces the overall gain.,Complex and costly.,Oscillatory response.,All of the above.,D,True,0.11401751637458801,0.037016067653894424,0.39796021580696106,0.45094799995422363
"Poles and zeros are arranged alternatively on negative real axis, then type of network is/are",LC network.,RC network.,RL network.,Both 2 and 3.,D,False,0.4828009605407715,0.039630718529224396,0.42607036232948303,0.01286621019244194
The magnetisation and applied field in ferromagnetic materials are related,sinusoidally.,non linearly.,linearly.,parabolically.,B,False,0.8819751739501953,0.043910957872867584,0.07239693403244019,0.0017026126151904464
Thin laminations are used in a machine in order to reduce,Eddy current losses,Hysteresis losses,Both A and B,Copper losses,A,True,0.8809571862220764,0.012566179037094116,0.07231336832046509,0.03415841609239578
A metal surface with 1 meter radius and surface charge density of 20 coulombs / m2 is enclosed in a 10 m side cube. The total outward electric displacement normal to the surface of the cube is,40π coulombs.,80π coulombs.,10π coulombs.,none of these.,B,False,0.6880506277084351,0.1739664375782013,0.1354851871728897,0.0024814980570226908
In binary number system the first digit (bit) from right to left is called as,"LSB, Least Significant Bit","MSB, Most Significant Bit",First Bit,Last Bit,A,True,0.5095517635345459,0.025369087234139442,0.44967785477638245,0.015387129969894886
In two wattmeter method of power measurement if the total power is measured by one wattmeter only then power factor of the system is,0.,0.5.,1.,none of above.,B,False,0.21139483153820038,0.14528939127922058,0.5746306777000427,0.06862984597682953
A 0 - 100 V voltmeter has a guaranteed accuracy of 2 % of full scale reading. The voltage measured by the voltmeter is 75 V. The limiting error is in percentage,3.33 %.,2.66 %.,2 %.,1 %.,B,False,0.37968263030052185,0.26095181703567505,0.3350687623023987,0.02427229844033718
Which of the following methods is/are used for reactive or voltage compensation,shunt capacitor,series capacitor,generation excitation control,all of the above,D,False,0.9035474061965942,0.024078721180558205,0.06545275449752808,0.006898669060319662
The ROM programmed during manufacturing process itself is called,MROM,PROM,EPROM,EEPROM,A,True,0.5836870074272156,0.025645416229963303,0.2757142186164856,0.1149347722530365
In 8085 name/names of the 16 bit registers is/are,stack pointer.,program counter.,both A and B.,none of these.,C,False,0.5698800683021545,0.025038782507181168,0.3916724622249603,0.013402294367551804
Stability of a transmission line can be increased by,shunt capacitor,series capacitor,shunt reactor,both A and B,D,False,0.9999798536300659,1.670136407483369e-05,1.136542209678737e-06,3.0589615107601276e-07
Snubber circuit is used with SCR,in series.,in parallel.,either series or parallel.,anti parallel.,B,False,0.8781190514564514,0.023401079699397087,0.09255306422710419,0.005916719790548086
The number of rings in the Bohr model of any element is determined by what?,Column number on periodic table.,Atomic mass.,Row number on periodic table.,Atomic number.,C,True,0.19893300533294678,0.08292761445045471,0.6943444013595581,0.023759158328175545
Silicon and Germanium are ________ elements.,trivalant,pentavalant,hexavalant,tetravalant,D,False,0.17748743295669556,0.012857147492468357,0.7019764184951782,0.10765157639980316
The number of output pins in 8085 microprocessors are,27.,40.,21.,19.,A,False,0.0316886343061924,0.08613864332437515,0.7212299704551697,0.1609281748533249
If P is the power of a star connected system then what will be power of an equivalent delta connected system?,P,3P,P/3,None of the above,A,True,0.8326601386070251,0.05323018133640289,0.11268829554319382,0.0014185364125296474
Which oscillators are easy to fabricate in a monolithic IC?,Crystal oscillator.,Hartley oscillator.,Wien bridge oscillator.,Relaxation oscillator.,D,False,0.966315507888794,0.010734796524047852,0.022725563496351242,0.0002227935619885102
"If all the elements in a particular network are linear, then the superposition theorem would hold, when the excitation is",DC only,AC only,Either AC or DC,An Impulse,C,True,0.07690601795911789,0.03632783144712448,0.8268176317214966,0.05989446863532066
The feedback factor of a Wien bridge oscillator using Op-Amp is,1/3,1/4,1/2,1,C,False,0.5057559013366699,0.09958922863006592,0.3067564368247986,0.08788718283176422
"The length of bus cycle in 8086/8088 is four clock cycles, T1, T2, T3, T4 and an indeterminate number of wait state clock cycles denoted by Tw. The wait states are always inserted between",T1 & T2,T2 & T3,T3 & T4,T4 & T1,C,True,0.2553154230117798,0.02374803088605404,0.6940191984176636,0.026910044252872467
Which of the following is not a sinusoidal oscillator?,LC oscillator,RC phase shift oscillator,Relaxation oscillator,Crystal oscillator,C,True,0.3385160565376282,0.027787089347839355,0.5581186413764954,0.07553314417600632
A wire carrying current is bent in the form of a circular loop. Then the magnetic field around each portion of the wire will be,parallel to the plane of the wire.,perpendicular to the circumference of the wire.,parallel to half portion and perpendicular for the other half.,none of above.,A,False,0.22790119051933289,0.10765288025140762,0.6194995641708374,0.044876400381326675
