0,1,2,3,4,5,correct,choiceA_probs,choiceB_probs,choiceC_probs,choiceD_probs
The most important element of ethical research on human subjects is:,Beneficence,Justice,A methodologically sound study design,Informed consent,D,False,0.24094048142433167,0.015402809716761112,0.5779861807823181,0.16559581458568573
The characteristic of injecting drug users in Asia is/are:,Strong family support,Low failure rate for rehabilitation centers,Remaining a member of the community,Both a and c,D,True,0.006400592625141144,0.013550055213272572,0.24018046259880066,0.7398079037666321
"Viruses have encouraged us to change our world, as we have now:",Eradicated smallpox,Eradicated polio,Increased hygiene,A better understanding of how cellular genes aid virus replication and so become a target for new drugs,A,False,0.014702821150422096,0.024240853264927864,0.15807020664215088,0.8027468323707581
What is the most important factor for virus classification?,The geometry of the virus,How many proteins the virus has,The disease a virus causes,Chemistry of the DNA and RNA,D,False,0.012638567015528679,0.007665678858757019,0.886031985282898,0.09338708221912384
The major issue for HIV infection among the Latino population is:,Late detection of HIV status,Cultural beliefs,Immigration,All of the above,D,False,0.007396691478788853,0.012195082381367683,0.6658288836479187,0.3145153224468231
Disease can most often be prevented by which of the following:,Vaccines,Antivirals,Hygiene,mosquito nets,A,False,0.011076797731220722,0.01611664518713951,0.8799390196800232,0.09274488687515259
Results of surveillance should be distributed to:,Decision makers,The public,The data collectors,All of the above,D,True,0.003119674976915121,0.00078877730993554,0.015843015164136887,0.9801726937294006
Which is a major characteristic of the bunyavirus family?,"Amplify by persistent infection of midgets, mosquitoes, sand flies, ticks",Predominantly mosquito borne,Genetic recombination or reassortment,Spread to humans via bites of mice and rats,A,False,0.08859404176473618,0.0689971074461937,0.6546263694763184,0.18755359947681427
The group that permits analysis of the entire natural history of HIV/AIDS is:,Persistent seronegatives,Long-term survivors,Seroconverters,Long-term survivors with low levels of CD4+ cells,C,True,0.0019575762562453747,0.008773247711360455,0.8948955535888672,0.09432129561901093
The chance of acquiring HIV infection from factor VIII in the United States in 2011 is 0% primarily because:,All donors for factor VIII are screened,Factor VIII is subject to detergent “washing” prior to release,Factor VIII is made synthetically,Factor VIII is important from countries with no reported HIV,C,True,0.04491525515913963,0.07405273616313934,0.7025928497314453,0.177643284201622
The prevalence of HIV among Latino-Americans compared to other ethic groups in the U.S. is:,Highest,Higher than all other ethnic groups except African-Americans,Higher than in all other ethnic groups except African-Americans and,Native Americans,B,False,0.014580425806343555,0.011355247348546982,0.5471264719963074,0.42610251903533936
What is the rubella syndrome?,A description of the 3 day rash of German measles,"The teratogenic lesions of cataracts, deafness, mental retardation and microcephaly in the foetus",Combination of rash and post infection encephalitis,Side effects of the MMR vaccine,B,False,0.008172880858182907,0.010494187474250793,0.9446565508842468,0.03662830963730812
What is the most common way for a virus to kill a cell?,Dissolves the cellular membrane,Induces apoptosis via caspases,Fragments cellular DNA,Totally blocks cellular transcription,B,False,0.12272579967975616,0.057971563190221786,0.48538994789123535,0.3336033225059509
The influenza virus has complicated genetics mainly characterised by which of the following?,Genetic reassortment amongst 8 genes,High levels of recombination,Rapid adsorption and fusion from without via a hydrophobic peptide,High fidelity RNA replicase enzyme,B,False,0.05295036733150482,0.05295036733150482,0.5023791193962097,0.391253262758255
The highest risk of HIV infection among drug users in the U.S. is in:,The east coast,"The central United States (Kansas, Missouri etc.)",Southern California,"The Pacific Northwest (Washington, Oregon, Idaho)",A,False,0.1700112670660019,0.15003442764282227,0.6724076271057129,0.007469774689525366
"A study is conducted to assess the relationship between race and end-stage renal disease pathologists independently study specimens from 1,000 kidney biopsies. The first group of pathologists is aware of the race of the patient from whom the biopsy came, while the second group is blinded as to the patient’s race. The first group reports ‘hypertensive nephropathy’ much more frequently for black patients than the second group. Which of the following types of bias is most likely present in this study?",Confounding,Nonresponse bias,Recall bias,Referral bias,A,False,0.21167707443237305,0.09998916834592819,0.4481203556060791,0.23986156284809113
What is urban yellow fever (YF)?,Part of a cycle of mosquitoes biting humans in cities,Part of a cycle of mosquitoes biting humans and monkeys in forested areas,A mutant of the YF virus,A YF species that has adapted to new mosquitoes,A,False,0.036683645099401474,0.02856925129890442,0.8349158763885498,0.09971648454666138
The current testing policy of the Centers for Disease Control and the World Health Organization is:,“Opt-in”,“Opt-out”,Mandatory testing of prisoners,Mandatory testing of high-risk groups,B,False,0.07355675846338272,0.15571965277194977,0.290922611951828,0.4796503186225891
Common cold viruses are ubiquitous and invade by which route?,Faecal oral route,Respiratory and surface route,Cuts in the skin,Sexual transmission,B,False,0.043671756982803345,0.07200255990028381,0.4695156514644623,0.4143460988998413
Assembly is a vital late replication stage for a virus and is often accomplished by which of the following?,Use of cellular scaffolding in the nucleus and cytoplasm,Snatching cellular lipids and membranes,Master plan embedded in the viral genome,Random interactions between cellular and virus proteins,A,False,0.019451245665550232,0.04117828607559204,0.8270880579948425,0.11193419247865677
The biggest single determinant of HIV transmission to the infant is:,Mother’age,Mother’s viral load,Mother’s immune status,Father’s viral load,B,False,0.11231192201375961,0.07719078660011292,0.646310567855835,0.1634128987789154
What does the reproductive number of a virus tell us?,How virulent the infection will be,How many people will die,How many contacts will be infected from one case,How long the 'incubation period' will be,C,False,0.023480042815208435,0.07232362031936646,0.3672896921634674,0.5344033241271973
PreP is most effective for which group:,Men with frequent unprotected sex,Men with infrequent unprotected sex,Women with frequent unprotected sex,Women with infrequent unprotected sex,A,False,0.06286334246397018,0.13308168947696686,0.7658323049545288,0.03812854364514351
A special feature of adaptive immunity is:,Speed of response to a foreign protein,Ability to distinguish self and non self,Ability to distinguish viruses and bacteria,Short memory,B,False,0.011519188992679119,0.05849926546216011,0.9150825142860413,0.014790930785238743
As regards the range of diseases caused by viruses:,Each member of the 'family' causes the same disease.,Members of many families can cause the same sort of disease.,Most virus disease are now controlled by vaccines.,Most viruses can cross placenta and be teratogenic.,B,False,0.051689356565475464,0.07520757615566254,0.38193556666374207,0.49041497707366943
Which is the exception in the following range of disease symptoms caused by bunyaviruses?,Pneumonias,Haemorrhagic fever,Hepatitis,Impaired renal function,D,False,0.05541364476084709,0.0296607855707407,0.5957528352737427,0.3188835382461548
There is no vaccine against HIV because of which of the following?,The virus is so antigenically variable,Such a vaccine would be too expensive,The virus can be controlled by a change in sexual habits,Latency can abrogate any vaccine effect,B,False,0.023150254040956497,0.0159109216183424,0.19383470714092255,0.7666311264038086
The requirements for an effective surveillance system include:,A diagnostic algorithm,Staff members,A sampling frame,All of the above,D,True,0.08993701636791229,0.009479290805757046,0.3139110207557678,0.5864629745483398
MERS has four special characteristics and here we have one exception - which is it?,Spread by faecal oral route,Aerosol droplet transmission,Reservoir in bats,A conduit to humans via camels,C,False,0.2088610678911209,0.2088610678911209,0.2366705983877182,0.34435367584228516
The major beneficiary of Medicaid in the U.S. is:,Single men,The elderly,Women and children,Undocumented residents,C,True,0.011188824661076069,0.005988946184515953,0.7843971848487854,0.19832667708396912
Which of the following is the most important for controlling disease caused by norovirus?,A norovirus vaccine,Attention to handwashing and hygiene,Quarantine,New antiviral drugs,B,False,0.04298632591962814,0.06254472583532333,0.7619507908821106,0.13240718841552734
Why do vigorous CD8 cell responses in chronically infected HIV-positive individuals fail to eliminate the virus?,CTL exhaustion,Epitope escape,Suboptimal CTL,Absence of dendritic cells,B,False,0.022477872669696808,0.019836653023958206,0.8434759378433228,0.11415205895900726
The most widespread and important retrovirus is HIV-1; which of the following is true?,Infecting only gay people,Infecting only males,Infecting every country in the world,Infecting only females,A,False,0.044222474098205566,0.03902620077133179,0.22458027303218842,0.6917559504508972
The first acquired immune cell to respond defensively to HIV infection is:,CD4+,CD8+,CD57,NK cells,B,False,0.012001619674265385,0.012001619674265385,0.3974390923976898,0.578270435333252
Which of the following is a special feature of the rabies vaccine?,The vaccine has not changed since the time of L. Pasteur,The original air dried spinal cord of infected rabbits was a killed vaccine,The vaccine still needs 16 doses given into the peritoneal cavity,The modern rabies vaccine is grown in human diploid cells from an aborted embryo,B,False,0.03298550471663475,0.04799362272024155,0.5159801244735718,0.4018457233905792
Most viral vaccines are produced by which of the following techniques?,Traditional cell culture,Molecular biology,Animal tissues in vitro,VLPs (virus like particles),B,False,0.0407564751803875,0.16119499504566193,0.49651554226875305,0.30115190148353577
The treatment of hepatitis C has been revolutionised most recently by which of the following?,The use of interferon,A new vaccine,Monoclonal antibodies,Direct-acting Antivirals such as daclatasvir and sofosbuvir,A,False,0.08576913923025131,0.08576913923025131,0.718136191368103,0.11012975871562958
Chikungunya has spread widely from Asia and Africa into the Caribbean in recent years. This has been mainly facilitated by:,Mutation in the virus allowing replication in the mosquito Aedes albopictus,Air Travel,Climate change,Poor mosquito control and the absence of DTT,A,False,0.04352356120944023,0.10440759360790253,0.3215980529785156,0.5302255153656006
The successful anti-cancer HPV vaccine consists of:,Live virus attenuated by specific mutagenesis,Whole virus chemically inactivated vaccine,Self-assemble of virus L1 protein into VLP,Sub unit chemically inactivated vaccine,A,False,0.046341586858034134,0.08657748252153397,0.5645561218261719,0.3021851181983948
The rotavirus is an important cause of which of the following?,Respiratory infection in adults,Gastroenteritis in children,Diarrhoea and vomiting in adults,Cancer,B,False,0.14120055735111237,0.06669842451810837,0.49283838272094727,0.2989215850830078
The surveillance testing strategy associated with the least selection bias is:,Compulsory,Unlinked anonymous,Voluntary anonymous,Voluntary confidential,A,False,0.00843873992562294,0.06235431879758835,0.7596310973167419,0.16949662566184998
"In a medical class of 147 students, the distribution of scores on a biochemistry final examination has a mean equal to 67, a median equal to 76, a mode equal to 80, a standard deviation equal to 5.5, and a variance equal to 30.25. Three students were unable to take the test on the scheduled date and were given a different form of the exam 1 week later. Which parameter is most likely to be the least biased estimator of central tendency for this distribution of biochemistry test scores?",Mean,Median,Mode,Standard deviation,A,False,0.021582840010523796,0.02771291509270668,0.8098901510238647,0.14073778688907623
What disease do herpes viruses not cause?,Infantile paralysis,Encephalitis,Sexually transmitted disease,Cancer,A,False,0.018321216106414795,0.006739999167621136,0.36799147725105286,0.6067153811454773
The purpose of a double-blind or double-masked study is to:,Achieve comparability of treated and untreated subjects,Reduce the effects of sampling variation,Avoid observer and subject bias,Avoid observer bias and sampling variation,B,False,0.05268855392932892,0.07666139304637909,0.7273430228233337,0.14322233200073242
Nipah is a zoonotic paramyxovirus; where did it originate?,Originating in pigs,Originating in bats,Coming from humans,Coming from horses,C,True,0.044994886964559555,0.03504205122590065,0.7975534200668335,0.12230878323316574
What is the genome structure of the polyomavirus family?,Circular ds DNA with T antigen coding regions,Circular ssDNA,RNA genome with RT,Segmented RNA genome,C,True,0.03927462548017502,0.01637209951877594,0.7888519167900085,0.15533414483070374
Interferons are very special defence mechanisms which operate by:,Binding to viruses,Binding to neighbouring cells,Producing a long lasting state of resistance,Inhibiting virus induced enzymes,B,False,0.05801280960440636,0.09564695507287979,0.7067407369613647,0.1391654908657074
Genetic characteristics of the bunyavirus family include which one of the following?,Three segmented negative stranded RNA viruses with anti-sense expression,Highly mutable RNA viruses,Emerging viruses via arthropod vector,Use an RT enzyme,A,False,0.08698184788227081,0.0410873144865036,0.8252608180046082,0.04655803367495537
"The basic code of ethical research (respect for persons, beneficence, and justice) was first established by the:",Nuremberg Code,Declaration of Helsinki,CIOMS,Belmont Report,D,False,0.07862064242362976,0.2421686351299286,0.5126709938049316,0.16643989086151123
The paramyxovirus family employ what strategy at virus entry?,Initiate a fusion 'from without' using virus F protein,Has fusion from within a cytoplasmic vacuole at low pH,Viruses can puncture plasma membranes at entry,A fusion mediated by M protein,D,False,0.10956845432519913,0.027703246101737022,0.6305229663848877,0.23195645213127136
The risk of acquiring HIV from a unit of blood in the United States is now:,"1/10,000 units","1/200,000 units","1/500,000 unit",1 per 2 million units,D,False,0.0748530849814415,0.0748530849814415,0.7101863026618958,0.13984397053718567
What is the essential pathology of astroviruses?,Very restricted replication in the gut,Can cause infection of the central nervous system,Sequence diversity allows widespread replication,Can cause infection in the upper respiratory tract,A,False,0.08038849383592606,0.19284199178218842,0.4082464873790741,0.31794267892837524
Which of the following are goals of vaccination?,Prevent infection,Prevent disease,Prevent transmission,All of the above,D,False,0.09770795702934265,0.00802035816013813,0.8180986642837524,0.07609502971172333
Randomization of study subjects in a clinical trial is most helpful for controlling for which of the following?,Placebo effect,Recall bias,Non-compliance,Effect modification (interaction),A,False,0.028773436322808266,0.04186510667204857,0.5779299139976501,0.3505322337150574
A quasi species virus such as influenza and HIV has which of the following characteristics?,A fragmented or segmented genome,Co-existence of innumerable genetic variants,Possesses RNA and DNA,A very large genome,B,False,0.01733502931892872,0.02858063578605652,0.44707632064819336,0.5066038370132446
Positive stranded RNA viruses have which of the following characteristics?,Their genome RNA can be translated directly as mRNA,They have to transcribe their genome RNA to a mirror image copy as a mRNA,This genome is circular,Their RNA genome is segmented,A,False,0.02615332044661045,0.017974896356463432,0.6745030283927917,0.2811746895313263
What is the genetic structure of rotavirus?,Circular DNA containing virus,RNA virus with RT,ds RNA virus,ds RNA virus in segments,B,False,0.006556402891874313,0.009539510123431683,0.9730564951896667,0.010809681378304958
Are/were viruses:,The most abundant form of life on earth?,Discovered before bacteria?,Grown in animals in the laboratory?,The cause of all human disease?,A,False,0.012765439227223396,0.01857360452413559,0.07346003502607346,0.8949264287948608
It is unlikely that a 'cure' of HIV is possible with current drugs because:,Even in combination current drugs do not completely block viral replication,They do not penetrate to cells,They cannot block viral transcription from integrated viral DNA,They cannot penetrate to the CNS,B,False,0.016987234354019165,0.021812040358781815,0.14223235845565796,0.8184908032417297
Which viruses appear to be hypermutable?,DNA viruses,'Emerging' viruses,Influenza and HIV,RNA viruses,D,True,0.013885661959648132,0.005108249839395285,0.45982998609542847,0.5210556387901306
How are herpes infections controlled?,Chemotherapy,Vaccines,Hygiene and social distancing,No method,A,False,0.031872618943452835,0.007111742626875639,0.72541743516922,0.23550854623317719
"A new drug with in vitro activity against HIV is tested on a population of patients with Western-blot confirmed HIV infections. Out of the 200 individuals in the patient population, 100 are chosen by lottery to receive the drug. The drug, which is tasteless, is administered in a cup of orange juice; the other patients receive pure orange juice. Neither the nurses, doctors, nor the patients know which patients receive the drug. At the end of the study period, the number of CD4+ T cells is determined for all of the subjects. This is an example of a",Case-control study,Case report,Cohort study,Cross-sectional study,A,False,0.08211537450551987,0.01426951214671135,0.8828234672546387,0.020762018859386444
What is the most successful and most widely used 'travel' vaccine for international visitors?,Influenza,MMR,Yellow Fever,Rabies,B,False,0.027328720316290855,0.016575707122683525,0.9050029516220093,0.05105677619576454
What is a virus pandemic?,A sharp and rapid epidemic involving more than one country,An outbreak which recurs again and again,A rapid global outbreak starting from a single focus,A characteristic of common cold virus and HIV,C,True,0.04644133523106575,0.03191863000392914,0.823192298412323,0.09831630438566208
Benefits of opioid replacement therapy as an approach for HIV prevention include:,Reducing craving for and use of illicit opioids,More sharing of injecting paraphernalia,Reducing frequency of injection drug use,Both a and c,D,True,5.141539440955967e-05,3.118501263088547e-05,0.00048781567602418363,0.9994271993637085
Papilloma viruses are characterised by what genetic feature?,A genome of ds circular DNA encoding around 8 ORF,A virus with RT able to integrate and cause cancer,A variable ds RNA virus,A large DNA containing virus,A,False,0.04360174760222435,0.023338334634900093,0.682046115398407,0.25091075897216797
"As part of the Women’s Health Study, researchers investigated the role of systemic inflammation in predicting cardiovascular disease in women (N Engl J Med. 2002;347[20]:1557-1565). Researchers used a prospective study design with a large sample size. Blood levels of C-reactive protein (CRP) were measured at baseline and women were followed for an average of 8 years. The following table shows the relative risk estimates of cardiovascular event (heart attack or stroke) within 5 years by quintile of CRP level for the 30,000 women. The first quintile is used as the reference category.  1 0.49 mg/dL Relative Risk Number of women  1.0 6000  2 >0.49-1.08 mg/dL 1.8 6000  Quintile of CRP Level 3 >1.08-2.09 mg/dL 2.3 6000  4 >2.09-4.19 mg/dL 3.2 6000  5 >4.19 mg/dL 4.5 6000  Based on the relative risk data above, one can conclude:",There is no risk of heart attack/stroke for women with CRP levels in the first quintile.,Decreasing CRP level appears to increase the risk of heart attack/stroke.,Increasing CRP level appears to increase the risk of heart attack/stroke.,There appears to be no association between CRP levels and heart attack/stroke.,A,True,0.2966403663158417,0.10912790149450302,0.2966403663158417,0.2966403663158417
What is the morphology of the Dane particle?,Double shelled icosahedron,Lipid membrane free icosahedron,Flexuous and filamentous morphology,Numerous small particles,C,True,0.034451887011528015,0.02683115378022194,0.7841212749481201,0.15440262854099274
The adenovirus virion has which unique structural feature?,Icosahedron,Icosahedron with slender fibres,'Complex' structure not yet fully explored,Flexuous lipid containing structure,B,False,0.03781433030962944,0.012276515364646912,0.2794122099876404,0.6702750325202942
"A city has a population of 250,000 cases and 400 deaths each year from this disease. There are 2,500 deaths per year from all causes. The prevalence of this disease is given by","400/250,000","600/250,000","1,000/250,000","2,500/250,000",D,False,0.07611611485481262,0.07611611485481262,0.7221695780754089,0.12549425661563873
Which unique form does the rabies virus take?,The virion has a dumbbell appearance,It is shaped like a bullet from a gun,The virus is star shaped,The virion is very pleomorphic,D,False,0.05563824623823166,0.012414570897817612,0.46585333347320557,0.46585333347320557
Which of the following diseases is not caused by togaviruses?,Chikungunya,Rubella (German measles),Western Equine encephalitis,Yellow Fever,D,False,0.02134825848042965,0.011426898650825024,0.706957221031189,0.26007506251335144
Why are the viruses of this family called astroviruses?,Because of the nucleotide sequence of their genomes,The superficial appearance of a 'star' on negative straining electron microscopy,"Because of isolation in very large numbers of mammals including dromedaries, cats and cattle",Because they are more common in developing countries with poor hygiene,B,False,0.007361389696598053,0.0107107600197196,0.017659056931734085,0.9641518592834473
Why do emerging viruses like Zika and Ebola continue to plague us?,These viruses mutate and hence emerge,We disturb forests where they quietly exist as a zoonosis,Mosquitoes are the main culprit to encourage virus spread,The viruses can be halted by new vaccines,B,False,0.009479029104113579,0.003487139707431197,0.02006710320711136,0.9668871760368347
