0,1,2,3,4,5,correct,choiceA_probs,choiceB_probs,choiceC_probs,choiceD_probs
How many human polyomaviruses are known at present?,100,1,10,unknown,A,False,0.11735383421182632,0.11735383421182632,0.10356440395116806,0.5598638653755188
AIDS activism in the U.S. resulted in:,Food and Drug Administration reforms,Easier access to investigational drugs,Changes in the way medicine was practiced in the U.S.,All of the above,D,True,0.16060565412044525,0.04060746729373932,0.18199005722999573,0.49470022320747375
"Globally, the most deaths are caused by:",Respiratory infections,Diarrheal diseases,Malaria,Tuberculosis,B,False,0.14971502125263214,0.04289407283067703,0.24683834612369537,0.5225567817687988
What happens during the 'incubation period'?,The virus is cleared from the body by the immune system,Virus replication happens at an intracellular level,This period commonly lasts for a few days,This period commonly lasts for a few hours,B,False,0.0933031290769577,0.11980359256267548,0.25362420082092285,0.41815561056137085
Newborn infants in countries with limited access to safe water and low levels of education should be:,Exclusively formula fed for six months,Exclusively breast fed for six months,Should receive both breast milk and other foods as tolerated in the first 6,months,B,False,0.09386307746171951,0.12829561531543732,0.22516581416130066,0.44779571890830994
Achieving effective change in a community is usually dependent on which of the following segments of society?,Innovators,Early adapters,Middle adapters,Late adapters,A,False,0.10272964090108871,0.10272964090108871,0.27924811840057373,0.4604022800922394
“Contingency management” is”:,A strategy of last resort for reducing high-risk behaviors,Paying drug users for negative urine specimens,Paying sex workers to use condoms,Paying drug users to use condoms,B,False,0.07076890766620636,0.062453337013721466,0.49123355746269226,0.2320423126220703
Typical clinical symptoms following infection with astroviruses include which of the following?,Acute pneumonia,Gastroenteritis in children,Hepatitis,rashes,B,False,0.10237454622983932,0.07036092877388,0.31533581018447876,0.45881086587905884
Which of the following is the most special characteristic of the adaptive immune system?,Antibodies,T cells,Memory T cells,Clonal expansion of pre-existing antibodies and/or T cells,D,True,0.12156717479228973,0.12156717479228973,0.1768791824579239,0.5448262691497803
Chemotherapy is now an option for clinical care of patients. Typical drug regimens now include which of the following?,Interferon and ribavirin,Lamivudine and ribavirin,Combinations of adefovir and entecavir and/or tenofovir (DAA),Interferons alone,B,False,0.3729718327522278,0.11374997347593307,0.18754202127456665,0.15547779202461243
"There were no new cases of Ebola virus in the United States from January 1, 1997 through January 1, 1998. Which of the following epidemiologic terms does this statement describe?",Incidence,Lifetime expectancy,Lifetime prevalence,Period prevalence,C,True,0.25994834303855896,0.0744764432311058,0.294560045003891,0.25994834303855896
How were retroviruses discovered?,In chickens as Rous sarcoma,In humans as HTLV-1,In mice causing leukaemia,In cats causing leukaemia,C,False,0.11875845491886139,0.06356681883335114,0.25141164660453796,0.5322384238243103
Most surveillance systems use which of the following study designs?,Cohort,Serial cross-sectional,Mortality,Syndromic,B,False,0.2142810821533203,0.11469639837741852,0.1891023963689804,0.40032973885536194
Polio can be eradicated by which of the following?,Attention to sewage control and hygiene,Killed polio vaccine,Live polio vaccine,Combination of the killed and live vaccines.,A,False,0.10542086511850357,0.11945749074220657,0.36795496940612793,0.3247191309928894
Public health ethics is:,Patient-centered,Population-centered,Subject-centered,Must respect the rights of individuals,B,False,0.17688149213790894,0.04472264274954796,0.12156873941421509,0.6173770427703857
How many people globally are currently infected with hepatitis B?,350 million,2 billion,"100,000",1 million,A,False,0.15270265936851501,0.08173583447933197,0.15270265936851501,0.4703572988510132
"In a study, a group of people are exposed to an environmental toxin but are not treated observed over time on a standard set of measures to ascertain the potential effects of the toxin. This type of study design is called",Clinical trial,Double-blind,Longitudinal,Prospective cohort,D,False,0.22759145498275757,0.09487423300743103,0.2422698438167572,0.21380238234996796
Which disease do polyomaviruses predominantly cause?,Tumours,Brain pathology,No disease at all,Kidney infections,C,False,0.17137236893177032,0.10394258797168732,0.22004646062850952,0.46583834290504456
How are antibody producing cells stimulated?,Interacting with a virus short peptide,Interacting with a T helper cell.,Interacting with a plasma cell,Interacting with a virus infected cell,B,False,0.1791907399892807,0.1231558695435524,0.26072099804878235,0.3793467879295349
The single most important key to the success of the Multicenter AIDS Cohort (MACS) is:,The brilliance of the principal investigator,The commitment of the staff,The commitment of the participants,The quality of the laboratories,C,False,0.22069984674453735,0.11813212931156158,0.28338420391082764,0.3211163878440857
Picornavirus replication as a positive strand RNA virus is particularly typified by which of the following?,Virions carry RNA transcriptase enzyme into the cell,The virion RNA is translated into a single large polyprotein,The virion RNA acting as mRNA,The virus exits by apoptosis of the cell,C,False,0.27940669655799866,0.09071007370948792,0.27940669655799866,0.24657554924488068
Why are members of the astrovirus family only recently recognised as significant enteric viruses for humans?,The genome has been identified by the new method of deep sequencing,A new vector has been discovered,They infect a wide range of domestic animals and so contaminate meat,Knowledge of their replication as positive sense ssRNA viruses is now complete,A,False,0.09389663487672806,0.10639882832765579,0.11326095461845398,0.5751866102218628
Which virus infection was not first identified by clinical observation?,HIV,Rubella teratogenicity,Microcephaly and Zika,Hepatitis C,D,True,0.11183807253837585,0.03630851209163666,0.18438982963562012,0.6435837149620056
The particular quality of the U.S. health care system is its:,"Systematic, democratic approach","Fragmented, uncoordinated approach",The result of rationale decisions by informed legislators,a. and c. above,B,False,0.060270801186561584,0.04996625334024429,0.018381556496024132,0.34683454036712646
The three key intervention strategies according to Professor Shoptaw are:,"Behavioral intervention, treatment and structural interventions","Condoms, drug therapy and regulation of commercial sex establishments","Drug replacement therapy, community intervention and needle exchange","HIV testing, drug therapy and condom use",A,False,0.16941764950752258,0.048538971692323685,0.08518855273723602,0.5913257002830505
Measles has been controlled in many countries by which of the following?,By hygiene,By MMR vaccine,By new molecular peptide vaccines,By humanised monoclonal antibodies to F protein,B,False,0.21084430813789368,0.11285683512687683,0.30677664279937744,0.2707294523715973
How can the spread of filoviruses be restricted?,New antivirals,New humanised monoclonal antibodies,Hygiene and social distancing,New vaccines,C,False,0.3162161707878113,0.07995196431875229,0.1493699550628662,0.4060295820236206
Most pandemics have arisen from influenza viruses from which of the following animals?,Pigs,Wild birds,Bats,Humans,A,False,0.10229114443063736,0.11591105163097382,0.4045693278312683,0.3150789141654968
PreP is an effective strategy for reducing the incidence of HIV in:,Women,Drug users,Pregnant women,a. and b. above,B,False,0.05244996398687363,0.0005142014124430716,0.004583027213811874,0.015996335074305534
The replication of hepatitis B includes which of the following stages?,Movement of intact virus to the cellular cytoplasm for replication,Conversion of relaxed circular viral DNA in to covalently closed circular (CCC) DNA in the nucleus,Virions produced in the cytoplasm by cellular DNA polymerase,Oncogenic activity to transform liver cells.,C,False,0.20205892622470856,0.11512969434261322,0.1388729363679886,0.2939939796924591
How does the papilloma family of viruses cause cancer?,"Replicate in dividing cells and encodes three oncogenic proteins E5, E6 and E7",Integrates viral genome into cellular DNA,Has an oncogene able to initiate cancer,Acts as a co factor for a cellular oncogene,B,False,0.1993449479341507,0.13700765371322632,0.2559639811515808,0.2559639811515808
The noroviruses typically cause which of the following?,Diarrhoea,Rash,Projectile vomiting and diarrhoea,Disease of the central nervous system,C,True,0.2269786149263382,0.1214928925037384,0.2914462983608246,0.2914462983608246
Deep nucleotide sequencing (NGS) is now cheap enough for general application. What will the technique mainly be useful for?,Speedy vaccine development,Identifying genetic variation,Giving details on virus excretion in symptomless carriers,Quickly identifying new viruses,D,True,0.10064759105443954,0.08882118761539459,0.2414410412311554,0.511130690574646
Determinants of acquiring an HIV infection from an infected person per sexual act include:,Viral RNA level,Presence of other infections,Condom use,All of the above,D,True,0.2018873542547226,0.09536483138799667,0.22876834869384766,0.4273955225944519
How is next generation sequencing (NGS) most often used?,To identify a newly discovered virus,To search for drug resistant mutants,To identify quasi species viruses,Cannot be used,D,True,0.07153429836034775,0.043387748301029205,0.19445037841796875,0.5989493727684021
Which of the following HPV viruses are known to cause cervical cancer?,Viruses of all 5 clades,"Types 14, 16, 18, 31, 45",None are oncogenic per se,Types 1-180,C,False,0.19799081981182098,0.09352423995733261,0.19799081981182098,0.4191465675830841
Which member of the paramyxovirus family can cause very serious croup?,Measles,Meta pneumo virus,Hendra,Respiratory syncytial virus (RSV),B,False,0.14315669238567352,0.05606096610426903,0.2674519419670105,0.4996659457683563
Which of the following is the cause of delay in HIV testing among the Latino population?,Stigma attached to the disease,Machismo,Drug abuse,All of the above,D,True,0.26272347569465637,0.06642689555883408,0.20460925996303558,0.4331577718257904
Describe the morphology of a togavirus.,Enveloped spherical particles with an icosahedral structure,Non-enveloped with an icosahedral structure,Filamentous virus with protruding glycoproteins,Small round viruses,A,True,0.31143614649772644,0.08922795206308365,0.24254672229290009,0.24254672229290009
A good surveillance system should provide information about:,Who is being infected,Where the infected individuals are,How rapidly infection is spreading,All of the above,D,True,0.21494753658771515,0.0615834966301918,0.1896905153989792,0.4550439119338989
What has so far prevented polio being eradicated from the world?,Inability to vaccinate in some countries,Poor quality (unsafe) vaccines,Genetic variation,Expense,A,False,0.06010792404413223,0.06010792404413223,0.20979727804660797,0.6462211012840271
The range of disease caused by the family is wide but identify the exception from the following:,Aplastic crisis in anaemia patients,Fifth disease at 'Slapped cheek' syndrome,Foetal infection with teratogenicity,Serious pneumonia,A,False,0.1376226544380188,0.1071806252002716,0.3740971088409424,0.33013954758644104
Which of the following drugs inhibit herpes viruses?,Amantadine,Acyclovir,Oseltamivir,Azidothymidine,D,False,0.3318013846874237,0.09506269544363022,0.2584071755409241,0.2584071755409241
The three countries with the most drug injectors are:,"Bolivia, Argentina, Thailand","China, the U.S. and Russia","Afghanistan, Iraq and Myanmar","Lithuania, Estonia and Latvia",B,False,0.11347619444131851,0.044437918812036514,0.05360235646367073,0.6134465336799622
"Officials at a large community hospital report an increased incidence of acute lymphocytic leukemia (ALL) among children aged 5 – 12. They point out that some households in the community are exposed to chemical waste from a nearby factory. They believe that chemical waste causes leukemia. If a study is designed to evaluate the hospital officials’ claim, which of the following subjects are most likely to comprise the control group?",Children exposed to the chemical waste who do not suffer from ALL,Children not exposed to the chemical waste who do not suffer from ALL,Children from the hospital’s outpatient clinic who do not suffer from ALL,Children not exposed to the chemical waste who suffer from ALL,B,False,0.11003578454256058,0.18141832947731018,0.29910823702812195,0.29910823702812195
Lassa and Ebola are emergent viruses in W. Africa. What is their origin?,Humans,Primates,Fruit bats,Pigs,B,False,0.17808756232261658,0.10801555961370468,0.20179961621761322,0.4840921461582184
Antivirals can be used prophylactically or therapeutically in persons in which of the following circumstances?,If administered within 4 days of clinical signs,If used within 48 hours of first clinical signs,Used for the obese,Used in children under the age of 2 years where high virus spread is noted,C,True,0.1182253435254097,0.25028306245803833,0.3641597032546997,0.1518043428659439
Papillomaviruses cause warts and cancer but how do they most often infect humans?,Are water borne,Are airborne,Via scratches and breaks in the skin,Are nosocomial and spread in hospitals,C,False,0.15788482129573822,0.10851255804300308,0.17890697717666626,0.48631951212882996
There are 57 serotypes of adenovirus currently recognised. Which has the most important clinical impact?,Diarrhoea,Eye infections,Respiratory tract infections,Haemorrhagic cystitis,C,True,0.19881337881088257,0.03245539218187332,0.4769285321235657,0.22528508305549622
How are new polyomaviruses detailed,Shot gun sequencing,Cultivation in human neural cells,Deep pyro sequencing (NGS),Monoclonal antibody techniques,A,False,0.1944425404071808,0.11793537437915802,0.3205815553665161,0.2829122245311737
Describe the YF vaccine.,Killed virus vaccine,Live attenuated virus vaccine developed by Pasteurian passage,Live attenuated vaccine produced by direct mutation of the virus genome,Experimental vaccine only,B,False,0.19668087363243103,0.08198877424001694,0.4163733720779419,0.19668087363243103
What is the biggest risk factor for infection with Ebola?,Working in a category IV laboratory,Attending a funeral of a victim outside,Nursing a patient at home,Attending football matches or large gatherings,A,False,0.1608232855796814,0.1608232855796814,0.26515278220176697,0.3857950270175934
"The influenza virus is mainly controlled in special ""risk"" sectors by:",Hygiene,Vaccination,Antiviral drugs,Humanised monoclonal antibodies,B,False,0.14011310040950775,0.12364936619997025,0.3808668553829193,0.2966194152832031
"A case-control study is conducted to assess the association between alcohol consumption and lung cancer patients with lung cancer and 100 controls are asked about their past alcohol consumption. According to the study results, alcohol consumption is strongly associated with lung cancer (OR = 2.5). The researchers then divide the study subjects into two groups: smokers and non-smokers. Subsequent statistical analysis does not reveal any association between alcohol consumption and lung cancer within either group. The scenario described is an example of which of the following?",Observer bias,Confounding,Placebo effect,Nonresponse bias,B,False,0.15854714810848236,0.09033744782209396,0.27825891971588135,0.31530866026878357
How are arenaviruses spread?,Sexual contact,Blood,Aerosols of urine from infected small mammals,Mosquito bites,A,False,0.06842974573373795,0.0532931424677372,0.11282157897949219,0.735689103603363
Which areas of the world are rabies free?,USA,Norway,EU,"Island nations, UK, NZ and Australia",D,True,0.08257162570953369,0.030376402661204338,0.13613760471343994,0.6101263761520386
The risk of perinatal transmission of HIV-1 infection during breast feeding is increased due to:,Mixed feeding,Very early introduction of solids,Both a and b,None of them,C,False,0.08327507227659225,0.012770647183060646,0.2906585931777954,0.42290574312210083
How is the parvovirus family targeted to reduce disease?,Transfusion blood is screened,Vaccine has been developed,A range of new antivirals,Social distancing,A,False,0.18220242857933044,0.09752591699361801,0.18220242857933044,0.4952774941921234
Who discovered the first virus?,The microscopist Antonie van Leeuwenhoek,The bacteriologist Charles Chamberland,The botanist Dmitri Iwanowsky,The virologist Jonas Salk,C,True,0.1496487408876419,0.045640286058187485,0.21773763000965118,0.16957423090934753
Structural interventions typically target:,Policies,The environment,Availability,All of the above,D,True,0.27708449959754944,0.10193368792533875,0.244526207447052,0.3139778673648834
What is the main clinical picture of hepatitis A?,Rash,Limb paralysis,Jaundice and abdominal discomfort,Upper respiratory tract infection,C,False,0.12122872471809387,0.0505356527864933,0.37341076135635376,0.4231298267841339
If the human norovirus cannot be cultured in cell cultures how can it best be studied?,Animal models,Volunteer studies,In cells using replicon systems,Deductions from the 3 human ORF's of the virus genome,B,False,0.10434579104185104,0.05945443734526634,0.2351468801498413,0.4393121898174286
"Any systematic error in the design, conduct, or analysis of a study that results in a mistaken estimate of an exposure’s effect on the risk of disease is called:",Confounding,Bias,Interaction,Stratification,C,True,0.2493850141763687,0.10395914316177368,0.32021668553352356,0.28259024024009705
Describe the coronavirus structure.,Club shaped glycoprotein spikes protrude through a lipid bilayer,An icosahedral structure with an envelope,An icosahedral large pleomorphic virus,Large regimented barrel shaped virus,C,False,0.1481957882642746,0.12285862118005753,0.20255962014198303,0.4288187026977539
SARS is described as a zoonotic virus - what does this mean?,Such viruses are confined to animals,They do not cause disease in humans,They emerge from animals to cross the species barrier infrequently,They cause pandemics,A,False,0.16384273767471313,0.06829981505870819,0.27013099193573,0.44537070393562317
Which of the following coronaviruses has caused thousands of deaths around the world as an 'emergent' virus?,MERS,SARS,OC43,HKU1,A,False,0.18102271854877472,0.03794442489743233,0.14098064601421356,0.5575892329216003
Clinical infection by an arenavirus is characterised by which one of the following?,Pantropic infection,Signs of malaria,Short (2-3 days) incubation,Hepatitis,A,False,0.15457747876644135,0.06053340435028076,0.4201850891113281,0.3272404670715332
How does rubella cause foetal abnormalities?,By crossing the placenta early in pregnancy and infecting the foetus,By only infecting the placenta,By inducing cytokines and chemokines in the mother,By raising the temperature of the mother and inducing an abnormal immune reaction to the foetus,A,False,0.21821168065071106,0.06251869350671768,0.09096416085958481,0.4339657425880432
Which of the following is an unusual feature of the replication cycle in coronaviruses?,The RNAs all terminate in a common 3´ and produce nested set transcripts,They take advantage of recombination with the long RNA genome,They are not highly mutable,They use capped cellular mRNA's,B,False,0.23902979493141174,0.11290968209505081,0.16428260505199432,0.39409348368644714
Which replication strategy is paralleled by some other viruses?,Cytoplasmic replication and 'snatched caps' are used as primers for RNA transcription,Replicates in cytoplasmic tubules,Extracellular replication,Replicates in the nucleus,C,False,0.10299023240804672,0.07534927129745483,0.26299479603767395,0.49133893847465515
The characteristic of a generalized epidemic is:,High rates in drug users,High rates in MSM,High rates in pregnant women,High rate in STD clinic attendees,C,False,0.17183539271354675,0.10422343015670776,0.22064100205898285,0.4670969843864441
An updated version of classification shows the parvovirus family as having how many genera?,Having 5 genera,A very large number of virus types,Only a single virus,Only three viruses,B,False,0.2251589000225067,0.10635754466056824,0.2891097664833069,0.2891097664833069
The largest Latino community in the U.S. is:,Puerto Rican,Mexican,Cuban,Brazilian,B,False,0.21063512563705444,0.03896357864141464,0.39351820945739746,0.270460844039917
How can epidemics of astrovirus mainly be controlled?,By vaccination,Using passive antibody,Basic knowledge of hand washing and food hygiene,Quarantine,C,False,0.18175098299980164,0.11023753136396408,0.18175098299980164,0.4940503239631653
"500 women aged 40 – 54 who present for routine check-ups are asked about their meat consumption the women turn out to be vegetarian. During the ensuing 5 years, 5 vegetarians and 43 non-vegetarians develop colorectal cancer. Which of the following best describes the study design?",Case series report,Cohort study,Case-control study,Cross-sectional study,A,False,0.26668018102645874,0.18328644335269928,0.3021882474422455,0.1617497205734253
In the absence of treatment the risk of HIV transmission from an infected mother to her fetus/infant was highest in which of the following areas?,Africa,North America,Europe,Japan,A,False,0.1583845019340515,0.05826640501618385,0.4878586232662201,0.20336972177028656
Poliovirus can most easily become more virulent by which of the following processes?,Mutation of the RNA genome at only a few positions,Recombining with another enterovirus,Altering its protein coat,Multiple nucleotide deletions and substitutions,A,False,0.19083461165428162,0.13115859031677246,0.3565259873867035,0.24503649771213531
A virus such as influenza which emerges suddenly and spreads globally is called:,Epidemic,Endemic,Pandemic,Zoonotic,B,False,0.10314370691776276,0.045769739896059036,0.3600068986415863,0.4622580111026764
"Of the following factors, which are the most important factors for virus spread and infection?",Age,Sex,Genetic factors,Travel,D,True,0.04815371707081795,0.04523622989654541,0.27710551023483276,0.5866323709487915
How do viruses of the calcivirus family replicate?,As negative strand RNA viruses,As positive strand RNA viruses,Retroviruses,Using genetic reassortment,B,False,0.11491499096155167,0.06969946622848511,0.3123713433742523,0.4544976055622101
The parvoviruses have a rather unique genome; what form does it take?,Circular ds DNA,Small linear ss DNA,ds DNA genome,RNA genome with RT,D,False,0.12771733105182648,0.07277113944292068,0.4187690317630768,0.25399625301361084
How can the morphology of filoviruses be described?,Very large ball like structure,Long filamentous threads,Icosahedral virion,Floppy membranes without defined morphology,C,False,0.16013166308403015,0.0710579976439476,0.23299020528793335,0.49324026703834534
What is the usual direction of 'knowledge' in a cell?,From protein to DNA,From DNA to DNA,From DNA to RNA to protein,Random,C,False,0.13300010561943054,0.09140954166650772,0.21928009390830994,0.36153173446655273
Why are drug combinations essential for HIV?,Single drugs are not completely inhibitory,Mutations negate the effect of one drug,Combinations of antibiotics are effective versus TB,The virus cannot mutate vs a combination,C,False,0.13062280416488647,0.08977564424276352,0.19005508720874786,0.5166231989860535
"Many virus infections result in immune pathology, this is caused predominantly by which of the following?",A cytokine storm,Antibody mediated reactions,A response of killer T cells (CD-8),A decline in function of the immune system,A,False,0.19455450773239136,0.10413751751184464,0.28307512402534485,0.36347565054893494
David Baltimore is a molecular biologist. What did he discover?,The structure of DNA,X-ray crystallographic techniques,The enzyme reverse transcriptase,The anti HIV drug zidovudine,C,True,0.1873140186071396,0.07808410376310349,0.3499486446380615,0.3499486446380615
Identify the most commonly used diagnostic technique in the virus laboratory:,Virus isolation in cell culture,Deep sequencing (NGS),Reverse transcriptase (RT) PCR,Immuno-serology,B,False,0.46733149886131287,0.10427575558423996,0.2207517772912979,0.1338927149772644
The major risk group for HIV infection among Latinos is:,Heterosexual males,Homosexual males,Females,Injection drug users,B,False,0.1351858377456665,0.05635383725166321,0.1735820472240448,0.6058608889579773
"In HIV-associated tuberculosis cases, treatment with antiretrovirals should begin:",Before antiretroviral drugs are started,After antiretroviral drugs are started,Concurrently with antiretroviral drugs,Doesn’t make any difference,C,True,0.22922559082508087,0.13903234899044037,0.29433149099349976,0.22922559082508087
A “benefit” of research may accrue:,To the participant,To his/her family,To society,All of the above,D,True,0.1726750284433365,0.08156590163707733,0.25124070048332214,0.41422584652900696
What is the current best option for preventing future outbreaks of Ebola?,"Rebuild scientific, medical and nursing infrastructure and train staff",Early and accurate diagnosis with molecular kits,Develop effective vaccines,Arrange rapid intervention into West Africa with EU and USA army teams,D,True,0.2762044370174408,0.08423759788274765,0.14784160256385803,0.4018750786781311
Where are arenaviruses predominately located in the world?,SE Asia,Russia,Africa and S. America,N. America,A,False,0.15655729174613953,0.061308715492486954,0.2924875319004059,0.3755614161491394
