0,1,2,3,4,5,correct,choiceA_probs,choiceB_probs,choiceC_probs,choiceD_probs
The most important element of ethical research on human subjects is:,Beneficence,Justice,A methodologically sound study design,Informed consent,D,True,0.33718377351760864,0.04563286527991295,0.2045123130083084,0.38207927346229553
The characteristic of injecting drug users in Asia is/are:,Strong family support,Low failure rate for rehabilitation centers,Remaining a member of the community,Both a and c,D,True,0.05178068205714226,0.07534044235944748,0.11668956279754639,0.592598557472229
"Viruses have encouraged us to change our world, as we have now:",Eradicated smallpox,Eradicated polio,Increased hygiene,A better understanding of how cellular genes aid virus replication and so become a target for new drugs,A,False,0.10084571689367294,0.0889960378408432,0.16626648604869843,0.5803270936012268
What is the most important factor for virus classification?,The geometry of the virus,How many proteins the virus has,The disease a virus causes,Chemistry of the DNA and RNA,D,False,0.16247795522212982,0.09854786098003387,0.3439658284187317,0.3439658284187317
The major issue for HIV infection among the Latino population is:,Late detection of HIV status,Cultural beliefs,Immigration,All of the above,D,True,0.149306058883667,0.09055870026350021,0.27894043922424316,0.4598950445652008
Disease can most often be prevented by which of the following:,Vaccines,Antivirals,Hygiene,mosquito nets,A,False,0.1457974761724472,0.10020503401756287,0.39631861448287964,0.24037939310073853
Results of surveillance should be distributed to:,Decision makers,The public,The data collectors,All of the above,D,True,0.1513831466436386,0.08102955669164658,0.13359516859054565,0.46629294753074646
Which is a major characteristic of the bunyavirus family?,"Amplify by persistent infection of midgets, mosquitoes, sand flies, ticks",Predominantly mosquito borne,Genetic recombination or reassortment,Spread to humans via bites of mice and rats,A,False,0.25515398383140564,0.09991972893476486,0.25515398383140564,0.32762420177459717
The group that permits analysis of the entire natural history of HIV/AIDS is:,Persistent seronegatives,Long-term survivors,Seroconverters,Long-term survivors with low levels of CD4+ cells,C,False,0.06999316811561584,0.07931263744831085,0.35545459389686584,0.45641276240348816
The chance of acquiring HIV infection from factor VIII in the United States in 2011 is 0% primarily because:,All donors for factor VIII are screened,Factor VIII is subject to detergent “washing” prior to release,Factor VIII is made synthetically,Factor VIII is important from countries with no reported HIV,C,True,0.1428975909948349,0.1428975909948349,0.3427935242652893,0.3025142252445221
The prevalence of HIV among Latino-Americans compared to other ethic groups in the U.S. is:,Highest,Higher than all other ethnic groups except African-Americans,Higher than in all other ethnic groups except African-Americans and,Native Americans,B,False,0.06060488149523735,0.05348362401127815,0.32762694358825684,0.47669434547424316
What is the rubella syndrome?,A description of the 3 day rash of German measles,"The teratogenic lesions of cataracts, deafness, mental retardation and microcephaly in the foetus",Combination of rash and post infection encephalitis,Side effects of the MMR vaccine,B,False,0.06077637895941734,0.03462934121489525,0.32855403423309326,0.4780432879924774
What is the most common way for a virus to kill a cell?,Dissolves the cellular membrane,Induces apoptosis via caspases,Fragments cellular DNA,Totally blocks cellular transcription,B,False,0.30679216980934143,0.08257199823856354,0.16421402990818024,0.30679216980934143
The influenza virus has complicated genetics mainly characterised by which of the following?,Genetic reassortment amongst 8 genes,High levels of recombination,Rapid adsorption and fusion from without via a hydrophobic peptide,High fidelity RNA replicase enzyme,B,False,0.17323744297027588,0.07221610844135284,0.2520590126514435,0.4155750274658203
The highest risk of HIV infection among drug users in the U.S. is in:,The east coast,"The central United States (Kansas, Missouri etc.)",Southern California,"The Pacific Northwest (Washington, Oregon, Idaho)",A,False,0.17673814296722412,0.17673814296722412,0.37415462732315063,0.20027054846286774
"A study is conducted to assess the relationship between race and end-stage renal disease pathologists independently study specimens from 1,000 kidney biopsies. The first group of pathologists is aware of the race of the patient from whom the biopsy came, while the second group is blinded as to the patient’s race. The first group reports ‘hypertensive nephropathy’ much more frequently for black patients than the second group. Which of the following types of bias is most likely present in this study?",Confounding,Nonresponse bias,Recall bias,Referral bias,A,False,0.27202311158180237,0.1456034779548645,0.2118518203496933,0.3082425594329834
What is urban yellow fever (YF)?,Part of a cycle of mosquitoes biting humans in cities,Part of a cycle of mosquitoes biting humans and monkeys in forested areas,A mutant of the YF virus,A YF species that has adapted to new mosquitoes,A,False,0.1113724410533905,0.08148181438446045,0.38872799277305603,0.3430512547492981
The current testing policy of the Centers for Disease Control and the World Health Organization is:,“Opt-in”,“Opt-out”,Mandatory testing of prisoners,Mandatory testing of high-risk groups,B,False,0.1635340452194214,0.1635340452194214,0.1853083372116089,0.4445315897464752
Common cold viruses are ubiquitous and invade by which route?,Faecal oral route,Respiratory and surface route,Cuts in the skin,Sexual transmission,B,False,0.15550653636455536,0.10687798261642456,0.1996743381023407,0.47899386286735535
Assembly is a vital late replication stage for a virus and is often accomplished by which of the following?,Use of cellular scaffolding in the nucleus and cytoplasm,Snatching cellular lipids and membranes,Master plan embedded in the viral genome,Random interactions between cellular and virus proteins,A,False,0.21050120890140533,0.10584664344787598,0.3470578193664551,0.23852911591529846
The biggest single determinant of HIV transmission to the infant is:,Mother’age,Mother’s viral load,Mother’s immune status,Father’s viral load,B,False,0.14988893270492554,0.10301706194877625,0.359564870595932,0.359564870595932
What does the reproductive number of a virus tell us?,How virulent the infection will be,How many people will die,How many contacts will be infected from one case,How long the 'incubation period' will be,C,False,0.10211788862943649,0.08465869724750519,0.23012621700763702,0.4299323558807373
PreP is most effective for which group:,Men with frequent unprotected sex,Men with infrequent unprotected sex,Women with frequent unprotected sex,Women with infrequent unprotected sex,A,False,0.18868575990200043,0.16651460528373718,0.3110902011394501,0.2745361626148224
A special feature of adaptive immunity is:,Speed of response to a foreign protein,Ability to distinguish self and non self,Ability to distinguish viruses and bacteria,Short memory,B,False,0.14778901636600494,0.1674668788909912,0.4017321765422821,0.24366287887096405
As regards the range of diseases caused by viruses:,Each member of the 'family' causes the same disease.,Members of many families can cause the same sort of disease.,Most virus disease are now controlled by vaccines.,Most viruses can cross placenta and be teratogenic.,B,False,0.1600460410118103,0.14124014973640442,0.2328656166791916,0.383930504322052
Which is the exception in the following range of disease symptoms caused by bunyaviruses?,Pneumonias,Haemorrhagic fever,Hepatitis,Impaired renal function,D,False,0.12754569947719574,0.05316895619034767,0.39286839962005615,0.39286839962005615
There is no vaccine against HIV because of which of the following?,The virus is so antigenically variable,Such a vaccine would be too expensive,The virus can be controlled by a change in sexual habits,Latency can abrogate any vaccine effect,B,False,0.11755899339914322,0.09155502915382385,0.21962910890579224,0.5268628597259521
The requirements for an effective surveillance system include:,A diagnostic algorithm,Staff members,A sampling frame,All of the above,D,True,0.20542892813682556,0.0666930079460144,0.1812903732061386,0.43489301204681396
MERS has four special characteristics and here we have one exception - which is it?,Spread by faecal oral route,Aerosol droplet transmission,Reservoir in bats,A conduit to humans via camels,C,False,0.15390929579734802,0.15390929579734802,0.23837938904762268,0.27011924982070923
The major beneficiary of Medicaid in the U.S. is:,Single men,The elderly,Women and children,Undocumented residents,C,False,0.07585300505161285,0.03365956246852875,0.3399495780467987,0.49462369084358215
Which of the following is the most important for controlling disease caused by norovirus?,A norovirus vaccine,Attention to handwashing and hygiene,Quarantine,New antiviral drugs,B,False,0.20246177911758423,0.15767739713191986,0.33380305767059326,0.25996607542037964
Why do vigorous CD8 cell responses in chronically infected HIV-positive individuals fail to eliminate the virus?,CTL exhaustion,Epitope escape,Suboptimal CTL,Absence of dendritic cells,B,False,0.13652029633522034,0.09382893890142441,0.32749518752098083,0.4205121397972107
The most widespread and important retrovirus is HIV-1; which of the following is true?,Infecting only gay people,Infecting only males,Infecting every country in the world,Infecting only females,A,False,0.11997293680906296,0.09343501180410385,0.3261202275753021,0.418746680021286
The first acquired immune cell to respond defensively to HIV infection is:,CD4+,CD8+,CD57,NK cells,B,False,0.12845413386821747,0.10004017502069473,0.18689967691898346,0.5080459713935852
Which of the following is a special feature of the rabies vaccine?,The vaccine has not changed since the time of L. Pasteur,The original air dried spinal cord of infected rabbits was a killed vaccine,The vaccine still needs 16 doses given into the peritoneal cavity,The modern rabies vaccine is grown in human diploid cells from an aborted embryo,B,False,0.15190936625003815,0.11113926768302917,0.2838040590286255,0.3644116520881653
Most viral vaccines are produced by which of the following techniques?,Traditional cell culture,Molecular biology,Animal tissues in vitro,VLPs (virus like particles),B,False,0.1626339703798294,0.1626339703798294,0.2681380808353424,0.34429609775543213
The treatment of hepatitis C has been revolutionised most recently by which of the following?,The use of interferon,A new vaccine,Monoclonal antibodies,Direct-acting Antivirals such as daclatasvir and sofosbuvir,A,False,0.23450540006160736,0.1255216896533966,0.3011108934879303,0.23450540006160736
Chikungunya has spread widely from Asia and Africa into the Caribbean in recent years. This has been mainly facilitated by:,Mutation in the virus allowing replication in the mosquito Aedes albopictus,Air Travel,Climate change,Poor mosquito control and the absence of DTT,A,False,0.09205900132656097,0.12582972645759583,0.3018498420715332,0.3875828683376312
The successful anti-cancer HPV vaccine consists of:,Live virus attenuated by specific mutagenesis,Whole virus chemically inactivated vaccine,Self-assemble of virus L1 protein into VLP,Sub unit chemically inactivated vaccine,A,False,0.1410062462091446,0.1410062462091446,0.2634343206882477,0.3832946717739105
The rotavirus is an important cause of which of the following?,Respiratory infection in adults,Gastroenteritis in children,Diarrhoea and vomiting in adults,Cancer,B,False,0.24435393512248993,0.1482081562280655,0.31375664472579956,0.24435393512248993
The surveillance testing strategy associated with the least selection bias is:,Compulsory,Unlinked anonymous,Voluntary anonymous,Voluntary confidential,A,False,0.103389210999012,0.103389210999012,0.31846120953559875,0.4089122712612152
"In a medical class of 147 students, the distribution of scores on a biochemistry final examination has a mean equal to 67, a median equal to 76, a mode equal to 80, a standard deviation equal to 5.5, and a variance equal to 30.25. Three students were unable to take the test on the scheduled date and were given a different form of the exam 1 week later. Which parameter is most likely to be the least biased estimator of central tendency for this distribution of biochemistry test scores?",Mean,Median,Mode,Standard deviation,A,False,0.24435564875602722,0.058039549738168716,0.2947491705417633,0.12286972999572754
What disease do herpes viruses not cause?,Infantile paralysis,Encephalitis,Sexually transmitted disease,Cancer,A,False,0.08242296427488327,0.05321626737713814,0.2876844108104706,0.5374652147293091
The purpose of a double-blind or double-masked study is to:,Achieve comparability of treated and untreated subjects,Reduce the effects of sampling variation,Avoid observer and subject bias,Avoid observer bias and sampling variation,B,False,0.1396956890821457,0.12328099459409714,0.379732221364975,0.29573574662208557
Nipah is a zoonotic paramyxovirus; where did it originate?,Originating in pigs,Originating in bats,Coming from humans,Coming from horses,C,False,0.17349019646644592,0.09286260604858398,0.28603696823120117,0.36727872490882874
What is the genome structure of the polyomavirus family?,Circular ds DNA with T antigen coding regions,Circular ssDNA,RNA genome with RT,Segmented RNA genome,C,False,0.1706400066614151,0.06277495622634888,0.24827976524829865,0.4093441069126129
Interferons are very special defence mechanisms which operate by:,Binding to viruses,Binding to neighbouring cells,Producing a long lasting state of resistance,Inhibiting virus induced enzymes,B,False,0.21393157541751862,0.12975606322288513,0.2746935784816742,0.3112685978412628
Genetic characteristics of the bunyavirus family include which one of the following?,Three segmented negative stranded RNA viruses with anti-sense expression,Highly mutable RNA viruses,Emerging viruses via arthropod vector,Use an RT enzyme,A,False,0.31909680366516113,0.052091121673583984,0.36158403754234314,0.17080020904541016
"The basic code of ethical research (respect for persons, beneficence, and justice) was first established by the:",Nuremberg Code,Declaration of Helsinki,CIOMS,Belmont Report,D,True,0.08381316065788269,0.08381316065788269,0.1470966786146164,0.4823114573955536
The paramyxovirus family employ what strategy at virus entry?,Initiate a fusion 'from without' using virus F protein,Has fusion from within a cytoplasmic vacuole at low pH,Viruses can puncture plasma membranes at entry,A fusion mediated by M protein,D,True,0.20146405696868896,0.08939913660287857,0.2282886803150177,0.3763844072818756
The risk of acquiring HIV from a unit of blood in the United States is now:,"1/10,000 units","1/200,000 units","1/500,000 unit",1 per 2 million units,D,False,0.15694019198417664,0.13849923014640808,0.29320287704467773,0.29320287704467773
What is the essential pathology of astroviruses?,Very restricted replication in the gut,Can cause infection of the central nervous system,Sequence diversity allows widespread replication,Can cause infection in the upper respiratory tract,A,False,0.16857469081878662,0.13128608465194702,0.19102013111114502,0.45823347568511963
Which of the following are goals of vaccination?,Prevent infection,Prevent disease,Prevent transmission,All of the above,D,False,0.28328967094421387,0.08116384595632553,0.28328967094421387,0.28328967094421387
Randomization of study subjects in a clinical trial is most helpful for controlling for which of the following?,Placebo effect,Recall bias,Non-compliance,Effect modification (interaction),A,False,0.1155654788017273,0.07461468130350113,0.355966717004776,0.355966717004776
A quasi species virus such as influenza and HIV has which of the following characteristics?,A fragmented or segmented genome,Co-existence of innumerable genetic variants,Possesses RNA and DNA,A very large genome,B,False,0.1311594545841217,0.07955222576856613,0.31463515758514404,0.40399956703186035
Positive stranded RNA viruses have which of the following characteristics?,Their genome RNA can be translated directly as mRNA,They have to transcribe their genome RNA to a mirror image copy as a mRNA,This genome is circular,Their RNA genome is segmented,A,False,0.172486811876297,0.06345434486865997,0.2843826413154602,0.36515456438064575
What is the genetic structure of rotavirus?,Circular DNA containing virus,RNA virus with RT,ds RNA virus,ds RNA virus in segments,B,False,0.14665240049362183,0.10079260915517807,0.39864251017570496,0.2739827334880829
Are/were viruses:,The most abundant form of life on earth?,Discovered before bacteria?,Grown in animals in the laboratory?,The cause of all human disease?,A,False,0.10992753505706787,0.07097455114126205,0.10992753505706787,0.4926609992980957
It is unlikely that a 'cure' of HIV is possible with current drugs because:,Even in combination current drugs do not completely block viral replication,They do not penetrate to cells,They cannot block viral transcription from integrated viral DNA,They cannot penetrate to the CNS,B,False,0.06732790172100067,0.08121296018362045,0.20738455653190613,0.5637296438217163
Which viruses appear to be hypermutable?,DNA viruses,'Emerging' viruses,Influenza and HIV,RNA viruses,D,True,0.1790173202753067,0.031108547002077103,0.2028532177209854,0.5514121651649475
How are herpes infections controlled?,Chemotherapy,Vaccines,Hygiene and social distancing,No method,A,False,0.21395473182201385,0.10106505453586578,0.18881437182426453,0.4529421329498291
"A new drug with in vitro activity against HIV is tested on a population of patients with Western-blot confirmed HIV infections. Out of the 200 individuals in the patient population, 100 are chosen by lottery to receive the drug. The drug, which is tasteless, is administered in a cup of orange juice; the other patients receive pure orange juice. Neither the nurses, doctors, nor the patients know which patients receive the drug. At the end of the study period, the number of CD4+ T cells is determined for all of the subjects. This is an example of a",Case-control study,Case report,Cohort study,Cross-sectional study,A,True,0.3966692090034485,0.06083119660615921,0.12097726762294769,0.10676206648349762
What is the most successful and most widely used 'travel' vaccine for international visitors?,Influenza,MMR,Yellow Fever,Rabies,B,False,0.12725023925304413,0.04397650435566902,0.3459019958972931,0.4441469609737396
What is a virus pandemic?,A sharp and rapid epidemic involving more than one country,An outbreak which recurs again and again,A rapid global outbreak starting from a single focus,A characteristic of common cold virus and HIV,C,True,0.193032369017601,0.09706276655197144,0.31825658679008484,0.31825658679008484
Benefits of opioid replacement therapy as an approach for HIV prevention include:,Reducing craving for and use of illicit opioids,More sharing of injecting paraphernalia,Reducing frequency of injection drug use,Both a and c,D,True,0.045629192143678665,0.021553704515099525,0.07522981613874435,0.6705160737037659
Papilloma viruses are characterised by what genetic feature?,A genome of ds circular DNA encoding around 8 ORF,A virus with RT able to integrate and cause cancer,A variable ds RNA virus,A large DNA containing virus,A,False,0.21680006384849548,0.10240910202264786,0.3574428856372833,0.21680006384849548
"As part of the Women’s Health Study, researchers investigated the role of systemic inflammation in predicting cardiovascular disease in women (N Engl J Med. 2002;347[20]:1557-1565). Researchers used a prospective study design with a large sample size. Blood levels of C-reactive protein (CRP) were measured at baseline and women were followed for an average of 8 years. The following table shows the relative risk estimates of cardiovascular event (heart attack or stroke) within 5 years by quintile of CRP level for the 30,000 women. The first quintile is used as the reference category.  1 0.49 mg/dL Relative Risk Number of women  1.0 6000  2 >0.49-1.08 mg/dL 1.8 6000  Quintile of CRP Level 3 >1.08-2.09 mg/dL 2.3 6000  4 >2.09-4.19 mg/dL 3.2 6000  5 >4.19 mg/dL 4.5 6000  Based on the relative risk data above, one can conclude:",There is no risk of heart attack/stroke for women with CRP levels in the first quintile.,Decreasing CRP level appears to increase the risk of heart attack/stroke.,Increasing CRP level appears to increase the risk of heart attack/stroke.,There appears to be no association between CRP levels and heart attack/stroke.,A,False,0.13109150528907776,0.11568783223628998,0.1791808307170868,0.27752068638801575
What is the morphology of the Dane particle?,Double shelled icosahedron,Lipid membrane free icosahedron,Flexuous and filamentous morphology,Numerous small particles,C,True,0.2238345593214035,0.08234413713216782,0.3690407872200012,0.25363779067993164
The adenovirus virion has which unique structural feature?,Icosahedron,Icosahedron with slender fibres,'Complex' structure not yet fully explored,Flexuous lipid containing structure,B,False,0.20963606238365173,0.11221010237932205,0.20963606238365173,0.3916517198085785
"A city has a population of 250,000 cases and 400 deaths each year from this disease. There are 2,500 deaths per year from all causes. The prevalence of this disease is given by","400/250,000","600/250,000","1,000/250,000","2,500/250,000",D,False,0.24405406415462494,0.07923275232315063,0.24405406415462494,0.19006949663162231
Which unique form does the rabies virus take?,The virion has a dumbbell appearance,It is shaped like a bullet from a gun,The virus is star shaped,The virion is very pleomorphic,D,True,0.253323495388031,0.049882352352142334,0.19728854298591614,0.3685835003852844
Which of the following diseases is not caused by togaviruses?,Chikungunya,Rubella (German measles),Western Equine encephalitis,Yellow Fever,D,True,0.16311922669410706,0.0600082166492939,0.3453234136104584,0.3913027048110962
Why are the viruses of this family called astroviruses?,Because of the nucleotide sequence of their genomes,The superficial appearance of a 'star' on negative straining electron microscopy,"Because of isolation in very large numbers of mammals including dromedaries, cats and cattle",Because they are more common in developing countries with poor hygiene,B,False,0.13490819931030273,0.08710327744483948,0.14360903203487396,0.5012447834014893
Why do emerging viruses like Zika and Ebola continue to plague us?,These viruses mutate and hence emerge,We disturb forests where they quietly exist as a zoonosis,Mosquitoes are the main culprit to encourage virus spread,The viruses can be halted by new vaccines,B,False,0.11210748553276062,0.03639597073197365,0.06799662113189697,0.7310326099395752
