0,1,2,3,4,5,correct,choiceA_probs,choiceB_probs,choiceC_probs,choiceD_probs
Which one of the following is the most appropriate definition of a 99% confidence interval?,"99% of the time in repeated samples, the interval would contain the true value of the parameter","99% of the time in repeated samples, the interval would contain the estimated value of the parameter","99% of the time in repeated samples, the null hypothesis will be rejected","99% of the time in repeated samples, the null hypothesis will not be rejected when it was false",A,False,0.15105114877223969,0.11763875186443329,0.5974189043045044,0.13330218195915222
What is the main difference between the Dickey Fuller (DF) and Phillips-Perron (PP) approaches to unit root testing?,ADF is a single equation approach to unit root testing while PP is a systems approach,PP tests reverse the DF null and alternative hypotheses so that there is stationarity under the null hypothesis of the PP test,The PP test incorporates an automatic correction for autocorrelated residuals in the test regression,PP tests have good power in small samples whereas DF tests do not.,C,True,0.1011124923825264,0.2748522460460663,0.3114483952522278,0.3114483952522278
"If there were a leverage effect in practice, what would be the shape of the news impact curve for as model that accounted for that leverage?",It would rise more quickly for negative disturbances than for positive ones of the same magnitude,It would be symmetrical about zero,It would rise less quickly for negative disturbances than for positive ones of the same magnitude,It would be zero for all positive disturbances,A,False,0.18735995888710022,0.05367952957749367,0.449453204870224,0.30890437960624695
Which of the following statements is false concerning the linear probability model?,There is nothing in the model to ensure that the estimated probabilities lie between zero and one,"Even if the probabilities are truncated at zero and one, there will probably be many observations for which the probability is either exactly zero or exactly one",The error terms will be heteroscedastic and not normally distributed,The model is much harder to estimate than a standard regression model with a continuous dependent variable,D,False,0.052145373076200485,0.06695598363876343,0.4947415292263031,0.38530510663986206
Which of the following statements concerning the regression population and sample is FALSE?,The population is the total collection of all items of interest,The population can be infinite,"In theory, the sample could be larger than the population",A random sample is one where each individual item from the population is equally likely to be drawn.,C,True,0.04673834890127182,0.03639986366033554,0.5693897008895874,0.34535229206085205
Which of the following statements is INCORRECT concerning a comparison of the Box-Pierce Q and the Ljung-Box Q* statistics for linear dependence in time series?,"Asymptotically, the values of the two test statistics will be equal",The Q test has better small-sample properties than the Q*,The Q test is sometimes over-sized for small samples,"As the sample size tends towards infinity, both tests will show a tendency to always reject the null hypothesis of zero autocorrelation coefficients.",B,False,0.053138505667448044,0.06823118776082993,0.7335544228553772,0.14444541931152344
A parsimonious model is one that,Includes too many variables,Includes as few variables as possible to explain the data,Is a well-specified model,Is a mis-specified model,A,False,0.08002985268831253,0.08002985268831253,0.6700817346572876,0.1694231927394867
Which of the following is NOT a feature of continuously compounded returns (i.e. log-returns)?,They can be interpreted as continuously compounded changes in the prices,They can be added over time to give returns for longer time periods,They can be added across a portfolio of assets to give portfolio returns,They are usually fat-tailed,C,True,0.15219654142856598,0.04941098392009735,0.6019490361213684,0.19542422890663147
"Which of the following features of financial asset return time-series could be captured using a standard GARCH(1,1) model?

i) Fat tails in the return distribution


ii) Leverage effects


iii) Volatility clustering


iv) Volatility affecting returns",(ii) and (iv) only,(i) and (iii) only,"(i), (ii), and (iii) only","(i), (ii), (iii), and (iv)",B,False,0.01807720772922039,0.023211592808365822,0.7686623930931091,0.1335734874010086
"Consider the estimation of a GARCH-M model. If the data employed were a time-series of daily corporate bond percentage returns, which of the following would you expect the value of the GARCH-in-mean parameter estimate to be?",Less than -1,Between -1 and 0,Between 0 and 1,Bigger than 1,C,True,0.12294425070285797,0.12294425070285797,0.5509979128837585,0.20270082354545593
"Under which of the following situations would bootstrapping be preferred to pure simulation?

i) If it is desired that the distributional properties of the data in the experiment

are the same as those of some actual data


ii) If it is desired that the distributional properties of the data in the experiment

are known exactly


iii) If the distributional properties of the actual data are unknown


iv) If the sample of actual data available is very small",(ii) and (iv) only,(i) and (iii) only,"(i), (ii), and (iv) only","(i), (ii), (iii), and (iv)",B,False,0.005662822630256414,0.015393148176372051,0.9523403644561768,0.02239689789712429
"Which of the following may be consequences of one or more of the CLRM assumptions being violated?

i) The coefficient estimates are not optimal


ii) The standard error estimates are not optimal


iii) The distributions assumed for the test statistics are inappropriate


iv) Conclusions regarding the strength of relationships between the dependent

and independent variables may be invalid.",(ii) and (iv) only,(i) and (iii) only,"(i), (ii), and (iii) only","(i), (ii), (iii), and (iv)",D,False,0.01613546535372734,0.018283875659108162,0.8809664845466614,0.08194264769554138
Which of the following statements is true concerning forecasting in econometrics?,Forecasts can only be made for time-series data,Mis-specified models are certain to produce inaccurate forecasts,Structural forecasts are simpler to produce than those from time series models,In-sample forecasting ability is a poor test of model adequacy,D,False,0.0764172375202179,0.03609694540500641,0.725026547908783,0.16177529096603394
The pacf is necessary for distinguishing between,An AR and an MA model,An AR and an ARMA model,An MA and an ARMA model,Different models from within the ARMA family,B,False,0.11340086907148361,0.06878110021352768,0.7394664883613586,0.07793919742107391
Negative residual autocorrelation is indicated by which one of the following?,A cyclical pattern in the residuals,An alternating pattern in the residuals,A complete randomness in the residuals,Residuals that are all close to zero,B,False,0.3442171812057495,0.12663044035434723,0.3442171812057495,0.18424619734287262
"Which of the following statements are true concerning a comparison between ARCH(q) and GARCH(1,1) models?

i) The ARCH(q) model is likely to be the more parsimonious


ii) The ARCH(q) model is the more likely to violate non-negativity constraints


iii) The ARCH(q) model can allow for an infinite number of previous lags of squared

returns to affect the current conditional variance


iv) The GARCH(1,1) model will usually be sufficient to capture all of the dependence

in the conditional variance",(ii) and (iv) only,(i) and (iii) only,"(i), (ii), and (iii) only","(i), (ii), (iii), and (iv)",A,False,0.0163263026624918,0.01850012317299843,0.8913859128952026,0.06457178294658661
"Which of the following statements are true concerning a triangular or recursive system?

i) The parameters can be validly estimated using separate applications of OLS to

each equation


ii) The independent variables may be correlated with the error terms in other

equations


iii) An application of 2SLS would lead to unbiased but inefficient parameter estimates


iv) The independent variables may be correlated with the error terms in the equations

in which they appear as independent variables",(ii) and (iv) only,(i) and (iii) only,"(i), (ii), and (iii) only","(i), (ii), (iii), and (iv)",C,True,0.016909951344132423,0.021712807938456535,0.9232520461082458,0.035798367112874985
Which one of the following statements best describes the algebraic representation of the fitted regression line?,\hat{y}_t = \hat{\alpha} + \hat{\beta}x_t + \hat{u}_t,\hat{y}_t = \hat{\alpha} + \hat{\beta}x_t,\hat{y}_t = \hat{\alpha} + \hat{\beta}x_t + u_t,y_t = \hat{\alpha} + \hat{\beta}x_t + \hat{u}_t,B,False,0.11775548756122589,0.10391884297132492,0.5277434587478638,0.24928836524486542
What are the dimensions of $\hat{u}^t \hat{u}?,T x k,T x 1,k x 1,1 x 1,D,False,0.4411703944206238,0.16229753196239471,0.3435838520526886,0.052690289914608
"The characteristic roots of the MA process

$y_t = -3u_{t-1} + u_{t-2} + u_t$

are",1 and 2,1 and 0.5,2 and -0.5,1 and -3,B,False,0.15565985441207886,0.13736934959888458,0.47946614027023315,0.2264837771654129
"Which of the following is an equivalent expression for saying that the explanatory variable is ""non-stochastic""?",The explanatory variable is partly random,The explanatory variable is fixed in repeated samples,The explanatory variable is correlated with the errors,The explanatory variable always has a value of one,B,False,0.17742300033569336,0.1076124757528305,0.6192671060562134,0.09496768563985825
Suppose that the Durbin Watson test is applied to a regression containing two explanatory variables plus a constant with 50 data points. The test statistic takes a value of 1.53. What is the appropriate conclusion?,Residuals appear to be positively autocorrelated,Residuals appear to be negatively autocorrelated,Residuals appear not to be autocorrelated,The test result is inconclusive,D,False,0.10631793737411499,0.19862806797027588,0.6118175387382507,0.0828005000948906
"If OLS is used in the presence of autocorrelation, which of the following will be likely consequences?

i) Coefficient estimates may be misleading


ii) Hypothesis tests could reach the wrong conclusions


iii) Forecasts made from the model could be biased


iv) Standard errors may inappropriate",(ii) and (iv) only,(i) and (iii) only,"(i), (ii), and (iii) only","(i), (ii), (iii), and (iv)",A,False,0.011348639614880085,0.010015140287578106,0.9015340805053711,0.06530691683292389
What will be the properties of the OLS estimator in the presence of multicollinearity?,"It will be consistent, unbiased and efficient",It will be consistent and unbiased but not efficient,It will be consistent but not unbiased,It will not be consistent,A,False,0.1701934039592743,0.048761218786239624,0.46263357996940613,0.3179630935192108
Which one of the following would NOT be a consequence of using non-stationary data in levels form?,The regression $R^2$ may be spuriously high,Test statistics may not follow standard distributions,Statistical inferences may be invalid,Parameter estimates may be biased,D,False,0.08600352704524994,0.05216377228498459,0.5608134269714355,0.3001818060874939
"If a series, y, follows a random walk, what is the optimal one-step ahead forecast of y?",The current value of y,Zero,One,The average value of y over the in-sample period,A,False,0.04254180192947388,0.054624754935503006,0.8544749617576599,0.048206180334091187
The order condition is,A necessary and sufficient condition for identification,A necessary but not sufficient condition for identification,A sufficient but not necessary condition for identification,A condition that is nether necessary nor sufficient for identification,B,False,0.08532452583312988,0.08532452583312988,0.49100878834724426,0.3374650776386261
"If an estimator is said to have minimum variance, which of the following statements is NOT implied?",The probability that the estimate is a long way away from its true value is minimised,The estimator is efficient,"Such an estimator would be termed ""best""",Such an estimator will always be unbiased,D,False,0.12049529701471329,0.08281512558460236,0.5400224328041077,0.25508853793144226
"Which of the following are disadvantages of the Dickey-Fuller / Engle-Granger approach to testing for cointegration and modelling cointegrating relationships?

i) Only one cointegrating relationship can be estimated

ii) Particularly for small samples. There is a high chance of the tests suggestingthat variables are not cointegrated when they are

iii) It is not possible to make inferences on the cointegrating regression

iv) The procedure forces the researcher to specify which is the dependent variable and which are the independent variables.",(ii) and (iv) only,(i) and (iii) only,"(i), (ii), and (iii) only","(i), (ii), (iii), and (iv)",D,False,0.022023402154445648,0.022023402154445648,0.8264220952987671,0.12673594057559967
Which of the following statements is true concerning the population regression function (PRF) and sample regression function (SRF)?,The PRF is the estimated model,The PRF is used to infer likely values of the SRF,Whether the model is good can be determined by comparing the SRF and the PRF,The PRF is a description of the process thought to be generating the data.,D,False,0.09225688129663467,0.0299514252692461,0.6816912889480591,0.19530783593654633
"Which one of the following is a disadvantage of the general to specific or ""LSE"" (""Hendry"") approach to building econometric models, relative to the specific to general approach?",Some variables may be excluded at the first stage leading to coefficient biases,The final model may lack theoretical interpretation,The final model may be statistically inadequate,"If the initial model is mis-specified, all subsequent steps will be invalid.",B,False,0.04178476333618164,0.0884583443403244,0.7406526207923889,0.12870611250400543
"Which of the following statements are true concerning maximum likelihood (ML) estimation in the context of GARCH models?

i) Maximum likelihood estimation selects the parameter values that maximise the

probability that we would have actually observed the values of the series y that we

actually did.


ii) GARCH models can only be estimated by ML and not by OLS


iii) For estimation of a standard linear model (with no GARCH), the OLS and ML

estimates for the slope and intercept parameters will be identical but the estimator

for the variance of the disturbances is slightly different


iv) Most computer packages use numerical procedures to estimate GARCH models

rather than a set of analytical formulae",(ii) and (iv) only,(i) and (iii) only,"(i), (ii), and (iii) only","(i), (ii), (iii), and (iv)",D,False,0.01677033305168152,0.01900327578186989,0.9156291484832764,0.045586489140987396
Including relevant lagged values of the dependent variable on the right hand side of a regression equation could lead to which one of the following?,Biased but consistent coefficient estimates,Biased and inconsistent coefficient estimates,Unbiased but inconsistent coefficient estimates,Unbiased and consistent but inefficient coefficient estimates.,A,False,0.04516996443271637,0.04516996443271637,0.7065771222114563,0.20243774354457855
Which one of the following factors is likely to lead to a relatively high degree of out-of-sample forecast accuracy?,A model that is based on financial theory,A model that contains many variables,A model whose dependent variable has recently exhibited a structural change,A model that is entirely statistical in nature with no room for judgmental modification of forecasts,A,False,0.14338372647762299,0.0869666188955307,0.6426012516021729,0.12653568387031555
"Which of the following are plausible approaches to dealing with residual autocorrelation?

i) Take logarithms of each of the variables

ii) Add lagged values of the variables to the regression equation

iii) Use dummy variables to remove outlying observations

iv) Try a model in first differenced form rather than in levels.",(ii) and (iv) only,(i) and (iii) only,"(i), (ii), and (iii) only","(i), (ii), (iii), and (iv)",A,False,0.01776081509888172,0.02012564055621624,0.8557640314102173,0.09019686281681061
For an autoregressive process to be considered stationary,The roots of the characteristic equation must all lie inside the unit circle,The roots of the characteristic equation must all lie on the unit circle,The roots of the characteristic equation must all lie outside the unit circle,The roots of the characteristic equation must all be less than one in absolute value,C,True,0.29515790939331055,0.1085825264453888,0.4866331219673157,0.1085825264453888
"Which of the following statements are true concerning information criteria?

(i) Adjusted R-squared is an information criterion

(ii) If the residual sum of squares falls when an additional term is added, the value of the information criterion will fall

(iii) Akaike's information criterion always leads to model orders that are at least as large as those of Schwarz's information criterion

(iv) Akaike's information criterion is consistent",(ii) and (iv) only,(i) and (iii) only,"(i), (ii), and (iii) only","(i), (ii), (iii), and (iv)",B,False,0.00901462510228157,0.024504289031028748,0.9195166826248169,0.045780036598443985
"The ""within transform"" involves",Taking the average values of the variables,Subtracting the mean of each entity away from each observation on that entity,Estimating a panel data model using least squares dummy variables,Using both time dummies and cross-sectional dummies in a fixed effects panel model,B,False,0.033763110637664795,0.014074558392167091,0.8707621097564697,0.08099348843097687
"The purpose of ""augmenting"" the Dickey-Fuller test regression is to",Ensure that there is no heteroscedasticity in the test regression residuals.,Ensure that the test regression residuals are normally distributed,Ensure that there is no autocorrelation in the test regression residuals,Ensure that all of the non-stationarity is taken into account.,C,True,0.16336826980113983,0.07716970890760422,0.646134078502655,0.11228125542402267
"If a series, y, follows a random walk with drift b, what is the optimal one-step ahead forecast of the change in y?",The current value of y,Zero,One,The average value of the change in y over the in-sample period,D,False,0.03785927593708038,0.06241939589381218,0.8616731762886047,0.03785927593708038
"Which of the following are plausible approaches to dealing with a model that exhibits heteroscedasticity?

i) Take logarithms of each of the variables

ii) Use suitably modified standard errors

iii) Use a generalised least squares procedure

iv) Add lagged values of the variables to the regression equation.",(ii) and (iv) only,(i) and (iii) only,"(i), (ii), and (iii) only","(i), (ii), (iii), and (iv)",C,True,0.012245492078363895,0.017817087471485138,0.8584753274917603,0.10253025591373444
"Which of the following statements are true concerning the standardised residuals (residuals divided by their respective conditional standard deviations) from an estimated GARCH model?

i) They are assumed to be normally distributed


ii) Their squares will be related to their lagged squared values if the GARCH model is

appropriate


iii) In practice, they are likely to have fat tails


iv) If the GARCH model is adequate, the standardised residuals and the raw residuals

will be identical",(ii) and (iv) only,(i) and (iii) only,"(i), (ii), and (iii) only","(i), (ii), (iii), and (iv)",B,False,0.01882088929414749,0.016609378159046173,0.9068412184715271,0.05116048455238342
Which one of the following statements is true concerning VARs?,The coefficient estimates have intuitive theoretical interpretations,The coefficient estimates usually have the same sign for all of the lags of a given variable in a given equation,VARs often produce better forecasts than simultaneous equation structural models,All of the components of a VAR must be stationary before it can be used for forecasting,C,True,0.09593834728002548,0.07471685856580734,0.6255965828895569,0.2031014859676361
Which of the following statements is INCORRECT concerning the classical hypothesis testing framework?,"If the null hypothesis is rejected, the alternative is accepted",The null hypothesis is the statement being tested while the alternative encompasses the remaining outcomes of interest,The test of significance and confidence interval approaches will always give the same conclusions,Hypothesis tests are used to make inferences about the population parameters.,A,False,0.04730004444718361,0.05359797552227974,0.44877034425735474,0.44877034425735474
"An ARMA(p,q) (p, q are integers bigger than zero) model will have",An acf and pacf that both decline geometrically,An acf that declines geometrically and a pacf that is zero after p lags,An acf that declines geometrically and a pacf that is zero after q lags,An acf that is zero after p lags and a pacf that is zero after q lags,A,False,0.09416943788528442,0.07333923876285553,0.541907787322998,0.2900623381137848
"Suppose that the following regression is estimated using 27 quarterly observations:

$y_t = \beta_1 + \beta_2 x_2 + \beta_3 x_{3t} + u_t$

What is the appropriate critical value for a 2-sided 5% size of test of $H_0: \beta_3 = 1$?",1.64,1.71,2.06,1.96,C,True,0.1348259150981903,0.1348259150981903,0.5332468152046204,0.19617055356502533
"Suppose that two researchers, using the same 3 variables and the same 250 observations on each variable, estimate a VAR. One estimates a VAR(6), while the other estimates a VAR(4). The determinants of the variance-covariance matrices of the residuals for each VAR are 0.0036 and 0.0049 respectively. What is the values of the test statistic for performing a test of whether the VAR(6) can be restricted to a VAR(4)?",77.07,0.31,0.33,4.87,A,False,0.053174782544374466,0.06025492027401924,0.6478014588356018,0.23831287026405334
Which of the following is a DISADVANTAGE of using pure time-series models (relative to structural models)?,They are not theoretically motivated,They cannot produce forecasts easily,They cannot be used for very high frequency data,It is difficult to determine the appropriate explanatory variables for use in pure time-series models,A,False,0.06695714592933655,0.05214627832174301,0.49475011229515076,0.3853117823600769
"Which of the following are alternative names for the dependent variable (usually denoted by y) in linear regression analysis?

(i) The regressand

(ii) The regressor

(iii) The explained variable

(iv) The explanatory variable",(ii) and (iv) only,(i) and (iii) only,"(i), (ii), and (iii) only","(i), (ii), (iii), and (iv)",B,False,0.015254771336913109,0.02515086531639099,0.832882285118103,0.1127183586359024
"Which of the following are advantages of the VAR approach to modelling the relationship between variables relative to the estimation of full structural models?

i) VARs receive strong motivation from financial and economic theory


ii) VARs in their reduced forms can be used easily to produce time-series forecasts


iii) VAR models are typically highly parsimonious


iv) OLS can be applied separately to each equation in a reduced form VAR",(ii) and (iv) only,(i) and (iii) only,"(i), (ii), and (iii) only","(i), (ii), (iii), and (iv)",A,False,0.009619021788239479,0.012351066805422306,0.8658766746520996,0.10341422259807587
Which of the following statements is TRUE concerning the standard regression model?,y has a probability distribution,x has a probability distribution,The disturbance term is assumed to be correlated with x,"For an adequate model, the residual (u-hat) will be zero for all sample data points",A,False,0.11333952844142914,0.08826890587806702,0.34911033511161804,0.44826653599739075
"Consider the following model for $y_t$:

$y_t = \mu + \lambda t + u_t$

Which one of the following most accurately describes the process for $y_t$?",A unit root process,A stationary process,A deterministic trend process,A random walk with drift,C,True,0.1910160630941391,0.07962734252214432,0.6667115688323975,0.06201383098959923
Which of the following is correct concerning logit and probit models?,They use a different method of transforming the model so that the probabilities lie between zero and one,The logit model can result in too many observations falling at exactly zero or exactly one,"For the logit model, the marginal effect of a change in one of the explanatory variables is simply the estimate of the parameter attached to that variable, whereas this is not the case for the probit model",The probit model is based on a cumulative logistic function,A,False,0.11034366488456726,0.05906270444393158,0.7195310592651367,0.11034366488456726
What is the most important disadvantage of the diagonal VECH approach to building multivariate GARCH models that is overcome by the BEKK formulation?,The diagonal VECH model is hard to interpret intuitively,The diagonal VECH model contains too many parameters,The diagonal VECH model does not ensure a positive-definite variance-covariance matrix,The BEKK model reduces the dimensionality problem that arises when a number of series are modelled together.,C,True,0.0235284510999918,0.0235284510999918,0.5355051159858704,0.4170517921447754
