0,1,2,3,4,5,correct,choiceA_probs,choiceB_probs,choiceC_probs,choiceD_probs
"If a relevant variable is omitted from a regression equation, the consequences would be that:

i) The standard errors would be biased


ii) If the excluded variable is uncorrelated with all of the included variables, all of

the slope coefficients will be inconsistent.


iii) If the excluded variable is uncorrelated with all of the included variables, the

intercept coefficient will be inconsistent.


iv) If the excluded variable is uncorrelated with all of the included variables, all of

the slope and intercept coefficients will be consistent and unbiased but inefficient.",(ii) and (iv) only,(i) and (iii) only,"(i), (ii), and (iii) only","(i), (ii), (iii), and (iv)",C,True,0.00420286925509572,0.01008215919137001,0.9075669646263123,0.07449763268232346
"Which of the following are alternative names for the independent variable (usually denoted by x) in linear regression analysis?

(i) The regressor

(ii) The regressand

(iii) The causal variable

(iv) The effect variable",(ii) and (iv) only,(i) and (iii) only,"(i), (ii), and (iii) only","(i), (ii), (iii), and (iv)",B,False,0.015298858284950256,0.02522355318069458,0.8352893590927124,0.1130441203713417
"Consider the OLS estimator for the standard error of the slope coefficient. Which of the following statement(s) is (are) true?

(i) The standard error will be positively related to the residual variance

(ii) The standard error will be negatively related to the dispersion of the observations on the explanatory variable about their mean value

(iii) The standard error will be negatively related to the sample size

(iv) The standard error gives a measure of the precision of the coefficient estimate.",(ii) and (iv) only,(i) and (iii) only,"(i), (ii), and (iii) only","(i), (ii), (iii), and (iv)",D,False,0.017291206866502762,0.032304227352142334,0.8331369757652283,0.0995040237903595
"What is the meaning of the term ""heteroscedasticity""?",The variance of the errors is not constant,The variance of the dependent variable is not constant,The errors are not linearly independent of one another,The errors have non-zero mean,A,False,0.2192990779876709,0.08067560940980911,0.5961166024208069,0.10358952730894089
"If a Durbin Watson statistic takes a value close to zero, what will be the value of the first order autocorrelation coefficient?",Close to zero,Close to plus one,Close to minus one,Close to either minus one or plus one,C,True,0.2183152437210083,0.0708765760064125,0.5934423208236694,0.11685571074485779
"Under the null hypothesis of a Bera-Jarque test, the distribution has",Zero skewness and zero kurtosis,Zero skewness and a kurtosis of three,Skewness of one and zero kurtosis,Skewness of one and kurtosis of three.,B,False,0.3273155093193054,0.09377745538949966,0.5396520495414734,0.03909226506948471
"If an estimator is said to be consistent, it is implied that","On average, the estimated coefficient values will equal the true values",The OLS estimator is unbiased and no other unbiased estimator has a smaller variance,The estimates will converge upon the true values as the sample size increases,The coefficient estimates will be as close to their true values as possible for small and large samples.,C,True,0.20036327838897705,0.06504842638969421,0.6993365287780762,0.03481791540980339
Which of the following is a typical characteristic of financial asset return time-series?,Their distributions are thin-tailed,They are not weakly stationary,They are highly autocorrelated,They have no trend,D,False,0.19863420724868774,0.03451744467020035,0.6933014392852783,0.07307343184947968
"Which of the following assumptions are required to show the consistency, unbiasedness and efficiency of the OLS estimator?

i) $E(u_t) = 0$


ii) $\text{Var}(u_t) = \sigma^2$


iii) $\text{Cov}(u_t, u_{t-j}) = 0 \forall j$


iv) $u_t \sim N(0, \sigma^2)$",(ii) and (iv) only,(i) and (iii) only,"(i), (ii), and (iii) only","(i), (ii), (iii), and (iv)",C,True,0.005533182993531227,0.010337348096072674,0.9305383563041687,0.05249738693237305
Which of the following is a disadvantage of the fixed effects approach to estimating a panel model?,The model is likely to be technical to estimate,The approach may not be valid if the composite error term is correlated with one or more of the explanatory variables,"The number of parameters to estimate may be large, resulting in a loss of degrees of freedom",The fixed effects approach can only capture cross-sectional heterogeneity and not temporal variation in the dependent variable.,C,True,0.060238052159547806,0.08764583617448807,0.5043669939041138,0.3466460406780243
"Consider an identical situation to that of question 21, except that now a 2-sided alternative is used. What would now be the appropriate conclusion?",H0 is rejected,H0 is not rejected,H1 is rejected,There is insufficient information given in the question to reach a conclusion,A,False,0.08552581071853638,0.14100822806358337,0.6319550275802612,0.14100822806358337
The price of a house is best described as what type of number?,Discrete,Cardinal,Ordinal,Nominal,B,False,0.03839090093970299,0.01600370742380619,0.8737728595733643,0.07172363996505737
"If a Johansen ""trace"" test for a null hypothesis of 2 cointegrating vectors is applied to a system containing 4 variables is conducted, which eigenvalues would be used in the test?",All of them,The largest 2,The smallest 2,The second largest,C,True,0.06731518357992172,0.2073453813791275,0.5636231303215027,0.16148072481155396
"Which of the following statements is true concerning variance decomposition analysis of VARs?

i) Variance decompositions measure the impact of a unit shock to each of the variables on the VAR

ii) Variance decompositions can be thought of as measuring the proportion of the forecast error variance that is attributable to each variable

iii) The ordering of the variables is important for calculating impulse responses but not variance decompositions

iv) It is usual that most of the forecast error variance for a given variable is attributable to shocks to that variable",(ii) and (iv) only,(i) and (iii) only,"(i), (ii), and (iii) only","(i), (ii), (iii), and (iv)",A,False,0.026854414492845535,0.030430037528276443,0.7848010659217834,0.1363779604434967
"Suppose that we have estimated a GARCH model for daily equity returns, and we are interested in producing a 10-day forecast of the volatility (measured by the standard deviation of returns) for use in a value at risk model. How could such a forecast most validly be calculated?","Produce 1, 2, 3, ..., 10 step ahead conditional variance forecasts and add them up","Produce 1, 2, 3, ..., 10 step ahead conditional variance forecasts and add them up and take the square root","Produce 1, 2, 3, ..., 10 step ahead conditional variance forecasts, take the square roots of each one and add them up","Produce a 1-step ahead conditional variance forecast, take its square root and multiply it by the square root of 10",B,False,0.018908707424998283,0.04535963386297226,0.9110726118087769,0.024279262870550156
"Suppose that the value of $R^2$ for an estimated regression model is exactly zero. Which of the following are true?

i) All coefficient estimates on the slopes will be zero

ii) The fitted line will be horizontal with respect to all of the explanatory variables

iii) The regression line has not explained any of the variability of y about its mean value

iv) The intercept coefficient estimate must be zero.",(ii) and (iv) only,(i) and (iii) only,"(i), (ii), and (iii) only","(i), (ii), (iii), and (iv)",C,True,0.023458406329154968,0.03867637366056442,0.7768357396125793,0.15296801924705505
"A white noise process will have

(i) A zero mean

(ii) A constant variance

(iii) Autocovariances that are constant

(iv) Autocovariances that are zero except at lag zero",(ii) and (iv) only,(i) and (iii) only,"(i), (ii), and (iii) only","(i), (ii), (iii), and (iv)",A,False,0.0067130643874406815,0.02067769505083561,0.7759247422218323,0.19618450105190277
"Which of the following statements are true concerning the Box-Jenkins approach to diagnostic testing for ARMA models?

(i) The tests will show whether the identified model is either too large or too small

(ii) The tests involve checking the model residuals for autocorrelation, heteroscedasticity, and non-normality

(iii) If the model suggested at the identification stage is appropriate, the acf and pacf for the residuals should show no additional structure

(iv) If the model suggested at the identification stage is appropriate, the coefficients on the additional variables under the overfitting approach will be statistically insignificant",(ii) and (iv) only,(i) and (iii) only,"(i), (ii), and (iii) only","(i), (ii), (iii), and (iv)",A,False,0.014048349112272263,0.029740355908870697,0.869140625,0.08084266632795334
Which one of the following would be a plausible response to a finding of residual non-normality?,Use a logarithmic functional form instead of a linear one,Add lags of the variables on the right hand side of the regression model,Estimate the model in first differenced form,Remove any large outliers from the data.,D,False,0.11948668211698532,0.11948668211698532,0.6068034768104553,0.1534239500761032
The fixed effects panel model is also sometimes known as,A seemingly unrelated regression model,The least squares dummy variables approach,The random effects model,Heteroscedasticity and autocorrelation consistent,B,False,0.010871287435293198,0.00846656784415245,0.8636133670806885,0.11687735468149185
Which of the following statements is TRUE concerning OLS estimation?,OLS minimises the sum of the vertical distances from the points to the line,OLS minimises the sum of the squares of the vertical distances from the points to the line,OLS minimises the sum of the horizontal distances from the points to the line,OLS minimises the sum of the squares of the horizontal distances from the points to the line.,B,False,0.0887666568160057,0.0887666568160057,0.6559018492698669,0.16583795845508575
"If the standard tools for time-series analysis, such as estimation of the acf, pacf and spectral analysis, find no evidence of structure in the data, this implies that the data are which of the following?",Normally distributed,Uncorrelated,Independent,Fat-tailed,B,False,0.12854982912540436,0.08835092186927795,0.6528299450874329,0.12854982912540436
"If two variables, $x_t$ and $y_t$ are said to be cointegrated, which of the following statements are true?

i) $x_t$ and $y_t$ must both be stationary


ii) Only one linear combination of $x_t$ and $y_t$ will be stationary


iii) The cointegrating equation for $x_t$ and $y_t$ describes the short-run relationship

between the two series


iv) The residuals of a regression of $y_t$ on $x_t$ must be stationary",(ii) and (iv) only,(i) and (iii) only,"(i), (ii), and (iii) only","(i), (ii), (iii), and (iv)",A,False,0.021242469549179077,0.024070871993899345,0.9032527804374695,0.0449703074991703
A dependent variable whose values are not observable outside a certain range but where the corresponding values of the independent variables are still available would be most accurately described as what kind of variable?,Censored,Truncated,Multinomial variable,Discrete choice,A,False,0.04066705331206322,0.03167153522372246,0.8168196678161621,0.11054451763629913
A Hausman test would be used for,Determining whether an equation that is part of a simultaneous system is identified,Determining whether a simultaneous framework is needed for a particular variable,Determining whether 2SLS or ILS is optimal,Determining whether the structural form equations can be obtained via substitution from the reduced forms,B,False,0.14685434103012085,0.14685434103012085,0.6581554412841797,0.04767662286758423
"Under the matrix notation for the classical linear regression model, $y = X \beta + u$, what are the dimensions of $u$?",T x k,T x 1,k x 1,1 x 1,B,False,0.36981943249702454,0.1541636884212494,0.4190603196620941,0.05671364814043045
"How many parameters will be required to be estimated in total for all equations of a standard form, unrestricted, tri-variate VAR(4), ignoring the intercepts?",12,4,3,36,D,False,0.09421227872371674,0.10675650089979172,0.5421543121337891,0.2560955584049225
"A researcher tests for structural stability in the following regression model:

$y_t = \beta_1 + \beta_2 x_{2t} + \beta_3 x_{3t} + u_t$

The total sample of 200 observations is split exactly in half for the sub-sample regressions. Which would be the unrestricted residual sum of squares?",The RSS for the whole sample,The RSS for the first sub-sample,The RSS for the second sub-sample,The sum of the RSS for the first and second sub-samples,D,False,0.03741069510579109,0.05443223565816879,0.6631203889846802,0.24394838511943817
"Suppose that we are interested in testing the null hypothesis that a GARCH(2,2) model can be restricted to a process with a constant conditional variance using the likelihood ratio test approach. Which of the following statements are true?",The test statistic will follow a chi-squared distribution with 2 degrees of freedom under the null hypothesis,The value of the log-likelihood function will almost always be bigger for the restricted model than for the unrestricted model,"If the relevant values of the log-likelihood functions are -112.3 and -118.4, the value of the test statistic is 12.2",The likelihood ratio test compares the slopes of the log-likelihood function at the maximum and at the restricted parameter value.,C,False,0.09300847351551056,0.11942524462938309,0.36785563826560974,0.41683506965637207
Which one of the following is NOT a plausible remedy for near multicollinearity?,Use principal components analysis,Drop one of the collinear variables,Use a longer run of data,Take logarithms of each of the variables,D,False,0.11871989071369171,0.10476993024349213,0.6029093861579895,0.17273643612861633
"Consider the following AR(2) process:

yt = 1.5 yt-1 - 0.5 yt-2 + ut

This is a",Stationary process,Unit root process,Explosive process,Stationary and unit root process,B,False,0.08993972092866898,0.10191504657268524,0.753055989742279,0.05455119535326958
Which of the following could be used as a test for autocorrelation up to third order?,The Durbin Watson test,White's test,The RESET test,The Breusch-Godfrey test,D,False,0.13256533443927765,0.07095710933208466,0.7628608345985413,0.03351776674389839
The residual from a standard regression model is defined as,"The difference between the actual value, y, and the mean, y-bar","The difference between the fitted value, y-hat, and the mean, y-bar","The difference between the actual value, y, and the fitted value, y-hat","The square of the difference between the fitted value, y-hat, and the mean, y-bar",C,True,0.2987526059150696,0.07553648203611374,0.5581433176994324,0.06666070967912674
"If OLS is applied separately to each equation that is part of a simultaneous system, the resulting estimates will be",Unbiased and consistent,Biased but consistent,Biased and inconsistent,It is impossible to apply OLS to equations that are part of a simultaneous system,C,True,0.07828695327043533,0.032634858042001724,0.5784666538238525,0.3096309304237366
Which one of the following is NOT an example of mis-specification of functional form?,Using a linear specification when y scales as a function of the squares of x,Using a linear specification when a double-logarithmic model would be more appropriate,Modelling y as a function of x when in fact it scales as a function of 1/x,Excluding a relevant variable from a linear regression model,D,False,0.09128082543611526,0.06273633241653442,0.6744791865348816,0.17053504288196564
Suppose that we wished to evaluate the factors that affected the probability that an investor would choose an equity fund rather than a bond fund or a cash investment. Which class of model would be most appropriate?,A logit model,A multinomial logit,A tobit model,An ordered logit model,B,False,0.05881570652127266,0.019094664603471756,0.7165219783782959,0.20528699457645416
"Which of the following statements will be true if the number of replications used in a Monte Carlo study is small?

i) The statistic of interest may be estimated imprecisely


ii) The results may be affected by unrepresentative combinations of random draws


iii) The standard errors on the estimated quantities may be unacceptably large


iv) Variance reduction techniques can be used to reduce the standard errors",(ii) and (iv) only,(i) and (iii) only,"(i), (ii), and (iv) only","(i), (ii), (iii), and (iv)",D,False,0.02389449067413807,0.018609048798680305,0.8966341614723206,0.03939535468816757
Which of the following is a disadvantage of the random effects approach to estimating a panel model?,The approach may not be valid if the composite error term is correlated with one or more of the explanatory variables,"The number of parameters to estimate may be large, resulting in a loss of degrees of freedom",The random effects approach can only capture cross-sectional heterogeneity and not temporal variation in the dependent variable.,All of (a) to (c) are potential disadvantages of the random effects approach.,A,False,0.06363854557275772,0.0495617501437664,0.47022879123687744,0.41497543454170227
"Which of the following could result in autocorrelated residuals?

i) Slowness of response of the dependent variable to changes in the values of the independent variables

ii) Over-reactions of the dependent variable to changes in the independent variables

iii) Omission of relevant explanatory variables that are autocorrelated

iv) Outliers in the data",(ii) and (iv) only,(i) and (iii) only,"(i), (ii), and (iii) only","(i), (ii), (iii), and (iv)",C,True,0.011096823029220104,0.018295567482709885,0.8815298676490784,0.08199504762887955
"Which of the following statements are true concerning the acf and pacf?

(i) The acf and pacf are often hard to interpret in practice

(ii) The acf and pacf can be difficult to calculate for some data sets

(iii) Information criteria represent an alternative approach to model order determination

(iv) If applied correctly, the acf and pacf will always deliver unique model selections",(ii) and (iv) only,(i) and (iii) only,"(i), (ii), and (iii) only","(i), (ii), (iii), and (iv)",C,True,0.013839577324688435,0.017770368605852127,0.8562243580818176,0.10226141661405563
"Which of the following conditions are necessary for a series to be classifiable as a weakly stationary process?

(i) It must have a constant mean

(ii) It must have a constant variance

(iii) It must have constant autocovariances for given lags

(iv) It must have a constant probability distribution",(ii) and (iv) only,(i) and (iii) only,"(i), (ii), and (iii) only","(i), (ii), (iii), and (iv)",C,True,0.011005154810845852,0.020560337230563164,0.8742477297782898,0.09214502573013306
"Consider the following equation and determine the class of model that it best represents

$y_{it} = \alpha + \beta_{it} + \mu_i + \nu_{it}$",An entity fixed effects model,A time fixed effects model,A random effects model,A pure time series model,A,False,0.08415357023477554,0.05104171857237816,0.7984268665313721,0.06553886830806732
"Note that statistical tables are not necessary to answer this question. For a sample of 1000 observations, the Dickey-Fuller test statistic values are",More negative than (i.e. bigger in absolute value than) those in the left hand tail of a normal distribution,Less negative than (i.e. smaller in absolute value than) those in the left hand tail of a normal distribution,Obtained from an analytical formula for the density of the Dickey-Fuller distribution,More negative (i.e. bigger in absolute value) for a 10% size of test than a 5% test.,A,True,0.2962798476219177,0.26146605610847473,0.17970281839370728,0.26146605610847473
"Suppose that a hypothesis test is conducted using a 5% significance level. Which of the following statements are correct?

(i) The significance level is equal to the size of the test

(ii) The significance level is equal to the power of the test

(iii) 2.5% of the total distribution will be in each tail rejection region for a 2-sided test

(iv) 5% of the total distribution will be in each tail rejection region for a 2-sided test.",(ii) and (iv) only,(i) and (iii) only,"(i), (ii), and (iii) only","(i), (ii), (iii), and (iv)",B,False,0.022486262023448944,0.03707357868552208,0.7446427345275879,0.18827515840530396
Which one of the following criticisms of the Dickey-Fuller/Engle-Granger approach to dealing with cointegrated variables is overcome by the Engle-Yoo (EY) procedure?,"In the context of small samples, Dickey Fuller tests are prone to conclude that there is a unit root in a series when there is not",The Engle-Granger (EG) approach can only detect up to one cointegrating relationship even though there could be more than one,The variables are treated asymmetrically in the cointegrating tests,It is not possible to perform tests about the cointegrating relationship,D,False,0.136844664812088,0.09405187517404556,0.6132952570915222,0.15506531298160553
Consider a series that follows an MA(1) with zero mean and a moving average coefficient of 0.4. What is the value of the autocovariance at lag 1?,0.4,1,0.34,It is not possible to determine the value of the autocovariances without knowing the disturbance variance.,D,False,0.0535406656563282,0.08827362954616547,0.507979691028595,0.3491290211677551
"Which of the following estimation techniques are available for the estimation of over-identified systems of simultaneous equations?

i) OLS

ii) ILS

iii) 2SLS

iv) IV",(iii) only,(iii) and (iv) only,"(ii), (iii), and (iv) only","(i), (ii), (iii) and (iv)",B,False,0.022133653983473778,0.0322042778134346,0.6468402147293091,0.23795923590660095
Which one of the following statements best describes a Type II error?,It is the probability of incorrectly rejecting the null hypothesis,It is equivalent to the power of the test,It is equivalent to the size of the test,It is the probability of failing to reject a null hypothesis that was wrong,D,False,0.13033460080623627,0.06976308673620224,0.5841191411018372,0.21488544344902039
Which one of the following would be the most appropriate as a 95% (two-sided) confidence interval for the intercept term of the model given in question 21?,"(-4.79,2.19)","(-4.16,4.16)","(-1.98,1.98)","(-5.46,2.86)",D,False,0.2029264271259308,0.17908191680908203,0.5516111850738525,0.06588055938482285
"Which of the following are characteristics of a stationary process?

i) It crosses its mean value frequently


ii) It has constant mean and variance


iii) It contains no trend component


iv) It will be stationary in first difference form",(ii) and (iv) only,(i) and (iii) only,"(i), (ii), and (iii) only","(i), (ii), (iii), and (iv)",D,False,0.014363553375005722,0.018443167209625244,0.8886415958404541,0.07294414192438126
Consider again the VAR model of equation 16. Which of the following conditions must hold for it to be said that there is bi-directional feedback?,The b and d coefficients significant and the a and c coefficients insignificant,The a and c coefficients significant and the b and d coefficients insignificant,The a and c coefficients significant,The b and d coefficients significant,D,False,0.1617826372385025,0.08659600466489792,0.6398627161979675,0.11119145900011063
"Consider the following sample autocorrelation estimates obtained using 250 data points:

1) Lag 1 2 3

2) Coefficient 0.2 -0.15 -0.1

3) Assuming that the coefficients are approximately normally distributed, which of the coefficients are statistically significant at the 5% level?",1 only,1 and 2 only,"1, 2 and 3 only",It is not possible to determine the statistical significance since no standard errors have been given,B,False,0.18881332874298096,0.11452106386423111,0.5815860033035278,0.11452106386423111
Which one of the following is examined by looking at a goodness of fit statistic?,How well the population regression function fits the data,How well the sample regression function fits the population regression function,How well the sample regression function fits the data,How well the population regression function fits the sample regression function.,C,True,0.10769429802894592,0.05087118223309517,0.7022550106048584,0.1382821947336197
"Which of the following statements are correct concerning the use of antithetic variates as part of a Monte Carlo experiment?

i) Antithetic variates work by reducing the number of replications required to cover the whole probability space

ii) Antithetic variates involve employing a similar variable to that used in the simulation, but whose properties are known analytically

iii) Antithetic variates involve using the negative of each of the random draws and repeating the experiment using those values as the draws

iv) Antithetic variates involve taking one over each of the random draws and repeating the experiment using those values as the draws",(ii) and (iv) only,(i) and (iii) only,"(i), (ii), and (iv) only","(i), (ii), (iii), and (iv)",B,False,0.010116346180438995,0.01471919659525156,0.9106444716453552,0.04533831402659416
Which one of the following statements is true concerning alternative forecast accuracy measures?,Mean squared error is usually highly correlated with trading rule profitability,Mean absolute error provides a quadratic loss function,Mean absolute percentage error is a useful measure for evaluating asset return forecasts,Mean squared error penalises large forecast errors disproportionately more than small forecast errors,D,False,0.07519064098596573,0.051677726209163666,0.713388979434967,0.15917859971523285
