0,1,2,3,4,5,correct,choiceA_probs,choiceB_probs,choiceC_probs,choiceD_probs
"Which of the following criticisms of standard (""plain vanilla"") GARCH models can be overcome by EGARCH models?

i) Estimated coefficient values from GARCH models may be negative

ii) GARCH models cannot account for leverage effects

iii) The responsiveness of future volatility to positive and negative shocks is symmetric under a GARCH formulation

iv) GARCH models cannot allow for a feedback from the volatility to the returns",(ii) and (iv) only,(i) and (iii) only,"(i), (ii), and (iii) only","(i), (ii), (iii), and (iv)",C,True,0.03290313109755516,0.03290313109755516,0.7488718032836914,0.16709588468074799
"Suppose that 100 separate firms were tested to determine how many of them ""beat the market"" using a Jensen-type regression, and it is found that 3 fund managers significantly do so. Does this suggest prima facie evidence for stock market inefficiency?",Yes,No,"In order to answer this question, you would need to test every fund manager trading in that market",There is insufficient information given in the question to draw a conclusion about market efficiency.,B,False,0.0437769778072834,0.17314130067825317,0.4153444170951843,0.36654016375541687
"Which of the following are advantages of the use of panel data over pure cross-sectional or pure time-series modelling?

(i) The use of panel data can increase the number of degrees of freedom and therefore the power of tests

(ii) The use of panel data allows the average value of the dependent variable to vary either cross-sectionally or over time or both

(iii) The use of panel data enables the researcher allows the estimated relationship between the independent and dependent variables to vary either cross-sectionally or over time or both",(i) only,(i) and (ii) only,(ii) only,"(i), (ii), and (iii)",B,False,0.002185957506299019,0.002185957506299019,0.1532474309206009,0.06388304382562637
"If the Engle-Granger test is applied to the residuals of a potentially cointegrating regression, what would be the interpretation of the null hypothesis?",The variables are cointegrated,The variables are not cointegrated,Both variables are stationary,Both variables are non-stationary,B,False,0.17388086020946503,0.1970328539609909,0.5355907678604126,0.09307171404361725
"Which of the following statements are true concerning the autocorrelation function (acf) and partial autocorrelation function (pacf)?

i) The acf and pacf will always be identical at lag one whatever the model

ii) The pacf for an MA(q) model will in general be non-zero beyond lag q

iii) The pacf for an AR(p) model will be zero beyond lag p

iv) The acf and pacf will be the same at lag two for an MA(1) model",(ii) and (iv) only,(i) and (iii) only,"(i), (ii), and (iii) only","(i), (ii), (iii), and (iv)",C,True,0.01739300601184368,0.028676217421889305,0.8380419611930847,0.10008984059095383
