0,1,2,3,4,5,correct,choiceA_probs,choiceB_probs,choiceC_probs,choiceD_probs
Nearsightedness results from,too much curvature of the cornea and lens,too little curvature of the cornea and lens,too much curvature of the iris and lens,too little curvature of the iris and lens,A,True,0.5975916385650635,0.10384584963321686,0.2822823226451874,0.015925278887152672
Delusions of grandeur are most characteristic of,OCD.,schizophrenia.,conversion disorder.,antisocial personality disorder.,B,False,0.3066816031932831,0.08786574751138687,0.5056325197219849,0.09956493973731995
Abraham Maslow proposed the idea that some motives are more imperative to survival than others. Which of the following approaches expresses this?,Homeostatic regulation,Goal-setting,Expectancy-value,Hierarchy of needs,D,False,0.020394371822476387,0.020394371822476387,0.7652931809425354,0.19349642097949982
"In test construction and evaluation, validity refers to the degree to which a test",measures what it purports to measure,yields consistent results on successive administrations,has been piloted and statistically analyzed,includes norms based on a representative sample of the general population,A,False,0.4116183817386627,0.02981753461062908,0.09184446930885315,0.46642473340034485
The precedent established in Larry P. v. Riles resulted in,"the provision of a free, appropriate public education for students with disabilities",the provision of bilingual education for English-language learners,schools being held responsible for providing tests that do not discriminate on the basis of race,the assignment of similar funding to athletic activities for boys and girls,C,True,0.22385166585445404,0.06413457542657852,0.5369922518730164,0.17433585226535797
The heritability for traits of a cloned population is,0%,25%,50%,75%,A,False,0.013082697987556458,0.05863258242607117,0.6303597092628479,0.29776084423065186
Which of the following statistics provides the most information about how spread out a distribution of scores is?,variance,mean,range,median,A,False,0.03972169756889343,0.045010581612586975,0.6213518977165222,0.29350587725639343
"According to the position statement Supervision in School Psychology published by the National Association of School Psychologists (NASP), which of the following is most accurate concerning school psychologists who will be supervising in a school district?",They need provide supervision only to school psychologists who are not fully certified or licensed and to any school psychology interns.,They should provide professional but not administrative supervision.,They are eligible to serve as supervisors after one year of experience as a school psychologist.,They should hold the Nationally Certified School Psychologist credential or the state school psychologist credential.,D,False,0.2424544245004654,0.27473685145378113,0.3527691066265106,0.1297765076160431
"Dan read a list of 30 vocabulary words only once. If he is typical and shows the serial position effect, we would expect that the words he remembers two days later are",at the beginning of the list,in the middle of the list,at the end of the list,distributed throughout the list,A,False,0.11074310541152954,0.14219693839550018,0.7221357226371765,0.024710124358534813
"Which developmental stage theory explained how experiences in infancy, childhood, adolscence, adulthood, and old age influence later personality characteristics?",Piaget's cognitive development theory,Erikson's psychosocial stage theory,Kohlberg's moral development theory,Ainsworth's social attachment theory,B,False,0.07683435827493668,0.08706473559141159,0.5677333474159241,0.268178254365921
The AP Psychology examination given by the College Board in May exemplifies which of the following types of tests?,aptitude,projective,achievement,intelligence,C,True,0.009015202522277832,0.03565581515431404,0.9195756316184998,0.03565581515431404
Our ability to perceive depth depends primarily on what other perceptual abilities?,proximity and similarity,top-down processing and bottom-up processing,binocular and monocular cues,size and shape constancy,C,True,0.12059208750724792,0.08288165181875229,0.540456235408783,0.25529345870018005
A person who sustains major injuries that involve the destruction of the medulla oblongata will,be paralyzed,fall into a coma,suffer severe speech impairment,die,D,False,0.018648961558938026,0.02394573949277401,0.6997970938682556,0.2574410140514374
Which of the following terms applies to IQ tests?,achievement,standardized,projective,triarchic,B,False,0.03554288670420647,0.040275365114212036,0.43300095200538635,0.4906543791294098
"Which classical conditioning term best describes the following scenario: Later in his classical conditioning experiments, Ivan Pavlov's dogs began to salivate whenever they heard any sound similar to a bell, such as a doorbell or someone accidentally clinking a water glass.",discrimination,spontaneous recovery,trace conditioning,generalization,D,False,0.014476204290986061,0.018587814643979073,0.7903739809989929,0.1763562709093094
"Sal meets Petunia for the first time. She is outgoing and funny. He walks away with the opinion that Petunia is a fun person, whereas in actuality Petunia is temporarily gleeful because she just won the lottery. Sal's opinion that Petunia is funny is best explained by",the mere-exposure effect.,self-serving bias.,equipotentiality.,the fundamental attribution error.,D,False,0.14705628156661987,0.14705628156661987,0.3527697026729584,0.3527697026729584
All of the following are examples of punishment EXCEPT,grounding a teenager for staying out past curfew,spanking a child for misbehavior,permanently revoking the driving privileges of a third-time DWI driver,refusing to return the boss' phone call after not getting the expected raise,D,False,0.08016397058963776,0.08016397058963776,0.5923360586166382,0.24692241847515106
Which of the following must be done when universal screening data show that very few students are successfully meeting school competencies?,Changes must be made in the delivery of the core program.,Students who are not meeting competencies must be given strategic or supplemental instruction.,Students must be given more time to develop competencies.,Students who are not meeting competencies must be evaluated for learning disabilities.,A,True,0.2978365421295166,0.14068803191184998,0.26283982396125793,0.2978365421295166
Substances that are toxic to humans often taste,sour,sweet,salty,bitter,D,True,0.02052951045334339,0.01598839834332466,0.28340113162994385,0.6798440217971802
All public institutions subscribe to all of the following ethical guidelines EXCEPT,avoiding unnecessary deception to humans,avoiding unnecessary pain to humans and other animals,avoiding use of animals when computers are available,protecting confidentiality,C,True,0.08150941133499146,0.0339781828224659,0.46905434131622314,0.4139389991760254
Which of the following kinds of tests is most likely to be an achievement test?,an IQ test,a classroom test over a chapter in a textbook,an entrance exam for law school,a personality test based on the Big Five personality traits,B,False,0.04318021237850189,0.02039688639342785,0.7653874754905701,0.17078104615211487
A fetus with the genotype XXY will most likely,result in a miscarriage.,suffer from sterility as an adult.,be color blind.,grow into a depressed adult.,B,False,0.022886017337441444,0.09051595628261566,0.668827474117279,0.21713648736476898
"Susan is a first-grade student who is referred to the school psychologist because she will not remain seated at her desk. Her teacher reports that Susan is ""always getting up and walking around the room."" What observation data is LEAST relevant to the referral concern?",Frequency,Duration,Intensity,Peer comparison,C,True,0.09352850168943405,0.05006219819188118,0.7831045389175415,0.07284006476402283
"In order to prove a psychological theory,",you need to run an experiment.,you need to find statistically significant results.,you must replicate your findings.,it is impossible to prove a theory.,D,False,0.11962952464818954,0.05650898069143295,0.5361422896385193,0.28697630763053894
Research indicates that which of the following factors most influence a person's sexual orientation?,parenting style,masculine/feminine personality traits,hormones released in the womb,sexual orientation of parents,C,True,0.037528470158576965,0.017727196216583252,0.7537795305252075,0.19058531522750854
Which of the following usually increases with age in healthy adults between the ages of 18 and 70?,fluid intelligence,crystallized intelligence,g,speededness,B,False,0.040960729122161865,0.07652471214532852,0.4403693377971649,0.4403693377971649
The left cerebral hemisphere is specialized for which of the following functions?,"verbal, mathematical, and recognizing emotional expressions","mathematical, spatial, and musical","verbal, analytic, and mathematical","mathematical, spatial, and analytic",C,True,0.06665240973234177,0.035676464438438416,0.8119925856590271,0.0855833888053894
Runners in a park were found to pick up their pace when another runner came into view; this finding illustrates the phenomenon of,social facilitation.,conformity.,deindividuation.,norms.,A,False,0.0866338387131691,0.11124005913734436,0.7253762483596802,0.07645409554243088
"A researcher tests the problem solving skills of twenty 10-year-old, twenty 20-year-old, and twenty 30-year-old participants for a study on age and problem solving. What research method is this researcher using?",longitudinal,stage,developmental,cross-sectional,D,False,0.19753530621528625,0.17432431876659393,0.47386255860328674,0.15384064614772797
"Bessie could barely detect sweetness in a sip of water from a pitcher in which one quarter of a teaspoon of water was mixed into a half gallon of water. For taste, this is Bessie's",absolute threshold,difference threshold,subliminal stimulation,distal stimulus,A,False,0.08069439977407455,0.02040274068713188,0.7656071782112122,0.133042573928833
"During assigned seat-work time, Mary, a firstgrade student, sometimes leaves her seat and attempts to play with a block collection. When she leaves her seat, she fails to complete her seat work. Which of the following behavioral intervention strategies will most effectively increase the long-term likelihood that Mary will complete her seat work?",Allowing Mary to read from a teacherselected book for a specific period of time before beginning her seat work,Allowing Mary to play with the blocks afterward if she remains in her seat throughout the assigned seat-work time,Explaining to Mary the value of completing seat work in terms of the objectives of the lesson,Removing the blocks from the classroom during the assigned seat-work time,B,True,0.03236747533082962,0.5063124895095825,0.347983181476593,0.11297359317541122
Which of the following are most directly designed to help determine whether the findings of a study reflect a truly replicable phenomenon rather than the outcomes of chance processes?,Inferential statistics,Descriptive statistics,Standard deviation,Extraneous variables,A,False,0.12377513945102692,0.1800917536020279,0.5547216534614563,0.14025560021400452
An unjustifiable and usually negative attitude toward a group and its members is called,prejudice,ethnocentrism,in-group bias,discrimination,A,False,0.02340497262775898,0.049548327922821045,0.3230957090854645,0.6036221981048584
"Calvin's fear of dogs was so great that he could not even visit his friends who had dogs or who lived in a neighborhood that had a lot of dogs. Once he sought help, he worked to overcome this fear first by witnessing his counselor playing with a dog and then, after a while, by actually touching and petting a dog himself. The method used to help Calvin overcome his fears is known as",countertransference,peer-counselor alliance,rational-emotive therapy,systematic desensitization,D,True,0.03700942546129227,0.11399705708026886,0.39788880944252014,0.4508671164512634
"Mr. Gordon suffered damage to the back of his right frontal lobe. As a result, he is unable to",understand information he hears,understand information he reads,speak intelligibly,move his left hand,D,False,0.10767672955989838,0.09502437710762024,0.7021404504776001,0.09502437710762024
"During the manic phase of a bipolar disorder, individuals are most likely to experience",high self-esteem,delusions of persecution,uncontrollable grief and despair,visual hallucinations,A,False,0.014144291169941425,0.018161630257964134,0.7722521424293518,0.19525592029094696
"According to Kohlberg, at the third (postconventional) level of moral development, individuals",follow rules in order to obtain reward,follow rules in order to avoid punishment,"define what is right by what they have learned from others, especially authority figures",self-define principles that may or may not match the dominant morals of the times,D,False,0.019253576174378395,0.01699122227728367,0.927689254283905,0.03597041592001915
"To which perspective are the roles of knowledge, information processing, and their interactions most central?",Psychoanalytic,Cognitive,Behaviorist,Evolutionary,B,False,0.022484831511974335,0.07847977429628372,0.6571031212806702,0.24173475801944733
Which of the following is primarily a chemical sense?,Touch,Vision,Taste,Hearing,C,True,0.03686624392867088,0.06887520849704742,0.6534698009490967,0.2403981238603592
"A 7-year-old student arrived in the United States one year ago from a non-Englishspeaking country, where she achieved high scores in reading. Over the year, she has become fluent in social English. After a few months in a monolingual English second grade, her teacher refers her for evaluation because she has great difficulty with the basal reader used in the class. Two English proficiency tests administered to the student show that she performs above the mean for monolingual English grade peers in speaking and listening but well below the mean in reading and writing. She also performs well above the mean for grade peers on reading tests in her native language. Based on this information alone, which of the following is the most accurate interpretation?",Continued use of the student's native language in her home environment is interfering with her development of English.,The student's reading difficulty is an early indicator that she will have increased academic problems as her coursework requires more reading.,The discrepancy between the student's English social language skills and reading skills is expected given the richer context in which social skills are acquired., The discrepancy between the student's native language reading skills and English reading skills is related to the greater complexity of English.,C,True,0.14454707503318787,0.07737047970294952,0.7340706586837769,0.041413433849811554
The limbic system plays an important role in,maintaining balance.,regulating emotion.,monitoring arousal.,processing sensory information.,B,False,0.07556259632110596,0.014879157766699791,0.812374472618103,0.09702429920434952
"To demonstrate causation, a researcher must",manipulate the way a participant responds to some aspect of a situation,operationalize dependent and independent variables,develop a hypothesis that predicts the relationship between variables,show that the manipulation of one variable invariably leads to predicted changes in another,D,False,0.5836694240570068,0.14757473766803741,0.1894897222518921,0.07899107038974762
A special diet can prevent the expression of the trait for,Tay-Sachs syndrome,PKU (phenylketonuria),Huntington's disease,Down syndrome,B,False,0.02503371238708496,0.04676913470029831,0.8290027379989624,0.09901025891304016
Which of the following is an example of an implicit memory?,describing the taste of the cake at your last birthday party,remembering how to tie a tie,recalling the name of your junior high school shop teacher,recognizing a celebrity,B,False,0.027197593823075294,0.027197593823075294,0.9006606340408325,0.04484125226736069
"After collecting and analyzing the responses of 2,000 randomly selected study participants, Adeel finds that college juniors who work at paying jobs 15 hours a week get higher grades than juniors who don't have paying jobs or who work full time. Which of the following research methods did Adeel use?",experimental,naturalistic observation,case study,survey,D,True,0.018109431490302086,0.018109431490302086,0.36373767256736755,0.599702000617981
"Nat's therapist tells him to relax, close his eyes, and breathe slowly whenever he begins to experience fear associated with being in an enclosed space. The therapist is using a technique that is central to",person-centered therapy,psychoanalysis,rational-emotive therapy,systematic desensitization,D,False,0.15115001797676086,0.1177157461643219,0.4108683168888092,0.3199845552444458
Periods of special sensitivity to specific types of learning that shape the capacity for future development are known as,maturation periods,critical periods,primary development periods,secondary development periods,B,False,0.06409387290477753,0.0822981595993042,0.7808232307434082,0.07262787222862244
Areas of the brain that are damaged are referred to as having,brain lesions,hemispheres,brain lobes,cortical adhesions,A,False,0.04799916595220566,0.012136089615523815,0.5847495794296265,0.3546685576438904
Which of the following best summarizes a view of classical behaviorism?,"Behavior is under the control of external stimuli that either reinforce or punish actions, thereby affecting the likelihood of the occurrence of these behaviors.",Behavior can be controlled by introspection.,Behavior is the result of competing motives that result from mental events that occur outside of one's awareness.,Behavior is influenced by internal drives and motivation.,A,False,0.2113361656665802,0.06861080974340439,0.6509612202644348,0.06861080974340439
"A sixth-grade teacher is concerned because Kerry, a student in class, has been hostile to classmates. Which of the following teacher strategies is most likely to encourage Kerry to be more cooperative with classmates?",Preventing Kerry from participating in play or recess activities as a consequence of hostile behavior,Having Kerry memorize rules of behavior and write examples of how they would apply in the classroom,Withholding attention or approval from Kerry in response to hostile behavior,Implementing social skills training to teach Kerry appropriate replacement behaviors for hostile behaviors,D,False,0.039059724658727646,0.06439859420061111,0.4758448600769043,0.4199315905570984
Daniel is a toddler who lags behind his peers in terms of speech development. He avoids eye contact with people and resists alterations to routine. Daniel is most likely to be diagnosed with,Down syndrome.,fetal alcohol syndrome.,mental retardation.,autism.,D,False,0.021990643814206123,0.041083935648202896,0.7282301187515259,0.2086414247751236
Garcia and Koelling's research regarding learned aversions established that which of the following UCS and CS pairs are the most powerful and learned most quickly?,performing a task and receiving a food reward,nausea and food or drink,movement and shock,punishments and rewards,B,False,0.1433844268321991,0.1624758392572403,0.5670964121818542,0.1265363097190857
Which structure is found in the inner ear?,hammer,basilar membrane,tympanic membrane,pinna,B,False,0.17799796164035797,0.09527543932199478,0.5482723712921143,0.17799796164035797
Psychogenic amnesia is an indication of which kind of psychological disorder?,schizophrenic,anxiety,mood,dissociative,D,False,0.005846008658409119,0.0031291425693780184,0.526240885257721,0.46440595388412476
"Although a man watched in horror as his wife and children were killed by a speeding truck as they crossed the street, he has no memory of the event and gets upset when people tell him he must remember. The man is most likely suffering from",panic disorder,post-traumatic stress disorder,dissociative amnesia,bipolar disorder,C,True,0.07755506038665771,0.04151223227381706,0.8337954878807068,0.04703952372074127
"Michelle watches David Letterman on television, but doesn't recognize him when she walks past him in Manhattan. Which effect on perception does this best illustrate?",convergence,context,proximity,closure,B,False,0.09340740740299225,0.10584446787834167,0.3260239064693451,0.47436198592185974
"In a meeting with the school psychologist, Ms. Harcar, a new sixth-grade teacher, expresses some concerns about a student, Anthony. The school psychologist has worked with the boy and knows him well. Anthony has a mild learning disability and receives academic support. He is doing well on a daily basis but has difficulty performing on tests. The school psychologist discusses ways in which Ms. Harcar could incorporate study-skills training into classroom activities. With regard to study-skills training, the school psychologist should stress which of the following principles while advising Ms. Harcar?","The study skills of students with disabilities are improved when they are given a single, specific study strategy to follow for all subjects.",Students with disabilities often develop study skills on their own and need only some guidance and reinforcement by the teacher.,Training in study skills needs to include helping students to guide their own thinking to organize their own study behaviors and to use varied study approaches.,Study strategies are best taught in a small group by having students practice collaborative problem-solving activities modeled by the teacher.,C,True,0.20530369877815247,0.031484343111515045,0.716580331325531,0.04580944404006004
"In class, John's teacher tells him that she will give him the coin and bill for each picture he can correctly identify on the face of the penny, nickel, dime, quarter, half-dollar, dollar bill, and five-dollar bill. John cannot identify any of them although he has been handling money for 17 years. His inability to remember the pictures most likely results from",confabulation,failure to reconstruct,failure to encode,deep processing,C,True,0.14911070466041565,0.10248219221830368,0.6682677865028381,0.07981321215629578
The somatic nervous system is part of the,central nervous system.,peripheral nervous system.,autonomic nervous system.,parasympathetic nervous system.,B,False,0.08859796822071075,0.10039465129375458,0.7418217062950134,0.06900016218423843
Professor Ek is interested in studying online bullying behaviors of middle school students. Which of the following research method choices (and the rationale for the choice) is the most appropriate?,Experiment-the most convenient and ethical way to study online bullying is to randomly assign half of the participants to a group who experiences the independent variable (online bullying).,"Correlation-it would be unethical to purposefully expose middle school students to bullying behaviors, so Professor Ek should examine variables that correlate with existing instances of online bullying.","Naturalistic observation-observing instances of online bullying by monitoring middle school students' social networking behavior would provide the most accurate data and not raise important privacy concerns, because social networks are considered ""public"" space.",Survey-self-reports about online bullying behaviors and responses to these behaviors would likely provide the most accurate descriptions of bullying and its impact.,B,False,0.006510332226753235,0.004474482033401728,0.9662190079689026,0.02272329293191433
"In the rock opera Tommy, Tommy becomes deaf and blind after witnessing a terrible murder, although there is nothing organically wrong with his ears or eyes. Tommy is suffering from",panic disorder,post-traumatic stress disorder,conversion disorder,obsessive-compulsive disorder,C,True,0.08742976188659668,0.06809036433696747,0.7320404052734375,0.11226204037666321
"The ""c"" in the word cat is best described as a",phoneme.,morpheme.,holophrase.,syllable.,A,False,0.0419653095304966,0.05388452485203743,0.8428958058357239,0.061059173196554184
"Xavier is beginning his first year of college. He is eager to find a few other freshmen to ""hang out"" with. Psychologists would say that Xavier is motivated by a(n)",fraternization need,assimilation need,attachment need,affiliation need,D,False,0.05654072389006615,0.1196967214345932,0.5364434719085693,0.287137508392334
Research indicates that a test participant exposed to a list of positive words and then asked to recall the words from that list a week later will be more likely to remember those words if he,is tested by a researcher who deliberately exhibits a positive attitude,is in a positive mood when initially exposed to the words,"considers himself a ""positive"" person, regardless of his mood during the experience",considers the initial testing experience positive,B,False,0.3250132203102112,0.08217621594667435,0.3682882487773895,0.22337810695171356
All of the following are characteristic of physiological arousal EXCEPT,dilation of the pupils,increase in salivation,increase in perspiration,increase in secretion of stress hormones,B,False,0.026057783514261246,0.06250937283039093,0.5930724143981934,0.31744879484176636
What color are the shortest electromagnetic waves humans can see?,green,violet,red,orange,B,False,0.059507306665182114,0.03185196593403816,0.7249473929405212,0.18329541385173798
One cause of the deinstitutionalization of many psychiatric patients in the mid-1900s was,an increase in government funding.,the movement for the rights of the mentally ill.,the creation of new medications.,an improvement in psychotherapy.,C,True,0.06776385754346848,0.1265995353460312,0.6429255604743958,0.16255703568458557
Which of the following would play a role in quickly alerting you to a gas leak in your car?,olfactory receptors,gustatory receptors,feature detectors,basilar membrane,A,False,0.06577497720718384,0.04520644247531891,0.6240556836128235,0.2601450979709625
