0,1,2,3,4,5,correct,choiceA_probs,choiceB_probs,choiceC_probs,choiceD_probs
What part of Phineas Gage's brain was damaged by his accident while laying the railroad track?,corpus callosum,temporal lobe,medulla oblongata,prefrontal cortex,D,True,0.23581741750240326,0.03616377338767052,0.16207478940486908,0.5656965970993042
"Janice often has feelings of hostility and contempt for her husband of forty years. However, instead of expressing these feelings, Janice goes overboard to dote on her husband. Janice is using which of the following defense mechanisms?",Rational philosophy,Reaction formation,Repression,Sublimation,B,False,0.006626632995903492,0.03365281969308853,0.7659346461296082,0.19365860521793365
"""Mommy gived me a cookie"" best illustrates a basic understanding of",phonemes,prelinguistic speech,holophrases,grammar,D,False,0.06986626982688904,0.04801833629608154,0.7511332035064697,0.13052736222743988
"A child is frightened by the sudden barking of a neighbor's dog. Once her mother picks her up, the child begins to calm down as which of the following biological processes occurs?",The parasympathetic nervous system resumes control and reverses the sympathetic responses.,The sympathetic nervous system resumes control and reverses the parasympathetic responses.,The autonomic nervous system resumes control and reverses the peripheral responses.,The peripheral nervous system resumes control and reverses the autonomic responses.,A,False,0.3312056362628937,0.0652182549238205,0.37530517578125,0.22763410210609436
"Because Jake, the team's starting, star center, is late to basketball practice, Coach Peterson sits him out for the first quarter of the next game. Jake is on time for the rest of the season. Coach Peterson has used",positive punishment.,negative reinforcement.,modeling.,omission training.,D,False,0.023774268105626106,0.03459135815501213,0.6131464242935181,0.32819366455078125
"When Jared saw shadows of people on the walls of his bedroom, his blood pressure increased and his breathing rate sped up. These physical reactions were most directly regulated by his",sensorimotor system,somatic nervous system,sympathetic nervous system,pineal gland,C,True,0.22200636565685272,0.07207491248846054,0.5325655937194824,0.17289873957633972
Which sentence most accurately describes how neurons communicate?,Neurons communicate through physical contact between dendrites of one cell and the next cell.,"Electricity passes between neurons, which carries messages between one neuron and another.","Chemicals travel from one neuron to another, influencing whether a neuron will fire or not.",Neurons send messages up the spinal cord to the cerebral cortex through neural reflexes.,C,True,0.2267831265926361,0.10712476819753647,0.37390217185020447,0.2911953032016754
Which of the following is an example of a person who suffers from anterograde amnesia?,A six-year-old child who can't remember events related to her second birthday party,A twenty-year-old woman who can't remember the details of a traumatic event that occurred six months ago,A thirty-six-year-old man who experiences damage to his hippocampus and can't transfer information into his long-term memory,A fifteen-year-old boy who fell off his bicycle without his helmet and can't remember the events right before his accident,C,True,0.013148409314453602,0.04589245840907097,0.921774685382843,0.019130824133753777
"Stella remembered the order of the planets from the Sun by recalling the sentence, ""My very educated mother just served us noodles."" For Stella, this sentence is a",chunking strategy,mnemonic device,peg system,acoustic encoding sequence,B,False,0.1313072144985199,0.0702836886048317,0.6668330430984497,0.1313072144985199
"Tina is a very good student: Her grades are high, she is involved in extracurricular activities, and typically she excels at anything she tries. Therefore, when she caused an accident her second day of driver's ed., her instructor was shocked. The instructor's disbelief is most probably a result of",modeling,accommodation,a halo effect,convergence,C,True,0.22560887038707733,0.17570437490940094,0.4776139557361603,0.12075971812009811
An individual with brain lesions in the hippocampus will most likely experience impairment to her,emotional regulation,motor coordination,speech production,learning,D,False,0.018120184540748596,0.015991006046533585,0.7704898715019226,0.19481034576892853
"Mr. Maji gives a test to his class of 25 students. All but three students score between 82 and 94. The other three students score 47, 55, and 62. These scores are potential",modes.,skewers.,outliers.,variances.,C,True,0.04372691363096237,0.04954909160733223,0.6840040683746338,0.2220636010169983
"A group of participants in a sleep study are to be deprived of sleep for four days. After their second sleepless night, participants may begin reporting which of the following?",Hunger,Thirst,Lack of coordination,Hallucinations,D,False,0.004834958352148533,0.013142779469490051,0.7175714373588562,0.26397979259490967
Which of the following models of personality is the least deterministic?,humanistic,biological,evolutionary,behaviorist,A,False,0.03208201751112938,0.028312278911471367,0.7301833033561707,0.20920102298259735
"The study of cognitive, behavioral, and social changes across the life span are most directly studied by which of the following?",Psychometricians,Occupational psychologists,Developmental psychologists,Social psychologists,C,True,0.013076737523078918,0.045642297714948654,0.9167500734329224,0.024430561810731888
For which of the following disorders might a psychiatrist prescribe a selective serotonin reuptake inhibitor such as Prozac or Paxil?,manic,depressive,dissociative identity,conversion,B,False,0.037741489708423615,0.01225286815315485,0.7580580711364746,0.1916671097278595
Approximately what percentage of participants in Milgram's obedience experiments thought they delivered the maximum amount of shock possible?,0,20,40,60,D,False,0.008032262325286865,0.05237692594528198,0.6380816102027893,0.30140841007232666
A psychologist focusing on whether development occurs in stages is most interested in which of the following controversies?,nature versus nurture,continuity versus discontinuity,stability versus change,subjectivity versus objectivity,A,False,0.05690382793545723,0.13650517165660858,0.78553307056427,0.02093374729156494
"When a person experiences a discrepancy between an attitude and a behavior, the person experiences",cognitive dissonance,dissociation,behavioral dysfunction,metacognition,A,False,0.030160291120409966,0.018293140456080437,0.5346038937568665,0.41634994745254517
Which of the following disorders responds best to cognitive behavioral therapy?,disorganized schizophrenia,bipolar disorder,dissociative identity disorder,major depressive disorder,D,False,0.04348355531692505,0.03386502340435982,0.7707644104957581,0.15177249908447266
The president of a company brought in an outside consultant to disagree with him about an important decision to be discussed at a meeting of his top level executives in order to avoid,the bystander effect,groupthink,social loafing,the mere exposure effect,B,False,0.027750283479690552,0.03144519403576851,0.3830808699131012,0.5573793649673462
Mary Ainsworth placed babies into a strange situation and observed the babies' reactions when the parents left and then returned. What developmental concept was Ainsworth studying?,parenting style,motor development,infant reflexes,attachment,D,True,0.010921858251094818,0.02968868985772133,0.1935945749282837,0.7656813859939575
"According to the Law of Effect, behaviors followed by negative consequences",occur more frequently,occur less frequently,will never be performed again,will be performed more forcefully,B,False,0.12972401082515717,0.2423563450574875,0.35262638330459595,0.2746257185935974
"Most mnemonic devices (like learning the notes on the staff by memorizing the sentence ""Every Good Boy Does Fine"" and using the first letter of each word) are examples of which memory enhancement technique?",semantic encoding,potentiation,recognition,chunking,D,False,0.07067511975765228,0.09074865281581879,0.5917555093765259,0.2466803938150406
Iconic memory refers to,visual sensory registries,olfactory sensory registries,frontal sensory registries,STM sensory registries,A,False,0.047626566141843796,0.019853705540299416,0.3519153594970703,0.5802103281021118
"According to Jean Piaget, egocentrism, animism, and trial-and-error learning are characteristic of the stage of development known as",preoperational,sensorimotor,concrete operational,adolescence,A,False,0.014816938899457455,0.03554398939013481,0.8089774250984192,0.14057917892932892
Which of the following is most likely to lead to a constructed memory?,brain injury,serial position effect,leading questions,proactive interference,C,False,0.022436615079641342,0.04749831557273865,0.3509677052497864,0.5786479115486145
"As an experiment, a group of newborn kittens was allowed to see through only one eye at a time. Each day one of the eyes would be covered, switching between the two eyes on subsequent days. Which of the following best describes the visual limitations experienced by these cats as adults?",They were unable to make use of interposition depth perception.,They were unable to maintain perceptual constancy.,They were unable to distinguish left from right monocular cues.,They were unable to use binocular cues for depth perception.,D,False,0.07148037105798721,0.10400332510471344,0.7684864401817322,0.05566897243261337
"Blinking, sneezing, flinching, and coughing are examples of the type of behavior called",instinct,reflex,habit,thought,B,False,0.1845581978559494,0.06789516657590866,0.3042850196361542,0.4427320957183838
Which of the following refers to the benefit of having an emotional release to reduce aggressive tendencies?,James-Lange theory of emotion,Counterconditioning,Catharsis hypothesis,Transference,C,True,0.01829954981803894,0.030170857906341553,0.5347912311553955,0.41649582982063293
A projective test with ambiguous pictures that are frequently used to assess achievement motivation is the,Thematic Apperception Test,Rorschach inkblot test,WAIS-R,MMPI-2,A,False,0.11335752159357071,0.04725443944334984,0.7391838431358337,0.10003765672445297
Which of the following is an example of an implicit memory?,describing the taste of the cake at your last birthday party,remembering how to tie a tie,recalling the name of your junior high school shop teacher,recognizing a celebrity,B,False,0.0240118857473135,0.0240118857473135,0.9010393619537354,0.050833165645599365
Which of the following is not one of the stages in the development of language that children of virtually every culture go through?,Babbling,Holophrastic speech,Telegraphic speech,Introductive speech,D,False,0.05489214137196541,0.03772677853703499,0.757762610912323,0.1492123007774353
"Madison is a fifth grader who tries to listen to the teacher, but has difficulty focusing. She looks around the classroom while the teacher is talking and then does not know what to do when others are starting their assignments. Her symptoms are characteristic of which of the following?",panic disorder,post-traumatic stress disorder,attention deficit hyperactivity disorder,bipolar disorder,C,True,0.07559764385223389,0.10999391227960587,0.6329712867736816,0.18134932219982147
"In the three-box information processing model, what is the first place memories are stored?",short-term memory,eidetic memory,semantic memory,sensory memory,D,False,0.20221033692359924,0.01880848966538906,0.5496646165847778,0.22913430631160736
What kind of personality theorist would be most interested in the results of the MMPI?,psychoanalytic,humanistic,behaviorist,trait,D,False,0.040606170892715454,0.059081628918647766,0.6351873874664307,0.264785498380661
Which neurotransmitter is most closely associated with both Parkinson's disease and schizophrenia?,acetylcholine,dopamine,serotonin,endorphins,B,False,0.050885286182165146,0.04490610584616661,0.7024496793746948,0.2012552171945572
What kinds of factors are ignored or de-emphasized when people commit the fundamental attribution error?,dispositional,situational,social,cognitive,B,False,0.015357039868831635,0.03251085430383682,0.7399436235427856,0.2119974046945572
Anorexia nervosa is a life-threatening illness that can lead to permanent physiological changes (such as brittle bones) and even death. Which of the following individuals would be the most likely to develop this illness?,"Maria, a 16-year-old Caucasian female, who is an A student and talented musician, but who feels that her life is out of control","Leticia, a 15-year-old African American female, who is an A student and exceptional athlete, plus an avid reader","Rosa, a 26-year old Hispanic female, who has just received her law degree, is struggling with debt from school, and having difficulty finding employment","Virginia, a 14-year-old Caucasian female, who is a C student, is sexually promiscuous, and is experimenting with drugs",A,False,0.0013007622910663486,0.01795646920800209,0.9803900122642517,0.00019947835244238377
Ben thinks students will answer questions printed on yellow paper more quickly than those printed on blue paper. All study participants will take three tests with 35 multiple-choice questions each. The independent variable in Ben's experiment is,the color of the paper,the number of questions answered correctly,how long it takes students to answer questions,the total number of questions answered,A,False,0.06325744837522507,0.049264948815107346,0.8732420802116394,0.014114643447101116
Which of the following is generally considered a disadvantage of longitudinal developmental research?,I only,II only,III only,I and II only,D,False,0.0561981126666069,0.043767135590314865,0.5331928730010986,0.3664577305316925
Dieters often have difficulty losing additional weight after reaching a specific plateau because their bodies function at a lowered metabolic rate according to,VMH theory,opponent process theory,set point theory,the law of effect,C,True,0.054235588759183884,0.037275537848472595,0.4541090130805969,0.4541090130805969
Delia was accepted to both Harvard University and Yale University and is having difficulty choosing which school to attend. With which of the following conflicts is she faced?,frustration-aggression,intrinsic-extrinsic,approach-avoidance,approach-approach,D,False,0.044222719967365265,0.12020980566740036,0.6104758381843567,0.2245815247297287
All of the following are positive symptoms of schizophrenia EXCEPT,auditory hallucinations,visual hallucinations,paranoid delusions,flat affect,D,True,0.05264803767204285,0.024869173765182495,0.09835948795080185,0.8235539197921753
"The decision in Tarasoff v. Regents of the University of California (1974, 1976) established which of the following principles regarding confidentiality in counseling relationships?",Duty to warn and protect,Responsibility to maintain privacy,Need to obtain informed consent,Need to maintain accurate records,A,False,0.12282275408506393,0.07449577003717422,0.7067962288856506,0.09565446525812149
"A person suffering from a skin rash finds her pain is temporarily relieved by vigorous scratching. She does not perceive the pain from the rash while she is scratching, but the pain returns soon after she stops scratching. Which concept best explains this temporary pain relief?",opponent-process theory,amplitude and frequency theories,transduction theory,gate-control theory,D,False,0.03462987765669823,0.06469712406396866,0.47805070877075195,0.42187824845314026
Which of the following accurately summarizes a depressed person's view according to Aaron Beck's negative triad theory?,"Depressed individuals cope with the three primary stresseschange, death, and monetary instabilitythrough withdrawal.","Depressed individuals believe that when they are in a group, at least three individuals will view them negatively.","Depressed individuals hold a negative view of themselves, the world, and their futures.","Depressed individuals view the world in three stagesseparation anxiety, development of an external locus of control, and failure to achieve.",C,True,0.018049467355012894,0.0490635447204113,0.8696720600128174,0.06299883872270584
Use of brainstorming to solve a problem best encourages which of the following?,divergent thinking,convergent thinking,deductive reasoning,groupthink,A,False,0.16731774806976318,0.10148333013057709,0.4548167288303375,0.2758603096008301
"Shannon forgot her pillow when she went camping, so she complained about having to sleep with her head flat on the ground the whole night. Her failure to fold up her jeans and sweater to use as a pillow-substitute best illustrates the effects of",the availability heuristic,functional fixedness,confirmation bias,the representativeness heuristic,B,False,0.07574550807476044,0.05205908045172691,0.43588533997535706,0.43588533997535706
Which of the following is NOT an anxiety disorder?,panic disorder,hypochondriasis,agoraphobia,post-traumatic stress disorder,B,False,0.0037557738833129406,0.0015656393952667713,0.18096330761909485,0.8110212683677673
Which of the following statements is true about the relationship between reliability and validity?,"Reliability and validity are mutually exclusive: a test can be reliable or valid, but it can't be both.","If a test is reliable, then it is valid, but if a test is not reliable, it cannot be valid.","Validity is a concept related to achievement tests, and reliability is the corresponding concept related to aptitude tests.",A test can be reliable but not valid.,D,True,0.12288982421159744,0.09570668637752533,0.2947973608970642,0.4860386848449707
Which of the following structures in the eye is most specifically responsible for color vision?,rods,optic nerve,cornea,cones,D,False,0.056162022054195404,0.04373902827501297,0.532850444316864,0.36622241139411926
Neural transmission is often described as an electrochemical process. Which of the following is most directly involved in the electrical aspect?,the synapse,terminal buttons,hormones,myelin,D,True,0.07321285456418991,0.02693350426852703,0.4213108718395233,0.4774077534675598
Which of the following LEAST influences sexual behavior?,hypothalamus,pituitary,gonads,reticular formation,D,True,0.05243995413184166,0.015024297870695591,0.20740404725074768,0.7239112257957458
Which of the following is not considered a primary facial expression?,surprise,disgust,anger,love,A,False,0.062252700328826904,0.01573994755744934,0.45998871326446533,0.45998871326446533
"When a child is enrolled in elementary school, the parents are frequently involved in the child's education as partners, collaborators, and problem solvers. During middle and high school, the parents are more typically described as",partners,collaborators,supporters,audience,D,False,0.0164497047662735,0.0835384950041771,0.7925912141799927,0.10726555436849594
"Carlotta is a well-adjusted, socially competent adolescent. Which of the following most likely represents her family's parenting style?",Minimal supervision,Permissive,Authoritarian,Authoritative,D,False,0.015421231277287006,0.041919250041246414,0.841970682144165,0.1005590632557869
"Max was typically out of control whenever he attended preschool. Teachers tried time-outs and other punishments to no avail. His parents and the school decided to work with Max by giving him a sticker each time he behaved for a full hour. Once he accumulated ten stickers, he could present them to his parents who would give him a reward. The method the school and parents chose to employ is referred to as",negative reinforcement,a token economy,a point value system,negative punishment,B,False,0.22988927364349365,0.13943488895893097,0.2951836585998535,0.3344869017601013
Which technique controls for both experimenter and subject bias?,demand characteristics,double blind study,single blind study,Hawthorne effect,B,False,0.08122364431619644,0.09203846007585526,0.4124877452850342,0.4124877452850342
The staggering and slurred speech of a person who has consumed too much alcohol is most likely the result of altered functioning in the,limbic system,thalamus,sensorimotor cortex,cerebellum,D,False,0.17499417066574097,0.09366762638092041,0.6107896566390991,0.12027160078287125
The field of psychology arose out of which of the following?,Biochemistry,Physics,Philosophy,Cross-cultural anthropology,C,True,0.023458857089281082,0.01422851625829935,0.8802871108055115,0.08187945187091827
Which of the following is an example of imprinting?,A mother eagle will fly under her young while they are learning to fly in case they begin to fall.,"A newborn gosling will ""attach"" to the first moving object it sees, usually its mother.",An infant who is left by its primary caregivers for significant periods of time develops an indifference to their presence.,A mother cat teaches her kittens how to clean themselves.,B,False,0.051801975816488266,0.013097589835524559,0.9182119369506836,0.016817638650536537
For which of the following would drive-reduction theories not provide a reasonable explanation?,"In the middle of his five-mile race, Jerome grabs water from the water station to quench his thirst.",Ernest gobbles a few cookies on his way to class because he did not have time for lunch.,Tish decides to skip lunch because she is still full from eating a very large breakfast.,Kezia is very full after eating dinner but decides to order the strawberry cheesecake anyway.,D,False,0.013785193674266338,0.01770053803920746,0.8528597354888916,0.11542201042175293
Dr. Scarlett conducted experiments in which she electrically stimulated parts of a cat's brain. A cat that became terrified in the presence of a mouse was most likely stimulated in the,limbic system,thalamus,medulla,cerebellum,A,False,0.07794952392578125,0.06879021227359772,0.7395644783973694,0.11341589689254761
Which of the following illustrates why most people can detect the difference between Coke and Pepsi most of the time?,Subliminal perception,Absolute threshold,Signal detection theory,Difference threshold,D,False,0.061080969870090485,0.0888722836971283,0.4513307213783264,0.3982979655265808
A clinical psychologist who is working with an aggressive child seeks to understand the child's behavior in light of the dynamics of the entire family. Which of the following best identifies the approach the psychologist has chosen?,Cognitive social approach,Behavioral approach,Psychoanalytic approach,Systems approach,D,False,0.01216745562851429,0.013787533156573772,0.5173733830451965,0.45658040046691895
Why can experiments determine causal relationships when no other research method can?,Experiments are more precise than the other research methods.,Experiments isolate the effects of independent variables on dependent variables.,Experiments typically involve more participants than other research methods do.,"Experiments take place in more realistic, real-life settings.",B,False,0.13007628917694092,0.06144368648529053,0.45401087403297424,0.35358402132987976
What type of psychologist would assert that a key motivation for people is the desire to spread their genetic material?,cognitive,evolutionary,humanistic,psychodynamic,B,False,0.013445188291370869,0.06828030198812485,0.6478254795074463,0.27005383372306824
"In a team tug of war, Ty did not pull as hard as he would have if he were pulling alone against one competitor. His behavior exemplifies",deindividuation,groupthink,social loafing,bystander effect,C,True,0.034175384789705276,0.026615817099809647,0.6864309906959534,0.25252386927604675
What is the major difference between classical and operant conditioning?,Operant conditioning was established well before classical conditioning.,"Classical conditioning involves pairing stimuli, and operant conditioning involves pairing a response with a stimulus.","Operant conditioning is used to train organisms to perform specific acts, and classical conditioning is used to get organisms to stop performing specific acts.",Classical conditioning is more difficult to use but more effective than operant conditioning.,B,False,0.09415856748819351,0.07333077490329742,0.290028840303421,0.5418452024459839
"A listener-sponsored radio station wants to estimate the amount of money the typical supporter contributes during a fund-drive. In a sample of 30 supporters, it was discovered that 22 of them gave $60, six of them gave $1,000, and two of them gave $10,000. Based on this sample, which of the following measures of central tendency would provide the most useful information to the radio station?",Median,Mode,Histogram,ANOVA,B,False,0.04010758921504021,0.035394828766584396,0.29635724425315857,0.6273882985115051
"Young Tina had never seen the space shuttle until her parents pointed out a picture of it ready to launch. When she next saw a picture of it flying, she had difficulty recognizing it. Which concept best explains this problem?",autokinetic effect,dishabituation,summation,shape constancy,D,False,0.07796894758939743,0.12854905426502228,0.7397488355636597,0.05358722805976868
"Dr. Ramchandran found that his patients who brushed their teeth after lunch had 1/20 the number of cavities in their teeth as those who didn't. After interviewing the dentist, a local newswriter reports that brushing teeth after lunch prevents cavities. Based on the dentist's research, which of the following statements is true?","If at least 100 patients were studied, the writer's statement is justified.","If a minimum of 500 patients were studied, the writer's statement is justified.",At least 100 of the patients needed to have brushed their teeth after lunch for the writer's statement to be justified.,"No matter how many participants, the writer's statement is not justified.",D,False,0.04298647120594978,0.09100235998630524,0.7619534134864807,0.10311917960643768
