0,1,2,3,4,5,correct,choiceA_probs,choiceB_probs,choiceC_probs,choiceD_probs
Which of the following terms refers to the body's tendency to maintain a relatively constant state that permits cells to live and function?,Perceptual constancy,Set point,Homeostasis,Kinesthesia,C,True,0.10000767558813095,0.04724028334021568,0.8373540043830872,0.015336673706769943
"Joey, a 25-year-old convict, has a history of conduct disorder in elementary school and bullying in junior high. By high school, he was mugging peers and taking whatever he wanted from elderly shoppers without caring if he hurt anyone. Joey would most likely be diagnosed with",antisocial personality disorder,dissociative identity disorder,paranoid schizophrenia,somatoform disorder,A,False,0.20843951404094696,0.12642493844032288,0.5665972828865051,0.09845983237028122
"An ""A+"" course grade is which kind of reinforcer?",primary,secondary,continuous,partial,B,False,0.01833643950521946,0.08217821270227432,0.7796851992607117,0.1195686012506485
Which of the following explanations of why a 17-year-old drives his car at or below the speed limit best illustrates Kohlberg's conventional level of morality?,"""I don't want to get any tickets.""","""It's the law.""","""I want my parents to approve of my driving.""","""I don't want to crash my car.""",B,False,0.13253942131996155,0.033511217683553696,0.7627118229866028,0.07094324380159378
The obsessive fear of being in places or situations from which escape might be difficult is known as,claustrophobia,arachnophobia,social phobia,agoraphobia,D,True,0.014542782679200172,0.014542782679200172,0.42500239610671997,0.5457139015197754
Which of the following psychologists would most likely agree with the following statement: Behavior is a result of the combination of reinforcers and punishers?,William James,Wilhelm Wundt,B. F. Skinner,Carl Rogers,C,True,0.10060230642557144,0.04193728417158127,0.7433561086654663,0.11399735510349274
Free association and dream interpretation frequently characterize which of the following treatments?,psychoanalysis,behavior therapy,humanistic therapy,cognitive therapy,A,False,0.03229966387152672,0.06837838888168335,0.7351369261741638,0.1640312224626541
"Which is likely to increase as a normal, healthy individual ages from 25 to 75 years of age?",visual acuity,crystallized intelligence,ability to reason speedily,fluid intelligence,B,False,0.029198341071605682,0.070043183863163,0.3139117658138275,0.5864643454551697
"A doctor who smokes cigarettes knows that it is unhealthy, but thinks that he can keep smoking, since he eats healthily. Which concept best explains this thought process?",reaction formation,affective retraining,cognitive dissonance,obsessive compulsion,C,True,0.009626255370676517,0.08059964329004288,0.866527795791626,0.04314187914133072
"According to trait theorists, such as Hans Eysenck, the basis for personality is",conflicting sources of psychic energy,the distinctive human ability to act purposefully and to shape our own destiny,"the interactions between thought and the environment, which influence behavior","stable sources of individual differences that characterize an individual, based on an interaction of nature and nurture",D,False,0.032514214515686035,0.21201930940151215,0.7400200963020325,0.01535862684249878
"Tony got accepted to the college he wants to attend, is going to the prom with a girl he really admires, and was hired for the summer job he sought. He has high",self-efficacy,self-doubt,self-handicapping,introversion,A,False,0.08223768323659897,0.05652107670903206,0.607658863067627,0.2533099055290222
"At the outset of a study on eating habits, a researcher asks participants a variety of questions, including whether they typically eat breakfast. Whether or not a person eats breakfast is a(n)",categorical variable,continuous variable,dependent variable,independent variable,A,True,0.48857083916664124,0.13997790217399597,0.2963331937789917,0.0749247670173645
Cyan has come up with a test to identify people with the potential to be great civil rights lawyers. Such a test would be classified as a(n),speed test.,achievement test.,EQ test.,aptitude test.,D,False,0.016835473477840424,0.013111479580402374,0.6317464709281921,0.3381495475769043
An American teenager's prototype of a chair is most likely to include,a desk and/or table.,four legs and a seat.,a feeling of anxiety associated with school.,"an armchair, a chairlift, and a wheelchair.",B,False,0.03781302645802498,0.03336987644433975,0.5219927430152893,0.4065283536911011
Loss of the ability to understand language results from loss of tissue in which of the following lobes?,right frontal,right temporal,right parietal,left temporal,D,True,0.011520836502313614,0.09646277874708176,0.33668822050094604,0.5551050305366516
Knowledge of different categories of trees and where they grow best is an example of what kind of long-term memory?,episodic memory,semantic memory,procedural memory,eidetic memory,B,False,0.3402736186981201,0.06700383871793747,0.20638638734817505,0.38558050990104675
Which of the following most accurately describes the firing of a neuron?,It occurs gradually as the neuron reaches hyperpolarization.,"It has an all-or-none quality: it either happens, or it does not.",Its strength diminishes as it travels along the soma.,It occurs only in the post-synaptic neuron.,B,False,0.05452237278223038,0.06178193911910057,0.7526581287384033,0.13079236447811127
"A participant in a single-trial free-recall task is presented with a list of words, one at a time, in the following order: house, flower, dog, table, license, water, computer, salad. In accord with the serial position curve, which of the following words is the participant most likely to forget?",House,Computer,Flower,License,D,False,0.03601149097084999,0.04623967036604881,0.819617748260498,0.09788937866687775
Jyoti notes the behavior of people as they wait in line for tickets to rock concerts. Which of the following research methods is she using?,naturalistic observation,survey,controlled experiment,quasi-experiment,A,False,0.039412327110767365,0.03478125482797623,0.698600172996521,0.2268022745847702
The superintendent of a large school district asks the school psychologist to predict students' grade point averages (GPAs) for the first year of high school. The school psychologist has included achievement and aptitude scores as predictor variables for firstyear high school GPA in a regression analysis and is considering whether to also administer a school interest inventory and include those scores. The major concern of the school psychologist when making this decision should be which of the following?,The intercorrelation of the aptitude and achievement test scores,The degree to which the school interest inventory score raises the multiple correlation when it is included as a predictor variable of first-year high school GPA,The zero-order correlation of first-year high school GPA and the school interest inventory score,The difference in the correlations of the school interest inventory scores with first-year high school GPA and the aptitude and achievement test scores with first-year high school GPA,B,False,0.050975099205970764,0.12228289246559143,0.7036895155906677,0.12228289246559143
"Collective unconscious, archetypes, and individuation are personality concepts most closely associated with",Sigmund Freud,Carl Jung,B. F. Skinner,Karen Horney,B,False,0.062388237565755844,0.04287876561284065,0.8612430691719055,0.033394016325473785
"According to Whorf's linguistic relativity hypothesis,",we have an innate language acquisition device,apes do not have language because they don't use proper syntax,we tend to observe and imitate models,language determines the way we think,D,True,0.24025078117847443,0.06883300840854645,0.11348643153905869,0.5763316750526428
"When a 17-year-old student is failing at school, which society would most likely hold the parents accountable?",United States of America,Canadian,Japanese,English,C,True,0.03157590329647064,0.03157590329647064,0.6342189908027649,0.2995838522911072
"In most people, the left hemisphere of the brain is dominant for",language,logic,analytical reasoning,mathematical reasoning,A,False,0.12282198667526245,0.09565386921167374,0.7067918181419373,0.07449530810117722
"Jeanette locked the front door and then checked it by turning the knob. She checked it a second time. After walking halfway down the path to the street, Jeanette went back to the door and checked to make sure that it was locked. Her behavior appears to be",psychotic,schizophrenic,obsessive,compulsive,D,False,0.024701464921236038,0.014982195571064949,0.8180001378059387,0.14214710891246796
"Aisha is a beautiful, black teenager. If she is typical, she most likely believes that",white teenagers are superior to black teenagers,Asian teenagers are superior to black teenagers,Hispanic teenagers are superior to black teenagers,black teenagers are superior to white teenagers,D,False,0.049869146198034286,0.016190141439437866,0.883951723575592,0.049869146198034286
Functionalists such as William James were mainly interested in,the purpose of behavioral acts,identifying the smallest unit of behavior,the basic elements of consciousness,teaching introspection,A,False,0.11446764320135117,0.06942813098430634,0.7464227676391602,0.06942813098430634
What kind of therapy involves both behavioral and cognitive interventions?,counterconditioning,symptom substitution,primary preventions,systematic desensitization,D,True,0.09545012563467026,0.09545012563467026,0.25946035981178284,0.5492776036262512
"Georgia works in the local hospital because she wishes to help others, while Kathy works in the hospital strictly to make money. Their individual motivations demonstrate the difference between",primary and secondary drives,positive and negative loci of control,sympathetic and autonomic motivation,intrinsic and extrinsic motivation,D,False,0.02166520617902279,0.04047593101859093,0.8129808306694031,0.12467465549707413
Which of the following reinforcement schedules results in maintenance of behavior that is LEAST resistant to extinction?,continuous,fixed ratio,fixed interval,variable ratio,A,False,0.017408020794391632,0.11351455748081207,0.7402079105377197,0.12862883508205414
"According to gate-control theory, which condition tends to close the gate?",anxiety,depression,focusing on the pain,electrical stimulation,D,True,0.021561792120337486,0.03137222304940224,0.23181110620498657,0.7140284776687622
Knowledge of different categories of trees and where they grow best is an example of what kind of long-term memory?,episodic memory,semantic memory,procedural memory,eidetic memory,B,False,0.3284182548522949,0.07328001409769058,0.17578962445259094,0.4216974079608917
Which of the following is the most reliable indicator of emotions across all cultures?,hand gestures,facial expressions,voice intonation,body posture,B,False,0.15323016047477722,0.32438820600509644,0.41652271151542664,0.10531342774629593
"After taking AP Psychology and doing well in the class and on the exam, Donald goes to college. If Donald is interested in psychology and has high achievement motivation, as a first-year student, he is most likely to",take an introductory psychology class in which he knows that he will excel.,enroll in an upper-level graduate seminar in which he will be exposed to a lot of new information but is likely to struggle to pass.,avoid psychology classes since he has already mastered the material.,sign up for an upper-level undergraduate course in which he will have to work hard to succeed and will learn new things.,D,False,0.1929619461297989,0.1170373409986496,0.40850043296813965,0.28075799345970154
"As part of her campaign for school president, Edy personally gives out cookies that say ""Vote for Edy"" on them. Which of the following is one reason that this approach might improve Edy's chances in the election?",foot-in-the-door,mere-exposure effect,central route of persuasion,pluralistic ignorance,B,False,0.07994585484266281,0.07055196911096573,0.7585051655769348,0.09059052169322968
"A pencil and paper personality test that places a person in one of several personality categories (such as extrovert/introvert, etc.) is based on which personality theory?",psychodynamic,trait,biological,behaviorist,B,False,0.03356357663869858,0.24800315499305725,0.5250226855278015,0.19314506649971008
Some contemporary intelligence researchers like Howard Gardner and Robert Sternberg complain that schools focus too much on,nonessential subjects like art and music.,encouraging creative thought.,the environmental factors that influence the expression of intelligence.,traditional subjects and methods.,D,False,0.0806402713060379,0.06280270963907242,0.7650936245918274,0.09137739986181259
The part of the neuron that directs synthesis of neurotransmitters and proteins is the,cell body,dendrite,axon,axon terminal,A,False,0.108782097697258,0.05822685733437538,0.12326624989509583,0.7093483209609985
Research has shown a possible connection between the neurotransmitter acetylcholine and which of the following mental disorders?,Parkinson's disease,Alzheimer's disease,Schizophrenia,Mania,B,False,0.01675581745803356,0.035472068935632706,0.8073405027389526,0.14029473066329956
"Which of the following kinds of brain scans would be most useful in disproving the statement: ""Most people only use 10 percent of their brains""?",CAT,MRI,EEG,PET,D,False,0.03625847399234772,0.05275576189160347,0.642696738243103,0.26791587471961975
"Jonathan's IQ score is in the 97th percentile. Of the following, which score is most likely his?",85,100,130,150,C,True,0.03238743543624878,0.07769341766834259,0.6505190134048462,0.23931260406970978
A doctor examining a car crash victim in order to determine whether the crash caused structural damage to the brain would use what kind of brain scan?,MRI,PET,EEG,fMRI,A,False,0.018359912559390068,0.03430083394050598,0.473508358001709,0.473508358001709
A famous character in a Shakespearean play keeps washing her hands to get them clean of blood that is no longer on them. The repeated washing of her hands is,a delusion,a compulsion,a hallucination,an obsession,B,False,0.011179217137396336,0.03038826584815979,0.5386448502540588,0.4194970428943634
The tendency of young children learning language to overuse the rules of syntax is referred to as,overconfidence,confirmation bias,overgeneralization,overjustification,C,True,0.020571265369653702,0.05591849237680435,0.6011804938316345,0.3217887282371521
The relaying of sensory information to the cerebral cortex is the primary function of the,hypothalamus,cerebellum,reticular formation,thalamus,D,True,0.32603219151496887,0.03436354175209999,0.030325716361403465,0.6091083288192749
"Tired after a long, hard day at school, Cyrus decides to take a nap. An hour later, his Dad wakes him to let him know it's time for dinner. Cyrus feels worse than when he went to bed and can hardly drag himself to the table. An EEG of Cyrus right before he was awoken would most likely have shown a preponderance of",alpha waves.,beta waves.,delta waves.,sleep spindles.,C,True,0.0690455436706543,0.041878242045640945,0.7423095703125,0.14616940915584564
"According to Adler, firstborn children are more likely than subsequent children in a family to be",sociable,funny,responsible,followers,C,True,0.0073962025344371796,0.006527125369757414,0.8548847436904907,0.1311008334159851
Which term describes the phenomenon of like-minded groups taking more extreme positions than the individuals that comprise the group?,social facilitation,deindividuation,groupthink,group polarization,D,False,0.02393336221575737,0.02712005376815796,0.8980928063392639,0.0506669320166111
Which kinds of motivations best encourage positive behaviors to persist over long periods of time?,primary drives,secondary drives,achievement motivation,intrinsic motivation,D,False,0.02628171816468239,0.012414604425430298,0.5981691479682922,0.3628079295158386
One's ability to make inferences about the behavior of a population from the behavior of a sample of that population is referred to as,reliability,external validity,internal validity,inter-rater reliability,B,False,0.1278720498085022,0.21082539856433868,0.5730827450752258,0.08788509666919708
"Of the following theories, the presence of Hilgard's ""hidden observer"" best supports",dissociation,opponent process,activation-synthesis,diathesis-stress,A,False,0.03574168682098389,0.04050063714385033,0.8134770393371582,0.1100921481847763
The smallest unit of language that carries meaning is a,concept,word,phoneme,morpheme,D,False,0.02618267387151718,0.03809557110071182,0.5258930921554565,0.4095659554004669
Which of the following are included in the peripheral nervous system?,"brain, spinal cord, cranial nerves","cranial nerves, spinal nerves, autonomic ganglia","spinal cord, spinal nerves, sense organs","medulla, pons, thalamus",B,False,0.13335706293582916,0.05559149757027626,0.6772431135177612,0.13335706293582916
Receptors that respond to gravity and keep you informed of your body's location in space are located primarily in the,cochlea of the ear,macula of the eye,olfactory mucosa,muscles and joints of the skeleton,D,False,0.17360348999500275,0.2525915801525116,0.5347363948822021,0.03873617574572563
"In a study of brain development, two groups of rats were reared in a laboratory setting. In Group I, each rat was raised in isolation with no toys, while in Group II, rats were divided into small groups and given toys to play with. Which of the following statements most accurately reflects the probable findings of this study?",The rats raised in Group I will have forebrains that weigh more than those of the rats raised in Group II.,The rats raised in Group I will have forebrains that weigh less than those of the rats raised in Group II.,The brains of the rats raised in Group I will not be noticeably different from the brains of the rats raised in Group II.,"The brains of the rats raised in Group I will consist of more white matter, while the brains of the rats raised in Group II will consist of more gray matter.",B,False,0.045323193073272705,0.03115014173090458,0.6256673336029053,0.2955443263053894
Counterconditioning lies at the heart of which therapeutic approach?,flooding,systematic desensitization,REBT,token economies,B,False,0.03624290972948074,0.05273312330245972,0.5669345259666443,0.3438631594181061
"According to Abraham Maslow, esteem needs must at least be partially met before one is prompted to satisfy",belongingness needs,physiological needs,self-actualization needs,love needs,C,True,0.06467936187982559,0.030552368611097336,0.6136607527732849,0.28987282514572144
"Which of the following most accurately explains why a pool with water temperature of 82 degrees may feel cool to a person who has been sunbathing, yet warm to a person who has been inside in the air conditioning?",Sensory restriction,Perceptual constancy,Relative clarity,Sensory adaptation,D,False,0.030663268640637398,0.04461478814482689,0.6978927254676819,0.22657260298728943
Research indicates that which of the following factors most influence a person's sexual orientation?,parenting style,masculine/feminine personality traits,hormones released in the womb,sexual orientation of parents,C,True,0.0365997813642025,0.017288513481616974,0.735126256942749,0.21061719954013824
"Although Andy wanted to cut class to get to the Yankee opener, he came to class to take a quiz and review for an exam. According to Freud, this behavior evidences a strong",egocentricity,super id,id,superego,D,False,0.04108494520187378,0.04655534401535988,0.8252131938934326,0.08697682619094849
The case study of Phineas Gage's brain injury was significant for which of the following reasons?,Gage's accident was one of the first to be treated with drugs that alter the neurotransmitters in the brain.,It was one of the first well-documented examples of a specific brain area being associated with a set of physical and emotional changes.,This accident provided psychiatrists with one of the first opportunities to treat a brain-damaged patient with psychotherapeutic techniques.,The CAT scan was used for the first time in the Phineas Gage case to document the extent of brain injury.,B,False,0.11182110756635666,0.046613968908786774,0.7291651964187622,0.11182110756635666
Physiological reactions to surprise or shocks are most controlled by which of the following parts of the nervous system?,somatic nervous system,sympathetic nervous system,endocrine system,serotonin system,B,False,0.03888314962387085,0.02672397345304489,0.3255646526813507,0.6082348227500916
The most common somatic nervous system neurotransmitter to cause muscle contractions is,acetylcholine,dopamine,endorphins,epinephrine,A,False,0.11827465146780014,0.15186765789985657,0.3643115758895874,0.3643115758895874
"Although Jen is a very bright four-year-old, she doesn't think her mother's sister has any sisters. This lack of understanding reflects",conservation,introspection,transposition,egocentrism,D,False,0.0546673983335495,0.04257501661777496,0.5877299308776855,0.3145892024040222
"A 10-year-old student who was born in a non- English-speaking country has been referred as a possible candidate for special education services on the basis of low scores achieved on the school district's group achievement test. The student achieved high scores on the district's English fluency test. Of the following approaches to diagnostic assessment, the most appropriate is one that",uses an interpreter who is fluent in the language of the country in which the student was born,uses the results of at least two Englishlanguage intelligence tests,accounts for sociocultural and adaptive behavior in the process of identifying skills and abilities,includes parent interviews and classroom observations as well as the results of an intelligence test,C,True,0.17587465047836304,0.22582753002643585,0.4219013452529907,0.17587465047836304
An action potential involves the movement of,glucose into the axon,fats out of the axon terminal,molecules in the synaptic gap,sodium ions into the axon,D,False,0.38307103514671326,0.08547469973564148,0.298335999250412,0.23234432935714722
"After dealing kindly with several customers who acted very rudely toward her, the clerk was impatient with her next customer. The tendency of that customer to think that the clerk is a very impatient person rather than just having a bad day exemplifies",stereotyping,the fundamental attribution error,the mere exposure effect,the reciprocity norm,B,False,0.09499742835760117,0.10764617472887039,0.6194609999656677,0.17747856676578522
Which of the following has been linked to a deficit of dopamine?,major depressive disorder,autism,Parkinson's disease,Alzheimer's disease,C,True,0.029059935361146927,0.05429110303521156,0.5150996446609497,0.40116000175476074
Albert Bandura's work evidenced that children who witnessed aggressive behavior on the part of adults would be likely to imitate the aggressive behavior later on. This phenomenon is known as,instrumental learning.,modeling.,the copycat effect.,thanatos.,B,False,0.23182106018066406,0.18054243922233582,0.49076518416404724,0.09663739055395126
"If a distribution of scores includes one or more outliers, which of the following measures of central tendency should be used?",standard deviation,range,median,mean,C,True,0.0756627544760704,0.024564100429415703,0.7178682684898376,0.18150551617145538
Probabilistic reasoning from specific observations to general propositions is known as,deductive reasoning,inductive reasoning,intuitive reasoning,statistical reasoning,B,False,0.050320129841566086,0.050320129841566086,0.47742411494255066,0.42132529616355896
Which of the following is a common way to categorize personality traits?,the Big Five,Erikson's 8 traits,Piaget's 4 stages,the Nine Defense Mechanisms,A,False,0.18427664041519165,0.07681792974472046,0.5009158253669739,0.2366158813238144
"The more difference shown by the behavior of identical twins raised apart, the more the differences in their behavior can be attributed to their",heritability,genetic traits,mutations,environments,D,False,0.2305850237607956,0.13985688984394073,0.5531447529792786,0.07485999912023544
Piaget proposed that children develop knowledge by,constructing reality out of their own experiences,participating in traditional learning environments,responding to physiological changes,modeling various cultural influences,A,False,0.22198337316513062,0.0816631093621254,0.6034133434295654,0.09253643453121185
"Which of the following accomplishments accurately reflects why Wilhelm Wundt is sometimes referred to as the ""father of psychology?""",He founded the first psychological laboratory in the late nineteenth century.,He developed psychoanalytical theory through his work in clinical environments.,He conducted experiments throughout the nineteenth century that led to the belief that all behavior is learned.,His research demonstrated that psychology should be free from all philosophical questions.,A,False,0.20260293781757355,0.06577553600072861,0.7071536779403687,0.024197468534111977
The fact that people's ears are located on opposite sides of their heads is most adaptive because it helps us,sense a greater range of frequencies.,gauge the intensity of a stimulus.,identify the origin of a sound.,respond to noises behind us.,C,False,0.3034835755825043,0.1840721070766449,0.3034835755825043,0.20858101546764374
"According to researchers Darley and Latanne, bystander intervention decreases when a large number of people witness a crime. What social psychology concept could best explain this phenomenon?",Social loafing,Prejudice,Conformity,Diffusion of responsibility,D,False,0.07278336584568024,0.09345569461584091,0.6094076633453369,0.22418858110904694
