0,1,2,3,4,5,correct,choiceA_probs,choiceB_probs,choiceC_probs,choiceD_probs
Cognitivists claim that classical conditioning results from,an association between the unconditioned stimulus and the unconditioned response,an association between the unconditioned stimulus and the conditioned stimulus,an association between the conditioned stimulus and the unconditioned response,an expectation of what is coming following the conditioned stimulus,D,False,0.5792137384414673,0.14644816517829895,0.24145221710205078,0.03267700597643852
A doctor suspects that her patient's language processing area is in the right hemisphere. This would most likely be corroborated by the use of,CAT,MRI,PET,MMPI,C,True,0.023052413016557693,0.020343681797385216,0.7633910179138184,0.19301548600196838
Mechanical energy is transduced to electrochemical energy by,glandular effectors,muscular effectors,pressure receptors,rods and cones,C,True,0.0619884692132473,0.03318003565073013,0.7551741600036621,0.14870259165763855
"David collected data on 15 research participants. Their scores were: 42, 38, 14, 13, 12, 12, 11, 11, 11, 10, 10, 10, 9, 9, 9. Which of the following statistics best reflects the central tendency of this data set?",standard deviation,correlation coefficient,mode,median,D,False,0.05707413703203201,0.07328464835882187,0.6136048436164856,0.25578853487968445
The smallest units of meaning in a language are,phonemes,phenotypes,semantics,morphemes,D,False,0.017140762880444527,0.013349239714443684,0.8258882164955139,0.1435178518295288
"After a neuron has fired,",a resting potential returns,a graded potential is formed,an action potential occurs,hyperpolarization results,C,True,0.03894096612930298,0.07275129854679108,0.6902450919151306,0.1977585405111313
The rules that govern the placement of words and phrases in a sentence are called,semantics,grammar,syntax,phonemes,C,True,0.293396919965744,0.15704406797885895,0.4268900156021118,0.12230603396892548
"Which schedule of reinforcement is followed by Soledad, who answers every e-mail message her friend sends?",fixed ratio,fixed interval,variable ratio,continuous,D,True,0.1179598718881607,0.24972105026245117,0.2203780561685562,0.4117203950881958
Learned helplessness is an example of the power of,expectation,positive reinforcement,negative reinforcement,classical conditioning,A,False,0.06352648884057999,0.03853076323866844,0.5319007635116577,0.36556971073150635
"After Suzy decided to go to the prom with Dylan, Max was unconsciously furious. Max then channeled all his energies into his artwork. Which defense mechanism is Max using?",displacement,sublimation,rationalization,repression,B,False,0.013297852128744125,0.02484365738928318,0.7260380983352661,0.2357100546360016
Kohler's studies with apes are seen as demonstrating,the apes' ability to communicate.,that apes are able to use objects from their natural environment as tools.,latent learning in primates.,that learning can occur via insight.,D,False,0.0288945734500885,0.03710136562585831,0.7452008724212646,0.1884162873029709
An artist doing a pencil drawing could use which of the following techniques to add depth to her or his drawing?,retinal disparity,convergence,closure,linear perspective,D,False,0.1498086154460907,0.16975542902946472,0.4614430367946625,0.21797026693820953
The role of the outer ear is to,transduce sound waves to stimulate the ossicles,conduct sound by exciting the cilia in the inner ear,protect the eardrum while it transduces sound,collect and focus sounds from the air,D,False,0.4826299846172333,0.22797825932502747,0.2583332359790802,0.030853500589728355
What would Piaget test in order to determine whether a child is in the pre-operational or concrete operational stage of cognitive development?,object permanence,attachment,concepts of conservation,hypothesis testing,C,False,0.03169005364179611,0.08614249527454376,0.38606390357017517,0.495715856552124
"While driving to school, Elise hears about a concert ticket giveaway on the radio. She has to be the seventh caller to win. While pulling over so that she can call in, she repeats the number to herself several times. Elise was using which of the following to remember the phone number?",Iconic memory,Elaborative rehearsal,Chunking,Maintenance rehearsal,D,False,0.1126493513584137,0.099412702023983,0.7345660328865051,0.05321178585290909
Which of the following brain structures is most centrally involved in hunger motivation?,cerebellum,medulla,amygdala,hypothalamus,D,False,0.007094541564583778,0.0023032603785395622,0.7236628532409668,0.26622071862220764
"You are given four lists of words to learn: 1, 2, 3, and 4. You must learn list 1, then list 2, etc. Which list(s) would cause proactive interference for remembering list 2?",list 1 only,list 3 only,list 4 only,lists 3 and 4 only,A,False,0.05824960395693779,0.08475267142057419,0.6262422800064087,0.23038168251514435
The Whorfian hypothesis of linguistic relativity helps explain why,Eskimos have many words relating to snow,parents use a high-pitched voice when speaking to infants,phonemes are not interchangeable with morphemes,cultures have developed different languages,A,False,0.18594098091125488,0.03661395236849785,0.6489977836608887,0.1277952343225479
The semicircular canals of the inner ear are important for helping a person to maintain,tone quality,melatonin,balance,olfaction,C,True,0.016329435631632805,0.018503675237298012,0.891556978225708,0.07318345457315445
Sherif's Robbers Cave study indicated that which of the following principles best helps reduce tensions between groups?,superordinate goals,diffusion of responsibility,group polarization,deindividuation,A,False,0.07195530831813812,0.0923924446105957,0.6826929450035095,0.15232938528060913
Grounding a child for two weeks after the child has misbehaved is an example of,avoidant attachment,negative punishment,compliance learning,negative reinforcement,B,False,0.025538945570588112,0.06126474589109421,0.39949631690979004,0.5129634141921997
"After watching cartoons in which characters hit, punch, and kick other characters, nursery school students engage in more aggressive behavior than after watching Barney. This observation best supports",psychoanalytic theory,psychodynamic theory,social learning theory,humanistic theory,C,True,0.11452151834964752,0.061298955231904984,0.5815882682800293,0.2424420714378357
"During cooperative learning, all of the students in Group A members initially were opposed to the death penalty, whereas two of the students in Group B members were opposed to the death penalty and two were in favor of the death penalty. According to research, after an intense discussion within each group about capital punishment, we would expect",both groups would moderate their positions,"Group A members would moderate their positions, but Group B members would retain their original positions","Group A would become more firmly entrenched, while Group B members would moderate their positions","Group A members would retain their original positions, but Group B members would moderate their positions",C,True,0.05564175546169281,0.06305036693811417,0.5982052683830261,0.2825721800327301
Withdrawal symptoms are most directly caused by which of the following processes?,tolerance,dissociation,activation-synthesis,role theory,A,False,0.05459415540099144,0.042517974972724915,0.5869424939155579,0.31416770815849304
"Today Susan took a pill for her allergy that raised her blood pressure, caused her heart to beat faster, and raised her body temperature. Now caught in traffic, she feels angry. Yesterday, when she took the pill, she was with her husband. When her blood pressure rose, her heart speeded up, she got hotter, and she felt amorous. This description exemplifies",the adaptation-level phenomenon,two-factor theory,James-Lange theory,Cannon-Bard theory,B,False,0.47497621178627014,0.1542021930217743,0.2880876362323761,0.08253848552703857
"Children develop internal representational systems that allow them verbally to describe people, events, and feelings during which of Piaget's stages of cognitive development?",Sensorimotor,Preoperational,Symbolic,Concrete operational,B,False,0.003780047409236431,0.019196663051843643,0.8162629008293152,0.16073168814182281
"Chantal says that her mother is domineering and overbearing. All of Chantal's friends agree that she is the one that has these characteristics, not her mother. Freud would suggest that Chantal's behavior exemplifies which of the following defense mechanisms?",Repression,Regression,Projection,Displacement,C,True,0.05296720564365387,0.04125090315937996,0.8285465836524963,0.0770668312907219
Which of the following terms describes the behavioral component of negative attitudes toward particular groups?,Bias,Conditioning,Catharsis,Discrimination,D,True,0.056660160422325134,0.050002411007881165,0.4186650812625885,0.47440969944000244
A neutral stimulus that signals an unconditioned stimulus begins to produce a response that anticipates and prepares for the unconditioned stimulus during,acquisition trials,generalization,extinction trials,spontaneous recovery,A,False,0.1334812492132187,0.2200733721256256,0.5279285907745361,0.11779679358005524
"Which of the following is the term used to describe a number of psychotic disorders that involve disturbances in nearly every dimension of human psychology including thought, perception, behavior, and communication?",Schizophrenia,Intellectual disabilities,Dissociative disorder,Depression,A,False,0.10951158404350281,0.03555320203304291,0.7141051888465881,0.14061564207077026
A severely overweight rat would most likely result from lesioning of the,hippocampus,thalamus,hypothalamus,amygdala,C,True,0.05984887853264809,0.11181242763996124,0.7291085720062256,0.09867411851882935
"Coach Perry is training Lana to be the kindergarten soccer team's goalie. Coach Perry starts by rolling the ball to Lana slowly so she can stop it; he gradually begins to roll the ball faster and to different parts of the goal, all the while praising her successful attempts. The technique Coach Perry is using is called",the law of effect.,the partial reinforcement effect.,shaping.,second-order conditioning.,C,True,0.031608209013938904,0.06691458076238632,0.7193995714187622,0.18189269304275513
Turning up the volume on a music player changes which aspect of sound?,amplitude of the wave,frequency of the wave,pitch of the tone,transduction of the tone,A,False,0.12113592028617859,0.0445634126663208,0.5428935289382935,0.29058995842933655
"The gland sometimes referred to as the ""master gland,"" which regulates much of the action of the other endocrine glands is called the",thyroid gland,pancreas,pituitary gland,adrenal gland,C,True,0.0382339209318161,0.04332470893859863,0.5980791449546814,0.3201287090778351
Which psychological perspective was most popular at the turn of the twentieth century in Western Europe?,neuroscience,evolutionary,behaviorist,psychoanalytic,D,False,0.031897664070129395,0.059592679142951965,0.5653996467590332,0.34293219447135925
The most common form of Down syndrome results during sex cell formation and fertilization from,three copies of chromosome 19,three copies of chromosome 21,loss of a chromosome,failure of the separation of XX,B,False,0.06784883141517639,0.2368156909942627,0.5680913329124451,0.12675830721855164
"Odette is nearing her 70th birthday. Over the last year, she has suffered a loss of appetite and began to experience difficulty sleeping. She has lost interest in her favorite pastimes, gardening and bridge. Odette is most likely to be diagnosed as having",Alzheimer's disease.,seasonal affective disorder.,insomnia and bulimia.,major depressive disorder.,D,False,0.049893151968717575,0.049893151968717575,0.7804602384567261,0.11968745291233063
What is the principal tool used in all forms of psychotherapy?,talking to a patient,cognitive/behavioral interventions,biomedical/cognitive treatments,somatic therapies,A,False,0.09875088185071945,0.3905673027038574,0.4425707459449768,0.06787042319774628
"In Pavlov's conditioning of dogs, the point at which the dogs salivated at the sound of the tone without the food being present is referred to as",an unconditioned stimulus,acquisition,discrimination,generalization,B,False,0.022557927295565605,0.06131880730390549,0.8464799523353577,0.06948330998420715
"According to humanistic psychologists, psychological disorders are most likely caused by",neurochemical imbalances.,unhealthy attributional styles.,learned associations.,unfulfilled needs.,D,False,0.04023420065641403,0.06633498519659042,0.8081254959106445,0.08517579734325409
"According to the Gestalt organizing principles of perception, when you look at, ""i n car n a t e,"" you tend to notice the word car rather than in, nate, at, or ate, because of",continuity,the phi phenomenon,similarity,proximity,D,False,0.06663354486227036,0.04579652473330498,0.8117627501487732,0.07550569623708725
Which social psychological principle best explains prejudice?,individualism,collectivism,self-serving bias,in-group bias,D,True,0.027943067252635956,0.024659672752022743,0.3857421875,0.5612515211105347
"One month before finals, Conrad makes a study schedule and begins to review his notes. Two weeks before finals, Conrad is studying for hours each day to prepare. Right after finals at the start of summer vacation, Conrad comes down with the flu. Which of the following theories best explains this chain of events?",Selye's general adaptation syndrome,Yerkes-Dodson law,Thorndike's law of effect,Festinger's cognitive dissonance theory,A,False,0.040087856352329254,0.045425496995449066,0.8051861524581909,0.10897009074687958
Endorphins are chemicals that,elevate mood and reduce pain,increase alertness and reduce drowsiness,lower or raise the threshold for the firing of neurons,cannot cross the blood-brain barrier,A,False,0.1958286315202713,0.08163351565599442,0.6031946539878845,0.11877606064081192
A therapist used the Rorschach inkblot test to help him analyze his patient's problems. He was most likely a,psychoanalyst,person-centered therapist,behavioral psychologist,certified clinical social worker,A,False,0.03481901064515114,0.13771185278892517,0.792477011680603,0.03481901064515114
People who have previously not gotten along are often able to put aside their differences in the face of a mutual crisis. Their need to work together is often referred to as a(n),communal goal,superordinate goal,subordinate goal,alliance formation,B,False,0.047214873135089874,0.0686972364783287,0.5751948952674866,0.30787965655326843
Abraham Maslow's hierarachy of needs theorizes that each person is motivated by what?,desire to achieve in the eyes of others,satisfying needs from the next step in the hierarchy,primary (physical) and secondary (emotional) needs,homeostasis needs determined by our inner self,B,False,0.09921835362911224,0.06819170713424683,0.7331299781799316,0.09921835362911224
"Sanja hears a sound that she recognizes as the front door being shut. In order for her to detect the sound and process it so that she knows what it is, Sanja's ear funnels the sound waves to the inner ear in order to stimulate the cilia of the inner ear. This is a critical step in the process of",auditory transduction,olfactory perception,sensory interaction,decibel cognition,A,False,0.17042826116085052,0.11713350564241409,0.46327200531959534,0.24797165393829346
Which of the following is a secondary reinforcer?,food,water,money,sex,C,False,0.009316381998360157,0.02869647927582264,0.3085162341594696,0.6531288623809814
Which of the following kinds of personality theorists is the most likely to use a projective test?,social-cognitive,behaviorist,humanist,psychoanalyst,D,False,0.024723831564188004,0.0359729640185833,0.6376360058784485,0.30119794607162476
"Antonia has a cat. The first time she sees a rabbit, she calls it a cat. Her mistake is due to the process of",discrimination.,generalization.,accommodation.,assimilation.,D,False,0.07747164368629456,0.18584482371807098,0.572442352771759,0.16400748491287231
Which sentence most accurately describes how neurons communicate?,Neurons communicate through physical contact between dendrites of one cell and the next cell.,"Electricity passes between neurons, which carries messages between one neuron and another.","Chemicals travel from one neuron to another, influencing whether a neuron will fire or not.",Neurons send messages up the spinal cord to the cerebral cortex through neural reflexes.,C,True,0.2056063711643219,0.1100531592965126,0.3841232359409332,0.29915550351142883
"Aaron Beck's negative triad of beliefs, which explains the cycle of depression by examining negative thoughts about self and the world, exemplifies what type of therapy?",Psychoanalytic,Cognitive,Humanistic,Behavioral,B,False,0.019539838656783104,0.1274157613515854,0.8308550715446472,0.022141538560390472
"According to Sigmund Freud, what is the dominant factor determining our personality traits?",secondary drives and needs,genetic and nutritional factors,unconscious conflicts,parenting styles,C,True,0.005006603430956602,0.010598979890346527,0.7430458664894104,0.24123166501522064
A recent comparison of the intelligence scores of Asian Americans and African Americans on the Stanford-Binet showed that,I only,II only,III only,"I, II, and III",D,False,0.016448283568024635,0.014515558257699013,0.54469233751297,0.42420679330825806
"Emotional, cognitive, and behavioral tendencies that constitute underlying personality dimensions on which individuals vary are referred to as",traits,moods,temperaments,tenets,A,False,0.10236294567584991,0.06208626925945282,0.5198419690132141,0.3153000771999359
Someone with brain damage who has difficulty making the muscle movements needed to produce accurate speech might have damage to which area of the brain?,Wernicke's area,hippocampus,Broca's area,amygdala,C,True,0.06083521246910095,0.0325627438724041,0.7411246299743652,0.1653672605752945
"Lynda is a confident, capable woman who takes responsibility for her own actions. Lynda has a(n)",manic coping strategy,discriminative expectancy,internal locus of control,external locus of control,C,True,0.009915553964674473,0.014427044428884983,0.8925696611404419,0.08302190899848938
"In a sleep study, a researcher observes that the participant's eyes are beginning to dart as if he were watching a sporting event. The researcher notes that the participant has entered",stage 3 sleep,beta sleep,REM sleep,NREM sleep,C,True,0.05124172940850258,0.024204879999160767,0.8015555143356323,0.12292252480983734
Which of the following perspectives is most concerned with self-esteem and actualizing one's potential?,humanistic,behavioral,cognitive,psychodynamic,A,False,0.004557515028864145,0.023144971579313278,0.8685086369514465,0.10372857004404068
What kind of symptom is common among all the somatoform disorders?,inappropriate affect,disconnection from reality and delusions related to personal identity,maladaptive ways of behaving that prevent a person from accomplishing goals,experiencing a physical problem without a physical cause,D,False,0.022423379123210907,0.01200236938893795,0.9534662961959839,0.01200236938893795
Which of the following was an important technique used by Abraham Maslow and the humanistic psychologists during therapy?,defense mechanisms,factor analysis,unconditional positive regard,somatotype theory,C,True,0.01806527189910412,0.02047063410282135,0.5982396006584167,0.3628506660461426
The myelin sheath that covers the axons of most neurons serves to do which of the following?,Increase the number of messages a dendrite can receive,Increase the speed with which messages can be transmitted,Maintain the amount of neurotransmitter needed to create an action potential,Decrease the amount of information a dendrite can convey in one firing,B,False,0.1584494411945343,0.17954671382904053,0.43071019649505615,0.23054255545139313
"A study designed to investigate the friendship patterns of abused children was conducted by filming the interactions of the children and later having three raters view the footage and rate each child's pattern of behavior on a conflictual-behavior scale with values ranging from ""constant conflict"" to ""minimal conflict."" Which of the following kinds of reliability is most critical to this study, given the methodology used to measure the variables?",Coefficient-alpha reliability,Alternate-forms reliability,Inter-rater reliability,Test-retest reliability,C,True,0.04089346528053284,0.05250824987888336,0.6396814584732056,0.2666589021682739
Students diagnosed with attention deficit hyperactivity disorder (ADHD) are four to nine times more likely to be,females than males,males than females,children than adults,Caucasian children than African American children,B,False,0.04226703569293022,0.061498165130615234,0.5834783911705017,0.3123134970664978
"According to Erikson, a young adult's developmental crisis centers around",intimacy vs. isolation,identity vs. role confusion,autonomy vs. shame and guilt,industry vs. inferiority,A,False,0.13239876925945282,0.06254075467586517,0.7619023323059082,0.04298359155654907
Psychoactive substances are drugs that alter consciousness by,inducing the secretion of excitatory hormones into the bloodstream,imitating the behaviors of various pheromones,facilitating or inhibiting neural transmission at the synapse,increasing an individual's hypnotic susceptibility,C,False,0.5173814296722412,0.1154434084892273,0.27693435549736023,0.08990740776062012
"Two ""cognitive shortcuts"" that can lead to errors in information processing are",the representativeness heuristic and the availability heuristic,inductive reasoning and deductive reasoning,morphemic processing and phonemic processing,prototypic development and fuzzy concept development,A,False,0.17963667213916779,0.15852883458137512,0.43092599511146545,0.23065806925296783
Which of the following best states a conclusion of Stanley Milgram's study of obedience?,"When faced with a difficult decision, people are more likely to follow the opinions of the crowd than to diverge from those opinions.","When challenged to commit a crime, people will most often refuse if they are not coerced, but will agree if an authority figure coerces them.","When asked to inflict pain on others, people are likely to inflict mild amounts of pain without remorse.","When an authority figure is present, people are more likely to obey orders than to question the wisdom of the orders.",D,True,0.0699915811419487,0.0699915811419487,0.4027737081050873,0.45640242099761963
Which of the following is an example of a result of operant conditioning?,Milo starts at the sound of a buzzer because it sounds very similar to the alarm clock that wakes him every morning.,Paula is promoted to vice president of her company and vows to not lose touch with her employees.,Rebecca cancels her credit card to avoid paying the annual fee but plans to reinstate it in the new year.,Ashmed speaks louder than usual when he talks to his mother on the phone because she is hard of hearing.,D,False,0.02890332043170929,0.03711260110139847,0.8446788787841797,0.0890284925699234
Which of the following is a strategy that the National Association of School Psychologists (NASP) recommends as a best practice for improving school safety?,Expelling a student immediately after a minor disciplinary infraction,"Implementing a strict student code of conduct, such as a zero-tolerance policy",Communicating to parents that the school environment is safe,Creating a school safety and response team,D,False,0.026819312945008278,0.056776486337184906,0.6916792392730713,0.2245553582906723
"According to Elisabeth Kubler-Ross, the first reaction of a person faced with a terminal illness is",acceptance,anger,bargaining,denial,D,True,0.024428728967905045,0.05171561613678932,0.4330095648765564,0.49066412448883057
Which part of the brain was thought to play the most important role in the Cannon-Bard theory of emotion?,thalamus,hippocampus,medulla,association areas,A,False,0.021948713809251785,0.015085115097463131,0.7268415689468384,0.23597091436386108
"Jacob cries uncontrollably every time his mother takes him down the candy isle in the supermarket and refuses to let him buy anything. Eventually, Jacob's mother gives in and lets him choose one candy item to buy if he stops crying. Jacob's crying behavior is __________________ by his mother.",punished,associated,reinforced,extinguished,C,True,0.037163227796554565,0.061271801590919495,0.6587339639663696,0.24233470857143402
Research reveals that the most critical factor in Type A behavior associated with heart disease is,anger,competitiveness,sense of time urgency,conscientiousness,A,False,0.01309854444116354,0.01681886427104473,0.15957292914390564,0.8103782534599304
Which of the following represents the correct order of auditory transmission from the time the sound is first heard to when it is processed in the brain?,Oval window cochlea tympanic membrane auditory nerve auditory canal,Auditory canal auditory nerve cochlea tympanic membrane ossicles,Tympanic membrane oval window cochlea auditory nerve auditory canal,Auditory canal ossicles oval window cochlea auditory nerve,D,False,0.03229665383696556,0.08779140561819077,0.7350683808326721,0.14474354684352875
"Research has shown that people who read a job description written only with male pronouns (e.g., he, his) are more likely to think of an employee as male than people who read a description that uses gender-neutral language (e.g., he or she). This finding is most closely linked to",the linguistic relativity hypothesis.,gender schema theory.,the social role hypothesis.,modeling.,A,False,0.3176109194755554,0.11684252321720123,0.4621211588382721,0.10311316698789597
"In daylight, objects that reflect all wavelengths of light appear",black,white,dull,ultraviolet,B,False,0.01812995783984661,0.015999631956219673,0.28360024094581604,0.6803216338157654
