0,1,2,3,4,5,correct,choiceA_probs,choiceB_probs,choiceC_probs,choiceD_probs
Which statement is true about an open systems model of public relations in an organization?,It adapts to changing organizational environments.,It adopts the policy of transparency to build public trust.,It focuses on removing communication barriers between its business divisions.,It communicates with its publics frequently to effect change outside the organization.,A,False,0.23682500422000885,0.1844394952058792,0.3445783257484436,0.20899732410907745
Which law restricts corporate communications for publicly traded companies before and during the period that new securities are being registered?,Securities Act of 1933,Sarbanes-Oxley Act of 2002,Investment Advisers Act of 1940,Investment Company Act of 1934,A,False,0.10300717502832413,0.048657145351171494,0.10300717502832413,0.6716911196708679
"Which of these phrases refers specifically to a crisis, rather than an issue?",A gap between corporate and stakeholder expectations.,When an organization's trading is interrupted.,Can be avoided with constant monitoring and relationship building.,It happens suddenly.,D,False,0.1120200902223587,0.1120200902223587,0.44304805994033813,0.3045021891593933
Watson and Noble (2005) lay out a five-step model for circular evaluation. At which step should pre-testing of strategy and tactics be carried out?,1,2,3,4,C,True,0.1872793436050415,0.06889621168375015,0.3964703679084778,0.27248984575271606
Which of these sites offers 'microblogging?,YouTube,Facebook,Wikipedia,Twitter,D,True,0.16311131417751312,0.05295448750257492,0.16311131417751312,0.5693144202232361
Within which area of public relations do tactics relate to promotion of the overall organisation?,Corporate,Internal communications,Financial relations,Business to business,A,False,0.04185168817639351,0.036933980882167816,0.2729072868824005,0.577744722366333
"Emma is browsing a popular website when she runs across the story of a well-known actor who was recently pulled over for speeding and driving down the wrong side of the street. It turns out he had been drinking, and the arresting police officer found drugs in the car. The actor's publicist issued a statement claiming the actor was just tired and that the drugs belonged to someone else. Emma can't help having the impression that all public relations are ________ and occur only after something negative has occurred.",proactive,reactive,manipulative,manipulative,B,False,0.06911882013082504,0.028813011944293976,0.510722815990448,0.35101431608200073
"Louis owns a chemical company that has been irresponsibly disposing of chemical waste and contaminating the community's water supply. Although he knew the company was cutting costs in its waste disposal, he publicly claims to have had no knowledge of the irresponsible practices, blames it on the company's general manager and fires him. What image restoration strategy is Louis using?",denial,evasion of responsibility,reducing the offensiveness,corrective action,A,False,0.08818187564611435,0.07782024145126343,0.27161934971809387,0.5074517130851746
"The ________ phase of the PR model consists of primary and secondary research about a client, identifying the target audiences for the campaign, proposing channels of communication and strategies to be used in the campaign, and constructing goals, objectives, messages, and themes.",identification,evaluation,implementation,planning,D,False,0.05708308145403862,0.08305539190769196,0.42179009318351746,0.42179009318351746
The 'internal factors' portion of a firm's public relations situation analysis often includes,a communication audit,strategy suggestions,community focus groups,a listing of media contacts,A,False,0.10219773650169373,0.10219773650169373,0.31479117274284363,0.4580184519290924
What is the major advantage of organizational publications?,Their ability to provide a revenue source for sponsoring organizations,"Their ability to deliver specific, detailed information to narrowly defined target publics",Their ability to avoid the problems typically associated with two-way media,Their ability to give sponsoring organizations a means of uncontrolled communications,B,False,0.4448767602443695,0.0876014232635498,0.16366103291511536,0.26983141899108887
"Which outcome, from the evaluation phase of public relations planning, documents the impact a program had on its stakeholders?",the quality of the messages and activities,the number who change attitudes and opinions,the number who responded to communications,the number of messages and activities implemented,B,False,0.12427536398172379,0.15957272052764893,0.3827950656414032,0.2981210947036743
"The second stage of the advertising campaign is to establish ________, or to become known as trustworthy and believable.",legitimacy,identity,reliability,agency,A,False,0.054936476051807404,0.054936476051807404,0.4599774479866028,0.40592867136001587
Which type of writing employs the pyramid structure?,Media writing,Personal writing,Business writing,Promotional writing,A,False,0.05048595741391182,0.04455370455980301,0.2905266582965851,0.5427752137184143
During which step of the Chase Jones model of issues management should the organization's ability to lead the issue be assessed?,Identification,Analysis,Strategy,Evaluation,C,True,0.06008383631706238,0.0771491676568985,0.44396284222602844,0.3917958438396454
Which of these should an objective NOT be?,Broad,Achievable,Measurable,Time-bound,A,False,0.029038894921541214,0.032905373722314835,0.40086954832077026,0.5147266983985901
Which statement describes an idea from Kantian ethics?,What is right and what is wrong are predetermined.,"People should be treated as an end, not a means to an end.",The greatest good for the greatest number.,Those better off should give to people who are not as well off.,B,False,0.17299795150756836,0.10492856055498123,0.5328712463378906,0.13473094999790192
Which of these organizations is most effective in engaging with customers online?,Starbucks,Coca-Cola,Wholefoods,Redbull,A,False,0.13321541249752045,0.05553244426846504,0.10374826192855835,0.5970300436019897
"According to Russian philosopher Mikhail Bakhtin, in order to create ________, or a well-informed public, all communication about an issue must be ________, or take the form of a dialogue.","intelligentsia, democratic","democracy, dialogic","democracy, logical","democracy, bipartisan",B,False,0.21502146124839783,0.14778193831443787,0.4552004039287567,0.10156894475221634
Your client has asked you to develop a public relations campaign to promote a college tuition savings program using new technologies. What is the most appropriate first step?,Research pricing and development costs for different services.,Develop a survey to discover which factors impact families' savings.,Conduct a situation analysis to gain a better understanding of the issue.,Hold a focus group to determine which messages are most effective for the program.,C,True,0.16576150059700012,0.07830019295215607,0.510581374168396,0.21284198760986328
"According to ""working theory,"" what is the step that occurs between an individual gaining information and changing behavior?",coorientation,opinion change,reaction formation,semantic encoding,B,False,0.06440433859825134,0.10618479549884796,0.2547241151332855,0.539250910282135
"Segmentation of the population into psychographics, demographics and geodemographics is especially important in which public relations specialisation?",Issues management,Investor relations,Public affairs,Marketing communications,D,True,0.05375463888049126,0.08862640708684921,0.35052427649497986,0.45008206367492676
What are two examples of an evaluation of outcome? ,Change in attitude,Placement of message,Distribution of message,Size of attentive audience,A,False,0.03626834973692894,0.05277014151215553,0.44183897972106934,0.44183897972106934
Which fashion house sued for damages to its reputation after being accused of stealing a design?,Dior,Givenchy,Chanel,Lacroix,C,True,0.19927604496479034,0.10666479170322418,0.28994494676589966,0.28994494676589966
"What public relations pioneer is credited with being the first practitioner to insist on ""a place at the management table""?",Carl Byoir,Edward Bernays,Doris Fleischman,Arthur Page,D,False,0.1637343317270279,0.060234490782022476,0.26995226740837097,0.18553529679775238
What are major reasons why organizations retain outside public relations counsel? ,They offer flexibility of talents and skills.,They bring greater credibility to the work. ,They will provide sound ROI on the project or program.,They can provide more attention and detail to a project that in-house staff.,A,False,0.2750849723815918,0.07881316542625427,0.2750849723815918,0.3117121160030365
Which of these activities might secondary research involve?,Conducting a content analysis,Conducting a survey,Observing people,Examining public records,D,True,0.07529900223016739,0.10955939441919327,0.2978132963180542,0.4910111427307129
Which of the following information about publications does the Audit Bureau of Circulation NOT provide?,Circulation,Distribution,Traffic,Readership,D,True,0.034140292555093765,0.02658848464488983,0.1350274682044983,0.7770294547080994
Early email was developed in which decade?,1960s,1970s,1980s,1990s,B,False,0.3307143747806549,0.10736723989248276,0.2918544113636017,0.1770186573266983
"According to Esman (1972), which publics help an organization to exist by lending authority or assistance?",Enabling,Functional,Normative,Diffused,A,False,0.04675751179456711,0.041263360530138016,0.5026906728744507,0.39149588346481323
Which common public relations tactic can provide a 'halo effect'?,Placement on TV or radio,Stunts,Third parties,Sponsorship,D,False,0.09631896018981934,0.1091436892747879,0.38094890117645264,0.38094890117645264
