0,1,2,3,4,5,correct,choiceA_probs,choiceB_probs,choiceC_probs,choiceD_probs
The false cause fallacy is,arguing that since someone is poor she must have high moral character,arguing that two things are causally related without evidence of a causal relationship,arguing that since something is new it is necessarily bad,substituting individual stories for a larger sample in support of a claim,B,False,0.030960751697421074,0.13875645399093628,0.12245213240385056,0.7046634554862976
Arguing that someone should do something because other people are doing it is a description of which of the following fallacies?,appeal to common practice,snob appeal,argument by consensus,appeal to tradition,A,False,0.0083572743460536,0.06997460126876831,0.4026760458946228,0.5170462727546692
Which of the following describes the fallacy of false consolation?,arguing against a position based only on negative personal feelings toward the position,responding to charges of wrongdoing by saying others do things as bad or worse,arguing that someone is not really harmed because things could be worse or by pointing out what they have to be thankful for,using threats of harm instead of reasoning to get agreement,C,True,0.010757170617580414,0.04254543408751488,0.5873215794563293,0.3562285602092743
Which of the following fallacies happens when someone concludes that a legitimate generalization necessarily applies to a particular case?,False dilemma,Circular reasoning,Accident,Bifurcation,C,False,0.012225186452269554,0.0797182247042656,0.31529173254966736,0.5890424847602844
Which of the following best describes the fallacy of poisoning the well?,"a way of suppressing evidence that eliminates a source of evidence from consideration by claiming the source is flawed, when there is no true relationship between the alleged flaw and the reliability of the source","arguing that a claim should be accepted based on evidence that is not presented, but asserted to be well known or obvious.","arguing something should be done based only on evidence that it's been done that way in the past, or should be believed only because it's been believed for a long time.",reasoning that a claim is true based only on the evidence that it has been made so often.,A,False,0.03691524267196655,0.08855505287647247,0.3090875446796417,0.5095992088317871
Which of the following describes the straw person fallacy?,arguing someone should do something only because it will make him or her better liked,"saying an opposing arguer has taken a position that you can easily defeat, when he or she has not taken that position, then going on to defeat that position and claim to have done significant damage to that arguer's overall argument",attacking the character or background of an opposing arguer instead of responding to that person's arguments with good evidence and sound reasoni,responding to an argument with an expression of derision instead of a counter argument,B,False,0.05964244529604912,0.20817260444164276,0.2672989070415497,0.4407013952732086
Which of the following is another name for appeal to the people?,argument by consensus,appeal to beliefs,no true Scotsman,overlooked evidence,A,False,0.003037806833162904,0.053846411406993866,0.2734546661376953,0.5789034962654114
Which of the following describes the fallacy of appeal to tradition?,reasoning that a claim must be true because it's been made so often,reasoning that a claim must be true because a regular person believes it,reasoning that a claim must be true because it's been believed in the past,reasoning that a claim must be true because a lot of people believe it,C,False,0.03557799756526947,0.08534718304872513,0.1594495177268982,0.7146031856536865
Which of the following is the best explanation of the fallacy of loaded language?,"Using emotionally charged language to create an impression about the subject of a claim, without making an argument that the language fits the subject.",Referring to an act committed by an opponent in negative terms while referring to the same act committed by the arguer or supporters in favorable terms.,"Using language and punctuation in a way that a statement can have multiple interpretations, so it's not really clear what is meant.",Confusing figurative language with literal language,A,False,0.046240080147981644,0.16139374673366547,0.30152320861816406,0.34167054295539856
Automatically rejecting a claim just because it's traditional is...,Not reasonable,An appeal to tradition,An appeal to the masses,Reasonable,A,False,0.006285086274147034,0.06757104396820068,0.34315410256385803,0.4992862343788147
A slippery-slope pattern of argument is fallacious when...,It is hypothetical,There is good reason to think that doing one action will inevitably lead to another undesirable action,There are only two possible results,There is no good reason to think that doing one action will inevitably lead to another undesirable action,D,True,0.018803635612130165,0.12261509150266647,0.22907519340515137,0.6226908564567566
Which of the following best describes the fallacy of special pleading?,"Reasoning that ideas presented in an appealing manner are correct, regardless of the content of the message.","Using language and punctuation in a way that a statement can have multiple interpretations, so it's not really clear what is meant.",Confusing figurative language with literal language.,Referring to an act committed by an opponent in negative terms while referring to the same act committed by the arguer or supporters in favorable terms,D,True,0.030434584245085716,0.09374510496854782,0.32720258831977844,0.5394658446311951
Whether someone is hypocritical regarding her claims is...,Irrelevant to her character,Evidence that the claims are false,Irrelevant to the truth of the claims,Relevant only in court,C,True,0.0048212758265435696,0.02774452604353428,0.8108139634132385,0.14089831709861755
"If someone says if you do something it will lead to extreme consequences, but doesn't provide you with any evidence of a cause and effect relationship between your act and those consequences, that person has probably committed which of the following fallacies?",ad nauseam,self evident truths,slippery slope,suppressed evidence,C,False,0.003032486420124769,0.03694324940443039,0.27297571301460266,0.6548346877098083
The concomitant variation fallacy is,attributing the cause of an event to a single cause when the cause is more complicated,"arguing that since two events happened at the same time, one event must have caused the other",arguing that since one event preceded another event it must have caused the second event,drawing a conclusion based on sign reasoning when there is not really a direct relationship between the alleged sign and the subject of the conclusion,B,False,0.016491083428263664,0.07390791177749634,0.4819400906562805,0.4253106415271759
""" _Ad novitatem_ "" is a specific kind of fallacy of",Division,False sign,False cause,Hasty Generalization,B,False,0.01984589174389839,0.2133634388446808,0.3104419708251953,0.4516904056072235
Rejecting a claim by criticizing the person who makes it rather than the claim itself is known as the fallacy of...,Division,Appeal to emotion,Composition,Appeal to the person,D,False,0.03058093786239624,0.1994127631187439,0.5420600771903992,0.2259642481803894
Which of the following best describes the fallacy of amphiboly?,"Using emotionally charged languages to create an impression about the subject of a claim, without making an argument that the language fits the subject.",Referring to an act committed by an opponent in negative terms while referring to the same act committed by the arguer or supporters in favorable terms.,"Using grammar and punctuation in a way that a statement may have multiple interpretations, so it's not really clear what is meant.",Changing the meaning of a word or phrase from one part of the argument to another.,C,False,0.06540112942457199,0.1777786910533905,0.2586664855480194,0.42646893858909607
"When someone uses grammar or punctuation in a way that makes a statement have more than one possible interpretation, that person may have committed which of the following fallacies?",Amphiboly,Hypostatization,Question begging epithets,Style over substance,A,False,0.04050512984395027,0.1815313994884491,0.339145302772522,0.43547120690345764
Telling people that they haven't been harmed because there is something they should be thankful for commits which of the following fallacies?,genetic fallacy,horse laugh,false consolation,appeal to joy,C,False,0.0036821463145315647,0.021189289167523384,0.17741574347019196,0.5464789867401123
