0,1,2,3,4,5,correct,choiceA_probs,choiceB_probs,choiceC_probs,choiceD_probs
"In a hypothetical syllogism, when the minor premise affirms the antecedent",no valid conclusion can be drawn,the conclusion must affirm the consequent,the conclusion must deny the consequent,the conclusion must deny the antecedent,B,False,0.03437964990735054,0.19784122705459595,0.6905337572097778,0.07278171926736832
"Moses Maimonides, ""The Guide of the Perplexed"": God, may He be exalted ... existed alone, and nothing else. ...Afterwards, through His will and His volition, He brought into existence out of nothing all the beings as they are, time itself being one of the created things. For time is consequent upon motion, and motion is an accident of what is moved. Furthermore, what is moved...is itself created in time ....",Equivocation,Appeal to Authority,Inconsisteny,Slippery Slope,C,False,0.05487178638577461,0.21702216565608978,0.11616357415914536,0.5899273157119751
"John Stuart Mill: Each person's happiness is a good to that person, and the general happiness, therefore, a good to the aggregate of all persons.",Fallacy of Composition,Fallacy of Division,Gambler's Fallacy,Equivocation,A,False,0.020538518205285072,0.07168647646903992,0.25021037459373474,0.4674545228481293
_Circulus in probando_ is another name for,The fallacy of accident,False dilemma,Begging the question,Guilt by association,C,False,0.01742304489016533,0.1653052717447281,0.34995120763778687,0.44934624433517456
Arguing that an idea should be accepted or rejected only because of the source of the idea commits which of the following fallacies?,genetic fallacy,appeal to popularity,scare tactics,appeal to emotions,A,False,0.0051526776514947414,0.026167454198002815,0.15058329701423645,0.7647251486778259
"At the end of the course, Professor Jones told us that we were the best class he had ever had. That's why I'm sure that the 0.0 the appeared on my grade report is a mistake. Surely, if we were as good a class as Professor Jones said we were, none of us deserved to fail.",Fallacy of Composition,Fallacy of Division,Questionable Cause,Appeal to Gallery (Provicialism),B,False,0.00236071296967566,0.03258863463997841,0.06088358536362648,0.165498748421669
Which of the following best describes the fallacy of equivocation?,A form of loaded language that uses an emotionally charged restatement of the claim in place of support for the claim.,Changing the meaning of a word or phrase from one part of the argument to another.,Confusing figurative language with literal language.,Referring to an act committed by an opponent in negative terms while referring to the same act committed by the arguer or supporters in favorable terms.,B,False,0.1009567454457283,0.16644953191280365,0.5127006769180298,0.21372543275356293
The fallacy of appeal to emotions consists of,trying to make an opponent's argument seem ridiculous,defending wrongdoing by claiming the opposing arguer does the same thing,arguing that an argument should be rejected because the source of the argument,trying to get someone else to agree to a claim only by arousing that person's feelings about the subject,D,True,0.015546365641057491,0.061487071216106415,0.1671391874551773,0.7490658760070801
"""To be valid, the minor premise must either agree with the antecedent, or disagree with the consequent"" is a requirement for",a disjunctive syllogism,a categorical syllogism,a conditional syllogism,disjunctive enthymeme,C,True,0.06252162158489227,0.24727782607078552,0.31751102209091187,0.2802024781703949
Which of the following fallacies happens when someone concludes that someone couldn't have done something good because he or she has negative qualities?,Laudatory personality,Guilt by association,Reprehensible personality,Circular reasoning,C,False,0.008243374526500702,0.11379627883434296,0.2729831039905548,0.5779052376747131
Another name for the bandwagon appeal is,appeal to beliefs,appeal to authority,appeal to the people,common man appeal,C,False,0.0007177645456977189,0.020976154133677483,0.030520124360919,0.8919287919998169
A valid disjunctive syllogism has which of the following characteristics?,The minor premise must either affirm the antecedent or deny the consequent,The minor premise must either accept an alternative or reject an alternative,One of the premises is missing,It reaches a truthful conclusion,B,False,0.04088667035102844,0.12593981623649597,0.38792192935943604,0.43957313895225525
Appeal to beliefs is another name for which of the following fallacies?,ad nauseam,appeal to tradition,solid slope,self evident truths,D,True,0.025691570714116096,0.1304725557565689,0.2437548190355301,0.5847374200820923
When a claim is supported only by asserting that unidentified experts accept the claim the arguer has committed which of the following fallacies?,appeal to tradition,ad vericundiam,appeal to anonymous authority,snob appeal,C,False,0.004874552600085735,0.04624846205115318,0.43879321217536926,0.4972178339958191
The black-or-white fallacy is another name for,The fallacy of accident,False dilemma,Begging the question,Circular reasoning,B,False,0.0076428730972111225,0.09310925006866455,0.1971122920513153,0.6879894733428955
The false sign fallacy is,arguing that what is true of part of an object is necessarily true of the entire object,arguing that two things are similar enough that what is true of one is true of the other,arguing that since something is inexpensive it is necessarily of low quality,reasoning by sign when there is really not a direct relationship between the alleged sign and the subject of the argument,D,True,0.11762294918298721,0.2197486013174057,0.24900777637958527,0.41054442524909973
""" _Ad novitatem_ "" is",arguing that what is true of a few members of a class is true of all members of the class,drawing a conclusion by applying irrelevant criteria to a subject,substituting individual stories for a larger sample as support for a claim,"arguing that something must be good because it is new, or must be bad because it is old",D,False,0.039128225296735764,0.3276166021823883,0.47667935490608215,0.1547551304101944
"When someone tries to support a proposition with information that really has nothing to do with the claim being made, that person has probably committed which of the following fallacies?",straw person,genetic fallacy,irrelevant conclusion,ignoratio elenchi,C,False,0.002183707198128104,0.06381727755069733,0.3240908980369568,0.6054815053939819
Applying irrelevant standards to the subject of the argument is the fallacy of,ad crumenam,ad antiquitatem,false criteria,hasty generalization,C,False,0.003872787579894066,0.06864680349826813,0.34861722588539124,0.5747726559638977
"If you argued something is flawed because it fails to do something, when it was never intended to do that, you may have committed which of the following fallacies?",ad ignorantium,Many questions,Extension,Compound proposition,C,False,0.0070907073095440865,0.08638249337673187,0.26607680320739746,0.6382851004600525
""" _Ad antiquitatem_ "" is",a specific type of false cause fallacy that argues that since two event happened at the same time one event must have caused the other,"a specific type of false sign fallacy that reasons something is necessarily better because it is old, or is worse because it is new","a specific type of false sign fallacy that reasons something is necessarily better because it is new, or is worse because it is old",arguing that what is true of an individual part of an object must be true of the entire object,B,False,0.041606687009334564,0.1281576156616211,0.16455763578414917,0.6508380770683289
""" _Ad crumenam_ "" is",basing a conclusion on an analogy when the items being compared are not similar enough to sustain the analogy,"a specific type of false sign fallacy that reasons someone is necessarily better because he or she is wealthy, or is worse because he or she is poor",drawing a firm conclusion without enough evidence to support that conclusion,a specific type of false cause that involves mistakenly attributing the cause of an event to a simple cause when the cause is more complex,B,False,0.013685489073395729,0.10112284123897552,0.5135442018508911,0.3529534339904785
The fallacy of laudatory personality is a specific type of,The fallacy of accident,False dilemma,Begging the question,Circular reasoning,A,False,0.0069687929935753345,0.06611806154251099,0.20365796983242035,0.7108361721038818
Appeal to ignorance is a fallacy that involves,"determining the conclusion one wants first, then accepting only evidence supporting that conclusion, or interpreting all evidence as support for that conclusion.",arguing something is inferior just because it doesn't do something it was never intended to do.,arguing that a claim must be true because there is no evidence that it is false.,arguing about something when you are ignorant about the subject,C,False,0.05294045805931091,0.18478035926818848,0.2688538432121277,0.3452151417732239
Which of the following statements is **not** true?,A formally valid syllogism may be materially untrue,A formally valid syllogism must be materially true,A materially true conclusion may arise from a formally valid syllogism,The formal validity of a syllogism does not guarantee it is materially true,B,False,0.030680257827043533,0.07359811663627625,0.3737620711326599,0.47991999983787537
"""The minor premise must affirm the antecedent or deny the consequent"" is a validity requirement of which type of argument?",Toulmin,Categorical,Disjunctive,Conditional (or hypothetical),D,True,0.017124004662036896,0.1265302300453186,0.26786449551582336,0.3035302460193634
Which of the following describes the fallacy of appeal to loyalty?,arguing that someone should do something because it will make him or her better liked by others,responding to an argument with an expression of derision,arguing that an idea should be accepted only because of who originated the idea,arguing that someone should do something to be loyal to a person or a group,D,True,0.03233126178383827,0.06844528764486313,0.0533052422106266,0.8338342905044556
Arguing in favor of a claim based only on the evidence that some regular people believe the claim is one way to commit which of the following fallacies?,poisoning the well,common person appeal,ad numerum,suppressed evidence,B,False,0.00959889218211174,0.10319781303405762,0.11693844944238663,0.7625344395637512
The appeal to fear involves,arguing something should be done only because it will make the person doing it feel good,arguing someone should do something only because of ill will towards someone else,"arguing actions should be taken to avoid exaggerated, unlikely, or irrelevant negative results",characterizing an opponents position in a way that makes it seem silly,C,False,0.05374867469072342,0.10041574388742447,0.18760131299495697,0.6547929048538208
"It's silly to pass laws against discrimination, since it is obvious that we can't live without it. We discriminate between pleasant and unpleasant tastes in selecting our food, between pleasant and unpleasant sounds in selecting our music, between harmonious and unharmonious colors in decorating our homes, between interesting and uninteresting people in choosing our friends, and so on. We can't live without discriminating.",Prejudicial Language,Equivocation,Inconsistency,Straw Man,B,False,0.0856151431798935,0.26371321082115173,0.26371321082115173,0.383700430393219
The fallacy of guilt by association is a specific type of,Fallacy of accident,Laudatory personality,Begging the question,Circular reasoning,A,False,0.00213101739063859,0.03777318447828293,0.4601716101169586,0.4601716101169586
Appeal to compassion is,an appeal to emotion that argues against a position based only on negative personal feelings toward the position,an appeal to emotion that argues a conclusion should be made based only on feeling sorry for someone,an appeal to emotion that argues an action should be taken based only on the need to be loyal to someone,arguing that an idea should be accepted based only on who originated the idea,B,False,0.029707394540309906,0.05550072342157364,0.13313929736614227,0.7661638259887695
"When someone uses highly emotionally charged terms during an argument, without giving any reasons why those terms fit the subject, that person may have committed which of the following fallacies?",Special pleading,Amphiboly,Equivocation,Loaded language,D,False,0.012583944015204906,0.09298347681760788,0.6063284277915955,0.28640925884246826
Arguing that someone couldn't have done something good because she holds a particular position commits the fallacy of,Guilt by association,False dilemma,Reprehensible personality,False dichotomy,C,False,0.009790630079805851,0.10525919497013092,0.19665007293224335,0.68637615442276
""" _Ad antiquitatem_ "" is a specific kind of",False cause,False sign,False analogy,Hasty Generalization,B,False,0.009468172676861286,0.10179245471954346,0.35529056191444397,0.31354284286499023
The hasty conclusion fallacy is,arguing that a single event caused another when the cause is really several events,making an argument without enough evidence to support the conclusion,substituting individual stories for a larger sample in support of a claim,reasoning that applies irrelevant criteria to the subject of the argument.,B,False,0.05024566501379013,0.1753746122121811,0.15476754307746887,0.6121175289154053
""" _Ad lazarum_ "" is","a specific type of false sign that argues there is necessarily an inverse relationship between cost and quality, so something is necessarily a better value because it costs less",arguing that what is true of an entire object must also be true of every individual part of that object,a specific type of false analogy that reasons what is true about nature must be true about humans,drawing a conclusion without enough evidence to support that conclusion,A,False,0.01906554214656353,0.12432294338941574,0.20497389137744904,0.6313640475273132
"All things that are spoiled are inedible. Timothy is spoiled. So, Timothy is inedible.",Equivocation,Attacking the Person (ad hominem),Fallacy of Division,Questionable Cause,A,False,0.0012373928911983967,0.019356081262230873,0.06755936145782471,0.2672024667263031
"Which of the statements below is correct about the following argument?

""If the sky is blue there won't be rain. The sky is blue today. Therefore, there won't be rain.""",It is a formally valid categorical syllogism,It is a formally invalid disjunctive syllogism,It is a formally valid conditional syllogism,It is a formally invalid conditional syllogism,C,False,0.009639848954975605,0.03364637866616249,0.08071347326040268,0.13307400047779083
Which of the following best describes the snob appeal fallacy?,reasoning that a claim is true based only on the evidence that it has been made so often.,arguing someone should accept a claim based only on the evidence that he or she has the favorable characteristics to understand the truth of the claim.,arguing a claim should be accepted based only on evidence that unidentified authorities accept it.,"arguing that someone should accept an idea or product based only on evidence that prestigious people accept it, or that non-prestigious people reject it.",D,False,0.017733389511704445,0.05462268739938736,0.5182456374168396,0.40361011028289795
"""Each term must be used twice, no more and no less,"" is a test of validity for which type of syllogism?",Enthymeme,Categorical,Disjunctive,Conditional,B,True,0.04599999636411667,0.2647117078304291,0.2647117078304291,0.16055577993392944
"The universe, like a watch, must have a maker.",Fallacy of Accident,Questionable Analogy,Questionable Cause,Fallacy of Composition,B,False,0.003672004444524646,0.05069045349955559,0.09470223635435104,0.7929320931434631
The natural law fallacy is a specific type of,false analogy,false cause,false criteria,false sign,A,False,0.03190843388438225,0.16204439103603363,0.3027387857437134,0.4991318881511688
"Given the following major premise, which of the following minor premises could lead to a valid conclusion?

""Either I'm going to do well on this test or I'm going to be mad.""","""I won't do well on the test""","""I won't take the test""","""My birthday is today""",both A and B,A,False,0.012842963449656963,0.10753282159566879,0.48192864656448364,0.3312244117259979
Men are better drivers than women are. The proof of this is that men are more capable than women of managing cars on the road.,Begging the question,Ad hominem (Attacking the Person),False Dilemma,Appeal to Pity,A,False,0.002581668319180608,0.04576116427779198,0.5574851036071777,0.18098890781402588
"In a faulty analogy, the things being compared are...",Sufficiently similar,Sufficiently similar in irrelevant ways,Complete opposites,Not sufficiently similar in relevant ways,D,False,0.07114151120185852,0.19338269531726837,0.4093911349773407,0.3188341557979584
Which of the following describes the _tu quoque_ fallacy?,summarizing an opponent's position in a way that makes it seem silly,attempting to gain agreement based only on the feelings aroused in the argument,responding to charges of wrongdoing by saying the accuser does the same thing,arguing against a position based only on negative personal feelings toward the position,C,False,0.008986084721982479,0.05859663337469101,0.09660951048135757,0.8089014887809753
Responding to charges of wrongdoing by saying the accuser or others do the same thing describes which of the following fallacies?,ignoratio elenchi,ad baculum,ad misericordiam,tu quoque,D,False,0.008736727759242058,0.1064351350069046,0.2893206775188446,0.1754818707704544
"The fallacy that involves reasoning that determines the conclusion one wants first, then accepts only evidence supporting that conclusion, or interprets all evidence as support for that conclusion is known as",ad ignorantium,a priori,plurium interrogationum,Extension,B,False,0.004148293286561966,0.03935791179537773,0.06489022821187973,0.5433192253112793
The genetic fallacy consists of,arguing that a conclusion should be made based on feeling sorry for someone when that feeling is irrelevant to the conclusion,responding to charges of wrongdoing by saying the accuser does something just as bad,arguing that an idea should be accepted or rejected based only on who originated the idea.,causing confusion during refutation because of a real or feigned lack of ability to engage in refutation,C,False,0.1269618421792984,0.2093247026205063,0.2687782347202301,0.39107000827789307
Another name for the fallacy of begging the question is,Dito simpliciter,Bifurcation,Reprehensible personality,Circular reasoning,D,True,0.0008655482670292258,0.02529502473771572,0.10004375874996185,0.30815649032592773
The fallacy of _ignoratio elenchi_ is also known as,argument against the person,appeal to compassion,ignorance of refutation,"the ""you too"" fallacy",C,False,0.0009991858387365937,0.017710993066430092,0.07937515527009964,0.10191972553730011
"William Safire in American Heritage Magazine (December 1987): ...The greatness of Lincoln was his purposefulness. He saw something that few others saw: that the democratic experiment centered on the Union and that majority rule was everything. The minute you allowed secession, you made democracy an absurdity---because what would happen would be continued subdivision.",Slippery Slope,Questionable Analogy,Appeal to Authority,Straw Man,A,False,0.03952575847506523,0.2274550497531891,0.4815223217010498,0.20072835683822632
"So, how long have you been beating your wife?",Attacking the Person (ad hominem),False Dilemma,Prejudicial Language,Appeal to Force,C,False,0.002483462681993842,0.034283146262168884,0.030254773795604706,0.41765424609184265
"""Misuse of statistics,"" ""questionable statistics,"" and ""questionable use of statistics"" are all other names for the fallacy of",appeal to a pride,significance,poisoning the well,slippery slope,B,False,0.017367666587233543,0.11325141042470932,0.12833064794540405,0.7384918928146362
"E.F. Schumacher, famous economist, in an article in the Atlantic (April 1979): Fifteen months [after I had advised that rural India should have a technology intermediate between the hoe and the tractor,] an all-India conference on intermediate technology was arranged. (They still didn't like the term [intermediate], so they called it appropriate technology. That's all right: when I come to India and somebody says, ""Oh, Mr. Schumacher, I don't believe in appropriate technology"", I just look him straight in the face and say, ""Oh, that's splendid. Do you believe in inappropriate technology?"")",Equivocation,Inconsistency,Appeal to Authority,Prejudicial Language,A,False,0.047776419669389725,0.14716173708438873,0.274934321641922,0.5136449337005615
"We must assume that he is a Communist, because he says that he is not, and we know that Communists are taught always to deny party membership.",Argument from Ignorance,Affirming the Consequent,Denying the Antecedent,Begging the Question,B,False,0.01174627523869276,0.11144555360078812,0.5659672617912292,0.3029404580593109
"If someone argues that something should be done in a certain way because that's the way it's always been done, that person has committed which of the following fallacies?",slippery slope,appeal to tradition,argument from authority,ad nauseam,B,False,0.0072236452251672745,0.07766149938106537,0.23921428620815277,0.6502517461776733
False analogy is another name for which fallacy?,Over generalization,Composition,Concomitant variation,Imperfect analogy,D,True,0.008840222842991352,0.06532090157270432,0.12203551083803177,0.7957714200019836
"Which of the following fallacies happen if someone argues that you are a reasonable and intelligent person, so of course you understand his claim is true?",significance,argument from authority,appeal to pride,slippery slope,C,False,0.00330172386020422,0.03132588043808937,0.045578889548778534,0.9154765009880066
"Which fallacy happens when someone argues in favor of a two part proposition, only supports one part of the proposition, then asserts that the entire proposition has been supported.",a priori,Complex proposition,Extension,Appeal to ignorance,B,False,0.00019810567027889192,0.004508864600211382,0.012256363406777382,0.9736435413360596
Which of the following is a test of the validity of a conditional syllogism?,Every term must be used twice--no more and no less,"If one premise is negative, the conclusion must be negative",The minor premise must affirm the antecedent or deny the consequent,The alternatives presented must be mutually exclusive,C,True,0.03538817539811134,0.20364491641521454,0.553564190864563,0.20364491641521454
Which of the following fallacies happens when someone attributes the cause of an event to a simple cause when the cause is actually more complicated?,complex cause,hasty generalization,post hoc,division,A,False,0.01573190465569496,0.11624392867088318,0.4597536325454712,0.4057311713695526
Which of the following is another name for the fallacy of amphiboly?,Misusing ambiguity,Reification,Figure of speech,Special pleading,A,False,0.007254896219819784,0.08838272094726562,0.21201913058757782,0.6530649065971375
"Tan ah Tiat, forty-nine years old, a native of Kuala Lumpar, Malaysia, was charged with possession of opium. Arguing for acquittal, he told the judge that his opium habit did no harm, as he was too old to work anyway. Asked how he lived, he replied that he lived on the earnings of his grandmother.",Straw Man,False Dilemma,Inconsistency,Appeal to Authority,C,True,0.01535175833851099,0.11343500018119812,0.5083804130554199,0.30834829807281494
Which of the following best describes the fallacy of self-evident truths?,arguing that a claim is true based only on evidence that an authority figure accepts the claim.,arguing a claim should be accepted based only on evidence that unidentified authorities accept it.,"arguing that a claim should be accepted based on evidence that is not presented, but is asserted to be well known or obvious.",arguing someone should accept a claim based only on the evidence that he or she has the favorable characteristics to understand the truth of the claim.,C,False,0.036995746195316315,0.08874817192554474,0.39774173498153687,0.45070046186447144
""" _Ad lazarum_ "" is a specific kind of",Anecdotal evidence,Complex cause,False criteria,False sign,D,False,0.01294290367513895,0.08439832925796509,0.4286101162433624,0.4286101162433624
"We're perfectly entitled to believe there is a God. After all, every effort by atheists to prove otherwise has failed.",Appeal to Authority,Denying the Antecedent,Attacking the Person (ad hominem),Argument from Ignorance,D,True,0.01940007694065571,0.12650437653064728,0.09852171689271927,0.7279825210571289
"When someone makes an argument, and the only evidence he or she uses to support the claim is the testimony that an authority figure believes the claim, the arguer has committed which fallacy?",Questionable use of statistics,Apple polishing,Self evident truths,Argument from authority,D,True,0.008449279703199863,0.04290898144245148,0.08016452938318253,0.8618499636650085
When someone changes the meaning of a word or phrase from one part of the argument to another that person may have committed which of the following fallacies?,Special pleading,Hypostatization,Question begging epithets,Equivocation,D,True,0.01514256652444601,0.12678714096546173,0.2090366780757904,0.6438782811164856
Another name for the fallacy of accident is,Laudatory personality,Guilt by association,Either-or fallacy,Dicto simpliciter,D,True,0.00043360222480259836,0.011182748712599277,0.011182748712599277,0.09363201260566711
"""Each term must be used twice, no more and no less"" is a requirement for",valid categorical syllogism,a valid disjunctive syllogism,a valid conditional syllogism,a materially true hypothetical syllogism,A,False,0.0557328462600708,0.15149757266044617,0.46664538979530334,0.24977728724479675
