0,1,2,3,4,5,correct,choiceA_probs,choiceB_probs,choiceC_probs,choiceD_probs
A valid disjunctive syllogism has a major premise that:,includes two or more alternatives,classifies subjects,affirms the antecedent or denies the consequent,leads to a valid conclusion,A,False,0.006679309997707605,0.1520203948020935,0.6813080906867981,0.1520203948020935
Which of the following best describes the fallacy of style over substance?,Changing the meaning of a word or phrase from one part of the argument to another.,Confusing figurative language with literal language.,"Reasoning that ideas presented in an appealing manner are correct, regardless of the content of the message.","Using emotionally charged language to create an impression about the subject of a claim, without making an argument that the language fits the subject.",C,True,0.0815887302160263,0.17272335290908813,0.4143417775630951,0.3226897120475769
"Which of the following fallacies is a way of suppressing evidence that eliminates a source of evidence from consideration by claiming the source is flawed, when there is no true relationship between the alleged flaw and the reliability of the source?",significance,snob appeal,poisoning the well,appeal to anonymous authority,C,False,0.00278456206433475,0.029936859384179115,0.3647056221961975,0.601297914981842
The false analogy fallacy is,a specific type of false cause fallacy that argues that since two event happened at the same time one event must have caused the other,arguing that an event that preceded another event necessarily is the cause of the second event,arguing that since something is new it is necessarily good,drawing a conclusion based on a comparison when the items being compared are not similar enough to support the conclusion.,D,True,0.04826334863901138,0.1908852458000183,0.16845564544200897,0.5879679322242737
The _ad nauseam_ fallacy is,arguing that something should be done because that's the way it's been done in the past.,"arguing that an act should be carried out because it will not have any significant consequences, when there is no evidence of the effects",reasoning that a conclusion is true because it's been claimed so often,reasoning that a claim is true because so many people believe it is true,C,False,0.026075081899762154,0.10312895476818085,0.19267025589942932,0.6724852323532104
Arguing that what is true of an entire object is also true of each part of that object is the fallacy of,false criteria,hasty generalization,ad crumenam,division,D,True,0.012970605865120888,0.2299094796180725,0.2028944343328476,0.5515242218971252
Which of the following describes the horse laugh fallacy?,responding to an argument with an expression of derision instead of a counter argument,attempts to gain agreement based solely the feelings aroused by the message,characterizing an opponent's position in such way to make it or its consequences appear to be ridiculous,"arguing actions should be taken to avoid negative results, when those results are exaggerated, unlikely, or irrelevant",A,False,0.026014601811766624,0.13211305439472198,0.2468196600675583,0.5920895934104919
Arguing that a lack of evidence proves something is the fallacy of...,Appeal to ignorance,Double negative,Equivocation,Burden of proof,A,False,0.025433998554944992,0.2129562795162201,0.16585050523281097,0.5788751244544983
The argument against the person consists of,ignoring another person's arguments and attacking her character instead,"asserting an opposing arguer has taken an easily defeated position, which she has not really taken",causing confusion during an argument by a lack of ability to engage in refutation,using threats of harm instead of reasoning to gain agreement,A,False,0.0040800198912620544,0.026605071499943733,0.081949383020401,0.8810389637947083
Which of the following fallacies happens when someone concludes that someone must be honest because the people he hangs around with are honest?,Laudatory personality,Guilt by association,Reprehensible personality,Circular reasoning,B,False,0.007780509535223246,0.1379128396511078,0.2919614911079407,0.5454558730125427
Asking a question that includes an unproven assumption may lead to which of the following fallacies?,Appeal to ignorance,Extension,a priori,Complex question,D,True,0.0024521208833903074,0.02636278234422207,0.15170733630657196,0.7704334259033203
"Polonius in William Shakespeare's Hamlet: ""Your noble son is mad: Mad call I it, for to define true madness, What is't but to be nothing else but mad?""",Attacking the Person (ad hominem),Equivocation,Begging the Question,Appeal to Pity,C,False,0.020158857107162476,0.16878806054592133,0.09034572541713715,0.45881348848342896
Notice from the Hyatt Regency Hotel in New Orleans: We are pleased to confirm your reservation. It will be held on a space-available basis.,Equivocation,Affirming the Consequent,Gambler's Fallacy,Inconsistency,D,True,0.013363243080675602,0.08713928610086441,0.3905312120914459,0.5014520287513733
The natural law fallacy is,arguing that something is necessarily bad because it doesn't cost very much,substituting individual stories for a larger sample when supporting a generalization,arguing that what is true in nature must be true about humans,the same thing as the  post hoc  fallacy,C,False,0.015793483704328537,0.04293113574385643,0.048647355288267136,0.8622949719429016
"If someone uses an emotionally charged restatement of a claim in place of support for the claim, that person may have committed which of the following fallacies?",Style over substance,Question begging epithets,Hypostatization,Amphiboly,B,False,0.013368399813771248,0.08717291057109833,0.5016455054283142,0.3906819224357605
Arguing that a claim must be true merely because a substantial number of people believe it is called the fallacy of...,Tu quoque,Composition,Appeal to the masses,Appeal to reason,C,False,0.004946155473589897,0.05317617952823639,0.27005094289779663,0.5716978311538696
_Ad populum_. is another name for which fallacy?,poisoning the well,suppressed evidence,appeal to pride,appeal to the people,D,True,0.0023837299086153507,0.03290637582540512,0.06966279447078705,0.7489456534385681
In a valid disjunctive syllogism the minor premise must,accept one choice,reject all but one choice,either A or B,none of the above,C,True,0.022358933463692665,0.08843130618333817,0.5766445398330688,0.30865558981895447
Which of the following describes the fallacy of appeal to spite?,responding to an argument with an expression of derision instead of a counter argument,arguing against a position based only on negative personal feelings toward the position,arguing someone should do something only because that person dislikes someone else,saying someone shouldn't do something because if he or she does it people won't like him or her,C,False,0.009195937775075436,0.05996504798531532,0.09886564314365387,0.8277918696403503
_Ad hominem_ is another name for the fallacy of,appeal to loyalty,reducing to an absurdity,ignorance of refutation,argument against the person,D,True,0.02178098075091839,0.11061293631792068,0.30067718029022217,0.561738908290863
The fallacy of appeal to the person is rejecting a claim by...,Using rhetoric,Making false statements,Ignoring the person,Criticizing the person who makes it,D,True,0.010696163401007652,0.1303059309720993,0.18959404528141022,0.6617481708526611
Another name for hasty conclusion is,hasty generalization,post hoc ergo prompter hoc,jumping to a conclusion,ad novitatem,C,False,0.002031773328781128,0.031782276928424835,0.16140373051166534,0.6383641362190247
"John S. Knight, Detroit Free Press (3 July 1970): ...Capitalism is the economic system in which the means of production and distribution are privately owned and operated for profit. The alternative system is called socialism, the theory of the ownership and operation of the means of production by society, with all members sharing in the work and the products.",Begging the Question,False Dilemma,Straw Man,Appeal to Gallery (Provicialism),B,False,0.005978240165859461,0.038983024656772614,0.12007617205381393,0.41910701990127563
The fallacy of composition is,attributing the cause of an event to a simple cause when the cause is more complex,arguing that what is true of part of an object must be true of the entire object,drawing a conclusion without enough evidence to support that conclusion,drawing a conclusion based on sign reasoning when there is not really a direct relationship between the alleged sign and the subject of the conclusion,B,False,0.04360412433743477,0.17245766520500183,0.5312070250511169,0.2509244382381439
""" _Ad crumenam_ "" is a specific kind of",False analogy,Hasty Generalization,False sign,Hasty Conclusion,C,False,0.020664911717176437,0.11891835182905197,0.22216875851154327,0.6039172410964966
Which of the following fallacies happens when someone draws a conclusion that is simply a restatement of one of the premises?,Laudatory personality,Guilt by association,Accident,Begging the question,D,True,0.005575014743953943,0.1268867403268814,0.06791757792234421,0.6443840861320496
"I don't know what the answer is to number 8. But Heather hasn't made the third option into the correct answer for a while, and even then only once, so I'm guessing that this is the fallacy of Composition!",Gambler's Fallacy,Equivocation,Fallacy of Composition,Appeal to Pity,A,False,8.623678695585113e-06,0.00011904621351277456,0.0009967617224901915,0.00036668815300799906
"When someone argues that making a change will have no significant effect, but there is no evidence that the effect will not be significant, that person has committed which of the following fallacies?",poisoning the well,solid slope,appeal to tradition,argument from authority,B,False,0.008111689239740372,0.07696156203746796,0.2686222195625305,0.6443912386894226
Which of the following best describes the fallacy of question begging epithets?,Treating something that exists in the mind as if it was a real object.,"A form of loaded language that uses an emotionally charged restatement of the claim, often in the form of name calling, in place of support for the claim.",Changing the meaning of a word or phrase from one part of the argument to another.,"Reasoning that ideas presented in an appealing manner are correct, regardless of the content of the message.",B,False,0.09892896562814713,0.163106307387352,0.2689168155193329,0.4433688521385193
Which of the following describes he fallacy of appeal to pride?,arguing a claim should be accepted based only on evidence that unidentified authorities accept it.,arguing someone should accept a claim based only on the evidence that he or she has the favorable characteristics to understand the truth of the claim.,"arguing something should be done based only on evidence that it's been done that way in the past, or should be believed only because it's been believed for a long time.","arguing that an act or series of acts should be carried out because they will have no significant consequences, when there is no evidence for the lack of significant effects.",B,False,0.03312864527106285,0.07947149127721786,0.21602590382099152,0.6654066443443298
A syllogism that is formally invalid,cannot be materially true,might be materially true,might be materially untrue,both B and C,D,True,0.000955263851210475,0.06696916371583939,0.04061885178089142,0.6353857517242432
Another name for the fallacy of false dilemma is,Guilt by association,Circular reasoning,Laudatory personality,False dichotomy,D,True,0.0006718842196278274,0.019635336473584175,0.010510037653148174,0.6502330303192139
"When someone responds to your argument with a sarcastic statement such as, ""Yeah, right. Like that's ever going to happen,"" that person may have committed which fallacy?",appeal to indignation,appeal to spite,horse laugh,tu quoque,C,False,0.010838071815669537,0.16953596472740173,0.24667339026927948,0.4066956639289856
The _post hoc_ fallacy is,arguing that a single event caused another when the cause is really several events,arguing that since two things happened at the same time one must have caused the other,drawing a conclusion about a causal relationship when there is no evidence of a causal relationship,arguing that since one event preceded another event the first event must have caused the second event,D,False,0.03920834884047508,0.12077020853757858,0.6133217811584473,0.22562849521636963
The fallacy of reprehensible personality is a specific type of,the fallacy of accident,False dilemma,Begging the question,Circular reasoning,A,False,0.004531616810709238,0.04871947318315506,0.17004767060279846,0.7621008157730103
_A priori_ is a fallacy that involves,"asking a question that includes either an unproven assumption or more than one question, thus making a straightforward yes or no answer meaningless.",arguing something is inferior just because it doesn't do something it was never intended to do.,arguing that a claim must be true because there is no evidence that it is false.,"reasoning that determines the conclusion one wants first, then accepts only evidence supporting that conclusion, or interprets all evidence as support for that conclusion.",D,False,0.07883904874324799,0.4003777503967285,0.4536874294281006,0.0613999143242836
"If you say an opposing arguer has taken a position that you can easily defeat, when he or she has not taken that position, then you go on to defeat that position and claim to have done significant damage to that arguer's overall argument, you are probably guilty of which of the following fallacies?",genetic fallacy,appeal to emotions,straw person,ignorance of refutation,C,False,0.006714668590575457,0.0818014070391655,0.22235926985740662,0.684914767742157
"""The minor premise must affirm the antecedent or deny the consequent"" is a way to determine the validity of which type of argument?",Categorical syllogism,Disjunctive syllogism,Hypothetical syllogism,Toulmin model,C,False,0.007753125391900539,0.044616155326366425,0.018598780035972595,0.006842108443379402
Arguing that someone couldn't have done something good because he is incapable of doing good commits the fallacy of,Begging the question,False dilemma,Accident,False dichotomy,A,False,0.01477373018860817,0.12369892001152039,0.23110003769397736,0.6281949877738953
The complex proposition fallacy involves,including more than one claim in the proposition and treating proof for one claim as proof for all the claims.,"asking a question that includes either an unproven assumption or more than one question, thus making a straightforward yes or no answer meaningless.",arguing that a claim must be true because there is no evidence that it is false.,arguing something is inferior just because it doesn't do something it was never intended to do.,A,False,0.0243975929915905,0.18027518689632416,0.7130022048950195,0.0663195326924324
Anecdotal evidence is a specific kind of,False sign,False criteria,False cause,Hasty Generalization,D,True,0.0037510902620851994,0.05867692455649376,0.14075861871242523,0.7148312926292419
Fallacies can be psychologically persuasive even though they are...,Psychologically impotent,Logically flawed,Deductively valid,Inductively valid,B,False,6.7161718106945045e-06,0.00013489792763721198,0.000685068138409406,0.0008796449401415884
Referring to an act committed by an opponent in negative terms while referring to the same act committed by the arguer or supporters in favorable terms describes which of the following fallacies?,Ambiguity,Special pleading,Reification,Hypostatization,B,False,0.023461809381842613,0.08188976347446442,0.28582337498664856,0.6050880551338196
Which of the following explanations best fits the fallacy of ignorance of refutation?,"asserting an argumentative opponent has taken an easily defeated position, which the opponent has not really taken, defeating the position, and acting as if you've done significant damage to that person's overall argument.",causing confusion during refutation because of a real or feigned lack of the ability to engage in refutation,characterizing an opposing argument in such a way to make it or its consequences appear to be ridiculous,arguing an action should be taken based only on the need to be loyal to someone or to a group,B,False,0.061805445700883865,0.2769927978515625,0.4030221104621887,0.24444527924060822
Another name for the fallacy of reducing to an absurdity is,tu quoque,ad baculum,ad hominem,reductio ad absurdum,D,True,1.8540198652772233e-05,0.00047815809375606477,0.0031179822981357574,0.005140683613717556
Another name for the fallacy of complex question is,Fallacy of interrogation,Compound proposition,Appeal to ignorance,Extension,A,False,0.00127036205958575,0.025515904650092125,0.0890592560172081,0.844970703125
The appeal to joy fallacy involves,arguing that someone should do something based only on the assertion that it will make him or her feel happier,causing confusion during refutation because of a lack of ability to engage in refutation,arguing for a conclusion based only on feeling sorry for someone when that feeling is irrelevant to the conclusion,arguing someone should do something only because other people will like him or her for doing it,A,False,0.05794244259595871,0.12266413867473602,0.0955309346318245,0.7058834433555603
Another name for the fallacy of accident is,Sweeping generalization,Black-or-white fallacy,Petitio principii,False dichotomy,A,False,0.0032321906182914972,0.0393761470913887,0.10703545063734055,0.5435709357261658
Which of the following describes the fallacy of evading the issue?,arguing that someone should do something only because of ill will towards someone else,characterizing an opponent's position in a way that makes it seem ridiculous,"supporting a claim with evidence or reasoning that is not relevant to the proposition, or responding to another's argument by changing the subject",attempting to gain agreement based only on the feelings aroused in the message,C,True,0.026230381801724434,0.11755640059709549,0.5970007181167603,0.24886691570281982
Including more than one claim in a proposition may lead to which of the following fallacies?,Complex question,Appeal to ignorance,Compound proposition,Extension,C,False,0.0015441548312082887,0.021316399797797203,0.13900037109851837,0.799892008304596
Which of the following fallacies happens when someone concludes that someone couldn't have done something bad because he or she has good qualities?,Laudatory personality,Guilt by association,Reprehensible personality,Circular reasoning,A,False,0.0076775699853897095,0.13608819246292114,0.2880987226963043,0.5382392406463623
Which of the following describes the fallacy of appeal to popularity?,saying someone should do something because he or she dislikes someone else,saying someone should do something to be better liked by others,saying someone should do something because it will make him or her feel good,saying someone should accept an idea because of the source of the idea,B,False,0.038853902369737625,0.06405925005674362,0.19731637835502625,0.6887018084526062
Which fallacy happens because of a failure to recognize the alternatives presented are not mutually exclusive?,Begging the Question,Accident,Circular reasoning,False dilemma,D,True,0.005725047551095486,0.037331998348236084,0.24343523383140564,0.45479685068130493
"In a conditional syllogism, when the minor premise denies the antecedent",no valid conclusion can be drawn,the conclusion must affirm the consequent,the conclusion must deny the consequent,the conclusion must affirm the antecedent,A,False,0.05169294402003288,0.18042609095573425,0.7135990262031555,0.05169294402003288
"The Dean was showing a visitor around the campus. The visitor asked, ""About how many students do you have here?"" After a moment of reflection the Dean replied, ""Oh, I'd guess about one in a hundred.""",Equivocation,Fallacy of Division,Appeal to Authority,Denying the Antecedent,A,False,0.009668640792369843,0.13347147405147552,0.3628130555152893,0.4658612012863159
The appeal to anonymous authority fallacy consists of,"reasoning that an act or series of acts should be carried out because they will have no significant consequences, when there is no evidence there will be no consequences.",arguing that a claim should be accepted based on the evidence that a large number of people accept it,arguing that something should be done because it has been done in the past,arguing a claim should be accepted based only on the assertion that unidentified authorities accept it,D,True,0.05847311019897461,0.1801098734140396,0.262058287858963,0.4895893335342407
A hasty generalization is a fallacy of...,Acceptable premises,Unacceptable premises,Deduction,Acceptable but untrue premises,B,True,0.028653953224420547,0.39555561542510986,0.3080590069293976,0.21172566711902618
Which of the following best describes the fallacy of figure of speech?,"Using emotionally charged language to create an impression about the subject of a claim, without making an argument that the language fits the subject.",Treating something that exists in the mind as if it was a real object.,Confusing figurative language with literal language.,A form of loaded language that uses an emotionally charged restatement of the claim in place of support for the claim.,C,True,0.09215134382247925,0.3216397762298584,0.3644656240940094,0.07176753133535385
The fallacy of extension consists of,"asking a question that includes either an unproven assumption or more than one question, thus making a straightforward yes or no answer meaningless.",arguing something is flawed because it doesn't do what it was never intended to do.,arguing about something when you don't know what you're talking about,including more than one claim in the proposition and treating proof for one claim as proof for all the claims.,B,True,0.051155246794223785,0.4853474795818329,0.20232293009757996,0.25978779792785645
Arguing that a claim must be true because there is no evidence that it is false is which of the following fallacies?,a priori,Extension,Appeal to ignorance,plurium interrogationum,C,False,0.0008387630223296583,0.021631980314850807,0.12448345124721527,0.4923416078090668
Which of the following describes the fallacy of appeal to common practice?,"eliminating a source of evidence from consideration by claiming the source is flawed, when there is no true relationship between the alleged flaw and the reliability of the source","reasoning that an act or series of acts should be carried out because they will have no significant consequences, when there is no evidence there will be no consequences",drawing a conclusion after purposely leaving out evidence or ignoring known evidence that might contradict a claim,arguing that something is the right thing to do based only on evidence that other people are already doing it.,D,True,0.00937181431800127,0.04759399592876434,0.18823792040348053,0.7444953918457031
Which of the following is another name for evading the issue?,"""you too"" fallacy",irrelevant conclusion,appeal to fear,argument against the person,B,False,0.0045289634726941586,0.042969610542058945,0.08027780055999756,0.8630676865577698
"I don't understand why everyone thinks they belong in college. After all, everyone knows that when you are intelligent you'll succeed. But so many people that elect to attend college don't have even the most basic intelligence. How do they expect to get anywhere here?",Attacking the Person (ad hominem),Straw Man,Denying the Antecedent,Begging the Question,C,False,0.03324917331337929,0.21681185066699982,0.27839192748069763,0.4589906632900238
When someone treats an imaginary concept as if it was something tangible that person might commit the fallacy of,Question begging epithets,Misusing ambiguity,Hypostatization,Amphiboly,C,False,0.008442273363471031,0.08009806275367737,0.2177290916442871,0.6706528067588806
Another name for hasty generalization is,false criteria,secundum quid,anecdotal evidence,ad crumenam,B,False,5.968105688225478e-05,0.0013583345571532845,0.006087633315473795,0.03503191098570824
An arguer who threatens another to gain agreement commits the fallacy of,appeal to force,tu quoque,ignorance of refutation,straw person,A,False,0.0004710929933935404,0.00835032295435667,0.07922565937042236,0.27652472257614136
"Which type of syllogism's major premise takes the form, ""All A's are B""?",categorical,disjunctive,conditional,hypothetical,A,False,0.002695661038160324,0.022570492699742317,0.16677463054656982,0.12988421320915222
"Which of the following fallacies happens when someone argues that a choice must be made among a certain set of alternatives, when there are really other alternatives to choose from?",Laudatory personality,Accident,False dilemma,Circular reasoning,C,False,0.004449683707207441,0.06142599135637283,0.353482186794281,0.5143135190010071
"If you think that someone's argument is strong based on their compelling use of language and confident delivery, you've probably committed which fallacy?",Amphiboly,Equivocation,Special pleading,Style over substance,D,False,0.023728322237730026,0.22512805461883545,0.42059457302093506,0.32755938172340393
Which of the following describes the fallacy of appeal to indignation?,attacking the character or background of someone making an argument instead of his or her evidence and reasoning,responding to charges of wrongdoing by saying other people do the same thing,arguing against a position only based on personal feelings toward the position,responding to an argument with an expression of derision instead of a counter argument,C,False,0.03829294815659523,0.17161710560321808,0.32062292098999023,0.4665035903453827
Evading burden of proof is another name for the fallacy of,Extension,Appeal to ignorance,Complex question,Complex proposition,B,False,0.0029673874378204346,0.06753741949796677,0.26711568236351013,0.6407772302627563
