0,1,2,3,4,5,correct,choiceA_probs,choiceB_probs,choiceC_probs,choiceD_probs
"With respect to theories of senescence, it's probably safe to say that",Programmed theories are the best we have at present,Many theories will have to be combined to explain senescence,The evidence for these theories is direct and quickly accumulating,All of these theories are merely speculation at this point,B,False,0.24647735059261322,0.13192982971668243,0.3586224317550659,0.24647735059261322
Current life expectancy in the United States is about,78,82,68,75,A,False,0.22748419642448425,0.10745592415332794,0.48158401250839233,0.17716488242149353
A burial site where the body is allowed to decompose naturally without a casket is called a _____ cemetery,Naturalistic,Green,Rapid decay,Sunshine,B,False,0.0988859310746193,0.0988859310746193,0.7306736707687378,0.059977348893880844
Older adults with higher education and self-esteem are more likely to be,Sexually active,Socially isolated,Lonely as they grow older,Married for a long time,A,False,0.0995464026927948,0.047022394835948944,0.5728500485420227,0.2705952227115631
BMI is regarded as a better measure of health than weight by itself because BMI is based on weight and,Height,Bone structure,Immune Function,Diet and exercise,A,False,0.07053501904010773,0.027621911838650703,0.7583229541778564,0.13177676498889923
Morbidity refers to,Death,Social and emotional isolation,Increased disability and declining health,A period of intense personal loss,C,True,0.162104070186615,0.046443596482276917,0.6411340236663818,0.14305634796619415
Older adults are able to improve their memories and reduce their anxiety about declining memory when,They learn about memory and aging and learn some techniques,They simply learn a number of memory improvement techniques,They learn that many aspects of memory do not decline and some even get better,Older adults cannot do either of these,A,False,0.1265537142753601,0.04955914616584778,0.2364334613084793,0.5671743750572205
Hearing loss for higher pitch is referred to as,Presbyopia,Presbycusis,Pitch deafness,Conductive loss,B,False,0.21553237736225128,0.07928992062807083,0.45628201961517334,0.24423018097877502
"In this chapter's Senior View, Tolly Kleckley told us that personality",Changes a lot past age 50,Doesn't change past age 50,Pretty much stays the same,Changes more for women than for men,C,False,0.45660901069641113,0.14823924005031586,0.2156868278980255,0.16797707974910736
The Kingbergs give us several keys to successful aging; which of the following is one that they did not name?,Eat the correct food but not too much.,Respect each other,Party at least once a month,Make long-range plans,C,False,0.044857949018478394,0.02720772475004196,0.4256003797054291,0.48226842284202576
Those who have lost a close family member to suicide most often experience,A lack of support from others,A desire to kill themselves,Feelings of relief and release,Severe but temporary cognitive impairment,A,False,0.08910088986158371,0.04769226908683777,0.5810107588768005,0.27445006370544434
"Our bodies have a natural, built in defense against free radicals that is referred to as",AFR,SOD,Vitamin C,Telomerase,B,False,0.26036930084228516,0.0957845151424408,0.42927640676498413,0.20277582108974457
Open-ended questions on a survey often make it difficult to,Get people to fill the survey out,Interpret the answers you get from people,Collect data in a timely manner,Get anyone to believe your results,B,False,0.11493156105279922,0.045007847249507904,0.4545631408691406,0.354014128446579
Which of the following groups is likely to have the more positive view of aging and older adults?,Other older adults,Children younger than 10,Young adults,Adolescents,A,False,0.0958506241440773,0.04527663066983223,0.5515822768211365,0.29524073004722595
The paradox of well-being refers to the finding of high levels of happiness among,Unhappy people,Older adults,People with very low SES,Terminally ill people,B,False,0.08601801097393036,0.024644572287797928,0.494999498128891,0.3855060040950775
The Supreme Court has now ruled that older workers need no longer prove _____________ to win a job discrimination suit.,Discrimination,Age bias,Negative impact,Intention,D,False,0.06807146221399307,0.09904339909553528,0.7318372130393982,0.0874054953455925
The decline in working memory with advanced age seems to be due to,A loss of resources and slower processing speed,An increase in the inhibition of relevant information,A general decline in the ability to process information,A severe loss of neural connections and decreased blood flow,A,True,0.3409018814563751,0.2342982143163681,0.3409018814563751,0.06712755560874939
A disadvantage of institutional care is that the staff frequently teach older residents to be,Rude,Dependent,Independent,Selfish,B,False,0.1028360053896904,0.07067808508872986,0.46087899804115295,0.3589329123497009
"If you believe that we are mostly in control of our own development and that our behaviors, good or bad, determine how successful our aging with be, you would be said to have which of the following perspectives?",Organismic,Nurture,Continuity,Mechanistic,A,False,0.1355065405368805,0.2531595528125763,0.5359387397766113,0.06400875747203827
The age at which one can receive full benefits from social security,Is 62,Is 65,Has been increasing,Will never change,C,True,0.1096639484167099,0.05180157721042633,0.49147969484329224,0.33778873085975647
Loss of stomach lining can lead to symptoms that resemble,Anorexia,Dementia,Senescence,Hepatitis,B,False,0.08491693437099457,0.051504723727703094,0.62745600938797,0.2308281809091568
Which of the following has NOT been shown to be an effective treatment for depression in older adults?,Rigorous exercise,Life review,Mental stimulation,Anti-depressant drugs,C,True,0.07375683635473251,0.07375683635473251,0.5449934005737305,0.2917139530181885
The term Baby Boom Generation refers to people who,Were born before WW II,Have had an extraordinary number of offspring,Were born right after WW II,Have raised their children in small villages,C,True,0.20687122642993927,0.05926958844065666,0.5623342394828796,0.16111145913600922
Older workers are more likely to,Be absent from work,Be dissatisfied with their jobs,Be less productive,Be laid off,D,False,0.1924440860748291,0.05513615906238556,0.4616493880748749,0.28000450134277344
"Mabel Davis, in this chapter's Senior View, would agree with which of the following?",Time seems to speed up when you grow older,Exercise keeps your mind sharp,Women are tougher than men,Glasses and hearing aids should be avoided,A,False,0.16129839420318604,0.09783241152763367,0.5629867315292358,0.16129839420318604
"The information stored in memory, according to research and our Senior View interviewees, is",True to life,Our own interpretation,Always exaggerated,Never accurate,B,False,0.22175870835781097,0.15241238474845886,0.3656182885169983,0.2512855529785156
"When speaking with an older adults with some hearing loss, you should",Speak a little slower than normal,Speak loudly into their best ear,Face them so they can watch your lips,Ask another person to translate,C,True,0.20988218486309052,0.14424976706504822,0.44432055950164795,0.1852203607559204
Longevity is strongly associated with higher levels of,Social support,BMI,Alcohol use,Supplement use,A,False,0.11561579257249832,0.06188467517495155,0.4035387635231018,0.4035387635231018
The hypothesis that says adults will remain healthy until very old age and then quickly become ill and die is the ____ hypothesis,Terminal drop,Compression of morbidity,Klagmore-Rensfeldt,Decline avoidance,B,False,0.10705840587615967,0.2000114470720291,0.42342421412467957,0.25681978464126587
The woman who conducted a longitudinal study on herself and found increased retrieval difficulty as she got older was named,Clark,Smith,Whitebear,Ebbinghaus,B,False,0.02598535642027855,0.03780847042798996,0.8605168461799622,0.06233563274145126
