0,1,2,3,4,5,correct,choiceA_probs,choiceB_probs,choiceC_probs,choiceD_probs
The model of social support that says that those who are close to you now are likely to be close for the rest of your days is called the ____ model,Consistency,Convoy,Attachment,Train,B,False,0.04590718820691109,0.06679456681013107,0.7181093096733093,0.1602318435907364
"When older and younger workers have lost their jobs, older workers typically",Find a job quicker because of their greater experience,Take longer to find a new job,Retire rather than search for a new job,Sue the company using the ADEA,B,False,0.2573188841342926,0.07372309267520905,0.424247145652771,0.22708313167095184
Our social network refers to,Everyone we know,Those who are closest to us,Those who we have not yet met,Family members,B,False,0.2576061487197876,0.0947679951786995,0.4812716543674469,0.15624602138996124
Those who survive the loss of another are called the,Survivors,Grieving,Bereaved,Family and friends,C,True,0.19650942087173462,0.08191731572151184,0.6858852505683899,0.023469703271985054
Financial adjustment to retirement has been most difficult for,Married couples,Single men,Single women,Older adults,C,True,0.14239439368247986,0.06726235151290894,0.4386056363582611,0.3415864109992981
Socioemotional selectivity theory says that older adults have smaller social networks because they,Are more concerned with those closest to them,Select new network members based on emotional factors,Can no longer get out to select new network members,Are too emotionally involved to spend time with others,A,False,0.26078471541404724,0.0959373340010643,0.3348541855812073,0.2955077886581421
The gender gap is likely to be associated with male/female differences in,Hormones,Risky behaviors and occupations,Proportion who smoke,All of the above,D,False,0.13731899857521057,0.05051683634519577,0.5431071519851685,0.25654566287994385
Those cells that build bone are called,Osteoblasts,Osteoclasts,Osteostructs,Osteopori,A,False,0.21530704200267792,0.07920702546834946,0.4558050036430359,0.24397484958171844
An increase in neuroticism later in life is a strong predictor of,Mortality,Loss of social support,Cognitive decline,Independence,A,False,0.059554096311330795,0.06748363375663757,0.7255173921585083,0.14286284148693085
Which of the following countries has the longest life expectancy?,U. S. A.,Sweden,Japan,Saudi Arabia,C,True,0.10703814029693604,0.06492191553115845,0.615962028503418,0.19997358322143555
Which type of reaction time results in the biggest age differences?,Simple,Choice,Complex,Elaborate,C,True,0.07535906881093979,0.15953513979911804,0.49140283465385437,0.26302897930145264
Gary says he won $1000 in the lottery because he really knows how to pick those numbers. Gary would be said to have a strong ____ locus of control,"External, powerful others",Internal,"External, chance",Secondary,B,False,0.11951068788766861,0.2232753485441208,0.5356097221374512,0.10546780377626419
The advanced directive where one specifies the types of medical intervention that are and are not desired is called a,Living will,DNH,DNR,Durable power of attorney,A,False,0.21506837010383606,0.18979719281196594,0.5159222483634949,0.06982248276472092
"If links between various diseases are found, then future older adults will probably",Take fewer medications,Be able to avoid certain diseases,Pay far less for pharmaceuticals,Pick and choose the disease(s) they want,A,False,0.17777478694915771,0.15688572824001312,0.42645955085754395,0.2282673716545105
With respect to hair loss,Men lose but women do not,Men are more systematic than women,Women lose hair less frequently but more rapidly than men,Environmental factors are the main causes,B,False,0.08556237071752548,0.03350670635700226,0.6322251558303833,0.23258265852928162
"In this chapter's Senior View, Pat Shelley told us that you shouldn't retire if",You can't do it right,You're younger than 60,Your family wants you to keep working,You have no hobbies,A,False,0.1627475619316101,0.08711248636245728,0.5012977719306946,0.2367963194847107
"A person who is not very well organized, rarely sets goals, and frequently puts things off until the last minute would be said to be low on which trait?",Agreeableness,Conscientiousness,Openness,Neuroticism,B,False,0.06395290791988373,0.09305093437433243,0.4170253276824951,0.4170253276824951
As working people get closer to retirement they are more likely to,Be absent from work,Invest in craft and hobby books,Do some informal planning,Become irritated and anxious,C,True,0.08411448448896408,0.03506413474678993,0.7980560064315796,0.07423077523708344
Older adults may show less major depression than younger adults because they,Have learned to cope with loss,See major depression as a stigma,Have very different brain biochemistry,Are no longer concerned with emotional matters,A,False,0.08860349655151367,0.034697629511356354,0.5098779797554016,0.35043367743492126
The different components of memory should be thought of as,Being very independent,Working one at a time,Working as a system,Taking turns,C,True,0.08280953019857407,0.039116453379392624,0.6933556795120239,0.1753077656030655
"Very rapid disposal of the body, before sundown on the day of the death, is typical of which religion?",Islam,Hindu,Jewish,Tao,B,False,0.1484380066394806,0.07945314049720764,0.5180995464324951,0.24473291635513306
An example of an objective test of personality is the,TAT,MMPI,Rorschach ink blot test,McAdams test of levels,B,False,0.13485227525234222,0.15280766785144806,0.4153742790222168,0.2854822874069214
"When a measure actually quantifies what it claims to measure, we say that it has good",Accuracy,Validity,Reliability,Associative value,B,False,0.11126840114593506,0.07647357881069183,0.498670369386673,0.30245888233184814
In which country do most individuals choose to be cremated?,Japan,U. S. A.,Kenya,Mexico,A,False,0.05077345669269562,0.0575338639318943,0.6185473203659058,0.2578488886356354
A possible positive effect of moderate alcohol consumption is that it may,Inhibit the growth of cancers,Promote healing from injuries and illnesses,Keep blood vessels from stiffening,Result in relaxation and lower blood pressure,C,True,0.1431722193956375,0.09840071946382523,0.3891824185848236,0.3434522747993469
The environmental design that brings pets and plants to nursing homes and young people and children as regular visitors is referred to as,Instrumental Living Design,The Humanistic Choice,Human-Environment Congruence,The Eden Alternative,D,False,0.2932567894458771,0.22838862240314484,0.4266861081123352,0.04497238248586655
Excess disability refers to symptoms that are,Not due to the disease but due instead to malignant social psychology,In excess of the average for that particular disorder,Found only in the last stage of Alzheimer's,Those that can be successfully treated by medicine if they are caught early enough,A,False,0.17737174034118652,0.17737174034118652,0.33137401938438416,0.29243654012680054
Well being for younger adults is positively related to which form of control?,Positive reappraisal,Lowering of aspirations,Primary,Internal,C,True,0.08902961760759354,0.07856835424900055,0.580545961856842,0.2420075684785843
Which of the following is NOT one of the major reasons for the increase in numbers of older adults?,The Baby Boom generation,The steadily increasing birth rate,Increases in life expectancy at birth,Increases in life expectancy at a specified age,B,False,0.07154001295566559,0.03829260542988777,0.4664994478225708,0.4116843044757843
Before we can collect data from other human beings we must make sure that they,Have information that will be worth our effort to collect,Are going to be honest and forthright,Are informed about our study and give their consent to participate,Have been granted permission to participate by the IRB,C,True,0.27370429039001465,0.06920327991247177,0.45126205682754517,0.1660100519657135
"In this chapter's Senior View, May Lee told us that we should all respect our elders because",They are much older than we are,They raised us,They lived through difficult times,They ask nothing in return,B,False,0.24719934165477753,0.10304801166057587,0.5233209729194641,0.11676870286464691
One line of evidence against antagonistic pleiotropy is that,Women who have more children tend to live longer,Some animals show little or no senescence,Even tissue cells with longer telomere strands can show senescence,Exercise increases rather than decreases longevity,A,False,0.12728168070316315,0.09912708401679993,0.6463897824287415,0.11232569068670273
Loss of muscle fiber may be due to loss of neurons which may be due to,Clogged blood vessels,Loss of bone density,Changes in hormone levels,Loss of collagen,A,False,0.1527823954820633,0.08177851885557175,0.4706028997898102,0.28543511033058167
"After losing a spouse, the surviving spouse often dies within the first year because of",Stress and loss of social support,Having the same disorder as the deceased,The inability to remarry quickly,They have the same defective genes,A,False,0.12299948930740356,0.08453622460365295,0.4864724278450012,0.2950604557991028
Which of the following factors has NOT received as much support as the others in research investigating why social support is related to better health?,Social,Behavioral,Psychological,Gerontological,B,False,0.07013574242591858,0.04253947734832764,0.5182369351387024,0.3561787009239197
Older adults' coping strategies are generally,Ineffective at solving problems,Variable as they have more strategies,Persistent as they use the same strategy over and over,Narrow as they ignore many aspects of the problem,B,False,0.17138294875621796,0.08095557242631912,0.3628177046775818,0.3628177046775818
Men are more likely than women to die from,Septicemia,Stroke,Suicide,Influenza,C,True,0.14075221121311188,0.09673748165369034,0.4912734925746918,0.2629597783088684
The slowing that occurs with advanced age appears to be centered in,The sense organs themselves,The brain,The muscle fibers,The peripheral nervous system,B,False,0.11233948171138763,0.06813734024763107,0.5705069899559021,0.23782268166542053
One possible reason that time seems to pass more rapidly for older adults is that,Their memories are poor so they forget to check the time,They have fewer novel experiences,They pay less attention to important events in life,Their lives are full of events which they don't recall at a later time,B,False,0.2199384719133377,0.07140356302261353,0.41089916229248047,0.28240659832954407
"If we found that adult age was significantly and positively correlated with consumption of herbal teas, we could conclude that",Drinking herbal teas makes one grow older more slowly,Becoming older causes one to begin or increase consumption of herbal teas,Older adults drink less herbal tea than do younger adults,Older adults drink more herbal tea than do younger adults,D,False,0.15992435812950134,0.09699902683496475,0.3836386203765869,0.3385598659515381
The initials ADL stand for,Activities of Daily Living,American Disease Legion,Always Delay Learning,Ancient Dependent Ladies,A,False,0.04802859574556351,0.03981710225343704,0.7997479438781738,0.07438813894987106
The dementia that results from a long-term deficiency of thiamine is one type of ____ dementia,Alzheimer's,Korsakoff's,Creutzfeldt-Jakob,Lewy body,B,False,0.06116008386015892,0.02395063452422619,0.6575328707695007,0.24189285933971405
The initial length of telomere stand for members of a species is,Always the same,Determined genetically,Dependent upon climate and time of year at birth,Determined by parent diet and exercise,B,False,0.2120678424835205,0.10017373412847519,0.576460063457489,0.08840302377939224
The current record for longest lived human being is held by,Jeanne Calment,Maggie Kuhn,Maria Esther de Capovilla,M. Cherie Clark,A,False,0.23096497356891632,0.1400873363018036,0.4889528453350067,0.10910013318061829
Glaucoma refers to the condition in which,Fluid pressure in the eye is above normal,Inner and outer layers of the retina separate,The lens becomes cloudy and opaque,The central part of the retina no longer functions,A,True,0.6497818827629089,0.08793841302394867,0.16429059207439423,0.08793841302394867
Workers in which of the following jobs still have mandatory retirements once they reach a certain age?,Cab drivers,Fire fighters,Insurance regulators,Computer programmers,B,False,0.11494958400726318,0.11494958400726318,0.40121346712112427,0.35406962037086487
Validation therapy refers to treatments in which the person with dementia,Is carefully monitored day and night,Is treated like a fellow human being,Is left alone to die peacefully,Is given double or triple doses of medication,B,False,0.10405489057302475,0.07151580601930618,0.678523063659668,0.1336091011762619
Surveys of bereaved individuals have found that one of the things that is reported as being most helpful is when others,Avoid any discussion of the deceased,Remain in close contact,Stay away and let the person grieve,Change the home environment for the bereaved,B,False,0.13888485729694366,0.13888485729694366,0.5493002533912659,0.15737715363502502
"An example of a gain, rather than a loss, that occurs as we grow older is our gain in",Perspective,Quickness,Size of our social networks,Certainty,A,False,0.038163114339113235,0.06292033940553665,0.5268255472183228,0.36208152770996094
Which of the following appears to remain relatively stable over the adult years?,Sensory memories,Personal concerns,Marital strain,Job satisfaction,A,False,0.18258437514305115,0.08624675869941711,0.5623995065689087,0.1611301600933075
Which of the following is always the longest?,Life expectancy at birth (LEAB),Life span,Life expectancy at a specified age (LEASA),There is no way of knowing,B,False,0.4046827554702759,0.07968675345182419,0.31516724824905396,0.19115860760211945
"Of the following, which is the more frequent stereotype of older adults?",Full of wisdom and knowledge,Healthy and independent,Confused and disoriented,Sleepy and lazy,C,True,0.08473385125398636,0.05823666229844093,0.5525341033935547,0.2957502007484436
One reason that older adults may have difficulty in retrieving memories is that,Long-term memory often discards older and unused memories,There are many more memories to search through to find the one that is sought,Older adults quit searching because they have more important things to do,Memory is less well organized as we grow older and finding a memory can be quite difficult,B,False,0.1992236226797104,0.12083522975444794,0.28986865282058716,0.3721987307071686
Even a small amount of sleep deprivation seems to,Increase weight,Improve sleep quality,Disrupt attention the next day,Increase irritability,B,False,0.15567460656166077,0.1998901516199112,0.479511559009552,0.15567460656166077
NEAT may be one way in which some people are able to maintain a healthy BMI; NEAT refers to,Eating the right kinds of low calorie foods,"Daily activities like walking, gesturing, and even fidgeting",Intense aerobic exercise practiced at least 3 times a week,Surgical removal of fatty tissue,B,False,0.3822017312049866,0.09663573652505875,0.43309131264686584,0.058612532913684845
"Over the last decade or two, which of the following causes of death has shown a huge increase?",Alzheimer's,Cancer,Cardiovascular diseases,Homicide,A,False,0.24934683740139008,0.1334657371044159,0.41110342741012573,0.19419151544570923
Which of the following statements is TRUE concerning older workers' job performance?,Older workers always perform better because of their vast experience,"Older workers never perform better than younger workers because with age, a worker's skills decline.",Job performance for older workers depends both upon the decline of skills and the benefits of experience,Most jobs are performed better by younger adults but a few are performed better by older adults,C,True,0.020447863265872,0.026255575940012932,0.8694652915000916,0.059167854487895966
Older adults' negative beliefs about their own memories seem to be more influenced by _____ than by their actual performance on memory tests,Negative stereotypes about older memory,Time of day and weather conditions,Who they are speaking with,Their slower processing speed,A,False,0.11721061915159225,0.09128371626138687,0.40910524129867554,0.361034095287323
Which of the following is NOT one of the more frequently named activities by those who are retired?,Volunteering,Travel,Redoing the home,Household chores,C,True,0.06414645910263062,0.08236567676067352,0.4182874262332916,0.4182874262332916
The retirement phase that occurs least frequently is the ____ phase,Disenchantment,Honeymoon,Retirement routine,Preretirement,A,False,0.026448778808116913,0.023340966552495956,0.4137285351753235,0.5312379598617554
Which of the following is the most important variable for gerontological researchers?,Age,Gender,Cohort,Time of measurement,A,False,0.1305079609155655,0.04236973822116852,0.7510215640068054,0.06985588371753693
Which of the following does NOT increase the risk of falling?,Taking many prescription medications,Visual impairment,Having no emotional support,A change in walking style or gait,C,False,0.023302827030420303,0.0525137297809124,0.34243255853652954,0.5645757913589478
The main reason given by men and women for their long lasting marriage is that,They are best friends,They must fulfill their vows,They agree on almost everything,They owe it to their children,A,False,0.15079021453857422,0.05547261983156204,0.46446657180786133,0.31922289729118347
"An older adult who has received a message (e.g., it's going to rain tomorrow) would be most likely to remember what when telling another person?",The person who told them it would rain,Where they were when they received the message,The contents of the message,The time of day that the message was received,C,True,0.22215646505355835,0.09260858595371246,0.6038838028907776,0.07212363928556442
The lifespan perspective says that development is composed of gains and losses; this means that,We gain while we are younger but lose when we are older,We gain some things and lose others at every age,For every aspect of development there is no overall change since each gain is offset by loss,Gains are far more important than losses but losses occur too,B,False,0.10024525970220566,0.12871746718883514,0.5090875029563904,0.24047590792179108
Identity refers to one's,Use of a particular coping strategy,Control over one's own life story,Physical appearance and overall personality,Coherent sense of self,D,False,0.5114961266517639,0.047576550394296646,0.24161368608474731,0.1881689429283142
Current estimates of how many people exercise on a regular basis suggest that _____ do,Less than 50%,More than 75%,Less than 25%,More than 50%,A,False,0.14541925489902496,0.1867220401763916,0.507563054561615,0.14541925489902496
An increased frequency of urination in older adults is most likely caused by,Prostate cancer,Smaller bladder,Kidney problems,Gall stone(s),B,False,0.11464598029851913,0.06953630596399307,0.45343366265296936,0.35313448309898376
Some research has found that later cognitive decline is predicted by earlier,Cardiovascular problems,Loss of muscle strength,Immune system decline,Graying of hair,B,False,0.07876940816640854,0.042162224650382996,0.5136410593986511,0.3530200123786926
The law that requires all healthcare institutions that receive Medicaid funds to inform patients about advance directives is called the,Patient Self-Determination Act,Informed Consent Act,Advance Directive,Medicaid Directive Information Act,A,False,0.16868673264980316,0.10231366008520126,0.5887745022773743,0.1313733607530594
Which of the following is NOT among the top 10 causes of death in the U. S.?,Kidney diseases,AIDS,Septicemia,Accidents,B,False,0.02218594215810299,0.005971264559775591,0.17450594902038574,0.7820813655853271
Presbyopia refers to,The point of clearest vision moving closer to the eye,The decline in vision with advanced age,The loss of hearing for higher pitch as one grows older,The point of clearest vision moving farther from the eye,D,True,0.3115173876285553,0.047772739082574844,0.27491313219070435,0.35299545526504517
The design of products and environments to fit the capabilities of people who use them or live there is called _____ design,Environmental,Ecological,Ergonomic,Eclectic,C,True,0.18439988791942596,0.11184418201446533,0.5679916739463806,0.12673607468605042
The insurance program for poor people of all ages is called,Hospice,Medicaid,Medicare,Respite,B,False,0.109012670814991,0.05835027992725372,0.48856088519096375,0.3357826769351959
When damage to the brain is irreversible and increasing we refer to the disorder as,Delirium,MCI,Dementia,Pick's,C,True,0.1038317158818245,0.06297711282968521,0.6770678162574768,0.15107424557209015
Grandparents with grandchildren in college report feeling especially loved when such grandchildren,Ask about their satisfaction with life and offer to help,Visit during the holidays and bring gifts,Pay a surprise visit and ask for advice,Invite the grandparents over to their place and cook a good meal,C,True,0.22729943692684174,0.07379332184791565,0.5452629923820496,0.10736864805221558
The influence of genetics on longevity is estimated to be about,20%,33%,50%,75%,B,False,0.22989143431186676,0.12305201590061188,0.3790268898010254,0.26050111651420593
Older adults are most likely to be involved in a traffic accident when they are,On foot,Driving in a new location,A passenger in a younger person's car,Alone,A,False,0.16132500767707825,0.1423688381910324,0.38699856400489807,0.3013947904109955
Life stories are more likely for people who have a sense of,Well being,Personal control,Generativity,Humor,B,False,0.08988631516695023,0.04811268299818039,0.6641750335693359,0.19028934836387634
The idea that the ability to complete a task depends on the fit between the environment and the person undertaking the task is a basic tenet of which of the following theories of aging?,Environmental,Ecological,Fitness,Congruence,B,False,0.1121799498796463,0.09899845719337463,0.569696843624115,0.20957976579666138
Neuroticism has been found to be correlated with which of the following?,Anger and guilt,Apathy and indifference,Deceit and cunning,Mania and hypertension,A,False,0.10238785296678543,0.09035696089267731,0.5199684500694275,0.2783190608024597
The Apo-E 2 protein is very prevalent in people who,Die young,Live to be 100 or older,Have healthy immune systems,Also have high levels of Apo-E 4,B,False,0.08472958207130432,0.04002342000603676,0.6260716319084167,0.23031890392303467
Information coming into our cognitive system is thought to first enter a,Sensory memory,Perceptual processor,Working memory,Meta-memory,A,False,0.19901005923748016,0.09400569647550583,0.3717997372150421,0.32811209559440613
Omega 3 appears to reduce the risk of,Some cancers,Cardiovascular disease,Arthritis,Insomnia,B,False,0.2680855393409729,0.1266346424818039,0.390062153339386,0.20878523588180542
"The term ""senescence"" refers to",An increased vulnerability,The process of becoming older,The loss of mental abilities,Biological aging,A,False,0.15031956136226654,0.0626625195145607,0.4630168676376343,0.31822654604911804
Which of the following is caused by a prion?,Vascular dementia,Alzheimer's,Creutzfeldt-Jakob,Huntington's,C,True,0.0765325203537941,0.03615140542387962,0.44041427969932556,0.44041427969932556
A difference between the social networks of older and younger adults is that older adults have,Larger inner circles,Larger outer circles,Smaller inner circles,Smaller outer circles,D,False,0.30015772581100464,0.2062951773405075,0.3401232361793518,0.1417844593524933
The first person to measure and compare the response times of young and old was,Francis Galton,William James,Michelle Meer,Tom Penge,A,False,0.038067929446697235,0.0711202621459961,0.7646148800849915,0.1172574907541275
About what percentage of people who have had bridge jobs say it was better than their career job?,Less than 25%,Less than 50%,More than 50%,More than 75%,C,True,0.07527084648609161,0.12410064041614532,0.6302350759506226,0.15934838354587555
We want our measures to be as reliable as possible; reliability refers to,Whether our measure really measure anything at all,Whether our measure is really measuring what it claims to measure,Whether our measure is consistent in the information it provides,Whether our measure has or has not been used before,C,False,0.38434848189353943,0.14139392971992493,0.38434848189353943,0.07568269968032837
A problem in comparing older adults' memory for recent events and events that happened a long time ago is that recent events,May be very well rehearsed,Are far more meaningful,Have no denominator to help in computing an average,Can be verified while older events often cannot,D,False,0.12178973108530045,0.10747906565666199,0.3751387894153595,0.3751387894153595
"Of the following types of memory, which shows the biggest deficit with advanced age?",Sensory memory,Episodic memory,Semantic memory,Procedural memory,B,False,0.16383568942546844,0.08769491314888,0.5046494603157043,0.23837952315807343
The loss of a ____ is regarded in the U. S. as the most severe loss and frequently produces guilt in addition to other emotions.,Spouse,Parent,Child,Sibling,C,True,0.07301994413137436,0.07301994413137436,0.6927939653396606,0.15458323061466217
DNA damage/repair theory claims that senescence is due to cells getting incorrect instructions from DNA damaged by sources such as,Radiation from anti-oxidants,Metabolic processes,Free radicals and sunlight,Telomerase,C,False,0.14100196957588196,0.10981243848800659,0.33824610710144043,0.3832830488681793
Comorbidity is a problem for older adults because it,Makes correct diagnoses difficult,Increases funeral costs,Is very contagious,"Cannot, at present, be cured",A,False,0.14881892502307892,0.07965701818466187,0.3569979965686798,0.4045317471027374
