0,1,2,3,4,5,correct,choiceA_probs,choiceB_probs,choiceC_probs,choiceD_probs
In a Robertsonian translocation fusion occurs at the:,telomeres.,centromeres.,histones.,ends of the long arms.,B,False,0.25952422618865967,0.10818580538034439,0.2940794825553894,0.10818580538034439
Zinc finger proteins and helix-turn-helix proteins are,types of DNA-binding proteins,involved in the control of translation,components of ribosomes,part of the hemoglobin in blood cells,A,False,0.23203769326210022,0.14981478452682495,0.29794228076934814,0.1322110891342163
"If the frequency of males affected with an X-linked recessive condition in a human population is .10 (one in ten), what will be the expected frequency of affected females?",0.01,0.001,0.02,0.0001,A,False,0.18051311373710632,0.09076768904924393,0.20454815030097961,0.09076768904924393
In DNA adenine normally pairs with:,cytosine.,guanine.,thymine.,uracil.,C,True,0.14218337833881378,0.1178741604089737,0.2827654182910919,0.09772111475467682
The pattern of inheritance shown by malignant hyperthermia (hyperpyrexia) is:,autosomal dominant.,autosomal recessive.,X-linked dominant.,X-linked recessive.,A,False,0.173989400267601,0.20987126231193542,0.28686001896858215,0.07252956926822662
Mapping of human chromosomes:,has been restricted to the sex chromosomes because of small family sizes,proceeded much more successfully as large numbers of DNA markers became available.,has determined that the number of linkage groups is about twice the number of chromosomes,has demonstrated that almost all of the DNA is involved in coding for genes,B,False,0.07624536752700806,0.13381478190422058,0.17182159423828125,0.18290314078330994
Intergenerational transmission to offspring can occur as a result of parental exposures to ______.,war,natural disasters,hunger,all of these,D,False,0.24034641683101654,0.05037934333086014,0.2257845550775528,0.028705285862088203
Asp235Phe in a molecular report indicates that:,asparagine has been replaced by phenylalanine.,phenylalanine has been replaced by asparagine.,aspartic acid has been replaced by phenylalanine.,phenylalanine has been replaced by aspartic acid.,C,True,0.20189353823661804,0.12245461344718933,0.37718677520751953,0.12245461344718933
The risk of abnormality in the child of a mother with untreated phenylketonuria is:,1%,10%,25%,Almost 100%,D,False,0.06291979551315308,0.17103374004364014,0.2649022340774536,0.2649022340774536
Exon skipping is associated with:,nonsense mutations.,regulatory mutations.,RNA processing mutations.,silent mutations.,C,True,0.10915622115135193,0.10915622115135193,0.405564546585083,0.19157513976097107
Which of the following is not a chromosome instability syndrome?,Klinefelter syndrome,Ataxia telangiectasia,Fanconi anaemia,Bloom syndrome,A,False,0.023718709126114845,0.0827864333987236,0.44753921031951904,0.3485438823699951
Normal adult haemoglobin (Hb A) consists of:,two α (alpha) and two β (beta) chains.,two α and two γ (gamma) chains.,two α and two δ (delta) chains.,four γ chains.,A,False,0.20707637071609497,0.16127122938632965,0.2830398380756378,0.11798855662345886
In a condition such as schizophrenia the recurrence risk will be greatest for which of the following relatives of an affected individual?,Brother,Nephew,Grandchild,Aunt,A,False,0.09513765573501587,0.08937356621026993,0.3119443655014038,0.21439602971076965
The mutation in sickle-cell disease consists of:,a deletion.,a duplication.,an insertion.,a point mutation.,D,False,0.07283472269773483,0.10597389191389084,0.3474750220775604,0.30664563179016113
Which of the following is an example of monosomy?,"46,XX","47,XXX","69,XYY","45,X",D,False,0.16298888623714447,0.09286826103925705,0.3450474441051483,0.18469059467315674
QTL analysis is used to,identify chromosome regions associated with a complex trait in a genetic cross,determine which genes are expressed at a developmental stage,map genes in bacterial viruses,identify RNA polymerase binding sites,A,False,0.09248735010623932,0.15248586237430573,0.2848810851573944,0.14324720203876495
What would be the frequency of AABBCC individuals from a mating of two AaBbCc individuals?,1.0/64,1.0/32,1.0/128,1.0/256,A,False,0.10059695690870285,0.061015140265226364,0.13749973475933075,0.07359830290079117
It is currently estimated that there are ______ human protein-coding genes although this estimate may be reduced over time.,"10,000–15,000","19,000–20,000","29,000–30,000","100,000",B,False,0.15559238195419312,0.14616550505161285,0.15559238195419312,0.1876802295446396
With which of the following relatives is an individual most likely to share a common HLA haplotype?,Father,Mother,Sister,Son,C,True,0.14810217916965485,0.14810217916965485,0.20243169367313385,0.19016698002815247
Which of the following genes conveys susceptibility for polygenic Alzheimer disease?,APP,PS1,PS2,APOE,D,True,0.07694120705127716,0.092808797955513,0.22263675928115845,0.4713220000267029
The DiGeorge/Shprintzen syndrome is caused by a deletion in which chromosome?,4,7,15,22,D,False,0.19414781033992767,0.11062208563089371,0.26536858081817627,0.12535125017166138
X-chromosome inactivation,results in genetically turning off one of the two X chromosomes in female mammals,takes place in humans so that the same X chromosome is inactive in all of the cells of a female,is the cause of the Y chromosome being genetically inactive,occurs in fruit flies but not in mammals,A,False,0.09012500941753387,0.07018942385911942,0.3564513325691223,0.1907946616411209
The pattern of inheritance shown by glucose-6-phosphate dehydrogenase (G6PD) deficiency is:,autosomal dominant.,autosomal recessive.,X-linked dominant.,X-linked recessive.,D,False,0.17053861916065216,0.1932455599308014,0.31860804557800293,0.06678387522697449
Homeobox sequences,are present in the genome of many animal species,are found in prokaryotes but not in eukaryotes,were identified as the integration sites for bacterial viruses,represent integration sites for transposable elements,A,False,0.09627515077590942,0.09627515077590942,0.3156740665435791,0.2785813808441162
Which of the following karyotypes is diagnostic of Down syndrome,"46,XX,der(14;21)(q10;q10)pat+21","47,XY,+13","45,XX,rob,(14;21)(q10;q10)","46,XY,t(2;3)(q21;q12)",A,False,0.10742464661598206,0.04766939952969551,0.12172806262969971,0.04478125274181366
"Nature is more important for ______ differences, while nurture has greater influence on ______ differences.",structural and anatomical; psychological and social,psychological and social; structural and anatomical,structural and psychological; anatomical and social,social and anatomical; psychological and structural,A,False,0.10761851817369461,0.07396505773067474,0.2581634223461151,0.18887637555599213
Which of the following would result in Angelman syndrome?,Maternal UPD 15,Paternal UPD 15,Deletion in the paternally derived chromosome 15,A mutation in the SNRPN promoter,B,False,0.08006446808576584,0.07521361112594604,0.31666111946105957,0.204451784491539
Recombinant alpha-iduronidase is used for the treatment of which disease/syndrome?,Fabry disease,Gaucher disease,Hurler syndrome,Pompe disease,C,True,0.0945124700665474,0.0945124700665474,0.35115641355514526,0.2734808921813965
Research from Moshe Szyf and colleagues has provided significant findings on the epigenetic influences of prenatal maternal stress. This work has been labelled ______.,developmental epigenetics,social epigenetics,fetal epigenetics,maternal epigenetics,B,False,0.17693008482456207,0.047620080411434174,0.27403467893600464,0.27403467893600464
If both parents are affected with the same autosomal recessive disorder then the probability that each of their children will be affected equals ___.,1 in 4,1 in 2,2 in 3,1,D,False,0.09746500104665756,0.11044231057167053,0.21964076161384583,0.21964076161384583
The mutational mechanism in δβ-thalassaemia consists of:,a deletion.,a duplication.,an insertion.,a point mutation.,A,False,0.16308465600013733,0.14392173290252686,0.39121976494789124,0.14392173290252686
"Assuming Hardy-Weinberg equilibrium, the genoypte frequency of heterozygotes, if the frequency of the two alleles at the gene being studied are 0.6 and 0.4, will be:",0.8,0.64,0.48,0.32,C,True,0.1441110074520111,0.09904595464468002,0.28659895062446594,0.1441110074520111
Familial hypercholesterolaemia is caused by mutations in the gene which encodes what?,High density lipoprotein,HMG-CoA reductase,Low density lipoprotein,Low density lipoprotein receptor,D,False,0.18085764348506927,0.13231827318668365,0.2981838285923004,0.18085764348506927
A cross between two true breeding lines one with dark blue flowers and one with bright white flowers produces F1 offspring that are light blue. When the F1 progeny are selfed a 1:2:1 ratio of dark blue to light blue to white flowers is observed. What genetic phenomenon is consistent with these results?,epistasis,incomplete dominance,codominance,inbreeding depression,B,False,0.26781874895095825,0.11884385347366333,0.22202955186367035,0.1116434708237648
The proportion of babies that have an abnormality identifiable at birth is _____.,1 in 10,1 in 40,1 in 100,1 in 500,B,False,0.12707725167274475,0.12707725167274475,0.26902252435684204,0.14399738609790802
______ explained genetic disorders such as alkaptonuria and albinism.,Recessive inheritance has,Dominant genes have,X chromosomes,Y chromosomes,A,False,0.1122492179274559,0.0874197855591774,0.36805102229118347,0.2529575228691101
Which of the following conditions shows anticipation in paternal transmission?,Huntington disease,Marfan syndrome,Cystic fibrosis,Fragile X syndrome,A,False,0.03079705499112606,0.10749227553606033,0.3310995101928711,0.4251402020454407
A homeotic mutation is one which,is present in only one form in an individual,substitutes one body part for another in development,results in development of a tumor,is wild type at one temperature and abnormal at another,B,False,0.15216799080371857,0.2508825957775116,0.2842872142791748,0.11132847517728806
Which of the following is not a familial cancer syndrome,Familial adenomatous polyposis,Li-Fraumeni syndrome,Von Hippel-Lindau syndrome,Waardenburg syndrome,D,True,0.03692430257797241,0.10037066042423248,0.3091634213924408,0.3969736695289612
"The epigenetic inheritance system has been described as ______ (Mayr and Provine, 1980).",genotype inheritance,soft inheritance,RNA inheritance,hard inheritance,B,False,0.15400823950767517,0.13591180741786957,0.3694465756416321,0.11994174122810364
Severe anaemia at birth is a feature of what?,Alpha-thalassaemia,Beta-thalassaemia,Hereditary persistence of fetal haemoglobin,Sickle cell disease,A,False,0.17032304406166077,0.11706120520830154,0.218699112534523,0.318205326795578
"If an X-linked recessive disorder is in Hardy-Weinberg equilibrium and the incidence in males equals 1 in 100, then the expected incidence of affected homozygous females would be _______.",1 in 1000,1 in 4000,1 in 10 000,1 in 40 000,C,True,0.21773956716060638,0.12406426668167114,0.2467312514781952,0.09662134200334549
Tay-Sachs disease is caused by deficiency of _________________?,Alpha-L-iduronidase,Glucose-6-phosphatase,Hexosaminidase A,Homogentisic acid oxidase,C,True,0.11935164034366608,0.08202909678220749,0.34535539150238037,0.1631343513727188
A nonsense mutation involves:,a regulatory sequence.,an AG splice acceptor site.,the creation of a different amino acid.,the creation of a stop codon.,D,False,0.16675396263599396,0.24262557923793793,0.27493080496788025,0.18895700573921204
The polymerase chain reaction or PCR is a technique that,was used to demonstrate DNA as the genetic material,is used to determine the content of minerals in a soil sample,uses short DNA primers and a thermostable DNA polymerase to replicate specific DNA sequences in vitro.,measures the ribosome transfer rate during translation,C,True,0.11335411667823792,0.12066483497619629,0.2554474472999573,0.056998029351234436
The maternal serum level of alpha-fetoprotein (AFP) is lower than average in which situation?,Down syndrome,Exomphalos,Neural tube defects,Twin pregnancies,A,False,0.05671381577849388,0.0642651841044426,0.4460887610912323,0.2387741208076477
"______ has been described as the phenomenon by which one genotype can give rise to a range of different physiological or morphological states in response to different environmental conditions during development (West-Eberhard, 1989).",Fetal plasticity,The fetal origins hypothesis,Developmental plasticity,Environmental plasticity,C,True,0.11895651370286942,0.08175753057003021,0.41519901156425476,0.25183093547821045
Arabidopsis is advantageous for plant genetic research because:,it is commercially important as a food crop,it is an endangered species,it is the closest to humans of any existing plant,it is a small plant with a small genome size which can be raised inexpensively,D,False,0.18737861514091492,0.0831487625837326,0.29021766781806946,0.15534234046936035
The proportion of genes shared by first cousins is on average ___.,1.0/2,1.0/4,1.0/8,1.0/16,C,True,0.18997468054294586,0.17846469581127167,0.2439323216676712,0.12265687435865402
Which of the following is not a tumour suppressor gene?,APC,NF1,RB1,RET,D,True,0.052420202642679214,0.1614656001329422,0.23493105173110962,0.43890896439552307
Which of the following is a feature of X-linked dominant inheritance?,Parental consanguinity,Male to male transmission,Transmission only by females,Transmitted by males only to females,D,False,0.09673330187797546,0.10297206789255142,0.38258764147758484,0.15948624908924103
"On average, how many fragments would a restriction enzyme which recognizes a specific 4 base sequence in DNA be expected to cleave a double-stranded bacteriophage with a genome size of 5,000 bp into?",about 2,about 4,about 20,about 50,C,True,0.15752573311328888,0.15752573311328888,0.22919858992099762,0.14798173308372498
Positional cloning refers to,using a selection procedure to clone a cDNA,cloning a portion of a gene using PCR,isolating a gene by PCR using primers from another species,mapping a gene to a chromosomal region and then identifying and cloning a genomic copy of the gene from the region,D,False,0.15766260027885437,0.13070689141750336,0.13913676142692566,0.06572355329990387
Plasmid vectors for cloning,can generally accommodate larger inserts than phage vectors can,"grow within bacteria, and are present in bacterial colonies on an agar plate",can accommodate inserts of over 100 kilobases,include centromeres to allow propagation in yeast,B,False,0.07119815051555634,0.11027386039495468,0.29975539445877075,0.14159442484378815
Transcriptional activator proteins,bind regions near a eukaryotic gene and allow an RNA polymerase to transcribe a gene,bind to ribosomes to activate the production of specific proteins,are produced during an infection of bacteria by a phage,are essential to function of transfer RNAs during translation,A,False,0.1176116093993187,0.16075602173805237,0.19390876591205597,0.10379188507795334
"Assuming that the level of glucose is low, a mutation in the repressor associated with the lac operon of E. coli which prevents binding of the repressor to lactose should result in: ",constitutive expression of the lac operon genes,lack of expression or reduced expression of the lac operon genes under all circumstances,expression of the genes only when lactose is present,expression of the genes only when lactose is absent,B,False,0.14283199608325958,0.14283199608325958,0.23549014329910278,0.09816689044237137
"In meiosis, recombination occurs in:",Metaphase I.,Prophase I.,Metaphase II.,Prophase II.,B,False,0.11967075616121292,0.09921053051948547,0.32529881596565247,0.10560905933380127
Leber's hereditary optic atrophy is caused by a mutation in:,chromosome 12.,chromosome 18.,chromosome 21.,mitochondrial DNA.,D,False,0.18002459406852722,0.12372897565364838,0.2619342505931854,0.1317088007926941
"Regarding exons, which, if any, of the following statements is correct?",Some exons in protein-coding genes consist of noncoding DNA.,The first exon of a protein-coding gene always contains the translational start site.,The last exon of a protein-coding gene always contains the normal termination codon.,A coding exon is always translated in just one of the three possible forward reading frames.,A,True,0.1631973832845688,0.15330976247787476,0.1440211832523346,0.09898421913385391
"In humans, each cell normally contains ______ of chromosomes.",11 pairs,23 pairs,32 pairs,46 pairs,B,False,0.10016851127147675,0.09409960359334946,0.3085407316684723,0.19920887053012848
"An increase in the inbreeding coefficient, F, is likely to result in:",reduced likelihood of heterozygotes being present in a population,higher proportion of genes that show linkage,higher proportion of genes with introns,higher level of difference between RNA molecules in two daughter cells,A,False,0.053129181265830994,0.09324462711811066,0.2698122560977936,0.1854390799999237
Which of the following findings on prenatal ultrasound examination would not raise suspicion of a chromosome abnormality?,Duodenal atresia,Holoprosencephaly,Hydrops fetalis,Monozygotic twins,D,False,0.11329396814107895,0.16484174132347107,0.30796489119529724,0.18679015338420868
"The likelihood of an individual in a population carrying two specific alleles of a human DNA marker, each of which has a frequency of 0.2, will be:",0.4,0.32,0.08,0.02,C,True,0.152676060795784,0.14342589676380157,0.2364693135023117,0.14342589676380157
An Hfr strain of E. coli contains:,a vector of yeast or bacterial origin which is used to make many copies of a particular DNA sequence,a bacterial chromosome with a human gene inserted,a bacterial chromosome with the F factor inserted,a human chromosome with a transposable element inserted,C,True,0.10708627104759216,0.1658584326505661,0.29109063744544983,0.10708627104759216
Male to male transmission is a key feature of which pattern of inheritance?,Autosomal dominant,Autosomal recessive,X-linked dominant,X-linked recessive,A,False,0.08432587236166,0.2022872418165207,0.35502517223358154,0.16770201921463013
Simple tandem repeat polymorphisms in humans are most useful for,solving criminal and paternity cases,reconstructing the relationships of humans and chimps.,estimating relationships of humans and Neanderthals,transferring disease resistance factors into bone marrow cells,A,False,0.07817306369543076,0.19962190091609955,0.27285081148147583,0.10037621110677719
Which of the following disorders is not suitable for population carrier screening?,Cystic fibrosis,Oculocutaneous albinism,Sickle cell disease,Tay-Sachs disease,B,False,0.06456335633993149,0.0829009860754013,0.4210059642791748,0.25535303354263306
Which of the following disorders does not show X-linked inheritance?,Duchenne muscular dystrophy,Tay-Sachs disease,Haemophilia A,Haemophilia B,B,False,0.08790998160839081,0.12015868723392487,0.39398518204689026,0.23896409571170807
The most common chromosome abnormality in first trimester spontaneous miscarriages is:,trisomy.,monosomy.,triploidy.,tetrasomy.,A,True,0.3370891809463501,0.14051967859268188,0.2044549286365509,0.08006570488214493
Which of the following karyotypes is not compatible with survival to birth?,"47,XY,+13","47,XX,+18","47,XY,+21","45,Y",D,False,0.08232425898313522,0.08763371407985687,0.2873398959636688,0.2535765767097473
Male breast cancer is associated with mutations in ___.,BRCA1,BRCA2,NF1,RET,B,False,0.09889403730630875,0.11206161975860596,0.20935866236686707,0.41635942459106445
Pseudocholinesterase deficiency is associated with increased sensitivity to what?,Fava beans,Halothane,Primaquine,Succinylcholine,D,False,0.052639853209257126,0.07659054547548294,0.4140445590019226,0.3224582076072693
The most common cystic fibrosis mutation consists of:,a deletion.,a duplication.,a substitution.,an insertion.,A,False,0.10426726937294006,0.1517079919576645,0.3211658000946045,0.2501241862773895
The normal human chromosome diploid number is:,23,24,46,48,C,True,0.19542765617370605,0.10460488498210907,0.3651069104671478,0.15219919383525848
Advantages of using adenoviruses for gene therapy include:,long term expression.,low risk of insertional mutagenesis.,low immunogenecity.,easy assembly.,B,False,0.16526846587657928,0.13701236248016357,0.3286755681037903,0.11358724534511566
Which of the following statements about Hirschsprung disease is incorrect?,It shows an association with Down syndrome.,It is more common in girls than in boys.,RET is a major susceptibility gene.,Recurrence risks are greater for long segment disease than for short segment disease.,B,False,0.05581684410572052,0.06324876844882965,0.25015372037887573,0.1425332874059677
Which of the following conditions is caused by a trinucleotide (triplet) repeat expansion?,Cystic fibrosis,Duchenne muscular dystrophy,Huntington disease,Osteogenesis imperfecta,C,True,0.03627507761120796,0.0636647492647171,0.3899938464164734,0.34416836500167847
Which of the following causes female pseudohermaphroditism?,Androgen insensitivity,Campomelic dysplasia,Congenital adrenal hyperplasia,Klinefelter syndrome,C,False,0.03436524048447609,0.07275120913982391,0.21051263809204102,0.5722326040267944
Which component of transcribed RNA in eukaryotes is present in the initial transcript but is removed before translation occurs?,Intron,3’ Poly A tail,Ribosome binding site,5’ cap,A,False,0.14818651974201202,0.0844341441988945,0.35548099875450134,0.24431829154491425
Which of the following is not a recognized complication of cystic fibrosis?,Cancer of the oesophagus,Congenital absence of the vas deferens,Diabetes mellitus,Liver cirrhosis,A,False,0.03673705458641052,0.09986167401075363,0.348551481962204,0.348551481962204
Which of the following diagnostic techniques is of no value for the diagnosis of neural tube defects?,Amniocentesis,Chorion villus sampling (CVS),Maternal serum screening,Ultrasonography,B,False,0.060880985110998154,0.08858130872249603,0.329119473695755,0.25631850957870483
Which of the following conditions is a peroxisomal disorder?,Acute intermittent porphyria,Maple syrup urine disease,Medium chain acyl-CoA dehydrogenase deficiency,Zellweger syndrome,D,False,0.058907054364681244,0.08051638305187225,0.40889596939086914,0.3184485137462616
Marked microsatellite instability is a feature of:,familial adenomatous polyposis.,hereditary non-polyposis colon cancer (HNPCC).,multiple endocrine adenomatosis type 2.,neurofibromatosis 1.,B,False,0.2432580441236496,0.11490695923566818,0.35393834114074707,0.06969459354877472
The common mutation in α-thalassaemia consists of:,a deletion.,a duplication.,an insertion.,a point mutation.,A,False,0.10143820941448212,0.1302492469549179,0.35405412316322327,0.24333761632442474
A baby born with pulmonary hypoplasia secondary to oligohydramnios caused by renal agenesis would be classified as having:,an association.,a dysplasia.,a sequence.,a syndrome.,C,True,0.1269296109676361,0.11201497912406921,0.36728301644325256,0.1846814900636673
The ______ is the set of observable characteristics and is the sum of genetic and environmental effects.,genotype,phenotype,both genotype and phenotype,neither genotype or phenotype,B,False,0.2700844705104828,0.13580700755119324,0.21034200489521027,0.07738050073385239
Which of the following trisomy karyotypes has the mildest effect on human development?,"47,XXX","47,XXY","47,XX,+13","47,XY,+21",A,False,0.1711222529411316,0.13327014446258545,0.2338963896036148,0.11761049181222916
Mutations that cause achondroplasia exert an effect which can be classified as:,dominant negative.,gain-of-function.,haploinsufficiency.,loss-of-function.,B,False,0.09387943893671036,0.12831798195838928,0.3952471911907196,0.12054357677698135
The presence of two or more cell lines from different zygotes in a single individual is known as:,mosaicism.,diploidy.,aneuploidy.,chimaerism.,D,False,0.13797472417354584,0.12176225334405899,0.3992430865764618,0.1771630346775055
The risk for miscarriage associated with amniocentesis is approximately ____.,1 in 10,1 in 50,1 in 100 to 1 in 200,1 in 1000,C,False,0.06841651350259781,0.1859753578901291,0.1859753578901291,0.1127997562289238
Autozygosity mapping is used to map disorders that show which pattern of inheritance?,Autosomal dominant,Autosomal recessive,X-linked dominant,X-linked recessive,B,False,0.06422805041074753,0.11999379098415375,0.41881945729255676,0.18585000932216644
Consanguinity shows a strong association with which pattern of inheritance?,Autosomal dominant,Autosomal recessive,X-linked dominant,X-linked recessive,B,False,0.08166549354791641,0.20854012668132782,0.36599934101104736,0.11882258206605911
Most new mutations appear to be,beneficial,neutral or deleterious,present in homozygotes rather than heterozygotes,detectable using allozyme studies (protein electrophoresis),B,False,0.06052589416503906,0.13639721274375916,0.2548235356807709,0.14519405364990234
Twin studies in humans are useful because,they allow genetic as opposed to environmental influences on variation in a trait to be estimated,cloning of genes is facilitated by the presence of extra copies,they allow improved expression of genes,twins have a greater likelihood of being heterozygous,A,True,0.29155799746513367,0.15605975687503815,0.18824398517608643,0.07847177237272263
Complete the following sentence. The Philadelphia chromosome:,is an example of gene amplification.,is a product of a reciprocal translocation.,causes Burkitt's lymphoma.,causes retinoblastoma.,B,False,0.06344125419855118,0.09825974702835083,0.2670976519584656,0.2670976519584656
Enzyme assay can be used to identify carriers of:,Cystic fibrosis.,Fragile X syndrome.,Oculocutaneous albinism.,Tay-Sachs disease.,D,False,0.1714467704296112,0.10398772358894348,0.3629527986049652,0.09176883846521378
