0,1,2,3,4,5,correct,choiceA_probs,choiceB_probs,choiceC_probs,choiceD_probs
The climate of Great Britain is milder than most other places along the same latitude for which of the following reasons?,"The Gulf Stream brings warm waters to Great Britain, raising the temperature of winds that blow onto the island.",Hot springs throughout the country raise the temperature of the surrounding land and air.,Mountain ranges in the north of Great Britain act as a barrier to cold winds blowing from the Arctic.,Small landmasses generate their own local climate and are largely unaffected by latitude.,A,True,0.33972257375717163,0.16047358512878418,0.2645762264728546,0.23348769545555115
Which of the following supranational organizations is not an economic union?,EU,CARICOM,NAFTA,NATO,D,True,0.021111182868480682,0.014509489759802818,0.06502702087163925,0.897670328617096
The global lingua franca is,Chinese.,English.,French.,Arabic.,B,False,0.09453278034925461,0.050599753856658936,0.3738844096660614,0.4800770878791809
What are the two major branches of Islam?,Sunni and Shinto,Shinto and Shiite,Sunni and Shiite,Shamanism and Shiite,C,False,0.02100503258407116,0.01443653367459774,0.42189735174179077,0.5417269468307495
What was the primary reason the Green Revolution did NOT help Africa much?,It targeted crops Africans don't grow and eat.,It required sophisticated machinery.,Population growth has fallen so drastically that Africans don't need the increased food production.,African agricultural production went up without its help.,A,False,0.020849907770752907,0.018399978056550026,0.07277332246303558,0.8865606188774109
The largest exporter of agricultural goods in the world is,China.,Mexico.,Chile.,the United States.,D,True,0.08589869737625122,0.05210019275546074,0.29981592297554016,0.5601298809051514
Which of the following statements is NOT part of Gunnar Myrdal's theory of cumulative causation?,Developing and developed regions share similarly in wealth through trade.,The core will always dominate the periphery.,Growth and prosperity of the core exists at the expense of the periphery.,"Regions with initial advantage keep and expand it as they attract labor, capital, and trade.",A,False,0.0059866514056921005,0.011184537783265114,0.1982506811618805,0.7840966582298279
Which pair of religions below share a long-held tradition of cremating their dead?,Hindu and Buddhist,Hindu and Muslim,Muslim and Jewish,Christian and Buddhist,A,False,0.04276932030916214,0.02939489670097828,0.5210369825363159,0.405784010887146
"The official languages of Guyana, Suriname, and French Guiana are English, Dutch, and French, respectively. On what continent are those countries located?",North America,South America,Africa,Asia,B,False,0.030782435089349747,0.016476649791002274,0.7938895225524902,0.15632610023021698
