0,1,2,3,4,5,correct,choiceA_probs,choiceB_probs,choiceC_probs,choiceD_probs
The main factor preventing subsistence economies from advancing economically is the lack of,a currency.,a well-connected transportation infrastructure.,government activity.,a banking service.,B,False,0.08287007361650467,0.12057524174451828,0.5403807163238525,0.255257785320282
The tendency for a population to continue to grow long after replacement fertility has been achieved is called,zero population growth.,rapid growth rate.,homeostatic plateau.,demographic momentum.,D,False,0.02081744372844696,0.03028920106589794,0.4738028347492218,0.4738028347492218
The tendency for migration to decrease with distance is called,push factors.,pull factors.,distance decay.,migration selectivity.,C,True,0.10334768891334534,0.07102975994348526,0.46317219734191895,0.36071887612342834
"Which zone contains low-income slums, ethnic ghettos, and general deterioration in Burgess's concentric zone model of urban form?",First,Second,Third,Fourth,A,False,0.054671116173267365,0.04257791116833687,0.5877699255943298,0.3146105706691742
Which of the following statements is TRUE concerning women in the labor force?,Most women work in agriculture,The percentage of women economically active in the labor force declined worldwide,The percentage of women in the total labor force declined,Women spend more hours per day working than men in all regions except Anglo America and Australia,D,False,0.006570618133991957,0.015762094408273697,0.8605811595916748,0.11646699905395508
All the following factors can be considered pull factors of migration EXCEPT,safety.,better climate.,better schools.,overcrowding.,D,True,0.023108473047614098,0.015882205218076706,0.19348487257957458,0.7652475237846375
Which of the following countries does NOT have a well-known example of a relict boundary?,Vietnam,United Kingdom,Germany,Bolivia,D,True,0.0336596854031086,0.048974551260471344,0.31935420632362366,0.596632182598114
Which form of migration below are farm workers from another country most likely to be practicing during the year?,Chain migration,Cluster migration,Circular migration,International migration,C,False,0.09001895785331726,0.04818367585539818,0.4034369885921478,0.4571540057659149
Which of the following is a centrifugal force in a country?,Religious differences,A national holiday,An attack by another country,A charismatic national leader,A,False,0.036983340978622437,0.05381044000387192,0.5105392336845398,0.39760836958885193
Early settlements and high population density along coastlines and rivers are best attributed to which of the following?,Mediterranean climate,Limited forest cover,Growth of manufacturing,Access to trade routes,D,False,0.024943366646766663,0.036292385309934616,0.7289520502090454,0.2088482677936554
The first stage of the demographic transition exhibits,high birth rates with high but fluctuating death rates.,declining birth rates with continuing high death rates.,low birth rates with continuing high death rates.,high birth rates with declining death rates.,A,True,0.3494342565536499,0.2401624172925949,0.10011459141969681,0.30837464332580566
What is the population statistic that tells us the level of fertility at which a population will have just enough births to replace parents and compensate for early deaths?,Crude birth rate,Replacement level,Mortality rate,Total fertility rate,B,False,0.07616806775331497,0.09780174493789673,0.3868134021759033,0.4383170008659363
What is the most rapidly growing religion in the United States today?,Islam,Christianity,Hinduism,Buddhism,A,False,0.010515964590013027,0.00818984117358923,0.14516839385032654,0.8353865146636963
The outlying area serviced by a urban center is referred to as a,redline area.,threshold.,range.,hinterland.,D,False,0.055161524564027786,0.07082880288362503,0.593042254447937,0.28013333678245544
The best definition of an urban area is,the central city and its developed areas.,the central city and its surrounding suburbs.,the central city and its hinterlands.,the central city and the adjacent counties.,B,False,0.6422960758209229,0.1433156281709671,0.2085229903459549,0.005556949879974127
Which of the following religions developed first?,Buddhism,Christianity,Islam,Hinduism,D,False,0.22120431065559387,0.13416719436645508,0.32185035943984985,0.32185035943984985
Which one of the following is NOT a characteristic of world cities?,World cities contain the headquarters of many transnational corporations.,World cities are well connected to secondary-level world cities.,World cities contain many offices of multinational organizations.,World cities are found only in the northern and western hemispheres.,D,True,0.12072904407978058,0.0391949824988842,0.225551575422287,0.6131126880645752
Which type of transportation system created the star-shaped city pattern?,Highways to airports that link cities,Interstate highways that link cities,Beltways around cities,Streetcar and trolley lines extending from the CBD,D,False,0.19348026812076569,0.17074576020240784,0.4641350507736206,0.17074576020240784
In which urban US setting below would you expect to find planned communities?,Ghettos,Suburbs,CBDs,Transition zones,B,False,0.019533731043338776,0.03649381548166275,0.7329978942871094,0.2100074142217636
The latitude and longitude coordinates of a place are an example of,a formal region.,a functional region.,an absolute location.,a relative location.,C,True,0.02424413152039051,0.05815865099430084,0.486956387758255,0.42973750829696655
The voluntary association of three or more countries willing to give up some measure of sovereignty is called,nationalism.,devolution.,supranationalism.,complementarity.,C,True,0.03613578528165817,0.08668524026870728,0.6405221223831177,0.2356349378824234
The key factor Thomas Malthus failed to recognize in his population theory was,population is limited by their means of subsistence.,all populations have the potential to increase more than the actual rate of increase.,wars and famine inhibit population's reproductive capacity.,technology's ability to raise the Earth's carrying capacity.,D,False,0.02212994359433651,0.06015542522072792,0.5707387924194336,0.346170574426651
Which pair of religions are both universalizing religions?,Islam and Judaism,Judaism and Buddhism,Hinduism and Buddhism,Christianity and Buddhism,D,False,0.03865588828921318,0.0234459787607193,0.6851919889450073,0.25206807255744934
Which urban model theorizes that high-rent residential areas grow outward from the center of the city along major highways with lower-rent inhabitants taking over sequentially?,Concentric zone model,Central place model,Urban realms model,Sector model,D,False,0.09939370304346085,0.16387252509593964,0.5719712972640991,0.16387252509593964
"When a country combines its religion with its government, it is called a",dictatorship.,theocracy.,democracy.,autocracy.,B,False,0.1159910261631012,0.10236171633005142,0.5890510678291321,0.19123688340187073
What is the chief religion practiced in Europe?,Christianity,Islam,Hinduism,Animism,A,False,0.08970827609300613,0.07916727662086487,0.16759711503982544,0.6628594994544983
Which group enacted the first effective settlement in the eastern United States?,French,"British (English, Scotch-Irish, Welsh, Scottish)",Russian,Chinese,B,False,0.011585760861635208,0.007027119863778353,0.7167856693267822,0.2636907398700714
"A population pyramid, or age-sex structure, displays all the following information about a country's population EXCEPT",future social spending needs of the population.,"the impact of ""baby booms"" on the population.",the impact of wars on the population.,a quick visual depiction of the country's demographics.,B,False,0.021592235192656517,0.045710764825344086,0.6310176253318787,0.29807162284851074
The Rhine River is an example of which type of boundary?,Geometric,Artificial,Natural,Relict,C,True,0.0906325951218605,0.070584736764431,0.5215545892715454,0.3163388669490814
Which type of economic activity is most closely tied to the physical environment?,Primary,Secondary,Tertiary,Quaternary,A,False,0.06702350080013275,0.03165966272354126,0.6359013319015503,0.26508310437202454
The majority of workers in periphery countries are probably employed in which type of activities?,Primary,Secondary,Tertiary,Quaternary,A,False,0.05328172445297241,0.04702095687389374,0.5055229067802429,0.3937016427516937
All of the following are non-basic jobs in the city EXCEPT,city firefighter.,social worker.,dry cleaner.,garment factory worker.,D,True,0.1276569664478302,0.1276569664478302,0.2384946197271347,0.5048931241035461
Transnational corporations distribute their operations,manufacturing goods where production costs are the highest.,conducting accounting and research services where economical.,based on comparative advantage.,with headquarters located in LDCs.,C,False,0.22682896256446838,0.12141279876232147,0.22682896256446838,0.42377227544784546
Which of the following is LEAST associated with the development of alluvial landscapes?,A deep cover of loose materials,A predominance of gentle slopes,Frequent flooding,Deep dissection and erosion,D,True,0.07803688198328018,0.060775186866521835,0.3497370481491089,0.5088644027709961
Which of the following is LEAST self-sufficient in the natural resources needed for modern industry?,United States,Japan,France,United Kingdom,B,False,0.025150837376713753,0.053244318813085556,0.5724303722381592,0.3471965789794922
One of the effects of the east–west orientation of the Alpine mountain system and the northern plains of western and central Europe is that it,limits the marine climate of Europe to coastal areas,provides a corridor for communication between southern and northern Europe,enables marine-like climatic conditions to extend eastward into Germany and Poland,effectively prevents population movement between parts of the Mediterranean region,C,True,0.3337739109992981,0.17865630984306335,0.42857420444488525,0.058001209050416946
The largest Hindu temple complex ever constructed is found in,Calcutta.,Bombay.,Cambodia.,Bali.,C,True,0.0036196126602590084,0.0046476745046675205,0.8856899738311768,0.10578058660030365
Which term describes the forces that unify and strengthen a country?,Diffusion,Centrifugal,Centripetal,Ethnocentric,C,True,0.1550489068031311,0.1368301808834076,0.613230288028717,0.09404192119836807
Which one of the following statements best describes an application of the S-curve?,Graph of the Bantu migration,Graph of the growth of human populations since their first appearance on Earth,The chart showing how cities associate with one another based on their population sizes,A model showing the decrease in population growth for several countries after they industrialize,D,False,0.024380657821893692,0.027626903727650642,0.7125072479248047,0.23131723701953888
Which of the following items is NOT a challenge to the state?,Transnational corporations,EU,World Trade Organization,Good transportation network,D,True,0.14550015330314636,0.06872940063476562,0.1284034252166748,0.6520864367485046
"National sports teams, flags, national anthems, and national holidays all promote",nationalism.,sectarianism.,political unrest.,functional disputes.,A,False,0.035232070833444595,0.06582217663526535,0.0957707017660141,0.8018782734870911
"The process whereby immigrants learn the values, language, and customs of their new country is called",assimilation.,acculturation.,adaptation.,amalgamation.,B,False,0.05954214558005333,0.05954214558005333,0.4399602711200714,0.4399602711200714
"On which of the following can one most accurately depict true geographical distance, true direction, true size, and true shape?",A Mercator projection,A globe,A conic projection,A gnomonic projection,B,False,0.13247045874595642,0.19274336099624634,0.593691349029541,0.08034738898277283
Which of the following could be considered a higher-order central place function?,Winn-Dixie grocery store,Mercedes-Benz dealership,Shoe store,Family doctor,B,False,0.03278139978647232,0.054047390818595886,0.7461012005805969,0.16647768020629883
Which geographer viewed the US urban community of the 1920s as a set of concentric rings radiating outward from a central core?,Rostow,Ravenstein,Von Thünen,Burgess,D,False,0.004565444774925709,0.007527146954089403,0.7677897810935974,0.21997547149658203
"To get to school in the morning, we ALL use this as our guide:",Rand-McNally Road Atlas.,world globe.,road map.,mental map.,D,False,0.11245419830083847,0.07728856056928635,0.5039847493171692,0.3056821823120117
"Of these, the map using the smallest map scale would be the map of",the world.,"Atlanta, Georgia.","Main Street, Small Town, Ohio.",Pennsylvania.,A,False,0.017748801037669182,0.03757420927286148,0.3564941883087158,0.5877595543861389
An earlier boundary formed before meticulous geographic knowledge and mapping was available is known as,an antecedent boundary.,a geometric boundary.,a relict boundary.,a subsequent boundary.,A,False,0.0775391235947609,0.12784039974212646,0.6492271423339844,0.14486216008663177
Which of the following jobs is in the non-basic employment sector?,Software engineer,F-10 pickup truck assembly-line worker,Oil refinery worker,Parking lot attendant,D,False,0.015943048521876335,0.023196997120976448,0.677915632724762,0.28259727358818054
In which of the following regions is subsistence agriculture being replaced by large-scale commercial development?,The Swiss Alps,The Amazon Basin,North Africa,The Alaskan tundra,B,False,0.05311616137623787,0.06820250302553177,0.5710525512695312,0.3056624233722687
A strong movement away from all religions is called,secularism.,heathenism.,sacrilege.,nationalism.,A,False,0.032289959490299225,0.08777320384979248,0.572353184223175,0.30635860562324524
Regions share all of these characteristics EXCEPT,boundaries.,common features.,relative location.,easily defined.,D,True,0.03341131657361984,0.03341131657361984,0.40703320503234863,0.5226409435272217
Which of the following U.S. main immigration flow associations is NOT correct?,"Pioneer settlement to 1870—Germans, British, Scotch-Irish, Africans",1870–1914—Asians,1870–1914—Eastern and southern Europeans,1965–present—Hispanics,B,False,0.10344131290912628,0.0710941031575203,0.4635917842388153,0.3610456585884094
Which one of the statements below is characteristic of most African cities?,"They have thriving, clean residential areas.",There are jobs for most rural-to-urban migrants.,They have three separate business districts.,They have a well-developed infrastructure.,C,False,0.05344656482338905,0.02227984182536602,0.2714240550994873,0.65111243724823
Which country faces a serious trade disadvantage due to its location?,Singapore,Italy,Spain,Mongolia,D,True,0.007004643324762583,0.01482882909476757,0.26284730434417725,0.7144929766654968
"In which zone of Burgess's concentric zone model would one find better houses, single-family homes, and higher-rent apartments?",First,Second,Third,Fourth,C,True,0.038423385471105576,0.038423385471105576,0.6010429263114929,0.3217150866985321
The theory that every society develops economically according to a five-stage pattern of growth is attributed to,Rostow.,Ravenstein.,von Thünen.,Burgess.,A,False,0.010508534498512745,0.009273749776184559,0.8347962498664856,0.14506582915782928
Which of the following would NOT be considered a barrier to diffusion of a cultural trait?,Language,Religion,Oceans,Tolerant complaisant citizens,D,True,0.017164668068289757,0.03206782042980194,0.3042510449886322,0.6440994143486023
The process of invasion and succession is a process involving migration and is best described as when,new residents tear down and rebuild housing units.,new residents live peacefully with old residents.,new residents assimilate with old residents completely.,new residents move into areas occupied by older resident groups.,D,False,0.31250500679016113,0.13027146458625793,0.243379145860672,0.31250500679016113
Which of the following best illustrates the definition of a functional region?,A map showing Atlanta as a hub for Delta Airlines,An article describing the region referred to as the South,A map showing North Carolina's one hundred counties,An essay explaining the region known as the Bible Belt,A,False,0.03965495154261589,0.034995369613170624,0.376235693693161,0.5474197268486023
New stores opening around a large shopping mall reflect which concept?,Gravity concept,Distance decay,Complementarity,Movement bias,D,False,0.08631128817796707,0.1423032581806183,0.562820315361023,0.20705004036426544
The birth of an urban industrial workforce in Europe contributed to the start of the,First Agricultural Revolution.,Second Agricultural Revolution.,Third Agricultural Revolution.,Fourth Agricultural Revolution.,B,False,0.04024181142449379,0.06634753197431564,0.5555210709571838,0.33694055676460266
Which of the following statements about East Asia's industrial regions is true?,Japan has a rich natural resource base.,China lacks natural resources but has a massive labor force.,China is industrializing rapidly.,Taiwan lacks industrial enterprise and an educated workforce.,C,True,0.03502977639436722,0.03969394043087959,0.5479579567909241,0.3766056299209595
Which of the following statements best describes the United Nations?,The UN operates a worldwide police force.,Member states surrender sovereignty to the UN.,World laws are enforced by the UN.,The UN often practices interventionism in world conflicts.,D,False,0.1394605189561844,0.2299315482378006,0.3345484137535095,0.2952379286289215
Which of the following is a formal region?,Dixie,Pennsylvania,The market area of Winn-Dixie,The Pacific Northwest,B,False,0.05913121998310089,0.05913121998310089,0.3855839967727661,0.49509963393211365
The concentration of production activities and people spatially to benefit everyone is called,the substitution principle.,deglomeration.,agglomeration.,infrastructure.,C,True,0.05924779176712036,0.14212806522846222,0.49607568979263306,0.3008851110935211
"Which language family contains Italian, Spanish, Portuguese, and Romanian?",European,Slavic,Germanic,Romance,D,False,0.0071333120577037334,0.00555542903020978,0.8244987726211548,0.16235342621803284
"Ankara, Turkey and Islamabad, Pakistan are both examples of",desert cities.,forward-thrust capitals.,old colonial capitals.,rival cities.,B,False,0.038385286927223206,0.17203094065189362,0.467628538608551,0.3213960826396942
Which of the following is NOT an example of syncretism?,Halloween,Foreign cuisine changed to suit American tastes,Hasidic Judaism,Catholicism in Louisiana,C,False,0.013636174611747265,0.01203388161957264,0.12937642633914948,0.8436402678489685
The theory that whoever controlled the landmass of Europe would rule the world is called the,devolution theory.,domino theory.,heartland theory.,rimland theory.,C,True,0.04578801617026329,0.07549167424440384,0.8116120100021362,0.06662116944789886
Which group represents the Persian (Iranian) variation of Islam and believes in the infallibility and divine right to authority of the Imams descended from Ali?,Sunni,Shiite,Imam,Untouchables,B,False,0.05096195265650749,0.016544923186302185,0.7035080194473267,0.22839561104774475
The multiplier effect is,the addition of non-basic workers to an urban economy that has added more basic workers.,a ratio of urban to rural workers in an economy.,the ratio of city workers to farm workers in an economy.,the addition of rural jobs created by the urban economy.,A,False,0.07972728461027145,0.10237186402082443,0.14895018935203552,0.667548418045044
The sacred book of the Hindu is called the,Talmud.,Bible.,Torah.,Veda.,D,True,0.07271453738212585,0.0389212928712368,0.19765862822532654,0.6898963451385498
Which of the following is a distinct characteristic of an East European city?,A central park,Prominent religious buildings,A large central square surrounded by government and administrative buildings,Luxury apartment buildings,C,True,0.017982063814997673,0.02308942750096321,0.7646167874336243,0.19332540035247803
Which of the following countries is actively trying to preserve the purity of their native language from contamination by English or other languages?,Italy,Russia,Japan,Brazil,C,False,0.03157385438680649,0.03577786684036255,0.4358636140823364,0.4938981831073761
Which of the following is an example of a bulk-gaining industry?,Steel,Bottled orange juice,Paper,Copper,B,False,0.026197204366326332,0.048942822962999344,0.6756348013877869,0.24855217337608337
Which of the following is NOT a feature of an export processing zone (EPZ)?,Tariff reductions on exports,Raw materials imported duty-free,Exemption from customs duties,Strict pollution regulations,D,True,0.021084744483232498,0.021084744483232498,0.2568647861480713,0.6982308030128479
Which of the following characteristics is NOT true of a state?,Independent territory,Internationally recognized,Boundaries,A national language,D,True,0.014115444384515285,0.018124589696526527,0.19485770165920258,0.7706771492958069
"You are planning to move from your hometown to Pittsburgh. Along the way, you stop in Columbus, Ohio to visit a relative and fall in love with the city! You decide to stay and make Columbus your new home. This is an example of",intervening opportunity.,distance decay.,involuntary migration.,push-pull factors.,A,False,0.042405761778354645,0.11527080833911896,0.7516600489616394,0.08977299183607101
A large node of office and commercial land use outside the central city with more jobs than residents is a(n),suburb.,primate city.,town.,edge city.,D,False,0.03300144150853157,0.04801681265234947,0.5162293910980225,0.40203985571861267
Which crop began the Third Agricultural Revolution?,Rice,Wheat,Barley,Millet,A,False,0.09625495225191116,0.05152156576514244,0.14005012810230255,0.7112332582473755
Which factor in the last quarter century greatly destabilized Eastern Europe and led to ethnic conflict?,The introduction of new languages,The end of the Cold War,The invasion by the Soviets,The acceptance of many Eastern European countries into the EU,B,False,0.08322489261627197,0.044547077268362045,0.25635069608688354,0.6149533987045288
"If I wanted to ship a small piece of very valuable jewelry to my aunt who lives in Poughkeepsie, which mode of transportation makes the most sense?",Truck,Air,Ship,Railroad,B,False,0.037843089550733566,0.0294722281396389,0.861304759979248,0.07070019841194153
Which of the following is a functional region?,Dixie,Pennsylvania,The market area of Winn-Dixie,The Pacific Northwest,C,False,0.04196201637387276,0.04754919186234474,0.3981245160102844,0.5112019777297974
Which type of city model contains a distinct residential spine proceeding outward from center city along the main boulevard?,European,Muslim,Sub-Saharan African,Latin American,D,False,0.010518280789256096,0.025232043117284775,0.8355705142021179,0.12813888490200043
What family do most European languages belong to?,Ural-Altaic,Basque,Indo-European,Phoenician,C,True,0.09132193773984909,0.06276458501815796,0.674782931804657,0.17061184346675873
"What do the terms apartheid, ethnic cleansing, and integration all have in common?",They all occurred in Nazi Germany during World War I.,They are all forms of residential segregation.,They are all ways to integrate different ethnic populations in neighborhoods.,They are different expressions for the same concept.,B,False,0.16131363809108734,0.30137354135513306,0.09784166514873505,0.4384959042072296
Which one of the statements below correctly describes immigrants living in Europe?,Most find citizenship easy to get in host countries.,Muslims immigrants from North Africa are well integrated in France.,Immigrants to European cities rarely bring their families.,They are usually restricted to certain neighborhoods.,D,False,0.014981914311647415,0.02798990160226822,0.7218690514564514,0.2343565672636032
Which of the following activities are NOT secondary economic activities?,Assembling automotive parts,Sewing shirts,Mining copper,Binding books,C,False,0.15072225034236908,0.0628303810954094,0.3190790116786957,0.46425721049308777
Johnny and Susie are moving to Scotland to renovate and live in the family castle. What makes their move a migration?,They are crossing another country's borders.,They are not taking anything with them.,They are moving permanently.,They will be gone more than one year.,C,True,0.011354843154549599,0.01457990799099207,0.7960359454154968,0.17761963605880737
Which of the following entities is a state?,Antarctica,American Samoa,Egypt,Marshall Islands,C,True,0.015324677340686321,0.013523980975151062,0.5750542879104614,0.39522865414619446
What is the most abundant fossil fuel?,Phosphate,Oil,Petroleum,Coal,D,True,0.0503273643553257,0.0503273643553257,0.42138588428497314,0.4774927496910095
A rejection of or indifference to religion in a country is called,polytheism.,animism.,secularism.,monotheism.,C,True,0.03908606618642807,0.09376260638237,0.6114089488983154,0.2548731565475464
"In a postindustrial economy, which of the following resources is considered most important to increase productivity?",Energy,Labor,Information,Specialization,C,True,0.12149620056152344,0.12149620056152344,0.6991624236106873,0.05739074572920799
A city that is more than twice as large as the next largest city in a country is called a,global city.,world leader city.,megalopolis.,primate city.,D,False,0.0885395035147667,0.18743813037872314,0.4496407210826874,0.27272090315818787
