0,1,2,3,4,5,correct,choiceA_probs,choiceB_probs,choiceC_probs,choiceD_probs
Every country with a seacoast has an exclusive economic zone (EEZ) under the UN Convention on the Law of the Sea. Which one of the following statements regarding the Law of the Sea and the EEZ is NOT correct?,The EEZ extends up to 200 nautical miles (370 km) from the coastline.,Countries have the right to exploit natural resources in their EEZ.,Countries can exploit resources on the continental shelf extending up to 350 nautical miles (560 km) beyond their EEZ.,A country does not have the right to exploit living resources in its EEZ.,D,False,0.03344886749982834,0.05514785274863243,0.5928953289985657,0.3173540234565735
Which of the following is MOST likely to experience population pressure?,An industrial society with abundant natural resources and large imports of food,A society with a highly mechanized agricultural sector,A non-ecumene,A slash-and-burn agricultural society,D,False,0.037445731461048126,0.31352925300598145,0.5169223546981812,0.13069844245910645
"Part of the boundary between the United States and Mexico is the Rio Grande, an example of",a water divider.,a watercourse.,an artificial boundary.,a natural boundary.,D,False,0.1369926780462265,0.09415359795093536,0.5418165922164917,0.22586274147033691
"When we talk about diffusion of a cultural trait, what do we mean by ""hearth""?",Destination,Origin point,All locations along the diffusion path,Axis point,B,False,0.021855147555470467,0.046267349272966385,0.8201083540916443,0.11098959296941757
The distance north and south of the equator is the,global grid system.,Prime Meridian,latitude.,longitude.,C,True,0.044926077127456665,0.13838206231594086,0.48300084471702576,0.3319613039493561
Why are perceptual or vernacular regions so difficult to identify?,Boundaries are constantly being redrawn.,"Physical features, such as rivers, are constantly shifting.",Defining criteria are subjective and differ among researchers.,Antecedent boundaries were drawn before humans were located in the regions.,C,False,0.13778454065322876,0.0394759364426136,0.12159442156553268,0.6997276544570923
Which structure(s) traditionally occupies the center of a historic Asian city?,A central market,High-density housing,A religious building,Government office buildings,C,True,0.11229857057332993,0.0771816149353981,0.6462337374687195,0.16339346766471863
Which description best describes the urban hierarchy model in which the population of a city is inversely proportional to its rank in the hierarchy?,Multiplier effect,Rank-size rule,Central place theory,Burgess's sector model,B,False,0.011790254153311253,0.032049231231212616,0.9366158843040466,0.019438842311501503
Which of the following is a major concern in countries with a large and rapidly aging population?,Immunization,Adequate schools,Daycare facilities,Health care,D,True,0.043292123824357986,0.029754215851426125,0.2491290122270584,0.6772028207778931
Which of the following capital cities is located OUTSIDE the central core area of the country?,"Abuja, Nigeria","Paris, France","London, United Kingdom","Cairo, Egypt",A,False,0.037473924458026886,0.0617840550839901,0.5861908197402954,0.31376534700393677
"Spanish colonial architecture, uneven economic development, and rural-to-urban migration flows are most commonly found in which of the following?",Southeast Asia,Sub-Saharan Africa,North America,Latin America,D,False,0.07219207286834717,0.05622324347496033,0.7761378884315491,0.09269645810127258
The purpose for the creation of NATO was to,defend North America and Western Europe against the threat of communism.,form an economic alliance for trade between Europe and North America.,defend Europe against a second Nazi invasion.,defend northern Europe against Chinese missiles.,A,False,0.1462944597005844,0.06910460442304611,0.5106177926063538,0.2733140289783478
Which of the following is NOT a key milestone reached by the EU?,The introduction of a common currency used by many EU countries,A customs union,A single market,A common European language,D,True,0.04428943619132042,0.056868765503168106,0.4202064871788025,0.4761563241481781
The use and spread of English in nineteenth-century India is an example of what type of diffusion?,Stimulus,Contagious,Hierarchal,Relocation,C,False,0.09952519088983536,0.14480829238891602,0.30655917525291443,0.44604092836380005
The theory that most migration occurs over a short distance and in steps is attributed to,Rostow.,Ravenstein.,von Thünen.,Burgess.,B,False,0.004094589501619339,0.005957592278718948,0.8841850757598877,0.10560085624456406
"The way of life based on breeding and herding of animals that are used as a source of food, shelter, and clothing is called",swidden.,subsistence farming.,pastorialism.,hunting and gathering.,C,True,0.12612275779247284,0.2670018672943115,0.5652429461479187,0.04094606265425682
The European Union (EU) replaced which of the following organizations?,NATO,EEC,UN,ASEAN,B,False,0.014726639725267887,0.007882602512836456,0.06600022315979004,0.9111049771308899
"The attempt by core countries to stimulate increased agricultural production in the periphery through use of technology, hybrid seed, and fertilizers is called the",First Agricultural Revolution.,Second Agricultural Revolution.,Third Agricultural Revolution.,Green Revolution.,D,True,0.02789115719497204,0.040581390261650085,0.43629106879234314,0.4943825602531433
Shifting cultivation is most often practiced in,alpine tundra.,tropical forests.,flood plains.,deserts.,B,False,0.2410837858915329,0.146224707365036,0.5103743672370911,0.10049866139888763
The migration streams into the United States between 1980 and the present have been primarily composed of emigrants from which of the following regions?,Europe and North Africa,Asia and Latin America,Sub-Saharan Africa and Oceania,Central Europe and Australia,B,False,0.1327366679906845,0.09122848510742188,0.5249837636947632,0.24798476696014404
Which one of the following North American associations is NOT correct?,Southeast—African Americans,Oklahoma and the Southwest—Native Americans,Quebec and northern Maine—French Americans and French Canadians,Southern prairie provinces—African Americans,D,False,0.030639534816145897,0.008778373710811138,0.4792829751968384,0.4792829751968384
Which of the following countries is NOT a federal state?,Canada,United States,France,People's Republic of China,C,False,0.022809060290455818,0.029287412762641907,0.35679373145103455,0.5882534384727478
Which of the following world regions is NOT considered one of the world's most densely populated regions?,South Asia,Europe,South America,Northeast United States,C,True,0.00797231774777174,0.00903381872922182,0.7176451086997986,0.26400691270828247
"Olives, grapes, and chickpeas are staple crops of which type of farming?",Pastoral nomadism,Subsistence,Plantation,Mediterranean,D,False,0.06199284642934799,0.1022089347243309,0.6664859652519226,0.16851402819156647
A person who practices the Hindu religion would be most likely to,visit a shrine built on the shore of a lake.,pray five times a day.,bathe in the Ganges River.,make a pilgrimage to Jerusalem.,C,True,0.08217781782150269,0.13548831641674042,0.607216477394104,0.17397044599056244
"The language with the largest number of ""speakers"" is",English.,Russian.,Spanish.,Mandarin Chinese.,D,False,0.022339526563882828,0.019714562222361565,0.5084452629089355,0.4487013816833496
Which one of the following statements does NOT correctly describe the Green Revolution?,It changed centuries-old methods of farming.,It was an attempt to feed a growing world population.,"It centered on increased rice, wheat, and maize yields.",It greatly improved crop yields in sub-Saharan Africa.,D,True,0.040592387318611145,0.027898713946342468,0.43640926480293274,0.4945164918899536
"Historically, the world's major languages have spread by all of the following methods EXCEPT",Sanskrit records.,migration.,trade.,conquest.,A,False,0.03595203533768654,0.059274885803461075,0.5623844861984253,0.3411034345626831
A primate city is,a large city located on the periphery of the country.,the most important city in a country.,when the largest city in a country is more than twice the size of the next largest city.,the largest city in a country.,C,True,0.11088238656520844,0.1256462037563324,0.49694037437438965,0.26599302887916565
"Which of the following factors would be considered a ""pull"" factor for Riva when considering a move from India to the United States?",Abject poverty,Better job and higher wages,India's caste system,Violence in her neighborhood,B,False,0.021854545921087265,0.04082966968417168,0.4974071979522705,0.4389602839946747
All of the following are reasons major cities attract young people in Latin America EXCEPT,the availability of jobs.,the potential for decent housing.,educational opportunities.,their families live there already.,D,True,0.024550698697566986,0.031523723155260086,0.3840375542640686,0.5587713122367859
"Which language family is most widely spoken in North America and Europe and includes Baltic, Celtic, Germanic, and Greek?",Dravidian,Uralic-Altaic,Sino-Tibetan,Indo-European,D,True,0.17110982537269592,0.043263331055641174,0.3196752071380615,0.4651246666908264
Which theorist(s) tried to explain the prices of farm products as they relate to patterns of land use?,Rostow,Ravenstein,Von Thünen,Burgess,C,True,0.014766375534236431,0.011500065214931965,0.7114838361740112,0.2617402970790863
Which of the following is NOT a spread effect in the core-periphery model of development?,Congestion in the core,High cost of labor in the core,High density in the core,More infrastructure in the core,D,True,0.052867013961076736,0.03206546977162361,0.344736248254776,0.56837397813797
Which of the following is NOT an important environmental factor influencing a country's agriculture?,Number of frost-free days per year,Availability of sufficient rainfall,Reliability of sufficient rainfall,Amount of fertilizer produced in the country,D,False,0.043994925916194916,0.06401223689317703,0.4729900360107422,0.41741225123405457
Which of the following countries is situated in the region of tectonic activity known as the Pacific Ring of Fire?,Brazil,Australia,Chile,India,C,False,0.06526739150285721,0.0739576518535614,0.37558794021606445,0.4822644293308258
"Which one of the following statements is NOT true of the ""core"" countries?",They are technologically advanced.,They are wealthy.,They are powerful.,They are less developed.,D,True,0.0190818402916193,0.031460635364055634,0.23246440291404724,0.7160407900810242
"If you wanted to find the global distribution of coal, you would use a",reference map.,topographic map.,thematic map.,location map.,C,True,0.0390559546649456,0.06439238041639328,0.47579890489578247,0.4198910593986511
Which one of the following is NOT a centripetal force in a state?,A high level of confidence in central government,The existence of strong separatist groups,The existence of national transportation networks,The national anthem,B,False,0.03567880019545555,0.03567880019545555,0.4346567392349243,0.49253061413764954
The cities of Varanasi (Benares) in India and Mecca in Saudi Arabia are alike because both are,capitals of countries formerly colonized by the English,destinations for vast numbers of pilgrims,financial centers for a large fraction of the world's economy,examples of modern urban planning,B,False,0.027308041229844093,0.016563164070248604,0.621528148651123,0.3326800465583801
China and Vietnam's dispute over the Spratley Islands is,a positional dispute.,a territorial dispute.,a resource dispute.,a functional dispute.,C,False,0.06760714948177338,0.052652500569820404,0.23597216606140137,0.6414387822151184
Which of the following is NOT used by geographers to determine absolute location?,Longitude,Latitude,Equator,Distance to the nearest city,D,True,0.028397174552083015,0.04681902751326561,0.2694248855113983,0.6463167071342468
Which of the following is a characteristic of a developed country?,Over 50% of workforce engaged in agriculture,Women held in inferior place in society,Main disease related to age and lifestyle,High birth and death rates,C,True,0.036239270120859146,0.052727822214365005,0.6423563957214355,0.26777398586273193
"Mary lives in a neighborhood with stores, offices, and restaurants so close that she does not need to own a car; however, she feels she has very little privacy. This is an example of a(n)",win-win.,trade-off.,infill.,leapfrog development.,B,False,0.04452264681458473,0.08317925781011581,0.5423968434333801,0.32898032665252686
Which of the following items below is an absolute location?,10 miles east of Pittsburgh,Washington,3 degrees south,"479 Elm Street, Muncie, Indiana",D,False,0.10811561346054077,0.08420051634311676,0.427605539560318,0.3773605525493622
Which one of the following groups is excluded from the caste system of Hinduism?,Scholar-priests,Warrior-landowners,Businessmen and farmers,Untouchables,D,True,0.02979499287903309,0.02979499287903309,0.17145834863185883,0.7684230208396912
Which of the following is a push factor?,Dissatisfaction with current jobs,Higher-paying jobs elsewhere,An attractive retirement community elsewhere,A pleasant climate,A,False,0.033633407205343246,0.029681377112865448,0.765492856502533,0.17080454528331757
"The Basques, Bretons, Kashmiris, and Tamils are all examples of",regionalist groups.,separatist groups.,terrorist groups.,interventionist groups.,B,False,0.20675000548362732,0.11066529899835587,0.340873122215271,0.340873122215271
Which of the following factors does NOT play a role in gender relationships in a culture or society?,Biology,Advancements in technological development,Religion,Custom,A,False,0.016853010281920433,0.011582893319427967,0.33850178122520447,0.6324045658111572
The intensive agricultural practice of planting and harvesting the same crop more than once a year is called,swidden.,double cropping.,pastorialism.,intertillage.,B,False,0.10277580469846725,0.21757638454437256,0.46060919761657715,0.21757638454437256
"When a new fashion design is introduced globally, the information initially travels through a process known as",contagious diffusion,relocation diffusion,innovative diffusion,hierarchical diffusion,D,False,0.057555150240659714,0.030807051807641983,0.6187762022018433,0.29228919744491577
Opponents of genetically modified organisms (GMOs) in food are afraid that the GMOs,will hinder global trade.,make plants more resistant to disease.,may cause irreversible changes in humans.,make plants more resistant to drought.,C,False,0.03143240511417389,0.01906471699476242,0.23225580155849457,0.7153982520103455
Which one of the following is NOT an advantage of urban agriculture?,Helping to solve the problem of solid waste disposal,Fresh produce for sale to others,Beautification of a dingy urban area,Renewed or purified water supplies,D,True,0.03358010575175285,0.029634343460202217,0.40908947587013245,0.5252812504768372
Which of the following is NOT a problem Europe currently faces today?,Rising immigration,Lack of population growth,Environmental apathy,Urban ethnic ghettos on the rise,C,False,0.08320153504610062,0.04453457519412041,0.25627875328063965,0.614780843257904
The world systems theory divides the world into,"core, periphery, and semi-periphery.",rich and poor.,developed and undeveloped.,haves and have-nots.,A,True,0.4010482728481293,0.2756361961364746,0.3123367130756378,0.010687574744224548
The majority of Kurds are found in which country?,Iran,Iraq,Turkey,Egypt,C,True,0.09882590174674988,0.05289769545197487,0.5018793940544128,0.3449363112449646
In what country are the most Basque speakers found?,Denmark,Finland,Luxembourg,Spain,D,True,0.005083797033876181,0.004486435558646917,0.020106807351112366,0.9688002467155457
The most rapidly urbanizing area of the world is:,Europe,East Asia,Sub-Saharan Africa,South Asia,C,True,0.023208942264318466,0.01407693512737751,0.5985665321350098,0.3630489408969879
The influence of neo-Malthusianism can be seen in,government programs for birth control and planning.,famine relief.,increased spending in social welfare programs.,increased total fertility rates.,A,False,0.11446499824523926,0.2423224002122879,0.3995220959186554,0.2423224002122879
The process of devolution involves,the change of government from a democracy to a communist dictatorship.,the movement of power from the central government to regional governments in the country.,the movement of power from a monarchy to a military dictatorship.,the movement of power from regional governments to central governments.,B,False,0.24100404977798462,0.10046542435884476,0.14617633819580078,0.5102055668830872
The theory that cities grow outward from a core utilizing several nodes of growth was proposed by,Rostow.,Ravenstein.,von Thünen.,Harris and Ullmann.,D,False,0.015496655367314816,0.037174541503190994,0.846088707447052,0.10105088353157043
The theory that the main purpose of a settlement or market town is to furnish goods and services to the surrounding market area is called the,urban hierarchy theory.,central place theory.,concentric zone model.,multiplier effect.,B,False,0.0865805372595787,0.3021957576274872,0.3424326777458191,0.2666868269443512
Which one of the following statements does NOT correctly describe transnational companies (TNCs)?,"Many TNCs operate in areas of electronics, chemicals, pharmaceuticals and petroleum.",Most TNCs produce and sell manufactured goods.,"Most TNCs are headquartered in the United States, Japan, and the European Union.",TNCs are generally controlled by foreign governments.,D,True,0.030933983623981476,0.035052794963121414,0.22857293486595154,0.7040541768074036
"The ""melting pot"" theory of combining several immigrant groups into one mainstream culture is called",amalgamation theory.,acculturation.,ethnic islands.,ethnic clustering.,A,False,0.05643503740429878,0.11947298049926758,0.5354407429695129,0.2866007685661316
Which theory below was used as justification for US involvement in Vietnam in the 1960s and 1970s?,Devolution,Colonialism,Heartland theory,Containment theory,D,False,0.06637939065694809,0.06637939065694809,0.4328480064868927,0.4328480064868927
Urban agriculture can benefit urban society in all of the following ways EXCEPT,create sustainable food systems in urban areas.,provide jobs for women and children.,turn urban waste into a resource when utilized in safe manner.,replace agribusiness as the main focus of global food production.,D,True,0.00871942937374115,0.005992769729346037,0.19845327734947205,0.7848979830741882
Which one of the following organizations is NOT a supranational organization?,UN,NATO,ASEAN,PLO,D,True,0.014952026307582855,0.03165343776345253,0.027934063225984573,0.9250491261482239
Which one of the following demographic factors characterizes stages 4 and 5 in the demographic transition model?,Zero population growth,High mortality rates,High birth rates,High sex ratios,A,False,0.026942554861307144,0.06463183462619781,0.787376880645752,0.12074816226959229
Which of the following statements does NOT describe a factor that contributed to suburbanization in the United States?,A shorter workweek made time for a commute possible.,Changes in the housing mortgage regulations made home ownership easier.,Fixed-route public transit routes increased in importance.,Improved automobiles made transportation easier and less limited.,C,False,0.08157145231962204,0.08157145231962204,0.36557793617248535,0.46941134333610535
An isobar map shows lines connecting all points of equal,atmospheric pressure,surface temperature,elevation,precipitation,A,False,0.03384234011173248,0.06322581321001053,0.6797415614128113,0.22067977488040924
Ralph purchases garden fertilizer at the nearby garden shop rather than drive 50 miles to the neighboring town for the same product. This reflects which type of spatial interaction?,Transferability,Complementarity,Intervening opportunity,Territoriality,C,True,0.09337678551673889,0.07272191345691681,0.6088931560516357,0.2239992916584015
What type of countries generally possesses a greater variety of climates and resources than other countries?,Perforated states,Fragmented states,Elongated states,Prorupt states,C,True,0.06639153510332108,0.06639153510332108,0.4329271614551544,0.4329271614551544
Which of the following factors has little or no impact on mortality rates in the developing countries?,New medicines,Improved birth control methods,Pesticides,Famine relief,B,False,0.0572371780872345,0.039338499307632446,0.4792410135269165,0.42292872071266174
"The idea that you identify with, and give allegiance, to a nation-state is",regionalism.,diffusion.,iconography.,nationalism.,D,False,0.05953307822346687,0.05953307822346687,0.43989327549934387,0.43989327549934387
What condition occurs when the people of one state want to annex a territory whose population is ethnically related to that state's population but now under the rule of another state?,Nationalism,Resource dispute,Irredentism,Positional dispute,C,False,0.018026474863290787,0.023146452382206917,0.28198152780532837,0.6764385104179382
"Variations in vocabulary, pronunciation, and rhythm in a spoken language are called",syntax.,isoglosses.,lingua francas.,dialects.,D,False,0.07255212217569351,0.08221232146024704,0.7800087928771973,0.06402702629566193
Boundary problems along the United States–Mexico border are caused by which type of issue below?,Ownership of fertile ground,Land use,Irredentism,Immigration,D,True,0.03781581297516823,0.03337233513593674,0.4065583050251007,0.5220311880111694
In which country does language pose a centrifugal force?,Canada,United States,Brazil,Norway,A,False,0.008317477069795132,0.017608098685741425,0.6607390642166138,0.3121110200881958
Quebec is a strong example of which of the following situations?,Irredentism,Secession,Ethnonationalism,A colony,C,True,0.021496174857020378,0.031276751309633255,0.8066380023956299,0.14017266035079956
Which of the following items below is NOT considered a barrier to the diffusion of an innovation?,Internet,Distance,Cultural obstacles,Government interference,A,False,0.02579496055841446,0.02922951802611351,0.35608842968940735,0.5870906114578247
Change in any culture is introduced through all the following processes EXCEPT,innovation.,diffusion.,acculturation.,gravity.,D,True,0.04807017371058464,0.08980689942836761,0.4024866223335266,0.45607709884643555
Which of the following statements regarding historical North American migration streams is NOT correct?,Canada's first major migration came from France.,Canada's second major migration stream originated in the British Isles.,Canada's third major migration stream came from Latin America.,The first major migration wave to the United States originated in Europe.,C,False,0.07812455296516418,0.060843463987112045,0.35012996196746826,0.5094360709190369
A chief factor that contributed to the Second Agricultural Revolution was,the Industrial Revolution.,World War I.,World War II.,the discovery of the plow.,A,False,0.03985138237476349,0.07445217669010162,0.7063826322555542,0.17860150337219238
Zero population growth (ZPG) is achieved when,CBR – CDR 5 2.,Births 1 immigration 5 deaths 1 emigration.,Total fertility 5 3.,Replacement fertility is achieved.,B,False,0.06892181187868118,0.10028064996004105,0.7409793734550476,0.08849736303091049
In which of the following Asian countries would one find special economic zones (SEZs)?,Japan,South Korea,China,Vietnam,C,True,0.1991792917251587,0.12080834805965424,0.47780629992485046,0.1991792917251587
Which of the following industries does NOT need to be close to its markets?,Dairy foods,Bulk-gaining products,Single-market products,Bulk-reducing products,D,False,0.06192982941865921,0.06192982941865921,0.5185320973396301,0.3563815653324127
Which of the following is NOT a characteristic of a city in the developing world?,Contains modern centers of commerce,Has a well-developed infrastructure,Experiences large in-migrations of rural people into the city,Produces a large share of its country's GDI,B,False,0.05278630927205086,0.05278630927205086,0.3900410234928131,0.5008226037025452
A map that presents a single class of statistics is called a,general purpose map.,thematic map.,reference map.,mental map.,B,False,0.03592245653271675,0.1253816932439804,0.4958942234516144,0.3408227860927582
The construction of freeways leads to all but which of the following results?,Urban sprawl,Traffic increase,Traffic congestion,Decreased dependency on cars,D,False,0.08075522631406784,0.07126623392105103,0.5265901684761047,0.3193930983543396
Which continent has the highest total fertility rates?,Africa,Asia,South America,Europe,A,False,0.0569770522415638,0.023751569911837578,0.37153708934783936,0.5405832529067993
What monotheistic religion is based on the life and teachings of Jesus Christ of Nazareth?,Islam,Christianity,Hinduism,Buddhism,B,False,0.09481357783079147,0.057507336139678955,0.22744596004486084,0.6182621717453003
Which of the following statements is true concerning folklore?,It is the written tradition of a group.,It encourages changing the old values and customs.,It serves to blend all cultures into one.,It expresses in words the shared values of a group by expressing their ideals.,D,False,0.19289752840995789,0.06262466311454773,0.46273714303970337,0.28066426515579224
The irregularity of the wet monsoon in South Asia in recent years may have a significant negative effect on which of the following?,Food production,Population patterns,Wildlife conservation efforts,Tourism,A,False,0.04255784675478935,0.0546453557908535,0.5874929428100586,0.3144623339176178
"According to Alfred Weber's least-cost theory, which one of the following costs of production is the most important factor in locating an industry?",Labor,Transport,Raw materials,Agglomeration costs,B,False,0.06894417852163315,0.060843028128147125,0.7412198185920715,0.12880468368530273
