0,1,2,3,4,5,correct,choiceA_probs,choiceB_probs,choiceC_probs,choiceD_probs
 Papadaki thinks that in cases where partners in a relationship mutually deny each other's humanity that,sexual objectification occurs.,sexual objectification does not occur.,there is no straightforward answer to the question of whether or not sexual objectification occurs.,the context of the relationship will determine whether or not sexual objectification occurred.,C,True,0.13140465319156647,0.1911926418542862,0.45864731073379517,0.21664966642856598
 Which of the following statements would Macedo disagree with?,States should give special weight to their own citizens.,Immigration policies can have powerful economic effects.,Self-governance is morally irrelevant to the immigration debate.,There are reasons to think U.S. immigration policy has had detrimental effects on income distribution among citizens.,C,False,0.04947590455412865,0.06352832168340683,0.4142566919326782,0.4694143533706665
 Which of the following best characterizes Rachels's argument?,"Both active and passive euthanasia involve the intentional termination of a human life with dignity; therefore, both are morally wrong.","Neither active nor passive euthanasia involves the intentional termination of a human life with dignity; therefore, both are morally permissible.","There is no inherent moral difference between killing and letting die; therefore, there is no inherent moral difference between active and passive euthanasia.","There is no inherent moral difference between killing and letting die; therefore, both active and passive euthanasia are morally wrong.",C,False,0.14439523220062256,0.09924130141735077,0.30568474531173706,0.44476863741874695
" Suppose two athletes, A and B, are equally skilled. Suppose also that A naturally inherited certain traits from her father that made playing the sport easier for her, and thus she didn't have to train as hard as B. According to the ethic of willfulness,",A is a better athlete.,B is a better athlete.,B doesn't count as an athlete because training precludes athleticism.,A and B are equally good athletes.,B,False,0.2019132375717163,0.07427971810102463,0.4274502992630005,0.2937820255756378
" According to Altman, justifications of speech codes that take account of which of the following kinds of harm have the best prospects for success?",causal harm,expressive harm,both causal and expressive harm,auxiliary harm,D,False,0.15651258826255798,0.13812188804149628,0.6190193295478821,0.08377515524625778
" Kant's Universal Law formulation does not refer to an agent's wants; rather, it represents",an ethical dilemma.,a criterion for social acceptability.,a way to measure the value of an action's consequences.,a kind of consistency test.,D,False,0.11512892693281174,0.13045817613601685,0.5846729874610901,0.16751162707805634
" Wellman cites a number of ""unpalatable implications that follow from denying a country's right to freedom of association,"" including",the inability to explain why it would be wrong to force Canada to join NAFTA.,the inability to explain why it would be wrong for the United States to forcefully annex Canada .,both A and B,neither A nor B,C,True,0.04863251373171806,0.029497109353542328,0.6713511347770691,0.24697630107402802
" According to West, which of the following reasons for a women to engage in sex with her male partner may cause her harm?","She or her children are economically dependent on her male partner, and so she reasons that she better have sex with him and keep him happy.",Her refusal will result in her partner's being in a foul mood which is more burdensome than having undesired sex.,Her refusal might result in a violent outburst.,All of the above.,D,True,0.10390672832727432,0.06302261352539062,0.3626701235771179,0.4656776487827301
" According to Kant, an imperative that represents an action as a necessary means to something that is willed is what kind of imperative?",categorical,universalizable,hypothetical,noumenal,C,True,0.17834265530109406,0.15738682448863983,0.4847855567932129,0.17834265530109406
 What does Pence think is an appropriate standard for the safety of SCNT before it should be allowed?,There should be no standards for safety.,SCNT should not be allowed unless a healthy baby could be guaranteed.,SCNT should be allowed when it falls within the range of risks that is accepted by ordinary people in sexual reproduction.,none of the above,C,True,0.09982918947935104,0.09982918947935104,0.7376434803009033,0.06054946407675743
 Which of the following claims would Leopold clearly accept?,The problems associated with how we should use our natural environment ultimately concern how human beings should treat each other.,"We should think in terms of ""the balance of nature"" to properly appreciate the value of the natural environment.",The problems associated with how we should use our natural environment are not merely economic problems.,We should ignore all economic motives in deciding questions about land use.,C,True,0.15717396140098572,0.09533082693815231,0.4841299057006836,0.2591360807418823
 Mill argues on that even a false opinion should not be censored because,no one actually knows anything.,you don't really know the true view unless you can explain why false views are false.,you don't really know whether or not anything is false.,All of the above.,B,False,0.14867772161960602,0.02750261314213276,0.14867772161960602,0.6663272976875305
" Norcross claims that if morality demands that we not torture puppies merely to enhance our own eating pleasure, morality also demands that",we try to reduce our carbon footprint.,we donate money to Oxfam.,we not support factory farming.,we follow the Golden Rule.,C,True,0.16490040719509125,0.1133342832326889,0.5079290270805359,0.2117363065481186
 Which of the following is not one of the potentially negative consequences of imposing the death penalty?,the prevention of future murders,great financial cost,the incitement effect,the execution of innocent persons,A,False,0.1378704458475113,0.08362265676259995,0.5452882051467896,0.2273099422454834
" According to Sinnott-Armstrong, the fact your government morally ought to do something",does not prove that government officials ought to promote it.,does not prove that you ought to do it.,proves that you ought not to do it.,"proves that you ought to do it, too.",B,False,0.10832839459180832,0.10832839459180832,0.6233869194984436,0.15761689841747284
 Some forms of misogynist speech only target a subset of women. Richardson-Self argues that we should,deny that subsets of women can be the targets of hate speech.,say that this speech is merely sexist speech.,consider such speech hate speech.,understand misogynistic speech as akin to other forms of oppressive speech against racial minorities.,C,True,0.03494742140173912,0.08383450657129288,0.701937735080719,0.1774776577949524
" Instead of asking why the act of destroying the environment might be immoral, Hill wants to ask",why the act of destroying nature might be immoral.,why people who destroy the environment might be bad people.,how the decision to preserve the environment benefits the environment.,whether plants have interests.,B,False,0.22380274534225464,0.08233243227005005,0.5368748903274536,0.15381723642349243
 Philippa Foot explains the moral relevance of the killing/letting die distinction by appealing to,rights of noninterference.,rights to goods and services.,both A and B,neither A nor B,C,True,0.05486942082643509,0.037711165845394135,0.5899019241333008,0.3157517611980438
 Which of the following is an example of a duty-based moral theory?,consequentialism,natural law theory,Kantian moral theories,none of the above,C,True,0.24403426051139832,0.16772212088108063,0.5166205167770386,0.0699169859290123
 Lukianoff and Haidt argue that trigger warnings involve which kind of pathological thinking?,fortune-telling,blaming,dichotomous thinking,resentment,B,False,0.04257775843143463,0.07019884884357452,0.7547088265419006,0.13114871084690094
 Corresponding to the practical aim of moral theory is the principle of,parsimony.,practical guidance.,explanatory power.,none of the above,B,False,0.1984923630952835,0.15458600223064423,0.5395581126213074,0.10624528676271439
" By recognizing that we have backup duties to donate to aid agencies, Ashford argues that we can",acknowledge the force of the criticism that effective altruism is at best a band-aid approach while diffusing this same criticism.,acknowledge that effective altruism fails to be the right response to global poverty.,"feel relieved about our duties to the global poor, since backup duties are not morally urgent.",None of the above.,A,False,0.1519995480775833,0.11837737262248993,0.530530571937561,0.1951713114976883
 Which of the following is a view that Dershowitz argues for?,"Torture is permissible in the ""ticking bomb"" case.","No democratic society should allow public officials to engage in illegal actions ""off the books.""","""Torture warrants"" should be part of a legal system regulating the practice of torture.",all of the above,D,False,0.6786433458328247,0.04338421672582626,0.1514258086681366,0.11793052405118942
" According to de Marneffe, which of the following is a reason we might call someone a drug addict?",They use a drug to relieve a craving.,They use a drug even though they obviously shouldn't.,"Although they believe they should use the drug when they decide to use it, at other times they believe they should not use the drug anymore.",all of the above,D,False,0.45488816499710083,0.06975936144590378,0.401437371969223,0.06975936144590378
" On McGregor's view, our rights carve out",what we are free to do.,the domain of our community.,the domain of our personal identity.,all of the above.,C,False,0.3775453269481659,0.08424175530672073,0.3775453269481659,0.15738430619239807
 Which of the following is an example of a duty that corresponds to a right to goods and service?,John's duty to return to Mary that car that he borrowed from her,John's duty to allow Mary to pursue goals that she values,John's duty to not harm Mary,John's duty to not commit suicide,A,False,0.18778856098651886,0.1462498903274536,0.4504813551902771,0.21279233694076538
" In response to the worry that the freedom of association could justify immigration policies that exclude entry to members of a given race, Wellman claims that",such a policy would wrongly disrespect existing citizens who belong to that race.,this is an implication of the freedom of association that we must accept.,this is an unavoidable implication of all philosophical positions on immigration policy.,none of the above,A,False,0.23535527288913727,0.16175717115402222,0.43970152735710144,0.16175717115402222
 Which of the following conditions would make a slippery-slope argument fallacious?,The envisioned results of the action or practice under consideration turn out not to be bad.,The central idea of the argument-that the action or practice under consideration will lead us down a path to disaster-turns out not to be plausible.,both A and B are correct; either condition would make the argument fallacious.,neither A nor B is correct; neither condition would make the argument fallacious.,C,True,0.04053404927253723,0.05897669494152069,0.6340592503547668,0.2643152177333832
" According to Carruthers, which of the following groups should not be accorded direct moral standing?",human infants,the senile,the mentally disabled,none of the above,D,False,0.11824572831392288,0.0812690258026123,0.6804572343826294,0.11824572831392288
" If the killing/letting die distinction is morally relevant, then that would show that the following distinction is also morally relevant:",killing/murder,physician/patient,active/passive euthanasia,involuntary/nonvoluntary euthanasia,C,True,0.12354666739702225,0.06612976640462875,0.6274217963218689,0.17975935339927673
 Macedo describes his position on immigration as politically,liberal.,conservative.,evangelical.,neutral.,A,False,0.10234333574771881,0.07970505952835083,0.458670973777771,0.3572133183479309
" In the context of Gardiner's article, what is ""the dispersion of causes and effects""?",the dispersion of the impacts of emissions of greenhouse gases to other actors and regions of the Earth,the dispersion of the causes of greenhouse gas emissions across the Earth,the dispersion of carbon dioxide molecules in the atmosphere,the dispersion of fault and blame for causing greenhouse gas emissions.,A,False,0.30065014958381653,0.1609264314174652,0.437443345785141,0.09760680794715881
 Kant refers to the special worth or value of persons as,virtue.,beauty.,praiseworthiness.,dignity.,D,False,0.26576942205429077,0.05930117145180702,0.5626338720321655,0.11078916490077972
 Stephen Macedo approaches the ethical issue of immigration from the perspective of _____ justice.,feminist,global,distributive,international,C,True,0.11777512729167938,0.2200329452753067,0.5981114506721497,0.06304048746824265
" On Kant's view, it is morally permissible to:",masturbate.,engage in prostitution.,engage in consensual sexual activity outside of marriage.,None of the above.,D,False,0.4218664765357971,0.08307042717933655,0.3722958564758301,0.12086676806211472
 West posits that one reason that these harms go unnoticed in the U.S. is that people in the U.S.,are less sensitive to threats from coercion.,are in general more sexist than other places.,tend to equate what is legal with what is good or harmless.,West actually thinks that people in the U.S. disproportionately recognize these harms.,C,False,0.16045694053173065,0.16045694053173065,0.23346345126628876,0.4361671507358551
 Cases in which a doctor is involved to some degree in assisting an individual to commit suicide are known as,mercy killing.,physician-assisted suicide.,involuntary euthanasia.,all of the above,B,False,0.42550960183143616,0.1565362513065338,0.37551090121269226,0.03957855701446533
" In contrast to other moral theories, care ethics emphasizes",the importance of attitudes as well as actions.,the concepts of care and compassion.,relationships as fundamental to one's identity and as a source of moral obligation.,all of the above.,D,False,0.19967472553253174,0.044553451240062714,0.6969332695007324,0.05720776692032814
 Why does Metz think that extant dignity-based arguments based on African values fail?,"It is unclear that they show that capital punishment is degrading, and so therefore wrong.",They prove too much. They seem to entail that any instance of killing in self-defense is wrong.,Both A and B,None of the above,C,True,0.15135599672794342,0.07149549573659897,0.41142821311950684,0.3630841076374054
" John considers what Mary has done and thinks to himself, Mary did the right thing. This thought is primarily a judgment about",Mary's upbringing.,an action Mary performed.,Mary's moral character.,what John thinks he would have done.,B,False,0.13565167784690857,0.13565167784690857,0.6079486012458801,0.11971217393875122
 A central premise of Wellman's argument is that the state's right to freedom of association implies a right to _____ prospective members:,exclude,punish,advocate,none of the above,A,False,0.3101551830768585,0.18811863660812378,0.3982471525669098,0.10069265216588974
 Papadaki argues that the narrow view of sexual objectification,is correct.,fails to account for cases where there can be unintentional disregard of a person's humanity.,fails to account for cases of benign or positive objectification.,none of the above.,B,False,0.0972214937210083,0.08579766750335693,0.6339637637138367,0.18163366615772247
 Baron cites a summary of Ali Soufan's Senate testimony to suggest that,torture works in only limited situations.,endorsing a single act of torture requires endorsing torture as a practice.,successful interrogation may not require torture.,torture is always wrong without exception.,C,True,0.21644338965415955,0.07026887685060501,0.5192207098007202,0.19101063907146454
 A war that involves actual fighting is known as,a hot war.,a cold war.,a war simpliciter.,none of the above,A,True,0.459624707698822,0.1690865010023117,0.27877649664878845,0.09050546586513519
 Carens defends a form of,Kantian distributionism.,anticosmopolitanism.,libertarian cosmopolitanism.,egalitarian cosmopolitanism.,D,False,0.22163371741771698,0.15232647955417633,0.5316716432571411,0.09239067137241364
" Callahan cites the Oregon Death with Dignity Legal Defense and the Education Center's finding that ""after four full years .. there have been no missteps, abuses or coercive tendencies"" regarding laws permitting euthanasia. In response he argues that",they can't know this to be true without an anonymous survey.,other studies have found contrary results.,"even if the finding is true, it is irrelevant to the moral status of euthanasia.",the findings are suspect because the study was performed by advocates of euthanasia.,A,False,0.07656887918710709,0.0867639109492302,0.2672516405582428,0.5657716989517212
 Which of the following is not an example of a natural right that Locke uses?,the right to life,the right to liberty,the right to citizenship,the right to property,C,True,0.10017383098602295,0.07801546156406403,0.5087246894836426,0.3085571527481079
" Shapiro claims that humans are social or cultural animals, which is significant for his view because it implies that",social norms or rules play a significant role in influencing behavior.,we are just products of our biochemistry.,past experience plays a significant role in influencing behavior.,none of the above,A,False,0.37371447682380676,0.09448981285095215,0.4798588752746582,0.05057675391435623
 Van den Haag thinks that we can't know whether a murderer who receives the death penalty,is justly punished.,suffers more than the victim.,is morally degraded.,is punished excessively.,B,False,0.1538066416978836,0.1538066416978836,0.5368379354476929,0.1538066416978836
 Critics of speech codes adopted in the 1980s and early 1990s argued that these codes violated which of the following principles?,freedom of speech,freedom of the press,right to bear arms,right to privacy,B,False,0.10116860270500183,0.08928097039461136,0.4534062147140503,0.3531131148338318
" According to Aristotle, if something has a function, then its good depends on",its function.,its substance.,our beliefs about it.,cultural practices.,A,False,0.3060702383518219,0.12758904695510864,0.5046244859695435,0.06026880070567131
" Suppose Nathan argues that while neither nonhuman nor nonsentient beings have direct moral standing, we still ought to have a certain noninstrumental regard for the environment because failing to do so involves a deficiency in one's moral character. Nathan is most likely applying what moral theory?",virtue ethics,consequentialism,Kantian theory,an ethics of prima facie duty,A,False,0.21298465132713318,0.30989083647727966,0.30989083647727966,0.16587261855602264
" More than communicating to an individual, McGregor argues that rape",reinforces a corrupt legal system.,expresses contempt for the democratic system of government.,expresses the inferiority of women as a group to the wider community.,reinforces gender roles.,C,True,0.14151887595653534,0.09726439416408539,0.49394938349723816,0.26439207792282104
 What is the main difference between a cloned (SCNT) individual and an individual who is a product of normal sexual reproduction?,The SCNT individual has genetic material primarily from one person instead of two.,The SCNT individual has genetic material primarily from two people instead of one.,The SCNT individual has no genetic material.,There is no significant difference.,A,False,0.2156517505645752,0.1154300719499588,0.5173217058181763,0.1482151448726654
" According to Lee and George, ova/sperm are not human beings because",they cannot reproduce.,they do not have a human genetic profile.,they are genetically and functionally identifiable as parts of the male or female potential parents.,all of the above,C,False,0.34896939992904663,0.0687161460518837,0.2717776298522949,0.30796441435813904
 Little suggests that we should think about the abortion issue in terms of degrees and layers because,the fetus gains a more certain claim to the right to life over time.,the fetus gains more capacities over time.,"a gestating mother is somewhere in between a mere biological mother and a mother in a thick, normative sense.",the gestating mother has different degrees and layers of preferences.,C,True,0.09478269517421722,0.10740285366773605,0.618060827255249,0.17707738280296326
 West worries that liberal theory in academia has inadvertently led to the under-acknowledgement of the harms of consensual sex because,it is implicitly sexist.,it promotes individualism and valorizes individual choice.,it is too left-wing to support a sound gender-based critique of our sex practices.,it promotes communitarian thinking to the detriment of individualism.,B,False,0.1640072911977768,0.08778677135705948,0.23862920701503754,0.5051780343055725
 Utilitarian arguments depend heavily on factual claims about,what a virtuous person ought to do in a particular situation.,what God has commanded or would prefer.,what duties one has inherited through implicit social contracts.,the overall comparative effects of contemplated courses of action.,D,False,0.24200066924095154,0.1143130287528038,0.3989916443824768,0.24200066924095154
" In his discussion of discrimination in war, Valls suggests that",there is no difference between combatants and noncombatants.,the difference between combatants and noncombatants is a matter of degree.,the difference between combatants and noncombatants is categorical and clear.,"""terrorism"" should be defined as indiscriminate violence.",B,False,0.1482190489768982,0.11543311923742294,0.4565468430519104,0.27690964937210083
" Which of the following is not, according to Carens, a concern for all liberal egalitarians?",the ability of people to pursue their own projects,equal opportunity,freedom of speech,keeping actual inequalities as small as possible,C,False,0.0878068134188652,0.11274618655443192,0.3472827076911926,0.44591981172561646
 Lukianoff and Haidt argue that American colleges and universities now encourage,emotional reasoning.,critical reasoning.,reflective reasoning.,all of the above.,B,False,0.20425154268741608,0.0402195118367672,0.6291390657424927,0.12388481944799423
 Aristotle defines virtue as,the ability to control one's anger.,a disposition to avoid extremes in feeling and action.,intellectual knowledge.,the capacity to ascertain what God would desire.,B,False,0.21062247455120087,0.08780050277709961,0.5725312232971191,0.1277489811182022
 Nagel thinks that the core of the absolutist position is that,human persons have a right to life.,it is permissible to harm as a foreseen but unintended consequence of action.,the ends justify the means.,the hostility should be directed at its true object.,D,False,0.28242290019989014,0.13340714573860168,0.3626381754875183,0.21995118260383606
" Which of the following is a ""positional good,"" according to Peter Singer's definition?",being at least six feet tall (in a population where this is above average),having an IQ of at least 150 (in a population where this is the average),being at least six feet tall (in a population where this is the average),all of the above,A,True,0.2878217101097107,0.19781677424907684,0.25400176644325256,0.25400176644325256
 Aquinas's moral theory is a version of,consequentialism.,natural law theory.,rights-based theory.,virtue ethics.,B,False,0.11412227898836136,0.11412227898836136,0.6567283868789673,0.11412227898836136
" Van den Haag responds to the ""miscarriages of justice"" objection by claiming that",miscarriages of justice are offset by the moral benefits and usefulness of doing justice.,"there have been no miscarriages of justice, in the sense used in the objection.",miscarriages of justice are inevitable and so irrelevant.,none of the above,A,False,0.2073114514350891,0.18295171856880188,0.3417988121509552,0.2661931812763214
" Which of the following does Corvino take to be a problematic ""hidden assumption"" of harm arguments against homosexuality?","If a practice is riskier than the alternatives, then that practice is moral, prudent, or otherwise to be pursued.","If a practice is risker than the alternatives, then that practice is immoral, imprudent, or otherwise to be avoided.","If a practice is safer than the alternatives, then that practice is immoral, imprudent, or otherwise to be avoided.",none of the above,B,False,0.2364060878753662,0.09854871034622192,0.5004716515541077,0.16247935593128204
 Patrick Lee and Robert George argue that human embryos are complete human beings because,they are complete organisms that are genetically human.,"unlike cells of the mother or father, their growth is directed toward survival and maturation.",both A and B,neither A nor B,C,True,0.1181553304195404,0.049254465848207474,0.46731337904930115,0.36394402384757996
" Hate speech, according to Richardson-Self involves",only violence,"violence and oppression in the form of subordination, exploitation, and cultural imperialism.","only forms of oppression like subordination, exploitation, and cultural imperialism.",none of the above,B,False,0.1152765303850174,0.06170307472348213,0.7516973614692688,0.06991874426603317
" When we think about the norms of creation, Little argues that","it can be a sign of respect to terminate a pregnancy when certain background conditions, like a loving family, are not met.","it is never a sign of respect to terminate a pregnancy, because we should value and hold sacred the act of creation.",we see the abortion issue as a matter of the personal preferences of the mother.,none of the above.,A,True,0.3807538151741028,0.14007151126861572,0.336014062166214,0.14007151126861572
