0,1,2,3,4,5,correct,choiceA_probs,choiceB_probs,choiceC_probs,choiceD_probs
" What two problems does individualism lead us into, according to Hourdequin?",It leads to failures of developing integration and integrality.,"They lead us into ""tragedy of the commons"" situations and they instill in us an atomistic view of persons.",It leads to increased greenhouse gas emissions and increased consumption of non-recyclable goods.,"We both tend to think of our moral obligations as only personal obligations, and so think that we can only advocate for policy in ""tragedy of the commons"" situations.",D,False,0.1612350046634674,0.11081507802009583,0.5627654194831848,0.1612350046634674
 One message that Nathanson argues we can send by abolishing the death penalty is that,we respect the dignity of human life.,there are some penalties worse than death.,there is no punishment that is proportional to murder.,none of the above,A,False,0.26139193773269653,0.10896436125040054,0.4883444011211395,0.13991300761699677
 Aristotle claims that a state of character arises from the repetition of similar,beliefs.,relationships.,activities.,opinions.,C,True,0.11924374848604202,0.1531120091676712,0.6055697798728943,0.11924374848604202
" Corvino considers the following argument: Homosexuals are ""born that way""; therefore, homosexual activity is good and natural. Corvino claims that this argument is unsound. Why?",It ignores the possibility that homosexuality is a lifestyle choice.,It assumes that all innate desires are good ones.,It is equivalent to recognizing that homosexuality is unusual.,None of the above,B,False,0.12475273013114929,0.058929018676280975,0.6335467100143433,0.181514173746109
 Hardin's approach to the moral issues of hunger and poverty is essentially,a consequentialist approach.,a virtue ethics approach.,an ethics of prime facie duty approach.,a Christian/Marxist approach.,A,False,0.19142256677150726,0.1689298003911972,0.5203404426574707,0.1161036491394043
 Which of the following theories will approach the morality of abortion by considering how much overall intrinsic value is likely to be brought about by abortion?,virtue ethics,consequentialist theory,Kantian ethics,natural law theory,B,False,0.11712314188480377,0.24794970452785492,0.46323102712631226,0.17041318118572235
" In his definition of terrorism, Valls defines ""violence"" as",including only bodily harm to persons.,including bodily harm to persons and the destruction of property.,including only the destruction of property.,none of the above,B,False,0.15547418594360352,0.12108341604471207,0.6149123907089233,0.10685573518276215
 What information is available to occupants within Rawls's original position?,knowledge of how one is talented compared to others,knowledge of one's social status,"knowledge of one's abilities, such as intelligence, strength, and so on",none of the above,D,False,0.22490769624710083,0.12038441002368927,0.47612956166267395,0.1751583069562912
 Shapiro claims that surveys have been confirmed by longitudinal studies that indicate that,excessive use of illegal drugs is the norm.,moderate and/or controlled use of illegal drugs is the norm.,an individual's illegal drug use inevitably diminishes over time.,those who begin using illegal drugs typically do not stop until they become addicted.,B,False,0.4034511148929596,0.13098140060901642,0.3142080307006836,0.14842139184474945
 A truly environmental ethic must hold that which of the following has direct moral standing?,at least some nonhuman beings,at least some nonconscious beings,both A and B,neither A nor B; an environmental ethic may deny that there are any nonhuman and nonconscious beings with direct moral standing.,C,False,0.013395809568464756,0.02208595536649227,0.391482949256897,0.5696042776107788
 Ashford argues that worries about causing dependency on aid agencies among those in extreme poverty does not mean that we should,abandon the world's poor to their unjust predicament.,legally abolish aid agencies.,adopt a social contract approach to the problem of global economic justice.,accept the view that we have no negative duties to the poor.,C,True,0.057631295174360275,0.05085943639278412,0.7955754399299622,0.0950179398059845
" According to Singer, the conclusions argued for in ""all animals are equal"" flow from which of the following principles alone?",the principle of maximizing happiness,the principal principle,the principle of double effect,the principle of minimizing suffering,D,False,0.146376833319664,0.18795156478881836,0.45087239146232605,0.21297705173492432
" Mill thinks that if something is desirable, but not desirable as an end, then it must be",desirable as a rule.,desirable in theory.,desirable as a means.,none of the above,C,True,0.30619022250175476,0.1857137680053711,0.3931560218334198,0.11264108866453171
" From the fact that emigration is often associated with significant costs, Fine concludes that",those who are willing (or forced) to leave a state often have substantial interests in living in another state.,preventing potential immigrants from settling in a different state can be detrimental to their well-being.,closing borders can have significant costs to potential immigrants.,all of the above,D,False,0.26928290724754333,0.14413674175739288,0.3457660675048828,0.2376413196325302
 Mill defends which of the following liberty-limiting principles?,the harm principle,the offense principle,the principle of legal paternalism,wthe principle of legal moralism,A,False,0.12764641642570496,0.07742145657539368,0.4455297589302063,0.34697893261909485
" By definition, if a person or thing needs to be taken into account in moral decision-making (i.e., if it counts morally), then that person or thing has",moral standing.,moral permissibility.,viability.,all of the above,A,True,0.41472703218460083,0.13464215397834778,0.25154465436935425,0.19590318202972412
" What is an example of ""mutual coercion, mutually agreed upon""?",all countries cooperating to change the existing incentive structure by introducing a system of enforceable sanctions to curb climate change.,the agreement of more powerful nations to require less powerful nations to curb greenhouse gas emissions for the benefit of all humanity.,the agreement of less powerful nations to boycott trade with more powerful nations until the latter agree to curb their greenhouse gas emissions.,the agreement of a large number of individual agents to restrict their own pollution.,A,False,0.09695345163345337,0.09695345163345337,0.7163945436477661,0.0855611264705658
" Which of the following is a problem for Kant's principle of equality and an ""eye for an eye"" according to Nathanson?",It fails to tell us what the appropriate punishment would be for all cases of criminal action.,It does not provide an adequate measure of moral desert.,It requires that we punish criminals in ways that are morally unacceptable.,all of the above,D,False,0.553787112236023,0.09623376280069351,0.14001931250095367,0.20372691750526428
" What is Pence's main objective in his article ""Will Cloning Harm People?""",to use consequentialist arguments to show that cloning is immoral,to object to consequentialist arguments against cloning,to use Kant's humanity formulation to show that cloning is immoral,to use Kant's humanity formulation to show that cloning is morally acceptable,B,False,0.26431673765182495,0.2332587093114853,0.3393894135951996,0.16031621396541595
 Timmons suggests that many people believe in moral relativism because,They believe in tolerating differences.,They are sensitive to the descriptive fact of widespread moral disagreement.,They realize that some ethical claims seem true in some contexts but not in others.,All of the above.,D,False,0.6637999415397644,0.042435310781002045,0.1901818811893463,0.10179702192544937
" According to Sandel, eugenics and genetic enhancement can be seen to be wrong from a religious perspective because",their use would lead to atheism or agnosticism.,"in using them, we would confuse our role in creation with God's role.",the Bible explicitly opposes all forms of technological enhancement.,all of the above,B,False,0.25630247592926025,0.08320922404527664,0.3290988802909851,0.3290988802909851
 Which of the following is a method of torture that Dershowitz believes is appropriate in those cases where torture is permissible?,having a sterilized needle shoved under the victim's fingernails,electrocution at nonlethal levels,submerging the victim in water so he or she feels as if he or she is drowning,none of the above; Dershowitz thinks torture is wrong in all cases.,A,False,0.15309566259384155,0.17348012328147888,0.471567839384079,0.196578711271286
" In Rachels's thought experiment with Smith and Jones, Jones's action (i.e., his watching the child, who slipped accidentally, drowned in the tub) is supposed to be an example of",killing.,letting die.,assisted suicide.,none of the above,B,False,0.25716185569763184,0.12147465348243713,0.4804415702819824,0.1376488208770752
" According to Gill, the moral value of autonomy mostly consists in",the ability to act and choose while free from distress.,the ability to choose to end one's own life.,the ability to make important life decision on the basis of our deepest values.,the duty to not interfere with the free choices of others.,C,True,0.1564711183309555,0.08375295251607895,0.7012549042701721,0.057562507688999176
 Foot's Rescue I and Rescue II cases are intended to,contrast evil intentions with good intentions.,contrast originating a harmful sequence with allowing a harmful sequence to continue.,show that evil intentions always involve the origination of harmful sequences.,all of the above,B,False,0.41084834933280945,0.07139473408460617,0.41084834933280945,0.10387872904539108
" In contrast to Garrett Hardin's approach, the Confucian model rejects coercion because",the costs of eliminating a collective action problem are not irrelevant to its solution,it affirms the autonomy of individuals apart from others.,"it cannot lead to real social change, which involves changes of mind as well as action",The Confucian model actually accepts coercion.,B,False,0.0886276364326477,0.0886276364326477,0.24091488122940063,0.5779247879981995
 Velleman believes that the option of euthanasia may harm some patients. What does he think is the most significant way in which this might happen?,by burdening a patient with having to justify his or her continued existence,by eliminating the patient's capacity for self-determination,by eliminating a patient's opportunities for self-determination,by tempting a patient to undergo a painful procedure,A,False,0.11916463077068329,0.17338353395462036,0.6857451796531677,0.020707709714770317
 Velleman believes that euthanasia can be justified on the basis of,Kantian considerations.,consequentialist considerations.,existentialist considerations.,feminist considerations.,A,False,0.13914771378040314,0.10836835950613022,0.70665043592453,0.045174650847911835
" Carruthers argues that, on contractualist grounds, nonhuman animals may be accorded which of the following kinds of moral standing?",direct,indirect,quasi-,none of the above,B,False,0.19921061396598816,0.19921061396598816,0.42172887921333313,0.17580273747444153
" One of the premises of the ""lack of imagination"" argument that Kamm discusses is that",genetic enhancement is always morally permissible.,nature ought to be honored over personal choice.,most people's conception of the varieties of goods is limited.,we ought to always leave the development of valuable traits up to chance.,C,False,0.3078465163707733,0.14541639387607574,0.2716735899448395,0.2716735899448395
" In accordance with the theory of justice proposed by John Rawls, Stephen Macedo argues,""We must consider the justifiability of policies from the standpoint of the _____ well-off among our fellow citizens.""",most,least,historically,permanently,B,True,0.18687456846237183,0.3491276502609253,0.3491276502609253,0.11334515362977982
 Which of the following is not a prima facie duty that Ross discusses?,the duty to keep promises,the duty not to harm others,the duty to protect our natural environment,the duty of nonmaleficence,C,True,0.08589969575405121,0.08589969575405121,0.5601363182067871,0.26458969712257385
 Which of the following is an example of a vice of character?,blindness,physical weakness,obesity,cowardice,D,False,0.09441038966178894,0.050534240901470184,0.4794555604457855,0.37340036034584045
" Leopold claims that history has shown that ""the conqueror role is eventually self-defeating."" It is self-defeating, in this view, because",the conqueror doesn't understand what makes the conquered community tick.,the conqueror doesn't know what and who within the community is valuable.,the conqueror doesn't know what and who is worthless in community life.,all of the above,D,False,0.4113743007183075,0.07148613035678864,0.36303654313087463,0.1513361632823944
" Sarah Fine's ""internal critique"" of Wellman's argument targets his claim that","we have an absolute right to freedom of association (i.e., one that cannot be outweighed by anything else).",freedom of association implies that a legitimate state has a presumptive right to exclude anyone from its territory.,immigration is harmful to low-income Americans.,egalitarianism is a Marxist doctrine.,B,False,0.2695494294166565,0.1852584332227707,0.2378765344619751,0.3054395318031311
 Shapiro discusses experiments about the role of expectations in the experience of drug use to show that,drug effects are inherently biological and are not influenced at all by expectations and other psychological factors.,"users who do not expect to get addicted to ""hard"" drugs almost always do.",there is no such thing as drug addiction.,sometimes a drug's effects are the direct result of what one expects from the drug.,D,False,0.26855406165122986,0.14374662935733795,0.3448302447795868,0.23699812591075897
 What kind of consequentialist theory does Dershowitz think can justify terrorism in certain extreme particular cases?,act-based deontology,rule-based hedonism,rule utilitarianism,act utilitarianism,D,False,0.09052832424640656,0.13171795010566711,0.4597407877445221,0.3159749209880829
" On the proposal that we need to establish world food banks to help those who are in need, Hardin would say that","if the proposal were to be realized, the operation must be conducted consistently.",only the richer countries have some moral obligation to make deposits in the world food banks.,it would be subject to the tragedy of the commons.,we need to go with the idea because we ought not to punish poor people who are caught in an emergency.,C,True,0.13101106882095337,0.1484549641609192,0.3561249375343323,0.3561249375343323
 A utilitarian who recognizes rights will attempt to explain rights on the basis of utility by claiming that,there are no moral rights; there is only utility.,a moral right is a kind of claim that is justified by the fact that its recognition will not diminish overall welfare.,a moral right is a kind of claim that is justified by the fact that its recognition will contribute to the maximization of overall welfare.,all of the above,C,False,0.4856075942516327,0.12278082966804504,0.29453590512275696,0.09562180191278458
" If a global ban would not be effective in prohibiting genetic engineering that goes beyond eliminating obvious defects, then Singer suggests which ""bolder"" strategy?",creating a world military that would enforce the ban with greater strength,requiring genetic engineering for every newborn child,using a lottery system so everyone gets a fair chance at the benefits of genetic engineering,none of the above,C,True,0.19261644780635834,0.19261644780635834,0.46206286549568176,0.15000984072685242
 Which of the following is a kind of consequentialist theory that explains right action in terms of the net balance of pleasure (or lack of pain) produced by that action?,hedonistic utilitarianism,perfectionist consequentialism,rule consequentialism,"By definition, consequentialist theories do not mention pain.",A,False,0.11559289693832397,0.14842422306537628,0.5180513858795166,0.2159559577703476
 The retributive theory of punishment does not claim that,wrongdoers deserve to be punished.,specific punishments are justified based on the overall intrinsic value that they produce,the punishment should fit the crime.,the death penalty might be morally justified in some cases of murder.,B,False,0.18270409107208252,0.11081562936306,0.4966411590576172,0.20703083276748657
" Mary's laptop deserves moral consideration only because she owns it and cares about it. Thus, Mary's laptop has",direct moral standing.,indirect moral standing.,relative moral standing.,inherent or intrinsic worth.,B,False,0.3295210897922516,0.13736483454704285,0.3733963072299957,0.15565474331378937
 Collins suggests that the moral value of caring actions comes from,the intrinsic value of caring attitudes which motivate caring actions.,how well any caring actions fulfills the recipient's interests and the strength of one's intention to fulfill the recipient's interest.,the degree to which those actions produces the greatest amount of happiness in the recipient of care.,the non-instrumental value of caring actions as manifestations of intrinsic goods for person like love and forgiveness.,B,False,0.2194530963897705,0.13310502469539642,0.5264406204223633,0.11746478080749512
" Kant's humanity formulation of the categorical imperative makes it impermissible for us to, he argues,",sell one of our teeth.,engage in prostitution.,both A and B,Neither A nor B,C,True,0.040876083076000214,0.024792594835162163,0.7245458364486694,0.207585871219635
" According to Nathanson, criminals who commit murder forfeit their right to",life.,respect.,privacy.,humane treatment.,C,False,0.05514487624168396,0.033447060734033585,0.31733688712120056,0.5928633213043213
 Reiman suggests that the refusal to execute criminals teaches,the wrongfulness of murder.,that the death penalty is a better deterrent than life imprisonment.,that criminals already face the risk of death.,that criminals are usually undeterred by the chance of receiving the death penalty.,A,False,0.27527904510498047,0.10126950591802597,0.4538584351539612,0.16696520149707794
" According to Shapiro, the standard view has to explain the preeminence of controlled use by arguing that",controlled use is preeminent.,drug laws have no effect on access to illegal drugs.,drug laws reduce access to illegal drugs.,drug laws increase access to illegal drugs.,C,True,0.251216858625412,0.1047227680683136,0.4693348705768585,0.17265866696834564
 Which of the following is a premise of Kass's despotism argument?,Cloning is inherently morally wrong.,"In reproductive cloning, one seeks to impose one's will on a child's future.",The permissibility of cloning depends on the parent's intent to raise the child.,We have a good reason not to clone.,B,False,0.16495239734649658,0.12846505641937256,0.39570024609565735,0.30817165970802307
" In Rachels's thought experiment with Smith and Jones, Smith's action (i.e., his holding the child underwater) is supposed to be an example of",killing.,letting die.,assisted suicide.,none of the above,A,False,0.2531823515892029,0.13551874458789825,0.4730069041252136,0.13551874458789825
 All cases of euthanasia in which the patient has consented to the active bringing of his or her death are cases of,voluntary euthanasia.,involuntary euthanasia.,nonvoluntary euthanasia.,passive euthanasia.,A,False,0.286940336227417,0.1740381121635437,0.4174957275390625,0.11961453408002853
" According to Ross, when our duties conflict with each other we should",not do anything because duties cannot actually conflict with each other.,use moral judgment to determine which duty should be obeyed.,consult authorities instead of relying on our own judgment.,wait until the conflict ceases on its own.,B,False,0.06871622055768967,0.11329389363527298,0.6519613862037659,0.1648416519165039
 Kamm claims that Sandel's moral distinction between treatment and enhancement assumes that,nature in itself has no moral value.,nature is sacred and should be honored.,human beings want enhancement more than they want treatment.,there is no moral difference between treatment and enhancement.,B,False,0.1484386920928955,0.11560416966676712,0.5181019306182861,0.2159770131111145
 West argues that feminist legal theory has inadvertently led to the under-acknowledgement of the harms of consensual sex because,it posits that all sex is rape.,"by suggesting that the harm of rape is that it is nonconsensual, it implies that all consensual sex is good.","by suggesting that the harm of rape has nothing to do with the victim's gender, it implies that women are not especially harmed by nonconsensual sex.",all of the above.,B,False,0.28903675079345703,0.07307993620634079,0.15471021831035614,0.47654104232788086
 Sinnott-Armstrong is most interested in examining issues about the moral obligations of,individuals.,societies.,governments.,families.,A,False,0.20825856924057007,0.3030144274234772,0.4408833980560303,0.046468764543533325
" The decision to remove Terri Schiavo's feeding tube, thus allowing her to die of dehydration, is a case of:",voluntary euthanasia.,physician-assisted suicide.,passive euthanasia.,active euthanasia.,C,True,0.27899253368377686,0.1692175418138504,0.3582335114479065,0.19174858927726746
 De Marneffe explains that we might call someone a drug addict to show that,it is a mistake to suppose that drug use is sometimes evidence of low self-control.,drug addiction is a problem that drug legalization cannot address.,"it is a mistake to suppose that drug use, even heavy drug use, is not autonomous.",none of the above,C,True,0.24921169877052307,0.10388688743114471,0.5275811553001404,0.11771927028894424
 Frances Kamm discusses the case of a scientist who works on finding a cure for congenital blindness and is motivated only by a bad desire for mastery to suggest that,sometimes an action can be permissible even if it is motivated by a bad desire.,all actions motived by bad desires are impermissible.,"the desire for mastery is not, as Sandel argues, a bad desire.",sometimes the only way to cure a disease is through selfish desires.,A,False,0.08587592840194702,0.07578524947166443,0.49418187141418457,0.3396459221839905
" If Thomson's conclusion is correct, then",the abortion issue cannot be settled just by determining at what stage (if any) the fetus is a person.,abortion is always morally permissible.,abortion is never morally permissible.,the abortion issue can be settled just by determining at what stage (if any) the fetus is a person.,A,False,0.1140688955783844,0.06105668097734451,0.24148385226726532,0.5792896747589111
" In satisfying Kant's Humanity formulation of the categorical imperative, we are obligated to adopt two very general goals: the goal of promoting the (morally permissible) ends of others and the goal of",self-perfection.,producing happiness.,increasing welfare.,self-sacrifice.,A,False,0.28472137451171875,0.28472137451171875,0.3655894994735718,0.06352992355823517
 Ashford defines a structural human rights violation as,"violations of human rights that pertain to the structure of a person's practical, social, and political agency.",ongoing patterns of behavior by a large number of agents which predictably result in many others coming to be deprived of the object of a fundamental human right: the means of subsistence.,the violation of fundamental human rights brought about the political structures of a particular government.,all of the above,B,False,0.45461180806159973,0.11494386196136475,0.3124498426914215,0.11494386196136475
" Which of the following is a possible source of obligations, according to Cohen?",rights,freely made commitments,special relations,all of the above,D,False,0.384402871131897,0.06679920107126236,0.3392343521118164,0.2057560384273529
 Richardson-Self argues that sexist speech,"is always hate speech, because it involves violence.","is not always hate speech, because it does not involve violence","is always hate speech, because it does not involves violence.","I s not always hate speech, because it always involves violence.",B,False,0.10817678272724152,0.10817678272724152,0.2940549850463867,0.48481470346450806
" Norcross agrees that if a being is incapable of moral reasoning, at even the most basic level, then it cannot be",a moral patient.,a moral agent.,an object of moral sympathy.,a being of value.,B,False,0.16657505929470062,0.18875429034233093,0.5130873322486877,0.1297287791967392
" Shapiro cites a study of Vietnam veterans, which showed a significant decrease in heroin use after the veterans returned home. Which factor does Shapiro cite as explaining this decrease?",the type of drug used,the duration over which the users used the drug,the pharmacological effects of heroin,the difference in social setting,D,False,0.21114875376224518,0.11301979422569275,0.5065195560455322,0.16444282233715057
 One suggestion that Lukianoff and Haidt make to challenge vindictive protectiveness is,have colleges and universities officially and strongly discourage trigger warnings.,to defund the Department of Education.,to promote greater understanding of historical and contemporary oppression.,none of the above.,B,False,0.31173643469810486,0.1472538560628891,0.51396644115448,0.025588883087038994
 Aristotle's moral theory is a version of,virtue ethics.,consequentialism.,rights-based theory.,utilitarianism.,A,False,0.1117674931883812,0.18427346646785736,0.6431775689125061,0.059824831783771515
