0,1,2,3,4,5,correct,choiceA_probs,choiceB_probs,choiceC_probs,choiceD_probs
" Suppose Wellman argued that just as you have a right not to marry someone who would be harmed by your refusal, a state is free to exclude others even if it causes harm to them. Fine would respond by saying that",the liberal state cannot claim to be primarily an intimate or expressive association.,you do not have the right to refuse a legitimate marriage proposal.,there is no difference between marital relationships and the relationship between a citizen and his state.,refusing to marry someone cannot be a cause of harm.,A,False,0.10595832765102386,0.05671541020274162,0.22431382536888123,0.609748125076294
" Which of the following is an example of a ""right of noninterference"" according to Arthur?",the right to privacy,the right to life,the right to exercise religious freedom,all of the above,D,False,0.3547429144382477,0.06985302269458771,0.45549890398979187,0.11516815423965454
 Audi proposed that we expand Ross's list of prima facie duties to include,veracity.,enhancement and preservation of freedom.,respectfulness.,all of the above,D,False,0.11862634122371674,0.10468737781047821,0.6024343371391296,0.17260032892227173
" According to Singer, which of the following historical defenders of the principle of equal consideration of interests was one of the few to recognize that the principle applies to members of other species as well as to our own?",Immanuel Kant,Aristotle,Jeremy Bentham,John Stuart Mill,C,True,0.19442275166511536,0.22030982375144958,0.3632294833660126,0.22030982375144958
" The only way to break out of the ""terrorist cycle,"" says Walzer, is to","attack quickly, swiftly, and with full force.",use the same tactics the terrorists use.,avoid playing the terrorism game.,use psychological rather than military tactics.,C,True,0.11026052385568619,0.059018202126026154,0.7189888954162598,0.11026052385568619
" According to Norcross, which of the following arguments poses a formidable challenge to any proposed criterion of full moral standing that excludes animals?",the ontological argument,the argument from cosmology,the argument from marginal cases,none of the above,C,True,0.2008984237909317,0.15645983815193176,0.5460984706878662,0.09489767998456955
" According to Aquinas's moral theory, morality is ultimately grounded in",agreements made between individuals.,pleasure and the absence of pain.,facts about human nature.,virtue.,C,True,0.1456589251756668,0.10010982304811478,0.6527979969978333,0.10010982304811478
 Kant's moral theory is a version of,consequentialism.,virtue ethics.,utilitarianism.,none of the above,D,False,0.2575477063655853,0.13785535097122192,0.481162428855896,0.12165691703557968
 Which of the following statements best describes Gill's response to the argument that the Oregon physician-assisted law falsely assumes that doctors are qualified to judge whether a life is worth living?,Doctors are as qualified as any other mature adult to decide whether a life is worth living.,"Doctors are normally required to make life-and-death decisions, and this is no exception.",The argument is self-defeating because it was proposed by medical doctors.,The law only requires doctors to make medical decisions about the patient's life expectancy and prognosis.,D,True,0.12382736802101135,0.08510522544384003,0.2313399761915207,0.554955780506134
" The best explanation for drug addiction, according to Shapiro, appeals to",one's individual mindset and social setting.,"the pharmacological effects of drug use (e.g., withdrawal).","one's genetic profile, which explains why some people have ""addictive personalities.""",specific psychological disorders such as obsessive-compulsive disorder.,A,False,0.2799764573574066,0.13225150108337402,0.5230648517608643,0.062471188604831696
" Wellman accepts that there are other values besides the freedom of association, such as",egalitarian values concerning the elimination of inequalities that make people vulnerable to oppression.,libertarian values concerning individuals' property rights and freedom of movement.,both A and B,nothing; there are no values besides freedom of association,C,True,0.1066732332110405,0.08307719230651855,0.4780762493610382,0.3285766839981079
 What does Marquis think is the main reason why it is wrong to kill a fetus?,The fetus can feel pain.,Abortion will harm the woman.,Killing the fetus would deprive it of a valuable future.,all of the above,C,False,0.4126262664794922,0.0383802205324173,0.4126262664794922,0.13396014273166656
 Altman believes that there are significant difficulties associated with defending a pro-censorship position based solely on claims of which of the following kinds of harm?,expressive harm,causal harm,physical harm,intentional harm,D,False,0.16374324262142181,0.1445029079914093,0.5043647289276123,0.1855454295873642
" According to Hardin, the ""ratchet effect"" refers to the fact that",overpopulation does not affect the number of people who are poor.,overpopulation leads to creation of food banks that help curb poverty rates.,world hunger and poverty leads to recognition of rights not to be hungry.,the use of a world food bank to feed the hungry leads to an escalating series of emergency situations.,D,False,0.04917056858539581,0.04917056858539581,0.6787787079811096,0.2203671783208847
 Which of the following is the term used to refer to a stage in prenatal development which in humans begins at roughly the second week of pregnancy and lasts until roughly the eighth week?,fertilization,fetal stage,embryonic stage,viability,C,True,0.08221080899238586,0.09315704554319382,0.6883426308631897,0.13554269075393677
 Which of the following potentially morally relevant differences between Fred's behavior and the behavior of the consumers of factory-raised meat does Norcross not discuss?,"Fred's behavior involves the suffering of puppies, whereas the behavior of meat-eaters ""merely"" involves the suffering of chickens, pigs, cows, calves, sheep, and the like.","The suffering of the puppies is necessary for gustatory pleasure, whereas the suffering of animals on factory farms is simply a by-product of the conditions dictated by economic considerations.","Fred could prevent the suffering of the puppies, whereas meat-eaters can't prevent the suffering of the animals they consume.",none of the above,D,False,0.18678371608257294,0.11329004168510437,0.5077307224273682,0.18678371608257294
" According to Singer, international corporations that deal with corrupt dictators are akin to",murderers of those who witness crimes.,prostitutes who knowingly spread disease.,people who knowingly buy stolen goods.,all of the above,C,True,0.10876071453094482,0.040010832250118256,0.7092089056968689,0.13965150713920593
" Since we who live in wealthy countries have directly caused harm, Pogge argues that we have very stringent",libertarian duties towards the global poor,positive duties towards the global poor,negative dutiestowards the global poor,egalitarian duties towards the global poor.,C,True,0.10424751788377762,0.11812791228294373,0.5999031066894531,0.17187511920928955
" Which of the following is not a requirement on the definition of ""legal punishment""?",It must be for an offense against legal rules.,It must involve unpleasant consequences.,It must not necessarily be of an actual or supposed offender.,It must be intentionally administered by human beings other than the offender.,C,True,0.10005912184715271,0.11338184773921967,0.5081421732902527,0.2719888985157013
" According to Mill, the only evidence it is possible to produce that anything is desirable is that",God has deemed it desirable.,experts on desirability have deemed it desirable.,people do actually desire it.,rational insight reveals it to be desirable.,C,True,0.276913583278656,0.13080470263957977,0.3137841820716858,0.276913583278656
 Velleman worries that the word dignity is sometimes used (incorrectly) to glorify which of the following:,a patient's capacity for self-determination,a patient's worthiness of being protected or cared for,"Western culture's obsession with youth, strength, and independence",none of the above,C,True,0.2778332233428955,0.06199296563863754,0.5881729125976562,0.07024724036455154
 Which of the following is an example of a virtue of character?,tallness,honesty,physical beauty,simplicity,B,False,0.1311710625886917,0.1311710625886917,0.5187916159629822,0.2162645012140274
" The most common form of cosmopolitanism is _____ cosmopolitanism, according to which those in a position to do so have an obligation to assist those in need because of poverty and to promote basic human rights.",moral,political,cultural,economic,A,True,0.606619656085968,0.17379945516586304,0.1533774733543396,0.0639372393488884
 What is wrong with a conservation system based wholly on economic motives according to Leopold?,It assumes that the economic parts of the biotic system will function without the uneconomic parts.,It assumes that economic motives are morally relevant.,It implies that nonhuman creatures are necessarily without any moral standing.,none of the above,A,False,0.3401595950126648,0.1104336529970169,0.3854513168334961,0.16068001091480255
 Singer argues that developing nations are harming poor nations by,causing global warming.,"handing out too much foreign aid, which increases need.",ignoring important aspects of their culture.,indoctrinating them with Western values.,A,False,0.17906871438026428,0.10861065983772278,0.551570475101471,0.15802758932113647
" According to Sandel, eugenics and genetic enhancement can be seen to be wrong from a secular perspective because they would produce unwelcome changes in",humility.,responsibility.,solidarity.,all of the above,D,False,0.20976628363132477,0.046805184334516525,0.5032031536102295,0.2376963496208191
" According to some defenders of meat-eating, the suffering of animals counts less than the suffering of humans (if at all) because",animals are rational and humans are not.,humans are rational and animals are not.,"animals lack the capacity for suffering, and humans do not.",animals can tolerate more suffering than humans can.,B,False,0.13336233794689178,0.11769184470176697,0.5274582505226135,0.21987730264663696
 To say that an action is intrinsically permissible (a feature mentioned in the doctrine of double effect) is to say that,"the action, apart from its effects, is morally permissible.","the action, only because of its effects, is morally permissible.",no actual person would ever endorse that action.,the action is valuable because of its relationship to things that are intrinsically valuable.,A,True,0.32936564087867737,0.2565101981163025,0.2565101981163025,0.1555813103914261
 Locke can be thought of as accepting a,natural law conception of morality.,Kantian theory.,version of utilitarianism.,version of virtue ethics.,A,False,0.20228955149650574,0.2292241007089615,0.42824697494506836,0.13903144001960754
 Metz argues that dignity is based in,a capacity for communal or friendly relationships,a capacity for moral thought,a capacity for rational deliberation,a capacity for certain kinds of feelings or sentiments,A,False,0.38207998871803284,0.1592746526002884,0.4329533576965332,0.024425558745861053
" According to Singer, which of the following is the single relevant factor in determining whether something has moral status?",dignity,belonging to a moral community,sentience,none of the above,C,True,0.18884368240833282,0.08920343220233917,0.6591292023658752,0.06130856275558472
 Nathanson proposes a form of retributivism that requires all of the following except,a list of crimes ranked according to their seriousness.,a scale of punishments that correspond to the seriousness of certain crimes.,treating criminals humanely.,the death penalty for the most serious crimes.,D,True,0.13455766439437866,0.17277546226978302,0.3227870464324951,0.36576563119888306
" According to Kant, all imperatives are expressed by the word","""want.""","""ought.""","""will.""","""may.""",B,False,0.3334951102733612,0.17850707471370697,0.3778994679450989,0.10827001184225082
 The goal of cognitive-behavioral therapy is to,build grit.,minimize distorted thinking.,reward good behavior.,achieve stoic wisdom.,A,True,0.3446582555770874,0.26842013001441956,0.3446582555770874,0.04116356000304222
 Thomson's appeal to the vices of callousness and self-centeredness relates to what kind of approach to abortion?,deontological approach,Kantian approach,virtue ethics approach,consequentalist approach,C,True,0.18595728278160095,0.2387738823890686,0.4460883140563965,0.12780645489692688
 Which of the following is evidence that de Marneffe cites in support of the claim that increased availability of a drug leads to increased use of that drug?,Heroin use was much higher among military personnel in Vietnam than it was among veterans who returned to the United States.,The percentage of physicians who use psychoactive drugs is much higher than the general population.,Alcohol abuse declines when the law restricts the times it can be legally sold.,all of the above,A,True,0.5308820605278015,0.0814134031534195,0.22130456566810608,0.15210026502609253
 Carens's main conclusion is that,liberal egalitarianism should almost always press for more openness toward immigrants and refugees.,"liberal egalitarianism, contrary to appearances, entails that only closed border immigration policies are acceptable.",egalitarianism is founded on sentiments of envy and is therefore unjustified.,liberal egalitarian objections to anticosmopolitanism do not succeed.,A,False,0.1618862897157669,0.1428641676902771,0.30244341492652893,0.38834500312805176
" Carens accepts that it is possible for the sudden opening of one country's borders to do more harm than good from a liberal egalitarian perspective. However, he argues that","in practice, feasible policy options will not entail major costs to current citizens.","liberal egalitarianism is false, and so this possibility is irrelevant.",sometimes you have to do more harm than good in the short term to do more good in the long term.,all of the above,A,False,0.2791742980480194,0.062292203307151794,0.35846689343452454,0.2791742980480194
 Callahan is against the legalization of euthanasia because he believes legalization would,be contrary to the Constitution of the United States.,teach society the wrong kind of lesson.,violate our right to self-determination.,none of the above,B,False,0.38793712854385376,0.052501581609249115,0.49812114238739014,0.0594920888543129
 Callahan discusses the Dutch Commission on Euthanasia in 1990 to show that,laws permitting euthanasia can and have been abused.,doctors who perform euthanasia may not report doing so.,both A and B,neither A nor B,C,True,0.06063085049390793,0.04167093336582184,0.4480047821998596,0.4480047821998596
" According to Lukianoff and Haidt, institutionalizing vindictive protectiveness will",encourage students to think pathologically.,ill-prepare them for the workforce.,harm their ability to learn.,all of the above.,C,False,0.16875766217708588,0.054787587374448776,0.3152807950973511,0.4587308466434479
" Baxter claims that his ""very general way"" of stating what we should strive for environmentally assumes that",we have a god-like control over the environment.,we can measure in some way the incremental units of human satisfaction.,nonhuman animals have no value whatsoever.,all of the above,B,False,0.19980017840862274,0.08328910171985626,0.2907075583934784,0.4229769706726074
 Which of the following objections to adopting speech codes does Altman discuss?,Speech codes encourage bigotry.,Speech codes treat hate speakers with less than equal consideration.,Speech codes result in causal harms.,all of the above,D,False,0.3135429918766022,0.05448559671640396,0.3135429918766022,0.3135429918766022
" In Singer's understanding, the principle of the equality of human beings is",a description of an alleged actual equality among humans.,a description of an alleged actual inequality among humans.,a prescription of how we should treat nonhuman animals.,a prescription of how we should treat humans.,D,False,0.26347360014915466,0.1598048210144043,0.434394508600235,0.14102724194526672
 Nathanson believes that killing another person in self-defense is compatible with,respect for the dignity of persons.,the principle of equality.,a consequentialist theory of punishment..,equality retributivism.,A,False,0.1993139088153839,0.1993139088153839,0.42194753885269165,0.1758938878774643
 Sandel believes that the use of genetic enhancement is inherently wrong because,its use would be unsafe.,its use would be unfair.,both of the above,none of the above,D,False,0.16934214532375336,0.07999156415462494,0.6697611808776855,0.07999156415462494
"According to Michael Huemer, the harm of drug use to individual drug users",justifies state prohibition of drug use.,does not justify state prohibition of drug use.,justifies a massive campaign of public health awareness.,does not justify a massive campaign of public health awareness.,B,False,0.1620023101568222,0.12616752088069916,0.49900224804878235,0.2080150842666626
" Which of the following is a basic intrinsic good, according to Aquinas's version of natural law theory?",human life,human procreation,human sociability,all of the above,D,False,0.5694774985313416,0.08733220398426056,0.20949909090995789,0.12706761062145233
" Mary is a person, and as such she plausibly deserves moral consideration because of features inherent to her (e.g., being self-aware). This suggests that she has",direct moral standing.,indirect moral standing.,relative moral standing.,none of the above,A,True,0.5462929010391235,0.1773553341627121,0.20096993446350098,0.0739326998591423
" In his objection to ""the second prong of the libertarian case for open borders,"" Wellman responds to the objection that he is essentially denying that we have a right to freedom of movement. Which of the following is part of his response?",He would say this begs the question because the immigration question is identical to the freedom-of-movement question.,He would present an argument showing that there is actually no right to freedom of movement.,"He would argue that some rights are not absolute (e.g., the right to marriage doesn't allow you to marry an unwilling partner).",He would use deontological premises to deductively conclude that unjust public policies are morally objectionable.,C,True,0.06535183638334274,0.10774695128202438,0.6200409531593323,0.2012978196144104
 Richardson-Self discusses which of the following kinds of speech?,hate speech,misogynistic speech,sexist speech,all of the above,D,False,0.3274044096469879,0.07305379956960678,0.47637060284614563,0.12044534832239151
 Lex talionis is another name for,proportional retributivism.,the death penalty.,an eye for an eye.,the morality of restraint.,C,True,0.23470748960971832,0.23470748960971832,0.3869672119617462,0.14235730469226837
 Huemer argues that there is no reason to think that the harms of drug use are in an important sense,more harmful on average than legally permitted harmful activities.,differing from the harms of other legally permitted harmful activities.,more detrimental to a person's character than otherslegally permitted harmful activities.,All of the above.,D,False,0.25304704904556274,0.09309080988168716,0.32491883635520935,0.32491883635520935
 Which of the following is a value that Arthur believes is more fundamental than rights and desert?,justice,fairness,respect for other persons,all of the above,D,False,0.4350360929965973,0.035709936171770096,0.38391801714897156,0.14123554527759552
 One of the main factors that Hardin links to world hunger and poverty is,reproduction rates.,exploitation of other people.,people having too many rights.,none of the above,A,False,0.2844512164592743,0.15225575864315033,0.4689807593822479,0.09234777837991714
" According to the Humanity formulation of Kant's principle, we must treat persons",never as a means.,never as a mere means.,in ways that produce the most good for everyone concerned.,in ways that serve one's own best interests.,B,False,0.13803569972515106,0.09487046301364899,0.7010031938552856,0.06520345062017441
" Since Nagel thinks there can be genuine moral dilemmas, he denies the moral principle that",can implies should.,can implies ought.,ought implies can.,ought implies should.,C,True,0.16923221945762634,0.19176524877548218,0.5212719440460205,0.11631149053573608
 Which of the following is not an example of vice?,callousness,obesity,selfishness,greediness,B,False,0.0985468253493309,0.06773018091917038,0.441656231880188,0.38976025581359863
" On Metz's view, what kind of punishment is justified for wrongdoers?",Harmful punishment that is proportionate to the harm done by the wrongdoing.,"Unfriendly action that is proportionate to the unfriendly wrongdoing, aimed at correcting the wrongdoing.",Degradation proportionate to the degrading impacts of the wrongdoing.,All of the above.,B,False,0.5412337779998779,0.08300089091062546,0.3282748758792877,0.04442717134952545
" According to the principle of greatest equal liberty proposed by John Rawls, each person is to have an equal right to",the highest level of happiness that is attainable by the least happy person in the society.,the social and economic inequalities that are built into society.,opportunities and resources that belong to that person but nobody else.,the most extensive basic liberty compatible with a similarly liberty for others.,D,False,0.4806664288043976,0.1768273264169693,0.25728222727775574,0.08352729678153992
 Wellman argues that insisting on unlimited property rights commits one to,deontological theory.,egalitarianism.,consequentialism.,anarchy.,D,False,0.18806222081184387,0.10066245496273041,0.6564016342163086,0.053880725055933
 Ross argues that the existing body of moral convictions of the best people is the cumulative product of,the moral reflection of many generations.,generations of bias and self-confirmation.,ignorance.,political discourse.,A,False,0.11434232443571091,0.12956681847572327,0.5124467611312866,0.24206270277500153
 Kant argues that marriage allows spouses to treat each other not as mere means when engaging in sexual activity because,God demands that all sexual activity occur in the context of marriage.,this will ultimately produce the most happiness for the greatest number of persons.,in marriage two persons equally and reciprocally transfer their whole person to the other.,the universal law formulation of the categorical imperative requires that each of us be married.,C,True,0.2857511043548584,0.1349792629480362,0.47112390398979187,0.10512195527553558
" On Pogge's view, affluent citizens are harming the poor by",imposing on them the lasting effects of historical crimes.,keeping them below welfare in the state-of-nature.,both A and B,None of the above,C,True,0.10057024657726288,0.053831372410058975,0.6558003425598145,0.1878899484872818
" According to Aquinas, the first precept of natural law is","""good is to be done, evil to be avoided.""","""one ought to do what one will.""","""one ought to do only what can be done without contradiction.""","""pleasure is to be sought, pain to be avoided.""",A,True,0.49579158425331116,0.14204667508602142,0.30071279406547546,0.05921386182308197
 Shapiro discusses Mediterranean cultures' use of alcohol to show that,even cultures with very low levels of alcohol consumption can have comparatively high levels of alcoholism.,"the consumption of alcoholic beverages (e.g., wine) can have surprising health benefits.",increased use of a drug does not always lead to increased addiction.,all of the above,C,False,0.5648793578147888,0.09816130250692368,0.2078075259923935,0.12604162096977234
 Little argues that the norms governing the moral permission of abortion are,impersonal and categorical.,merely a matter of the mother's preferences.,a complex matter of the mother's personal integrity and her ideals about motherhood and creation.,none of the above.,C,True,0.16149623692035675,0.04626944288611412,0.7237758636474609,0.06732164323329926
" According to Hardin, the fundamental error of ""sharing ethics"" is that",it is anti-Christian.,it would require a stronger system of taxation for the affluent.,"it would lead to a ""tragedy of the commons.""",all of the above,C,False,0.22268247604370117,0.043848779052495956,0.19651661813259125,0.5341874957084656
" The principle Arthur calls ""the greater moral evil rule""says that",people are entitled to keep their earnings only if there is no way for them to prevent a greater evil by giving them away.,"being rich is a great moral evil, and as such we should all strive to live on a moderate income.",two moral evils do not make a moral good.,morality itself is a great evil.,A,False,0.13732658326625824,0.1069500520825386,0.32942935824394226,0.4229956567287445
 Ross claims that the essential defect of utilitarianism is that it ignores,the value of pleasure.,autonomy.,epistemological responsibility.,the personal character of duty.,D,False,0.16708426177501678,0.10134171694517136,0.45418205857276917,0.2754753530025482
" The second premise in Singer's main argument is: ""If it is in your power to prevent something bad from happening, without sacrificing anything nearly as important, it is wrong not to do so."" Which phrase in this premise is deliberately left vague?","""something bad""","""it is wrong""","""nearly as important""","""in your power""",C,True,0.15933959186077118,0.15933959186077118,0.5561498403549194,0.12409380078315735
" According to Lukianoff and Haidt, the recent trend to uncover microaggressions encourages",students to confabulate reasons.,"the pursuit of justice by marking out racism, sexism, and classism.","labeling, by assigning global negative traits to persons.",universities to bear overly burdensome legal obligations.,C,True,0.04558493569493294,0.03550158441066742,0.713068425655365,0.2042975276708603
