0,1,2,3,4,5,correct,choiceA_probs,choiceB_probs,choiceC_probs,choiceD_probs
 Just war theory's principle of military necessity belongs to,jus in bello.,jus ad bellum.,moral nihilism.,all of the above,A,True,0.6163017153739929,0.07360674440860748,0.2000838816165924,0.10709717124700546
" According to Mill, censoring speech that is possibly true",violates human dignity.,fails a prima facie duty of honesty.,is tantamount to asserting that you are infallible.,is a risk worth taking of the speech is dangerous enough.,C,True,0.17246006429195404,0.13431204855442047,0.36509793996810913,0.3221977949142456
 West argues that feminist rhetoric has,"obscures the harms of noncoerced, consensual sex by implying that because what is coerced is bad what is noncoerced is good.",obscures the harms of rape by equating all sex with nonconsensual sex.,"by not acknowledging a distinction between what is good and what noncoerced, has led to the acknowledgement of the harms of consensual sex.",All of the above,A,True,0.6345176100730896,0.04056335240602493,0.08587261289358139,0.23342600464820862
" According to Mill, the value of a particular pleasure depends on",its quantity alone.,its quality alone.,both its quantity and its quality.,neither its quantity nor its quality.,C,True,0.12956608831882477,0.05401118844747543,0.7456014156341553,0.06935173273086548
" According to Carruthers, whenever someone is required to act in a certain way toward an animal for the sake of the animal, what explains that fact are facts about",the animal.,the wider effects on human beings.,both A and B,neither A nor B,B,False,0.08035873621702194,0.04301293566823006,0.59377521276474,0.2804795503616333
" What does SCNT stand for, as used in the discussion on cloning?",skin cell nuclear transfer,stem cell nuclear transmission,somatic cell nuclear transfer,none of the above,C,True,0.24150371551513672,0.11407827585935593,0.5793372988700867,0.06106170266866684
" Velleman worries that, by offering a patient the option of euthanasia,",we allow the patient to harm him- or herself.,we force doctors to harm the patient.,we harm the patient's family.,we harm the patient.,D,False,0.3744999170303345,0.13777083158493042,0.33049502968788147,0.15611478686332703
 Nathanson supports which of the following kinds of retributivism?,preventive,proportional,equality,retaliatory,B,False,0.15826374292373657,0.23027236759662628,0.43020540475845337,0.1793362945318222
 Carruthers approaches questions about the moral standing of nonhuman animals from the perspective of which of the following moral theories?,consequentialism,Kantianism,virtue ethics,contractualism,D,False,0.21415504813194275,0.242669478058815,0.35308200120925903,0.18899117410182953
" In Gardiner's analysis, which of the following is a characteristic of the climate change problem?",institutional adequacy,dispersion of causes and effects,fragmentation of agency,all of the above,D,False,0.15186628699302673,0.07173655182123184,0.6006428003311157,0.17208704352378845
" What is the ""intergenerational storm"" of climate change?",the problem of massive world overpopulation over generations.,the problem that the bad effects of current carbon dioxide emissions will fall largely on future generations.,"the problem that the compounding effects of greenhouse gas emissions require the current generation to, in effect, cooperate with future generations.","the problem that countries are possibly biased toward the interests of the current generation, which largely benefits from carbon dioxide emissions.",D,False,0.12745460867881775,0.0773051381111145,0.6472679972648621,0.14442501962184906
 Hourdequin argues that one flaw of consequentialist calculation is that,it fails to reconcile prima facie duties.,it can run counter to a person's being able to integrate her commitments at various levels.,it can run counter to the idea that persons are atomistic and individually rational actors.,it fails to recognize that possibility that the persons are best understood in relation to one another.,B,False,0.28424856066703796,0.1521472930908203,0.4686466455459595,0.09228198975324631
 Dershowitz discusses the hypothetical case where the hijacked planes of 9/11 must be shot down to argue that important decisions like these,often have to be made quickly and without immediate authorization.,should be made with visibility and accountability by the highest-level officials.,have no objective answer.,none of the above,B,False,0.20871931314468384,0.1434505581855774,0.5006916522979736,0.1434505581855774
 Baxter argues that we should view our treatment of the environment as a matter of various trade-offs whose aim is,to minimize damage incurred by all individual living beings.,to minimize the suffering of all sentient creatures.,to promote the functional integrity of ecosystems.,to promote human welfare.,D,False,0.09083449095487595,0.1321633905172348,0.7605478763580322,0.015784667804837227
 Which of the following is an example of a value-based moral theory?,consequentialism,virtue ethics,both A and B,neither A nor B,C,True,0.0993085652589798,0.06023368611931801,0.4450700879096985,0.39277297258377075
 Kass worries that cloned individuals:,will be seen as curiosities.,will be scrutinized in relation to the person they are clones of.,both of the above,none of the above,C,True,0.18740573525428772,0.06894271820783615,0.654110312461853,0.08852420002222061
" Why, according to Gill, does Leon Kass think the notion of being ""better off dead"" is incoherent?","because dead people no longer exist, and thus cannot benefit from choosing to die.","because some things (e.g., long-term torture) are worse than death.",because there has yet to be a satisfactory philosophical explanation of why death is bad.,"because death is, by definition, undesirable.",A,True,0.5636366009712219,0.1109866201877594,0.16148459911346436,0.16148459911346436
" In response to the argument that embryos are not persons because they lack certain rights that all persons have (such as the right to life), Lee and George argue that",the right to life belongs to a human being at all times that he or she exists.,"the right to life belongs to all living creatures, human or not.","not all persons have the right to life-for example, a murderer has given up his or her right to life through his or her actions",all of the above,A,False,0.32450979948043823,0.0820489227771759,0.1736975759267807,0.4166788160800934
 The consequentialist approach to punishment is at odds with,retributive theories of punishment.,perfectionist theories of punishment.,legal theories of punishment.,preventive theories of punishment.,A,False,0.19961877167224884,0.19961877167224884,0.4225929081439972,0.1761629283428192
" What does Hursthouse say about the claim that any adequate action-guiding (i.e., moral) theory must provide clear guidance about what ought and ought not to be done that any intelligent person could follow?",She says the claim is very plausible.,She says the claim is implausible.,She says the claim is self-evident.,She says the claim is true.,B,False,0.10677076131105423,0.0831531435251236,0.47851336002349854,0.3288770914077759
 Which of the following is not an objection that Kass makes against cloning?,It constitutes unethical experimentation.,It threatens identity and individuality.,It will produce harmful biological mutations as clones produce further clones.,It perverts our values concerning parenthood and the raising of children.,C,True,0.06274137645959854,0.06274137645959854,0.4635995626449585,0.4091251790523529
" In response to the objection that freedom of association is much more important in the marital context than the political realm, Wellman says",there is no freedom of association in the marital context.,his argument does not require that marital and political freedom of association be equally important.,freedom of association is equally important in both contexts.,none of the above,B,False,0.08922035247087479,0.061320189386606216,0.7470328211784363,0.1010999009013176
" If it were known that a policy would wipe out several animal species without negatively affecting human beings, Baxter would most likely say that",this policy is morally problematic because it harms the environment.,this policy is morally problematic because it damages the integrity of the ecosystem.,this policy is morally obligatory because the environment ought not to exist.,this policy is morally unproblematic.,D,False,0.1573919951915741,0.09546306729316711,0.6224973797798157,0.1225769966840744
" According to Reiman, van den Haag's argument leads to the conclusion that",we should refrain from imposing the death penalty.,the refusal to execute criminals has a civilizing effect.,we should institute death by torture.,murder is wrong.,C,True,0.2071419358253479,0.08634959906339645,0.5630700588226318,0.1423664093017578
" According to Singer, the principle of equality requires",identical treatment.,differential treatment.,equal consideration.,differential consideration.,B,False,0.20721563696861267,0.08638032525777817,0.6382691264152527,0.06727306544780731
 Advocates of care ethics argue that,care ethics is an important development of virtue ethics.,that traditional moral theories have difficulty explaining the rightness or wrongness of attitudes.,that the only important more concepts are care and compassion.,that we should think about welfare and happiness in terms of sympathy.,B,False,0.26084446907043457,0.26084446907043457,0.3349309265613556,0.13961999118328094
" According to Norcross, any attempt to justify the claim that humans have a higher moral status than other animals by appealing to some version of rationality as the morally relevant difference between humans and animals will",fail to give an adequate answer to the argument from marginal cases.,fail to make the case that such a difference is morally relevant to the status of animals as moral patients as opposed to their status as moral agents.,both A and B,neither A nor B,C,True,0.1066286638379097,0.09409946948289871,0.5415050983428955,0.2557888925075531
" In response to the argument that the death penalty does not deter murderers, van den Haag claims that",he is still confident that the threat of the death penalty at least sometimes prevents murder.,criminal law is supposed to protect the innocent over murderers.,the severity and finality of the death penalty is appropriate to the seriousness and finality of murder.,all of the above,D,False,0.3906210660934448,0.09876447916030884,0.34472188353538513,0.16283509135246277
" Thomas Nagel call the two kinds of moral considerations he discusses in ""War and Massacre""",consequentialist and dignity-based,forward-looking and backward-looking,utilitarian and absolutist,All of the above,C,True,0.28034478425979614,0.026076124981045723,0.6725121736526489,0.015815969556570053
 What is the main reason why Arthur doesn't think that the poor have a right to aid from the affluent?,Persons can never have a right to aid from anyone.,The right to aid is a negative right.,The consequences of helping the poor would be worse than the consequences of not helping them.,"This kind of right would require a contract or agreement, and the affluent haven't entered into a contract or agreement with the poor.",D,True,0.09184106439352036,0.09184106439352036,0.2828904390335083,0.5285088419914246
 What assumption does Pence think people who object to SCNT make when they say that SCNT is not best for the child?,The parents have good motives.,We can't tell what the motives of the parents are.,The parents have bad motives.,none of the above,A,False,0.13320185244083405,0.055526796728372574,0.6764549016952515,0.13320185244083405
 Van den Haag is,a distributionist.,an abolitionist.,a retentionist.,a humanitarian.,C,True,0.0665789246559143,0.0754438042640686,0.7157909274101257,0.14094758033752441
" Against Kant's view of sexual objectification, Papadaki argues that",it is not clear how sexual use sacrifices humanity.,Kant is wrong to think about the wrong of sexual objectification in terms of humanity.,sexual objectification actually enhances humanity.,Papadaki actually agrees with Kant's view,A,False,0.09248920530080795,0.04950590059161186,0.7744026184082031,0.0816214308142662
 Thomson discusses a different version of the violinist case wherein the violinist only needs to use your kidneys for one hour to survive. Her own view about this case is that,you have no obligation to let the violinist use your kidneys for that hour.,the violinist has an obligation to disconnect him- or herself before that hour is over.,"because you ought to let the violinist use your kidneys for that hour, we should conclude that he or she has a right to use your kidneys for that hour.","even though you ought to let the violinist use your kidneys for that hour, we should not conclude that he or she has a right to use your kidneys for that hour.",D,False,0.17157307267189026,0.10406432300806046,0.4663839340209961,0.24963733553886414
 Fine asks us to consider the example of a yoga group that practices in Central Park and is free to reject prospective members but isn't free to exclude others from making use of Central Park. The point of this example is to show that,Central Park qualifies as a state.,there is a difference between rules of membership and rules about settlement within a physical territory.,territorial rights only belong to individuals.,Wellman is committed to an absurd theory of group membership.,B,False,0.1429198831319809,0.3025614023208618,0.34284698963165283,0.20794720947742462
" The annual death-toll from poverty related causes is, according to Pogge,",around one quarter of all human deaths.,around one third of all human deaths.,around one half of all human deaths.,none of the above.,A,False,0.20431376993656158,0.1803063005208969,0.49012327194213867,0.12392257153987885
 What is the overall percentage of capital cases that are overturned because of serious errors?,under 50 percent,52 percent,68 percent,82 percent,C,True,0.04589952528476715,0.08575159311294556,0.6336233615875244,0.23309703171253204
" According to Nussbaum, treating someone as an object is",sufficient for sexual objectification.,necessary for sexual objectification.,not necessary for sexual objectification.,all of the above.,C,True,0.25264260172843933,0.11933990567922592,0.4719984829425812,0.15323546528816223
" In Corvino's reading of Aquinas, ""unnatural"" sexual acts are those that are",deliberately pro-creative.,non-consensual.,deliberately non-procreative.,uncommonly practiced among adults.,B,False,0.10343415290117264,0.11720623821020126,0.674475371837616,0.10343415290117264
 Rachels compares the cases of Smith and Jones to show that,killing is in itself morally worse than letting die.,letting die in itself is morally worse than killing.,killing is not in itself morally worse than letting die.,none of the above,C,True,0.24586911499500275,0.11614034324884415,0.520504891872406,0.11614034324884415
 Biocentrism is the view that,the only beings that possess direct moral standing are human beings.,all and only sentient creatures have direct moral standing.,"all living beings, because they are living, possess direct moral standing.",the primary bearers of direct moral standing are ecosystems in virtue of their functional integrity.,C,False,0.32524335384368896,0.1740902215242386,0.32524335384368896,0.1740902215242386
 Which of the following is a feature of consequentialist moral theory?,It is a value-based theory.,It involves the idea of alternative actions open to the agent.,It is a strongly impartialist moral theory.,all of the above,D,False,0.5024388432502747,0.11210925877094269,0.23733530938625336,0.14395113289356232
" On West's account, women who engage in undesired sex because of actual or felt dependence on their partner may experience injury to their sense of autonomy because",they have neglected to take whatever steps would lead to their self-sustenance.,they are dominated by their partners insofar as they are not free to do as they please.,they are actually coerced into having sex.,none of the above.,A,False,0.2911313474178314,0.17658008635044098,0.4235936105251312,0.10710123926401138
 Which of the following is not mentioned by Macedo as a duty that societies have toward nonmembers?,"duties of fair dealing (e.g., nonexploitation)","cosmopolitan egalitarian duties (e.g., ensuring that everyone has equal wealth)","duties of rectification and redress (e.g., redressing those who were oppressed)","humanitarian duties (e.g., preventing systematic violations of human rights)",B,False,0.10585750639438629,0.08244191110134125,0.6091679334640503,0.19776786863803864
 Mill thinks that each person desires,to do his or her duty.,to be virtuous.,his or her own happiness.,none of the above,C,True,0.3479363024234772,0.12799862027168274,0.39426350593566895,0.12799862027168274
" According to Valls, a just cause for political violence is usually",defensive.,offensive.,territorial.,economically motivated.,A,False,0.10381374508142471,0.11763639748096466,0.5272097587585449,0.2490362524986267
" Fine asks us to consider an example in which a private club ""regularly arranges noisy late-night gatherings"" to show that",private clubs can rightfully exclude outsiders.,the actions of groups can affect members outside that group.,there is no difference between an individual's and a group's freedom of association.,all of the above,B,False,0.30461153388023376,0.07701785862445831,0.268818736076355,0.3451700806617737
" According to Huemer, even if drug use harms a person's friends, families, and other relations,",this would still not justify drug prohibition.,this would justify drug prohibition.,this would only justify drug prohibition if drug use was extremely likely to cause these harms.,this would only justify drug prohibition if drug use was more likely to cause these kinds of harms than other prohibited activity.,A,False,0.0753231942653656,0.1594592034816742,0.5565673112869263,0.2047496885061264
 The basic idea of social contract theories of morality is that correct or justified moral rules or principles are the ones that result from,a social leader's moral deliberations.,an actual or hypothetical social agreement of some sort.,a contract that has been signed by most of the affected parties.,none of the above,B,False,0.29985976219177246,0.23353102803230286,0.339785635471344,0.12500016391277313
" In Singer's view, the question of when it's wrong to painlessly kill an animal is one",to which we need to give a precise answer.,to which we need give no precise answer.,"that cannot be answered, vaguely or precisely.",that is ethically unimportant.,B,False,0.32099610567092896,0.11808786541223526,0.36373624205589294,0.19469398260116577
 Which of the following is one of de Marneffe's responses to the objection that drug prohibition would be paternalistic?,"Drug prohibition would be done for the benefit of others, not the benefit of those who wish to produce/sell drugs, so it is not paternalistic in an objectionable sense.","Drug prohibition would be paternalistic, but its consequences would be good enough to outweigh considerations about paternalism.","Drug prohibition would be targeted to adults, and one can only be paternalistic toward children.",Paternalism is always justified when the paternalistic practices truly are in the best interest of those affected.,A,False,0.1477721482515335,0.1674477607011795,0.27607470750808716,0.40168631076812744
 Lukianoff and Haidt argue that the disinvitation of certain speakers,is an example of mental filtering.,will only serve to promote intellectual homogeneity on college and universities.,will encourage students to disregard positive aspects of a person's history.,All of the above.,B,False,0.2516143321990967,0.05614275112748146,0.3230791985988617,0.36609670519828796
 Ashford's article is meant to address a particular paralysis in the face of,the sheer scope of global poverty.,having to choose between addressing immediate harm and addressing structural injustice.,reconciling conflict moral theories.,having to give up so much of our own wealth in light of Singer's arguments.,A,False,0.12846152484416962,0.08829022943973541,0.6523814797401428,0.12846152484416962
" In support of her thesis that global social institutions violate the rights of the world's poor, Ashford argues that",illicit cash flow to tax havens from rich countries exceeds aid to the world's poor.,the implementation of neoliberal economic policies have had at mixed and at worse adverse impacts of the economic and social rights of the world's poor.,that wealthy nations press their political and economic advantages to secure unfair trade agreements with poor countries.,all of the above,D,False,0.3691399395465851,0.11984219402074814,0.17436937987804413,0.32576486468315125
 Papadaki argues that,sexual objectification is not always wrong.,sexual objectification involves the total reduction of a person to an object.,sexual objectification is not explainable in Kantian terms.,sexual objectification involves the denial of a person's humanity.,D,False,0.19607995450496674,0.1347636580467224,0.47037139534950256,0.19607995450496674
 The two kinds of anti-homosexuality arguments to which Corvino responds are,naturalness arguments and arguments from fidelity.,harm arguments and arguments from divine command.,unnaturalness arguments and harm arguments.,naturalness arguments and economic arguments.,C,True,0.13234946131706238,0.08027400076389313,0.5931491255760193,0.19256731867790222
 The view that moral considerations do not apply to war is known as,jus ad bellum.,antiwar pacifism.,just war theory.,moral nihilism.,D,False,0.19686052203178406,0.17372877895832062,0.5351223349571228,0.09299030900001526
" In the context of Gardiner's article, ""the fragmentation of agency"" refers to what?",an agent's inability to acknowledge his or her contribution to climate change,the fragmentation of the effects of greenhouse gas emissions across generations,the vast number of individuals and agents who contribute to climate change,the idea that it's not rational for each individual to restrict his or her own pollution,C,True,0.11002244055271149,0.08568555861711502,0.7174364328384399,0.08568555861711502
 Ashford thinks that the right test of whether or not legal and economic structures are minimally just is to see whether or not,they help develop human capabilities.,they minimize the amount of suffering in the world.,"they recognize, enforce, and implement duties not to violate human rights.",they are universalizable.,C,True,0.1801454871892929,0.2041315734386444,0.3813679814338684,0.2313113659620285
 Little argues that we should accept a prerogative on the part of mothers to end a pregnancy until the fetus is a person because,we should accept a prerogative to decline radical changes to one's practical identity.,abortion is absolutely morally wrong.,abortion is presumptively morally wrong but can become permissible in certain extreme cases.,there is no clear answer about the moral status of abortion.,A,False,0.11523459106683731,0.08974479883909225,0.6631293296813965,0.1305779069662094
" Which of the following is, according to the introduction to chapter 8, typically defined as the act or practice of killing or allowing someone to die?",murder,ethical killing,suicide,euthanasia,D,False,0.289817214012146,0.13689997792243958,0.37213265895843506,0.19918827712535858
" In Baxter's view, the first and foremost step toward a solution of our environmental problems is a clear recognition that our objective is not pure air or water but rather",some optimal state of pollution.,an overall maximally clean environment.,some maximal state of pollution.,the preservation of all living species.,A,False,0.1582152545452118,0.17928136885166168,0.5522255301475525,0.10873964428901672
 Ross's moral theory is a version of,consequentialism.,the ethics of prime facie duty.,Kantian theory.,virtue ethics.,B,False,0.1624578982591629,0.14336858689785004,0.5670337677001953,0.12652233242988586
 Which of the following are forms of misogynist speech according to Richardson-Self?,Interdivisional misogynist speech,Intradivisional misogynist speech,Interpersonal misogynist speech,A and B only,D,False,0.23471496999263763,0.11087150871753693,0.3869795799255371,0.26596692204475403
" Leopold most likely describes the ""land pyramid"" to",argue that nature is not inherently normative.,"provide a description of a mechanism that ""we can see, feel, understand, love, or otherwise have faith in.""",give a detailed description of how plants absorb energy from the sun.,"argue that even the noneconomic parts of the ""biotic clock"" have economic value.",B,False,0.05286943167448044,0.08716695010662079,0.7298399209976196,0.1268271505832672
 Ecoholism is the view that,only whole ecosystems (not any of the individuals that make up those ecosystems) have direct moral standing.,ecosystems and some of the individuals that make them up have direct moral standing.,ecosystems do not have direct moral standing but some of the individuals that make them up do.,none of the above,B,False,0.35367119312286377,0.2145124226808548,0.3121137320995331,0.1148202195763588
 The view according to which wars are always (or at least nearly always) morally wrong is known as,just war theory.,antiwar pacifism.,moral nihilism.,jus ad bellum.,B,False,0.33278709650039673,0.2287210077047348,0.2591748535633087,0.17812809348106384
" According to Reiman, van den Haag's arguments in favor of the death penalty",are incompatible with the right to retaliation.,prove that torture is morally impermissible.,should be accepted.,follow common sense.,D,False,0.12277363985776901,0.12277363985776901,0.5502332448959351,0.20241951942443848
