0,1,2,3,4,5,correct,choiceA_probs,choiceB_probs,choiceC_probs,choiceD_probs
"The molecular geometry of thionyl chloride, SOCl2, is best described as",trigonal planar,T-shaped,tetrahedral,trigonal pyramidal,D,False,0.32275763154029846,0.19576239585876465,0.4144289791584015,0.056086864322423935
"Which of the following procedures tend(s) to minimize the influence of random errors on measured results?
I. Signal averaging
II. Use of internal standards
III. Averaging the results from multiple samples",I only,II only,III only,I and III only,D,False,0.2722250819206238,0.060741622000932693,0.14571160078048706,0.18709738552570343
A PO3- radical produces a pair of lines separated by 280 MHz with giso = 2.005. Calculate the expected resonant field positions of both lines in the X-band EPR spectrum (ν = 9.5 GHz).,Bres for mI = -½ = 325.0 mT; Bres for mI = +½ = 335.0 mT,Bres for mI = -½ = 123.5 mT; Bres for mI = +½ = 124.5 mT.,Bres for mI = -½ = 333.5 mT; Bres for mI = +½ = 343.5 mT.,Bres for mI = -½ = 0.218 mT; Bres for mI = +½ = 0.418 mT.,D,False,0.08731744438409805,0.17365147173404694,0.41656824946403503,0.2863028943538666
"Calculate the relative occupancies of the α and β spin energy levels for a radical species with g = 2.05, at L- and W-band frequencies (take TS = 300 K).",Nα/Nβ = 0.9800 at L-band; Nα/Nβ = 0.9509 at W-band,Nα/Nβ = 0.9950 at L-band; Nα/Nβ = 0.9609 at W-band,Nα/Nβ = 0.9910 at L-band; Nα/Nβ = 0.9709 at W-band,Nα/Nβ = 0.9850 at L-band; Nα/Nβ = 0.9809 at W-band,D,False,0.24532613158226013,0.3569473922252655,0.19106018543243408,0.19106018543243408
Which of the following is a primary standard for use in standardizing bases?,Ammonium hydroxide,Sulfuric acid,Acetic acid,Potassium hydrogen phthalate,D,False,0.14101937413215637,0.23250165581703186,0.4343702495098114,0.18107245862483978
Which of the following is lower for argon than for neon?,Melting point,Boiling point,Polarizability,First ionization energy,D,False,0.3192733824253082,0.1330929696559906,0.3617841601371765,0.17089474201202393
"The 99Ru chemical shift of [Ru(H2O)6]2+ is 16,050 ppm relative to [Ru(CN)6]2- at 0 ppm. The electronic excitation energies of [Ru(H2O)6]2+, [Ru(CN)6]2- and [Ru(NH3)6]2+ are 18,900, 40,000 and 25,600 cm-1 respectively. Assuming that the chemical shift differences are dominated by paramagnetic currents, determine the chemical shift of [Ru(NH3)6]2+.","7,530 ppm","8,090 ppm","11,070 ppm","14,840 ppm",B,False,0.13271917402744293,0.31837671995162964,0.3607681095600128,0.1704147905111313
"During a delay, spins with an offset frequency Ω = 250 rad s-1 precess through an angle of 60°. How long is the delay?",4.19 ms,26.3 ms,240 ms,1510 ms,A,False,0.1656898856163025,0.3974693715572357,0.309549480676651,0.11387688666582108
Which of the following is always true of a spontaneous process?,The process is exothermic.,The process does not involve any work.,The entropy of the system increases.,The total entropy of the system plus surroundings increases.,D,False,0.22985342144966125,0.15797579288482666,0.33443474769592285,0.2604580521583557
Nitronyl nitroxides are stable radicals in which the unpaired electron is coupled to two equivalent nitrogen nuclei. How many lines will appear in the EPR spectrum of a solution of a rigid nitronyl nitroxide diradical with J >> a?,3 lines,9 lines,5 lines,7 lines,D,False,0.29856076836586,0.29856076836586,0.26347893476486206,0.12445864081382751
Redox enzyme catalysis involves the cyclic oxidation and reduction of metal ions that have at least two stable positive oxidation states. Which of the following groups of metals could be found at the active site of redox enzymes?,"Cu, Fe, Co","Zn, Ca, Ga","Sr, Ga, Mg","Na, Ba, Al",A,False,0.2551998198032379,0.37131354212760925,0.2891792953014374,0.06452461332082748
"In the vibrational-rotational spectrum of a diatomic molecule, the R-branch of the spectrum is the result of which of the following transitions?",ΔJ = 0; Δu = 0,ΔJ = 1; Δu = 0,ΔJ = 2; Δu = 0,ΔJ = 1; Δu = 1,D,False,0.28938865661621094,0.28938865661621094,0.28938865661621094,0.12063513696193695
"Of the following atoms, which has the lowest electron affinity?",F,Si,O,Ca,D,False,0.08806149661540985,0.09978675842285156,0.44721320271492004,0.34828999638557434
"Of the following ions, which has the smallest radius?",K+,Ca2+,Sc3+,Rb+,C,True,0.11677692830562592,0.09094596654176712,0.5930421948432922,0.19253261387348175
What is the NMR frequency of 31P in a 20.0 T magnetic field?,54.91 MHz,239.2 MHz,345.0 MHz,2167 MHz,C,True,0.14016631245613098,0.23109515011310577,0.3810114860534668,0.23109515011310577
Predict the number of lines in the EPR spectrum of a solution of dimethylnitroxide (CH3)2NO• assuming the lines do not overlap.,21,3,7,24,B,False,0.35651227831840515,0.2450270801782608,0.21623563766479492,0.1684044897556305
"Of the following compounds, which is LEAST likely to behave as a Lewis acid?",BeCl2,MgCl2,ZnCl2,SCl2,D,False,0.17638801038265228,0.15566186606884003,0.32953616976737976,0.32953616976737976
