0,1,2,3,4,5,correct,choiceA_probs,choiceB_probs,choiceC_probs,choiceD_probs
"The rate, r, of a zero-order chemical reaction A → B can be expressed as which of the following?",r = k ln[A],r = k [A]^2,r = k [A],r = k,D,False,0.2136618047952652,0.18855588138103485,0.3991727828979492,0.18855588138103485
Infrared (IR) spectroscopy is useful for determining certain aspects of the structure of organic molecules because,all molecular bonds absorb IR radiation,IR peak intensities are related to molecular mass,most organic functional groups absorb in a characteristic region of the IR spectrum,each element absorbs at a characteristic wavelength,C,True,0.18248386681079865,0.18248386681079865,0.49604251980781555,0.12541919946670532
What is the maximum number of phases that can be at equilibrium with each other in a three component mixture?,2,3,4,5,D,False,0.158101886510849,0.29537320137023926,0.33470168709754944,0.2030068337917328
"When the following equation is balanced, which of the following is true?
__ MnO4− + __ I− + __ H+ <-> __ Mn2+ + __ IO3− + __ H2O",The I− : IO3− ratio is 3:1.,The MnO4- : I- ratio is 6:5.,The MnO4- : Mn2+ ratio is 3:1.,The H+ : I− ratio is 2:1.,B,False,0.2739364504814148,0.1882735937833786,0.31041067838668823,0.21334192156791687
The equation ΔH = ΔU + PΔV is applicable,always,only for constant pressure processes,only for constant temperature processes,only for constant volume processes,B,False,0.18978556990623474,0.14780515432357788,0.4017760455608368,0.24368949234485626
Nitronyl nitroxides are stable radicals in which the unpaired electron is coupled to two equivalent nitrogen nuclei. How many lines will appear in the EPR spectrum of a solution of a rigid nitronyl nitroxide diradical with J << a?,3 lines,9 lines,5 lines,7 lines,B,True,0.28267356753349304,0.32031112909317017,0.24945855140686035,0.1335255354642868
Cobalt-60 is used in the radiation therapy of cancer and can be produced by bombardment of cobalt-59 with which of the following?,Neutrons,Alpha particles,Beta particles,X-rays,A,True,0.3273591995239258,0.25494760274887085,0.22499048709869385,0.17522276937961578
Which of the following is required for both paramagnetism and ferromagnetism?,Strong oxidizing conditions,Low-spin electron configuration,Metallic physical properties,Unpaired electrons,D,False,0.21161529421806335,0.21161529421806335,0.395349383354187,0.16480614244937897
"The 1H spectrum of a mixture of dimethylsulphoxide (DMSO) and acetonitrile (AN) contains lines with relative intensities α and 3α, respectively. What is the ratio of the two concentrations, [DMSO]:[AN]?",1:1,1:3,1:6,2:3,C,True,0.2136874496936798,0.274380087852478,0.3109133839607239,0.1885785013437271
Which of the following statements most accurately explains why the T1 of a nucleus is sometimes longer than its T2?,"T1, unlike T2, is sensitive to very low-frequency molecular motions.","T2, unlike T1, is sensitive to very low-frequency molecular motions.","T1, unlike T2, is sensitive to molecular motions at the Larmor frequency.","T2, unlike T1, is sensitive to molecular motions at the Larmor frequency.",D,False,0.20854850113391876,0.12649105489253998,0.5002818703651428,0.14333315193653107
The 1H Larmor frequency of benzene exceeds that of trifluoroacetic acid by 1.656 kHz on a 400 MHz spectrometer. The 1H chemical shift of benzene is 7.16 ppm. What is the chemical shift of trifluoroacetic acid?,3.02 ppm,5.03 ppm,10.56 ppm,11.30 ppm,D,False,0.29982027411460876,0.20606325566768646,0.3397408723831177,0.1416250616312027
"Suppose that the 13C nuclei in a molecule in a 600 MHz spectrometer can be 100% polarized (p = 1). If T1 = 5.0 s, how long does it take for p to reach a value equal to twice the thermal equilibrium polarization at 298 K?",[The polarization relaxes exponentially: p(t) = [p(0) - peq]exp(-t/T1) + peq.],72.0 s,56.6 s,12.7 s,B,False,0.34688499569892883,0.2384103387594223,0.3061249256134033,0.08770626038312912
Estimate the β-hyperfine value for the cyclobutyl radical (C4H7•) assuming the radical is flat and the HCH angle is 115°.,4.6 mT,27 G,5.4 mT,3.8 mT,A,False,0.1619497835636139,0.30256202816963196,0.34284767508506775,0.18351314961910248
What is the ratio of line intensities in the EPR spectrum of the t-Bu radical (CH3)3C•?,1:19:36:84:126:126:84:36:19:1,1:9:36:84:126:126:84:36:9:1,1:9:35:82:120:120:82:35:9:1,1:8:28:56:70:56:28:8:1,D,False,0.274864137172699,0.311461865901947,0.24256674945354462,0.14712417125701904
Which one sentence explains most accurately why spin trapping is often used to detect free radical intermediates?,spin trapping provides more structural information than direct detection by EPR,spin trapping makes it easy to quantify free radical intermediates,steady state concentration of free radical intermediates is often too low to enable direct detection by EPR,detection of spin adducts requires lower power than direct detection of radical intermediates,D,False,0.27852779626846313,0.4592146873474121,0.1490851789712906,0.074964739382267
Calculate the magnetic moment (μI) of a 13C nucleus.,6.1445 x 10^-27 J T-1,3.1445 x 10^-27 J T-1,9.1445 x 10^-27 J T-1,1.1445 x 10^-28 J T-1,C,False,0.2306862473487854,0.33564648032188416,0.2614017426967621,0.15854817628860474
"The normal modes of a carbon dioxide molecule that are infrared-active include which of the following?
I. Bending
II. Symmetric stretching
III. Asymmetric stretching",I only,II only,III only,I and III only,D,False,0.3131565451622009,0.1305430680513382,0.2438865602016449,0.2438865602016449
Which of the following is a true statement about optical isomerism of complexes containing achiral ligands?,Square planar complexes can display optical isomerism only if all four ligands are identical.,Tetrahedral complexes never display optical isomerism.,Linear complexes can display optical isomerism when both ligands are different.,Octahedral complexes of monodentate ligands can display optical isomerism only when they have at least three different ligands.,D,False,0.20746058225631714,0.20746058225631714,0.43919405341148376,0.12583120167255402
Which one of the following statements is true:,Protons and neutrons have orbital and spin angular momentum.,"Protons have orbital and spin angular momentum, neutrons have spin angular momentum.",Protons and neutrons possess orbital angular momentum only.,Protons and neutrons possess spin angular momentum only.,C,False,0.47790777683258057,0.2558056116104126,0.1758124679327011,0.07328953593969345
Calculate the Larmor frequency for a proton in a magnetic field of 1 T.,23.56 GHz,42.58 MHz,74.34 kHz,13.93 MHz,B,False,0.23921680450439453,0.18630222976207733,0.3480583727359772,0.21110808849334717
Which of the following is an n-type semiconductor?,Silicon,Diamond,Silicon carbide,Arsenic-doped silicon,D,False,0.1465204805135727,0.1465204805135727,0.5794997215270996,0.11411025375127792
Which of the following statements most accurately explains why the 1H spectrum of 12CHCl3 is a singlet?,Both 35Cl and 37Cl have I = 0.,The hydrogen atom undergoes rapid intermolecular exchange.,The molecule is not rigid.,Both 35Cl and 37Cl have electric quadrupole moments.,D,False,0.17245474457740784,0.36508670449256897,0.3221878707408905,0.11852629482746124
"At 25°C, the maximum amount of PbI2 that can be dissolved in 1.00 L of pure water is 1.0 mmol. Assuming complete dissociation, the solubility product, K_sp, for lead iodide at 25°C is",1.0 × 10^−3,1.0 × 10^−6,1.0 × 10^−9,4.0 × 10^−9,D,False,0.24908079206943512,0.24908079206943512,0.31982606649398804,0.1711905598640442
The 13C spectrum of which isomer of C6H14 has lines with five distinct chemical shifts?,hexane,2-methylpentane,3-methylpentane,"2,3-dimethylbutane",B,True,0.24953457713127136,0.28275972604751587,0.28275972604751587,0.17150244116783142
Which of the following is the most common naturally-occurring form in which silicon is found?,Metallic element,Sulfide,Fluoride,Oxide,D,False,0.09320221096277237,0.13560843467712402,0.5363417267799377,0.2235804945230484
Which nuclide has an NMR frequency of 115.5 MHz in a 20.0 T magnetic field?,17O,19F,29Si,31P,A,False,0.1491982638835907,0.2170821875333786,0.4055629074573517,0.2170821875333786
"Which of the following must be true about a binary liquid mixture that obeys Raoult’s law?
I. The partial pressure of each component at equilibrium is proportional to its mole fraction in the liquid mixture.
II. The volume of the mixture is equal to the sum of the volumes of each component before mixing.
III. Intermolecular interactions in the mixture are identical to intermolecular interactions in the pure components.",I only,III only,I and III only,"I, II, and III",D,False,0.15605410933494568,0.08352974057197571,0.2915474474430084,0.2915474474430084
A single line is seen in the 31P spectrum of a solution of sodium phosphate. The 31P chemical shifts of H2PO4‾ and HPO42– are 3.42 ppm and 5.82 ppm respectively. What is the chemical shift when the pH of the solution equals the pKa of H2PO4‾?,3.41 ppm,3.98 ppm,4.33 ppm,4.62 ppm,D,False,0.3312348425388336,0.25796595215797424,0.29231372475624084,0.1075362116098404
"For EDTA titrations, the analyte solution and the titrant solution are both buffered at the same pH for which of the following reasons?
I. The conditional formation constant is affected by pH.
II. The fraction of EDTA in the fully deprotonated Y4− form varies with pH.
III. When EDTA reacts to form a metal complex, H+ is a product in most cases.",I only,I and II only,I and III only,"I, II, and III",D,True,0.24347607791423798,0.06975706666707993,0.21486689150333405,0.27589455246925354
The Henry’s law constant for CO2 dissolved in water at 25°C is 30.0 atm M^−1. The concentration of dissolved CO2 in a vessel pressurized with 2.0 atm of CO2 is,1.5 M,0.15 M,0.067 M,0.015 M,C,False,0.2110653817653656,0.3070983290672302,0.3070983290672302,0.16437789797782898
"A student performs five titrations and obtains a mean result of 0.110 M, with a standard deviation of 0.001 M. If the actual concentration of the titrated solution is 0.100 M, which of the following is true about the titration results?",Accurate but not precise,Precise but not accurate,Both accurate and precise,Neither accurate nor precise,B,False,0.2054966688156128,0.1813502013683319,0.4929609000682831,0.10999444872140884
A Cu(II) metal ion (giso = 2.12) produces four lines with a separation of 500 MHz between each line. Express the hyperfine splitting in field units of mT and the hyperfine coupling in units of wavenumbers.,500 MHz = 0.185 mT = 0.29842 cm-1,500 MHz = 16.850 mT = 0.01667 cm-1,500 MHz = 32.953 mT = 0.76298 cm-1,500 MHz = 45.672 mT = 2.86329 cm-1,C,False,0.27050796151161194,0.30652567744255066,0.23872244358062744,0.16407138109207153
"On the basis of oxidation-reduction potential, which of the following is most likely to occur?",Al(s) + 3 NaNO3(aq) 3 Na(s) + Al(NO3)3(aq),Zn(s) + 2 Ag(NO3)(aq) → 2 Ag(s) + Zn(NO3)2(aq),Pb(s) + Ca(NO3)2(aq) → Ca(s) + Pb(NO3)2(aq),Pb(s) + 2 LiNO3(aq) → 2 Li(s) + Pb(NO3)2(aq),B,True,0.2815282940864563,0.3190133571624756,0.2815282940864563,0.10356847196817398
Which of the following statements is not a reason why tetramethylsilane is used as a 1H chemical shift reference.,Its 1H spectrum is a singlet.,Its protons are quite strongly shielded.,It dissolves in most organic solvents.,Most organic compounds do not contain silicon atoms.,D,False,0.0915796160697937,0.1938740611076355,0.4104313552379608,0.2820850908756256
"The X-band (9.5 GHz) EPR spectrum of a matrix isolated Na atom reveals four hyperfine lines with resonant field positions of 3074 G, 3174 G, 3274 G and 3374 G. Calculate the g value of the atom.",g = 2.002,g = 1.950,g = 2.250,g = 2.005,A,True,0.3351440727710724,0.23034094274044037,0.26101046800613403,0.15831086039543152
Calculate the spin angular momentum of 43Ca. [I = 7⁄2],2.166 x 10^-34 J s,3.691 x 10^-34 J s,4.185 x 10^-34 J s,5.493 x 10^-34 J s,C,False,0.34251487255096436,0.18333500623703003,0.26675087213516235,0.18333500623703003
Calculate the magnetic field responsible for the polarization of 2.5 x 10^-6 for 13C at 298 K.,0.5 T,1.2 T,2.9 T,100 T,C,True,0.17972572147846222,0.2036559134721756,0.3357718288898468,0.2614993751049042
"The T2 of an NMR line is 15 ms. Ignoring other sources of linebroadening, calculate its linewidth.",0.0471 Hz,21.2 Hz,42.4 Hz,66.7 Hz,B,False,0.1807057410478592,0.26292529702186584,0.33760276436805725,0.2047664225101471
What is the maximum value of the z-component of the spin angular momentum of 43Ca? [I = 7⁄2],3.691 x 10^-34 J s,4.185 x 10^-34 J s,5.493 x 10^-34 J s,8.370 x 10^-34 J s,A,False,0.20766118168830872,0.2666422426700592,0.30214524269104004,0.20766118168830872
"Of the following compounds, which has the lowest melting point?",HCl,AgCl,CaCl2,CCl4,A,False,0.10925893485546112,0.10925893485546112,0.33654120564460754,0.4321274757385254
Which of the following statements about nuclear binding energies is NOT true?,Binding energy per nucleon reaches a maximum for 56Fe.,Nuclear binding energies have about the same magnitude as chemical bond energies.,Nuclei have slightly less mass than the sum of their component nucleons.,The nuclei of heavy elements have more neutrons than protons in order to provide sufficient binding energy to hold the nuclei together.,B,False,0.09315735846757889,0.19721414148807526,0.3684445023536682,0.32515111565589905
Predict the hyperfine value for the EPR spectrum of fully deuteriated benzene radical anion C6D6•-.,0.375 mT,3.75 G,2.35 mT,0.58 G,D,False,0.19474856555461884,0.3210861086845398,0.3210861086845398,0.15167033672332764
The strongest base in liquid ammonia is,NH3,NH2−,NH4+,N2H4,B,False,0.25771331787109375,0.17712360620498657,0.3749706447124481,0.17712360620498657
The equilibrium populations of the 1H energy levels of a molecule are nα = nαeq and nβ = nβeq. What are the populations after a 5.0 μs pulse when B1 = 4.697 mT?,nα = nβeq and nβ = nαeq,nα = nαeq and nβ = nβeq,nα = ½(nαeq + nβeq) and nβ = ½(nαeq + nβeq),nα = nαeq + nβeq and nβ = nαeq + nβeq,A,False,0.20909780263900757,0.16284553706645966,0.268486887216568,0.3447439968585968
Calculate the Q-factor for an X-band EPR cavity with a resonator bandwidth of 1.58 MHz.,Q = 1012,Q = 2012,Q = 3012,Q = 6012,D,False,0.2277691662311554,0.2277691662311554,0.33140215277671814,0.20100557804107666
The 13C chemical shifts of benzene and chloroform are 128.4 ppm and 77.2 ppm respectively. What is the difference in the 13C NMR frequencies of the two compounds on a 600 MHz spectrometer?,7.73 kHz,30.7 kHz,91.6 kHz,122 kHz,A,False,0.18718598783016205,0.2403515726327896,0.396272748708725,0.16519105434417725
"Of the following solutions, which will have the highest ionic strength? (Assume complete dissociation.)",0.050 M AlCl3,0.100 M NaCl,0.050 M CaCl2,0.100 M HCl,A,False,0.10585224628448486,0.22408920526504517,0.3694606423377991,0.2877362370491028
What is the strength (B1) of a 13C 90° pulse of duration 1 μs?,3.72 mT,5.18 mT,17.0 mT,23.3 mT,B,False,0.19744431972503662,0.22373370826244354,0.36887452006340027,0.19744431972503662
Which of the following experimental observations were explained by Planck’s quantum theory?,Blackbody radiation curves,Emission spectra of diatomic molecules,Electron diffraction patterns,Temperature dependence of reaction rates,A,False,0.1646091192960739,0.18652655184268951,0.44745394587516785,0.18652655184268951
"A radioactive isotope, which is used in diagnostic imaging, has a half-life of 6.0 hours. If a quantity of this isotope has an activity of 150 mCi when it is delivered to a hospital, how much activity will remain 24 hours after delivery? (mCi = microcuries)",150 mCi,38 mCi,19 mCi,9.4 mCi,D,False,0.2726908326148987,0.2406488060951233,0.3089991807937622,0.1653953492641449
"What is the orbital angular momentum quantum number, l, of the electron that is most easily removed when ground-state aluminum is ionized?",3,2,1,0,C,False,0.3545677363872528,0.16748593747615814,0.2761376202106476,0.18978643417358398
"Considering 0.1 M aqueous solutions of each of the following, which solution has the lowest pH?",Na2CO3,Na3PO4,Na2S,NaCl,D,False,0.1322982758283615,0.1322982758283615,0.40750738978385925,0.3173670768737793
"A silyl radical bearing an Si-H· fragment has a g value of 2.0033 and a pair of lines separated by 15.5 MHz. Express the splitting in units of mT, Gauss and cm-1.",15.5 MHz = 11.104 mT = 27.201 Gauss = 0.862 x 10^-4 cm-1,15.5 MHz = 7.352 mT = 10.104 Gauss = 18.39 x 10^-4 cm-1,15.5 MHz = 1.55 mT = 0.562 Gauss = 31.0 x 10^-4 cm-1,15.5 MHz = 0.553 mT = 5.530 Gauss = 5.17 x 10^-4 cm-1,B,True,0.21452224254608154,0.3536873757839203,0.24308554828166962,0.16707009077072144
Elements with partially filled 4f or 5f orbitals include all of the following EXCEPT,Cu,Gd,Eu,Am,A,False,0.10057677328586578,0.18790215253829956,0.4507538378238678,0.24127115309238434
Calculate spin density on the central carbon atom of malonic acid radical (•CH(COOH)2) if the hyperfine value for the α-hydrogen atom is 21.9 G.,0.95,0.85,0.15,0.65,C,False,0.3201467990875244,0.3201467990875244,0.19417884945869446,0.15122663974761963
"In fluorescence spectroscopy, the quantum yield (Φ_f) is best defined as the",rate of fluorescence emission,number of photons emitted,"number of photons emitted, divided by the number of photons absorbed","number of excitation photons impinging on the sample, divided by the number of photons absorbed",C,True,0.16272349655628204,0.2682856619358063,0.3444856107234955,0.20894110202789307
Which one of the following statements is true:,Large and positive g shifts are observed when the LUMO – HOMO gap is small and λ is positive.,Large deviations in g occurs when the energy difference between the SOMO and lowest lying excited state is large.,A large deviation of g from ge is expected when λ is large and the energy difference between the SOMO and the lowest lying excited state is small.,A small deviation of g from ge is expected when λ is small and positive.,C,False,0.30764055252075195,0.21143805980682373,0.30764055252075195,0.1453191190958023
What is the magnetic moment of 205Tl?,"[ɣ (205TI = 1.569 x 108 T-1 s-1, I = ½]",0.717 x 10^-26 J T-1,0.827 x 10^-26 J T-1,1.433 x 10^-26 J T-1,C,False,0.30218324065208435,0.26667577028274536,0.30218324065208435,0.11116701364517212
A molecule has a rotational correlation time of 1 ns. At what magnetic field would protons in this molecule have the fastest spin-lattice relaxation? [Use eqns 5.3 and 5.4.],3.74 T,5.19 T,6.08 T,9.49 T,A,False,0.23190978169441223,0.23190978169441223,0.33742672204971313,0.1806115210056305
"Of the following ionic substances, which has the greatest lattice enthalpy?",MgO,MgS,NaF,NaCl,A,False,0.11170287430286407,0.14342933893203735,0.38988134264945984,0.34406906366348267
Which of the following compounds has a 1H resonance approximately 1.55 kHz away from TMS on a spectrometer with a 12.0 T magnet?,CH3F,CH3Cl,CH3Br,CH3I,B,False,0.22058412432670593,0.19466479122638702,0.3209480047225952,0.24995455145835876
Calculate the equilibrium polarization of 13C nuclei in a 20.0 T magnetic field at 300 K.,10.8 x 10^-5,4.11 x 10^-5,3.43 x 10^-5,1.71 x 10^-5,D,False,0.30248957872390747,0.30248957872390747,0.23557911813259125,0.1428859531879425
"The magnetic moment (μI) of an unknown nuclide is 2.884 x 10^-27 J T-1. Given the nuclear spin is known to be 1, identify the unknown nuclide.",14N,2H,19F,6Li,B,False,0.22739429771900177,0.12171538919210434,0.4813937246799469,0.15628565847873688
"Which of the following is (are) characteristic of mass spectrometry?
I. Analyte molecules are converted to gaseous ions.
II. The ions are separated according to their mass-to-charge ratio.
III. In addition to compound identification, mass spectra can be utilized to determine precise isotopic masses and isotopic ratios.",II only,I and II only,I and III only,"I, II, and III",D,False,0.19722355902194977,0.08221501111984253,0.36846211552619934,0.28695857524871826
Which of the following types of spectroscopy is a light-scattering technique?,Nuclear magnetic resonance,Infrared,Raman,Ultraviolet-visible,C,True,0.22721166908740997,0.1378108412027359,0.48100709915161133,0.1378108412027359
"When the Heisenberg uncertainty principle is applied to a quantum mechanical particle in the lowest energy level of a one-dimensional box, which of the following is true?","Momentum is known exactly, but no information about position can be known.","Position is known exactly, but no information about momentum can be known.",No information about either position or momentum can be known.,Neither position nor momentum can be known exactly.,D,False,0.15085764229297638,0.11748804152011871,0.5265448689460754,0.19370505213737488
"The dissociation energy for a hydrogen-bromine bond is defined as the change in enthalpy, DH, for which of the following reactions?",2 HBr(g) → H2(g) + Br2(l),HBr(g) → H+(g) + Br−(g),H(g) + Br(g) → HBr(g),HBr(g) → H(g) + Br(g),D,False,0.32898619771003723,0.32898619771003723,0.2562147080898285,0.07340674847364426
23Na has an NMR frequency of 198.52 MHz in a 750 MHz NMR spectrometer. What is its magnetogyric ratio?,101.1 x 10^7 T-1 s-1,26.75 x 10^7 T-1 s-1,7.081 x 10^7 T-1 s-1,0.9377 x 10^7 T-1 s-1,C,False,0.2490191012620926,0.31974685192108154,0.28217560052871704,0.13329032063484192
Exact solutions of the Schrödinger equation CANNOT be obtained for a,simple harmonic oscillator,particle in a one-dimensional box,rigid rotor,helium atom,D,False,0.21228499710559845,0.1873408555984497,0.3966005742549896,0.1873408555984497
What is the limiting high-temperature molar heat capacity at constant volume (C_V) of a gas-phase diatomic molecule?,1.5R,2R,2.5R,3.5R,D,False,0.2749510407447815,0.2749510407447815,0.2749510407447815,0.1667662262916565
The +1 oxidation state is more stable than the +3 oxidation state for which group 13 element?,B,Al,In,Tl,D,False,0.10898090898990631,0.1234915480017662,0.4884185492992401,0.26143160462379456
The fact that the infrared absorption frequency of deuterium chloride (DCl) is shifted from that of hydrogen chloride (HCl) is due to the differences in their,electron distribution,dipole moment,force constant,reduced mass,D,False,0.39107996225357056,0.12696507573127747,0.34512683749198914,0.11204628646373749
The number of allowed energy levels for the 55Mn nuclide are:,3,5,8,4,A,False,0.24992594122886658,0.24992594122886658,0.3209112584590912,0.17177142202854156
A substance that is NOT generally considered to be a toxic pollutant in water is,carbonic acid,a halogenated hydrocarbon,lead,mercury,A,False,0.09861637651920319,0.20877088606357574,0.4419679343700409,0.2365684062242508
"All proteins absorb electromagnetic radiation of wavelength around 190 nm, which corresponds to a π → π* excitation in the protein molecule. In which region of the spectrum is this wavelength found?",X-ray,Ultraviolet,Visible,Infrared,B,False,0.3256933391094208,0.09331269562244415,0.47388097643852234,0.09331269562244415
"The rotational correlation time of a spherical object of radius r immersed in a liquid with viscosity η is given by the Stokes equation: τc = 4πηr3/3kBT. A small molecule with relative molecular mass Mr = 100 in water at 298 K has τc = 50 ps. Assuming that Mr is proportional to the molecular volume, estimate τc for a small protein with Mr = 8400.",420 ns,42 ns,4.2 ns,420 ps,C,False,0.15560510754585266,0.3294160068035126,0.3294160068035126,0.17632368206977844
Chlorofluorocarbons (CFCs) such as F3CCCl3 are implicated in the decomposition of stratospheric ozone. Which of the following methods would be best suited to measurement of trace amounts (sub-ppb) of CFCs in an air sample?,Gas chromatographic separation of the air sample on a capillary column followed by electron capture detection,Gas chromatographic separation of the air sample on a packed column followed by thermal conductivity detection,Gas chromatographic separation of the air sample on a capillary column followed by flame ionization detection,"Conversion of the sample of the chlorinated compounds to chloride ions, followed by titration with Ag+",A,False,0.26737818121910095,0.3890329599380493,0.23596042394638062,0.07660512626171112
The solid-state structures of the principal allotropes of elemental boron are made up of which of the following structural units?,B12 icosahedra,B8 cubes,B6 octahedra,B4 tetrahedra,A,False,0.365543931722641,0.15238140523433685,0.4142155647277832,0.05605797842144966
A buffer is made from equal concentrations of a weak acid and its conjugate base. Doubling the volume of the buffer solution by adding water has what effect on its pH?,It has little effect.,It significantly increases the pH.,It significantly decreases the pH.,It changes the pH asymptotically to the pKa of the acid.,A,False,0.12137231975793839,0.2569452226161957,0.37385308742523193,0.2267533540725708
Which of the following is classified as a conjugate acid-base pair?,HCl / NaOH,H3O+ / H2O,O2 / H2O,H+ / Cl−,B,False,0.1446177363395691,0.18569284677505493,0.4454540014266968,0.21041758358478546
Which of the following metal ions cannot be used as a paramagnetic quencher?,Ti3+,Cr3+,Fe3+,Zn2+,B,False,0.1897316724061966,0.24362027645111084,0.3128146231174469,0.24362027645111084
An electron and a proton are placed in a 1.0 T magnetic field at 300 K. What is the ratio of the equilibrium polarizations: |pe / pH| ?,[|ɣe| = 1.761 x 10^11 T^-1 s^-1],820,658,329,B,False,0.20175382494926453,0.3326358199119568,0.3769257664680481,0.07422108203172684
"The amplitude of a free induction decay drops to 25% of its initial intensity after 1.0 s. Assuming exponential relaxation and Ω = 0, determine the value of T2.",0.721 s,0.750 s,1.386 s,1.661 s,D,False,0.18126966059207916,0.29886314272880554,0.3837478756904602,0.12458468973636627
