0,1,2,3,4,5,correct,choiceA_probs,choiceB_probs,choiceC_probs,choiceD_probs
The climate of Great Britain is milder than most other places along the same latitude for which of the following reasons?,"The Gulf Stream brings warm waters to Great Britain, raising the temperature of winds that blow onto the island.",Hot springs throughout the country raise the temperature of the surrounding land and air.,Mountain ranges in the north of Great Britain act as a barrier to cold winds blowing from the Arctic.,Small landmasses generate their own local climate and are largely unaffected by latitude.,A,True,0.37988483905792236,0.158359557390213,0.2304118126630783,0.2304118126630783
Which of the following supranational organizations is not an economic union?,EU,CARICOM,NAFTA,NATO,D,True,0.016933351755142212,0.011638111434876919,0.04602961987257004,0.9245296716690063
The global lingua franca is,Chinese.,English.,French.,Arabic.,B,False,0.09106472134590149,0.03796142339706421,0.40812379121780396,0.462464839220047
What are the two major branches of Islam?,Sunni and Shinto,Shinto and Shiite,Sunni and Shiite,Shamanism and Shiite,C,False,0.014586441218852997,0.011359931901097298,0.42627832293510437,0.5473521947860718
What was the primary reason the Green Revolution did NOT help Africa much?,It targeted crops Africans don't grow and eat.,It required sophisticated machinery.,Population growth has fallen so drastically that Africans don't need the increased food production.,African agricultural production went up without its help.,A,False,0.016628112643957138,0.016628112643957138,0.05803781375288963,0.9078642129898071
The largest exporter of agricultural goods in the world is,China.,Mexico.,Chile.,the United States.,D,True,0.06944241374731064,0.037169843912124634,0.31121930480003357,0.5814341902732849
Which of the following statements is NOT part of Gunnar Myrdal's theory of cumulative causation?,Developing and developed regions share similarly in wealth through trade.,The core will always dominate the periphery.,Growth and prosperity of the core exists at the expense of the periphery.,"Regions with initial advantage keep and expand it as they attract labor, capital, and trade.",A,False,0.0033060715068131685,0.006998952943831682,0.18050538003444672,0.8089690208435059
Which pair of religions below share a long-held tradition of cremating their dead?,Hindu and Buddhist,Hindu and Muslim,Muslim and Jewish,Christian and Buddhist,A,False,0.038232870399951935,0.02977578714489937,0.46577170491218567,0.46577170491218567
"The official languages of Guyana, Suriname, and French Guiana are English, Dutch, and French, respectively. On what continent are those countries located?",North America,South America,Africa,Asia,B,False,0.027924593538045883,0.013190644793212414,0.8160762786865234,0.1418127864599228
