0,1,2,3,4,5,correct,choiceA_probs,choiceB_probs,choiceC_probs,choiceD_probs
The main factor preventing subsistence economies from advancing economically is the lack of,a currency.,a well-connected transportation infrastructure.,government activity.,a banking service.,B,False,0.07495690882205963,0.10906165093183517,0.5538607835769653,0.2616253197193146
The tendency for a population to continue to grow long after replacement fertility has been achieved is called,zero population growth.,rapid growth rate.,homeostatic plateau.,demographic momentum.,D,True,0.017388612031936646,0.02530028112232685,0.4484582245349884,0.5081697702407837
The tendency for migration to decrease with distance is called,push factors.,pull factors.,distance decay.,migration selectivity.,C,True,0.10939162224531174,0.0751836821436882,0.4326522648334503,0.38181427121162415
"Which zone contains low-income slums, ethnic ghettos, and general deterioration in Burgess's concentric zone model of urban form?",First,Second,Third,Fourth,A,False,0.043697796761989594,0.03003302589058876,0.6032294631004333,0.3228854835033417
Which of the following statements is TRUE concerning women in the labor force?,Most women work in agriculture,The percentage of women economically active in the labor force declined worldwide,The percentage of women in the total labor force declined,Women spend more hours per day working than men in all regions except Anglo America and Australia,D,False,0.0036820881068706512,0.011341629549860954,0.9009772539138794,0.0838039368391037
All the following factors can be considered pull factors of migration EXCEPT,safety.,better climate.,better schools.,overcrowding.,D,True,0.024714333936572075,0.01322862971574068,0.14222115278244019,0.8184263110160828
Which of the following countries does NOT have a well-known example of a relict boundary?,Vietnam,United Kingdom,Germany,Bolivia,D,True,0.02763809636235237,0.04556751996278763,0.2971375584602356,0.6290401816368103
Which form of migration below are farm workers from another country most likely to be practicing during the year?,Chain migration,Cluster migration,Circular migration,International migration,C,False,0.08121908456087112,0.03836518153548241,0.41246455907821655,0.46738359332084656
Which of the following is a centrifugal force in a country?,Religious differences,A national holiday,An attack by another country,A charismatic national leader,A,False,0.03343401104211807,0.04293011501431465,0.4615422487258911,0.4615422487258911
Early settlements and high population density along coastlines and rivers are best attributed to which of the following?,Mediterranean climate,Limited forest cover,Growth of manufacturing,Access to trade routes,D,False,0.024379093199968338,0.03130337595939636,0.7124615907669067,0.231302410364151
The first stage of the demographic transition exhibits,high birth rates with high but fluctuating death rates.,declining birth rates with continuing high death rates.,low birth rates with continuing high death rates.,high birth rates with declining death rates.,A,True,0.33970779180526733,0.23347751796245575,0.08589157462120056,0.33970779180526733
What is the population statistic that tells us the level of fertility at which a population will have just enough births to replace parents and compensate for early deaths?,Crude birth rate,Replacement level,Mortality rate,Total fertility rate,B,False,0.0677579864859581,0.08700297027826309,0.34410345554351807,0.5006675720214844
What is the most rapidly growing religion in the United States today?,Islam,Christianity,Hinduism,Buddhism,A,False,0.006825925316661596,0.004691385664045811,0.09422899782657623,0.8940198421478271
The outlying area serviced by a urban center is referred to as a,redline area.,threshold.,range.,hinterland.,D,False,0.05153603106737137,0.05839797109365463,0.6278373599052429,0.26172155141830444
The best definition of an urban area is,the central city and its developed areas.,the central city and its surrounding suburbs.,the central city and its hinterlands.,the central city and the adjacent counties.,B,False,0.6149556636810303,0.155485138297081,0.22622957825660706,0.0032269912771880627
Which of the following religions developed first?,Buddhism,Christianity,Islam,Hinduism,D,True,0.208632692694664,0.14339101314544678,0.3035587668418884,0.343977153301239
Which one of the following is NOT a characteristic of world cities?,World cities contain the headquarters of many transnational corporations.,World cities are well connected to secondary-level world cities.,World cities contain many offices of multinational organizations.,World cities are found only in the northern and western hemispheres.,D,True,0.11448569595813751,0.03716806694865227,0.18875502049922943,0.6588197350502014
Which type of transportation system created the star-shaped city pattern?,Highways to airports that link cities,Interstate highways that link cities,Beltways around cities,Streetcar and trolley lines extending from the CBD,D,False,0.17099812626838684,0.1509053260087967,0.5267113447189331,0.1509053260087967
In which urban US setting below would you expect to find planned communities?,Ghettos,Suburbs,CBDs,Transition zones,B,False,0.014067350886762142,0.02319313958287239,0.7680513262748718,0.1941937804222107
The latitude and longitude coordinates of a place are an example of,a formal region.,a functional region.,an absolute location.,a relative location.,C,True,0.019345946609973907,0.04095537215471268,0.49893856048583984,0.4403117299079895
The voluntary association of three or more countries willing to give up some measure of sovereignty is called,nationalism.,devolution.,supranationalism.,complementarity.,C,True,0.02979186736047268,0.07146696746349335,0.6780597567558289,0.22013376653194427
The key factor Thomas Malthus failed to recognize in his population theory was,population is limited by their means of subsistence.,all populations have the potential to increase more than the actual rate of increase.,wars and famine inhibit population's reproductive capacity.,technology's ability to raise the Earth's carrying capacity.,D,False,0.017450427636504173,0.05375109985470772,0.5778788328170776,0.35050123929977417
Which pair of religions are both universalizing religions?,Islam and Judaism,Judaism and Buddhism,Hinduism and Buddhism,Christianity and Buddhism,D,False,0.02959497459232807,0.0158410482108593,0.6735785007476807,0.2807892858982086
Which urban model theorizes that high-rent residential areas grow outward from the center of the city along major highways with lower-rent inhabitants taking over sequentially?,Concentric zone model,Central place model,Urban realms model,Sector model,D,False,0.09238903969526291,0.15232376754283905,0.6024521589279175,0.15232376754283905
"When a country combines its religion with its government, it is called a",dictatorship.,theocracy.,democracy.,autocracy.,B,False,0.12021879851818085,0.09362650662660599,0.6105214953422546,0.1749173402786255
What is the chief religion practiced in Europe?,Christianity,Islam,Hinduism,Animism,A,False,0.08317161351442337,0.06477411836385727,0.15538503229618073,0.6963874101638794
Which group enacted the first effective settlement in the eastern United States?,French,"British (English, Scotch-Irish, Welsh, Scottish)",Russian,Chinese,B,False,0.008756790310144424,0.005311261396855116,0.6956380009651184,0.2899850606918335
"A population pyramid, or age-sex structure, displays all the following information about a country's population EXCEPT",future social spending needs of the population.,"the impact of ""baby booms"" on the population.",the impact of wars on the population.,a quick visual depiction of the country's demographics.,B,False,0.019231051206588745,0.040712133049964905,0.6368449330329895,0.30082425475120544
The Rhine River is an example of which type of boundary?,Geometric,Artificial,Natural,Relict,C,True,0.09143055230379105,0.06283924728631973,0.5261465311050415,0.3191240131855011
Which type of economic activity is most closely tied to the physical environment?,Primary,Secondary,Tertiary,Quaternary,A,False,0.06990545988082886,0.02269497886300087,0.6632445454597473,0.24399405717849731
The majority of workers in periphery countries are probably employed in which type of activities?,Primary,Secondary,Tertiary,Quaternary,A,False,0.04476524889469147,0.03486321121454239,0.5453523993492126,0.37481483817100525
All of the following are non-basic jobs in the city EXCEPT,city firefighter.,social worker.,dry cleaner.,garment factory worker.,D,True,0.1145072877407074,0.1145072877407074,0.18879060447216034,0.5815160274505615
Transnational corporations distribute their operations,manufacturing goods where production costs are the highest.,conducting accounting and research services where economical.,based on comparative advantage.,with headquarters located in LDCs.,C,False,0.2426302284002304,0.11461039632558823,0.18896059691905975,0.45329293608665466
Which of the following is LEAST associated with the development of alluvial landscapes?,A deep cover of loose materials,A predominance of gentle slopes,Frequent flooding,Deep dissection and erosion,D,True,0.0682358369231224,0.05314212292432785,0.3058118224143982,0.5713316798210144
Which of the following is LEAST self-sufficient in the natural resources needed for modern industry?,United States,Japan,France,United Kingdom,B,False,0.01984029822051525,0.047594401985406876,0.5798185467720032,0.35167771577835083
One of the effects of the east–west orientation of the Alpine mountain system and the northern plains of western and central Europe is that it,limits the marine climate of Europe to coastal areas,provides a corridor for communication between southern and northern Europe,enables marine-like climatic conditions to extend eastward into Germany and Poland,effectively prevents population movement between parts of the Mediterranean region,C,False,0.4062633216381073,0.191905215382576,0.3585261106491089,0.04281983897089958
The largest Hindu temple complex ever constructed is found in,Calcutta.,Bombay.,Cambodia.,Bali.,C,True,0.002278638770803809,0.0029258301947265863,0.9192684888839722,0.07545815408229828
Which term describes the forces that unify and strengthen a country?,Diffusion,Centrifugal,Centripetal,Ethnocentric,C,True,0.13521714508533478,0.10530723631381989,0.6866893768310547,0.07237652689218521
Which one of the following statements best describes an application of the S-curve?,Graph of the Bantu migration,Graph of the growth of human populations since their first appearance on Earth,The chart showing how cities associate with one another based on their population sizes,A model showing the decrease in population growth for several countries after they industrialize,D,False,0.017960377037525177,0.02306157909333706,0.7636946439743042,0.1930922418832779
Which of the following items is NOT a challenge to the state?,Transnational corporations,EU,World Trade Organization,Good transportation network,D,True,0.12194721400737762,0.06527364253997803,0.107618048787117,0.7017577886581421
"National sports teams, flags, national anthems, and national holidays all promote",nationalism.,sectarianism.,political unrest.,functional disputes.,A,False,0.03247241675853729,0.060666464269161224,0.06874410808086395,0.8374747037887573
"The process whereby immigrants learn the values, language, and customs of their new country is called",assimilation.,acculturation.,adaptation.,amalgamation.,B,False,0.06328783184289932,0.05585131794214249,0.4126885235309601,0.4676373600959778
"On which of the following can one most accurately depict true geographical distance, true direction, true size, and true shape?",A Mercator projection,A globe,A conic projection,A gnomonic projection,B,False,0.11338941007852554,0.16498063504695892,0.6525110602378845,0.06877415627241135
Which of the following could be considered a higher-order central place function?,Winn-Dixie grocery store,Mercedes-Benz dealership,Shoe store,Family doctor,B,False,0.027054687961935997,0.044605642557144165,0.7906539440155029,0.13739503920078278
Which geographer viewed the US urban community of the 1920s as a set of concentric rings radiating outward from a central core?,Rostow,Ravenstein,Von Thünen,Burgess,D,False,0.0027809003368020058,0.005195405334234238,0.7710665464401245,0.22091427445411682
"To get to school in the morning, we ALL use this as our guide:",Rand-McNally Road Atlas.,world globe.,road map.,mental map.,D,False,0.12386658042669296,0.0585104264318943,0.5551314949989319,0.26222556829452515
"Of these, the map using the smallest map scale would be the map of",the world.,"Atlanta, Georgia.","Main Street, Small Town, Ohio.",Pennsylvania.,A,False,0.015212001278996468,0.032203804701566696,0.3055412173271179,0.6468307375907898
An earlier boundary formed before meticulous geographic knowledge and mapping was available is known as,an antecedent boundary.,a geometric boundary.,a relict boundary.,a subsequent boundary.,A,False,0.07889965921640396,0.13008353114128113,0.6606187224388123,0.13008353114128113
Which of the following jobs is in the non-basic employment sector?,Software engineer,F-10 pickup truck assembly-line worker,Oil refinery worker,Parking lot attendant,D,False,0.012527598068118095,0.01822754740715027,0.6839836239814758,0.28512680530548096
In which of the following regions is subsistence agriculture being replaced by large-scale commercial development?,The Swiss Alps,The Amazon Basin,North Africa,The Alaskan tundra,B,False,0.04385344311594963,0.06380637735128403,0.6053780913352966,0.2859603762626648
A strong movement away from all religions is called,secularism.,heathenism.,sacrilege.,nationalism.,A,False,0.02396904118359089,0.06515461206436157,0.6181697249412537,0.29200273752212524
Regions share all of these characteristics EXCEPT,boundaries.,common features.,relative location.,easily defined.,D,True,0.03137897327542305,0.02769184485077858,0.38227415084838867,0.5562055706977844
Which of the following U.S. main immigration flow associations is NOT correct?,"Pioneer settlement to 1870—Germans, British, Scotch-Irish, Africans",1870–1914—Asians,1870–1914—Eastern and southern Europeans,1965–present—Hispanics,B,False,0.09323864430189133,0.06408192217350006,0.4735049605369568,0.36876603960990906
Which one of the statements below is characteristic of most African cities?,"They have thriving, clean residential areas.",There are jobs for most rural-to-urban migrants.,They have three separate business districts.,They have a well-developed infrastructure.,C,False,0.040211282670497894,0.014792903326451778,0.23139993846416473,0.7127619981765747
Which country faces a serious trade disadvantage due to its location?,Singapore,Italy,Spain,Mongolia,D,True,0.004420106299221516,0.010603283531963825,0.2413296401500702,0.7433476448059082
"In which zone of Burgess's concentric zone model would one find better houses, single-family homes, and higher-rent apartments?",First,Second,Third,Fourth,C,True,0.02815551497042179,0.02815551497042179,0.6408165693283081,0.30270031094551086
The theory that every society develops economically according to a five-stage pattern of growth is attributed to,Rostow.,Ravenstein.,von Thünen.,Burgess.,A,False,0.005947079509496689,0.005947079509496689,0.8826248645782471,0.1054145097732544
Which of the following would NOT be considered a barrier to diffusion of a cultural trait?,Language,Religion,Oceans,Tolerant complaisant citizens,D,True,0.014074488542973995,0.023204907774925232,0.28269365429878235,0.6781468391418457
The process of invasion and succession is a process involving migration and is best described as when,new residents tear down and rebuild housing units.,new residents live peacefully with old residents.,new residents assimilate with old residents completely.,new residents move into areas occupied by older resident groups.,D,False,0.33595648407936096,0.12359149008989334,0.20376789569854736,0.33595648407936096
Which of the following best illustrates the definition of a functional region?,A map showing Atlanta as a hub for Delta Airlines,An article describing the region referred to as the South,A map showing North Carolina's one hundred counties,An essay explaining the region known as the Bible Belt,A,False,0.04152587428689003,0.03664645180106163,0.3476918637752533,0.573246955871582
New stores opening around a large shopping mall reflect which concept?,Gravity concept,Distance decay,Complementarity,Movement bias,D,False,0.07952608168125153,0.11570975929498672,0.5876226425170898,0.21617431938648224
The birth of an urban industrial workforce in Europe contributed to the start of the,First Agricultural Revolution.,Second Agricultural Revolution.,Third Agricultural Revolution.,Fourth Agricultural Revolution.,B,False,0.03892501816153526,0.06417650729417801,0.6088897585868835,0.2876191735267639
Which of the following statements about East Asia's industrial regions is true?,Japan has a rich natural resource base.,China lacks natural resources but has a massive labor force.,China is industrializing rapidly.,Taiwan lacks industrial enterprise and an educated workforce.,C,True,0.02905946969985962,0.032928697764873505,0.5836750864982605,0.35401684045791626
Which of the following statements best describes the United Nations?,The UN operates a worldwide police force.,Member states surrender sovereignty to the UN.,World laws are enforced by the UN.,The UN often practices interventionism in world conflicts.,D,False,0.1445406973361969,0.23830732703208923,0.3467350900173187,0.27003756165504456
Which of the following is a formal region?,Dixie,Pennsylvania,The market area of Winn-Dixie,The Pacific Northwest,B,False,0.05836492404341698,0.05150686576962471,0.3358669579029083,0.5537509918212891
The concentration of production activities and people spatially to benefit everyone is called,the substitution principle.,deglomeration.,agglomeration.,infrastructure.,C,True,0.05269768834114075,0.14324717223644257,0.49998176097869873,0.30325427651405334
"Which language family contains Italian, Spanish, Portuguese, and Romanian?",European,Slavic,Germanic,Romance,D,False,0.004436357878148556,0.003049061167985201,0.8454201817512512,0.14691197872161865
"Ankara, Turkey and Islamabad, Pakistan are both examples of",desert cities.,forward-thrust capitals.,old colonial capitals.,rival cities.,B,False,0.04176521301269531,0.2121012657880783,0.39625731110572815,0.3496958613395691
Which of the following is NOT an example of syncretism?,Halloween,Foreign cuisine changed to suit American tastes,Hasidic Judaism,Catholicism in Louisiana,C,False,0.011152766644954681,0.008685783483088017,0.09338096529245377,0.8859739899635315
The theory that whoever controlled the landmass of Europe would rule the world is called the,devolution theory.,domino theory.,heartland theory.,rimland theory.,C,True,0.04188976436853409,0.06906455010175705,0.8413784503936768,0.04746732860803604
Which group represents the Persian (Iranian) variation of Islam and believes in the infallibility and divine right to authority of the Imams descended from Ali?,Sunni,Shiite,Imam,Untouchables,B,False,0.039032455533742905,0.01435923669487238,0.6918667554855347,0.2545236051082611
The multiplier effect is,the addition of non-basic workers to an urban economy that has added more basic workers.,a ratio of urban to rural workers in an economy.,the ratio of city workers to farm workers in an economy.,the addition of rural jobs created by the urban economy.,A,False,0.09102250635623932,0.10314201563596725,0.13243696093559265,0.6725704073905945
The sacred book of the Hindu is called the,Talmud.,Bible.,Torah.,Veda.,D,True,0.06360378116369247,0.026514001190662384,0.13464920222759247,0.7748526930809021
Which of the following is a distinct characteristic of an East European city?,A central park,Prominent religious buildings,A large central square surrounded by government and administrative buildings,Luxury apartment buildings,C,True,0.01003414299339056,0.014599592424929142,0.7971106767654419,0.17785944044589996
Which of the following countries is actively trying to preserve the purity of their native language from contamination by English or other languages?,Italy,Russia,Japan,Brazil,C,False,0.02472022920846939,0.02472022920846939,0.3866894543170929,0.5626298189163208
Which of the following is an example of a bulk-gaining industry?,Steel,Bottled orange juice,Paper,Copper,B,False,0.018924497067928314,0.04006316512823105,0.7101365327835083,0.23054757714271545
Which of the following is NOT a feature of an export processing zone (EPZ)?,Tariff reductions on exports,Raw materials imported duty-free,Exemption from customs duties,Strict pollution regulations,D,True,0.017073074355721474,0.0193463284522295,0.2356865257024765,0.7259656190872192
Which of the following characteristics is NOT true of a state?,Independent territory,Internationally recognized,Boundaries,A national language,D,True,0.011341405101120472,0.014562653377652168,0.17740944027900696,0.7950938940048218
"You are planning to move from your hometown to Pittsburgh. Along the way, you stop in Columbus, Ohio to visit a relative and fall in love with the city! You decide to stay and make Columbus your new home. This is an example of",intervening opportunity.,distance decay.,involuntary migration.,push-pull factors.,A,False,0.030672162771224976,0.09447691589593887,0.7910454869270325,0.08337558060884476
A large node of office and commercial land use outside the central city with more jobs than residents is a(n),suburb.,primate city.,town.,edge city.,D,False,0.03150337189435959,0.040451131761074066,0.4927956461906433,0.43489062786102295
Which crop began the Third Agricultural Revolution?,Rice,Wheat,Barley,Millet,A,False,0.08982010930776596,0.042428016662597656,0.11533129960298538,0.7520545125007629
Which factor in the last quarter century greatly destabilized Eastern Europe and led to ethnic conflict?,The introduction of new languages,The end of the Cold War,The invasion by the Soviets,The acceptance of many Eastern European countries into the EU,B,False,0.07991626858711243,0.0333140566945076,0.21723493933677673,0.6691306829452515
"If I wanted to ship a small piece of very valuable jewelry to my aunt who lives in Poughkeepsie, which mode of transportation makes the most sense?",Truck,Air,Ship,Railroad,B,False,0.030317088589072227,0.02675473690032959,0.8859952092170715,0.05663977563381195
Which of the following is a functional region?,Dixie,Pennsylvania,The market area of Winn-Dixie,The Pacific Northwest,C,False,0.03666049242019653,0.04154178127646446,0.3478250801563263,0.5734665989875793
Which type of city model contains a distinct residential spine proceeding outward from center city along the main boulevard?,European,Muslim,Sub-Saharan African,Latin American,D,False,0.008523410186171532,0.018044058233499527,0.8694114089012146,0.10383638739585876
What family do most European languages belong to?,Ural-Altaic,Basque,Indo-European,Phoenician,C,True,0.09392711520195007,0.05696967616677284,0.6940327286720276,0.15485964715480804
"What do the terms apartheid, ethnic cleansing, and integration all have in common?",They all occurred in Nazi Germany during World War I.,They are all forms of residential segregation.,They are all ways to integrate different ethnic populations in neighborhoods.,They are different expressions for the same concept.,B,False,0.1375027447938919,0.37377122044563293,0.06495170295238495,0.42353829741477966
Which one of the statements below correctly describes immigrants living in Europe?,Most find citizenship easy to get in host countries.,Muslims immigrants from North Africa are well integrated in France.,Immigrants to European cities rarely bring their families.,They are usually restricted to certain neighborhoods.,D,False,0.01175056491047144,0.0248759463429451,0.7269816994667053,0.2360164076089859
Which of the following activities are NOT secondary economic activities?,Assembling automotive parts,Sewing shirts,Mining copper,Binding books,C,False,0.1688181608915329,0.054807230830192566,0.3153938353061676,0.4588952958583832
Johnny and Susie are moving to Scotland to renovate and live in the family castle. What makes their move a migration?,They are crossing another country's borders.,They are not taking anything with them.,They are moving permanently.,They will be gone more than one year.,C,True,0.006279778201133013,0.00913702417165041,0.8224886655807495,0.16195760667324066
Which of the following entities is a state?,Antarctica,American Samoa,Egypt,Marshall Islands,C,True,0.011425945907831192,0.008898535743355751,0.550532877445221,0.4287554621696472
What is the most abundant fossil fuel?,Phosphate,Oil,Petroleum,Coal,D,True,0.04993114620447159,0.04406408220529556,0.36894404888153076,0.5368103981018066
A rejection of or indifference to religion in a country is called,polytheism.,animism.,secularism.,monotheism.,C,True,0.028680050745606422,0.07796046137809753,0.6527549624443054,0.24013514816761017
"In a postindustrial economy, which of the following resources is considered most important to increase productivity?",Energy,Labor,Information,Specialization,C,True,0.10138135403394699,0.10138135403394699,0.7491125464439392,0.047889161854982376
A city that is more than twice as large as the next largest city in a country is called a,global city.,world leader city.,megalopolis.,primate city.,D,False,0.07621230185031891,0.18282382190227509,0.4385715425014496,0.3014255166053772
