0,1,2,3,4,5,correct,choiceA_probs,choiceB_probs,choiceC_probs,choiceD_probs
Mass-society theory suggests that:,the content of the media is determined by market forces,the subordinate classes are dominated by the ideology of the ruling class,"the media manipulate 'the masses' as vulnerable, passive consumers",audiences make selective interpretations of media messages,C,True,0.011148321442306042,0.09334374964237213,0.8856208920478821,0.00983835943043232
The ecological approach to urban sociology involved studying:,how social groups colonized different areas of the city and competed for resources,the forms of wildlife and natural habitats that could be found on the edges of the city,the way in which people organized collective protests about environmental issues,how men and women used the city's public spaces differently,A,False,0.13964514434337616,0.20318247377872467,0.6258460879325867,0.031159039586782455
Becker proclaimed that cannabis use was:,increasing throughout all sections of youth in the 1970s,learned gradually through the social processes of a deviant career,a dangerous pastime that young people should not be allowed to pursue,not as enjoyable as other sociologists had suggested,B,False,0.04876406863331795,0.037977494299411774,0.8643637895584106,0.04876406863331795
The middle classes that developed over the nineteenth century were:,"an urban set, involved in civic bodies and voluntary associations",too diverse to have a strong sense of class consciousness,often involved in 'white collar' work,all of the above,D,False,0.015889255329966545,0.026196954771876335,0.5962399244308472,0.36163780093193054
Technological forms of surveillance have made it easier to:,access and exchange 'private' information about consumers,reduce prison overcrowding by the use of electronic tagging,monitor employees' activities at work,all of the above,D,True,0.023668045178055763,0.03902200981974602,0.32672733068466187,0.6104069352149963
The concept of gemeinschaft developed by Ferdinand Tönnies describes basically the same relational characteristics as,organic solidarity,mechanical solidarity,gesellschaft,anomie,B,False,0.011912557296454906,0.04157891124486923,0.9463316202163696,0.00016992349992506206
There was a growth in income inequality in the 1980s because:,rates of income tax increased equally for all occupational groups,there were more professional jobs available but not enough people to fill them,the price of consumer goods rose at a higher rate than earnings,growing unemployment made more people dependent on welfare benefits,D,False,0.02505303919315338,0.0771687924861908,0.8296427130699158,0.06810121983289719
"If a deviant act is 'normalized', it is:",recognised as breaking an important norm of behaviour,seen a temporary aberration from an otherwise 'normal' character,the first step in establishing a deviant career,attributed to the person's genetic or anatomical make up,B,False,0.019928576424717903,0.1299506425857544,0.8473846316337585,0.0026970396284013987
"In the debate about the 'managerial revolution', John Scott (1997) argued that:",owners still exercised control through groups of shareholders and interlocking directorships,ownership and management were becoming increasingly separate functions,the techniques of scientific management were overly bureaucratic and inefficient,managers were becoming dissatisfied with their working conditions and planned to overthrow the owners of businesses,A,False,0.12639985978603363,0.7273809909820557,0.14322979748249054,0.002972639864310622
Marxist feminists explain patriarchy in terms of:,a lack of equal rights and opportunities for men and women,"sex classes, through which men oppress women economically, politically and sexually",women's domestic labour being exploited by the capitalist economy,the dual systems of capitalism and male domination,C,True,0.005113817285746336,0.020225537940859795,0.9745210409164429,0.00013627861335407943
Which of the following was not defined by Giddens (1998) as part of New Labour's 'third way':,the democratization of the family,putting an end to privatization,"positive welfare: 'a hand up, not a hand-out'",the strengthening of civil society,B,False,0.001153491553850472,0.009658067487180233,0.985149621963501,0.004026081413030624
Anti-psychiatrists like Laing & Esterson believed that:,Psychiatry was an out-moded form of treatment and should be replaced by alternative therapies like aromatherapy and kinesiology,"Mental illnesses were biological in origin, so there was no point in studying 'the mind' as experienced by the patient",Psychiatrists were agents of capitalism who tried to instill ruling class ideology into their patients,Behaviour that seemed bizarre could be seen as a reasonable response to disturbed patterns of family interaction,D,False,0.2663610279560089,0.43915510177612305,0.2663610279560089,0.028074245899915695
Butler & Stokes (1969) suggested that working class support for the Labour Party arose from:,socialization into working class families and communities,rational calculation of self-interest,issue-based concerns about culture and lifestyle,false consciousness and the acceptance of hegemonic values,A,False,0.07743125408887863,0.08774110674858093,0.8324644565582275,0.0023382215294986963
"In contemporary societies, social institutions are:","highly specialized, interrelated sets of social practices",disorganized social relations in a postmodern world,virtual communities in cyberspace,no longer relevant to sociology,A,False,0.05124998837709427,0.09574759006500244,0.8016847372055054,0.05124998837709427
The term 'emotion work' (Hochschild 1983) refers to:,the techniques used to consciously manage and present emotions that are deemed appropriate for public settings of interaction,"the work done by psychologists, counselors and therapists to help clients with mental and emotional problems","experiences such as grieving and falling in love, which demand a lot of emotional energy from a person",the way in which increasing levels of risk and anxiety have made us think more reflexively about our self-identities,A,False,0.0043589649721980095,0.05310306325554848,0.9412742853164673,0.0012488642241805792
"When sociologists study the structure of layers in society and people's movement between them, they call this:",social stratification,social control,social conflict,social solidarity,A,False,0.010660949163138866,0.028979463502764702,0.9596680402755737,0.0006815316737629473
"The four ideal types of social action that Weber identified were as follows: instrumentally-rational, value-rational, traditional, and...",affectual,affective,effective,infected,A,False,0.04923451691865921,0.32104939222335815,0.5997992157936096,0.029862241819500923
An ecclesia is:,a religious organization that claims total spiritual authority over its members,a church organized around voluntary rather than compulsory membership,a sect or cult with a very small following,a hierarchy of priests or other spiritual leaders,A,False,0.015139004215598106,0.04663141444325447,0.9366170167922974,0.0015956393908709288
"After slavery was abolished in the USA and British Empire, policy makers claimed that former slaves migrating to these cities would experience:",assimilation,adaptation,discrimination,compensation,A,False,0.07901523262262344,0.06973069906234741,0.7496756911277771,0.10145757347345352
Sutherland's study of the 'professional thief' suggested that:,people are socialized into a life of crime by associating with others who define it in positive terms,the majority of crime is committed by middle class people in professional occupations,those who were arrested and charged with theft did not define themselves as thieves,the most dangerous criminals on the street were those who were highly skilled thieves,A,False,0.046018701046705246,0.56062251329422,0.3853098750114441,0.007996850647032261
Which of the following policies did the New Labour government not pursue?,setting and streaming pupils by ability,parental choice of school,supporting LEAs that appeared to be failing,state regulation and control of the curriculum,C,True,0.002072962000966072,0.0367441289126873,0.9476435780525208,0.013517408631742
"Stone's research suggests that prior to industrialization, the nuclear family:",did not exist in any form,"had begun to disappear, as extended networks of kin became more important",had begun to emerge through the separation of work and home life,was simply another institution of patriarchal control,C,True,0.003558749333024025,0.009673683904111385,0.9867424964904785,2.397866228420753e-05
"Statistics about rural, suburban, and urban patterns of development and mobility are almost always reported based on a geographical area labeled as Metropolitan Statistical Areas (MSA). What constitutes an MSA?",It includes only the 10 largest cities in the United States.,"It is composed of at least one central city with a population of at least 50,000 and it surrounds densely urbanized counties.",It is an area that experiences strong storms at least 50 percent of the year.,It is a large city with a population of at least 1 million and is immediately surrounded by suburbs.,B,True,0.026857171207666397,0.8893873691558838,0.05685662850737572,0.026857171207666397
Mosca and Pareto identified the ruling elite as:,a minority group who fill all the top positions of political authority,a coalition of social forces with specific skills and abilities,a group who circulate between high status positions and exclude others,all of the above,D,False,0.7376405000686646,0.0686112567782402,0.18650472164154053,0.007231573574244976
Bourdieu attributed the reproduction of class to:,cults of the capital,capital culture,cultural capital,culpable capture,C,True,0.09249041229486465,0.2218729704618454,0.6834169030189514,0.0021751662716269493
Secularization involves the two related ideas of:,disappointment and disproportion,disbelief and disintegration,disengagement and disenchantment,distribution and distillation,C,True,0.007372391875833273,0.02573217637836933,0.9655928015708923,0.0012811296619474888
The general fertility rate fell between 1964 and 2000 because of:,increases in the age of marriage and the age at which childbearing begins,there being fewer women of childbearing age than there were in the first half of the century,errors in the measurement of birth rates and production of statistics,"the risk of diseases caused by poverty, poor housing and bad sanitation",A,False,0.051824647933244705,0.18088577687740326,0.7154171466827393,0.051824647933244705
Howard's idea of the garden city consisted of:,six small towns surrounded by green belts and linked to a larger central city,"planning cities to have plenty of trees, flowers and public gardens",each privately owned house to have its own front and back garden,tower blocks to displace the population vertically and leave most of the land available as green open spaces,A,False,0.1072409451007843,0.17681042850017548,0.6992987990379333,0.016445931047201157
The 'third age' of the life course is said to involve:,active non-work and independence after retirement,"full time employment, family-building and adult responsibility","illness, isolation and increasing dependence on others","the transition from education to work, and distinctive youth cultures",A,False,0.001431704848073423,0.009335888549685478,0.9522864818572998,0.036924153566360474
Weber (1919) said that the state's monopoly of the use of force was legitimated by:,charismatic authority,rational-legal authority,traditional authority,value-rational authority,B,False,0.01870417408645153,0.07397644221782684,0.9012175798416138,0.00607235636562109
Sullivan's (2000) study suggested that the proportion of housework men did was greatest when:,they had rediscovered themselves as 'new men',their wives were at home and nagged them all the time,exciting gadgets like the hoover and electric iron were invented,they were unemployed or both partners worked full time,D,False,0.012654942460358143,0.05005127191543579,0.887179970741272,0.05005127191543579
The shift from custodial to joint parenthood after divorce means that:,fathers are more likely to be absent from their children's lives,one parent has total responsibility for the child's welfare and socialization,both parents are expected to co-operate in the continued care of their children,parents must provide for all of their children in equal measure,C,True,0.0016722065629437566,0.015865452587604523,0.9815607666969299,0.0008950675837695599
Émile Durkheim believed the primary focus of sociology should be which of the following?,Social action,Social facts,Class relations,Cultural dynamics,B,False,0.03894323483109474,0.07275553792715073,0.8863439559936523,0.0019388694781810045
"The term ""sociology"" was coined in the early 1800s by which of the following?",Auguste Comte,Robert K. Merton,Karl Marx,Emile Durkheim,A,False,0.08841167390346527,0.06885508447885513,0.8388266563415527,0.003884538309648633
"In their study of depression, Brown & Harris (1978) found that:",women's susceptibility to stress depended on their levels of social support,self-reported depression is highest amongst men and the relatively affluent,men and women have fairly similar levels of diagnosed depression,men are more vulnerable to depression because of conventional gender roles,A,False,0.010143628343939781,0.031244570389389992,0.9131002426147461,0.04546058177947998
The alternative form of 'network organization' means that:,work can be subcontracted out to independent suppliers and retailers,business transactions occur only through electronic communication,"the Japanese model is applied, through lateral networks of flexible roles",activities are redistributed equally between men and women,A,False,0.002332086907699704,0.16349190473556519,0.8302804231643677,0.0038449615240097046
Margaret Mead suggested that:,adolescence and gender roles varied between societies and so were culturally determined,gender roles in three New Guinea societies were identical and so must be biologically determined,adolescence in the USA is a time of relative calm compared to the experience in Japan and Europe,anthropological fieldwork can be problematic because the researcher's values affect the way they interpret their observations,A,False,0.050074972212314606,0.1361178755760193,0.7833043932914734,0.030372006818652153
The term 'secondary deviation' refers to:,the punishment or stigmatization of deviant acts,the labelling of an act as deviant through social reactions to it,the ways in which taking on a deviant role affects future action,all of the above,D,False,0.03896592557430267,0.06424394994974136,0.8868603706359863,0.00985212903469801
The effect of the Internet upon the public sphere has been to:,"repress it, by promoting only the interests of elite groups","revive it, by reaffirming a commitment to freedom of speech","reproduce it, by emphasizing face-to-face contact with peer groups",replace it with a superior form of communication,B,False,0.017232516780495644,0.12733204662799835,0.8303092122077942,0.025073165073990822
Weber said that the 'spirit of capitalism' could be traced back to:,the movement towards religious pluralism,inspirational Protestant groups who revived religious ideas,new religious movements who rejected traditional forms of labour,Calvinists who engaged in ascetic practices to gain signs of salvation,D,False,0.0141108063980937,0.10426554828882217,0.8730047345161438,0.008558637462556362
The terms 'crisis of the 1970s' is used to refer to:,declining profits and rising unemployment,the eradication of the welfare state,rising divorce rates and the decline of the traditional family,an unfortunate twist in fashion sensibility,A,False,0.07752758264541626,0.08785025775432587,0.8335000872612,0.0011058715172111988
The Macpherson Report highlighted the increasing problem of:,hate crimes: violence against ethnic minorities simply because of their race,institutional racism: systematic forms of disadvantage built into the routines and practices of social institutions,overt racism in the police force that must be tackled by institutional reforms,growing numbers of asylum seekers in need of long term accommodation,B,False,0.4258159399032593,0.3316257894039154,0.22792285680770874,0.014570619910955429
Seven people standing silently while waiting for a bus at a bus stop is an example of which of the following?,A primary group,A secondary group,An aggregate,A social category,C,True,0.006450713612139225,0.010635429061949253,0.9573707580566406,0.025513065978884697
Environmentalist social movements are global in the sense that:,they increase our awareness of risks that affect the whole planet,they appeal to universal values and human rights,they use global media to generate publicity,all of the above,D,False,0.5051809549331665,0.1640082448720932,0.18584571778774261,0.14473678171634674
Chodorow (1978) argued that gender socialization occurred through:,"both boys and girls being closely attached to their mothers, but then boys breaking away",girls being attached to their mothers but then breaking away,boys being attached to their fathers and girls to their mothers,"both boys and girls being closely attached to their fathers, but girls breaking away",A,False,0.2301262617111206,0.2030857503414154,0.5520442128181458,0.014711480587720871
The 'new man' of the 1980s was alleged to be:,"sensitive, caring, and emotional","laddish, aggressive, and violent",a strong and dependable breadwinner,openly bisexual and proud of it,A,False,0.00721240509301424,0.019605349749326706,0.944638729095459,0.028525616973638535
"In the 1960s, comprehensive schools did not eradicate class inequalities in education because:",they tended to recruit pupils from the inner cities and traditionally working class areas,"selective schools could still 'cream off' the most able pupils, while the comprehensives put children into ability streams","teachers in comprehensive schools used the restricted code in the classroom, whereas working class pupils used elaborated codes of speech",national testing and league tables made the new schools highly competitive and selective,B,False,0.05268434062600136,0.16227920353412628,0.3435450494289398,0.44112056493759155
"In idealized views of science, the experimental method is said to involve:",testing out new research methods to see which one works best,isolating and measuring the effect of one variable upon another,using personal beliefs and values to decide what to study,"interpreting data subjectively, drawing on theoretical paradigms",B,False,0.0188562273979187,0.1393297165632248,0.8017871975898743,0.03991863131523132
An 'open' society is one that:,grants every member equal status,does not have any official secrets in its government,has permissive attitudes towards sexual behaviour,allows people to move between levels of the hierarchy,D,False,0.006072694901376963,0.03494594618678093,0.9012678265571594,0.05761612206697464
The Nation of Islam group appealed to:,British-born second generation immigrants from the Asian subcontinent,White Americans who wanted to convert to Islam,African-Americans who felt excluded from the 'ethnic melting pot' in the USA,African-Caribbeans who lived in the inner cities and had a distinctive youth culture,C,True,0.04163634032011032,0.009290323592722416,0.947638750076294,0.001424717134796083
Comte's term 'positivism' refers to:,a theory that emphasizes the positive aspects of society,"the precise, scientific study of observable phenomena",a theory that posits difficult questions and sets out to answer them,an unscientific set of laws about social progress,B,False,0.003976605832576752,0.022883787751197815,0.9730433821678162,9.352080815006047e-05
Theories of racialized discourse suggest that:,race is an objective way of categorizing people on biological grounds,the idea of race is socially constructed through powerful ideologies,race relations in Britain and America can be traced back to colonial times,people choose their racial identity and this becomes fixed,B,False,0.01781746745109558,0.11618448793888092,0.8584936857223511,0.007427425589412451
"A major car accident occurs. One man stops his car and starts helping people. After seeing him stop, others also stop and start helping. Which of the following theories best explains the scenario?",Convergence,Emergent-norm,Contagion,Value-added,B,False,0.011748122982680798,0.052651435136795044,0.9332689642906189,0.0023133426439017057
A new highway extends from a major city though an area used for farmland. Which of the following is most likely to happen as a result?,Farmers will increase the acreage under production.,The city will evolve into a multiple nuclei model.,Suburbanization will develop because the time it takes to commute to the city has been decreased.,"People from the countryside will move to the city, depopulating the farmland region.",C,True,0.003826021682471037,0.05281659960746765,0.9361966252326965,0.00714794872328639
"According to W. E. B. Dubois, progress for African Americans in the aftermath of slavery",depended on the small group of African Americans receiving the same thorough and extensive education as the most talented White Americans were able to access,"involved their use of skills they already had from farming, domestic work, and labors of rural life rather than being forced to learn new skills in the late 1800s",required that they be trained and prepared as craftspeople and service employees so they could become immediately self-sufficient,"required them to move to large cities where they would be accepted as equals in government, religion, and education",A,False,0.005145640578120947,0.012343750335276127,0.980585515499115,0.0018929754151031375
Pluralist theories suggest that:,the state's power can be exercised through several different administrative structures,the ruling elite is composed of people from various class backgrounds,political parties must compete for the votes of 'consumers' in the electorate,there is a close alignment between class background and party preference,C,True,0.005504766944795847,0.04067503660917282,0.9257595539093018,0.027955515310168266
The term 'over-urbanization' means that:,life in modern Western cities is so far removed from that of the Third World that we find it difficult to understand these societies,"in poorer countries, the rapidly developing cities drain resources from the rural areas",the extent to which urbanization affects development has been exaggerated,governments are so preoccupied with urbanization in the West that they forget to attend to problems in the Third World,B,False,0.02025541104376316,0.11656183749437332,0.8612819314002991,0.001884046709164977
The capitalist class of the mid-twentieth century were said to join the upper class because they:,participated in the same leisure pursuits and events of the 'social calendar',emulated the lifestyle and cultural values of the traditional aristocracy,owned companies and financial assets that generated wealth through corporations,"had direct, personal ownerships of land and businesses as physical assets",C,False,0.09458668529987335,0.4239080846309662,0.3740975856781006,0.10718075186014175
The term inter-generational mobility refers to:,movement into a different occupational category over a person's lifetime,movement into different occupational categories between generations,movement into a higher occupational category,movement into an occupation that generates a lower income,B,True,0.05466606095433235,0.5877155661582947,0.35646751523017883,0.0011345578823238611
"The term 'culture industry', used by members of the Frankfurt School, referred to:",the globalization of culture through new technologies,the way in which cultural products were bought and sold for profit,the development of subcultures and counter-cultures in society,the way in which industrialization had created new means of communication,B,False,0.4550139009952545,0.4550139009952545,0.08959754556417465,0.0003661647206172347
"According to Hakim (1995, 1996), the majority of part-time work is done by women because:",part-time jobs pay relatively high wages and so are financially beneficial,they make a rational choice to combine employment with their 'home-centred' lives,"their choices are constrained by structural factors, such as being unable to afford childcare",full time work is not available in the kinds of occupations that they want to enter,B,False,0.03148986026644707,0.2326803356409073,0.716705858707428,0.019099565222859383
A sect is organised around:,"beliefs that can be challenged by members, a charismatic leader, and openness to new recruits",tolerance towards other religions and the separation of church and state,"voluntary membership, democratic leadership, and high levels of emotional commitment",the idea of the secular world itself as being sacred,C,True,0.08775203675031662,0.21050620079040527,0.6484047174453735,0.05322430282831192
What is the name of the process by which we acquire a sense of identity and become members of society?,rationalization,colonization,McDonaldization,socialization,D,False,0.0016498046461492777,0.017737070098519325,0.9684111475944519,0.012190497480332851
Pre-testing a questionnaire is useful for:,finding out which topics are important to the respondents,testing out your computer and printer,identifying any problems with the question wording and routing,deciding which respondents to leave out of the final sample,C,True,0.0035049081780016422,0.013862179592251778,0.9718138575553894,0.010795877315104008
Judith Butler (1999) suggested that:,sexual characteristics are the biological determinants of gender,"heterosexuality and homosexuality are essential, opposing identities",the 'two-sex' model replaced the 'one-sex' model in the eighteenth century,gender is performed through bodily gestures and styles to create 'sex',D,False,0.05218460410833359,0.12518437206745148,0.8163045644760132,0.006232562009245157
