0,1,2,3,4,5,correct,choiceA_probs,choiceB_probs,choiceC_probs,choiceD_probs
White-collar crime is low in visibility because:,it involves only small amounts of money,the proletariat can outsmart the bourgeoisie,the police turn a blind eye to corporate crime,it goes undetected in the context of everyday business transactions,D,False,0.00780912209302187,0.039657991379499435,0.6203553676605225,0.3320523202419281
"With industrial capitalism, leisure emerged as a concept that meant:",distinct periods of non-work and relaxation,regulated and organized activities to reduce social disorder,"the growth of civic, municipal culture through public libraries, museums and art galleries",all of the above,D,False,0.13036882877349854,0.013740772381424904,0.8501115441322327,0.005728006362915039
A moral panic occurs when:,"the media exaggerate reports of deviant groups, generating hostile reactions",children watch violent or sexually explicit films and then copy the behaviour,audiences challenge the ethnic stereotypes represented by the media,elitists express concern with the Americanization of culture,A,False,0.018763210624456406,0.1780203878879547,0.7978319525718689,0.005375749431550503
The 'demographic transition' is a social trend that involves:,"a reduction in population size, caused by a higher rate of emigration than immigration",a change in the principal causes of death and disease since industrialization,"increased birth and death rates, resulting in a relatively young population","a decline in the birth rate, greater life expectancy, and an ageing population",D,False,0.31891804933547974,0.2814441919326782,0.31891804933547974,0.08063510805368423
'Snowballing' is an example of:,probability sampling,non-probability sampling,cluster sampling,using the Christmas vacation constructively,B,False,0.012389085255563259,0.09154364466667175,0.6764211058616638,0.21960178017616272
The 'class polarization' that Marx predicted referred to:,the division of each social class into the more or less privileged,"a growing gap between rich and poor, resulting in class consciousness",the growth of intermediate strata in the middle classes,the tendency for the working class to live in very cold places,B,False,0.07191836833953857,0.3223157823085785,0.6021651029586792,0.0035806044470518827
"In the context of the labour movement in the nineteenth century, 'incorporation' meant:",including union representatives in processes of policy decision making,creating links between the state and corporate organizations,recruiting women into full time paid employment,including working class organizations in political bargaining and representation,D,False,0.021460387855768204,0.10898484289646149,0.7106704115867615,0.1585720032453537
Millions of immigrant children who entered the United States learned English and the duties of citizenship while attending public schools in the communities in which they settled. This is an example of which of the following sociological concepts?,Acculturation,Collective behavior,Social stratification,Social mobility,A,False,0.054728373885154724,0.0796293094754219,0.8560957908630371,0.00951036624610424
The capitalist world economy is what Wallerstein (1974) would call a 'world system'. This term refers to:,a means of transporting money between different areas of a country,an empire with a bureaucratic administration but no political centre,an awareness of risks and dangers that affect the environment as a whole,a unit with a division of labour that extends across ethnic and cultural groups,D,False,0.0751124769449234,0.10928800702095032,0.8075352311134338,0.007916796952486038
"According to Foucault, carceral organizations:",emphasised human relations and employee satisfaction,increased the amount of power held by managers,stripped inmates of their previous identities,isolated people and put them under surveillance,D,False,0.002120398683473468,0.017753880470991135,0.9693289995193481,0.010768272913992405
Which of the following is not recognised as a level of society?,the household,the office,the global village,the nation state,B,False,0.0020389528945088387,0.01934504695236683,0.932096540927887,0.04640635475516319
Ethnic identity refers to:,the objective categories of ethnicity used in the census,"a felt sense of group membership on the basis of religion, language, or history",the imposition of a racial label on a minority by a powerful majority,the fragmented and pluralistic nature of ethnicity,B,False,0.058635350316762924,0.29777491092681885,0.6303894519805908,0.013083315454423428
Marriage appears to be in decline because:,the proportion of people living alone has fallen to 29%,many people are cohabiting in long term relationships,the upward curve of remarriages compensates for the drop in first marriages,all of the above,B,False,0.13394486904144287,0.03386656567454338,0.1517794281244278,0.6802281737327576
The market model of state welfare is based on the principle of:,"individuals buying welfare privately, with some means-tested benefits",regular benefit payments to men as earners of the 'family wage',"a universalist system of welfare for all, regardless of income",decommodifying social welfare through state provision,A,False,0.0464920811355114,0.05268242582678795,0.8240918517112732,0.07665248215198517
The term feminization of poverty refers to:,the critical deconstruction of 'poverty' by feminist theorists,"women's increased chances of being in poverty, due to low pay and greater welfare dependency",the way in which managing a budget and avoiding poverty tends to be a woman's responsibility within the home,the disproportionate number of female sociologists who do research on poverty,B,False,0.0494810976088047,0.25128576159477234,0.6830654740333557,0.01606415957212448
Which of the following is not identified as a new form of community?,"ethnic communities, based on shared identity and experiences of discrimination","gay villages, which are formed in certain parts of large cities","sociological communities, formed by unpopular lecturers",virtual communities that exist only in cyberspace,C,True,0.0016190609894692898,0.015361221507191658,0.9503651261329651,0.03251970559358597
The use of 'indentured labour' in the nineteenth century involved:,people being transported to the British colonies and forced to work for one employer under poor conditions,the sale of African people through the slave trade in the 'Atlantic triangle',selecting the most skilled workers in factories to promote their employer's company overseas,extracting the teeth of the laziest workers to stop them from talking,A,False,0.025327354669570923,0.12862291932106018,0.8387267589569092,0.007256408222019672
Cultural restructuring has involved:,regenerating cities in economic decline,turning industrial landscapes into tourist attractions,selling sites and images through the 'symbolic economy' of media advertising,all of the above,D,True,0.08193612843751907,0.030142618343234062,0.4161060154438019,0.4715099036693573
Which of the following was not part of Weber's ideal type of bureaucracy?,impersonal rules,extensive paperwork,hierarchy of officials,Salaries,B,False,0.002978151896968484,0.024935759603977203,0.9357074499130249,0.03628131374716759
Which of the following is the most important agent of socialization in early childhood?,A preschool provider,A peer group,The mass media,The family,D,False,0.027316581457853317,0.06552907824516296,0.904600977897644,0.002540837973356247
Which of the following is not a 'research purpose'?,triangulation,explanation,description,exploration,A,False,0.00010848329111468047,0.002469068393111229,0.996093213558197,0.0013215970247983932
'Scientific' theories in the nineteenth century tried to explain race in naturalistic terms. Which of the following ideas was not considered?,genetics,evolution,height,brain size,C,True,0.038852740079164505,0.04988790675997734,0.884284257888794,0.02670307084918022
Which of the following is not a regular national survey carried out by the British government?,Labour Force Survey,General Household Survey,Fashion Sensibility Survey,Family Expenditure Survey,C,True,0.019712796434760094,0.08834662288427353,0.8382094502449036,0.053584933280944824
Which of the following industries did Blauner (1964) suggest was most alienating to its employees?,machine-based factory work,textile work as craft production,car manufacturing in assembly plants,chemical processing with automated practices,C,True,0.013185451738536358,0.05909309536218643,0.9243715405464172,0.0033338044304400682
The 'decentralized city' can be identified by:,the shift of employment and services away from the inner city towards multiple centres in smaller towns and rural areas,the degendering of public space as women use local facilities more,gentrification: the movement of middle class people back into the inner city,all of the above,D,False,0.4609532058238983,0.05505301058292389,0.4609532058238983,0.02294950745999813
Lombroso claimed that:,criminals were socialized into an 'underworld' of crime,no act is intrinsically deviant,biological failings drove some people into crime,women were less likely to be arrested than men,C,True,0.021083541214466095,0.0735887885093689,0.8964949250221252,0.00878892745822668
Warner and Myrdal claimed that black former slaves were not joining the 'ethnic melting pot' of the North American cities because:,"the white population did not believe in liberty, equality, and democracy",they wanted to retain a strong sense of their original ethnic identity,they were not prepared to leave the Southern states and move to North America,the promise of citizenship was contradicted by continued discrimination,D,False,0.036263223737478256,0.12657108902931213,0.8253471255302429,0.01177294459193945
"When Berger & Luckmann said that reality is socially constructed, they meant:","scientists are guided in their work by social values and interests, so they define and measure phenomena that will support their theories","people negotiate shared definitions of their situation and live according to these, often forgetting that these social worlds are not fixed and external",sociologists decide what constitutes social reality and measure only that,terms like 'reality' have no deeper meaning beyond the level of discourse,B,False,0.04804849997162819,0.4023051857948303,0.5165700912475586,0.03302321955561638
Which of the following groups or organizations can be identified as having the characteristics of a bureaucracy?,"An extended or consanguine family, including all the relatives by blood, marriage, or adoption",The government of a large city,A book club in which books are chosen by members who take turns alphabetically to lead discussion,The volunteers who gather annually to clean the neighborhood,B,False,0.07518897205591202,0.20438483357429504,0.7133731245994568,0.006993664428591728
Pilcher (1999) identified soap operas as a 'feminine genre' of media because:,most of the characters in soap operas are women,they represent images of women as both domesticated and independent,they alienate women and appeal to an audience of men,female television producers are most likely to work in this area,B,False,0.02539508044719696,0.11381284892559052,0.8409695029258728,0.019777707755565643
Which of these was not one of Townsend's (1979) indicators of relative deprivation?,lacking exclusive use of a bath or shower,living in housing with serious structural defects,buying fewer than twenty DVDs in the previous year,going without a week's holiday in the previous year,C,True,0.0046595423482358456,0.03442961722612381,0.8879515528678894,0.07288750261068344
Children who are still sucking their thumbs when they enter kindergarten are often subject to teasing and ridicule for this behavior. What type of social sanction is applied in this instance?,Formal positive sanction,Formal negative sanction,Informal positive sanction,Informal negative sanction,D,False,0.022910775616765022,0.05496009439229965,0.8597205281257629,0.06227795034646988
The concept of political culture refers to the,"way that cultural products, such as novels or paintings, reflect the political ideologies of their creators",basic beliefs and orientation toward politics that are shared widely by the members of a culture,political beliefs and attitudes shared by people in public offices,ideological biases of the mass media,B,False,0.14590755105018616,0.2725912034511566,0.5770755410194397,0.0044060260988771915
"Walt Disney, Sony and Time Warner are examples of:",transnational corporations,multi-media empires,ownership concentrated within one medium,government-owned companies,A,False,0.1809394806623459,0.15967853367328644,0.631540834903717,0.027747968211770058
Equilibrium theories of social change emphasize,globalization,stability and the structure of society,secularism and mechanization,industrialization,B,False,0.059452708810567856,0.23514002561569214,0.49779143929481506,0.2075103372335434
Which of the following best describes the definition of poverty used by the United States government?,It specifies the poverty line at a level set in the 1960s and adjusted since to reflect inflation.,"It includes the value of government services, such as Medicaid or public housing, when setting the poverty line.","It is based on the concept of relative deprivation, and the poverty line changes as the distribution of income changes.","It is based on the concept of lifestyle, and the poverty line varies according to the needs of the individual.",A,False,0.0016650945181027055,0.015797974541783333,0.9773861169815063,0.005128851626068354
The 'absolute' poverty line is drawn to show:,the most extreme level of poverty that is found in a society,the estimated minimum level of income needed for subsistence,"households that are poor, relative to the norms and values of their culture",the areas of a city in which poverty is concentrated,B,False,0.0142300333827734,0.09279146790504456,0.8803809881210327,0.012557960115373135
'Eyeballing' is a technique that involves:,reading a textual document quickly to understand the gist of it,gathering a sample from whoever you can see in a public place,scanning a table to identify general patterns and significant figures,keeping your eyes on research participants at all times,C,True,0.015679460018873215,0.11585640907287598,0.8560695052146912,0.012211175635457039
Which of the following was not a strategy used by the Conservative government of 1979 to reduce the power of the labour movement?,making all strike action illegal,imposing restrictions on picketing,banning political strikes that were not primarily concerned with the worker's own conditions of work,making secondary action (in support of workers elsewhere) illegal,A,False,0.0031367975752800703,0.05560106411576271,0.8697469830513,0.07139318436384201
"In the nineteenth century, homosexuality was understood as:",a positive identity in which gay people could take pride,"an absolute taboo, which meant that all homosexuals were isolated",a subordinate form of masculinity that threatened 'compulsory heterosexuality',confirmation of the two-sex model,C,True,0.024284571409225464,0.05141044035553932,0.9112718105316162,0.012998593971133232
The population pyramid of a population that has had a slightly larger birth rate than death rate for several generations will most likely have which of the following shapes?,Wider at the top than in the middle,Wider at the bottom than at the top,Bulging in the middle,Having parallel sides,B,False,0.01716705784201622,0.04118163138628006,0.9372895956039429,0.004340512212365866
The 'new racism' refers to:,"a subtler form of prejudice, masked by nationalist pride",a post-modern deconstruction of racist ideas to reveal their lack of depth,"racist practices found in newly emerging areas of social life, such as cyberspace",an anti-fascist movement which challenges nationalist politics,A,False,0.02129710651934147,0.17831850051879883,0.799168050289154,0.001201500534079969
Giselle graduated from college with high honors in management. She was recruited immediately following college by a large corporation and accepted a position in junior management. She quickly advanced to middle management. Ten years later Giselle was still in a middle-management position and had witnessed junior male colleagues promoted over her. Which of the following is a phenomenon that is most likely to explain Giselle's lack of promotion?,Glass ceiling,Gender constancy,Underemployment,Glass elevator,A,False,0.1125640794634819,0.1445351392030716,0.23829816281795502,0.5044772028923035
The Mafia is an example of:,white collar crime,organized crime,non-criminal deviance,global terrorism,B,False,0.04939497634768486,0.07186926156282425,0.8755468130111694,0.0031577148474752903
Goldthorpe identified the 'service class' as:,"those in non-manual occupations, exercising authority on behalf of the state",people working in consultancy firms who were recruited by big businesses,the young men and women employed in domestic service in the nineteenth century,those who had worked in the armed services,A,False,0.09996867924928665,0.0606340691447258,0.8370274305343628,0.0023510379251092672
Industrial production in the nineteenth century was characterized by:,increasing numbers of women in high status positions,cottage industries and homeworkers doing piecework in the domestic sphere,the 'managerial revolution' by which ownership and control became separate,power-driven machinery and the concentration of workers in large workplaces,D,False,0.10705187171697617,0.13745731115341187,0.6980658769607544,0.057300735265016556
The term 'collective consumption' (Castells 1977) refers to:,the privatization of public services by the Conservative government,the lifestyle practice of shopping in peer groups,the form of tuberculosis suffered by those who collect stamps,"the provision of health, housing, and education services by the state",D,False,0.023927466943860054,0.176801398396492,0.7923688888549805,0.006855334155261517
The deviant subculture of homosexuals who met in seventeenth and eighteenth century London was called the:,pollies,mollies,dollies,lollies,B,False,0.11576229333877563,0.11576229333877563,0.6661660671234131,0.10215987265110016
Robert and Tanya are married and live with their three children. Their family unit is called,a family of orientation,a nuclear family,an extended family,a communal family,B,False,0.009470458142459393,0.013779433444142342,0.9660129547119141,0.010731435380876064
"In Durkheim's work, the term 'collective representations' refers to:",effervescent ceremonies that create a feeling of belonging,images of gods or totems that are widely recognized,"shared ideas and moral values, often symbolized by an object or figurehead",ideological tools used to obscure class divisions,C,True,0.11137396097183228,0.16204816102981567,0.7262494564056396,0.00031282653799280524
Which of the following is not a characteristic of totalitarian societies?,indoctrination and propaganda,freedom of movement for citizens,one-party rule,a centrally planned economy,B,False,0.005549267400056124,0.036185771226882935,0.9332433342933655,0.024870092049241066
Freud's notion of the 'ego' referred to:,the unconscious mass of instinctive drives that may be repressed,the self as a whole: an unstable mix of conscious and unconscious elements,"the conscious part of the mind that regulates emotional drives on a practical, rational level",the neurotic part of the mind that longs for belonging and may suffer an inferiority complex,C,True,0.24960161745548248,0.22027263045310974,0.5284066200256348,0.0016818024450913072
Which of the following theories focuses on how society manages to carry out the activities necessary to maintain order and stability?,Functionalism,Interactionism,Rational-choice theory,Conflict theory,A,False,0.005975381005555391,0.03438594192266464,0.8868252038955688,0.07279504090547562
Which of the following is a personal document with closed access?,government 'white paper',confidential medical records,household account book,the shares register of a business,C,True,0.000997692346572876,0.022707372903823853,0.9655420184135437,0.01072620414197445
The tripartite system used the 11+ exam to select pupils for:,popular schools that lay outside their catchment area,"private, public and comprehensive schools","grammar, technical, and secondary modern schools","polytechnics, colleges and universities",C,True,0.010446738451719284,0.04681902751326561,0.9403853416442871,0.00233098235912621
Durkheim defined social facts as:,"ways of acting, thinking, and feeling that are collective and social in origin",the way scientists construct knowledge in a social context,data collected about social phenomena that are proven to be correct,"ideas and theories that have no basis in the external, physical world",A,True,0.7749319076538086,0.11883966624736786,0.10487563163042068,0.0013201895635575056
The media-themes model of media influence claims that:,audiences selectively interpret what they want to hear,content analysis is the best way to identify the themes covered by the media,audiences passively absorb whatever messages they are given,social interaction reinforces the ideas and images that audiences select,D,False,0.05270983278751373,0.14328019320964813,0.5000969767570496,0.3033241629600525
Bowlby's maternal deprivation thesis claimed that:,mothers who are living in poverty cannot afford to give their children the resources that other children enjoy,"children deprived of an early, secure attachment to their mother are prone to suffer physically, intellectually and socially in later life",'mothering' is a socially constructed activity identified in the narratives of new mothers,"deprivation is something children inherit, usually through their mother's side",B,False,0.43567073345184326,0.2642476558685303,0.2642476558685303,0.03576203063130379
War became possible between nation states in the nineteenth century because:,the world was divided into several rival overseas empires,"industrialization provided better transport, technology and administration","there was intense economic, political and military competition",all of the above,D,False,0.3176766633987427,0.08032123744487762,0.5934981107711792,0.008465795777738094
Which of the following is not identified by Fulcher & Scott as a criterion of community?,a shared sense of identity and belonging together,common activities involving all-round relationships,a fixed geographical location,collective action based on common interests,C,True,0.0009641405194997787,0.024865511804819107,0.9330714344978333,0.04099629819393158
The 'Great Migration' of 1916-1919 meant that Chicago became an ethnically diverse city. The consequence of this was:,assimilation: all racial boundaries were dissolved by the 'ethnic melting pot',multiculturalism: all ethnic identities were celebrated equally,"most ethnic groups were integrated into mainstream society, but the black population remained in the city's ghettos",racism: the white host population were hostile and prejudiced towards migrants,C,True,0.019574590027332306,0.08772721886634827,0.8323327302932739,0.06029398366808891
"According to Scott (1990), a document is 'authentic' if it:","is a sincere and accurate account, free from political bias",is representative of all the similar documents that did not survive,has both a literal and an interpretable meaning,"is a 'sound' original, or reliable copy, of known authorship",D,False,0.3725891709327698,0.1994326114654541,0.2901727259159088,0.13706791400909424
Which of the following is not a consequence of global tourism?,decreased rates of prostitution and sex tourism,developing countries can depend on it as a crucial source of income,"the exploitation of cheap, unregulated labour in poor countries",we have become more aware of 'other' societies and ways of living,A,False,0.006026189308613539,0.034678325057029724,0.8943657875061035,0.06478764116764069
Which of the following did Thatcher's government not strive to achieve:,marketization and privatization,"individual freedom, choice and responsibility","generous financial benefits for single parents, students and the unemployed",the rolling back of the welfare state,C,True,0.010319116525352001,0.024754272773861885,0.9288972020149231,0.03601725399494171
One of the ethical problems with covert participant observation is:,not being able to write comprehensive fieldnotes or record conversations,deceiving the respondents as to the reason for your presence,observing people outside of their natural setting,subjecting the participants to physical harm,B,False,0.022418279200792313,0.11384941637516022,0.8412397503852844,0.022418279200792313
The embourgeoisement thesis suggests that:,capitalists are being replaced by salaried managers with bureaucratic authority,the affluent working class is adopting middle class values and ways of life,white collar occupations are being 'deskilled' by the introduction of new technologies into the workplace,the class structure has fragmented and there are no longer any distinct social classes,B,False,0.13760274648666382,0.22686859965324402,0.6166927218437195,0.01862250827252865
Women have been excluded from the public sphere because:,industrial capitalism separated the middle class home from the workplace,those who enter paid employment have been 'sidelined' into particular fields,it is difficult to succeed in 'malestream' politics without compromising their femininity,all of the above,D,True,0.3640209138393402,0.012456110678613186,0.02327107824385166,0.6001690030097961
