0,1,2,3,4,5,correct,choiceA_probs,choiceB_probs,choiceC_probs,choiceD_probs
Patterns of drug use in Britain reveal that:,it has increased and is no longer confined to a hedonistic youth subculture,the most commonly used recreational drug is Ecstasy,teenage girls are more likely to experiment with hard drugs than teenage boys,"despite a series of moral panics, the use of illegal drugs is very rare",A,False,0.015847215428948402,0.117095947265625,0.6738407015800476,0.19305859506130219
Murray thought that the 'underclass' consisted of people who:,formed an inferior 'race' with low levels of intelligence,lived morally unsound lives of crime and squalor,were too reliant upon welfare benefits,all of the above,D,True,0.21180987358093262,0.022324595600366592,0.11337364464998245,0.6524203419685364
"Religious organizations such as the Church of Norway, Islam, the Church of England, and the Church of Greece have which of the following characteristics in common?",They are cultures as well as churches.,They practice separation of church and state.,They exclude women as clergy.,They are monotheistic.,D,False,0.11061272025108337,0.20665179193019867,0.6365323066711426,0.04611025005578995
"A researcher mailed 1,000 questionnaires to members of a labor union and received 300 back. Most of those who returned the questionnaires indicated that they were dissatisfied with the union. Results based only on the returned questionnaires are most likely contaminated by",response rate bias,researcher bias,confusing correlation and causation,statistical regression,A,False,0.0303023848682642,0.08237042278051376,0.6896790862083435,0.19759637117385864
Role-learning theory suggests that,we internalise and take on social roles from a pre-existing framework,we create and negotiate our roles through interaction with others,social roles are not fixed or stable but fluid and pluralistic,roles have to be learned to suppress unconscious motivations,A,False,0.001762631582096219,0.08492834120988846,0.9130657315254211,0.0002385462139500305
Post-modernist writers have argued that:,"we live in a world of superficial, fragmented images",no theory is better than any other: 'anything goes',society has changed and we need new kinds of theory,all of the above,A,False,0.007702490780502558,0.009890193119645119,0.6933560967445374,0.28903380036354065
"Leroy visits his parents, who live in a primarily African American working-class neighborhood. During his visit, he notices that the community is changing. Several developments have been built to accommodate single-family homes, and upscale shopping centers have been added. While Leroy appreciates these changes, he is worried that his parents will not be able to afford to continue living in their neighborhood because property values are rising. Which of the following best explains what is happening to Leroy's old neighborhood?",Gentrification,Urbanization,White flight,The demographic transition,A,False,0.0362350232899189,0.02490394376218319,0.9345135688781738,0.004327656701207161
Warner's study of the city of Natchez in the American Deep South showed that the 'colour line' there was:,no longer a powerful influence upon race relations,a way of marking out the land so that black people had less space for housing,a new policy that had been introduced to assimilate black and white groups,"a sharp division between black and white castes, underpinned by beliefs about white superiority",D,False,0.005861042533069849,0.08090919256210327,0.8698558807373047,0.04330757260322571
The social construction of childhood can be traced back to:,the introduction of compulsory education,increasingly emotional ties between parents and children,"new consumer goods for children, such as clothes, toys and books",all of the above,D,False,0.5113045573234558,0.07841109484434128,0.39820441603660583,0.012024731375277042
"In Marx's theory, the 'mode of production' means:",the way in which products are made in a factory,the average measure of productivity under capitalism,the organization of a society's technical and human resources,an integral part of the superstructure of a society,C,True,0.26387953758239746,0.299014687538147,0.43506380915641785,0.002014745259657502
The trend of decarceration involves:,community alternatives to imprisonment and institutional care,the increased use of imprisonment as the main form of punishment,transferring the management of prisons to private companies,decentralized organization due to the mobility of capital,A,False,0.06254711747169495,0.13241223990917206,0.7619799375534058,0.042987968772649765
The work of Smart suggested that:,the rates of violent crime were similar for men and women,women's sexual delinquency was more likely to be normalized than men's,women's criminal behaviour tended to reflect traditional gender roles,all of the above,C,True,0.3342852294445038,0.07458911091089249,0.5511431097984314,0.03992467746138573
Allen's (2001) study of nurses showed that:,nurses perform a great deal of emotional labour for which they are not paid,the policies of Project 2000 had the effect of de-professionalising the career of nursing,"more men were moving into nursing, which challenges some of the prevailing stereotypes about the occupation",the role of the nurse was ambiguous and had to be constantly redefined in the context of everyday interactions with other staff and patients,D,False,0.09459167718887329,0.42393046617507935,0.37411731481552124,0.10718640685081482
Which of the following best describes the practice of placing the blame for the problems of a society on one particular group?,Ethnocentrism,Stereotyping,Scapegoating,Institutionalization,C,True,0.001453825505450368,0.0257696732878685,0.966999888420105,0.005749991163611412
"Dahrendorf, Rex, and Habermas focused their attention on:",social solidarity and cohesion,the interpretive understanding of action,women's experiences and gendered knowledge,"power, domination, and conflict",D,False,0.027285119518637657,0.06545360386371613,0.9035590887069702,0.0036926395259797573
Sreberny-Mohammadi (1996) argues that national cultures can resist American cultural domination of the media by:,"domesticating its content, including more 'home-produced' programmes",controlling the distribution of imported products by banning satellite dishes,creating 'reverse flows' of their own programmes back to imperial societies,all of the above,D,False,0.3068065941333771,0.11286784708499908,0.3939474821090698,0.18608762323856354
Mulholland (1998) argued that privatization changed the relationship between companies and managers in that:,flexibility was reduced by the introduction of detailed daily worksheets,the state had greater control than managers over production processes,ownership was transferred from small shareholders to senior managers,employment depended on performance rather than trust and commitment,D,False,0.4143409729003906,0.2513104975223541,0.2847720980644226,0.04948597401380539
Which of the following is consistent with results of current research conducted in the area of gender roles and the workplace?,"In about a quarter of households with children, men stay home with the children so their wives can work.","Most women believe that there is equal opportunity today between men and women in career choice, advancement, and income.",Most men believe that women should be homemakers because men earn more money.,Most men married to working women do not share housework and childcare obligations equally with their working wives.,D,False,0.017341455444693565,0.14519822597503662,0.7373774647712708,0.09979318827390671
Socialization is:,the formation of an attachment bond between an infant and its carer,a tendency of social theorists to explain everything in terms of social causes,the process of becoming part of a society by learning its norms and values,the historical process by which societies change from traditional to modern,C,True,0.003111206227913499,0.017903754487633705,0.9775118827819824,0.0014696295838803053
The term 'assets' refers to:,the culturally valued commodities and standards of living that make the poor feel relatively deprived,the flow of money a person receives from their salary or wage,"a stock of economic resources, including land, shares and bank deposits",the 'slices' of the population who own differing amounts of wealth,C,True,0.018573857843875885,0.0832422599196434,0.8949386477470398,0.0032276527490466833
"In the traditional hierarchy of status and precedence, which of these members of the upper class are in the right order (from highest to lowest status)?","Prime Minister, Archbishop of York, Viscounts of England","Marquesses of England, Earls of Great Britain, King's Brothers","Esquires, Serjeants of Law, Dukes' Eldest Sons","King's Grandsons, Lord High Treasurer, Companions of the Bath",D,False,0.6568974852561951,0.24165910482406616,0.10073849558830261,0.0006787706515751779
Social norms are:,"creative activities such as gardening, cookery and craftwork",the symbolic representation of social groups in the mass media,religious beliefs about how the world ought to be,rules and expectations about interaction that regulate social life,D,False,0.03614189475774765,0.12614761292934418,0.8225857019424438,0.015066183172166348
The 'nuclear family' means:,a group of people sharing living accommodation and meals,a network of relatives extended within or between generations,the new family created when an adult leaves home and gets married,a two generation unit of parents and their children,D,False,0.043978169560432434,0.0639878660440445,0.8833251595497131,0.008659815415740013
The rise of new social movements indicates that:,people vote according to pragmatic issues and concerns,consumer identities are more important than class identities,"personal, cultural and environmental issues can mobilise political consciousness just as much as economic interests",all of the above,D,False,0.0031609281431883574,0.0027895092498511076,0.9931340217590332,0.0009056210401467979
Which of the following sociological perspectives views society as a system of interdependent and coordinated parts?,Functionalism,Conflict theory,Symbolic interactionism,Role theory,A,False,0.0016532300505787134,0.02282213605940342,0.9704218506813049,0.005092306528240442
Post-Fordist forms of media production and consumption involve:,the mass production of standardized products for passive audiences,television based on producer-broadcaster rather than publisher-broadcaster models,a diverse range of products aimed at niche markets,increasing numbers of advertisements for motoring and car-related products,C,True,0.039497777819633484,0.29185131192207336,0.6178492307662964,0.05071615055203438
Marx said that the development of the labour movement through factory-based production would turn the working class into:,a class in itself,a class by itself,a class for itself,a ruling class,C,True,0.04456408694386482,0.15554392337799072,0.7899172902107239,0.009943591430783272
"In stage 3 of the 'health transition', the main causes of illness and death are:","acute, infectious diseases such as typhus, measles and cholera",respiratory diseases such as pneumonia and asthma,"chronic, degenerative diseases, such as cancer, heart disease, and strokes",too diverse to put into one category,C,True,0.11853966116905212,0.09231878072023392,0.7729756832122803,0.016042597591876984
Sociologists like Bordo (1993) have attributed the 'epidemic' of anorexia in Western cultures to:,"a generally ascetic, frugal lifestyle that can be taken to extremes","traditional images of women as emotional, domesticated, and unassertive","the social construction of mental illness, through which 'normal' patterns of behaviour are pathologized","the new ideal of independent, self-assured femininity, combined with cultural values of achievement and control",D,False,0.04866379126906395,0.05514329671859741,0.8625863194465637,0.03344609960913658
One of the difficulties in 'operationalizing' concepts like social class is that:,"definitions and indicators can vary, making valid comparisons problematic",there are no reliable indicators of such widely contested ideas,it takes all the fun out of armchair theorising,"it has little use for applied, empirical research about the topic",A,False,0.24690380692481995,0.31703075766563416,0.2178918570280075,0.2178918570280075
"In the 1990 reform of the National Health Service, hospitals became:",self-governing trusts competing for purchasing contracts from health authorities,"state-controlled providers, dependent on funding from the central government",increasingly detached from health authorities and providers of private health care,"less inclined to run themselves efficiently, as demand for health care was falling",A,False,0.043072834610939026,0.1703563630580902,0.7634842395782471,0.023055225610733032
Law and order was privatized in the 1980s and 1990s through:,the expansion of private security companies,the building of private prisons,the introduction of market disciplines to measure police performance,all of the above,D,False,0.659372091293335,0.07875076681375504,0.2140667736530304,0.04776475578546524
The 'correspondence principle' (Bowles & Gintis) suggests that:,schools prepare children for work by teaching them to be obedient,teachers and parents tend to have similar attitudes to learning,children who write lots of letters develop a better grasp of language,boys' and girls' educational achievements have recently become similar,A,False,0.05582049489021301,0.17193923890590668,0.6001269221305847,0.17193923890590668
Class segregation was apparent in mid-twentieth century Britain insofar as:,middle class owner-occupiers moved into the inner city through gentrification,"working class communities formed in the inner cities, while the middle classes moved out to the suburbs",the middle classes lived in the countryside while the working class lived in the city,"the upper and middle classes dominated public space, while working class people were more home-centred",B,False,0.11627794057130814,0.24616040289402008,0.5211215615272522,0.11627794057130814
Charles Cooley's theory of the looking-glass self emphasizes,the manner in which young children come to a realization that they have a separate identity,the difficulty one experiences in seeing oneself as others do,how one's self-concept is based on one's perception of how others see one,how one's self-concept is heavily influenced by one's physical appearance,C,True,0.018506594002246857,0.08294079452753067,0.8916976451873779,0.006808194797486067
Queer Theory makes the claim that:,heterosexuality is the normal and most desirable way to be,"the sexual categories and discourses we use are based upon true, underlying biological differences",deviant forms of masculinity are seen as more threatening to the gender order than deviant forms of femininity,"all sexualities are pluralistic, fragmented and frequently reconstructed",D,False,0.07883048802614212,0.4536381661891937,0.4536381661891937,0.01369868591427803
Scott (1991) introduced the term 'power elite' to describe:,"the ruling class, or bourgeoisie, who exploit the proletariat",a capitalist class dependent on property ownership and advantaged life chances,an alignment of classes with shared interests but no state power,a state elite whose members are drawn overwhelmingly from a power bloc,D,False,0.36787497997283936,0.416856974363327,0.19690929353237152,0.01831541769206524
"A sociologist is conducting research on institutional power relations at a local hospital. The sociologist is on staff at the hospital for several weeks, recording data as field notes. This method of research is called",experimentation,secondary data analysis,participant observation,survey administration,C,True,0.006429029628634453,0.028812911361455917,0.9541525840759277,0.010599678382277489
"In Symbolic Interactionist theory, Mead defined the 'generalized other' as:",the group of structural theories of society that he was reacting against,the overall impression of ourselves that we try to give off to others,a significant figure in early childhood who teaches us the general values of society,an image of how people in the wider society might perceive our behaviour,D,False,0.044274382293224335,0.2547815144062042,0.4759944975376129,0.22484388947486877
"According to Davis (1995), women may seek cosmetic surgery because:",they have a deep-rooted sense of ineffectiveness and are striving for control,"they are in pursuit of the 'perfect' body, fuelled by images of beauty","they perceive a part of their body as stigmatizing, in relation to a cultural ideal",their male partners pressurize them to look like supermodels,C,True,0.005045886617153883,0.032903313636779785,0.9615757465362549,0.00046934059355407953
Marx (1844) claimed that capitalism had alienated workers from:,the product they were making,the production process,each other and humanity in general,all of the above,D,False,0.3592982292175293,0.14977778494358063,0.4613480567932129,0.029492994770407677
Herberg's (1955) study of religion in America suggested that:,ethnic minorities practised religion to achieve social acceptance in the culture,mainstream faiths were becoming increasingly identified with national identity,the moral teachings of the main religions were becoming relatively similar,all of the above,D,False,0.7175472974777222,0.07562892884016037,0.20558075606822968,0.0012224279344081879
Structural-Functionalists describe society as:,a complex network of interaction at a micro-level,"a source of conflict, inequality, and alienation",an unstable structure of social relations,a normative framework of roles and institutions,D,False,0.02518387883901596,0.028537074103951454,0.9450181126594543,0.0012538314331322908
Booth's (1901) study revealed that the percentage of people in London who were living in poverty was:,30.70%,27.50%,18.60%,33.20%,A,False,0.027958126738667488,0.040678832679986954,0.9258459806442261,0.005505281034857035
Traditional working class identity was based around:,shared working conditions in the manufacturing industry,the class consciousness of members of the proletariat,"local communities, extended kinship networks and shared leisure pursuits",collective aspirations to move into the middle class,C,True,0.22206665575504303,0.17294567823410034,0.5327101945877075,0.07209448516368866
Bernstein thought that using 'restricted codes' of language disadvantaged pupils at school because:,this pattern of speech made them the target of bullying,"they referred to explicit, context independent meanings",they prevented children from communicating outside of their peer groups,"they involved short, simple sentences with a small vocabulary",D,False,0.17196984589099884,0.10430499166250229,0.6801539659500122,0.04348078742623329
Telework is a form of employment that involves:,running one's own business through telephone helplines or hotlines,"working at home for an outside employer, using information technology","babysitting and other jobs within a local network, through the informal economy",combining non-manual work with the leisure activity of watching television,B,False,0.14702048897743225,0.2423958033323288,0.5814772844314575,0.028950050473213196
Frank (1967) made the claim that 'underdeveloped' societies were:,insufficiently involved in the international capitalist economy,reluctant to surrender their traditional ways of life,economically dependent on the wealthy countries that exploited them,the 'metropoles' to which 'satellite' countries were attached,C,True,0.1350628137588501,0.3239988386631012,0.5341838002204895,0.006724381819367409
The case of the former Soviet Union supports Kerr et al.'s (1960) claim that:,totalitarian regimes are incompatible with the requirements of advanced industrial technology,democratic governments serve the interests of a ruling elite,advanced industrial technology strengthens the power of totalitarian regimes,communist societies disperse power between various political parties,A,False,0.06128987669944763,0.2746821641921997,0.6589282751083374,0.0050309794023633
The print revolution of the nineteenth century resulted in:,"mass production, mass circulation, and the decline of serious content",the public ownership of newspapers as a shared resource,more people going to the cinema as a new leisure activity,a reduction of 'virtual communities' on the Internet,A,False,0.09368675202131271,0.28857553005218506,0.6109143495559692,0.006786645855754614
The term 'feminist standpoint' suggests:,taking a stand on the issues neglected by feminism,studying society from the perspective of women,the recognition of difference and diversity in women's lives,a tendency to ignore the gendered nature of knowledge,B,False,0.0026514253113418818,0.05325530096888542,0.9439727067947388,0.00011649548832792789
Ethnographic research produces qualitative data because:,the findings are amenable to statistical analysis,it is conducted over a period of several years,"it uncovers rich, detailed accounts from an insider's perspective",it compares findings from a number of different cases,C,True,0.01005053985863924,0.08415212482213974,0.904720664024353,0.0010593190090730786
Marx proclaimed that religion would disappear when:,a new trend of moral individualism became established,a socialist revolution removed the need for capitalist ideology,church attendance dropped below 15%,people came to believe more in science and technology,B,True,0.093685582280159,0.610906720161438,0.28857189416885376,0.006786561105400324
Which of the following is not a feature of globalization?,an increasing awareness of the world as a whole,the extended power of nation states,the destruction of distance through communications technologies,the stretching of social relations beyond national boundaries,B,False,0.005145221017301083,0.0488165020942688,0.8652931451797485,0.0804848000407219
Someone who gains a higher (or lower) social position than he or she was born into has experienced,absolute poverty,relative poverty,vertical mobility,horizontal mobility,C,True,0.003831493901088834,0.02498447708785534,0.8273722529411316,0.14377573132514954
A survey should avoid asking:,fixed-choice questions,short questions,leading questions,funnelled questions,C,True,0.013906958512961864,0.0550030879676342,0.8603931069374084,0.07062536478042603
"The theory of development which suggests that societies move from traditional to modern, industrial forms of organization is called:",Westernization theory,Modernization theory,Industrialization theory,Dependency theory,B,False,0.08814689517021179,0.11318285763263702,0.7380449175834656,0.06058241426944733
"In modern societies, social status is typically measured by a person's:",age,income,verbal fluency,occupation,D,False,0.04294558987021446,0.35957902669906616,0.2800404131412506,0.3173273503780365
Sociology differs from common sense in that:,it focuses on the researchers' own experiences,it makes little distinction between the way the world is and the way it ought to be,its knowledge is accumulated from many different research contexts,it is subjective and biased,C,True,0.0007766522467136383,0.025719190016388893,0.9651054739952087,0.008349798619747162
World-affirming religions:,embrace conventional cultural values but offer new means of achieving them,react against the loss of any meaningful religious content in the teachings of churches,adopt an attitude of mild disapproval towards mainstream social values,reject both the goals and means of conventional society and provide utopian alternatives,A,False,0.007917690090835094,0.04556316137313843,0.915160596370697,0.03131507337093353
The 'extension pattern' that Parker (1976) identified was said to be:,"the lifestyle of clerical and unskilled manual workers, who saw leisure time as a chance to escape from alienating work","characteristic of professionals and skilled workers, whose work interests spilled over into leisure time","a neutral balance between work and leisure as neither connected nor oppositional, as evidenced by semi-skilled manual and clerical workers",the tendency of students to leave essay-writing until the last minute and then ask for an extended deadline,B,False,0.017022842541337013,0.08644913136959076,0.8202065229415894,0.07629108428955078
Weber defined a 'class situation' as:,the exploitation of the working class by their capitalist employers,a social group's consciousness of their status and life chances,"a person's position in the capital, product and labour markets, based on their economic resources","the lifestyle of a social class, as defined by patterns of consumption",C,True,0.030611379072070122,0.07343287765979767,0.8945956230163574,0.0013449700782075524
The introduction of market principles to educational policy in the 1980s resulted in:,more funding for students in higher education,the delegation of power and budgetary control to LEAs,a reduction in parental choice of school,increased state regulation through national testing and inspections,D,False,0.025623012334108353,0.1474502682685852,0.5146519541740417,0.3121522068977356
Smith & Tomlinson argued that:,differences in ethnic background were more significant than class or gender in predicting educational achievement,racism in schools undermined the move towards equality of opportunity for children from ethnic minorites,school character far outweighed ethnic background in determining educational success,gender differences in educational achievement could be attributed to inequalities of class,C,True,0.01850675791501999,0.08294153958559036,0.8917055726051331,0.006808255799114704
The 'post-industrial society' identified by Bell (1973) involved:,the increasing power of trade unions in resolving industrial disputes,a resurgence of interest in industrial production and manufacturing,"a shift towards a service economy, based on knowledge and information",all of the above,C,True,0.3491498827934265,0.06875169277191162,0.5756508708000183,0.006394903641194105
