0,1,2,3,4,5,correct,choiceA_probs,choiceB_probs,choiceC_probs,choiceD_probs
"According to the Ideal Moral Code theory, one is obligated to do what the ideal moral rules would require:",in one’s actual institutional setting.,in an ideal institutional setting.,in a setting devoid of institutions.,in a world in which everyone complied with those rules perfectly.,A,True,0.5104634165763855,0.3508360683917999,0.1290653645992279,0.009349464438855648
"According to Cicero, the most practical branch of philosophy deals with:",logic.,natural science.,moral duties.,expedience.,C,True,0.14039450883865356,0.14039450883865356,0.7129822373390198,0.00616850471124053
"According to Socrates, the value or quality of one's life depends on understanding the principles of, or basic rationale for human existence.  Without such knowledge (he suggests) life lacks virtue, because:",acting virtuously means acting in way that is informed about what one is doing and why.,someone who does not understand existence philosophically could never do anything right.,to have the power or ability to do anything at all requires that we know what we are doing.,not only is virtue knowledge but also the unexamined life is not worth living.,A,True,0.718002200126648,0.08575313538312912,0.11010921001434326,0.08575313538312912
Rawls claims that students with fewer native assets (such as intelligence) should be given:,more attention and resources than those with more native assets.,the same level of attention and resources as those with more native assets.,less attention and fewer resources than those with more native assets.,virtually no educational resources.,A,True,0.3888717591762543,0.2081480622291565,0.3431781232357025,0.05963541939854622
Nussbaum claims that the specification of particular virtues:,will always consist of a single answer.,might sometimes turn out to be a disjunction.,is necessarily relative to a culture.,can be settled in such a way as to be no longer revisable.,B,False,0.16719987988471985,0.1014118492603302,0.21468889713287354,0.5150119066238403
"According to Rawls, we can enter the original position:",only by leaving society and remaking social institutions from scratch.,"at any time, by simply following a certain procedure.","only if we somehow forget who we are, which is very rare.",none of the above.,B,False,0.4179028272628784,0.17420782148838043,0.32546305656433105,0.08228994160890579
Mill argues that virtue:,is not desirable.,is desirable only as a means to one’s own happiness.,is desirable only as a means to the happiness of others.,is desirable as part of one’s happiness.,D,False,0.22444796562194824,0.07286758720874786,0.6913484334945679,0.011174606159329414
Bentham claims that utilitarian calculations:,should be performed prior to each action.,"need not be performed before each action, but should always be kept in mind.","are merely a formal device, and do not have practical application.",are fundamentally flawed.,B,False,0.593148410320282,0.037918709218502045,0.21820713579654694,0.14997141063213348
Nussbaum claims that for Aristotle the reference of each virtue term is fixed by:,conventional use.,grounding experiences.,a thick description of the virtue.,tradition.,B,False,0.09853170812129974,0.12651720643043518,0.7280563116073608,0.04654308035969734
"According to Gauthier, deliberative justification:",is refuted by moral requirements.,is replaced once we acknowledge moral requirements.,refutes morality.,ignores morality and seemingly replaces it.,D,False,0.038859110325574875,0.026707449927926064,0.7805061340332031,0.15369075536727905
Nussbaum claims that recent anthropological work has shown that fear is:,partially learned and culturally variant.,universally experienced in roughly the same way.,not present in certain societies.,none of the above.,A,False,0.1099838837981224,0.0970604345202446,0.7171849608421326,0.07559073716402054
"Of the ways of escaping moral arguments that he discusses, Hare claims:",none of them are successful.,"some, but not all of them are successful.",all are entirely successful.,"all might be successful, but at a price.",D,False,0.07620643079280853,0.07620643079280853,0.8192963600158691,0.02803477831184864
Most of those who take the externalist approach to meaning view the matter from a _____ standpoint.,secular,nonreligious,religious,pragmatic,C,True,0.04022657126188278,0.06632240116596222,0.7130330204963684,0.18028298020362854
"According to Hume, reason:",should serve our passions.,should operate completely independently of our passions.,should be used to direct our passions.,should be used to extinguish our passions.,A,False,0.1345134675502777,0.11870771646499634,0.6831157803535461,0.06353966146707535
"In response to the argument that famine relief is counterproductive because it leads to overpopulation, Singer claims that:",this has empirically been shown to be false.,"this is true, but should not be of moral concern to us.",this is a reason to give money to population control efforts.,there is no such thing as “overpopulation.”,C,True,0.015522394329309464,0.006470697000622749,0.9603365659713745,0.017589177936315536
Of the two versions of the principle that Singer considers:,he considers the stronger version to be correct.,he considers the weaker version to be correct.,he ends up rejecting them both.,he claims that they are equivalent.,A,False,0.03403167054057121,0.03856293484568596,0.8776883482933044,0.04951579123735428
"According to the scripture that Butler discusses in Sermon One, human beings are:",independent and autonomous individuals.,all a part of one body.,all a part of God.,part of the animal kingdom.,B,False,0.2737818956375122,0.05391085520386696,0.6567686796188354,0.015445718541741371
At first Descartes supposes that everything he sees is _____.,TRUE,FALSE,part of him,undeniable,B,False,0.10629145056009293,0.08277986943721771,0.1985785961151123,0.6116651296615601
"According to Socrates, just as there is a difference between what an ironic statement says and its true meaning, so also appearances differ from reality.  Even though societies or individuals appear to differ about what is required for the good life, that in no way contradicts the fact that:","what is right or wrong, true or false varies from one culture to another.",appearances are the only real way we have for knowing reality.,the distinction of appearance and reality is the basis for the dialectical discovery of truth.,there are objective principles for thought and action that are required for the good life.,D,False,0.23639830946922302,0.11166663467884064,0.6425971388816833,0.009166155941784382
An example of a morally impossible rule would be:,lie whenever doing so is necessary to prevent a catastrophe.,always do whatever brings about the greatest happiness.,always assert what you don’t think to be the case.,all of the above.,C,True,0.3342243432998657,0.0745755285024643,0.5510427951812744,0.03991740569472313
"According to Locke, every man, by consenting with others to make one body politic under one government, puts himself under an obligation to everyone of that society to submit to the determination of_____.",the majority,the king,the judges,his own will,A,False,0.09638449549674988,0.05159090459346771,0.5546544790267944,0.2968851625919342
Bentham claims that nature has placed mankind under two sovereign masters:,pain and pleasure.,good and evil.,God and the devil.,duty and self-interest.,A,True,0.49756962060928345,0.052443452179431915,0.4391036629676819,0.010326728224754333
The biblical account of the soul is at odds with _____.,a unitary concept of the soul,the identity theory,soul-body dualism,the idea of a monistic soul,C,True,0.07792661339044571,0.1455860733985901,0.7393471002578735,0.036809924989938736
"According to Aristotle, happiness is:",a state of mind.,a feeling or sensation.,a craft.,activity of the soul in accordance with virtue.,D,False,0.10830587893724442,0.20234204828739166,0.5500226616859436,0.13906751573085785
Mill says that the ultimate end of utilitarianism is an existence as free of pain as possible and as rich as possible in _____.,lower pleasures,spiritual attainment,social achievement,enjoyments,D,False,0.019042925909161568,0.035576868802309036,0.9175395369529724,0.0277072936296463
What was Schopenhauer's attitude toward life?,He thought life was uncertain but worthwhile.,He thought life was hard but ultimately hopeful.,He thought life was bereft of meaning.,He believed in an afterlife in which all misery vanishes.,C,True,0.20278985798358917,0.12299825996160507,0.37886133790016174,0.2950575053691864
"When it comes to defining good, Moore claims that many past philosophers are guilty of:",begging the question.,circular reasoning.,the naturalistic fallacy.,the ad hominem fallacy.,C,True,0.3359854519367218,0.2616657316684723,0.38072139024734497,0.02147883176803589
"According to Aristotle, we should begin ethical inquiry by specifying:",which things are intrinsically valuable.,the aim of human life.,what our fundamental duties are.,what constraints on behavior it would be reasonable to agree to.,B,False,0.39947792887687683,0.18870002031326294,0.39947792887687683,0.012063187547028065
"According to Epicurus, the wealth required for a good life is:",easily procured.,"attainable for everyone, but only through great effort.",available only to the rich.,available only to the gods.,A,False,0.14450384676456451,0.23824657499790192,0.504368007183075,0.11253971606492996
Feinberg claims that the story about Abraham Lincoln:,provides some evidence for psychological egoism.,provides some evidence against psychological egoism.,provides no evidence for or against psychological egoism.,actually involves a confusion between ethical egoism and psychological egoism.,B,False,0.18743538856506348,0.08853821456432343,0.5773416757583618,0.14597482979297638
"According to d'Holbach, all the mental and moral attributes that people think are evidence for an immaterial soul are in fact _____.",purely intellectual,purely physical and natural,ethereal,undetermined,B,False,0.010828168131411076,0.025975426658988,0.8601879477500916,0.10273480415344238
Hare claims that a person who refuses to make any positive moral judgments:,is irrational.,is immoral.,cannot coherently invoke morality to protect one’s own interests.,couldn’t possibly exist.,C,False,0.10832672566175461,0.08436492830514908,0.37809741497039795,0.42844051122665405
Hobbes claims that all of the laws of nature can be summarized in the precept:,maximize happiness.,never treat another person as a means to your ends.,do not do to another what you would not have done to yourself.,practice virtue in all that you do.,C,True,0.052978914231061935,0.007169915363192558,0.9390736818313599,0.000755703600589186
"In Aristotle’s view, the virtues are:",acquired through habit.,acquired through philosophical reflection.,a gift from the gods.,innate.,A,False,0.12487978488206863,0.18169903755187988,0.6341919302940369,0.0589890331029892
Mill claims that the distinction between justice and other moral obligations corresponds perfectly to the distinction between:,perfect and imperfect obligations.,positive and negative duties.,strong and weak duties.,absolute and relative obligations.,A,False,0.35186704993247986,0.24183446168899536,0.39871761202812195,0.007302768062800169
Descartes declares that an evil demon _____.,undoubtedly exists,could not possibly exist,could possibly be deceiving him,must exist if God exists,C,False,0.33599013090133667,0.09626279026269913,0.33599013090133667,0.23092243075370789
"During his trial, Socrates argues that he would never intentionally corrupt others because:",it is his duty not to do so.,"this would make them vicious, and they would then harm him.",he would be likely to get caught if he did so.,he would not know how.,B,False,0.8528635501861572,0.0424615740776062,0.10186002403497696,0.002714477712288499
"According to Kant, laws of nature are laws according to which __________, and laws of freedom are laws according to which __________.",everything will happen; everything will happen,everything will happen; everything ought to happen,everything ought to happen; everything will happen,everything ought to happen; everything ought to happen,B,False,0.03470372408628464,0.030625928193330765,0.8950208425521851,0.03932447358965874
"Augustine claims that to be happy, one must know:",the causes of natural occurrences.,the causes of good and evil.,both a and b.,neither a nor b.,B,False,0.048185668885707855,0.007389511447399855,0.85411137342453,0.09002267569303513
"According to Wolf, a moral saint:",cannot read Victorian novels.,cannot have a sarcastic wit.,cannot have an interest in gourmet cooking.,all of the above.,B,False,0.11647956073284149,0.012276856228709221,0.27941998839378357,0.5915320515632629
"According to Socrates, justice is when a soul is ruled by its:",respect for the law.,rational part.,desire for honor.,none of the above.,B,False,0.22494781017303467,0.10625780373811722,0.6114714741706848,0.05687570571899414
Singer claims that his conclusions are similar to those of:,Plato.,Aristotle.,Thomas Aquinas.,Immanuel Kant.,C,True,0.3719521462917328,0.17569775879383087,0.4214770197868347,0.030531693249940872
"In Cicero’s view, each person is invested by Nature with two characters:",universal and individual.,virtuous and vicious.,good and evil.,divine and beastly.,A,False,0.29102352261543274,0.22664935886859894,0.4798166751861572,0.002221992239356041
Aristotle saw his theory of the virtues as:,final and complete.,open-ended and revisable.,relative to his culture.,applicable only to himself.,B,False,0.0791558176279068,0.16757287085056305,0.5848867893218994,0.16757287085056305
"Nussbaum claims that in cross-cultural communication, inhabitants of different conceptual schemes tend to view their interaction:",in a relativist way.,in an absolutist way.,in a Kantian way.,in an Aristotelian way.,D,False,0.14261050522327423,0.04629885405302048,0.7242359519004822,0.08649765700101852
Cicero claims that there could be “no more pernicious doctrine” than the idea that:,the gods do not care what we do.,a thing may be expedient without being morally right.,moral rightness is relative to one’s culture.,it is sometimes permissible to lie.,B,False,0.7522819638252258,0.1481330841779709,0.07928992807865143,0.020047634840011597
An important moral criterion of adequacy is known as _____.,simplicity,consistency with our considered moral judgments,fruitfulness,fallibility,B,False,0.0037323881406337023,0.03125090152025223,0.9132852554321289,0.05152403190732002
Gauthier claims that moral agreements that are equally favorable to all parties are desirable because they:,satisfy our desire for fairness.,satisfy the conceptual constraint against exploitation.,maximize the productivity of society.,invite the stable compliance of everyone.,A,False,0.3301748037338257,0.22692561149597168,0.4239528179168701,0.018627187237143517
Baier argues that moral rules:,always must be applied to everyone alike.,must applied to everyone alike in the absence of morally relevant differences.,only apply to some members of a group.,are the same in every society.,B,False,0.34751006960868835,0.09956329315900803,0.5056241750717163,0.04703037068247795
Anscombe claims that an adequate moral psychology would include:,an answer to the mind-body problem.,analyses of concepts such as “action” and “intention.”,an explanation of how free will is possible.,all of the above.,B,False,0.4422335922718048,0.0870809555053711,0.4422335922718048,0.02827104739844799
"According to Parfit, the obligation to give priority to the welfare of one’s children is:",agent-relative.,agent-neutral.,absolute.,none of the above.,A,False,0.048709943890571594,0.08030911535024643,0.863404393196106,0.007469911593943834
Epictetus recommends that we act:,according to our passions.,"so as to do whatever comes naturally, without much thought.",only after careful reflection on the consequences of our actions.,so as to benefit the greatest number.,C,True,0.13074848055839539,0.07930296659469604,0.7524056434631348,0.037460070103406906
"Descartes says that, for all he knows, he may be _____.",dreaming,a god,infallible,perfect,A,False,0.02030099928379059,0.02606699988245964,0.593282163143158,0.35984382033348083
"When Euthyphro attempts to define the holy as prosecuting wrongdoers, Socrates objects that:",there are many other things that are also holy.,prosecuting wrongdoers is not always holy.,there is disagreement about what counts as “wrongdoing.”,all of the above.,A,False,0.19475144147872925,0.020526651293039322,0.10424293577671051,0.6797493100166321
Wolf claims that morality:,is merely a cultural artifact.,is not really relevant to our lives.,provides a comprehensive guide to conduct.,none of the above.,D,False,0.05182082951068878,0.02160213515162468,0.9185461401939392,0.007946981117129326
"According to Bentham, considerations of pain and pleasure determine:",what we ought to do.,what we will do.,both a and b.,neither a nor b.,C,True,0.03470563143491745,0.01276748813688755,0.8950700163841248,0.057219911366701126
Augustine claims that all created things are:,eternally and unchangeably good.,"good when taken together, but not good separately.","good, even taken separately.",none of the above.,C,True,0.25222569704055786,0.04383024573326111,0.6856204271316528,0.01827116496860981
"In Augustine’s view, lying is:",often permissible if done for the right reasons.,"not evil in itself, although it can have bad consequences.",permissible only in very rare circumstances.,never permissible.,D,False,0.30134639143943787,0.07619229704141617,0.5629891157150269,0.05933861806988716
"Whereas the social sciences (e.g., psychology, sociology, economics) ask questions about how people think and act, philosophy is the study of:",how people with different beliefs or backgrounds disagree with one another.,what beliefs mean and whether people with different beliefs are justified in having them.,the reasons why philosophic questions never have better or worse answers.,questions that can be answered better by appealing to scientific experiments.,B,False,0.35038650035858154,0.18754838407039642,0.4499051868915558,0.011989566497504711
" Plato indicates that the knowledge of pure reason is preferable to conceptual understanding, because knowing that something is a certain kind of thing is not as good as knowing:",how we come to learn what to call a thing in virtue of our own experiences.,"the logos or rationale of the thing, that is, why it is the way it is.",why we differ among ourselves about what we claim to know.,the difference between knowledge and opinion as outlined in Plato's divided line image.,B,False,0.5725733041763306,0.08780696988105774,0.2704645097255707,0.06838413327932358
"According to Socrates, a clear sign that a person has _____ is her exclusive pursuit of social status, wealth, power, and pleasure.",philosophical ambition,worldly wisdom,exceptional desires,an unhealthy soul,D,False,0.053247395902872086,0.06033720821142197,0.8329294323921204,0.053247395902872086
Philo says the analogy that Cleanthes uses to make his case is _____.,too complicated,weak,strong,not based on a legitimate method of reasoning,B,False,0.012906649149954319,0.03096144273877144,0.7985061407089233,0.15723517537117004
How did Tolstoy's life change after his crisis of meaning?,His income increased dramatically.,He distrusted everyone.,He became religious.,He became an agnostic.,C,True,0.005778911057859659,0.020170381292700768,0.7568880319595337,0.21685205399990082
Which of the following is not one of Ross’s prima facie duties?,Fidelity,Beneficence,Non-maleficence,Legality,D,True,0.018001699820160866,0.0231146402657032,0.36157381534576416,0.5961344242095947
Cicero claims that it is sometimes permissible to:,commit acts of injustice.,break one’s promises.,steal.,none of the above.,B,False,0.22255276143550873,0.15295810997486115,0.4711441695690155,0.15295810997486115
"According to Hobbes, without a common power to keep them in awe humans would exist in a state of:",peace and harmony.,mutual indifference.,cautious mistrust.,war of every man against every man.,D,False,0.09366356581449509,0.09366356581449509,0.692085325717926,0.120266392827034
Traditionally art has been defined as _____.,wealth,utility,representation,well being,C,True,0.016405025497078896,0.016405025497078896,0.7904384136199951,0.17637065052986145
One objection to Singer’s theory that he considers is that it:,does not do enough to address suffering in other countries besides our own.,inappropriately makes proximity morally important.,does not account for the fact that we have stricter obligations to our loved ones than to strangers.,requires too drastic a revision to our moral scheme.,D,False,0.30496418476104736,0.18497014045715332,0.3455697000026703,0.16323557496070862
Anselm assumes that a being that exists in reality is greater than a being that _____.,is worshipped,is embodied,exists only in the understanding,exists without flaws,C,True,0.01817305013537407,0.03395172581076622,0.8756266236305237,0.07187581062316895
"According to Baier, a rule can be said to be for the good of human beings only if:",it is not harmful.,it does not impose unnecessary restrictions.,it promotes the good of some people.,all of the above.,D,False,0.1698673814535141,0.1030297800898552,0.6718385219573975,0.055147863924503326
A prominent view is that an object has aesthetic value if it _____.,cannot be defined,has no utility,serves some important function,has no meaning,C,True,0.04640434309840202,0.0765078216791153,0.6405921578407288,0.23566070199012756
Hobbes describes felicity as:,a state of tranquility.,a continual progress of desire from one object to another.,a state of contemplation.,the absence of desire.,B,False,0.04012640565633774,0.02757844887673855,0.9132727980613708,0.01895437203347683
"According to Sartre, there is at least one being in whom existence precedes essence, and this being is _____.",God,man,primitive man,future man,B,False,0.2348288744688034,0.34167400002479553,0.387167364358902,0.03601217269897461
"In Butler’s view, acting virtuously consists of acting in accordance with:",our strongest inward principle.,our highest inward principle.,all of our inward principles.,the commands of God.,B,False,0.514571487903595,0.14742720127105713,0.31210339069366455,0.025619003921747208
Anscombe criticizes Sidgwick on the grounds that:,he does not distinguish between the foreseen and intended consequences of one’s action.,he endorses the divine law conception of ethics.,he claims that there is a “natural balance” to the universe.,all of the above.,A,True,0.7146766781806946,0.08535595238208771,0.1407281756401062,0.0586642324924469
"Why is it ""easier said than done"" to ensure that the principle of informed consent is adhered to?",It is not practicable to present every participant with all the information about the study.,"Sometimes it is desirable to withhold certain pieces of information, such as the length of time an interview will take.","If the participants knew exactly what the researcher was intending to study, they might change their behavior.",All of the above.,D,False,0.5041860938072205,0.04689661040902138,0.2381606549024582,0.2101760357618332
"In Hobbes’s view, a law of nature is:",a command of God.,"a principle of duty, known by intuition.","a principle, known by reason, which forbids one from doing something destructive of one’s life.",None of the above.,C,True,0.2640013098716736,0.09712065756320953,0.6333062052726746,0.005479172337800264
A Loving Saint is someone:,whose happiness lies in the happiness of others.,"who pays little or no attention to his own happiness, in light of the overriding importance of morality.",loves all human beings equally.,is morally perfect only in relation to those he loves.,A,False,0.2383747398853302,0.06027056276798248,0.647969663143158,0.053188588470220566
Moore defines good as:,pleasure.,that which we desire.,that which we desire to desire.,none of the above.,D,False,0.4145490527153015,0.1525040864944458,0.4145490527153015,0.018214013427495956
"Feinberg claims that when people are hungry, they typically desire:",to eat food.,pleasant gustatory sensations.,both a and b.,neither a nor b.,A,False,0.030206605792045593,0.004632333293557167,0.8827664256095886,0.08211006224155426
"According to Hobbes, the right of nature is:",an entitlement to the fruits of one’s labors.,a claim not to be harmed by others.,the right of the king to rule his subjects.,the liberty to use one’s powers to preserve one’s life.,D,False,0.5228937268257141,0.08018835633993149,0.27988487482070923,0.11667336523532867
"According to Socrates, it is important that we discover what makes a particular action (e.g., a merciful or just act) the kind of action that it is, because without such knowledge:","no one in society will ever do any action that really is merciful or just, only those actions that they think are merciful or just.",the primary purpose of human existence--which is to think and to know--is replaced by a focus on morality (acting and doing).,we can refer only to how people characterize actions without knowing why such actions should be characterized that way.,"there would be no way to distinguish one kind of action (e.g., a merciful action) from another kind of action (e.g., a just action).",C,False,0.44318681955337524,0.041222792118787766,0.30459755659103394,0.20934663712978363
Feinberg claims that the best way to pursue happiness is to:,pursue pleasure.,pursue happiness.,forget about happiness.,none of the above.,C,False,0.5247917175292969,0.2187657356262207,0.2478940784931183,0.00848246831446886
Hobbes defines injustice as:,taking more than one’s share of a good.,failure to perform one’s covenant.,treating another person as a mere means.,violating a law of nature.,B,False,0.7980616688728333,0.057811394333839417,0.1386823058128357,0.005377297289669514
