0,1,2,3,4,5,correct,choiceA_probs,choiceB_probs,choiceC_probs,choiceD_probs
Berkeley insists that heat and cold are _____.,illusions,physical objects,only things existing apart from our minds,only sensations existing in our minds,D,False,0.1959111988544464,0.0816679373383522,0.4699665606021881,0.2515549957752228
"According to Moore, the most fundamental question in all of ethics is:",whether life is worth living.,whether God exists.,how “good” is to be defined.,whether morality is objective.,C,True,0.09844300150871277,0.08687564730644226,0.7274008989334106,0.08687564730644226
Bentham claims that actions are right or wrong in virtue of:,the motives behind them.,their consequences.,both a and b.,neither a nor b.,B,False,0.017345840111374855,0.0030142550822347403,0.9470507502555847,0.032406292855739594
"Which of the following concepts can be defined, according to Moore?",good,yellow,horse,all of the above,C,False,0.31752681732177734,0.08028334379196167,0.19258975982666016,0.40771248936653137
Cicero argues that we will never go morally astray if we:,follow our conscience.,follow the laws.,follow religious edicts.,follow Nature as our guide.,D,False,0.08739721775054932,0.04678036645054817,0.8292017579078674,0.03643258288502693
"According to Kant, the moral worth of an action depends on:",the moral character of the agent who performs it.,the consequences of the action.,the maxim that is acted on.,all of the above.,C,True,0.4011998474597931,0.11494568735361099,0.45461899042129517,0.029062818735837936
Epictetus recommends that we refrain from:,laughing without restraint.,casually going to lectures.,having sex before marriage.,all of the above.,D,True,0.09263888001441956,0.026541482657194138,0.19611650705337524,0.6845138669013977
Nussbaum claims that our modern debates about homosexuality:,are continuations of the very same debate about sexual activity that went on in the Greek world.,are interminable because there is no objective answer as to whether homosexuality is immoral.,are carried out in a manner that is not virtuous.,none of the above.,D,False,0.6951072216033936,0.06465504318475723,0.225668266415596,0.014426489360630512
"To say that ""philosophy"" (like ""love"" or ""art"") is not a closed concept means that we cannot state the necessary and sufficient conditions by which it is defined.  Rather, philosophic issues are identifiable as having ""family resemblances"" with one another.  In other words:","there is no one distinguishing feature that identifies an issue as philosophic, only an overlapping of issues roughly associated with one another.","the way we come to think about philosophy, love, or art really depends on how we were raised by our families to identify things as resembling one another.",the necessary and sufficient condition for something to be considered philosophic is that it answers either of these questions: What does it mean? and How do you know?,"philosophy is not a closed discipline insofar as it is willing to accept any answer suggested by the ""human family"" as being true.",A,False,0.07959317415952682,0.015672825276851654,0.8557072877883911,0.04827570542693138
"According to Ross, we should construct a moral theory by:",constructing logical proofs for moral principles.,consulting social conventions.,reflecting on what we really think.,consulting scripture.,C,True,0.132671520113945,0.17035362124443054,0.6737616658210754,0.023054854944348335
A prima facie duty is a characteristic of an act in virtue of which the act:,"seems to be right, although this might be illusory.","tends to be right, although this might be outweighed by other considerations.",is right.,"is the first thing that an agent ought to do, above all else.",B,False,0.3928947150707245,0.14453788101673126,0.44520804286003113,0.017262589186429977
" According to Socrates, the task of the wise and virtuous person is not simply to learn various examples of just or virtuous actions but to learn the essence of justice or virtue, because:","by knowing enough examples of justice or virtue, we will live a worthwhile life even if we do not know what makes them examples of justice or virtue.",knowledge of individual examples alone would not prepare someone for situations of justice or virtue to which the examples do not immediately apply.,what makes an action just or virtuous can be known only by asking people for their opinions and respecting each answer as equally valuable.,"justice and virtue are universal goals of all human beings, even if people do not always agree on how to achieve those ends.",B,False,0.382646769285202,0.051785606890916824,0.382646769285202,0.1807495355606079
Baier claims that ethical skepticism is often due to:,confused metaphysical theories.,confused epistemological theories.,confused religious views.,confused scientific theories.,B,False,0.9679993987083435,0.01772952824831009,0.00837483536452055,0.005755934398621321
Aquinas claim that all human operations appear to serve:,those in power.,those of high status.,those who contemplate the truth.,those who act wickedly.,C,True,0.09793814271688461,0.12575505673885345,0.7236704230308533,0.05242251232266426
"According to Stevenson, moral disagreements involve:",disagreement in interest.,disagreement in belief.,disagreement in theory.,disagreement in practice.,A,False,0.155902698636055,0.03941837325692177,0.7917392253875732,0.012797272764146328
"According to Hobbes, whenever and wherever men live without a common power to keep them all in awe, there is _____.",negotiation,war,democracy,freedom,B,False,0.08592597395181656,0.05211673676967621,0.7194493412971497,0.14166796207427979
Hare claims that all moral arguments are:,useless.,valid.,ad hominem.,sound.,C,True,0.04262854531407356,0.033199142664670944,0.5193219780921936,0.40444836020469666
"Apart from the fact that it is ""not a nice thing to do"", what is an important ethical disadvantage of deceiving participants?",It can damage the professional reputation of the researcher and their discipline.,It makes it more difficult to gain access to deviant or hidden populations.,It means that records of personal data about the participants cannot be made anonymous.,None of the above.,A,False,0.42287904024124146,0.08326981216669083,0.47918474674224854,0.014470125548541546
Stevenson claims that the primary use of ethical judgments is to:,state facts.,influence the interests of others.,describe one’s own approval of things.,none of the above.,B,False,0.40778499841690063,0.21827158331871033,0.35986900329589844,0.013953635469079018
"Butler claims that, strictly speaking, the only thing that anyone has a right to is:",life.,liberty.,property.,happiness.,D,False,0.3003753125667572,0.08605896681547165,0.5611749291419983,0.052197400480508804
Augustine holds that we can never err:,in any circumstances whatsoever.,except through ignorance.,except through wickedness.,except through temptation.,B,False,0.10905103385448456,0.07494960725307465,0.5538069009780884,0.2615998685359955
"According to Brandt’s theory, an ideal moral rule is one that would:","maximize positive utility, ignoring negative utility.","minimize negative utility, ignoring positive utility.","maximize utility, with both positive and negative utilities being counted.",take no account of either positive or negative utility.,C,True,0.2536078691482544,0.04407043009996414,0.6893775463104248,0.012626390904188156
Hare asserts that ethics and science are similar in that:,both seek to provide us with true beliefs about the world.,both are essential components of a worthwhile life.,both involve testing general principles by examining their logical consequences.,all of the above.,C,False,0.611318051815033,0.08273289352655411,0.19846589863300323,0.10623113811016083
Hume argues that the criteria for judging aesthetic value are _____.,entirely subjective,unchangeable,entirely objective,unknown,A,False,0.044202398508787155,0.05675699934363365,0.6101952791213989,0.2882358431816101
How many categories of ethical principles do Diener and Crandell refer to?,Three: harm to students; lack of informed consent; invasion of privacy on social media.,Four: harm to participants; lack of informed consent; invasion of privacy; involvement of deception,Two: ethical and unethical,Two: right and wrong,B,True,0.14351123571395874,0.5009034276008606,0.268114298582077,0.08704395592212677
In response to the claim that deliberative justification is incomplete:,Gauthier expands the definition of deliberative justification.,Gauthier argues that deliberative justification by definition takes account of all relevant considerations.,Gauthier claims that deliberative justification works.,Gauthier argues that all theories of justification are equally incomplete.,C,False,0.384358286857605,0.1101204976439476,0.20573216676712036,0.29933851957321167
Aquinas claims that the ultimate perfection of operation is:,delight.,peace.,pleasure.,Godliness.,A,False,0.05985879525542259,0.06782890111207962,0.567924439907074,0.3039880692958832
Rawls argues that parties in the original position would not accept utilitarianism because:,it is too difficult to determine which policies would maximize happiness.,doing so would be too risky.,"it requires us to do unjust things, such as executing innocent people.",they would be behind the veil of ignorance and thus would never have heard of utilitarianism.,B,False,0.6680582761764526,0.14906395971775055,0.16891157627105713,0.013865106739103794
What does the notion of “meaning in life” refer to?,external meaning,god's plan,internalmeaning,meaning in an afterlife,C,True,0.026031773537397385,0.04291914030909538,0.5228621363639832,0.4072054624557495
Stevenson identifies the meaning of a term with:,the empirical observations to which it applies.,all the psychological causes and effects that attend its utterance.,the psychological causes and effects it has a tendency to be connected with.,the set of other words that are synonyms to the original word.,C,False,0.5773369073867798,0.27271467447280884,0.14597363770008087,0.003890065709128976
Hume thinks that each mind perceives _____.,the same beauty,a different beauty,a warped sense of beauty,objective beauty,B,False,0.07315285503864288,0.08289305120706558,0.7864673733711243,0.056971509009599686
Descartes says that the chief characteristic of physical things is that _____.,they cannot be measured,science can study them,they do not have extension,they have extension,D,False,0.06734588742256165,0.04628610238432884,0.4976225197315216,0.3875488042831421
"In Book II of the Republic, Glaucon claims that justice originates from:",a social agreement.,nature.,the gods.,the powerful.,A,False,0.35894128680229187,0.10283838957548141,0.5222564339637756,0.01577077805995941
Augustine identifies evil with:,the influence of the devil.,the absence of good.,"a unique force, opposed to goodness.",pain.,B,False,0.3903485834598541,0.23675838112831116,0.3444814085960388,0.028276756405830383
"According to Paley, we must conclude that a watch had an intelligent designer if the watch _____.",shows purposefulness,has a structure,runs well,is engraved,A,False,0.14087139070034027,0.08544281125068665,0.4339144229888916,0.33793288469314575
"According to Bentham, a moral sanction is:",pleasure or pain inflicted by chance members of the community.,pleasure or pain inflicted by a judge in accordance with a rule.,pleasure or pain that it is permissible to inflict on someone.,none of the above.,A,False,0.29666998982429504,0.2038981020450592,0.4891261160373688,0.010151488706469536
Augustine claims that Academic skepticism:,"is true, and can be proven.","is true, but cannot be proven",is false but cannot be refuted.,is false and can be refuted.,D,False,0.2734217643737793,0.12915529310703278,0.4507962763309479,0.1463521122932434
"If you assume that a set of statements is true, and yet you can deduce a false or absurd statement from it, then the original set of statements as a whole must be false. This kind of argument is known as _____.",modus tollens,modus ponens,hypothetical syllogism,reductio ad absurdum,D,True,0.030809592455625534,0.057559896260499954,0.2923133075237274,0.618827223777771
Aristotle ends the Ethics with a segue to a discussion of:,aesthetics.,theology.,politics.,natural science.,C,True,0.017638983204960823,0.042313721030950546,0.7500286102294922,0.1896369308233261
Kant claims that the moral law is given to each person by:,society.,one’s own will.,God.,Nature.,B,False,0.16653838753700256,0.06942351907491684,0.7463732361793518,0.017553016543388367
Aesthetics addresses questions that interest _____.,only philosophers,only critics,no one,philosophers and nonphilosophers,D,False,0.005036273039877415,0.01757832057774067,0.9597437977790833,0.01757832057774067
The control condition claims:,it is morally wrong to ever lose control of oneself.,it is morally wrong to try to control the lives of (adult) others.,one cannot be morally assessed for what is due to factors outside one’s control.,one cannot be morally blamed for taking control of one’s own life.,C,False,0.6106669902801514,0.12024745345115662,0.17495903372764587,0.09364882111549377
"According to Feinberg, the claim that we always feel pleasure when we get what we want:","is true, and supports psychological egoism.","is true, but does not support psychological egoism.","is false, and would not support psychological egoism even if it were true.","is false, but would support psychological egoism if it were true.",C,True,0.14639949798583984,0.10061880201101303,0.510984480381012,0.2413719743490219
"Plato distinguishes knowledge from mere belief or opinion by saying that knowledge must be a true belief for which one can give a justification, a rationale, or ""logos.""  In terms of his image of the Divided Line, for Plato, knowledge is attained only when our sensible experience is:",grounded ultimately in what our senses reveal to us about the world of becoming.,"based on images of the good, beauty, and truth obtained from particular objects and on which the concepts and Forms depend.",replaced by what we sincerely believe is true or have come to believe based on our upbringing.,understood in terms of concepts or innate ideas (Forms) that are perceived as rationally ordered.,D,False,0.5428118705749512,0.1996893584728241,0.1996893584728241,0.05721195042133331
What are the two principal answers to whether life has any meaning for us?,the external view and the internal view,the pessimist'sview and the optimist'sview,the religious view and the liberal view,the theistic view and the agnostics view,B,False,0.09323349595069885,0.044040389358997345,0.5365217924118042,0.3254168927669525
Bentham defines the fecundity of a pleasure or pain as:,its chance of occurring.,the degree to which it is felt.,its chance of being followed by sensations of the same kind.,how long it lasts.,C,False,0.7744426131248474,0.07203438133001328,0.15249678492546082,0.0009067790233530104
Disagreements about the aesthetic value or social relevance of a piece of art are _____.,uncommon,common,vacuous,never serious,B,False,0.04868364706635475,0.08026576042175293,0.4618975818157196,0.40762317180633545
Aristotle states that if we ask what the highest good of human action is:,there is no agreement about the answer.,most people agree that it is pleasure.,nearly everyone agrees that it is happiness.,there is no objective answer to this question.,C,True,0.13767293095588684,0.10721977800130844,0.6170072555541992,0.13767293095588684
"When faced with the complaint that utilitarianism is a doctrine worthy of swine, Mill responds that pleasures differ in:",purity.,quality.,species.,weight.,B,False,0.1431235522031784,0.05265221372246742,0.726841390132904,0.07660851627588272
"According to Aquinas, an infinite regress of causes is _____.",finite,possible,impossible,necessary,C,True,0.02655959501862526,0.043789371848106384,0.776185154914856,0.15283991396427155
"Epictetus claims that if the wife and children of a virtuous man were to die, he should feel:",righteous indignation.,moderate grief.,undisturbed.,envy of those who still have their loved ones.,C,True,0.17750069499015808,0.09500927478075027,0.6195383071899414,0.10765960067510605
"Like most rationalists, Plato defines knowledge as justified true belief.  In terms of this definition, we might be able to claim to know something as true which might actually be false, but it is impossible for us really to know something that is false.  Why?","Because to know something that is false is to know no real thing, nothing (i.e., not to know at all).",Because what we know as true is ultimately based on what we claim to know as true.,Because we cannot give a justification or reason for believing in something that is false.,"Because in contrast to our knowledge of the unchanging Forms, beliefs about particular objects can change.",A,True,0.5070667862892151,0.08811499178409576,0.23952141404151917,0.16462048888206482
"By “animal motion,” Hobbes means:",involuntary operations such as heartbeat and breathing.,"instinctive behavior, such as nursing young.",irrational behavior.,all voluntary behavior.,D,False,0.19200024008750916,0.1319596916437149,0.6701467037200928,0.005797904916107655
Taurek claims that:,the death of two people is always worse than the death of one.,the death of two people is sometimes less bad than the death of one.,the death of two people is always exactly as bad as the death of one.,the notion of the sum of two people’s losses should be rejected.,D,False,0.2695733904838562,0.12733745574951172,0.5706868171691895,0.03219595178961754
Which of the following ideas is not associated with the stance of situation ethics?,Anything goes,Principled relativism,The end justifies the means,No choice,A,False,0.03363524004817009,0.07120580226182938,0.6755818724632263,0.21932931244373322
"For Plato, ordinary sensible objects exist and are knowable as examples or instances of Ideas or ""Forms"" that do not exist in our ordinary sensible world.  Forms do not exist in the sensible world because:","in the sensible world only mathematical objects (e.g., triangles) can be known using hypotheses which are recollected when we are asked the right kinds of questions.","unlike everything in the sensible world, Forms are not individual things but rather the universal essences or natures by which individual things are what they are and are known.","nothing in the sensible, experienced world could exist or be identified as one particular thing or another unless there were a ""Sensible World"" Form (like the Form of beauty or justice).","the sensible world consists of changing Forms that exist and are known in terms of other changing Forms, which in turn exist and are known in terms of yet others in an endless regress.",B,False,0.5458070635795593,0.13800163567066193,0.17719760537147522,0.13800163567066193
Descartes declares that he is _____.,a body,a dream,a thing that thinks,a thing that cannot exist,C,False,0.046328216791152954,0.046328216791152954,0.3423217833042145,0.5643932223320007
Aquinas says that the first efficient cause of everything is _____.,the universe,God,nature,an infinite series,B,False,0.07000242173671722,0.11541449278593063,0.7525969743728638,0.06177692487835884
Hume claims that a person who is unaffected by images of human happiness or misery will also be indifferent to:,art and beauty.,virtue and vice.,his own well-being.,all of the above.,B,False,0.07921324670314789,0.08976037055253983,0.7515543699264526,0.07921324670314789
When using visual methods in a research project what should you take into consideration alongside the legal guidelines?,What constitutes a public space,Protecting individuals from potential harm,Any risk of invasion of privacy,All of the above.,D,False,0.2403717339038849,0.036862198263406754,0.5766218304634094,0.14579282701015472
"According to Epicurus, the wise man:",yearns for the end of life.,fears the cessation of life.,is unconcerned with death.,realizes that death is an illusion.,C,True,0.06731683760881424,0.03603210672736168,0.8200869560241699,0.07627996802330017
"To illustrate the attempt to do injustice with impunity, Cicero considers the story of:",the ring of Gyges.,Icarus.,Achilles and Agamemnon.,Oedipus the King.,A,True,0.5255308747291565,0.05539054051041603,0.409283846616745,0.009625433012843132
"Epicurus states that of all the things required for a complete life, the greatest is:",honor.,friendship.,luxury.,good food.,B,False,0.03680770844221115,0.07792191952466965,0.7393026351928711,0.1455773115158081
Parfit claims that the magnitude of pains:,can be precisely compared.,"can be compared, but only roughly.","can be compared within individuals, but not between individuals.",cannot compared either within individuals or between individuals.,B,False,0.5844940543174744,0.06980785727500916,0.21502335369586945,0.13041825592517853
"Nagel claims that prior to reflection, it is plausible that people cannot be morally assessed for:",actions that affect only themselves.,their character.,what is due to factors beyond their control.,actions that do not violate anyone’s rights.,C,True,0.3081680238246918,0.16495047509670258,0.44838184118270874,0.07791706919670105
"According to Anscombe, “moral obligation” currently signifies:",the norms of a society.,the feelings of an individual.,the commands of God.,no real concept at all.,D,False,0.2734089493751526,0.12914924323558807,0.450775146484375,0.14634525775909424
Hume says that beauty is _____.,a quality in things themselves,a matter of a priori knowledge,judged by logical standards,no quality in things themselves,D,False,0.023380814120173454,0.04949718341231346,0.774266242980957,0.15246205031871796
"According to Plato, we can attain knowledge only by seeing beyond this world of particular, changing objects to the true essences or Forms in terms of which things in this world are intelligible.  For example, we know what triangularity is not from comparing sensible triangles but by thinking of the ideal of triangularity in terms of which these sensible figures are recognized as triangles.  From this Plato concludes that all knowledge (as opposed to opinion) is innate, because:",from the moment we are born we know what things are in the world in terms of ideas that we get through our senses.,"since we are born with senses (that is, our senses are innate), we can know things about the sensible world with certainty as long as we rely on the senses alone.",our knowledge of the world is not really of the sensible world itself but of the world grasped mathematically and ideally.,"since our absolutely certain knowledge of things cannot be based on the changing things in sensible experience, it must merely be triggered by sensible experience.",C,False,0.3804922103881836,0.15861274302005768,0.12352772802114487,0.3357831835746765
"According to Stevenson, empirical methods:",are never useful in resolving ethical disagreement.,"are sometimes useful in resolving ethical disagreement, but are not always sufficient.",are in principle always sufficient for resolving ethical disagreement.,provide the only responsible way to engage in moral philosophy.,B,False,0.013863788917660713,0.008408813737332821,0.9719266891479492,0.005779287312179804
"Before his conversion, what was Tolstoy surrounded by?",what is considered complete happiness,things that no one would want,what is considered heavenly bliss,what is considered deep insight,A,False,0.017252491787075996,0.028444552794098854,0.6473950147628784,0.30580776929855347
"According to Sartre, what existentialists have in common is that they think that _____.",essence precedes existence,objectivity must be a starting point,existence is a myth,existence precedes essence,D,False,0.05150984600186348,0.05836829915642738,0.5537830591201782,0.3358863890171051
Feinberg takes his remarks about the two different senses of pleasure to refute:,psychological egoism.,psychological egoistic hedonism.,ethical egoism.,all of the above.,D,False,0.17211027443408966,0.07174623757600784,0.6007238626480103,0.15188677608966827
Rawls claims that a conception of justice should be justified by:,deducing it from self-evident premises.,direct acquaintance via moral intuition.,"the mutual support of many considerations, which it fits into one coherent view.",none of the above.,C,True,0.2476012259721756,0.2185072898864746,0.524171769618988,0.00960054062306881
Epictetus claims that the only thing one can call one’s own is:,the way one deals with one’s impressions.,one’s family.,one’s friends.,one’s body.,A,True,0.4575144946575165,0.11567778140306473,0.4037551283836365,0.022778304293751717
"In Hobbes’s view, to say something is good is to say that:",it is conducive to human happiness.,you desire it.,most people desire it.,most people ought to desire it.,B,False,0.637003481388092,0.14213469624519348,0.16105970740318298,0.05925055220723152
"Moore claims that there is no meaning in saying that pleasure is good, unless:",goodness and pleasure are the same thing.,good is something different than pleasure.,all good things are pleasant.,all pleasant things are good.,B,False,0.4114813208580017,0.2828066945075989,0.24957604706287384,0.05568794161081314
"Baier asserts that when we ask for moral advice, we are asking for others to:",issue commands.,inform us of their preferences.,deliberate with us.,empathize with us.,C,True,0.007486010901629925,0.008482762612402439,0.9804739952087402,0.0035361414775252342
Moral theories that say that the rightness of actions depends solely on their consequences are _____.,deontological,virtue oriented,consequentialist,egoistic,C,True,0.028025126084685326,0.0672287866473198,0.5628997087478638,0.3414159417152405
Socrates tells Crito that he should attempt to break out of prison if and only if doing so would be:,to his advantage.,harmful to his enemies and advantageous to his friends.,pleasing to the gods.,just.,D,False,0.1721777468919754,0.09216010570526123,0.6009593605995178,0.13409216701984406
