0,1,2,3,4,5,correct,choiceA_probs,choiceB_probs,choiceC_probs,choiceD_probs
A lesion causing compression of the facial nerve at the stylomastoid foramen will cause ipsilateral,paralysis of the facial muscles.,paralysis of the facial muscles and loss of taste.,"paralysis of the facial muscles, loss of taste and lacrimation.","paralysis of the facial muscles, loss of taste, lacrimation and decreased salivation.",A,False,0.09758353233337402,0.059187401086091995,0.1823100447654724,0.6363245248794556
"A ""dished face"" profile is often associated with",a protruding mandible due to reactivation of the condylar cartilage by acromegaly.,a recessive maxilla due to failure of elongation of the cranial base.,an enlarged frontal bone due to hydrocephaly.,defective development of the maxillary air sinus.,B,True,0.2169681042432785,0.3156867027282715,0.19147367775440216,0.24585705995559692
Which of the following best describes the structure that collects urine in the body?,Bladder,Kidney,Ureter,Urethra,A,False,0.1063687801361084,0.044341105967760086,0.4206967055797577,0.4206967055797577
Which of the following structures is derived from ectomesenchyme?,Motor neurons,Skeletal muscles,Melanocytes,Sweat glands,C,False,0.05435115844011307,0.06158793345093727,0.35441410541534424,0.5156694650650024
Which of the following describes the cluster of blood capillaries found in each nephron in the kidney?,Afferent arteriole,Glomerulus,Loop of Henle,Renal pelvis,B,False,0.10177114605903625,0.06172732636332512,0.31347721815109253,0.5168365836143494
A patient suffers a broken neck with damage to the spinal cord at the level of the sixth cervical vertebra.,They will be unable to breathe without life support.,They will only be able to breathe quietly.,It is impossible to predict an effect on breathing.,Breathing will be unaffected.,B,False,0.1196320429444313,0.17406360805034637,0.36849263310432434,0.3251936137676239
Which of the following anatomical regions of abdomen lies just distal to the sternum?,Epigastric,Hypochondriac,Hypogastric,Lumbar,A,False,0.035976991057395935,0.021821144968271255,0.30123165249824524,0.6377073526382446
Which of the following best describes the human body's defense mechanism against environmental bacteria?,Hair in the nose,Mucous membranes,Osteoblasts,Saliva,B,False,0.035335104912519455,0.05825773999094963,0.3352501690387726,0.5527340769767761
The palatine processes begin to fuse at,six weeks post-fertilization.,eight weeks post-fertilization.,ten weeks post-fertilization.,twelve weeks post-fertilization.,C,False,0.19368630647659302,0.19368630647659302,0.19368630647659302,0.4100339114665985
Primary motor cortex activity results in,bilateral contraction of antigravity limb muscles.,bilateral contraction of limb musculature.,contraction of ipsilateral limb musculature.,contraction of contralateral limb musculature.,D,False,0.39389392733573914,0.09959198534488678,0.18606233596801758,0.3067649006843567
You notice that your patient's submandibular lymph nodes are enlarged. You would look for potential infection sites in the,hard palate.,hard palate and upper lip.,"hard palate, upper lip and upper central incisor.","hard palate, upper lip, upper central incisor and lower first molar.",D,False,0.36512166261672974,0.09827116131782532,0.22145748138427734,0.25094419717788696
A patient suffers damage to the orbit in a road traffic incident resulting in damage to the third cranial nerve. Which of the following signs will be present?,Pupillary constriction and a medial strabismus,Pupillary dilatation and a medial strabismus,Pupillary constriction and a lateral strabismus,Pupillary dilatation and a lateral strabismus,D,False,0.1636747121810913,0.26985400915145874,0.3926352560520172,0.1636747121810913
Which of the following statements is true of the temporomandibular joint?,It has an articular disc of hyaline cartilage,Its articular surfaces are covered by hyaline cartilage,Proprioceptive information is carried by the chorda tympani and deep temporal nerves,Proprioceptive information is carried by the masseteric and auriculotemporal nerves.,D,False,0.42411917448043823,0.1560247391462326,0.06923554837703705,0.17679916322231293
Laryngoscopic examination of the vocal folds after suspected recurrent laryngeal nerve damage usually shows that the vocal fold on the injured side is tensed and in an intermediate position between adduction and abduction. This is because,cricothyroid muscle is still functional but the interarytenoid muscles are fully active.,cricothyroid muscle is still functional but the interarytenoids are weak.,cricothyroid muscle is paralyzed but the interarytenoids are fully active.,cricothyroid muscle is paralyzed but the interarytenoids are weak.,B,False,0.4596650302410126,0.3159228563308716,0.11622151732444763,0.09051340073347092
Which one of the following statements about the growth of the mandible is correct?,The mental symphysis closes at about 1 year postnatally,The condylar growth cartilage ceases activity at puberty,The ossification centre appears about 8 weeks I.U.L medial to Meckel's cartilage,The functional matrix acting on the angle of the mandible is the lateral pterygoid muscle,A,False,0.07525599747896194,0.1320783942937851,0.21776045858860016,0.27960994839668274
Which of the following statements is true of the pupillary light reflex?,Its efferent limb is carried in the optic nerve,It is mediated by the inferior colliculi in the midbrain,It is a consensual reflex,Its afferent limb is carried in the oculomotor nerve,C,False,0.25399336218833923,0.19781021773815155,0.19781021773815155,0.3261339068412781
Which muscles are normally active during quiet inspiration?,External and internal intercostal muscles,External intercostal muscles and diaphragm,Internal intercostal muscles and diaphragm,External and internal intercostal muscles and diaphragm,B,False,0.06794211268424988,0.09885518997907639,0.3044954538345337,0.5020281076431274
Male hormones are produced by which of the following?,Glans penis,Prepuce,Prostate,Testes,D,True,0.263607919216156,0.12451957166194916,0.263607919216156,0.33847925066947937
Oxygenated blood is carried to the heart by which of the following structures?,Aorta,Carotid arteries,Inferior vena cava,Pulmonary veins,D,True,0.10280680656433105,0.10280680656433105,0.192068412899971,0.5916123986244202
Which of the following allows air to pass into the lungs?,Aorta,Esophagus,Trachea,Pancreas,C,False,0.02026788517832756,0.022966524586081505,0.35925689339637756,0.5923144817352295
Where is the sinoatrial node located?,Between the left atrium and the left ventricle,Between the right atrium and the right ventricle,In the upper wall of the right atrium,In the upper wall of the left ventricle,C,False,0.37428686022758484,0.17680060863494873,0.2572433650493622,0.17680060863494873
"In relation to the rib, the corresponding intercostal nerve lies",deep to its superior border.,superficial to its superior border.,deep to its inferior border.,superficial to its inferior border.,C,False,0.18826432526111603,0.24173617362976074,0.24173617362976074,0.31039538979530334
The regional lymphatic drainage of the left side of the tip of the tongue is to the,left submental lymph node.,left and right submental lymph nodes.,left submandibular lymph node.,left and right submandibular lymph nodes.,B,False,0.37640106678009033,0.15690730512142181,0.2931414544582367,0.15690730512142181
Gastrulation is the process of,mesoderm formation and occurs after neurulation.,ectomesenchyme formation and occurs before neurulation.,mesoderm formation and occurs before neurulation.,ectomesenchyme formation and occurs after neurulation.,B,False,0.20534710586071014,0.2326887547969818,0.1599244773387909,0.3836388885974884
The spheno-occipital synchondrosis,is a secondary growth cartilage.,influences the position of the viscerocranium.,ceases activity at 7 years of age.,can be reactivated in patients affected by acromegaly.,B,False,0.34527790546417236,0.23730580508708954,0.09892378002405167,0.3047066628932953
Which of the following substances is found in greater quantity in exhaled air?,Carbon dioxide,Carbon monoxide,Nitrogen,Oxygen,C,False,0.10169436782598495,0.061680760234594345,0.31324073672294617,0.5164466500282288
Which of the following conditions is characterized by the presence of kidney stones (renal calculi)?,Glomerulonephritis,Interstitial nephritis,Nephrolithiasis,Polycystic kidney,C,True,0.24163542687892914,0.07844752818346024,0.39838945865631104,0.2738088071346283
A pulse may be felt on a patient's face where the,facial artery crosses the mandible.,facial artery crosses the maxilla.,superficial temporal artery crosses the maxilla.,superficial temporal artery crosses the orbital rim.,A,True,0.3084030747413635,0.2721647620201111,0.24018456041812897,0.16507627069950104
A patient sustains severe blunt trauma to the left upper abdomen and requires surgery. Which one of the following organs is most likely to be involved?,Appendix,Gallbladder,Spleen,Urinary bladder,C,True,0.08918599039316177,0.054094038903713226,0.45292383432388306,0.39970389008522034
Which statement concerning the atrioventricular bundle is correct?,It is formed of autonomic nerve processes and is the only electrical connection between the atria and the ventricles.,It is formed of Purkinje fibres and is the only electrical connection between the atria and the ventricles,It is formed of autonomic nerve processes and forms one of several electrical connections between the atria and ventricles.,It is formed of Purkinje fibres and forms one of several electrical connections between the atria and ventricles.,B,False,0.25202155113220215,0.2224082350730896,0.15285879373550415,0.28557783365249634
Which of the following terms describes the motion of bending the forearm toward the body?,Abduction,Eversion,Flexion,Pronation,C,False,0.31988805532455444,0.06298968940973282,0.28230020403862,0.31988805532455444
Food is prevented from entering the larynx during the pharyngeal phase of swallowing by,constriction of the laryngeal entrance.,upward movement of the epiglottis.,downward movement of the larynx.,increase in respiratory rate.,A,True,0.4654274880886078,0.3198833167552948,0.13334721326828003,0.07137561589479446
At which of the following locations does bile enter the digestive tract?,Gastroesophageal sphincter,Duodenum,Ileocecum,Jejunum,B,False,0.08890700340270996,0.1293589323759079,0.18821612000465393,0.5797464847564697
In which of the following positions does a patient lie face down?,Dorsal,Erect,Lateral,Prone,B,False,0.04616570472717285,0.04074108973145485,0.2656652629375458,0.6372978687286377
Complete bilateral cleft palate is due to failure of fusion of the,palatine processes.,palatine and frontonasal processes.,"palatine, frontonasal and secondary nasal processes.","palatine, frontonasal, secondary nasal processes and mandibular processes.",C,False,0.21941526234149933,0.04895815998315811,0.319247305393219,0.3617545962333679
The auditory tube,connects the inner ear and nasopharynx.,is derived from the second pharyngeal pouch.,is opened by the action of levator veli palatini.,is closed by the action of tensor veli palatini.,C,False,0.710618793964386,0.0961717888712883,0.05147705227136612,0.12348701804876328
Which of the following is the lymphoid organ that is a reservoir for red blood cells and filters organisms from the blood?,Appendix,Gallbladder,Pancreas,Spleen,D,True,0.03262503445148468,0.03262503445148468,0.27316606044769287,0.6552913188934326
Which of the following cavities are separated by the diaphragm?,Abdominal and pelvic,Cranial and spinal,Thoracic and abdominal,Pericardial and pleural,C,False,0.16662442684173584,0.0891876146197319,0.27471721172332764,0.45293211936950684
The walls of bronchioles contain,"cartilage, smooth muscle and respiratory epithelium.",cartilage and smooth muscle.,cartilage and respiratory epithelium.,smooth muscle and respiratory epithelium.,D,False,0.33227071166038513,0.0951971560716629,0.22836610674858093,0.33227071166038513
"Which of the following organs removes bilirubin from the blood, manufactures plasma proteins, and is involved with the production of prothrombin and fibrinogen?",Gallbladder,Kidney,Liver,Spleen,C,True,0.12488837540149689,0.11021360754966736,0.49394309520721436,0.26438871026039124
Which of the following conditions is characterized by incompetence of the esophageal sphincter?,Crohn's disease,Esophageal varices,Gastroesophageal reflux disease,Pyloric stenosis,C,False,0.13609792292118073,0.056734051555395126,0.3264819383621216,0.475028395652771
The muscles of the soft palate are innervated by branches of the,trigeminal and glossopharyngeal nerves.,facial and glossopharyngeal nerves.,trigeminal and vagus nerves.,facial and vagus nerves.,C,False,0.3375827670097351,0.1594628244638443,0.23201702535152435,0.23201702535152435
Which of the following is the large bone found superior to the patella and inferior to the ischium?,Calcaneus,Femur,Symphysis pubis,Tibia,B,False,0.0706290677189827,0.06232993304729462,0.1919897198677063,0.6701099872589111
A successful inferior alveolar nerve block will produce anaesthesia of the,lower lip.,lower lip and mandibular teeth.,"lower lip, mandibular teeth and labial gingivae of the anterior mandibular teeth.","lower lip, mandibular teeth and labial gingivae of the anterior and buccal gingivae of the posterior mandibular teeth.",C,True,0.06056097522377968,0.06446681916713715,0.4203764498233795,0.4203764498233795
The mucosa of the upper larynx is innervated by the,internal laryngeal nerve which is the afferent limb of the cough reflex.,external laryngeal nerve which is the afferent limb of the gag reflex.,internal laryngeal nerve which is the afferent limb of the gag reflex.,external laryngeal nerve which is the afferent limb of the cough reflex.,A,True,0.3582940399646759,0.2790396809577942,0.14030995965003967,0.19178098440170288
The bones of the viscerocranium develop initially by,endochondral ossification and follow the somatic growth pattern.,endochondral ossification and follow the neural growth pattern.,intramembranous ossification and follow the somatic growth pattern.,intramembranous ossification and follow the neural growth pattern.,C,False,0.4038251042366028,0.19075347483158112,0.19075347483158112,0.19075347483158112
The physician directs the medical assistant to complete a request form for an X-ray study of the fibula. The procedure will be performed on which of the following structures?,Heel,Lower leg,Toes,Thigh,B,False,0.11406372487545013,0.16596172749996185,0.39812150597572327,0.3100573420524597
Which cells in the blood do not have a nucleus?,Lymphocyte,Monocyte,Erythrocyte,Basophil,C,False,0.041089411824941635,0.041089411824941635,0.18414996564388275,0.728327214717865
The coronal suture joins the,frontal and parietal bones.,left and right parietal bones.,parietal and occipital bones.,"parietal, squamous temporal and greater wing of the sphenoid.",A,False,0.22178107500076294,0.07200177013874054,0.32268956303596497,0.36565518379211426
"If you run your finger down the anterior midline of a patient's extended neck from chin to sternal notch, you should be able to palpate, in order, the","hyoid bone, cricoid cartilage, thyroid cartilage.","thyroid cartilage, cricoid cartilage, hyoid bone.","hyoid bone, thyroid cartilage, cricoid cartilage.","thyroid cartilage, hyoid bone, cricoids cartilage.",C,False,0.4747522473335266,0.32629212737083435,0.1360187977552414,0.04415883496403694
Which of the following bony structures may be palpated in a live patient?,The supraorbital foramen,The infraorbital foramen,The mental foramen,All of the above,D,True,0.2876846194267273,0.06419111043214798,0.2538807988166809,0.3693943917751312
Which of the following structures accompany the oesophagus through the diaphragm?,The phrenic nerves,The splanchnic nerves,The sympathetic trunks,The vagus nerves,D,True,0.14130428433418274,0.08570538461208344,0.20559655129909515,0.5588693022727966
Which sequence describes the systemic circulation?,Left ventricle → aorta → arteries → veins → capillaries,Left ventricle → aorta → arteries →capillaries → veins,Right ventricle → pulmonary trunk → arteries → capillaries →veins,Right ventricle → pulmonary trunk → arteries → veins → capillaries,B,False,0.3810707926750183,0.20397250354290009,0.20397250354290009,0.18000510334968567
The anatomic location of the spinal canal is,caudal,dorsal,frontal,transverse,B,False,0.033661577850580215,0.029706235975027084,0.4646837115287781,0.4646837115287781
The parotid duct runs,deep to masseter and enters the mouth opposite the upper second molar.,superficial to masseter and enters the mouth opposite the upper second molar.,deep to masseter and enters the mouth opposite the upper second premolar.,superficial to masseter and enters the mouth opposite the upper second premolar.,B,False,0.44662418961524963,0.21097034215927124,0.16430386900901794,0.16430386900901794
"If the foot is abducted, it is moved in which direction?",Inward,Outward,Upward,Downward,D,False,0.25475403666496277,0.15451614558696747,0.42001837491989136,0.15451614558696747
The infraorbital nerve,is a terminal branch of the maxillary division of the trigeminal nerve.,is a terminal branch of the maxillary branch of the facial nerve.,carries parasympathetic secretomotor neurons to the lacrimal gland.,innervates the inferior part of the orbicularis oculi muscle.,A,True,0.44202783703804016,0.16261297464370728,0.111762136220932,0.23660045862197876
Which of the following best describes the process whereby the stomach muscles contract to propel food through the digestive tract?,Absorption,Emulsion,Peristalsis,Regurgitation,C,False,0.06197703629732132,0.06197703629732132,0.40414103865623474,0.45795178413391113
Which of the following is the point at which an impulse is transmitted from one neuron to another neuron?,Dendrite,Glial cell,Nerve center,Synapse,D,True,0.03949737176299095,0.05071562901139259,0.20058420300483704,0.7001076340675354
Which of the following muscles initiates elevation of the mandible?,Masseter,Temporalis,Lateral pterygoid,Medial pterygoid.,D,True,0.233451247215271,0.08588190376758575,0.233451247215271,0.43614432215690613
Which of the following is an accessory organ of the gastrointestinal system that is responsible for secreting insulin?,Adrenal gland,Gallbladder,Liver,Pancreas,D,True,0.02461525797843933,0.03581499308347702,0.4363158941268921,0.4944106936454773
A malignant tumour is damaging the patient's glossopharyngeal nerve. They will experience,loss of taste over the anterior two-thirds of the tongue.,loss of somaesthetic sensation over the anterior two thirds of the tongue.,loss of taste and somaesthetic sensation over the posterior third of the tongue.,paralysis of the muscles of the tongue.,C,True,0.17083601653575897,0.2816609740257263,0.3191636800765991,0.21935778856277466
A possible effect of damage to the third cranial nerve by trauma to the orbit is,a convergent strabismus.,ptosis.,pupillary contriction.,bitemporal hemianopia.,B,False,0.09943391382694244,0.09943391382694244,0.3470584452152252,0.44563186168670654
Blood flows from the right ventricle of the heart into which of the following structures?,Inferior vena cava,Left ventricle,Pulmonary arteries,Pulmonary veins,C,False,0.13345535099506378,0.1039351299405098,0.282524973154068,0.46580490469932556
A patient is stabbed in the neck. You suspect damage to the accessory nerve in the posterior triangle. You would test nerve function by asking the patient to,extend their neck against resistance.,extend their neck without impairment.,lift their shoulders against resistance.,lift their shoulders without impairment.,C,False,0.29262372851371765,0.227895587682724,0.2582395374774933,0.2011171579360962
Which of the following muscles are derived from the first brachial arch?,The muscles of mastication,The muscles of mastication and anterior belly of digastric,The muscles of mastication and anterior and posterior bellies of digastric,"The muscles of mastication, anterior and posterior bellies of digastric and geniohyoid",B,False,0.04212495684623718,0.03717514127492905,0.5462847352027893,0.33133843541145325
Which of the following best describes the location where the carotid pulse can be found?,In front of the ears and just above eye level,In the antecubital space,In the middle of the groin,On the anterior side of the neck,D,True,0.16599014401435852,0.11408324539661407,0.1880914866924286,0.5112856030464172
"In the brain stem, pathways for:",nociception decussate in the medial lemniscus,skilled movements decussate in the medial lemniscus,skilled motor movements decussate in the pyramids.,discriminative touch decussate in the pyramids.,C,False,0.22645805776119232,0.12903191149234772,0.10049015283584595,0.22645805776119232
The respiratory tract is crossed by the isthmus of the thyroid gland at the level of the,thyroid cartilage.,cricothyroid membrane.,cricoid cartilage.,tracheal rings.,D,False,0.3735780417919159,0.1557304859161377,0.19996191561222076,0.2567561864852905
You notice a lesion on the labial alveolar mucosa of the lower right lateral incisor tooth of one of your patients and decide to take a biopsy to send for oral pathology report Which nerve would require local anaesthesia in order to carry out a pain-free biopsy?,The incisive nerve,The mental nerve,The buccal nerve,The lingual nerve,B,False,0.3564680814743042,0.13113729655742645,0.3145819902420044,0.1908036172389984
The major concentrations of proprioceptive receptors providing information about position of the TMJ are located in,the capsule and ligaments of the TMJ and the medial pterygoid muscle.,the capsule and ligaments of the TMJ and the lateral pterygoid muscle.,the articular disc of the TMJ and the medial pterygoid muscle.,the articular disc of the TMJ and the lateral pterygoid muscle.,B,False,0.40753182768821716,0.2800922691822052,0.21813607215881348,0.07081840187311172
Which of the following is a substance that aids the transmission of nerve impulses to the muscles?,Acetylcholine,Cholecystokinin,Deoxyribose,Oxytocin,A,False,0.07644397765398026,0.07644397765398026,0.266815721988678,0.5648488402366638
"In the spinal cord, motor neuron cell bodies are located in",Lamina I.,Lamina II.,Lamina V.,Lamina IX,D,True,0.06748340278863907,0.02482575736939907,0.16188427805900574,0.7255149483680725
"When you examine a patient who has suffered an unfavourable fracture of the body of the mandible, you would expect the",anterior fragment to be displaced downwards by the action of the digastric muscle.,posterior fragment to be displaced anteriorly by the action of the lateral pterygoid muscle.,anterior fragment to be displaced backwards by action of the temporalis muscle.,posterior fragment to be displaced medially by action of the medial pterygoid muscle.,A,True,0.3033169209957123,0.23622345924377441,0.1345960646867752,0.2676762342453003
Examination of a patient indicates that they have a medially directed strabismus (squint). This could be due to damage to the,oculomotor nerve.,trochlear nerve.,ophthalmic trigeminal nerve.,abducens nerve.,D,False,0.34451353549957275,0.3040321171283722,0.20895801484584808,0.12673945724964142
"A patient cuts a peripheral motor nerve in their wrist when they fall through a plate glass window. If the nerve does not regenerate, after about 6 months the muscles it normally innervates will show signs of which of the four options below?",spastic paralysis,flaccid paralysis,atrophy,contracture,C,True,0.12995770573616028,0.10121116787195206,0.4002979099750519,0.35326167941093445
A patient suffers a CVA in the area of the left internal capsule conveying motor neurons to the right leg. The patient's leg will exhibit,spastic paralysis.,flaccid paralysis.,tremor.,hyporeflexia.,A,False,0.1535233110189438,0.13548383116722107,0.2868192791938782,0.4173195958137512
The crown of a very carious tooth suddenly fractures while the patient is standing eating at a take-away food outlet and a fragment is inhaled. It is more likely to enter the,right lung because the right main bronchus is wider and more vertical than the left.,left lung because the left main bronchus is wider and more vertical than the right.,right lung or left lung because the two main bronchi are of equal size and at the same angulation.,right or left lung because there are no factors predisposing to the fragment going in one particular direction.,A,False,0.12371745705604553,0.2171308845281601,0.3810766041278839,0.2039756178855896
"Calcium, potassium, and sodium are classified as which of the following?",Androgens,Catecholamines,Electrolytes,Estrogens,C,False,0.11486741900444031,0.07894714921712875,0.2755526304244995,0.5148000717163086
Noradrenaline is the neurotransmitter between which of the two structures below?,parasympathetic pre- and post-ganglionic neurons,sympathetic pre- and post-ganglionic neurons,parasympathetic post-ganglionic neurons and target organs,sympathetic post-ganglionic neurons and target organs,D,True,0.08064869791269302,0.3395437002182007,0.16038908064365387,0.38475340604782104
Which of the following are mucus-producing glands located on each side of the vaginal opening?,Adrenal,Bartholin's,Bulbourethral,Corpus luteum,B,False,0.11670724302530289,0.10299377143383026,0.24706923961639404,0.5230455994606018
"When an emergency opening into the airway is required, the cricothyroid membrane should be pierced immediately",superior to the thyroid cartilage.,inferior to the thyroid cartilage.,inferior to the cricoid cartilage.,superior to the thyroid isthmus.,B,False,0.3304235339164734,0.20041200518608093,0.20041200518608093,0.2573341131210327
Cerebrospinal fluid circulates around the brain between the,skull and dura mater.,dura mater and arachnoid mater.,arachnoid and pia maters.,pia mater and brain surface.,C,False,0.5562684535980225,0.10953573882579803,0.10953573882579803,0.204639732837677
