0,1,2,3,4,5,correct,choiceA_probs,choiceB_probs,choiceC_probs,choiceD_probs
Which of the following closes and seals off the lower airway during swallowing?,Alveoli,Epiglottis,Larynx,Uvula,B,False,0.07630475610494614,0.07630475610494614,0.3419741988182068,0.4975695013999939
Which orbital wall is most likely to collapse in a 'blow out' fracture?,The roof,The floor,The lateral wall,The medial wall,B,False,0.12476225197315216,0.07567213475704193,0.6335950493812561,0.160197913646698
The walls of the maxillary sinus are sinus is related to,the floor of the orbit.,the floor of the orbit and the upper posterior teeth.,"the floor of the orbit, the upper posterior teeth and the infratemporal fossa.","the floor of the orbit, the upper posterior teeth, the infratemporal fossa and the hard palate.",C,False,0.20846323668956757,0.11158232390880585,0.2676720917224884,0.34369775652885437
Which of one of the following statements about the postnatal growth of the maxilla is correct?,Pneumatisation by enlargement of the developing maxillary sinus ceases at puberty,Space is created for the eruption of the permanent molars by resorption of the maxillary tuberosity,The zygomaticomaxillary sutures contribute to increase in height and length of the maxilla,The intermaxillary suture closes about eight years postnatally,C,False,0.19196033477783203,0.24648195505142212,0.16940441727638245,0.3164891004562378
The seventh cranial nerve supplies,taste buds on the posterior third of the tongue.,muscles of the soft palate.,muscles of the lower lip.,the parotid salivary gland.,C,True,0.2747431993484497,0.08919606357812881,0.3113248348236084,0.3113248348236084
Which of the following paranasal sinuses open into the middle meatus?,The anterior ethmoidal sinuses,The anterior ethmoidal and frontal sinuses,"The anterior ethmoidal, frontal and maxillary sinuses","The anterior ethmoidal, frontal, maxillary and sphenoidal sinuses",C,False,0.17470447719097137,0.07282765209674835,0.32639092206954956,0.3698493540287018
"Which of the following is a structural, fibrous protein found in the dermis?",Collagen,Heparin,Lipocyte,Melanin,A,False,0.10494432598352432,0.056172650307416916,0.4150628447532654,0.4150628447532654
Palatine shelf elevation is due to the effect of,descent of the tongue.,changes in flexure of the developing brain.,hydrophilic molecules increasing turgor pressure in the palatine shelves.,a combination of these three processes.,D,False,0.4231566786766052,0.1998850703239441,0.290831059217453,0.06489317864179611
On which surfaces of the teeth is dental plaque most likely to accumulate in the mouth of a patient with poor oral hygiene?,The palatal surfaces of the upper molars and lingual surfaces of the lower incisors.,The buccal surfaces of the upper molars and lingual surfaces of the lower incisors.,The palatal surfaces of the upper molars and labial surfaces of the lower incisors.,The buccal surfaces of the upper molars and labial surfaces of the lower incisors.,B,False,0.44525614380836487,0.12756802141666412,0.21032412350177765,0.18561036884784698
Laryngeal oedema is usually confined to the larynx above the vocal folds because,there are numerous mucous glands in the vestibular folds.,the mucosa covering the vocal folds is tightly attached to underlying tissues.,fluid will drain rapidly into the thorax below the vocal folds.,the mucosa above the vocal folds is more vascular than that below the vocal folds.,B,False,0.26965031027793884,0.26965031027793884,0.14433342218399048,0.3055538535118103
The coronary arteries,arise from the arch of the aorta and fill during diastole.,arise from the ascending aorta and fill during systole.,arise from the arch of the aorta and fill during systole.,arise from the ascending aorta and fill during diastole.,D,False,0.6036086678504944,0.11885758489370346,0.06361988186836243,0.1959630399942398
Which muscle is the most active during a right lateral excursion of the mandible?,Left lateral pterygoid muscle,Right lateral pterygoid muscle,Left medial pterygoid muscle,Right medial pterygoid muscle,A,True,0.2928803265094757,0.13834688067436218,0.258465975522995,0.2928803265094757
The phrenic nerves innervate the,diaphragm.,diaphragm and parietal pleura.,"diaphragm, parietal pleura and pericardium.","diaphragm, parietal pleura, pericardium and intercostals muscles.",C,False,0.1923404484987259,0.13219353556632996,0.2798537015914917,0.35933923721313477
Parasympathetic preganglionic nerves leave the central nervous system with the,third cranial nerves.,fourth cranial nerves.,fifth cranial nerves.,sixth cranial nerves.,A,False,0.15282012522220612,0.04378369823098183,0.25195780396461487,0.5333946347236633
"In a patient with a normal healthy mouth, you would expect the mucosa covering the alveolar process supporting the mandibular teeth to be",light pink in colour on both sides of the mucogingigival junction.,light pink below the mucogingival junction and red above it.,red below the mucogingival junction and light pink above it.,red on both sides of the mucogingival junction.,C,False,0.2267266809940338,0.2000855803489685,0.2267266809940338,0.3298853635787964
Macrostomia results from failure of fusion of,maxillary and mandibular processes.,left and right mandibular processes.,maxillary and frontonasal processes.,mandibular and hyoid arches.,A,True,0.44491493701934814,0.12747026979923248,0.210162952542305,0.210162952542305
You suspect that your patient has an enlarged submandibular salivary gland. You expect the enlarged gland,to be palpable intraorally..,to be palpable extraorally.,to be palpable both intra- and extraorally.,only to be detectable by radiographical examination.,C,False,0.2986402213573456,0.33840373158454895,0.2986402213573456,0.045797962695360184
Osteoclasts,deposit bone and differentiate from periosteal mesenchymal cells.,resorb bone and differentiate from periosteal mesenchymal cells.,deposit bone and differentiate from monocytes.,resorb bone and differentiate from monocytes.,D,False,0.6014328002929688,0.13419780135154724,0.13419780135154724,0.11842913180589676
The lateral pterygoid muscle,is attached to the coronoid process and elevates the mandible.,is attached to the condylar process and elevates the mandible.,is attached to the coronoid process and protrudes the mandible.,is attached to the condylar process and protrudes the mandible.,D,False,0.4910452663898468,0.10956701636314392,0.18064548075199127,0.2046981155872345
"In the fetus, the ductus arteriosus passes blood from the",pulmonary vein to the aorta.,aorta to pulmonary vein.,pulmonary artery to the aorta.,aorta to the pulmonary artery.,C,False,0.3136281371116638,0.1678730547428131,0.19022507965564728,0.3136281371116638
Which of the following bones develop by endochondral ossification?,The ribs,The ribs and sternum,"The ribs, sternum and clavicle","The ribs, sternum, clavicle and vertebrae",B,False,0.16800670325756073,0.07003560662269592,0.2769961953163147,0.4566895067691803
The mucosa of the hard palate is,keratinised and has submucosa and minor salivary glands posterolaterally.,non-keratinised and has submucosa and minor salivary glands posteromedially.,keratinised and lacks submucosa and minor salivary glands.,non-keratinised and lacks submucosa and minor salivary glands.,A,True,0.39435672760009766,0.18628093600273132,0.3071253299713135,0.09970899671316147
The head of the sixth rib articulates with,The inferior articular facet of T5 and superior articular facet of T6.,The inferior articular demifacet of T5 and superior articular facet of T6.,The inferior articular demifacet of T5 and the superior articular demifacet of T6.,The superior and inferior demifacets of T6.,C,False,0.5723909735679626,0.07746469229459763,0.08777900040149689,0.23860804736614227
Which of the following is located beneath the diaphragm in the left upper quadrant of the abdominal cavity?,Appendix,Duodenum,Spleen,Pancreas,C,True,0.09412509202957153,0.057089753448963165,0.4218393862247467,0.4218393862247467
Proprioceptive nerve endings in synovial joints are located in,articular cartilage and synovial membrane.,synovial membrane and capsule.,capsule and ligaments.,ligaments and articular discs.,D,False,0.40715283155441284,0.1923253834247589,0.21793320775032043,0.16972655057907104
The thoracic cage is a structural unit important for which of the following functions?,Alimentation,Menstruation,Mentation,Respiration,D,True,0.0942791998386383,0.08320111036300659,0.1068323403596878,0.6966343522071838
A patient is admitted after a head injury and sinks rapidly into a coma. An MRI scan indicates an extradural haemorrhage because extravasated blood can be detected between the,skull bones and dura mater.,dura mater and arachnoid.,arachnoid and pia mater.,pia mater and brain surface.,A,True,0.45214420557022095,0.14678972959518433,0.18848174810409546,0.18848174810409546
A successful infraorbital nerve block will produce anaesthesia of the,maxillary anterior teeth.,maxillary anterior teeth and their labial gingivae.,"maxillary anterior teeth, their labial gingivae and the upper lip.","maxillary anterior teeth, their labial gingivae, the upper lip and anterior hard palate.",C,False,0.3262631893157959,0.15411581099033356,0.19788862764835358,0.2540940046310425
Which of the following foramina pierce the sphenoid bone?,The foramen ovale,The foramen ovale and rotundum,"The foramen ovale, rotundum and spinosum","The foramen ovale, rotundum and spinosum and foramen lacerum",C,True,0.19256563484668732,0.09096156805753708,0.31748706102371216,0.31748706102371216
Which of the following is a disorder characterized by uncontrollable episodes of falling asleep during the day?,Dyslexia,Epilepsy,Hydrocephalus,Narcolepsy,D,True,0.04474709555506706,0.03948917239904404,0.291787713766098,0.6177145838737488
Which of the following allows gas exchange in the lungs?,Alveoli,Bronchi,Bronchioles,Capillaries,A,False,0.07463308423757553,0.03525417298078537,0.26049503684043884,0.6248951554298401
"A patient has a fracture in which the radius is bent but not displaced, and the skin is intact. This type of fracture is known as which of the following?","Closed, greenstick","Complex, comminuted","Compound, transverse","Open, spiral",A,False,0.12770859897136688,0.2385910451412201,0.270359069108963,0.3471479117870331
Fertilization of an ovum by a spermatozoon occurs in which of the following structures?,Cervix,Fallopian tube,Ovary,Uterus,B,False,0.10701895505189896,0.08334644138813019,0.37353286147117615,0.4232681691646576
Ectoderm gives rise to,the neural tube.,ectomesenchymal cells.,dental enamel.,all three structures.,D,False,0.3915557563304901,0.05299130827188492,0.23749056458473206,0.30494391918182373
"In men, which of the following structures is located at the neck of the bladder and surrounds the urethra?",Epididymis,Prostate,Scrotum,Seminal vesicle,B,False,0.4231226146221161,0.07352767884731293,0.3734043836593628,0.12122666090726852
"Which of the following options completes the following statement? ""The right atrioventricular valve…""",is a semilunar valve,is prevented from everting by papillary muscles.,is open during systole.,prevents blood returning from the pulmonary trunk as the heart relaxes.,B,False,0.1032048687338829,0.1501622051000595,0.19281211495399475,0.5241175889968872
Which one of the following brain areas is supplied by branches of the subclavian arteries?,The frontal lobe,The parietal lobe,The hypothalamus,The cerebellum,D,True,0.07819650322198868,0.04742857441306114,0.35045239329338074,0.509905219078064
Which of the following structures is part of the small intestine?,Ascending colon,Cecum,Ileum,Sigmoid colon,C,False,0.07935439795255661,0.042475346475839615,0.3556417226791382,0.5174556374549866
During an inferior alveolar nerve block the needle ideally passes,posterior and medial to medial pterygoid.,anterior and lateral to medial pterygoid.,through medial pterygoid.,inferior to medial pterygoid.,B,False,0.4020882844924927,0.3548416793346405,0.16761533915996552,0.06987246125936508
Patients with which of the following diseases are treated with injections of vitamin B-12?,Bell's palsy,Crohn's disease,Pernicious anemia,Graves' disease,C,False,0.10797683894634247,0.09528922289609909,0.22858697175979614,0.5483516454696655
Which of the following bones has a process that joins with the zygomatic bone to form the zygomatic arch?,The maxillary bone,The temporal bone,The sphenoid bone,The frontal bone,B,False,0.24117903411388397,0.060979604721069336,0.24117903411388397,0.45058172941207886
Parasympathetic preganglionic axons leave the CNS with the,cervical spinal nerves.,thoracic spinal nerves.,lumbar spinal nerves.,sacral spinal nerves.,D,True,0.3186648190021515,0.06274882704019547,0.19327999651432037,0.40917372703552246
A patient with damage to their cervical sympathetic chain will show the following signs and symptoms.,Pupillary constriction,Pupillary constriction and vasodilation of facial vessels,"Pupillary constriction, vasodilation of facial vessels and increased facial sweating","Pupillary constriction, vasodilation of facial vessels, increased facial sweating and decreased lacrimation",B,False,0.01580549217760563,0.027739502489566803,0.11678767204284668,0.7615512609481812
Which of the following cranial nerves is related to the sense of smell?,Abducens,Hypoglossal,Olfactory,Trochlear,C,True,0.1036350280046463,0.07122725248336792,0.5963784456253052,0.21939539909362793
Where are the vital centres located in the brainstem?,midbrain,pons,medulla oblongata,cerebellum,C,False,0.030381280928850174,0.023660965263843536,0.1542888730764389,0.783543586730957
Saliva contains an enzyme that acts upon which of the following nutrients?,Starches,Proteins,Fats,Minerals,A,False,0.08855176717042923,0.07814665883779526,0.44970300793647766,0.35022905468940735
During swallowing the,auditory tube opens.,cricopharyngeus muscle contracts.,rima glottis opens.,gag reflex is suspended.,A,True,0.28386980295181274,0.17217573523521423,0.2505142092704773,0.28386980295181274
The dorsal roots of all spinal nerves contain,sensory neuronal processes.,sensory and autonomic neuronal processes.,motor neuronal processes.,motor and autonomic neuronal processes.,A,True,0.3085871934890747,0.16517482697963715,0.24032793939113617,0.2723272144794464
Which of the following is the master gland of the endocrine system?,Adrenal,Pancreas,Pineal,Pituitary,D,True,0.06717823445796967,0.04074566438794136,0.16115222871303558,0.7222341299057007
Loss of somatic sensation over the anterior two-thirds of the tongue indicates damage to the,lingual branch of the mandibular trigeminal nerve.,chorda tympani branch of the facial nerve.,lingual branch of the glossopharyngeal nerve.,hypoglossal nerve.,A,False,0.27821946144104004,0.1687486469745636,0.21667754650115967,0.315263956785202
"In men, specimens for gonococcal cultures are most commonly obtained from which of the following structures?",Anus,Bladder,Urethra,Testicle,C,False,0.22020936012268066,0.11786957830190659,0.28275442123413086,0.36306387186050415
Which of the following structures should be visible on a dental panoramic radiograph?,The mandibular canal,The mandibular canal and maxillary sinus,"The mandibular canal, maxillary sinus and hard palate","The mandibular canal, maxillary sinus, hard palate and zygomatic arch",D,False,0.2830038368701935,0.08108195662498474,0.32068535685539246,0.2830038368701935
