0,1,2,3,4,5,correct,choiceA_probs,choiceB_probs,choiceC_probs,choiceD_probs
Which statement best explains the purpose of Hart's distinction between 'being obliged' and 'having an obligation'?,It demonstrates the difference between the internal and the external aspect of a rule.,It refutes the natural lawyer' view of the role of morality in law.,It explains the nature of power-conferring rules.,It illuminates the concept of a rule.,D,False,0.009174156934022903,0.013348318636417389,0.9357894062995911,0.041115716099739075
Maine's famous aphorism that 'the movement of progressive societies has hitherto been a movement from Status to Contract' is often misunderstood. In what way?,It is misinterpreted as a prediction.,His concept of status is misrepresented.,It is taken literally.,His idea is considered inapplicable to Western legal systems.,A,False,0.23815764486789703,0.2698679566383362,0.3058004677295685,0.1854773610830307
Which of the following factors contributed significantly to the revival of natural law in the 20th century?,Depression of the 1930,The rise of Fascism,The international recognition of human rights after World War II,The Bolshevik Revolution,C,True,0.06111171469092369,0.047593854367733,0.5798118114471436,0.3103509247303009
Which of the following criticisms of Llewellyn's distinction between the grand and formal styles of legal reasoning is the most compelling?,There is no distinction between the two forms of legal reasoning.,"Judges are appointed to interpret the law, not to make it.",It is misleading to pigeon-hole judges in this way.,Judicial reasoning is always formal.,C,True,0.016589060425758362,0.027350736781954765,0.6224998831748962,0.3332001864910126
Which proposition below is the most consistent with what Rawls claims the POP would opt for in respect of 'social primary goods'?,The POP will choose wealth over a compassionate society.,The POP will choose equality over power.,The POP will be unselfish.,The POP will choose to protect the disabled.,A,False,0.10906565189361572,0.14004306495189667,0.4887983202934265,0.261634886264801
The ________ School believes that promoting market efficiency should be the central goal of legal decision-making.,Law and Economics,Critical Legal Studies,Historical,Natural Law,A,False,0.18900911509990692,0.05415200814604759,0.5137799978256226,0.2426924854516983
Which statement below is the least likely to follow logically from Austin's argument that a sanction consists of the smallest chance of incurring the smallest evil?,All commands include some sanction.,The concept of a command contains the likelihood that a sanction will follow failure to obey the command.,Without a sanction the mere expression of a wish is not a command.,A command confers power to change one's legal status.,D,False,0.028263498097658157,0.09864930063486099,0.7289252281188965,0.1435338854789734
How does Weber solve the 'England problem'?,By denying its existence.,By explaining the difference between the common law and civil law.,By distinguishing certain features of the English legal system that facilitated the development of capitalism.,By recognizing the importance of legitimate domination.,C,True,0.06666091829538345,0.07553671300411224,0.5581450462341309,0.2987535297870636
Cicero's conception of natural law is 'based on the idea that 'true law is right reason in agreement with Nature.' Reason is a key element because:,It is a sin for humans not to apply reason.,The principles of natural law are discoverable by reason.,Natural law does not apply without good reason.,The law of nature is the basis of all positive law.,B,False,0.37074628472328186,0.0827246829867363,0.17512816190719604,0.37074628472328186
"Catharine MacKinnon argues that since men dominate women, the question is ultimately one of power. Which proposition below is the most inconsistent with this argument?",Women can achieve equality through political pressure.,Equality is impossible because men define women as different.,The idea of 'woman' needs to be redefined.,The world is phallocentric and oppressive.,A,False,0.040124475955963135,0.10906962305307388,0.29648199677467346,0.5539013147354126
Who was an exponent of “natural law with a variable content”?,John Rawls,Stammler,Jerome Hall,John Finns,B,False,0.010739517398178577,0.020064059644937515,0.8531455397605896,0.11546069383621216
The ________ School of jurisprudence asserts that the law is a means of achieving and advancing certain sociological goals.,Historical,Analytical,Command,Sociological,D,False,0.0016874982975423336,0.0031526617240160704,0.9905368685722351,0.004587096162140369
"According to Malinowski, the Trobriand Islanders organized their society around what concept?",Conflict.,Love.,War.,Reciprocity.,D,False,0.013605000451207161,0.01541648618876934,0.8417115807533264,0.1290806531906128
In Justice for Hedgehogs Dworkin endorses 'Hume's principle'. What does he understand by this idea?,That there is no distinction between law and morality.,That there is a distinction between right and wrong.,That facts about the world or human nature cannot normally ordain what ought to be,That human rights are fundamentally unsound.,C,True,0.17031517624855042,0.11705578118562698,0.5944583415985107,0.11705578118562698
Lyotard's dictum 'I define postmodern as incredulity toward meta-narratives' means:,Individual stories are suspect.,The law is static.,Universal values are meaningless.,Literature reproduces repression.,C,False,0.02920754998922348,0.03750323876738548,0.07939435541629791,0.853569746017456
Habermas distinguishes between 'law as medium' and 'law as institution'. Which statement below most accurately describes this distinction?,"Law as medium' describes law as a body of formal, general rules that control the state and the economy; 'law as institution' inhabits the 'lifeworld' and expresses its shared values and norms in institutional form.",Law as medium' consists of the manner in which law is presented by the media; 'law as institution' describes the courts.,Law as medium' concerns the manner in which the law expresses its rules in simplified terms; 'law as institution' refers to the formal declaration of laws by legislative bodies.,Law as medium' is defined as the intermediate stage of legal development; 'law as institution' is the advanced stage.,A,False,0.05149558559060097,0.07492563873529434,0.4885765314102173,0.3805038034915924
To claim that one has a prima facie duty to obey the law is to assert that:,"One is under a duty to obey the law without exception, regardless of its content.",There is no duty to obey a law to which one hasn't agreed.,The duty applies only to those who are directly affected by the law in question.,The obligation arises independently of the precise legal provisions involved - unless there are grounds to justify a specific exception.,D,False,0.21968628466129303,0.17109185457229614,0.5270000100135803,0.0808180719614029
Dworkin contends that to every legal question there is only one right answer. Which proposition below is most inconsistent with this claim?,In hard cases judges generally decide cases on the basis of rights.,The rights of the parties feature in the determination of most cases before the courts.,Judges exercise strong discretion.,Judges seek the best 'fit' with constitutional and institutional history.,C,False,0.05039779096841812,0.044475898146629333,0.29001927375793457,0.6139708161354065
"Robert makes the following statement while negotiating the sale of his car, 'This is the sharpest car on the market.' His statement may support a claim for:",misrepresentation,fraud,fraud and misrepresentation,none of the above,D,False,0.2128317803144455,0.11392063647508621,0.6555680632591248,0.01747029647231102
According to Austin the science of jurisprudence is concerned with,Morality,Positive law,Divine law,Natural law,B,False,0.22880354523658752,0.08417210727930069,0.48437708616256714,0.20191840827465057
Which of the following statements best captures the nature of Fuller's 'inner morality of law'?,A positivist view of law.,A morality of aspiration.,An Aquinian concept of natural law.,A rejection of the 'harm principle'.,B,False,0.025160742923617363,0.0532652921974659,0.8332093954086304,0.08781962096691132
Hart argues that secondary rules are 'power-conferring' but this seems unconvincing in the case of the rule of recognition because:,It both confers power and imposes duties on judges to decide cases.,It is not a social rule.,It applies only in the case of unitary constitutions.,It fails to specify the source of authority.,A,False,0.0988888144493103,0.18474863469600677,0.1438823789358139,0.5690658688545227
Adherence to precedent is called the doctrine of ________.,nolo contendere,stare decisis,substantial performance,commercial impracticability,B,False,0.07625728100538254,0.18293172121047974,0.30160343647003174,0.4388303756713867
Which proposition below may be characterized as the most powerful refutation by Hart of Lord Devlin's argument?,Society has no right to preserve its moral and social cohesion through the criminal law.,Homosexual acts cause public outrage.,The courts are the best place to resolve moral questions such as those concerning homosexuality and prostitution.,The law is anachronistic.,A,False,0.06153622642159462,0.06153622642159462,0.6615768074989319,0.21478253602981567
What relationships to the type of law that exists in society does Durkheim identify between (1) mechanical and (2) organic solidarity?,Mechanical solidarity produces conflict in society. Organic solidarity leads to greater social harmony.,Mechanical solidarity leads to repressive law. Organic solidarity leads to restitutive law.,Mechanical solidarity fosters efficiency. Organic solidarity leads to inefficiency.,Mechanical solidarity generates a more democratic legal system; organic solidarity a more authoritarian legal system.,B,False,0.07993996888399124,0.11631195992231369,0.6693291664123535,0.13179871439933777
Which of the following quotations best describes the central thesis of difference feminism?,There are fundamental differences between individual women.',Men and women have different conceptions of the feminist project.',"Women look to context, whereas men appeal to neutral, abstract notions of justice.'",Men are unable to comprehend their differences from women.',C,True,0.09692030400037766,0.10982508212327957,0.6319997310638428,0.15979456901550293
Which statement below is the least likely to follow logically from Dworkin's notion of law as integrity?,It is likely to generate more individual rights and greater liberty.,It renders a community more genuine.,It opens the door to authoritarianism.,It improves the moral justification for the exercise of political power.,C,True,0.06980063766241074,0.10155932605266571,0.5844336152076721,0.24362815916538239
Which statement best describes one of Dworkin's central arguments in Justice for Hedgehogs?,Morality plays no role in the concept of law.,Moral arguments operate only in hard cases.,The law dictates what moral values should affect our ethical behaviour.,Moral values are both independent and objective.,D,False,0.015362558886408806,0.022352389991283417,0.6532326340675354,0.30856525897979736
Which statement best describes the nature and function of Kelsen's Grundnorm?,The ultimate source of a legal system's morality.,The rule that distinguishes norms from habits of obedience.,The constitution of a state.,A presupposition that facilitates our understanding of the legal system.,D,False,0.0783422589302063,0.12916456162929535,0.5788753628730774,0.21295636892318726
Critical Legal Studies (CLS) is often compared to (or with) American realism. Which of the following statements is inaccurate?,Both are concerned with the 'law in action.',Both are anti-formalist and sceptical,Both adopt a liberal ideology.,Both attempt to demystify the law.,C,False,0.03678390383720398,0.053520262241363525,0.3954642415046692,0.5077861547470093
Which of the following best describes Dworkin's distinction between principles and policies?,"Principles are legislative, policies are precedents.","Principles describe rights, policies describe duties.","Principles are democratic, policies are autocratic.","Principles describe rights, policies describe goals.",D,False,0.06242367997765541,0.07073529809713364,0.6711178421974182,0.19227848947048187
Statutes are often called ________ law.,quasi,qualified,collaborated,codified,D,True,0.034047000110149384,0.05613401532173157,0.13465848565101624,0.7749061584472656
Which is the least accurate description of legal positivism?,It regards morals and law as inseparable.,It perceives law as commands.,It regards a legal order as a closed logical system.,It espouses the view that there is no necessary connection between morality and law.,A,False,0.011417047120630741,0.031034749001264572,0.6233496069908142,0.3336550295352936
Which proposition below is the most powerful refutation of Bentham's felicific calculus?,Happiness is less important than economic prosperity.,It is impossible to calculate all the consequences of one's acts.,Pain and pleasure are inevitable features of life.,Utilitarianism fails to take account of differences in social background.,B,False,0.032799672335386276,0.032799672335386276,0.5813881158828735,0.352629691362381
"Donny threw a knife at Sally, intending to injure her severely. However, Donny missed Sally. Sally saw the knife just as it whizzed by her head, missing it by about one inch. As a result, Sally was very scared. Sally sued Donny for assault and battery. Which of the following is most correct?","Donny will be liable for battery, but not assault.","Donny will be liable for assault, but not battery.",Donny will be liable for assault and for battery.,Donny will not be liable for either assault or battery because this is only a criminal matter.,B,False,0.011731837876141071,0.046400316059589386,0.9319753050804138,0.009136764332652092
Why does a Marxist account of law reject individual rights?,Because they are inconsistent with state control.,Because they are an expression of a capitalist economy and are unnecessary in a socialist society.,Because the concept of rights is philosophically unsound.,"Because Marx, Engels, and Lenin failed to provide a coherent analysis of rights.",B,False,0.045675527304410934,0.05864853784441948,0.08533310890197754,0.8096180558204651
Kelsen’s theory of law is called pure theory because Kelsen :,Purely discussed jurisprudence only,Defined law in according with morality and purity,"Separated law from religion, ethics, sociology and history",Discussed law purely in terms of justice,A,True,0.3658525347709656,0.15251003205776215,0.19582676887512207,0.28492623567581177
Which of the following purposes does the 'internal point of view' play in Hart's concept of law?,It distinguishes social rules from mere group habits.,It defines the judicial function.,It illustrates the authority of the legislature.,It stresses the relationship between law and justice.,A,False,0.02920493297278881,0.03749987855553627,0.8534932732582092,0.07938724011182785
The body of law which establishes rights between persons and provides for redress for violation of those rights is known as:,Criminal Law,Civil Law.,The Uniform Commercial Code.,Stare decisis.,B,False,0.14863963425159454,0.0901544913649559,0.40404438972473145,0.356567919254303
Why does Parfit oppose equality?,He argues than an unequal society is inevitable.,"He claims that by giving priority to the needs of the poor, we can increase equality.",He asserts that we are each responsible for our poverty.,He rejects the idea of equality altogether.,B,False,0.020625151693820953,0.08157406747341156,0.5319297313690186,0.36558958888053894
"The most fundamental of positivism's key commitments,' writes Ken Himma, 'is the Social Fact Thesis.' What does it claim?",That law is essentially an artefact or social construction.,That legal systems are unrelated to social forces.,That society is constantly in a state of flux.,That legal positivism is a social theory.,A,False,0.1648091822862625,0.06870269030332565,0.11327157914638519,0.6518329977989197
How does Nozick answer the criticism of his historical entitlement theory that if the distribution of goods in society is unjust those at the bottom always lose?,It can be remedied by redistribution of wealth.,"If each person's holdings are just, then the total distribution of holdings is just.",Historical factors are secondary to moral imperatives.,He has no answer.,B,False,0.03464139997959137,0.0504029355943203,0.37243014574050903,0.5418826341629028
The ________ School of jurisprudence maintains that the law is shaped by logic.,Historical,Analytical,Command,Sociological,B,False,0.05729089304804802,0.10703347623348236,0.7908763289451599,0.04461819306015968
Dworkin argues that it is only a conception of equality of resources that can secure the ideal of equality of welfare. How does he suggest this aspect of equality to be measured?,When no-one would prefer another's bundle of resources to his or her own.,By reference to the ownership of private property.,By the amount of income tax paid by individuals.,When the community determines that equality has been achieved.,A,False,0.20360107719898224,0.12349030375480652,0.33568140864372253,0.33568140864372253
Which statement best describes the relationship between law and morality among non-positivist legal theorists?,There is no relationship between law and morality.,Law is always in advance of moral ideas.,The law is inextricably bound up with morals.,Morality is generally in advance of the law.,C,True,0.019258327782154083,0.035979293286800385,0.8188849091529846,0.1255800724029541
Why does communitarianism resemble Aristotle's philosophy more than Kant's?,Because Aristotle justified slavery.,Because Kant failed to distinguish individual from social morality?,Because Aristotle believed that man is a 'social animal',Because Kant regarded the individual as unimportant.,C,True,0.1312834769487381,0.1312834769487381,0.458224356174469,0.27792713046073914
Which proposition below is the most inconsistent with a consequentialist justification of punishment?,Punishment protects security.,Punishment is a cost-effective method by which to prevent or reduce crime.,Punishment protects personal safety.,Punishment should fit the crime.,D,False,0.03320003300905228,0.04262968897819519,0.519335925579071,0.40445923805236816
"The philosophers of the ________ School of jurisprudence believe that the law is a set of rules developed, communicated, and enforced by the ruling party rather than a reflection of the society's morality, history, logic, or sociology.",Command,Law and Economics,Natural Law,Critical Legal Studies,A,False,0.02407577447593212,0.050968412309885025,0.3766084909439087,0.5479620695114136
Which statement below best represents Durkheim's view of the function of punishment?,Deterrence.,Rehabilitation.,Vengeance.,Desert.,C,True,0.06867194920778275,0.04719749465584755,0.7382930517196655,0.14537851512432098
What does Dworkin mean by the 'semantic sting'?,The language of the law is generally unclear.,Lawyers' arguments usually concern language.,Judges are prey to linguistic misunderstanding.,The rule of recognition cannot fully account for legal validity.,D,True,0.09245801717042923,0.08159390836954117,0.22179526090621948,0.6029019951820374
"The expression to signify any assumption which conceals of affects to conceal the fact that a rule of law has undergone alteration, its letter being unchanged, its operation being modified is :",Legal fiction,Equity,Custom,Legislation,A,False,0.039052680134773254,0.12029072642326355,0.41985589265823364,0.41985589265823364
Hume's attack on natural law is founded on his argument that:,We cannot objectively know what is morally right or wrong.,Natural law is backward-looking.,There is no such thing as a social contract.,Natural law fails to protect the state against attacks.,A,False,0.0949021726846695,0.044828616082668304,0.06522524356842041,0.7946061491966248
Why does Dworkin support liberal egalitarianism?,Because it attempts to give effect to personal choice over individual luck.,Because liberty is more important than equality.,Because a market economy is just.,Because the state is the best arbiter of equality between individuals.,A,False,0.23322182893753052,0.23322182893753052,0.23322182893753052,0.2994627356529236
Why do the Scandinavian realists reject a metaphysical approach to law?,Because they regard empiricism as a more reliable method by which to understand the concept of law.,Because they have no interest in the operation of the legal system.,Because their approach is based on Bentham's sceptical account of the common law.,Because they prefer a natural law analysis of legal ideas.,A,False,0.03827999159693718,0.020489800721406937,0.4115486741065979,0.528438925743103
Which statement below is the least consistent with the argument that judges in an unjust legal system ought to resign?,Judges are under a duty to act justly.,"Since they also prop up the unjust system, lawyers should also resign.","If a moral judge resigns, he or she may be replaced by a less moral judge.","Judges do not make the law, hence they cannot be held responsible for applying unjust legislation.",D,False,0.02964770421385765,0.05538920313119888,0.5954900979995728,0.31874287128448486
Normative legal theory is most accurately summarized by which of the following statements?,Its principal concern is with moral or political values.,It is represented by the positivist view of law as developed by HLA Hart.,It expresses the idea that law consists only of norms.,It is preoccupied with the analysis of the application of legislation to moral issues.,A,False,0.09577619284391403,0.13935352861881256,0.6245391964912415,0.13935352861881256
"Hart writes: '[T]he certification of something as legally valid is not conclusive of the question of obedience ... however great the aura of majesty or authority which the official system may have, its demands must in the end be submitted to a moral scrutiny.' What does this say about the nature of legal positivism?",That legal positivism is unconcerned about the morality of the law.,That validly enacted law should always be obeyed.,That moral issues fall outside the official legal system.,That there is no moral duty to obey an unjust law.,D,False,0.12168075144290924,0.12168075144290924,0.6179459095001221,0.13788236677646637
Which of the following propositions would be rejected by those who describe themselves as critical legal theorists?,Law is politics.,Law is determinate.,Law reflects economic power.,Law is unstable.,B,False,0.03986600041389465,0.045174095779657364,0.48566731810569763,0.42859989404678345
Posner denies the autonomy of law on two grounds. Name one of them.,He denies that law develops independently of social and economic forces.,He claims that law is economically immoral.,He rejects a positivist account of law.,He opposes any sociological analysis of the law.,A,False,0.10403477400541306,0.2495664805173874,0.5283322334289551,0.11788685619831085
"Bill purchased a can of Sipep from the Ajax Minimart. After he finished drinking the Sipep, Bill noticed that the can contained dead insects stuck on the inside bottom of the can. In a strict product liability tort action against Ajax, Bill must prove, among other things, that:",Ajax is a merchant selling Sipep.,Ajax knew or should have known of the defective condition,Ajax had prior notice of other similar problems with Sipep products.,Ajax actually placed the dead insects into the can.,A,False,0.11437605321407318,0.12960503995418549,0.3992116451263428,0.35230302810668945
The ________ School of jurisprudence believes that the law is an aggregate of social traditions and customs that have developed over the centuries.,Historical,Analytical,Command,Sociological,A,False,0.027198370546102524,0.021182112395763397,0.9006863236427307,0.05081325024366379
"Point out the most accurate response : According to Austin, law has the following attributes :","Command, sovereign and enforceability","Command, sovereign and legal remedy","Command, sovereign and sanction","Command, sovereign and obedience by subject",C,True,0.08823594450950623,0.03246019035577774,0.8371593356132507,0.041679710149765015
Which one of the following schools supports the view that a custom becomes law when it receives the stamp of judicial recognition by courts,Analytical School,Natural Law School,Historical School,Sociological School,A,False,0.07550637423992157,0.02777724154293537,0.5579208135604858,0.3383961021900177
The will theory of rights maintains that the enforcement of Y's duty requires the exercise of will by X. It assumes the correlativity of rights and duties. Which of the following succeeds in formulating the interest theory without this correlativity?,Regarding X's interest as directly related to Y's duty.,Accepting that conferring right means that the interest represented by that right ought to be recognized.,Treating an interest as the exercise of choice.,Asserting that X has a right whenever the protection of his interest is recognized as a reason for imposing duties -only when they are actually imposed.,B,False,0.03812920302152634,0.09146720916032791,0.765845537185669,0.103645920753479
Which statement is closest to characterizing the principal difference between the positions adopted by Hobbes and Locke?,They adopt different attitudes towards the role of the courts in maintaining order.,They disagree about the role of law in society.,They have opposing views about the nature of contractual obligations.,They differ in respect of their account of life before the social contract.,D,False,0.06997900456190109,0.11537588387727737,0.7523452639579773,0.061756256967782974
