0,1,2,3,4,5,correct,choiceA_probs,choiceB_probs,choiceC_probs,choiceD_probs
Which of the following statements best describes the postmodernist project?,It attempts to demonstrate the relationship between law and literature.,It seeks to defend Enlightenment values.,It is preoccupied with the rise of bureaucratic government.,"It rejects the Kantian concern with individual rights, equality, and justice.",D,False,0.021853851154446602,0.03179716318845749,0.8200597167015076,0.12576022744178772
Which of the following best describes Lon Fuller's objective in his hypothetical case of the Speluncean Explorers?,To demonstrate the differences between the criminal law and the civil law as they relate to cannibalism.,To examine the central questions of legal and political philosophy.,To criticize the role of the judiciary in cases involving a conflict between law and morality.,To consider the extent to which murder requires mens rea.,B,False,0.19091220200061798,0.19091220200061798,0.5880510210990906,0.029277333989739418
Which of the following arguments against the 'fair play' argument in support of a duty to obey the law is the most persuasive?,Fairness is a relative term.,"The legal system is, in fact, unfair.",It sets a bad example.,The law is irrational and ambiguous.,B,False,0.009401548653841019,0.01990307867527008,0.31133654713630676,0.6590994596481323
"What is the main reason why many Critical Race Theorists are hostile to concepts such as 'justice', 'neutrality', and 'truth'?",Because of their vagueness.,Because they have failed to produce racial justice.,Because they are unrelated to contemporary conditions.,Because these ideas are alien to most people of colour.,B,False,0.0444316565990448,0.07325541228055954,0.09406181424856186,0.7875699400901794
On what grounds does John Finnis reject Hume's conception of practical reason?,That natural law corresponds to positive law.,That Hume is a legal positivist.,That syllogistic logic is false.,That human reason can help us to determine what constitutes a worthwhile life.,D,True,0.05611217021942139,0.06358341127634048,0.10483132302761078,0.7746045589447021
The distinction between general and particular jurisprudence was recognized by,Holland,Salmond,Austin,Kelsen,C,True,0.024141570553183556,0.018801473081111908,0.7994589805603027,0.15742279589176178
Lex iniusta non est lex' has which of the following meanings?,The law is not valid unless it is formally enacted.,Law has lexical priority over morality.,An unjust law is not law.,No-one is above the law.,C,True,0.10516554862260818,0.09280828386545181,0.6051859855651855,0.19647513329982758
In which of the following the idea of ‘natural law’ first appeared,French Revolution,American War of Independence,Roman Law,Greek Thinking,D,False,0.058318451046943665,0.051465846598148346,0.8050613403320312,0.08485283702611923
"Tom and Jerry entered into a contract whereby Tom agreed to sell Jerry $1,000 worth of heroin, an illegal substance. This is an example of a:",quasi contract,void contract,voidable contract,secondary party beneficiary contract,B,False,0.05355270579457283,0.05355270579457283,0.24000661075115204,0.6524055004119873
Which statement best describes Tom Regan's 'sentimental anthropomorphicism' in support of animals rights?,Animals have inherent worth which entitles them to the absolute right to live their lives with respect and autonomy.,The social contract includes animals and their welfare.,The suffering of a few animals may in principle be justified by the pleasure of or benefit to the many.,Cruelty to animals is a reflection of the barbarity of a society.,A,False,0.11868346482515335,0.09243078529834747,0.682976245880127,0.10473780333995819
"Hart dismissed American realism as 'the claim that talk of rules is a myth, cloaking the truth that law consists simply of the decisions of courts and predictions of them.' What is the strongest reason for regarding this remark as unfair?",Because American realism was not concerned with the predictions of what courts will do but more interested in the rights and duties of parties involved in litigation.,Because American realists were preoccupied with the concept of justice and its application in American courts.,Because the American realists exposed the limitations of a doctrinal account of law without a proper empirical investigation of the way it functions thereby paving the way to a sociological approach to law.,Because the principal focus of the American realist 'school' was legal education.,C,True,0.09898045659065247,0.08734995126724243,0.5695932507514954,0.2374417781829834
The following person is the author of the book ‘The Concept of Law’ :,Hart,Austin,Bentham,None of the above,A,False,0.04025508463382721,0.024415941908955574,0.9162014722824097,0.019015153869986534
Which description below most accurately captures the distinction between Gemeinschaft and Gesellschaft?,"Gemeinschaft is democratic Gesellschaft, autocratic.","Gemeinschaft exists in civil society, Gesellschaft in civic society.","Gemeinschaft is a society based on community, Gesellschaft one based on association","Gemeinschaft refers to an open government, Gesellschaft to a lack of transparency.",C,True,0.07238664478063583,0.11934538930654526,0.6867853403091431,0.11934538930654526
The judicial branch of the United States government has the power to ________ the law.,interpret,make,enforce,override,A,False,0.05090359225869179,0.1077629029750824,0.7027024030685425,0.13837029039859772
“Natural law is based on the nature of man and on his inward need of living in society.” Who said it?,Hugo Grotius,Hobbes,Locke,Rousseau,B,False,0.0550924576818943,0.06242793798446655,0.522702693939209,0.35924798250198364
‘Law consists of set of principles or body of rules recognized and applied by the State in the administration of justice’. The statement is made by :,Austin,Salmond,Holland,Gray,B,False,0.042060818523168564,0.025511175394058228,0.6579419374465942,0.2742709815502167
Why does the 'capability' approach to justice reject Rawls' theory?,Because it fails to address the actual capabilities people have to benefit from his theory of justice.,Because it ignores the duties of individuals.,Because it applies only to democratic societies.,Because it overlooks the importance of the courts.,A,False,0.05932611972093582,0.06722529977560043,0.23463939130306244,0.6378159523010254
Which of the following apparent correlatives contradicts Hohfeld's scheme of 'jural relations'?,Right and duty.,Privilege and no-right.,Power and liability.,Immunity and disability.,C,True,0.0482717864215374,0.0482717864215374,0.5880707502365112,0.3147715926170349
Why is it important to separate the concept of punishment from its justification?,Because its justification depends on the concept employed.,Because any definition of punishment should be value-neutral.,Because the concept of punishment is controversial.,Because the practice of punishment is separate from its justification.,B,False,0.42055487632751465,0.15471351146697998,0.22510682046413422,0.19865606725215912
"According to Hobbes, peace is the first law of nature because of which of the following situations?",Without peace everyone has a right to everything - including another's life.,Peace is possible only after war.,Law cannot achieve peace.,The social contract cannot be entered into unless there is peace.,A,False,0.1657475233078003,0.08871825784444809,0.1657475233078003,0.5785156488418579
The United States Supreme Court's decision in Roe v Wade is highly controversial because:,It failed to consider the rights of fathers.,It overlooked the common law relating to abortion.,The majority held that the abortion law of Texas was unconstitutional because it violated a woman's right to privacy.,The court failed to consider the medical evidence.,C,True,0.06403099000453949,0.09316454082727432,0.47312861680984497,0.3684729337692261
The focus of liberal feminists on equality is denounced by radical feminists as mistaken because:,It treats women as objects.,It makes women into men.,It reduces feminism to a political movement.,It overlooks the historical struggle of women for justice.,B,False,0.07608281075954437,0.08621310442686081,0.3409794867038727,0.49612221121788025
Who said that “Jurisprudence is the eye of law”,Maine,Savigny,Pound,Laski,D,False,0.0022145817056298256,0.00992506556212902,0.7884455919265747,0.1993502676486969
Who amongst the following said that jurisprudence is the philosophy of positive law,Gray,Holland,Hart,Austin,D,True,0.05491701513528824,0.03774387761950493,0.31602564454078674,0.5904135704040527
Hart’s analysis of law distinguishes between,Cause and effect,Theory and fact,Being obliged and having an obligation,Corporeal and incorporeal rights,C,True,0.11727719008922577,0.10349677503108978,0.6748837232589722,0.10349677503108978
"Who defined jurisprudence as the knowledge of things divine and human, the science of right and wrong",Austin,Ulpian,Holland,Allen,B,False,0.046601634472608566,0.04112579673528671,0.5677241086959839,0.34434208273887634
Which of the factors below contributed significantly to the revival of natural law in the 20th century?,The Depression of the 1930s.,The rise of Fascism.,The international recognition of human rights after WWII.,The Bolshevik revolution.,C,True,0.04008801281452179,0.03537755087018013,0.6270820498466492,0.2962126135826111
The U.S. Congress is empowered by the Commerce Clause and other provisions of the U.S. Constitution to enact ________ to regulate foreign and interstate commerce.,ordinances,federal statutes,executive orders,charters,B,False,0.08804130554199219,0.06856664270162582,0.39457377791404724,0.447110652923584
"Who amongst the following said that “right with me is a child of law…..a natural right is a son that never had a father""",Jeremy Valdon,Jeremy Bentham,Salmond,Paton,B,False,0.03626330569386482,0.052762795239686966,0.2679515779018402,0.64278244972229
"American realists argued that formalism devalued the authority of the judge to make law, because:",Judicial decisions are less important than legislation.,Formalism treats legal reasoning as syllogistic reasoning.,Judges generally base their decisions on formal logic.,The structure of legal reasoning is flawed.,B,False,0.1577228456735611,0.08442295342683792,0.3783574402332306,0.3783574402332306
Which of the following most accurately describes Hart's response to Fuller's argument concerning the invalidity of Nazi law?,The Nazi law in question was validly enacted.,The court misunderstood the legislation.,Fuller misconstrued the purpose of the law.,The Nazi rule of recognition was unclear.,A,False,0.05460288003087044,0.07944672554731369,0.2772963345050812,0.5870363116264343
Which of the following is the strongest argument against ethical relativism's hostility to human rights?,Utilitarianism,Communitarianism.,Cognitivism.,Positivism.,C,True,0.026185549795627594,0.0380997508764267,0.5259508490562439,0.40961092710494995
Robert Nozick's proposes the formula r x H as a guide to determine the appropriate punishment. What does it mean?,Effectiveness of rehabilitation of multiplied by hazard to the community.,Extent of responsibility multiplied by actual harm done.,Risk of violence multiplied by degree of humility of offender.,Recidivism multiplied by defendant's history.,B,False,0.06484454870223999,0.050500981509685516,0.7899683117866516,0.09434826672077179
Who says that “Social Contract is not a historical fact but a hypothetical construction of reason”,Hobbes,Locke,Thomas Acquinas,Rousseau,D,True,0.02416524849832058,0.03984175994992256,0.2292734831571579,0.706212043762207
The legislative branch of the United States government has the power to ________ the law.,interpret,make,enforce,override,B,False,0.03687287122011185,0.11357643455266953,0.5767887830734253,0.27245572209358215
"Leopold Pospisil identifies four elements manifested by law: authority, universality, 'obligatio' - and fourthly?",Dispute.,Sanction.,Order.,Hierarchy.,B,False,0.28608912229537964,0.09287954121828079,0.3673456907272339,0.25247275829315186
What is Kant's 'categorical imperative?,You must not consciously harm another person.,You must always act in the best interests of the community.,You must treat human beings as means rather than ends.,You must act according as if your values apply to everyone.,D,False,0.17494845390319824,0.12024018913507462,0.6106300950050354,0.09364316612482071
"Which of the following statements is correct concerning the ""reasonable person"" standard in tort law?",The reasonable person standard varies from person to person.,The reasonable person standard focuses on the defendant's subjective mental state rather than on the defendant's behavior,A person with a physical disability must act as would a reasonable person with the same disability.,A person with a mental disability must act as would a person with the same mental disability.,C,True,0.0492863729596138,0.04349507391452789,0.7709686160087585,0.13397423923015594
"What is the purpose of politics, according to Aristotle?",To advance the interests of politicians.,To produce virtuous citizens and encourage righteousness in individuals.,To obtain power.,To secure justice by abolishing slavery.,B,False,0.07140055298805237,0.0809074267745018,0.5978295207023621,0.24921241402626038
Which of the following statements most accurately explains Ross' comparison of social life to the game of chess?,Chess is a game of skill; success in life is also a matter of skill.,"Winning a game of chess, like life, frequently depends on luck.","In both games of chess and social life, there is effectively a dispute or contest.",Social life is similar to chess because individual actions are often related to a common idea of rules.,D,False,0.02709917351603508,0.01643647998571396,0.8974013328552246,0.05736894533038139
Which statement below is the least likely to follow logically from Savigny's notion of a Volksgeist?,A society's law is a reflection of its culture.,Law is like language.,Law is the deliberate expression of a sovereign's will.,Law is an integral element of the social fabric.,C,True,0.061807889491319656,0.03748837858438492,0.5864169597625732,0.3138863742351532
The ________ School proposes that legal rules are unnecessary and are used as an obstacle by the powerful to maintain the status quo.,Law and Economics,Critical Legal Studies,Historical,Natural Law,B,False,0.0261678546667099,0.038074005395174026,0.7647368311882019,0.1706358641386032
Austin has been described as a 'naive empiricist.' Why?,Because he neglects the importance of morality.,Because his account of law is based on an anachronistic model of a legal system.,Because he conceives of laws in a pragmatic rather than a conceptual manner.,Because he overlooks the role of law in economic relations.,C,False,0.10822515189647675,0.0656418725848198,0.20219121873378754,0.6227927803993225
