0,1,2,3,4,5,correct,choiceA_probs,choiceB_probs,choiceC_probs,choiceD_probs
"_______ such as bitcoin are becoming increasingly mainstream and have a whole host of associated ethical implications, for example, they are______ and more ______. However, they have also been used to engage in _______.","Cryptocurrencies, Expensive, Secure, Financial Crime","Traditional currency, Cheap, Unsecure, Charitable giving","Cryptocurrencies, Cheap, Secure, Financial crime","Traditional currency, Expensive, Unsecure, Charitable giving",C,True,0.02282324619591236,0.029305629432201385,0.6669930219650269,0.27804404497146606
"Typical advertising regulatory bodies suggest, for example that adverts must not: encourage _________, cause unnecessary ________ or _____, and must not cause _______ offence.","Unsafe practices, Wants, Fear, Trivial","Unsafe practices, Distress, Fear, Serious","Safe practices, Wants, Jealousy, Trivial","Safe practices, Distress, Jealousy, Serious",B,False,0.09215763956308365,0.15194226801395416,0.4680151343345642,0.2838655412197113
"______ are the obligations of workers towards their employer, based on individual contracts and wider employment laws.",Employee rights,Employee rights,Employer duties,Employee duties,D,False,0.1566329300403595,0.1566329300403595,0.42577239871025085,0.25824400782585144
" ______ is an employee's preferred ratio between work-related and non-work-related activities which, due to intensification of work and technological shifts, has become a hotly contested issue in recent years.",Presenteeism,Absenteeism,Work-play balance,Work-life balance,D,False,0.023435305804014206,0.026555677875876427,0.7760707139968872,0.17316478490829468
" _______ can be a likened to their natural counterparts, comprising of a balanced network of interdependent organisms and their environments thus adding value to sustainability thinking due to the consideration of companies and industries as being bound together, and interdependent due to all kinds of resources and wastes.",Industrial supply loops,Industrial ecosystems,Ecological ecosystems,Corporate ecosystems,B,False,0.02875407412648201,0.06087237969040871,0.8403172492980957,0.06897743791341782
"________, where for example one party possess more resources, unfair distribution of ________, where one party gains more from the relationship, and CSOs being ________, are all limitations and risks of business-CSO collaborations.","Power imbalance, Benefits, Hoodwinked","Power imbalance, Resources, Co-opted","Informational asymmetries, Benefits, Hoodwinked","Informational asymmetries, Resources, Co-opted",B,False,0.01994747295975685,0.04222879931330681,0.6605695486068726,0.2753663659095764
Although corporate profit maximization is not directly prescribed by major normative theories to which normative theory is it most similar?,hedonistic utilitarianism,preference utilitarianism,The Categorical Imperative,ethics of care,B,False,0.054788537323474884,0.07971684634685516,0.4587388038635254,0.40483558177948
What does Milton Friedman believe to be the sole responsibility of business?,The only social responsibility of business is to its shareholders,Managers should act in ways that balance the interest of society and shareholders,The primary responsibility organizations have is to its employees,The primary responsibility organizations have is to its stakeholders,A,False,0.06390060484409332,0.06390060484409332,0.7784687280654907,0.09297483414411545
"______ regulation goes further than the ______ that CSOs have with businesses, as it also concerns _______of such processes.","Legal, Interactions, Mechanics","Civil, Relations, Outcomes","Political, Interactions, Outcomes","Environmental, Relations, Mechanics",B,False,0.02077670395374298,0.04398428276181221,0.7796400189399719,0.15352021157741547
"_______ working practices refer to working patterns which involve temporal, spatial and task related fluidity.",Dynamic,Fluid,Flexible,Modern,C,True,0.03871694579720497,0.06383345276117325,0.7776506543159485,0.11925660073757172
" What, according to Schnackenberg and Tomlinson (2014), are the three criteria which can be used to assess the quality of corporate transparency?","Breadth, Clarity, Accuracy","Disclosure, Detail, Accuracy","Disclosure, Clarity, Accuracy","Disclosure, Clarity, Efficiency",C,True,0.009165332652628422,0.01940300688147545,0.9348892569541931,0.036249589174985886
"A corporation is ________ from its managers, employees, investors and customers. It therefore has _______ succession and also ________.","Indistinguishable, Perpetual, Does not own its own assets","Independent, Limited, Owns its own assets","Independent, Perpetual, Owns its own assets","Indistinguishable, Perpetual, Owns its own assets",C,True,0.005624088458716869,0.036673665046691895,0.6500562429428101,0.30706483125686646
"The UK Public Services (Social Value) Act 2013 requires those procuring ______ to consider how they can secure wider _____, _____and _____ benefits.","Private services, social, economic and environmental","Public services, social, cultural and environmental","Private services, cultural, economic and environmental","Public services, social, economic and environmental",D,False,0.03891027718782425,0.07269396632909775,0.7815338373184204,0.1057690978050232
When the true cost an item is deliberately obscured by a company this is known as?,Predatory pricing,Deceptive pricing,Price fixing,Skimming,B,False,0.03952066972851753,0.08366525918245316,0.6182072758674622,0.2577071189880371
What are the three differing types of stakeholder theory according to Donaldson and Preston (1995)?,"Normative, Descriptive and Economic","Normative, Moral and Instrumental","Political, Descriptive and Instrumental","Normative, Descriptive and Instrumental",D,False,0.01961364410817623,0.06845834106206894,0.8339933753013611,0.07757346332073212
"The Right to _______ has been a long-standing ethical concern for employees which today are addressed in most developed countries through a dense network of occupational health, safety and environmental regulations companies must abide by.",Work-life balance,Healthy and safe working conditions,Employee privacy,Free Speech,B,False,0.058224570006132126,0.08471625298261642,0.6259731650352478,0.23028267920017242
Which of the following would most effectively act as the primary objective of a business organisation?,To make a profit,To procure resources,To communicate with shareholders,To mediate between the organisation and the environment,A,False,0.15037405490875244,0.10335046797990799,0.5947409272193909,0.15037405490875244
What is the enlightened self-interest model of CSR?,That it is in an organization's own best interest to put itself first rather than its ethics,That it is in an organization's best interest to consider what a shareholder would want,That it is in an organization's own best interest to act in an ethical way,That it is in an organization's own best interest to follow the legislation and abide by the law,C,True,0.009259171783924103,0.028520258143544197,0.9444611668586731,0.017298409715294838
"________ is the right of a consumer to control what information companies can collect about them and how it is stored, used and shared.",Consumer inclusion,Consumer control,Consumer privacy,Consumer exclusion,C,True,0.03317921236157417,0.054703276604413986,0.6664223670959473,0.24516311287879944
The Anglo-American model being considered the best model in light of the recession in the late 2000s.,"1,2,3","1,3,4","2,3,4","1,2,3,4",A,False,0.04217790439724922,0.06136848405003548,0.7476211786270142,0.147215336561203
"_______ economy is the term used to describe individuals being hired for a specific task rather than on a long-term basis. While this results in _________ which is beneficial for businesses, issues for those employed in such a manner relate to increased ________, uncertainty and a lack of _______.","Gig, Flexibility, Risk, Social welfare structures","Sharing, Risk, Flexibility, Autonomy","Gig, Risk, Flexibility, Autonomy","Sharing, Flexibility, Risk, Social welfare structures",A,False,0.016227973625063896,0.038928885012865067,0.6900309920310974,0.25384822487831116
"The Theory of _________ posits that 3 three levels of moral reasoning exist which an individual can engage in to assess ethical issues, dependant on their cognitive capacity.",Egoism,Cognitive moral development,Power distance,Uncertainty avoidance,B,False,0.04186566174030304,0.06091417744755745,0.6548891663551331,0.2409202754497528
_______ theory can be described as a code of conduct to which all rational beings should adhere. This contrasts with ________ morality which is the code of conduct adopted by a particular group or society.,"Descriptive, Normative","Normative, Instrumental","Normative, Descriptive","Ethical, Descriptive",C,True,0.05634348466992378,0.08197928965091705,0.6864041686058044,0.17355015873908997
"___________, ___________ and __________ are all factors which can impact the moral intensity","Social consensus, Temporal immediacy, Proximity","Proximity, Social dissensus, Futility of effect","Proximity, Temporal immediacy, Social dissensus","Social dissensus, Cultural immediacy, Proximity",A,False,0.02081524394452572,0.04406587406992912,0.6083105802536011,0.32560521364212036
"Better access to certain markets, differentiation of products, and the sale of pollution-control technology are ways in which better environmental performance can:",Increase Revenue,Increase Costs,Decrease Revenue,Decrease Costs,A,False,0.1297035962343216,0.16654270887374878,0.5129876732826233,0.18871764838695526
"_______ is the term used to describe the ongoing approval and acceptance of a company's activities by society, especially among local communities and civil societies.",Enlightened self interest,Social licence to operate,Community approval,Supply chain responsibility,B,False,0.010950393974781036,0.05561068654060364,0.8698975443840027,0.0630151703953743
"The degree to which corporate decisions, policies, activities and impacts are acknowledged and made visible to relevant stakeholders is known as ________",Corporate Opaqueness,Corporate Transparency,Corporate Openness,Corporate Visibility,B,False,0.035051871091127396,0.08408506214618683,0.621309220790863,0.2590002119541168
" _________, such as _______ and _______ are processes by which organisations implement environmental goals, policies and responsibilities and ensure regular auditing and reporting, which go beyond legal compliance.","Environmental management systems, SA8000, EMAS","Social accountability standards, ISO14001, SA8000","Environmental management systems, ISO14001, EMAS","Social accountability standards, EMAS, SA8000",C,True,0.0558503083884716,0.15181687474250793,0.46762892603874207,0.3213963508605957
"The so-called BRIC countries (Brazil, Russia, India and _______) tend to follow a __________ approach to corporate governance. However, recently this has tended to move towards more _______-based mechanisms.","Canada, Market, Relationship","China, Market, Relationship","Canada, Relationship, Market","China, Relationship, Market",D,False,0.055299703031778336,0.1703350692987442,0.5246689915657043,0.24783608317375183
A stakeholder orientation includes all of the following activities except:,Generating Data About Stakeholder Groups,Assessing The Firm's Effects On Stakeholder Groups,Distributing Stakeholder Information Throughout The Firm,Minimizing The Influence Of Stakeholder Information On The Firm,D,False,0.031792283058166504,0.05939580500125885,0.6385650634765625,0.26619353890419006
"Ethical issues related to marketing communications include the fact that they are _________ and unavoidable, they create ________ needs, reinforce _________ and perpetuate _________ and ______.","Intrusive, Artificial, Consumerism, Insecurity, Social Stereotypes","Intrusive, Artificial, De-materialism, Security, Happiness","Intrusive, Real, Consumerism, Insecurity, Happiness","Intrusive, Real, De-materialism, Security, Social stereotypes",A,False,0.03134435415267944,0.0751911997795105,0.6295681595802307,0.26244306564331055
"In order to try and align the interest of shareholders and senior management of a company, _________ are often made available to _______ of a company, to ensure that it is in their interests to increase _______ and dividend performance.","Share options, Senior managers, Share Price","Share options, All employees, Share Price","Non-financial remunerations, Senior managers, Employee Satisfaction","Non-financial remunerations, All employees, Employee Satisfaction",A,False,0.04281856119632721,0.11639292538166046,0.3163887560367584,0.5216369032859802
Predatory pricing.,"1,2,4","1,2,3,4","1,2","1,4",D,False,0.07781621813774109,0.06867256760597229,0.7382997274398804,0.11322193592786789
"There are a number of means by which can influence _______. These include _________to decision maker, varying from very direct modes to indirect modes, _________, being either public or private and ________ of communication.","Government, Avenue of approach, Breadth of transmission, Content","Consumers, Avenue of approach, Height of transmission, Content","Government, Breath of transmission, Avenue of approach, Content","Employees, Breadth of transmission, Content, Avenue of approach",A,False,0.050014205276966095,0.08245948702096939,0.3261336088180542,0.5377033948898315
Pick the correct description of the following term: Utilitarianism is…,A theory which states that an action is morally incorrect if it promotes the greatest good for the greatest number,A theory which states that an action is morally right if it promotes the greatest good for the decision maker,A theory which states that an action is morally right if it promotes the greatest good for the smallest number,A theory which states that an action is morally right if it promotes the greatest good for the greatest number,D,False,0.26462629437446594,0.20609118044376373,0.38502898812294006,0.14164426922798157
"Cognitive ______ models such as the Theory of _________ serve to try and explain consumer behaviour, but arguably somewhat oversimplify and overestimate individual ________.","Decision, Market equilibrium, Rationality","Attitudinal, Planned Behaviour, Social pressures","Decision, Planned behaviour, Rationality","Attitudinal, Market equilibrium, Social pressures",C,True,0.024298520758748055,0.05143997073173523,0.6266671419143677,0.2960166037082672
"____________ refers to a strategic process involving stakeholder assessment to create long-term relationships with customers, while maintaining, supporting, and enhancing the natural environment.",Eco-strategy,Green Marketing,Superfund reauthorization,Recycle and reprocess management,B,False,0.038527220487594604,0.05605676770210266,0.6829112768173218,0.22170881927013397
Sustainability can broadly be defined as,"The short-term maintenance of systems according to environmental, economic and social considerations","The long-term maintenance of processes according to environmental, economic and cultural considerations.","The short-term maintenance of systems according to environmental, political and social considerations.","The long-term maintenance of systems according to environmental, economic and social considerations.",D,False,0.08829263597726822,0.10004865378141403,0.7392651438713074,0.06876236945390701
Which of the three following organisational characteristics of small businesses tend to characterise their engagement with business related issues?,"Size and complexity, owner and family member influence on the organisation, shareholder and stakeholder power","Lack of organisational resources, size and complexity, owner and family member influence","Informal relationships, owner and family member influence on the organisation, lack of organisational resources","Bureaucratic and formal organisational structure, lack of organisational resources, conflicts of interest",C,True,0.0428583063185215,0.08006984740495682,0.7596816420555115,0.11650095134973526
"A(n) __________ is a ________, __________ framework which goes beyond linear functions, operations and transactions to produce a certain commodity or product","International supply chain, Static, Disconnected","Global production network, Dynamic, Relational","International supply chain, Dynamic, Disconnected","Global production network, Static, Relational",B,False,0.009031488560140133,0.06673417240381241,0.7174599766731262,0.205555722117424
Demand reduction.,"1,3,4","2,3,4","1,2,3","1,2,4",D,False,0.14008250832557678,0.17986948788166046,0.5540370345115662,0.12362238019704819
" Although the benefit and contribution of civil society in encouraging sustainability, lobbying on important issues and helping the needy are taken for granted in many places, in many other countries, such as _____ and ______ civil society is far less developed than in, for instance, _______.","Russia, China, Britain","Norway, China, Russia","Britain, United States, Australia","Canada, Russia, United States",A,False,0.024355433881282806,0.058425650000572205,0.7117701172828674,0.20392556488513947
"The extent to which an individual is able to creatively consider the consequences of, resolutions to, and issues associated with moral decision making is known as _________.",Moral imagination,Ethical reflexivity,Moral originality,Moral reflexivity,A,False,0.09305383265018463,0.17384745180606842,0.5354878902435303,0.19699499011039734
"When negotiating using unethical practices, businesses can risk _______, if the negotiations are part of a longer-term business association, as well as a ___________ and __________, as negotiations can impact company image and stymy progress.","Rigid negotiations, Enhanced reputation, Greater opportunities","Damaged relationships, Sullied reputation, Lost opportunities","Rigid negotiations, Sullied Reputation, Lost opportunities","Damaged relationships, Rigid negotiations, Lost opportunities",B,False,0.02012532576918602,0.05470631271600723,0.7551973462104797,0.16850730776786804
"________ is the use of language of to mask or expose the ethical nature of decisions, actions and behaviours.",Ethical splicing,Moral framing,Ethical window dressing,Moral splicing,B,False,0.02804592251777649,0.04080657660961151,0.7233138680458069,0.20723289251327515
The extent to which an individual believes they can control their life is determined by their __________.,Moral imagination,Personal integrity,Cognitive moral development,Locus of control,D,False,0.10134859383106232,0.08943981677293777,0.6608758568763733,0.14746133983135223
"The enforcement of company privacy is complex as corporations are somewhat __________, as there are few clear barriers to define their limits, it is difficult to _________ due to the number of individuals involved and much corporate activity takes place in ________.","Boundaryless, Control information, Private spaces","Public spaces, Maintain individual privacy, Private spaces","Boundaryless, Control information, Public spaces","Private spaces, Maintain individual privacy, Public spaces",C,True,0.11718450486660004,0.09126339107751846,0.5951120853424072,0.1932045966386795
"What term can be used to describe 'the hypothetical agreement between member of society and those who govern it which establishes the inter-relationships, rights and responsibilities on a fair basis'?",Social Contract,Duty Ethics,Consequentialism,Virtue Ethics,A,False,0.21997898817062378,0.1177462711930275,0.5277021527290344,0.13342399895191193
"Businesses have _____ within society and have the potential to provide a ____ to society while ____ has the potential to inflict enormous harm on individuals, communities and the environment.","Little power, Small contribution, Business malpractice","Little power, Major contribution, Corporate social responsibility","Huge power, Small contribution, Corporate social responsibility","Huge power, Major contribution, Business malpractice",D,False,0.012663732282817364,0.0825779065489769,0.7834774255752563,0.12015015631914139
According Carroll what four categories or aspects can corporate social responsibility be broken down into?,"Political, Legal, Ethical and Philanthropic","Economic, Legal, Ethical and Philanthropic","Economic, Legal, Cultural and Philanthropic","Economic, Legal, Ethical and Environmental",B,False,0.05726531147956848,0.04459827020764351,0.7905232310295105,0.1069856807589531
"Affirmative action involves ________ attempts to target ______ who are _________ within an organisation's workforce, for instance by trying to ______ the proportion of women, disabled or racial minorities in senior management positions.","Proactive, Groups, Under-represented, Increase","Passive, Groups, Under-represented, Retain","Proactive, Individuals, Represented, Increase","Passive, Individuals, Represented, Retain",A,False,0.0493813157081604,0.06340686231851578,0.6015875935554504,0.28416985273361206
"Traditionally consumer rights were based on the notion of _______ or _______ where the responsibility lay with consumer to avoid subpar products. However, this has gradually eroded due to increased ________ at a ________, EU and UN level.","Caveat emptor, Company Responsibility, Informal codes, International","Caveat emptor, Buyer beware, Regulation, National","Cemptor Eaveat, Buyer beware, Regulation, National","Cemptor Eaveat, Company Responsibility, Informal Codes, International",B,False,0.03400395065546036,0.06352774798870087,0.36557692289352417,0.531911313533783
"The state of being unable to make an informed, reasoned decision about a product purchase is known as?",Consumer inclusion,Consumer competence,Consumer exclusion,Consumer vulnerability,D,False,0.015758469700813293,0.03336068615317345,0.5913322567939758,0.35866114497184753
"According to Mitchell et al (1997) ______, the perceived ability of a stakeholder to influence organisational action, ________ whether the organisation perceives the stakeholder's actions as desirable, proper and appropriate and ________, the immediacy of attention the stakeholder claims require, determine stakeholder ________.","Power, Legitimacy, Salience Urgency","Legitimacy, Urgency, Salience, Power","Power, Legitimacy, Urgency, Salience","Salience, Power, Urgency, Legitimacy",C,True,0.023868415504693985,0.05052943900227547,0.697537362575531,0.22645722329616547
_______ and _______ are both examples of _______ -based theories which are based on basic universal principles of right and wrong.,"Ethics of duty, Ethics of rights and justice, Principle","Utilitarianism, Egoism, Principle","Ethics of duty, Utilitarianism, Consequentialist","Egoism, Ethics of rights and justice, Consequentialist",A,False,0.02954501286149025,0.048711493611335754,0.6724413633346558,0.24737738072872162
The complexity of the theory.,"1,2,3,4","1,3,4","1,2,3","1,2,4",C,True,0.1800103634595871,0.20397846400737762,0.3810819387435913,0.23113788664340973
"________ is any business effort to influence government or public policy. It includes activities such as __________, political advertising, financial contributions, ________ action and political ________.","Private regulation, Lobbying, Environmental, Fundraising","Private regulation, Consumer Marketing, Legal, Fundraising","Corporate political activity, Lobbying, Legal, Campaigning","Corporate political activity, Consumer marketing, Environmental, Campaigning",C,True,0.026273034512996674,0.08092664927244186,0.5277079939842224,0.3626880645751953
_________ such as the ________ in the United States is a key factor in driving ethical business practices.,"Legislation, Sarbanes-Oxley Act","Internal company policy, Unethical corporate practices act","Internal company policy, Sarbanes-Oxley Act","Legislation, Unethical corporate practices act",A,False,0.04057643935084343,0.05903836712241173,0.6347222924232483,0.26459160447120667
" _______, where actors are convinced that their actions harms nobody, _______ where actors argue that their norm violation is an attempt to realize higher-order values and ________ , where actors argue they are owed something, are all strategies for justifying or denying unethical behaviour.","Appeal to higher loyalties, Denial of injury, Metaphor of the ledger","Appeal to higher loyalties, Metaphor of the ledger, Denial of injury","Denial of injury, Appeal to higher loyalties, Metaphor of the ledger","Denial of injury, Metaphor of the ledger, Appeal to higher loyalties,",C,True,0.01800783909857273,0.04895038157701492,0.4644283056259155,0.4644283056259155
Which of the following is not one the underlying principles of the corporate governance Combined Code of Practice?,Openness,Integrity,Availability,Acceptability,D,False,0.019554197788238525,0.06023117154836655,0.5714574456214905,0.34660646319389343
"Factors that impact ethical decision making can be broadly broken down into ________ factors, related to the unique characteristics of a person, and _________ factors, which are features of the person's environment or the particular issue.","Tailored, Individual","Situational, Individual","Situational, Tailored","Individual, Situational",D,False,0.03777685388922691,0.07057645171880722,0.7587683796882629,0.13185416162014008
"_____ is a key driving force shaping the current and future state of business ethics, in particular regarding _____, ______ and _____ related issues.","Globalisation, Cultural, Legal, Accountability","Nationalisation, Cultural, Environmental, Accountability","Privatisation, Cultural, Legal, Accountability","Globalisation, Technological, Financial, Accountability",A,False,0.07273202389478683,0.08241618424654007,0.6900622844696045,0.15397371351718903
CSO's frequently spend too much time communicating their performance measures and too much time devising them with input from beneficiaries.,"2,3","1,3","3,4","1,2,3,4",B,False,0.05912753567099571,0.04604857414960861,0.6356809735298157,0.23385398089885712
