0,1,2,3,4,5,correct,choiceA_probs,choiceB_probs,choiceC_probs,choiceD_probs
"The race to the ______ is when, due to increased ________, countries compete for foreign investment through companies' relocation decisions by weakening their ______ and _____ standards.","Bottom, Globalisation, Social, Environmental","Top, Globalisation, Political, Environmental","Bottom, Standardisation, Social, Economic","Top, Standardisation, Political, Economic",A,False,0.06847034394741058,0.1449517160654068,0.5732951760292053,0.21090352535247803
"Managers are entrusted to run the company in the best interest of ________. Specifically, they have a duty to act for the benefit of the company, as well as a duty of ________ and of _______.","Shareholders, Care and Skill, Diligence","Stakeholder, Care and Skill, Diligence","Shareholders, Self-interest, Diligence","Stakeholders, Care and skill, Self-interest",A,False,0.02677973546087742,0.0566927008330822,0.690658450126648,0.22422397136688232
Replacing supply chains with _______ enhances the importance of product _______as well as a fundamental redesign of every activity a firm engages in that produces _______.,"Supply loops, Recapture, Waste","Supply loops, Redesign, Profit","Global production networks, Recapture, Waste","Global production networks, Redesign, Profit",A,False,0.020055647939443588,0.07000108063220978,0.6641517877578735,0.2443278282880783
A company may become insolvent if it,has negative working capital,cannot meet its budgeted level of profit,makes a loss,cannot pay creditors in full after realisation of its assets,D,False,0.13166189193725586,0.1491924524307251,0.35789409279823303,0.35789409279823303
"The ISO 26000 standard on ________ is emblematic of a number of trends emerging within the shared global governance space. Specifically, these trends concern, more deliberation and ________, greater focus on the _______ rather than outcomes and more _______ rather than specific norms.","Social responsibility, Collaboration, Process, Frameworks","Social responsibility, Individualism, Process, Legislation","Environmental responsibility, Individualism, Inputs, Frameworks","Environmental responsibility, Collaboration, Inputs, Legislation",A,False,0.03434940055012703,0.05663258954882622,0.5373150706291199,0.36929088830947876
"The ___________, otherwise known as _________ was launched in 1997 and is a global workplace standard that covers key labour rights such as working hours, forced labour and discrimination, with compliance being certified by independent auditors.","Social accountability standard, SA 8000","Social accountability standard, SA 9000","Sarbanes-Oxley Act, SA 8000","Sarbanes-Oxley Act, SA 9000",A,False,0.12583981454372406,0.301874041557312,0.3876139223575592,0.18309585750102997
Managers and directors have a fiduciary responsibility to protect the investment of shareholders.,"1,3,4","1,2,3,","1,2,4","2,3,4",A,False,0.09811758995056152,0.09811758995056152,0.6398070454597473,0.16176855564117432
Cultural homogenization.,"1,3,4","1,2,3","1,2,3,4","2,3,4",B,False,0.14585009217262268,0.14585009217262268,0.3964616358280182,0.30876463651657104
Insider trading undermines the fiduciary relationship.,"1,2,3","1,2,4","2,3,4","1,2,3,4",B,False,0.0635366141796112,0.05607086792588234,0.6830830574035645,0.1957065761089325
"There are two main issues associated with _____ sizing. _______ is a key issue as due to the information policy of the corporation it can be argued that employees have a right to know if they are being made redundant. _______ is a second issue, particularly the ________ package that employees receive when laid off.","Down, Involvement, Remuneration, Compensation","Up, Involvement, Autonomy, Compensation","Down, Autonomy, Remuneration, Benefit","Up, Independence, Involvement, Benefit",A,False,0.03103410266339779,0.08435943722724915,0.6233366131782532,0.2598453462123871
_______ locate morality beyond the sphere of rationality in an emotional 'moral impulse' towards others.,Virtue ethics,Ethical egoism,Postmodern ethics,Ethics of duty,C,True,0.06772737205028534,0.12653137743473053,0.7281379103660583,0.0767451673746109
"Under ethical ________ objective moral principles can be rationally determined, while ethical under ________ morality is both context dependant and subjective.","Normativity, Relativism","Absolutism, Relativism","Relativism, Absolutism","Absolutism, Normativity",B,False,0.027531016618013382,0.05828316509723663,0.7100343108177185,0.2034282386302948
" Some of key differences between Islamic finance and conventional finance include - prohibition of charging and paying _______, prohibition on ______ and ______ transactions, prohibition of sinful investment and requirement for all financial products to be backed by __________.","Interest, Certain, Speculative, Intangible assets","Interest, Uncertain, Assured, Intangible assets","Interest, Uncertain, Speculative, Tangible assets","Interest, Certain, Assured, Tangible assets",C,True,0.06201434135437012,0.07027146220207214,0.5883757472038269,0.27792900800704956
"________ reasoning is considered by many to be prevalent within society and particularly within businesses, where it is often referred to in the form of a ___________.","Consequentialist, Cost-benefit analysis","Rationalised, Annual audit","Consequentialist, Annual audit","Rationalised, Cost-benefit analysis",A,False,0.018828483298420906,0.06571786105632782,0.42853429913520813,0.4855929911136627
Which of the following areas is not covered by the principles enshrined in the UN Global Compact?,Human rights,Labour,Commercial performance,Anti-corruption,C,True,0.02999902330338955,0.04364832490682602,0.6025465130805969,0.3225199282169342
"What are, according to Wood (1991), the three outcomes of CSR?","Social policies, Social programmes and Social impacts","Social evaluations, Social programmes and Social impacts","Social policies, Social evidencing and Social impacts","Social policies, Social programmes and Social analysis",A,False,0.009871096350252628,0.018441634252667427,0.8885677456855774,0.08264967054128647
"Businesses engage in social accounting due to demands from _________, in order to identify ________, to improve ___________ and to encourage _________ and ___________","Stakeholders, Risks, Stakeholder management, Accountability, Transparency","Stakeholders, Accountability, Transparency, Risks, Stakeholder Management","Stakeholders, Accountability, Risks, Stakeholders, Stakeholder Management","Stakeholders, Stakeholder Management, Transparency, Risks, Accountability",A,False,0.030798934400081635,0.06520134210586548,0.700980544090271,0.20083428919315338
Post-modern ethics assert that ethics are context and individual specific and as such have an internal guide to ethics.,"2,3","1,3","1,2,3","1,2",B,False,0.10480552911758423,0.09249056875705719,0.6031142473220825,0.19580252468585968
"The focus on issues, the intended audience extending beyond shareholders and the voluntary nature of ___________ distinguish it from _________.","Financial accounting, Environmental management initiatives","Financial accounting, Social accounting.","Social accounting, Financial accounting.","Annual report publication, Social accounting",C,True,0.0712674930691719,0.11750023066997528,0.6761671900749207,0.13314521312713623
"Negative advertising, stealing or poaching customers and predatory pricing are all strategies employed by businesses described using the umbrella term ________.",Reasonable competitive behaviour,Swindles,Competitive tricks,Dirty tricks,D,False,0.047723304480314255,0.07868242263793945,0.6587998867034912,0.2138810008764267
"______ the workplace involves empowering employees through, for example, 'job enrichment' where employees are given a larger scope for deciding how to organize their work or 'job enlargement' where employees are given a wider range of tasks to do.",Re-invigorating,Re-flourishing,Revitalizing,Rehumanizing,D,False,0.017541471868753433,0.02252369560301304,0.845195472240448,0.11438476294279099
The need to head off negative publicity.,"1,3,4","2,3,4","1,2,3","1,2,3,4",C,True,0.2081722766160965,0.1262628734111786,0.49937933683395386,0.16212473809719086
"The rise in business led, private regulation can be attributed to: encouragement of a _______ approach from industry, _________ and _______ achievement of objectives.","Faster, Cost effectiveness, Slower","Faster, Heightened costs, Slower","Proactive, Cost effectiveness, Faster","Proactive, Heightened costs, Faster",C,True,0.015801705420017242,0.02952147275209427,0.7613688111305237,0.1925041824579239
" The ________ perspective on sustainability resulted from growth models that analysed the carrying capacity of the planet, overall concluding that the finite capacity of the earth and_______, ________ and _______ by current and past generations could reduce quality of life for future generations. This contrasts with the environmental perspective with focuses on the need to maintain and preserve the natural environment.","Economic, Overuse of resources, Overpopulation, Over pollution,","Economic, Underuse of resources, Underpopulation, Unsustainability","Environmental, Underuse of resources, Overpopulation, Over pollution","Environmental, Overuse of resources, Underpopulation, Unsustainability",C,True,0.026957470923662186,0.05706896632909775,0.5414552688598633,0.3721364140510559
"Healthy eating, particularly relating to sugar and salt consumption, food and packaging waste and supply chain CO2 emissions are all business ethics issues facing the ________.",Supermarket industry,Chemicals industry,Construction industry,Information and mobile technology industry,A,False,0.04896426573395729,0.0807284265756607,0.7659299969673157,0.10365735739469528
"_______ is a system of exchange based on guaranteeing producers in developing countries a living wage, decent working conditions and opportunities for community development.",Sustainable sourcing,Fair trade,Ethical sourcing,Supply chain responsibility,B,False,0.03187732771039009,0.12607727944850922,0.8221271634101868,0.019334577023983
_________ are individual beliefs about desirable behaviours and goals that are stable over time and which influence decision making.,Character traits,Personal values,Personal attitudes,Personal traits,B,False,0.0727013424038887,0.11986424773931503,0.6087208986282349,0.19762274622917175
They are too irrational and uncodified.,"3,4","1,3","2,3","4,1",B,False,0.08143475651741028,0.04358888044953346,0.5310212969779968,0.32208070158958435
The purposes for which the information is used is in the public's interest.,"1,2","1,3","2,3","1,2,3",A,False,0.03794732689857483,0.04872533306479454,0.7621924877166748,0.15008458495140076
The Private Sector Social Enterprise Model.,"1,2,4","2,3,4","1,2,3,4","1,2,3",D,False,0.1504736691713333,0.10341893136501312,0.5252047181129456,0.21893788874149323
______ is the corporate role in governing citizenship rights for the individual,Political Corporate Social Responsibility,Triple Bottom Line,Sustainability,Corporate Citizenship,D,False,0.02697734162211418,0.05040031298995018,0.6957548260688782,0.2258785218000412
How the code is enforced.,"1,2,3","1,2,4","1,3,4","2,3,4",B,False,0.06653048098087311,0.07538890838623047,0.7152700424194336,0.14084501564502716
"According to Evan and Freeman (1993), the Principle of ________ and the Principle of _______ can be used in a specific situation to determine who constitutes a _______.","Corporate rights, Corporate effect, Stakeholder","Corporate deniability, Corporate effect, Stakeholder","Corporate rights, Corporate responsibility, Stakeholder","Corporate rights, Corporate effect, Shareholder",A,False,0.034600529819726944,0.09405399113893509,0.7875044345855713,0.08300235122442245
The relationship between ethics and the law can be described as…,"Incredibly close, in fact, in all instances what is ethical is also what is legal and vice versa.","Not close, ethics and the law share a small amount of overlap, but fundamentally address differing questions and themes.","Close, as there is considerable overlap between ethics and law, but the two are not equivalent.","Not at all close, ethics and the law are virtually incompatible.",C,True,0.08494265377521515,0.09625262767076492,0.5538956522941589,0.26164180040359497
"In a business to business context, conflicts of interest can arise in two main ways: conflict of _______ and _______ interests, which might arise, for example, when a firm is hired as a supplier of professional services by another firm or conflict of _________ and ________ interests, such as where an individual's interests may conflict with that of their employer.","Professional, Organizational, Personal, Organizational","Professional, Individual, Personal, Organizational","Individual, Organizational, Organizational, Professional","Individual, Professional, Organizational, Personal",A,False,0.06721075624227524,0.0863003209233284,0.6376779675483704,0.2070237100124359
"________ are a business ethics management tool that have grown over the last few decades. Areas which these typically cover are compliance, corruption and environmental issues. However, they are constantly evolving, with for example, the onus on __________ having grown in recent years.","Annual reports, Company financial performance","Annual report, Internet - social media and networking","Codes of ethics, Company financial performance","Codes of ethics, Internet - social media and networking",D,False,0.03847111016511917,0.10457530617713928,0.5310772657394409,0.32211464643478394
Which of the following statements is correct?,Business ethics is not a real concept as the rules and ethics of everyday life don't apply to the world of business.,"Business Ethics is the study of business situations, activities and decisions where issues of right and wrong are addressed.",Business ethics cannot be defined as a real concept as it is an oxymoronic term.,Business ethics is concerned with the study of assessing the activities of a business based on their profitability.,B,False,0.07258995622396469,0.08225519210100174,0.3686422109603882,0.47334596514701843
