0,1,2,3,4,5,correct,choiceA_probs,choiceB_probs,choiceC_probs,choiceD_probs
Every country with a seacoast has an exclusive economic zone (EEZ) under the UN Convention on the Law of the Sea. Which one of the following statements regarding the Law of the Sea and the EEZ is NOT correct?,The EEZ extends up to 200 nautical miles (370 km) from the coastline.,Countries have the right to exploit natural resources in their EEZ.,Countries can exploit resources on the continental shelf extending up to 350 nautical miles (560 km) beyond their EEZ.,A country does not have the right to exploit living resources in its EEZ.,D,False,0.03774004429578781,0.05491144210100174,0.5903536677360535,0.3159935474395752
Which of the following is MOST likely to experience population pressure?,An industrial society with abundant natural resources and large imports of food,A society with a highly mechanized agricultural sector,A non-ecumene,A slash-and-burn agricultural society,D,False,0.038051996380090714,0.3186054527759552,0.5252916216850281,0.11720840632915497
"Part of the boundary between the United States and Mexico is the Rio Grande, an example of",a water divider.,a watercourse.,an artificial boundary.,a natural boundary.,D,False,0.14076533913612366,0.09674649685621262,0.5567377209663391,0.20481237769126892
"When we talk about diffusion of a cultural trait, what do we mean by ""hearth""?",Destination,Origin point,All locations along the diffusion path,Axis point,B,False,0.02201022207736969,0.0527997761964798,0.8259274959564209,0.0986429750919342
The distance north and south of the equator is the,global grid system.,Prime Meridian,latitude.,longitude.,C,True,0.041504185646772385,0.14486385881900787,0.505624532699585,0.3066767752170563
Why are perceptual or vernacular regions so difficult to identify?,Boundaries are constantly being redrawn.,"Physical features, such as rivers, are constantly shifting.",Defining criteria are subjective and differ among researchers.,Antecedent boundaries were drawn before humans were located in the regions.,C,False,0.15334297716617584,0.03877117857336998,0.11942362040281296,0.6872355341911316
Which structure(s) traditionally occupies the center of a historic Asian city?,A central market,High-density housing,A religious building,Government office buildings,C,True,0.1145474910736084,0.07872726768255234,0.6591753363609314,0.1470818966627121
Which description best describes the urban hierarchy model in which the population of a city is inversely proportional to its rank in the hierarchy?,Multiplier effect,Rank-size rule,Central place theory,Burgess's sector model,B,False,0.013339557684957981,0.03199993818998337,0.9351752400398254,0.019408943131566048
Which of the following is a major concern in countries with a large and rapidly aging population?,Immunization,Adequate schools,Daycare facilities,Health care,D,True,0.04329759627580643,0.029757974669337273,0.249160498380661,0.6772883534431458
Which of the following capital cities is located OUTSIDE the central core area of the country?,"Abuja, Nigeria","Paris, France","London, United Kingdom","Cairo, Egypt",A,False,0.03776157647371292,0.054942771792411804,0.5906904935836792,0.31617385149002075
"Spanish colonial architecture, uneven economic development, and rural-to-urban migration flows are most commonly found in which of the following?",Southeast Asia,Sub-Saharan Africa,North America,Latin America,D,False,0.08110398054122925,0.05574189871549606,0.7694931626319885,0.09190285205841064
The purpose for the creation of NATO was to,defend North America and Western Europe against the threat of communism.,form an economic alliance for trade between Europe and North America.,defend Europe against a second Nazi invasion.,defend northern Europe against Chinese missiles.,A,False,0.17117124795913696,0.08085555583238602,0.4652916491031647,0.28221365809440613
Which of the following is NOT a key milestone reached by the EU?,The introduction of a common currency used by many EU countries,A customs union,A single market,A common European language,D,False,0.04195385053753853,0.053869813680648804,0.4510464072227478,0.4510464072227478
The use and spread of English in nineteenth-century India is an example of what type of diffusion?,Stimulus,Contagious,Hierarchal,Relocation,C,False,0.10927014797925949,0.1589871495962143,0.297027051448822,0.4321718215942383
The theory that most migration occurs over a short distance and in steps is attributed to,Rostow.,Ravenstein.,von Thünen.,Burgess.,B,False,0.0033056423999369144,0.004809681326150894,0.9165629744529724,0.07523606717586517
"The way of life based on breeding and herding of animals that are used as a source of food, shelter, and clothing is called",swidden.,subsistence farming.,pastorialism.,hunting and gathering.,C,True,0.13089141249656677,0.2445373386144638,0.5866146087646484,0.0375010147690773
The European Union (EU) replaced which of the following organizations?,NATO,EEC,UN,ASEAN,B,False,0.014599407091736794,0.0078144995495677,0.07414190471172333,0.9032333493232727
"The attempt by core countries to stimulate increased agricultural production in the periphery through use of technology, hybrid seed, and fertilizers is called the",First Agricultural Revolution.,Second Agricultural Revolution.,Third Agricultural Revolution.,Green Revolution.,D,True,0.02604219689965248,0.04293632507324219,0.4073685109615326,0.5230715274810791
Shifting cultivation is most often practiced in,alpine tundra.,tropical forests.,flood plains.,deserts.,B,False,0.2545473277568817,0.17494766414165497,0.47555702924728394,0.09364272654056549
The migration streams into the United States between 1980 and the present have been primarily composed of emigrants from which of the following regions?,Europe and North Africa,Asia and Latin America,Sub-Saharan Africa and Oceania,Central Europe and Australia,B,False,0.1242341473698616,0.0853847935795784,0.5567787885665894,0.23209992051124573
Which one of the following North American associations is NOT correct?,Southeast—African Americans,Oklahoma and the Southwest—Native Americans,Quebec and northern Maine—French Americans and French Canadians,Southern prairie provinces—African Americans,D,False,0.030661797150969505,0.00878475233912468,0.4796312153339386,0.4796312153339386
Which of the following countries is NOT a federal state?,Canada,United States,France,People's Republic of China,C,False,0.022030293941497803,0.03205388784408569,0.44249024987220764,0.5014071464538574
Which of the following world regions is NOT considered one of the world's most densely populated regions?,South Asia,Europe,South America,Northeast United States,C,True,0.007977358996868134,0.009039531461894512,0.7180988788604736,0.26417383551597595
"Olives, grapes, and chickpeas are staple crops of which type of farming?",Pastoral nomadism,Subsistence,Plantation,Mediterranean,D,False,0.06326725333929062,0.10431007295846939,0.6801871061325073,0.15177026391029358
A person who practices the Hindu religion would be most likely to,visit a shrine built on the shore of a lake.,pray five times a day.,bathe in the Ganges River.,make a pilgrimage to Jerusalem.,C,True,0.08219467103481293,0.13551610708236694,0.6073410511016846,0.1740061342716217
"The language with the largest number of ""speakers"" is",English.,Russian.,Spanish.,Mandarin Chinese.,D,False,0.019820207729935646,0.01749127171933651,0.5111698508262634,0.45110583305358887
Which one of the following statements does NOT correctly describe the Green Revolution?,It changed centuries-old methods of farming.,It was an attempt to feed a growing world population.,"It centered on increased rice, wheat, and maize yields.",It greatly improved crop yields in sub-Saharan Africa.,D,True,0.04558547958731651,0.0313304141163826,0.43250301480293274,0.49009013175964355
"Historically, the world's major languages have spread by all of the following methods EXCEPT",Sanskrit records.,migration.,trade.,conquest.,A,False,0.03596266359090805,0.05929240956902504,0.5625507235527039,0.3412042558193207
A primate city is,a large city located on the periphery of the country.,the most important city in a country.,when the largest city in a country is more than twice the size of the next largest city.,the largest city in a country.,C,True,0.1197146475315094,0.1197146475315094,0.5365238189697266,0.22365640103816986
"Which of the following factors would be considered a ""pull"" factor for Riva when considering a move from India to the United States?",Abject poverty,Better job and higher wages,India's caste system,Violence in her neighborhood,B,False,0.023048827424645424,0.04306087642908096,0.5245888829231262,0.4085502326488495
All of the following are reasons major cities attract young people in Latin America EXCEPT,the availability of jobs.,the potential for decent housing.,educational opportunities.,their families live there already.,D,True,0.024556070566177368,0.03153061866760254,0.3841215670108795,0.5588935613632202
"Which language family is most widely spoken in North America and Europe and includes Baltic, Celtic, Germanic, and Greek?",Dravidian,Uralic-Altaic,Sino-Tibetan,Indo-European,D,True,0.18855707347393036,0.047674693167209625,0.31087806820869446,0.45232492685317993
Which theorist(s) tried to explain the prices of farm products as they relate to patterns of land use?,Rostow,Ravenstein,Von Thünen,Burgess,C,True,0.014769705012440681,0.011502658016979694,0.7116442918777466,0.26179933547973633
Which of the following is NOT a spread effect in the core-periphery model of development?,Congestion in the core,High cost of labor in the core,High density in the core,More infrastructure in the core,D,True,0.05287276580929756,0.03206895664334297,0.3447737693786621,0.568435788154602
Which of the following is NOT an important environmental factor influencing a country's agriculture?,Number of frost-free days per year,Availability of sufficient rainfall,Reliability of sufficient rainfall,Amount of fertilizer produced in the country,D,False,0.0440046451985836,0.06402638554573059,0.47309455275535583,0.4175044894218445
Which of the following countries is situated in the region of tectonic activity known as the Pacific Ring of Fire?,Brazil,Australia,Chile,India,C,False,0.06994926184415817,0.06994926184415817,0.4025301933288574,0.45612645149230957
"Which one of the following statements is NOT true of the ""core"" countries?",They are technologically advanced.,They are wealthy.,They are powerful.,They are less developed.,D,True,0.017422322183847427,0.0287245512008667,0.2122473269701004,0.7408159375190735
"If you wanted to find the global distribution of coal, you would use a",reference map.,topographic map.,thematic map.,location map.,C,True,0.03906344622373581,0.06440473347902298,0.475890189409256,0.41997161507606506
Which one of the following is NOT a centripetal force in a state?,A high level of confidence in central government,The existence of strong separatist groups,The existence of national transportation networks,The national anthem,B,False,0.04024721682071686,0.03551804646849632,0.4326983690261841,0.49031150341033936
The cities of Varanasi (Benares) in India and Mecca in Saudi Arabia are alike because both are,capitals of countries formerly colonized by the English,destinations for vast numbers of pilgrims,financial centers for a large fraction of the world's economy,examples of modern urban planning,B,False,0.034630194306373596,0.021004272624850273,0.6138348579406738,0.3285621404647827
China and Vietnam's dispute over the Spratley Islands is,a positional dispute.,a territorial dispute.,a resource dispute.,a functional dispute.,C,False,0.0680682435631752,0.04678257927298546,0.2375815510749817,0.6458135843276978
Which of the following is NOT used by geographers to determine absolute location?,Longitude,Latitude,Equator,Distance to the nearest city,D,True,0.02858698181807995,0.04159380868077278,0.2712257206439972,0.6506366729736328
Which of the following is a characteristic of a developed country?,Over 50% of workforce engaged in agriculture,Women held in inferior place in society,Main disease related to age and lifestyle,High birth and death rates,C,True,0.0362461656332016,0.05273785814642906,0.6424786448478699,0.2678249478340149
"Mary lives in a neighborhood with stores, offices, and restaurants so close that she does not need to own a car; however, she feels she has very little privacy. This is an example of a(n)",win-win.,trade-off.,infill.,leapfrog development.,B,False,0.041528474539518356,0.07758540660142899,0.5732828974723816,0.306856244802475
Which of the following items below is an absolute location?,10 miles east of Pittsburgh,Washington,3 degrees south,"479 Elm Street, Muncie, Indiana",D,False,0.10932571440935135,0.0751383900642395,0.43239158391952515,0.3815842270851135
Which one of the following groups is excluded from the caste system of Hinduism?,Scholar-priests,Warrior-landowners,Businessmen and farmers,Untouchables,D,True,0.029234135523438454,0.025799034163355827,0.19063051044940948,0.7539582848548889
Which of the following is a push factor?,Dissatisfaction with current jobs,Higher-paying jobs elsewhere,An attractive retirement community elsewhere,A pleasant climate,A,False,0.029906773939728737,0.026392634958028793,0.7713059186935425,0.17210161685943604
"The Basques, Bretons, Kashmiris, and Tamils are all examples of",regionalist groups.,separatist groups.,terrorist groups.,interventionist groups.,B,False,0.2184019237756729,0.10316576808691025,0.31777292490005493,0.3600839078426361
Which of the following factors does NOT play a role in gender relationships in a culture or society?,Biology,Advancements in technological development,Religion,Custom,A,False,0.014924399554729462,0.010257379151880741,0.3396777808666229,0.6346015930175781
The intensive agricultural practice of planting and harvesting the same crop more than once a year is called,swidden.,double cropping.,pastorialism.,intertillage.,B,False,0.08862605690956116,0.2126028686761856,0.5100077986717224,0.18762139976024628
"When a new fashion design is introduced globally, the information initially travels through a process known as",contagious diffusion,relocation diffusion,innovative diffusion,hierarchical diffusion,D,False,0.05540580302476883,0.029656589031219482,0.5956684947013855,0.3188383877277374
Opponents of genetically modified organisms (GMOs) in food are afraid that the GMOs,will hinder global trade.,make plants more resistant to disease.,may cause irreversible changes in humans.,make plants more resistant to drought.,C,False,0.02778320387005806,0.021637581288814545,0.23262591660022736,0.7165382504463196
Which one of the following is NOT an advantage of urban agriculture?,Helping to solve the problem of solid waste disposal,Fresh produce for sale to others,Beautification of a dingy urban area,Renewed or purified water supplies,D,True,0.029761534184217453,0.029761534184217453,0.4108452796936035,0.5275357961654663
Which of the following is NOT a problem Europe currently faces today?,Rising immigration,Lack of population growth,Environmental apathy,Urban ethnic ghettos on the rise,C,False,0.07416417449712753,0.04498284310102463,0.2588583827018738,0.6209689974784851
The world systems theory divides the world into,"core, periphery, and semi-periphery.",rich and poor.,developed and undeveloped.,haves and have-nots.,A,True,0.36839407682418823,0.25319331884384155,0.36839407682418823,0.009817369282245636
The majority of Kurds are found in which country?,Iran,Iraq,Turkey,Egypt,C,True,0.11127442121505737,0.046386078000068665,0.49869734048843384,0.34274935722351074
In what country are the most Basque speakers found?,Denmark,Finland,Luxembourg,Spain,D,True,0.004495094530284405,0.003966906573623419,0.020145613700151443,0.9706700444221497
The most rapidly urbanizing area of the world is:,Europe,East Asia,Sub-Saharan Africa,South Asia,C,True,0.021466592326760292,0.014753758907318115,0.6273458003997803,0.33579400181770325
The influence of neo-Malthusianism can be seen in,government programs for birth control and planning.,famine relief.,increased spending in social welfare programs.,increased total fertility rates.,A,False,0.11785685271024704,0.24950295686721802,0.41136083006858826,0.22018559277057648
The process of devolution involves,the change of government from a democracy to a communist dictatorship.,the movement of power from the central government to regional governments in the country.,the movement of power from a monarchy to a military dictatorship.,the movement of power from regional governments to central governments.,B,False,0.2334355264902115,0.11026713252067566,0.1604377180337906,0.4941830039024353
The theory that cities grow outward from a core utilizing several nodes of growth was proposed by,Rostow.,Ravenstein.,von Thünen.,Harris and Ullmann.,D,False,0.0157722607254982,0.04287344589829445,0.861136257648468,0.08009814471006393
The theory that the main purpose of a settlement or market town is to furnish goods and services to the surrounding market area is called the,urban hierarchy theory.,central place theory.,concentric zone model.,multiplier effect.,B,True,0.09330067783594131,0.3256513476371765,0.3256513476371765,0.253617525100708
Which one of the following statements does NOT correctly describe transnational companies (TNCs)?,"Many TNCs operate in areas of electronics, chemicals, pharmaceuticals and petroleum.",Most TNCs produce and sell manufactured goods.,"Most TNCs are headquartered in the United States, Japan, and the European Union.",TNCs are generally controlled by foreign governments.,D,True,0.032794881612062454,0.032794881612062454,0.2745881676673889,0.6587027907371521
"The ""melting pot"" theory of combining several immigrant groups into one mainstream culture is called",amalgamation theory.,acculturation.,ethnic islands.,ethnic clustering.,A,False,0.05843261256814003,0.12370184808969498,0.5543932318687439,0.26187682151794434
Which theory below was used as justification for US involvement in Vietnam in the 1960s and 1970s?,Devolution,Colonialism,Heartland theory,Containment theory,D,False,0.06639678031206131,0.06639678031206131,0.4329614043235779,0.4329614043235779
Urban agriculture can benefit urban society in all of the following ways EXCEPT,create sustainable food systems in urban areas.,provide jobs for women and children.,turn urban waste into a resource when utilized in safe manner.,replace agribusiness as the main focus of global food production.,D,True,0.007710455451160669,0.005299312993884087,0.19885525107383728,0.7864878177642822
Which one of the following organizations is NOT a supranational organization?,UN,NATO,ASEAN,PLO,D,True,0.014953224919736385,0.03165597841143608,0.02793630212545395,0.9251232743263245
Which one of the following demographic factors characterizes stages 4 and 5 in the demographic transition model?,Zero population growth,High mortality rates,High birth rates,High sex ratios,A,False,0.026295103132724762,0.0714775025844574,0.7684555649757385,0.13353754580020905
Which of the following statements does NOT describe a factor that contributed to suburbanization in the United States?,A shorter workweek made time for a commute possible.,Changes in the housing mortgage regulations made home ownership easier.,Fixed-route public transit routes increased in importance.,Improved automobiles made transportation easier and less limited.,C,False,0.07917100191116333,0.08971249312162399,0.31312739849090576,0.5162597894668579
An isobar map shows lines connecting all points of equal,atmospheric pressure,surface temperature,elevation,precipitation,A,False,0.03384684771299362,0.06323423236608505,0.6798321008682251,0.2207091599702835
Ralph purchases garden fertilizer at the nearby garden shop rather than drive 50 miles to the neighboring town for the same product. This reflects which type of spatial interaction?,Transferability,Complementarity,Intervening opportunity,Territoriality,C,True,0.09827058017253876,0.07653320580720901,0.640804648399353,0.18359361588954926
What type of countries generally possesses a greater variety of climates and resources than other countries?,Perforated states,Fragmented states,Elongated states,Prorupt states,C,True,0.078553706407547,0.06932340562343597,0.45204538106918335,0.3989286422729492
Which of the following factors has little or no impact on mortality rates in the developing countries?,New medicines,Improved birth control methods,Pesticides,Famine relief,B,False,0.05724725127220154,0.03934542089700699,0.4793253540992737,0.4230031371116638
"The idea that you identify with, and give allegiance, to a nation-state is",regionalism.,diffusion.,iconography.,nationalism.,D,False,0.05582801625132561,0.06326142698526382,0.46744224429130554,0.412516325712204
What condition occurs when the people of one state want to annex a territory whose population is ethnically related to that state's population but now under the rule of another state?,Nationalism,Resource dispute,Irredentism,Positional dispute,C,False,0.018027804791927338,0.023148158565163612,0.2820023000240326,0.6764883995056152
"Variations in vocabulary, pronunciation, and rhythm in a spoken language are called",syntax.,isoglosses.,lingua francas.,dialects.,D,False,0.06553329527378082,0.0841464176774025,0.7983590364456177,0.05103738233447075
Boundary problems along the United States–Mexico border are caused by which type of issue below?,Ownership of fertile ground,Land use,Irredentism,Immigration,D,True,0.0424501970410347,0.03746216744184494,0.4027562737464905,0.5171492695808411
In which country does language pose a centrifugal force?,Canada,United States,Brazil,Norway,A,False,0.0076329526491463184,0.01831050030887127,0.6870964765548706,0.2864243984222412
Quebec is a strong example of which of the following situations?,Irredentism,Secession,Ethnonationalism,A colony,C,True,0.01902143843472004,0.03136105090379715,0.808812141418457,0.14055046439170837
Which of the following items below is NOT considered a barrier to the diffusion of an innovation?,Internet,Distance,Cultural obstacles,Government interference,A,False,0.02392958104610443,0.02711576782166958,0.33033767342567444,0.6171520352363586
Change in any culture is introduced through all the following processes EXCEPT,innovation.,diffusion.,acculturation.,gravity.,D,True,0.048078056424856186,0.08982162922620773,0.40255263447761536,0.45615190267562866
Which of the following statements regarding historical North American migration streams is NOT correct?,Canada's first major migration came from France.,Canada's second major migration stream originated in the British Isles.,Canada's third major migration stream came from Latin America.,The first major migration wave to the United States originated in Europe.,C,False,0.09238732606172562,0.07195132970809937,0.36539897322654724,0.4691815674304962
A chief factor that contributed to the Second Agricultural Revolution was,the Industrial Revolution.,World War I.,World War II.,the discovery of the plow.,A,False,0.03642968460917473,0.06805960834026337,0.7317097783088684,0.16326652467250824
Zero population growth (ZPG) is achieved when,CBR – CDR 5 2.,Births 1 immigration 5 deaths 1 emigration.,Total fertility 5 3.,Replacement fertility is achieved.,B,False,0.07788881659507751,0.11332757025957108,0.7389885783195496,0.06873664259910583
In which of the following Asian countries would one find special economic zones (SEZs)?,Japan,South Korea,China,Vietnam,C,True,0.21184158325195312,0.11339063942432404,0.5081815719604492,0.1649823933839798
Which of the following industries does NOT need to be close to its markets?,Dairy foods,Bulk-gaining products,Single-market products,Bulk-reducing products,D,False,0.061939362436532974,0.061939362436532974,0.5186119079589844,0.35643643140792847
Which of the following is NOT a characteristic of a city in the developing world?,Contains modern centers of commerce,Has a well-developed infrastructure,Experiences large in-migrations of rural people into the city,Produces a large share of its country's GDI,B,False,0.05613257363438606,0.05613257363438606,0.41476669907569885,0.4699922502040863
A map that presents a single class of statistics is called a,general purpose map.,thematic map.,reference map.,mental map.,B,False,0.03437165915966034,0.11996887624263763,0.4744861125946045,0.36953017115592957
The construction of freeways leads to all but which of the following results?,Urban sprawl,Traffic increase,Traffic congestion,Decreased dependency on cars,D,False,0.07258147746324539,0.06405293196439743,0.5363086462020874,0.3252876102924347
Which continent has the highest total fertility rates?,Africa,Asia,South America,Europe,A,False,0.06113087013363838,0.02248878963291645,0.3986233174800873,0.5118424892425537
What monotheistic religion is based on the life and teachings of Jesus Christ of Nazareth?,Islam,Christianity,Hinduism,Buddhism,B,False,0.10234106332063675,0.0620729960501194,0.2455034703016281,0.58893221616745
Which of the following statements is true concerning folklore?,It is the written tradition of a group.,It encourages changing the old values and customs.,It serves to blend all cultures into one.,It expresses in words the shared values of a group by expressing their ideals.,D,False,0.17420925199985504,0.06408799439668655,0.47354981303215027,0.2872224748134613
The irregularity of the wet monsoon in South Asia in recent years may have a significant negative effect on which of the following?,Food production,Population patterns,Wildlife conservation efforts,Tourism,A,False,0.04761943966150284,0.061144571751356125,0.5801235437393188,0.3105177879333496
"According to Alfred Weber's least-cost theory, which one of the following costs of production is the most important factor in locating an industry?",Labor,Transport,Raw materials,Agglomeration costs,B,False,0.062753826379776,0.05538005754351616,0.7644980549812317,0.1172395795583725
