0,1,2,3,4,5,correct,choiceA_probs,choiceB_probs,choiceC_probs,choiceD_probs
The main factor preventing subsistence economies from advancing economically is the lack of,a currency.,a well-connected transportation infrastructure.,government activity.,a banking service.,B,False,0.08288905769586563,0.12060286849737167,0.5405045747756958,0.25531628727912903
The tendency for a population to continue to grow long after replacement fertility has been achieved is called,zero population growth.,rapid growth rate.,homeostatic plateau.,demographic momentum.,D,False,0.019584810361266136,0.028495732694864273,0.5050989389419556,0.4457482099533081
The tendency for migration to decrease with distance is called,push factors.,pull factors.,distance decay.,migration selectivity.,C,True,0.11447688192129135,0.07867872714996338,0.4527648389339447,0.352613627910614
"Which zone contains low-income slums, ethnic ghettos, and general deterioration in Burgess's concentric zone model of urban form?",First,Second,Third,Fourth,A,False,0.057072579860687256,0.03922537341713905,0.6135880947113037,0.2898384928703308
Which of the following statements is TRUE concerning women in the labor force?,Most women work in agriculture,The percentage of women economically active in the labor force declined worldwide,The percentage of women in the total labor force declined,Women spend more hours per day working than men in all regions except Anglo America and Australia,D,False,0.005271758884191513,0.014330126345157623,0.8865735530853271,0.09344416111707687
All the following factors can be considered pull factors of migration EXCEPT,safety.,better climate.,better schools.,overcrowding.,D,True,0.026108523830771446,0.01583562046289444,0.1929173469543457,0.763002872467041
Which of the following countries does NOT have a well-known example of a relict boundary?,Vietnam,United Kingdom,Germany,Bolivia,D,True,0.036441072821617126,0.04679126664996147,0.3457432985305786,0.5700343251228333
Which form of migration below are farm workers from another country most likely to be practicing during the year?,Chain migration,Cluster migration,Circular migration,International migration,C,True,0.0951719805598259,0.050941888242959976,0.42653119564056396,0.42653119564056396
Which of the following is a centrifugal force in a country?,Religious differences,A national holiday,An attack by another country,A charismatic national leader,A,False,0.04141797870397568,0.060262806713581085,0.5045742988586426,0.39296284317970276
Early settlements and high population density along coastlines and rivers are best attributed to which of the following?,Mediterranean climate,Limited forest cover,Growth of manufacturing,Access to trade routes,D,False,0.027286607772111893,0.039701782166957855,0.7037308812141418,0.22846797108650208
The first stage of the demographic transition exhibits,high birth rates with high but fluctuating death rates.,declining birth rates with continuing high death rates.,low birth rates with continuing high death rates.,high birth rates with declining death rates.,A,True,0.3495577275753021,0.24024727940559387,0.100149966776371,0.3084836006164551
What is the population statistic that tells us the level of fertility at which a population will have just enough births to replace parents and compensate for early deaths?,Crude birth rate,Replacement level,Mortality rate,Total fertility rate,B,False,0.07425196468830109,0.10803597420454025,0.33277422189712524,0.4841836094856262
What is the most rapidly growing religion in the United States today?,Islam,Christianity,Hinduism,Buddhism,A,False,0.010319853201508522,0.008037109859287739,0.16142965853214264,0.8198074698448181
The outlying area serviced by a urban center is referred to as a,redline area.,threshold.,range.,hinterland.,D,False,0.057050444185733795,0.07325422763824463,0.6133500933647156,0.2556823492050171
The best definition of an urban area is,the central city and its developed areas.,the central city and its surrounding suburbs.,the central city and its hinterlands.,the central city and the adjacent counties.,B,False,0.6423686742782593,0.14333182573318481,0.20854656398296356,0.005557577591389418
Which of the following religions developed first?,Buddhism,Christianity,Islam,Hinduism,D,False,0.2348431795835495,0.16140520572662354,0.3015446066856384,0.3015446066856384
Which one of the following is NOT a characteristic of world cities?,World cities contain the headquarters of many transnational corporations.,World cities are well connected to secondary-level world cities.,World cities contain many offices of multinational organizations.,World cities are found only in the northern and western hemispheres.,D,True,0.11164141446352005,0.03624466434121132,0.20857363939285278,0.6424520611763
Which type of transportation system created the star-shaped city pattern?,Highways to airports that link cities,Interstate highways that link cities,Beltways around cities,Streetcar and trolley lines extending from the CBD,D,False,0.18576502799987793,0.163937047123909,0.5049616694450378,0.14467394351959229
In which urban US setting below would you expect to find planned communities?,Ghettos,Suburbs,CBDs,Transition zones,B,False,0.018207963556051254,0.03401695564389229,0.7742223143577576,0.17275235056877136
The latitude and longitude coordinates of a place are an example of,a formal region.,a functional region.,an absolute location.,a relative location.,C,True,0.024416690692305565,0.05169013515114784,0.4904223680496216,0.4327962100505829
The voluntary association of three or more countries willing to give up some measure of sovereignty is called,nationalism.,devolution.,supranationalism.,complementarity.,C,True,0.03854779526591301,0.08160568028688431,0.6832759976387024,0.19576185941696167
The key factor Thomas Malthus failed to recognize in his population theory was,population is limited by their means of subsistence.,all populations have the potential to increase more than the actual rate of increase.,wars and famine inhibit population's reproductive capacity.,technology's ability to raise the Earth's carrying capacity.,D,False,0.023071469739079475,0.06271475553512573,0.5950210690498352,0.3184918463230133
Which pair of religions are both universalizing religions?,Islam and Judaism,Judaism and Buddhism,Hinduism and Buddhism,Christianity and Buddhism,D,False,0.039848171174526215,0.024169135838747025,0.7063257098197937,0.22931037843227386
Which urban model theorizes that high-rent residential areas grow outward from the center of the city along major highways with lower-rent inhabitants taking over sequentially?,Concentric zone model,Central place model,Urban realms model,Sector model,D,False,0.10136442631483078,0.16712169349193573,0.5833120346069336,0.14748437702655792
"When a country combines its religion with its government, it is called a",dictatorship.,theocracy.,democracy.,autocracy.,B,False,0.1306135505437851,0.11526604741811752,0.5853692889213562,0.16771112382411957
What is the chief religion practiced in Europe?,Christianity,Islam,Hinduism,Animism,A,False,0.09830612689256668,0.07656088471412659,0.18366001546382904,0.6410364508628845
Which group enacted the first effective settlement in the eastern United States?,French,"British (English, Scotch-Irish, Welsh, Scottish)",Russian,Chinese,B,False,0.010580046102404594,0.006417122669517994,0.7417185306549072,0.24080073833465576
"A population pyramid, or age-sex structure, displays all the following information about a country's population EXCEPT",future social spending needs of the population.,"the impact of ""baby booms"" on the population.",the impact of wars on the population.,a quick visual depiction of the country's demographics.,B,False,0.02334190346300602,0.04941480979323387,0.6019956469535828,0.32222506403923035
The Rhine River is an example of which type of boundary?,Geometric,Artificial,Natural,Relict,C,True,0.09064938873052597,0.0705978199839592,0.5216512680053711,0.316397488117218
Which type of economic activity is most closely tied to the physical environment?,Primary,Secondary,Tertiary,Quaternary,A,False,0.07768169790506363,0.0323825478553772,0.6504208445549011,0.2392764836549759
The majority of workers in periphery countries are probably employed in which type of activities?,Primary,Secondary,Tertiary,Quaternary,A,False,0.05837517976760864,0.051515914499759674,0.5538483262062073,0.33592596650123596
All of the following are non-basic jobs in the city EXCEPT,city firefighter.,social worker.,dry cleaner.,garment factory worker.,D,True,0.11776183545589447,0.13344164192676544,0.22000806033611298,0.5277719497680664
Transnational corporations distribute their operations,manufacturing goods where production costs are the highest.,conducting accounting and research services where economical.,based on comparative advantage.,with headquarters located in LDCs.,C,False,0.24572277069091797,0.131525918841362,0.21684959530830383,0.4051283597946167
Which of the following is LEAST associated with the development of alluvial landscapes?,A deep cover of loose materials,A predominance of gentle slopes,Frequent flooding,Deep dissection and erosion,D,True,0.07401514798402786,0.06531813740730286,0.3758799135684967,0.4826393723487854
Which of the following is LEAST self-sufficient in the natural resources needed for modern industry?,United States,Japan,France,United Kingdom,B,False,0.023379676043987274,0.049494773149490356,0.602969765663147,0.32274648547172546
One of the effects of the east–west orientation of the Alpine mountain system and the northern plains of western and central Europe is that it,limits the marine climate of Europe to coastal areas,provides a corridor for communication between southern and northern Europe,enables marine-like climatic conditions to extend eastward into Germany and Poland,effectively prevents population movement between parts of the Mediterranean region,C,False,0.374159038066864,0.20027290284633636,0.374159038066864,0.05063691735267639
The largest Hindu temple complex ever constructed is found in,Calcutta.,Bombay.,Cambodia.,Bali.,C,True,0.0028923156205564737,0.003713806625455618,0.9087384939193726,0.08452584594488144
Which term describes the forces that unify and strengthen a country?,Diffusion,Centrifugal,Centripetal,Ethnocentric,C,True,0.1740538626909256,0.1355532854795456,0.6075076460838318,0.08221722394227982
Which one of the following statements best describes an application of the S-curve?,Graph of the Bantu migration,Graph of the growth of human populations since their first appearance on Earth,The chart showing how cities associate with one another based on their population sizes,A model showing the decrease in population growth for several countries after they industrialize,D,False,0.020149294286966324,0.02931705117225647,0.7560967206954956,0.19117118418216705
Which of the following items is NOT a challenge to the state?,Transnational corporations,EU,World Trade Organization,Good transportation network,D,True,0.13073334097862244,0.06997651606798172,0.13073334097862244,0.6639187335968018
"National sports teams, flags, national anthems, and national holidays all promote",nationalism.,sectarianism.,political unrest.,functional disputes.,A,False,0.043863195925951004,0.0723181739449501,0.10522232949733734,0.7774937152862549
"The process whereby immigrants learn the values, language, and customs of their new country is called",assimilation.,acculturation.,adaptation.,amalgamation.,B,False,0.07057517766952515,0.06228237226605415,0.4602079689502716,0.4061321020126343
"On which of the following can one most accurately depict true geographical distance, true direction, true size, and true shape?",A Mercator projection,A globe,A conic projection,A gnomonic projection,B,False,0.1489194929599762,0.19121640920639038,0.5889880061149597,0.07034458965063095
Which of the following could be considered a higher-order central place function?,Winn-Dixie grocery store,Mercedes-Benz dealership,Shoe store,Family doctor,B,False,0.02962786890566349,0.05535215139389038,0.7641128301620483,0.15046273171901703
Which geographer viewed the US urban community of the 1920s as a set of concentric rings radiating outward from a central core?,Rostow,Ravenstein,Von Thünen,Burgess,D,False,0.004031436052173376,0.007531714625656605,0.7682557106018066,0.22010895609855652
"To get to school in the morning, we ALL use this as our guide:",Rand-McNally Road Atlas.,world globe.,road map.,mental map.,D,False,0.12556225061416626,0.07615736126899719,0.49660834670066833,0.3012081980705261
"Of these, the map using the smallest map scale would be the map of",the world.,"Atlanta, Georgia.","Main Street, Small Town, Ohio.",Pennsylvania.,A,False,0.01906769536435604,0.040366314351558685,0.3829849064350128,0.5572397708892822
An earlier boundary formed before meticulous geographic knowledge and mapping was available is known as,an antecedent boundary.,a geometric boundary.,a relict boundary.,a subsequent boundary.,A,False,0.07754582911729813,0.1448746770620346,0.6492832899093628,0.1278514415025711
Which of the following jobs is in the non-basic employment sector?,Software engineer,F-10 pickup truck assembly-line worker,Oil refinery worker,Parking lot attendant,D,False,0.018030159175395966,0.023151183500885963,0.6765767335891724,0.2820391356945038
In which of the following regions is subsistence agriculture being replaced by large-scale commercial development?,The Swiss Alps,The Amazon Basin,North Africa,The Alaskan tundra,B,False,0.04898710176348686,0.07127581536769867,0.5967850685119629,0.2819013297557831
A strong movement away from all religions is called,secularism.,heathenism.,sacrilege.,nationalism.,A,False,0.03386835753917694,0.08124596625566483,0.6003310084342957,0.28357627987861633
Regions share all of these characteristics EXCEPT,boundaries.,common features.,relative location.,easily defined.,D,True,0.035615935921669006,0.035615935921669006,0.4338908791542053,0.49166280031204224
Which of the following U.S. main immigration flow associations is NOT correct?,"Pioneer settlement to 1870—Germans, British, Scotch-Irish, Africans",1870–1914—Asians,1870–1914—Eastern and southern Europeans,1965–present—Hispanics,B,False,0.0932237058877945,0.0640716552734375,0.4734290540218353,0.36870691180229187
Which one of the statements below is characteristic of most African cities?,"They have thriving, clean residential areas.",There are jobs for most rural-to-urban migrants.,They have three separate business districts.,They have a well-developed infrastructure.,C,False,0.047611087560653687,0.01984725333750248,0.2739828824996948,0.6572507619857788
Which country faces a serious trade disadvantage due to its location?,Singapore,Italy,Spain,Mongolia,D,True,0.006520157214254141,0.013803171925246716,0.31415876746177673,0.6650741100311279
"In which zone of Burgess's concentric zone model would one find better houses, single-family homes, and higher-rent apartments?",First,Second,Third,Fourth,C,True,0.0401262491941452,0.0354112908244133,0.6276801228523254,0.29649510979652405
The theory that every society develops economically according to a five-stage pattern of growth is attributed to,Rostow.,Ravenstein.,von Thünen.,Burgess.,A,False,0.009606393985450268,0.008477612398564816,0.8647399544715881,0.1170298233628273
Which of the following would NOT be considered a barrier to diffusion of a cultural trait?,Language,Religion,Oceans,Tolerant complaisant citizens,D,True,0.017170235514640808,0.03207822144031525,0.30434972047805786,0.64430832862854
The process of invasion and succession is a process involving migration and is best described as when,new residents tear down and rebuild housing units.,new residents live peacefully with old residents.,new residents assimilate with old residents completely.,new residents move into areas occupied by older resident groups.,D,True,0.2951461374759674,0.13941717147827148,0.22986005246639252,0.33444440364837646
Which of the following best illustrates the definition of a functional region?,A map showing Atlanta as a hub for Delta Airlines,An article describing the region referred to as the South,A map showing North Carolina's one hundred counties,An essay explaining the region known as the Bible Belt,A,False,0.04024791345000267,0.03551866114139557,0.4327058494091034,0.49031996726989746
New stores opening around a large shopping mall reflect which concept?,Gravity concept,Distance decay,Complementarity,Movement bias,D,False,0.09671484678983688,0.14071927964687347,0.5565555691719055,0.2047453671693802
The birth of an urban industrial workforce in Europe contributed to the start of the,First Agricultural Revolution.,Second Agricultural Revolution.,Third Agricultural Revolution.,Fourth Agricultural Revolution.,B,False,0.03891824185848236,0.06416533142328262,0.6087837815284729,0.2875691056251526
Which of the following statements about East Asia's industrial regions is true?,Japan has a rich natural resource base.,China lacks natural resources but has a massive labor force.,China is industrializing rapidly.,Taiwan lacks industrial enterprise and an educated workforce.,C,True,0.03666108474135399,0.041542455554008484,0.5734758973121643,0.34783071279525757
Which of the following statements best describes the United Nations?,The UN operates a worldwide police force.,Member states surrender sovereignty to the UN.,World laws are enforced by the UN.,The UN often practices interventionism in world conflicts.,D,False,0.14450858533382416,0.2382543832063675,0.3466580808162689,0.2699775695800781
Which of the following is a formal region?,Dixie,Pennsylvania,The market area of Winn-Dixie,The Pacific Northwest,B,False,0.06195581704378128,0.06195581704378128,0.3565311133861542,0.5187497138977051
The concentration of production activities and people spatially to benefit everyone is called,the substitution principle.,deglomeration.,agglomeration.,infrastructure.,C,True,0.05816294997930527,0.15810328722000122,0.48699241876602173,0.2953758239746094
"Which language family contains Italian, Spanish, Portuguese, and Romanian?",European,Slavic,Germanic,Romance,D,False,0.005776739679276943,0.005097954533994198,0.8573442101478577,0.13147799670696259
"Ankara, Turkey and Islamabad, Pakistan are both examples of",desert cities.,forward-thrust capitals.,old colonial capitals.,rival cities.,B,False,0.04062963277101517,0.18208938837051392,0.4368097484111786,0.34018778800964355
Which of the following is NOT an example of syncretism?,Halloween,Foreign cuisine changed to suit American tastes,Hasidic Judaism,Catholicism in Louisiana,C,False,0.013638071715831757,0.012035556137561798,0.12939442694187164,0.8437576293945312
The theory that whoever controlled the landmass of Europe would rule the world is called the,devolution theory.,domino theory.,heartland theory.,rimland theory.,C,True,0.046481113880872726,0.07663439214229584,0.8238974213600159,0.05266999825835228
Which group represents the Persian (Iranian) variation of Islam and believes in the infallibility and divine right to authority of the Imams descended from Ali?,Sunni,Shiite,Imam,Untouchables,B,False,0.04534585773944855,0.014721645042300224,0.7093285918235779,0.23028527200222015
The multiplier effect is,the addition of non-basic workers to an urban economy that has added more basic workers.,a ratio of urban to rural workers in an economy.,the ratio of city workers to farm workers in an economy.,the addition of rural jobs created by the urban economy.,A,False,0.11523517966270447,0.13057857751846313,0.1676662117242813,0.5852125883102417
The sacred book of the Hindu is called the,Talmud.,Bible.,Torah.,Veda.,D,True,0.06688885390758514,0.03159606084227562,0.1818227767944336,0.7191230058670044
Which of the following is a distinct characteristic of an East European city?,A central park,Prominent religious buildings,A large central square surrounded by government and administrative buildings,Luxury apartment buildings,C,True,0.013541032560169697,0.019702088087797165,0.8377540707588196,0.12847374379634857
Which of the following countries is actively trying to preserve the purity of their native language from contamination by English or other languages?,Italy,Russia,Japan,Brazil,C,True,0.03175412863492966,0.03175412863492966,0.496718168258667,0.43835222721099854
Which of the following is an example of a bulk-gaining industry?,Steel,Bottled orange juice,Paper,Copper,B,False,0.02319522574543953,0.049104295670986176,0.6778638362884521,0.249372199177742
Which of the following is NOT a feature of an export processing zone (EPZ)?,Tariff reductions on exports,Raw materials imported duty-free,Exemption from customs duties,Strict pollution regulations,D,True,0.02108660340309143,0.02108660340309143,0.25688743591308594,0.6982923746109009
Which of the following characteristics is NOT true of a state?,Independent territory,Internationally recognized,Boundaries,A national language,D,True,0.012507817707955837,0.01606035605072975,0.19565518200397491,0.7738312482833862
"You are planning to move from your hometown to Pittsburgh. Along the way, you stop in Columbus, Ohio to visit a relative and fall in love with the city! You decide to stay and make Columbus your new home. This is an example of",intervening opportunity.,distance decay.,involuntary migration.,push-pull factors.,A,False,0.041910044848918915,0.11392331123352051,0.7428732514381409,0.10053696483373642
A large node of office and commercial land use outside the central city with more jobs than residents is a(n),suburb.,primate city.,town.,edge city.,D,False,0.030880490317940712,0.044930845499038696,0.5473697781562805,0.3762013912200928
Which crop began the Third Agricultural Revolution?,Rice,Wheat,Barley,Millet,A,False,0.09630295634269714,0.05154725909233093,0.14011996984481812,0.7115879654884338
Which factor in the last quarter century greatly destabilized Eastern Europe and led to ethnic conflict?,The introduction of new languages,The end of the Cold War,The invasion by the Soviets,The acceptance of many Eastern European countries into the EU,B,False,0.0932929590344429,0.04406847432255745,0.25359654426574707,0.6083465218544006
"If I wanted to ship a small piece of very valuable jewelry to my aunt who lives in Poughkeepsie, which mode of transportation makes the most sense?",Truck,Air,Ship,Railroad,B,False,0.04211370646953583,0.03279818594455719,0.8458763957023621,0.07867875695228577
Which of the following is a functional region?,Dixie,Pennsylvania,The market area of Winn-Dixie,The Pacific Northwest,C,False,0.039301976561546326,0.044534970074892044,0.3728867471218109,0.5425469875335693
Which type of city model contains a distinct residential spine proceeding outward from center city along the main boulevard?,European,Muslim,Sub-Saharan African,Latin American,D,False,0.0086068045347929,0.020646650344133377,0.8779178857803345,0.09253185987472534
What family do most European languages belong to?,Ural-Altaic,Basque,Indo-European,Phoenician,C,True,0.08148331940174103,0.06345926970243454,0.6822514533996582,0.17250019311904907
"What do the terms apartheid, ethnic cleansing, and integration all have in common?",They all occurred in Nazi Germany during World War I.,They are all forms of residential segregation.,They are all ways to integrate different ethnic populations in neighborhoods.,They are different expressions for the same concept.,B,True,0.15606869757175446,0.3743893504142761,0.0946604460477829,0.3743893504142761
Which one of the statements below correctly describes immigrants living in Europe?,Most find citizenship easy to get in host countries.,Muslims immigrants from North Africa are well integrated in France.,Immigrants to European cities rarely bring their families.,They are usually restricted to certain neighborhoods.,D,False,0.01637427508831024,0.030591171234846115,0.6962518692016602,0.25613677501678467
Which of the following activities are NOT secondary economic activities?,Assembling automotive parts,Sewing shirts,Mining copper,Binding books,C,False,0.14462803304195404,0.060289934277534485,0.3469446003437042,0.4454857110977173
Johnny and Susie are moving to Scotland to renovate and live in the family castle. What makes their move a migration?,They are crossing another country's borders.,They are not taking anything with them.,They are moving permanently.,They will be gone more than one year.,C,True,0.010052495636045933,0.012907659634947777,0.798568606376648,0.17818474769592285
Which of the following entities is a state?,Antarctica,American Samoa,Egypt,Marshall Islands,C,True,0.015327720902860165,0.013526666909456253,0.5751684904098511,0.39530715346336365
What is the most abundant fossil fuel?,Phosphate,Oil,Petroleum,Coal,D,True,0.056653451174497604,0.04999649152159691,0.4186154901981354,0.47435352206230164
A rejection of or indifference to religion in a country is called,polytheism.,animism.,secularism.,monotheism.,C,True,0.03674180805683136,0.0998745858669281,0.6512641310691833,0.2114344984292984
"In a postindustrial economy, which of the following resources is considered most important to increase productivity?",Energy,Labor,Information,Specialization,C,True,0.1300923228263855,0.1474139243364334,0.660663366317749,0.0614512637257576
A city that is more than twice as large as the next largest city in a country is called a,global city.,world leader city.,megalopolis.,primate city.,D,False,0.09351363033056259,0.19796836376190186,0.41909903287887573,0.288042277097702
