0,1,2,3,4,5,correct,choiceA_probs,choiceB_probs,choiceC_probs,choiceD_probs
The climate of Great Britain is milder than most other places along the same latitude for which of the following reasons?,"The Gulf Stream brings warm waters to Great Britain, raising the temperature of winds that blow onto the island.",Hot springs throughout the country raise the temperature of the surrounding land and air.,Mountain ranges in the north of Great Britain act as a barrier to cold winds blowing from the Arctic.,Small landmasses generate their own local climate and are largely unaffected by latitude.,A,True,0.35077717900276184,0.1656954139471054,0.24108539521694183,0.24108539521694183
Which of the following supranational organizations is not an economic union?,EU,CARICOM,NAFTA,NATO,D,True,0.020935680717229843,0.01438886858522892,0.07307270914316177,0.890207827091217
The global lingua franca is,Chinese.,English.,French.,Arabic.,B,False,0.08949462324380875,0.05428123474121094,0.40108707547187805,0.4544912278652191
What are the two major branches of Islam?,Sunni and Shinto,Shinto and Shiite,Sunni and Shiite,Shamanism and Shiite,C,False,0.017625927925109863,0.012114112265408039,0.454578697681427,0.515105128288269
What was the primary reason the Green Revolution did NOT help Africa much?,It targeted crops Africans don't grow and eat.,It required sophisticated machinery.,Population growth has fallen so drastically that Africans don't need the increased food production.,African agricultural production went up without its help.,A,False,0.020603220909833908,0.020603220909833908,0.08148731291294098,0.8760712146759033
The largest exporter of agricultural goods in the world is,China.,Mexico.,Chile.,the United States.,D,True,0.09205209463834763,0.05583242326974869,0.3212934136390686,0.5297232866287231
Which of the following statements is NOT part of Gunnar Myrdal's theory of cumulative causation?,Developing and developed regions share similarly in wealth through trade.,The core will always dominate the periphery.,Growth and prosperity of the core exists at the expense of the periphery.,"Regions with initial advantage keep and expand it as they attract labor, capital, and trade.",A,False,0.005824442487210035,0.012330345809459686,0.2185606211423874,0.7628514766693115
Which pair of religions below share a long-held tradition of cremating their dead?,Hindu and Buddhist,Hindu and Muslim,Muslim and Jewish,Christian and Buddhist,A,False,0.04802260547876358,0.03300542011857033,0.5162916779518127,0.40208837389945984
"The official languages of Guyana, Suriname, and French Guiana are English, Dutch, and French, respectively. On what continent are those countries located?",North America,South America,Africa,Asia,B,False,0.028339983895421028,0.015169301070272923,0.8282157182693481,0.1270110011100769
