0,1,2,3,4,5,correct,choiceA_probs,choiceB_probs,choiceC_probs,choiceD_probs
Which statement is true about an open systems model of public relations in an organization?,It adapts to changing organizational environments.,It adopts the policy of transparency to build public trust.,It focuses on removing communication barriers between its business divisions.,It communicates with its publics frequently to effect change outside the organization.,A,False,0.12166749686002731,0.13786733150482178,0.4812042713165283,0.2575700879096985
Which law restricts corporate communications for publicly traded companies before and during the period that new securities are being registered?,Securities Act of 1933,Sarbanes-Oxley Act of 2002,Investment Advisers Act of 1940,Investment Company Act of 1934,A,False,0.08413253724575043,0.035071659833192825,0.06552248448133469,0.7982272505760193
"Which of these phrases refers specifically to a crisis, rather than an issue?",A gap between corporate and stakeholder expectations.,When an organization's trading is interrupted.,Can be avoided with constant monitoring and relationship building.,It happens suddenly.,D,False,0.05507785454392433,0.07072136551141739,0.5921427607536316,0.2797084450721741
Watson and Noble (2005) lay out a five-step model for circular evaluation. At which step should pre-testing of strategy and tactics be carried out?,1,2,3,4,C,True,0.10130508244037628,0.042230237275362015,0.6605920791625977,0.18926280736923218
Which of these sites offers 'microblogging?,YouTube,Facebook,Wikipedia,Twitter,D,True,0.09306394308805466,0.026663266122341156,0.09306394308805466,0.7792148590087891
Within which area of public relations do tactics relate to promotion of the overall organisation?,Corporate,Internal communications,Financial relations,Business to business,A,False,0.022541776299476624,0.022541776299476624,0.2746150493621826,0.6587672829627991
"Emma is browsing a popular website when she runs across the story of a well-known actor who was recently pulled over for speeding and driving down the wrong side of the street. It turns out he had been drinking, and the arresting police officer found drugs in the car. The actor's publicist issued a statement claiming the actor was just tired and that the drugs belonged to someone else. Emma can't help having the impression that all public relations are ________ and occur only after something negative has occurred.",proactive,reactive,manipulative,manipulative,B,False,0.03152333199977875,0.013140879571437836,0.717467725276947,0.23292765021324158
"Louis owns a chemical company that has been irresponsibly disposing of chemical waste and contaminating the community's water supply. Although he knew the company was cutting costs in its waste disposal, he publicly claims to have had no knowledge of the irresponsible practices, blames it on the company's general manager and fires him. What image restoration strategy is Louis using?",denial,evasion of responsibility,reducing the offensiveness,corrective action,A,False,0.038758907467126846,0.04391958937048912,0.2230420857667923,0.6870179772377014
"The ________ phase of the PR model consists of primary and secondary research about a client, identifying the target audiences for the campaign, proposing channels of communication and strategies to be used in the campaign, and constructing goals, objectives, messages, and themes.",identification,evaluation,implementation,planning,D,False,0.029385432600975037,0.042755547910928726,0.5208691954612732,0.40565335750579834
The 'internal factors' portion of a firm's public relations situation analysis often includes,a communication audit,strategy suggestions,community focus groups,a listing of media contacts,A,False,0.05497540906071663,0.062295302748680115,0.3584847152233124,0.5215921998023987
What is the major advantage of organizational publications?,Their ability to provide a revenue source for sponsoring organizations,"Their ability to deliver specific, detailed information to narrowly defined target publics",Their ability to avoid the problems typically associated with two-way media,Their ability to give sponsoring organizations a means of uncontrolled communications,B,False,0.45961251854896545,0.062201790511608124,0.11620824784040451,0.35794660449028015
"Which outcome, from the evaluation phase of public relations planning, documents the impact a program had on its stakeholders?",the quality of the messages and activities,the number who change attitudes and opinions,the number who responded to communications,the number of messages and activities implemented,B,False,0.06888660043478012,0.14583294093608856,0.5090069770812988,0.27245181798934937
"The second stage of the advertising campaign is to establish ________, or to become known as trustworthy and believable.",legitimacy,identity,reliability,agency,A,False,0.03791732341051102,0.04868680611252785,0.5931267142295837,0.31747788190841675
Which type of writing employs the pyramid structure?,Media writing,Personal writing,Business writing,Promotional writing,A,False,0.022578032687306404,0.022578032687306404,0.3531798720359802,0.5822951793670654
During which step of the Chase Jones model of issues management should the organization's ability to lead the issue be assessed?,Identification,Analysis,Strategy,Evaluation,C,True,0.029973309487104416,0.043610911816358566,0.6020300388336182,0.32224345207214355
Which of these should an objective NOT be?,Broad,Achievable,Measurable,Time-bound,A,False,0.012752357870340347,0.0185545701533556,0.4223000705242157,0.542244017124176
Which statement describes an idea from Kantian ethics?,What is right and what is wrong are predetermined.,"People should be treated as an end, not a means to an end.",The greatest good for the greatest number.,Those better off should give to people who are not as well off.,B,False,0.060464583337306976,0.060464583337306976,0.8346877694129944,0.04155665636062622
Which of these organizations is most effective in engaging with customers online?,Starbucks,Coca-Cola,Wholefoods,Redbull,A,False,0.10145498812198639,0.02906734123826027,0.10145498812198639,0.749656617641449
"According to Russian philosopher Mikhail Bakhtin, in order to create ________, or a well-informed public, all communication about an issue must be ________, or take the form of a dialogue.","intelligentsia, democratic","democracy, dialogic","democracy, logical","democracy, bipartisan",B,False,0.19524802267551422,0.1341918706893921,0.6014062762260437,0.04936642944812775
Your client has asked you to develop a public relations campaign to promote a college tuition savings program using new technologies. What is the most appropriate first step?,Research pricing and development costs for different services.,Develop a survey to discover which factors impact families' savings.,Conduct a situation analysis to gain a better understanding of the issue.,Hold a focus group to determine which messages are most effective for the program.,C,True,0.0692964568734169,0.03709171712398529,0.7450070977210999,0.14670059084892273
"According to ""working theory,"" what is the step that occurs between an individual gaining information and changing behavior?",coorientation,opinion change,reaction formation,semantic encoding,B,False,0.04388459399342537,0.09290368109941483,0.3242657482624054,0.5346238017082214
"Segmentation of the population into psychographics, demographics and geodemographics is especially important in which public relations specialisation?",Issues management,Investor relations,Public affairs,Marketing communications,D,False,0.02573087438941002,0.05447226017713547,0.45609065890312195,0.45609065890312195
What are two examples of an evaluation of outcome? ,Change in attitude,Placement of message,Distribution of message,Size of attentive audience,A,False,0.017062682658433914,0.03612170368432999,0.6402724981307983,0.30244332551956177
Which fashion house sued for damages to its reputation after being accused of stealing a design?,Dior,Givenchy,Chanel,Lacroix,C,True,0.21635213494300842,0.07959150522947311,0.35670435428619385,0.27780163288116455
"What public relations pioneer is credited with being the first practitioner to insist on ""a place at the management table""?",Carl Byoir,Edward Bernays,Doris Fleischman,Arthur Page,D,False,0.2008330076932907,0.05753961578011513,0.3311176598072052,0.2578746974468231
What are major reasons why organizations retain outside public relations counsel? ,They offer flexibility of talents and skills.,They bring greater credibility to the work. ,They will provide sound ROI on the project or program.,They can provide more attention and detail to a project that in-house staff.,A,False,0.1765621304512024,0.06495358049869537,0.4235505163669586,0.32986149191856384
Which of these activities might secondary research involve?,Conducting a content analysis,Conducting a survey,Observing people,Examining public records,D,True,0.04944835975766182,0.09238169342279434,0.32244381308555603,0.5316199660301208
Which of the following information about publications does the Audit Bureau of Circulation NOT provide?,Circulation,Distribution,Traffic,Readership,D,True,0.018356019631028175,0.012615895830094814,0.08226597309112549,0.8844425678253174
Early email was developed in which decade?,1960s,1970s,1980s,1990s,B,False,0.39368417859077454,0.09953894466161728,0.34742504358291626,0.14482831954956055
"According to Esman (1972), which publics help an organization to exist by lending authority or assistance?",Enabling,Functional,Normative,Diffused,A,False,0.02460278756916523,0.021711884066462517,0.7189988493919373,0.23342475295066833
Which common public relations tactic can provide a 'halo effect'?,Placement on TV or radio,Stunts,Third parties,Sponsorship,D,False,0.05192643404006958,0.0666748657822609,0.49266430735588074,0.3836873471736908
