0,1,2,3,4,5,correct,choiceA_probs,choiceB_probs,choiceC_probs,choiceD_probs
A 25 g sample of a solid was heated to 100 °C and then quickly transferred to an insulated container holding 100 g of water at 26 °C. The temperature of the mixture rose to reach a final temperature of 37 °C. Which of the following can be concluded?,The sample lost more thermal energy than the water gained because the sample temperature changed more than the water temperature did.,"Even though the sample temperature changed more than the water temperature did, the sample lost the same amount of thermal energy as the water gained.",The sample temperature changed more than the water temperature did; therefore the heat capacity of the sample must be greater than the heat capacity of the water.,The final temperature is less than the average starting temperatures; therefore the equilibrium constant must be less than 1.,B,False,0.43150755763053894,0.08496887236833572,0.43150755763053894,0.05153622850775719
Which of the following processes is an irreversible reaction?,CH4(g) + O2(g) → CO2(g) + H2O(l),HCN(aq) + H2O(l) → CN-(aq) + H3O+(aq),Al(NO3)3(s) → Al3+(aq) + 3NO3-(aq),2Ag+(aq) + Ti(s) → 2Ag(s) + Ti2+(aq),A,False,0.16703879833221436,0.14741122722625732,0.5830227136611938,0.10131414234638214
"Starting with a stock solution of 18.0 M H2SO4, what is the proper procedure to create a 1.00 L sample of a 3.0 M solution of H2SO4 in a volumetric flask?","Add 167 mL of the stock solution to the flask, then fill the flask the rest of the way with distilled water while swirling the solution.","Add 600 mL of the stock solution to the flask, then fill the flask the rest of the way with distilled water while swirling the solution.","Fill the flask partway with water, then add 167 mL of the stock solution, swirling to mix it. Last, fill the flask the rest of the way with distilled water.","Fill the flask partway with water, then add 600 mL of the stock solution, swirling to mix it. Last, fill the flask the rest of the way with distilled water.",C,False,0.6167292594909668,0.050624217838048935,0.33011138439178467,0.0022242730483412743
Which of the following does not contain oxygen?,An aldehyde,An alkane,An alcohol,An ether,B,False,0.021724196150898933,0.02461673878133297,0.7194066047668457,0.23355711996555328
"Formation of a solution can often be visualized as a three-step process. Step 1. Solvent molecules are separated from each other to make space for the solute. Step 2. Solute molecules are separated so they fit into spaces in the solvent. Step 3. Separated solute and solvent are brought together, filling in the spaces. Which of the following statements about the energy involved in the above is correct?","Steps 1 and 2 are exothermic, and step 3 is endothermic.","Steps 1 and 2 are endothermic, and step 3 is exothermic.",All three steps are exothermic.,All three steps are endothermic.,B,False,0.26269516348838806,0.06641974300146103,0.6301729679107666,0.040285609662532806
"Consider the Lewis structures for the following molecules: CO2, CO32-, NO2-, and NO3-. Which molecule would have the shortest bonds?",CO2,CO32-,NO2-,NO3-,A,False,0.12784253060817719,0.03662750497460365,0.6492379903793335,0.18600980937480927
"In determining the order for reactant A in a certain reaction, the concentrations of all other reactants are held constant while the concentration of A is tripled from one experiment to another. The reaction rate is found to triple. The appropriate exponent for A in the rate law is",1,2,3,4,A,False,0.0865856409072876,0.11117816716432571,0.724972665309906,0.07641155272722244
The simplest alkene has,at least two pi bonds,at least four sigma bonds,a tetrahedral configuration,cis-trans isomers,B,False,0.3205680549144745,0.07152840495109558,0.5988999605178833,0.008542848750948906
2Ag+(aq) + Fe(s) → 2Ag(s) + Fe2+(aq) Which of the following would cause an increase in potential in the voltaic cell described by the above reaction?,Increasing [Fe2+],Adding more Fe(s),Decreasing [Fe2+],Removing some Fe(s),C,True,0.2838405966758728,0.2210552841424942,0.412985622882843,0.08132168650627136
"Hypochlorous acid is an unstable compound, and one of the decomposition products is chlorine gas, Cl2. The decomposition of the acid lowers its concentration over time. What effect will the decomposition of one-fourth of the acid have on the agreement between the endpoint of the titration and the equivalence point during a titration with standard sodium hydroxide?",The endpoint would still remain near the ideal equivalence point.,The endpoint would be after the ideal equivalence point.,The endpoint would be before the ideal equivalence point.,It is impossible to determine.,C,True,0.15578463673591614,0.0505758672952652,0.6981782913208008,0.09448815882205963
The name for CH3CHBrCHClCH2CH3 is,dibromotrichloropropane,dibromotrichloropentane,"2-bromo, 3-chloropentane","2,3-bromochloropentane",C,True,0.23984751105308533,0.08823495358228683,0.6519730687141418,0.01968787983059883
Under which conditions will a real gas most closely behave as an ideal gas?,High temperature and high pressure,High temperature and low pressure,High volume and high temperature,Low temperature and low pressure,B,False,0.2199164479970932,0.1333860605955124,0.5275521278381348,0.11771279573440552
"How many electrons, neutrons, and protons are in an atom of 52Cr?","24 electrons, 24 protons, 24 neutrons","27 electrons, 27 protons, 24 neutrons","24 electrons, 28 protons, 24 neutrons","24 electrons, 24 protons, 28 neutrons",D,False,0.16492938995361328,0.06875280290842056,0.6523084044456482,0.11335419863462448
S(s) + O2(g) → SO2(g),one atom of S reacts with one molecule of O2 to yield one molecule of SO2,one mole of sulfur atoms reacts with one mole of oxygen molecules to yield one mole of sulfur dioxide molecules,this reaction goes to completion,adding S(s) will change the equilibrium constant,D,False,0.2792239487171173,0.16935788094997406,0.5216590166091919,0.02942998893558979
"Sulfur dioxide reacts with oxygen to form sulfur trioxide in the presence of a catalyst. The equilibrium constant, Kp, at a certain temperature is 3.0 × 10^22. A 2.0-liter flask has enough SO3 added to it to produce a pressure of 0.789 atm Hg. After the reaction comes to equilibrium, the expected partial pressure of O2 will be",2.88 × 10^-6 torr,3 × 10^-18 mm Hg,1100 mm Hg,1.32 × 10^-5 torr,D,False,0.11396454274654388,0.1878957897424698,0.6558207273483276,0.04192521423101425
"How many electrons, neutrons, and protons are in an atom of Cr?","24 electrons, 24 protons, 24 neutrons","27 electrons, 27 protons, 24 neutrons","24 electrons, 28 protons, 24 neutrons",more information is needed to answer this question,D,False,0.053824715316295624,0.04191872850060463,0.8419602513313293,0.06099139526486397
"When an ideal gas is allowed to expand isothermally, which one of the following is true?",q = 0,w = 0,E = 0,q = -w,D,False,0.11174234747886658,0.05981137230992317,0.6430328488349915,0.18423199653625488
An ideal solution is a,mixture where two solvents can be dissolved in all ratios,mixture that has the same physical properties as the individual solvents,mixture where the potential energy of the mixture is the same as that of the individual solvents,mixture that is colorless,C,False,0.6686272621154785,0.04843519628047943,0.2787252962589264,0.003975802566856146
Which of the following is true for all bases?,All bases donate OH- ions into solution.,Only strong bases create solutions in which OH- ions are present.,Only strong bases are good conductors when dissolved in solution.,"For weak bases, the concentration of the OH-ions exceeds the concentration of the base in the solution.",C,True,0.27900367975234985,0.09057922661304474,0.45999929308891296,0.1692243069410324
The Pauli exclusion principle states that,no two electrons can have the same four quantum numbers,no two electrons with the same spin can occupy an orbital,no two electrons can occupy separate orbitals,no two electrons can pair up if there is an empty orbital available,A,False,0.35050857067108154,0.11379346996545792,0.509986937046051,0.025390753522515297
"Joseph Priestly discovered oxygen gas by the decomposition of solid mercury(II) oxide, HgO, to oxygen gas, O2, and liquid mercury metal, Hg. How many moles of oxygen gas will form when 4.32 g of solid mercury(II) oxide decomposes? The formula mass of mercury(II) oxide is 216 g mol^-1.",0.100 mol,0.0100 mol,0.0200 mol,0.0150 mol,B,False,0.1187981590628624,0.19586506485939026,0.6033068895339966,0.08164870738983154
"Atoms of four elements are examined: carbon, nitrogen, neon, and sulfur. Atoms of which element are most likely to form a structure with the formula XF6 (where X is one of the four atoms)?",Carbon,Nitrogen,Neon,Sulfur,D,False,0.18894080817699432,0.05413245037198067,0.7472754120826721,0.009406808763742447
Chlorine gas reacts most readily with,toluene,ethylene,ethanoic acid,ethane,B,False,0.06398166716098785,0.018331052735447884,0.8832396268844604,0.034246914088726044
An ester is made by reacting,an amine and an alcohol,two different alcohols,an alcohol and an acid,an acid and a base,C,True,0.15043991804122925,0.1033957451581955,0.6742249131202698,0.07106278091669083
"Atoms of four elements are examined: carbon, nitrogen, neon, and sulfur. Which element would have a photoelectron spectra in which the peak representing electrons with the lowest ionization energy would be three times higher than all other peaks?",Carbon,Nitrogen,Neon,Sulfur,C,True,0.07217738777399063,0.018249301239848137,0.8793006539344788,0.030088013038039207
What is the work involved if a gas in a 2.0-liter container at 2.4 atmospheres pressure is allowed to expand against a pressure of 0.80 atmosphere?,-3.2 L atm,-9.62 L atm,-4.8 L atm,+14.4 L atm,A,False,0.1460631787776947,0.1460631787776947,0.5776910781860352,0.12890030443668365
Which of the following is incorrectly named?,CaCl2   calcium chloride,Fe(NO3)3   iron(III) nitrate,AlBr3   aluminum tribromide,K2Cr2O7   potassium dichromate,C,True,0.12666957080364227,0.0678013414144516,0.5676936507225037,0.23664991557598114
The standard state for redox reactions includes,the temperature is 25 °C,concentrations of soluble species are 1 molar,partial pressures of gases are 1 atmosphere,all of the above are true,D,False,0.22554485499858856,0.03458842262625694,0.6947270631790161,0.044412415474653244
Chemists often ascribe the macroscopic properties of solids to the underlying microscopic structure. Silicon carbide is almost as hard and brittle as diamond. The solid state structure of silicon carbide is often described as,a molecular crystal,a covalent or network crystal,a metallic crystal,an ionic crystal,B,False,0.3498428463935852,0.12869998812675476,0.5090183019638062,0.011970963329076767
Which of the following may need to be balanced using the ion-electron method ?,BaCl2 + Al2(SO4)3 → AlCl3 + BaSO4,H+ + OH- → H2O,NaOH + H3PO4 → Na2HPO4 + H2O,C2H2(g) + N2O(g) → CO2(g) + H2O(g) + N2(g),D,False,0.23016923666000366,0.08467452228069305,0.6256647706031799,0.05819588899612427
A solution is prepared by dissolving 30.0 grams of Ni(NO3)2 in enough water to make 250 mL of solution. What is the molarity of this solution?,0.496 molar,0.656 mol/L,3.3 molar,6.3 × 10^-3 molar,B,False,0.1087929829955101,0.17936931550502777,0.626060426235199,0.08472806215286255
A solution of a weak base is titrated with a solution of a standard strong acid. The progress of the titration is followed with a pH meter. Which of the following observations would occur?,"Initially, the pH slowly decreases, then there is a rapid decrease to give a pH below 7 at the equivalence point.",The pH of the solution gradually decreases throughout the experiment and the pH at the equivalence point is below 7.,"Initially, the pH slowly decreases, then there is a rapid decrease to give a pH equal to 7 at the equivalence point.","Initially, the pH quickly decrease, then there is a gradual decrease to the equivalence point where the pOH equals the pKb of the base.",A,True,0.5225707292556763,0.24684493243694305,0.1922430396080017,0.03785489499568939
A 25 g sample of a liquid was heated to 95 °C and then quickly transferred to an insulated container holding 100 g of water at 26 °C. The temperature of the mixture rose to reach a final temperature of 37 °C. Which of the following can be concluded?,The sample lost more heat energy than the water gained because the sample temperature changed more than the water temperature did.,The final temperature is less than the average starting temperatures; therefore the equilibrium constant must be less than 1.,The sample temperature changed more than the water temperature did; therefore the heat capacity of the sample must be greater than the heat capacity of the water.,"Even though the sample temperature changed more than the water temperature did, the sample lost the same amount of heat energy as the water gained to obey the law of conservation of energy.",D,False,0.3761741816997528,0.12212587893009186,0.42626118659973145,0.07407308369874954
Changing which of the following will change the numerical value of the equilibrium constant?,The pressure of reactants,The pressure of products,The temperature,The total mass of the chemicals present,C,True,0.06222148612141609,0.06222148612141609,0.7580128908157349,0.11624504625797272
What is the general relationship between temperature and entropy for diatomic gases?,They are completely independent of each other; temperature has no effect on entropy.,"There is a direct relationship, because at higher temperatures there is an increase in energy dispersal.","There is an inverse relationship, because at higher temperatures substances are more likely to be in a gaseous state.",It depends on the specific gas and the strength of the intermolecular forces between individual molecules.,B,False,0.10315653681755066,0.09103532880544662,0.7622294425964355,0.04300204664468765
Nitrogen's electronegativity value is between those of phosphorus and oxygen. Which of the following correctly describes the relationship between the three values?,"The value for nitrogen is less than that of phosphorus because nitrogen is larger, but greater than that of oxygen because nitrogen has a greater effective nuclear charge.",The value for nitrogen is less than that of phosphorus because nitrogen has fewer protons but greater than that of oxygen because nitrogen has less valence electrons.,"The value for nitrogen is greater than that of phosphorus because nitrogen has less electrons, but less than that of oxygen because nitrogen is smaller.","The value for nitrogen is greater than that of phosphorus because nitrogen is smaller, but less than that of oxygen because nitrogen has a smaller effective nuclear charge.",D,False,0.1895150989294052,0.1302516907453537,0.401203453540802,0.2757428288459778
"A solution contains a mixture of four different compounds: KCl(aq), Fe(NO3)3(aq), MgSO4(aq), and N2H4(aq). Which of these compounds would be easiest to separate via distillation?",KCl(aq),Fe(NO3)3(aq),MgSO4 (aq),N2H4(aq),D,False,0.2192399799823761,0.08065386861562729,0.5959559679031372,0.10356161743402481
"The dimerization of NO2(g) to N2O4(g) is an endothermic process. Which of the following will, according to Le Châtelier's principle, increase the amount of N2O4 in a reaction vessel?",Decreasing the temperature,Increasing the size of the reaction vessel,Adding a selective catalyst,Making the reaction vessel smaller,D,False,0.27605587244033813,0.10155526548624039,0.5844102501869202,0.03736009821295738
"Cerium(III) sulfate, Ce2(SO4)2, is less soluble in hot water than it is in cold. Which of the following conclusions may be related to this?",The heat of solution of cerium(III) sulfate is exothermic.,The hydration energies of cerium ions and sulfate ions are very low.,The heat of solution for cerium(III) sulfate is endothermic.,The solution is not an ideal solution.,A,False,0.1505087912082672,0.0805615484714508,0.5952737927436829,0.17054881155490875
The weight percent of sodium hydroxide dissolved in water is 50%. What is the mole fraction of sodium hydroxide?,31.00%,0.164,0.311,0.5,C,True,0.0906854197382927,0.07062587887048721,0.5913432240486145,0.24650852382183075
The most massive subatomic particle is the,proton,neutron,alpha particle,beta particle,C,True,0.06414264440536499,0.034333083778619766,0.7814174294471741,0.11983424425125122
A 50.0 mL sample of 0.0025 M HBr is mixed with 50.0 mL of 0.0023 M KOH. What is the pH of the resulting mixture?,1,4,5,11,B,False,0.07999785989522934,0.07999785989522934,0.669813871383667,0.16935546696186066
Which of the following geometries corresponds to a substance that has five sigma bonds and one nonbonding pair of electrons?,Tetrahedron,Square planar,Octahedron,Square pyramid,D,False,0.27157464623451233,0.06866482645273209,0.6514737606048584,0.008200844749808311
Which of the following should be named using Roman numerals after the cation?,CaCl2,CuCl2,AlBr3,K2Cr2O7,B,False,0.053423188626766205,0.022270098328590393,0.737484335899353,0.18646524846553802
Which of the following is not a good measure of relative intermolecular attractive forces?,Heat of fusion,Boiling points,Vapor pressures,Heat of vaporization,A,False,0.026547135785222054,0.030081842094659805,0.4705592095851898,0.4705592095851898
The Pauli exclusion principle states that,no two electrons can have the same energy,no two electrons can have the same four quantum numbers,no two electrons can occupy separate orbitals,no two electrons can pair up if there is an empty orbital available,B,False,0.25326409935951233,0.0822228193283081,0.6075490117073059,0.056510861963033676
"Chlorine is often used to oxidize other substances. It makes a good bleach because it can oxidize many colored compounds. If chlorine is not available, what other substance can be used for oxidizing substances?",Al,H2S,Zn,KMnO4,D,False,0.024468539282679558,0.040341801941394806,0.9181751608848572,0.016816964372992516
A proposed mechanism for a reaction is as follows: NO2 + F2 →NO2F + F Slow step. F + NO2 → NO2F Fast step. What is the order of the overall reaction?,Zero order,First order,Second order,Third order,C,True,0.04466312378644943,0.2001662254333496,0.616555392742157,0.13757210969924927
The units for the rate of a chemical reaction are,L2 mol-2 s-1,mol L-1 s-1,L mol-1 s-1,it depends on the particular reaction,B,False,0.13350407779216766,0.0714595839381218,0.7682629823684692,0.026288513094186783
A stock solution of 12.0 M sulfuric acid is made available. What is the best procedure to make up 100. mL of 4.0 M sulfuric acid using the stock solution and water prior to mixing?,"Add 33.3 mL of water to the flask, and then add 66.7 mL of 12.0 M acid.","Add 33.3 mL of 12.0 M acid to the flask, and then dilute it with 66.7 mL of water.","Add 67.7 mL of 12.0 M acid to the flask, and then dilute it with 33.3 mL of water.","Add 67.7 mL of water to the flask, and then add 33.3 mL of 12.0 M acid.",D,False,0.39907214045524597,0.18850833177566528,0.31079769134521484,0.10090123862028122
"To prepare a buffer, all of the following are needed except",an acid with a pKa close to the desired pH,a conjugate acid along with its conjugate base,a buffer capacity sufficient to react with added acid or base,triple-distilled water,D,False,0.09394693374633789,0.13669198751449585,0.612610936164856,0.15489231050014496
"Of the following oxo acids, which is predicted to be the strongest acid?",HBrO,HClO,HIO,HClO3,D,False,0.09795915335416794,0.04083544760942459,0.8202019333839417,0.04083544760942459
"According to the kinetic-molecular theory of gases,",the average kinetic energy of a gas particle is directly related to the Kelvin temperature,ideal gas particles do not attract or repel each other,the atoms or molecules of an ideal gas have no volume,"(A), (B), and (C) are part of the theory",D,False,0.2687770128250122,0.046706441789865494,0.44313839077949524,0.20932376384735107
"Three 25.00 mL samples of approximately 0.10 M phenol, C6H5OH, Ka = 1.0 × 10^-10 were removed from a container and placed in separate 250 mL beakers. The samples were titrated with standard potassium hydroxide, KOH, solution. Cresol red was the acid-base indicator used in the titration. The samples required 31.75, 32.38, and 41.75 mL to reach the endpoint. Which of the following might explain why one of the samples required significantly more base to reach the endpoint?",The indicator was added too late.,The wrong indicator was used.,There was a base contaminating the unclean beaker.,There was an acid contaminating the unclean beaker.,D,False,0.26214799284935,0.12382994592189789,0.43220895528793335,0.18017148971557617
Which is correct about the calcium atom?,It contains 20 protons and neutrons,It contains 20 protons and 20 electrons,"It contains 20 protons, neutrons, and electrons",All atoms of calcium have a mass of 40.078 u,B,False,0.05735485255718231,0.0306998398154974,0.8971808552742004,0.01450157817453146
Which of the following correctly lists the individual intermolecular attractive forces from the strongest to the weakest?,Induced dipole < dipole-dipole < hydrogen bond,Hydrogen bond < dipole-dipole < induced dipole,Induced dipole < hydrogen bond < dipole-dipole,Dipole-dipole < hydrogen bond < induced dipole,B,False,0.08722300082445145,0.032087549567222595,0.8275488018989563,0.052903421223163605
Identify the Brønsted-Lowry conjugate acid-base pair in the following list.,H3O+ and OH-,H3PO4 and H3PO3,HC2H3O2 and C2H3O2-,SO32- and SO22-,C,True,0.08624820411205292,0.05927747115492821,0.818300187587738,0.03595359995961189
"What is the mass of one molecule of cholesterol (C27H46O, molecular mass = 386)?",6.41 × 10^-22 g,1.5 × 10^-21 g,1.38 × 10^-21 g,3 × 10^-23 g,A,False,0.18517552316188812,0.14421483874320984,0.5703807473182678,0.09911730140447617
"Using fundamental trends in electronegativity and bond strength, which of the following should be the strongest acid?",H2S,HI,HBr,H2O,B,False,0.12364152073860168,0.02434645965695381,0.7115078568458557,0.14010418951511383
Examining data obtained from mass spectrometry supports which of the following?,The common oxidation states of elements,Atomic size trends within the periodic table,Ionization energy trends within the periodic table,The existence of isotopes,D,False,0.23656249046325684,0.08702646940946579,0.6430434584617615,0.032015249133110046
"When potassium perchlorate, KClO4, dissolves in water, the temperature of the resultant solution is lower than the initial temperature of the components. Which of the following conclusions may be related to this?",This is a spontaneous process because it is exothermic.,This is a spontaneous process because of an entropy increase.,This is a spontaneous process because of an entropy decrease.,This is a spontaneous process because it is exothermic.,B,False,0.19842775166034698,0.10621070116758347,0.5393824577331543,0.1545356661081314
"Hard materials such as silicon carbide, used for grinding wheels, are said to be examples of",ionic crystals,network crystals,metallic crystals,molecular crystals,B,False,0.2391761839389801,0.06852511316537857,0.6501482129096985,0.041562583297491074
"A solution of sulfurous acid, H2SO3, is present in an aqueous solution. Which of the following represents the concentrations of three different ions in solution?",[SO32-] > [HSO3-] > [H2SO3],[H2SO3] > [HSO3-] > [SO32-],[H2SO3] > [HSO3-] = [SO32-],[SO32-] = [HSO3-] > [H2SO3],B,False,0.1511058509349823,0.249131441116333,0.4654387831687927,0.1333504468202591
Which of the following is a reduction half-reaction? (1) Cu2+ + e- → Cu+ (2) Cu+ + e- → Cu0 (3) Fe2+ → Fe3+ + e-,1 only because copper(II) ions are reduced,3 only because the iron is reduced,1 and 2 because they both reduce copper ions,1 and 3 because they do not have insoluble ions,C,True,0.2418745756149292,0.04203150048851967,0.5802269577980042,0.06929823011159897
The first ionization energy for a neutral atom of chlorine is 1.25 MJ/mol and the first ionization energy for a neutral atom of argon is 1.52 MJ/mol. How would the first ionization energy value for a neutral atom of potassum compare to those values?,It would be greater than both because potassium carries a greater nuclear charge then either chlorine or argon.,It would be greater than both because the size of a potassium atom is smaller than an atom of either chlorine or argon.,"It would be less than both because there are more electrons in potassium, meaning they repel each other more effectively and less energy is needed to remove one.",It would be less than both because a valence electron of potassium is farther from the nucleus than one of either chlorine or argon.,D,False,0.17564702033996582,0.07322057336568832,0.6130683422088623,0.1367940455675125
Which of the following is the correct order of increasing acid strength?,H2SeO3 < H2SO3 < HClO < HBrO,HClO < H2SeO3 < HBrO < H2SO3,HBrO < HClO < H2SeO3 < H2SO3,H2SO3 < H2SeO3 < HClO < HBrO,C,False,0.36980897188186646,0.1541593223810196,0.36980897188186646,0.10595205426216125
"During a chemical reaction, NO(g) gets reduced and no nitrogen-containing compound is oxidized. Which of the following is a possible product of this reaction?",NO2(g),N2(g),NO3-(aq),NO2-(aq),B,False,0.2639150321483612,0.14126352965831757,0.558708131313324,0.03571701422333717
"When using the ideal gas law, standard conditions for temperature and pressure are",0 K and 0 torr,25 °C and 1 atmosphere pressure,0 °C and 760 torr,0 °F and 1 atmosphere pressure,C,True,0.13205327093601227,0.0800943672657013,0.6706218719482422,0.11653660237789154
