0,1,2,3,4,5,correct,choiceA_probs,choiceB_probs,choiceC_probs,choiceD_probs
"Bromine has a normal boiling point of 59 °C, and iodine boils at 184 °C. The I2 molecule is much larger than Br2 (atomic radii are 114 and 133 pm, respectively). Which is the best reason for the large difference in boiling points?",Bromine is a liquid and boils; iodine is a solid and sublimes.,The intramolecular bonds in I2 are much weaker than those in Br2.,"The I2 electron clouds are much more polarizable than the Br2 electron clouds, resulting in much stronger London forces.",The mass of iodine is much greater than the mass of bromine.,C,False,0.4062153697013855,0.19188255071640015,0.35848379135131836,0.04281478375196457
"Atoms of four elements are examined: carbon, nitrogen, neon, and sulfur. Atoms of which element would have the strongest magnetic moment?",Carbon,Nitrogen,Neon,Sulfur,B,False,0.09286446869373322,0.009787843562662601,0.881073534488678,0.01613742485642433
Argon can be liquefied at low temperature because of,dipole-dipole attractive forces,hydrogen bonding,instantaneous and induced dipoles,the very low temperature,C,True,0.14156506955623627,0.021709706634283066,0.8146507740020752,0.021709706634283066
Choose the reaction expected to have the greatest decrease in entropy.,C(s) + CO2(g) → 2 CO(g),2 Na(s) + O2(g) → Na2O2(s),CH4(g) + 2 O2(g) → CO2(g) + 2 H2O(g),2 NI3(s) → 3 I2(s) + N2(g),B,False,0.25800076127052307,0.05756774917244911,0.6189116835594177,0.06523280590772629
"A 2.0 L flask holds 0.40 g of helium gas. If the helium is evacuated into a larger container while the temperature is held constant, what will the effect on the entropy of the helium be?",It will remain constant as the number of helium molecules does not change.,It will decrease as the gas will be more ordered in the larger flask.,It will decrease because the molecules will collide with the sides of the larger flask less often than they did in the smaller flask.,It will increase as the gas molecules will be more dispersed in the larger flask.,D,False,0.1852704882621765,0.09916814416646957,0.6466575264930725,0.06815719604492188
Chemical reactions can be classified as either heterogeneous or homogeneous. Which of the following equations below is best classified as a heterogeneous reaction?,2C2H2(g) + 5O2(g) → 4CO2(g) + 2H2O(g),C2H5OH(aq) + O2(aq) → HC2H3O2(aq) + H2O(aq),C(s) + H2O(g) → H2(g) + CO(g),C2H2(g) + 5N2O(g) → CO2(g) + H2O(g) + 5N2(g),C,False,0.6699602603912354,0.14948834478855133,0.16939248144626617,0.010828899219632149
What is the molar mass of a monoprotic weak acid that requires 26.3 mL of 0.122 M KOH to neutralize 0.682 gram of the acid?,212 g mol-1,4.70 g mol-1,147 g mol-1,682 g mol-1,A,False,0.04875708371400833,0.07094113528728485,0.7626891136169434,0.11696217209100723
"An experiment was performed to determine the moles of carbon dioxide gas formed (collected over water) when an acid reacts with limestone. To do this, a piece of dry limestone was weighed. Then carbon dioxide was collected until the limestone disappeared. The atmospheric pressure was measured at 0.965 atm. The temperature was 295 K. The volume of CO2 was measured to the nearest mL and corrected for the vapor pressure of water. The student continuously got low results from what was expected. Can you suggest why?",Limestone is never pure CaCO3.,Limestone is Ca(HCO3)2.,Carbon dioxide is rather soluble in water.,Perhaps there was not enough acid to dissolve all the limestone.,C,True,0.1555381864309311,0.12113325297832489,0.6151654720306396,0.10689972341060638
"Nitrous acid, HNO2, has a pKa value of 3.3. If a solution of nitrous acid is found to have a pH of 4.2, what can be said about the concentration of the conjugate acid/base pair found in solution?",[HNO2] > [NO2-],[NO2-] > [HNO2],[H2NO2+] > [HNO2],[HNO2] > [H2NO2+],B,False,0.42153695225715637,0.15507479012012482,0.3282932937145233,0.0940576121211052
"Which of the following best explains why the ionization of atoms can occur during photoelectron spectroscopy, even though ionization is not a thermodynamically favored process?",It is an exothermic process due to the release of energy as an electron is liberated from the Coulombic attraction holding it to the nucleus.,The entropy of the system increases due to the separation of the electron from its atom.,Energy contained in the light can be used to overcome the Coulombic attraction between electrons and the nucleus.,The products of the ionization are at a lower energy state than the reactants.,C,True,0.2451014369726181,0.06197134032845497,0.6662546992301941,0.025833498686552048
"During the investigation of a chemical reaction by a chemistry student, she was able to determine that the reaction was nonspontaneous at 1 atm and 298 K. However, she learned that cooling the system with dry ice (-78°C) caused the reaction to become spontaneous. Which of the following combinations must apply to this reaction?","ΔH < 0, ΔS < 0, and ΔG = 0","ΔH > 0, ΔS < 0, and ΔG > 0","ΔH < 0, ΔS < 0, and ΔG > 0","ΔH > 0, ΔS > 0, and ΔG > 0",C,True,0.24961477518081665,0.22028428316116333,0.41154518723487854,0.11790967732667923
Which of the following is a balanced chemical reaction?,Na2SO4 + Ba(NO3)2 → BaSO4 + NaSO4,AgNO3 + K2CrO4 → Ag2CrO4 + 2 KNO3,5 FeCl2 + 8 HCl + KMnO4 → 5 FeCl3 + MnCl2 + 4 H2O + KCl,Al(NO3)3 + 3 KOH → Al(OH)3 + KNO3,C,True,0.1780659407377243,0.1080024465918541,0.48403337597846985,0.22864118218421936
Identify the Brønsted-Lowry conjugate acid-base pair in the following list.,H3O+ and OH-,H3PO4 and H2PO4-,HClO4 and ClO3-,SO32- and HSO2-,B,False,0.2572626769542694,0.09464165568351746,0.61714106798172,0.030725644901394844
"Neutral atoms of chlorine are bombarded by high-energy photons, causing the ejection of electrons from the various filled subshells. Electrons originally from which subshell would have the highest velocity after being ejected?",1s,2p,3p,3d,C,True,0.22321085631847382,0.10543732345104218,0.606749951839447,0.06395097076892853
"Sulfurous acid is a weak acid, while sulfuric acid is a much stronger acid because",the sulfur in sulfuric acid is more electronegative than the sulfur in sulfurous acid,sulfuric acid has more oxygen atoms in its formula,the O–H bonds in sulfuric acid are much weaker than those in sulfurous acid,sulfurous acid has its hydrogen atoms bound directly to the sulfur atom,C,True,0.35356974601745605,0.13007104396820068,0.4539925456047058,0.06144120916724205
Which of the following is a radioactive element?,Na,Cr,Am,Al,C,True,0.04909766837954521,0.04909766837954521,0.7680167555809021,0.13346129655838013
Which of the following is expected to have two or more resonance structures?,CCl2F2,SO3,PF5,H2O,B,False,0.1344209462404251,0.08153042197227478,0.5316451191902161,0.2511313855648041
Formation of a solution can often be visualized as a three-step process. Step 1. Solvent molecules are separated from each other to make space for the solute. Step 2. Solute molecules are separated so they fit into spaces in the solvent. Step 3. Separated solute and solvent are brought together filling in the spaces.All of the fundamental principles below are important in understanding the formation of solutions except which one?,"Starting at equilibrium, moving particles apart while in the solid or equilibrium phases requires added energy proportional to the attractive forces.",Bringing particles together releases energy in proportion to their attractive forces.,The total of the energies in steps 1 to 3 indicates if a solution will form.,Molecules with similar molecular masses are required to form solutions.,D,False,0.2300194501876831,0.17913931608200073,0.42973288893699646,0.15808992087841034
Most transition metals share a common oxidation state of +2. Which of the following best explains why?,Transition metals all have a minimum of two unpaired electrons.,Transition metals have unstable configurations and are very reactive.,Transition metals tend to gain electrons when reacting with other elements.,Transition metals will lose their outermost s-block electrons when forming bonds.,D,False,0.6163310408592224,0.07361024618148804,0.29113417863845825,0.01861158385872841
"A 2.35-gram sample was dissolved in water, and the chloride ions were precipitated by adding silver nitrate (Ag+ + Cl- → AgCl). If 0.435 g of precipitate was obtained, what is the percentage of chlorine in the sample?",10.80%,4.60%,43.50%,18%,B,False,0.21482543647289276,0.1302981972694397,0.5839560031890869,0.06974360346794128
"Nitrous acid is a weak acid, while nitric acid is a much stronger acid because",the nitrogen in nitric acid is more electronegative than the nitrogen in nitrous acid,nitric acid has more oxygen atoms in its formula,the –O–H bonds in nitric acid are much weaker than in nitrous acid due to the electron withdrawing of more oxygen atoms on nitric acid,nitric acid has the hydrogen atoms bound directly to the nitrogen atom,C,True,0.29783275723457336,0.10956653207540512,0.5564247965812683,0.03557104617357254
"Determine the H+(aq) concentration in 1.0 M phenol, C6H5OH, solution. (The Ka for phenol is 1 × 10^-10.)",1 × 10^-10 M,1 × 10^-9 M,1 × 10^-3 M,1 × 10^-5 M,D,False,0.1945863515138626,0.13373711705207825,0.599368155002594,0.0715843215584755
"The equilibrium constant, Kc, for the dissociation of HI into hydrogen gas and iodine vapor is 21 at a certain temperature. What will be the molar concentration of iodine vapor if 15 grams of HI gas is introduced into a 12.0-L flask and allowed to come to equilibrium?",4.58 mol/L,0.00687 mol L-1,4.4 × 10^-3 M,9.76 × 10^-3 M,C,True,0.1332942098379135,0.11763172596693039,0.6769238710403442,0.07134725153446198
"0.25 mol of a weak, monoprotic acid is dissolved in 0.25 L of distilled water. The pH was then measured as 4.26. What is the pKa of this weak acid?",4.26,8.52,7.52,3.66,B,False,0.1088566854596138,0.08477766811847687,0.7098346948623657,0.09606567770242691
"Fluorine has a normal boiling point of 85 K, and chlorine boils at 239 K. The Cl2 molecule is much larger than F2 (atomic radius is 99 pm for chlorine and is 64 pm for fluorine). Which is the best reason for the large difference in boiling points?",Chlorine has a higher dipole moment than fluorine.,The intramolecular bonds in Cl2 are much weaker than those in F2.,"The Cl2 electron clouds are much more polarizable than the F2 electron clouds, resulting in much stronger London forces.",The mass of chlorine is much greater than the mass of fluorine.,C,False,0.5148138403892517,0.13016532361507416,0.31225037574768066,0.04225848987698555
Less than 1/1000 of the mass of any atom is contributed by,the electrons,the electrons and neutrons,the electrons and protons,the protons and neutrons,A,False,0.19939249753952026,0.08311916142702103,0.6959481835365295,0.021015815436840057
What is the molecular mass of a gas that has a density of 2.05 g/L at 26.0 °C and 722 torr?,53.0 g/mol,46.7 g/mol,4.67 g/mol,2876 g/mol,A,False,0.12465981394052505,0.11001189053058624,0.5586864948272705,0.20552930235862732
"Consider the Lewis structures for the following molecules: CO2, CO32-, NO2-, and NO3-. Which molecules are best represented by multiple resonance structures?",CO2 and CO32-,NO2- and NO3-,CO32- and NO3-,"CO32-, NO2- and NO3-",D,False,0.1984136551618576,0.06441547721624374,0.6925317049026489,0.04427206888794899
Helium effuses through a pinhole 5.33 times faster than an unknown gas. That gas is most likely,CO2,CH4,C5H12,C8H18,D,False,0.11957292258739471,0.0439884215593338,0.7797133922576904,0.05648225173354149
"When a solid melts, the entropy change and enthalpy changes expected are",positive enthalpy change and positive entropy change,negative entropy change and a negative enthalpy change,negative entropy change and positive enthalpy change,negative enthalpy change and positive entropy change,A,False,0.13240303099155426,0.08030649274587631,0.5933891534805298,0.19264525175094604
"If 1.0 g of rubidium and 1.0 g of bromine are reacted, what will be left in measurable amounts (more than 0.10 mg) in the reaction vessel?",RbBr only,RbBr and Rb only,RbBr and Br2 only,"RbBr, Rb, and Br2",C,True,0.05086095631122589,0.030848726630210876,0.901531994342804,0.016512135043740273
"Magnesium has an atomic radius of 160 pm and a first ionization energy of 737 kJ. Based on periodic trends and the data given above, what are the most probable values for the ionization energy and atomic radius of sodium?","186 pm, 496 kJ/mol","186 pm, 898 kJ/mol","135 pm, 523 kJ/mol","147 pm, 523 kJ/mol",A,False,0.07196702808141708,0.1523541957139969,0.6828041672706604,0.09240748733282089
Carbon exists in various forms called allotropes. Which of the following is not an allotrope of carbon?,diamond,soot,buckminsterfullerene,graphite,B,False,0.236202210187912,0.05270383507013321,0.5666196346282959,0.14326389133930206
"Based on periodic relationships, the concepts related to bond strength, and the concept relating bond strength to acid strength, which of the following correctly predicts the strength of binary acids from strongest to weakest?",H2Se > H2O > H2S,H2S > H2Se > H2O,H2O < H2S < H2Se,H2Se > H2S > H2O,D,False,0.25991472601890564,0.20242181420326233,0.42852696776390076,0.10834858566522598
Which of the following is considered a metalloid?,Cr,Mn,Si,S,C,True,0.021983424201607704,0.013333621434867382,0.7279910445213318,0.2363440841436386
S(s) + O2(g) → SO2(g),one atom of S reacts with one molecule of O2 to yield one molecule of SO2,one mole of sulfur atoms reacts with one mole of oxygen molecules to yield one mole of sulfur dioxide molecules,the position of equilibrium must be on the product side,the entropy increase will be large,D,False,0.24087490141391754,0.16555075347423553,0.5778288841247559,0.015398617833852768
Which of the following is expected to have the highest electronegativity?,S,Fe,W,Ag,A,False,0.042945511639118195,0.01394236646592617,0.8625836372375488,0.08023277670145035
What is the pH of a solution made by dissolving 0.0300 mol of sodium ethanoate in enough water to make 50 mL of solution (Ka for ethanoic acid is 1.8 × 10^-5)?,7,9.26,4.74,11.02,B,False,0.1409134417772293,0.08546832203865051,0.631530225276947,0.1409134417772293
"The specific rate constant, k, for a certain first-order reaction is 86 h^-1. What mass of a 0.0500 g sample of starting material will remain after 58 s?",0.0500 g,0.0250 g,0.0125 g,0.00625 g,C,True,0.08197815716266632,0.10526203364133835,0.7777870893478394,0.03417358174920082
The molar heat of vaporization of water is +43.9 kJ. What is the entropy change for the vaporization of water?,8.49 J mol-1 K-1,4.184 J mol-1 K-1,2.78 J mol-1 K-1,118 J mol-1 K-1,D,False,0.1670769453048706,0.06964802742004395,0.6608021259307861,0.10133729130029678
"A metal is reacted with HCl to produce hydrogen gas. If 0.0623 gram of metal produces 28.3 mL of hydrogen at STP, the mass of the metal that reacts with one mole of hydrochloric acid is",98.6 g,493 g,24.7 g,49.3 g,C,True,0.11821796745061874,0.151794895529747,0.6802974939346313,0.04928058385848999
The rate of a chemical reaction is determined by,the equilibrium constant,the rate-determining or slow step of the mechanism,the reaction vessel pressure,the intermediates formed in the first step,B,False,0.39549684524536133,0.14549516141414642,0.4481566548347473,0.010539635084569454
A first-order reaction has a half-life of 34 minutes. What is the rate constant for this reaction?,3.4 × 10^-4 s-1,2.04 × 10^-2 s-1,2.9 × 10^-1 min-1,34 min,A,False,0.19762343168258667,0.11986466497182846,0.6087230443954468,0.072701595723629
"A certain reaction is nonspontaneous under standard conditions, but becomes spontaneous at higher temperatures. What conclusions may be drawn under standard conditions?","ΔH < 0, ΔS < 0 and ΔG = 0","ΔH > 0, ΔS < 0 and ΔG > 0","ΔH < 0, ΔS < 0 and ΔG > 0","ΔH > 0, ΔS > 0 and ΔG > 0",D,False,0.08898837864398956,0.14671704173088074,0.4519203007221222,0.3105999827384949
"When collecting a gas over water, it is important to",set the temperature at 0°C,be sure the gas does not burn,wait until the barometer reads 760,correct for the vapor pressure of water,D,False,0.052632495760917664,0.07657982409000397,0.8233107924461365,0.04644801840186119
A sample of solid MgCl2 would be most soluble in which of the following solutions?,LiOH(aq),CBr4(aq),Mg(NO3)2(aq),AlCl3(aq),A,False,0.1593533456325531,0.12410451471805573,0.5561978220939636,0.1593533456325531
"SO2Cl2 → SO2(g) + Cl2(g) At 600 K, SO2Cl2 will decompose to form sulfur dioxide and chlorine gas via the above equation. If the reaction is found to be first order overall, which of the following will cause an increase in the half life of SO2Cl2?",Increasing the initial concentration of SO2Cl2,Increasing the temperature at which the reaction occurs,Decreasing the overall pressure in the container,None of these will increase the half life,D,False,0.3684479594230652,0.22347499430179596,0.325154185295105,0.08221185207366943
How many moles of propane (C3H8) are there in 6.2 g of propane?,14.1 mol,1.4 × 10^-1 mol,71 mol,7.1 mol,B,False,0.15502920746803284,0.0940299704670906,0.6131523847579956,0.13681280612945557
You cannot prepare a buffer by,mixing a solution of a weak base with a strong acid,mixing a solution of a weak acid with a strong base,mixing a solution of a strong base with a strong acid,mixing a solution of a weak acid with its conjugate base,C,True,0.38198238611221313,0.10943979024887085,0.43284276127815247,0.07521679252386093
Which would be the easiest way to burn a copper penny?,"Hold the copper penny with crucible tongs, and heat strongly in the flame of a Bunsen burner.","Use the method in (A), but use an oxyacetylene torch to reach a higher temperature.","Grind the copper penny into very small, dust-sized particles, and spray the particles into a Bunsen burner flame.","Dissolve the copper penny in acid, precipitate the hydroxide, and heat in a Bunsen burner flame to make the oxide.",C,True,0.06563547998666763,0.016595248132944107,0.906069815158844,0.011405735276639462
Which of the following molecules is a strong electrolyte when dissolved in water?,CH3COOH,HC2H3O2,PCl5,HBr,D,False,0.09026267379522324,0.03762707859277725,0.7557600736618042,0.11589956283569336
"Dissolving one mole of each of the following compounds in water results in solutions with different pH values. Under those conditions, which of the following acids will have the highest percentage ionization?",HNO2,HClO4,H2S,H3PO4,B,False,0.0979076400399208,0.0524061843752861,0.7234450578689575,0.12571589648723602
The collision theory of reaction rates does not include,the number of collisions per second,the transition state,the energy of each collision,the orientation of each collision,B,False,0.07817387580871582,0.10037723928689957,0.7416930794715881,0.07817387580871582
"When the dichromate ion is reacted, one of its most common products is Cr3+. What is the oxidation state (oxidation number) of chromium in the dichromate ion? Does reduction or oxidation occur when dichromate forms Cr3+?","3+, reduction","12+, reduction","6+, reduction","6+, oxidation",C,True,0.1300806701183319,0.1300806701183319,0.6606041789054871,0.07889791578054428
"During the study of the reaction A → 2B, a chemist constructs several graphs. The graph of [A] versus time and the graph of ln [A] versus time both give a curved line; however, the graph of 1/[A] versus time and gives a straight line. This implies the rate law is",Rate = k[A],Rate = k[A]^2,Rate = k[A]^0,Rate = k[A]^-1,B,False,0.25638484954833984,0.15550526976585388,0.5427666902542114,0.0445530042052269
