0,1,2,3,4,5,correct,choiceA_probs,choiceB_probs,choiceC_probs,choiceD_probs
London dispersion forces are caused by,temporary dipoles created by the position of electrons around the nuclei in a molecule,the three-dimensional intermolecular bonding present in all covalent substances,the uneven electron-to-proton ratio found on individual atoms of a molecule,the electronegativity differences between the different atoms in a molecule,A,False,0.40283530950546265,0.07000228017568588,0.5172507762908936,0.009473778307437897
Carbon has an atomic radius of 77 pm and a first ionization energy of 1086 kJ/mol.,"70 pm, 1402 kJ/mol","86 pm, 898 kJ/mol","135 pm, 523 kJ/mol","40 pm, 995 kJ/mol",A,False,0.082720547914505,0.10621528327465057,0.6112267971038818,0.19843629002571106
"An unknown substance is found to have a high melting point. In addition, it is a poor conductor of electricity and does not dissolve in water. The substance most likely contains",ionic bonding,nonpolar covalent bonding,covalent network bonding,metallic bonding,C,True,0.3327872157096863,0.10804017633199692,0.5486733317375183,0.010049303062260151
The net ionic equation expected when solutions of NH4Br and AgNO3 are mixed together is,Ag+(aq) + Br-(aq) → AgBr(s),NH4+(aq) + Ag+(aq) → Ag(NH4)3+2(aq),Br-(aq) + NO3-(aq) → NO3Br(aq),NH4Br(aq) + NO3-(aq) → NH4NO3(aq) + Br-(aq),A,True,0.41676393151283264,0.13530343770980835,0.41676393151283264,0.030190279707312584
The symbol for antimony is,W,Sb,Fe,An,B,False,0.04296170175075531,0.02299574203789234,0.8629088401794434,0.07083187252283096
"A sealed, rigid container contains three gases: 28.0 g of nitrogen, 40.0 g of argon, and 36.0 g of water vapor. If the total pressure exerted by the gases is 2.0 atm, what is the partial pressure of the nitrogen?",0.33 atm,0.40 atm,0.50 atm,2.0 atm,C,True,0.13802990317344666,0.17723390460014343,0.545918881893158,0.13802990317344666
Monatomic ions of the representative elements are often,very soluble,very electronegative,isoelectronic with a noble gas,highly colored,C,True,0.30278441309928894,0.09829969704151154,0.499207079410553,0.09829969704151154
Hund's rule requires that,no two electrons can have the same four quantum numbers,no two electrons with the same spin can occupy an orbital,no two electrons can occupy separate orbitals,no two electrons can pair up if there is an empty orbital at the same energy level available,D,False,0.3075864017009735,0.09985867887735367,0.574647068977356,0.017352838069200516
All of the following ions have the same electron configuration except,Rb+,Se2-,As5+,Sr2+,C,True,0.08265732228755951,0.03904455527663231,0.7842308878898621,0.09366302192211151
"Sulfurous acid is a weak acid, while sulfuric acid is a much stronger acid because",the O–H bonds in sulfuric acid are much weaker than in sulfurous acid due to the electron withdrawing of the oxygen atoms on sulfuric acid,sulfuric acid has more oxygen atoms in its formula,the sulfur in sulfuric acid is more electronegative than the sulfur in sulfurous acid,sulfuric acid has the hydrogen atoms bound directly to the sulfur atom,A,True,0.42336738109588623,0.1070440337061882,0.3736203908920288,0.09446603059768677
What is the molarity of a sodium hydroxide solution that requires 42.6 mL of 0.108 M HCl to neutralize 40.0 mL of the base?,0.0641 M,1.64 M,0.115 M,0.400 mol/L,C,True,0.08770592510700226,0.09938383847475052,0.6480640172958374,0.16385623812675476
Which of the following substances has an asymmetrical molecular structure?,SF4,PCl5,BF3,CO2,A,False,0.04170917347073555,0.05355564132332802,0.7393127679824829,0.1649629771709442
"Hydrogen fluoride, HF, is a liquid at 15°C. All other hydrogen halides (represented by HX, where X is any other halogen) are gases at the same temperature. Why?",Fluorine has a very high electronegativity; therefore the H-F bond is stronger than any other H-X bond.,HF is smaller than any other H-X molecule; therefore it exhibits stronger London dispersion forces.,The dipoles in a HF molecule exhibit a particularly strong attraction force to the dipoles in other HF molecules.,The H-F bond is the most ionic in character compared to all other hydrogen halides.,C,False,0.6299493908882141,0.05170939117670059,0.23174545168876648,0.08525437861680984
"The reaction of Br2(g) with Cl2(g) to form BrCl(g) has an equilibrium constant of 15.0 at a certain temperature. If 10.0 grams of BrCl is initially present in a 15.0-liter reaction vessel, what will the concentration of BrCl be at equilibrium?",3.8 × 10^-3 mol/L,5.77 × 10^-3 mol/L,1.97 × 10^-3 M,9.9 × 10^-4 M,A,False,0.20739614963531494,0.23501063883304596,0.49751752614974976,0.05941999331116676
A sample of liquid NH3 is brought to its boiling point. Which of the following occurs during the boiling process?,The N-H bonds within the NH3 molecules break apart.,The overall temperature of the solution rises as the NH3 molecules speed up.,The amount of energy within the system remains constant.,The hydrogen bonds holding separate NH3 molecules together break apart.,D,False,0.3407093584537506,0.11061213910579681,0.43747949600219727,0.11061213910579681
"A student has a liter of a 0.100 M solution of a strong acid. To prepare a buffer, this should be mixed with",a strong acid,a weak acid,a weak base,a strong base,C,True,0.2159191370010376,0.14839889109134674,0.5869289636611938,0.048178065568208694
Which of the following indicates that a reaction is spontaneous?,at equilibrium there are more products than reactants,the value of ΔG° is greater than zero,the value of ΔS° is greater than zero,the value of Keq is less than one,A,False,0.21399447321891785,0.08920616656541824,0.6591494083404541,0.03718666732311249
Which of the following is expected to have the largest bond polarity?,S–O,P–F,C–B,C–N,B,False,0.09456727653741837,0.039421502500772476,0.7918021082878113,0.07364906370639801
A mechanism is a sequence of elementary reactions that add up to the overall reaction stoichiometry. A substance that is produced in one elementary reaction and consumed in another is called,a catalyst,an intermediate,a reactant,a complex,B,False,0.2600055932998657,0.20249255001544952,0.4857543706893921,0.05119813233613968
Approximately how many half-lives will it take to reduce 10.0 kg of a radioactive substance to 1.0 microgram of that substance?,8,13,29,34,D,False,0.04724336043000221,0.08826220780611038,0.6521744132041931,0.21173003315925598
S(s) + O2(g) → SO2(g),either S(s) or O2(g) will be completely used up,Q must be close to 1.0 since there is one mole of gas on each side of the equation,this reaction goes to completion,adding O2 will change the equilibrium constant,B,False,0.08527672290802002,0.07525643706321716,0.7140132188796997,0.12407688796520233
"Three half-lives after an isotope is prepared,",25% of the isotope is left,25% of the isotope decayed,12.5% of the isotope is left,12.5% of the isotope decayed,C,True,0.052436914294958115,0.2662966549396515,0.49750760197639465,0.18302284181118011
"Which pair of reactants will have no net ionic equation (that is, all the ions cancel)?",Na2SO3 + FeCl2,CaCl2 + MnSO4,NH4I + Pb(NO3)2,KOH + HClO4,B,False,0.04562950134277344,0.03553628921508789,0.8088022470474243,0.10945947468280792
Which of the following is expected to be the least soluble in water?,NaBr,NiSO3,CrCl3,Mn(NO3)2,B,False,0.056774165481328964,0.02681821584701538,0.691650927066803,0.2245461791753769
The rate law may be written using stoichiometric coefficients for which of the following?,Precipitation reactions,Acid-base reactions,Elementary processes,Solubility reactions,C,True,0.08972034603357315,0.033006273210048676,0.8512429594993591,0.025705311447381973
"A liquid element that is a dark-colored, nonconducting substance at room temperature is",mercury,bromine,iodine,bismuth,B,False,0.027541395276784897,0.008941383101046085,0.8048775792121887,0.15848977863788605
The molecule with a tetrahedral shape is,PCl4F,BF3,CO2,CBr4,D,False,0.015516079030930996,0.02257576398551464,0.7476065754890442,0.21419288218021393
The ideal gas law is successful for most gases because,room temperature is high,volumes are small,gas particles do not interact significantly,gases are dimers,C,True,0.16308490931987762,0.04672461003065109,0.6450133323669434,0.14392192661762238
What is an alpha particle?,Another name for an electron,Another name for a helium nucleus,Another name for a positron,Another name for a cosmic ray,B,False,0.2461039274930954,0.054913200438022614,0.6689797639846802,0.029392918571829796
Your supervisor asks you to determine the enthalpy of a certain chemical reaction. Which would you do?,"Measure the ΔS and the ΔG for the reaction, and calculate the ΔH from the Gibbs free energy equation.",Use a bomb calorimeter to measure the heat of the reaction.,Use a solution calorimeter such as a coffee-cup calorimeter to measure the heat.,"Use a photoelectron spectrometer to measure the energies of all atoms in the compounds, and use Hess's law to add them.",C,False,0.395049124956131,0.18660800158977509,0.395049124956131,0.022287147119641304
The bond length between any two nonmetal atoms is achieved under which of the following conditions?,Where the energy of interaction between the atoms is at its minimum value,Where the nuclei of each atom exhibits the strongest attraction to the electrons of the other atom,The point at which the attractive and repulsive forces between the two atoms are equal,The closest point at which a valence electron from one atom can transfer to the other atom,A,False,0.2729843854904175,0.18761925399303436,0.5100019574165344,0.028772342950105667
"The oxidation number of chlorine in the perchlorate ion, ClO4–, is",2,-3,-1,7,D,False,0.10102199763059616,0.03716391697525978,0.7464572191238403,0.11447292566299438
"There are a number of experiments for the determination of the molecular mass of a gas. One method begins by heating a solid or liquid in a flask to produce a gaseous product. The gas passes through a tube and displaces water in an inverted, water-filled bottle. The mass of the starting material is measured, along with the volume of the displaced water and the temperature of the system. The pressure in the inverted water-filled bottle is equal to the external pressure. Once the barometric pressure has been recorded, what other information is needed to finish the experiment?",The heat of formation of the gas,The density of the water,The mass of the displaced water,The vapor pressure of the water,D,False,0.2168414443731308,0.2168414443731308,0.45905330777168274,0.10242864489555359
The melting point of straight-chain hydrocarbons increases as the number of carbon atoms increase. The reason for this is the,increasing mass of the compounds,increasing polarity of the compounds,increasing number of induced dipoles per molecule,increased probability of hydrogen bonds,C,True,0.3976254463195801,0.11392159759998322,0.45056864619255066,0.03698492795228958
"A sample of a compound known to consist of only carbon, hydrogen, and oxygen is found to have a total mass of 29.05 g. If the mass of the carbon is 18.02 g and the mass of the hydrogen is 3.03 g, what is the empirical formula of the compound?",C2H4O,C3H6O,C2H6O3,C3H8O2,B,False,0.10241233557462692,0.11604838073253632,0.5893423557281494,0.19133144617080688
Which would be the easiest way to burn an iron nail?,"Hold an iron nail with crucible tongs, and heat strongly in the flame of a Bunsen burner.","Use the method in (A), but use an oxyacetylene torch to reach a higher temperature.","Grind the nail into very small, dust-sized particles, and spray them into a flame",Dissolve the nail in acid to make the oxide.,C,True,0.12546344101428986,0.12546344101428986,0.6371560096740723,0.11072110384702682
Which of the following has an octet of electrons around the central atom?,BF3,NH4+,PF5,SF6,B,False,0.04963018000125885,0.020688937976956367,0.7763466238975525,0.15287171304225922
How many milliliters of 0.250 M KOH does it take to neutralize completely 50.0 mL of 0.150 M H3PO4?,30.0 mL,27 mL,90.0 mL,270 mL,C,True,0.12091324478387833,0.13701264560222626,0.5418955683708191,0.19935224950313568
NH4+(aq) + NO2- (aq) → N2(g) + 2H2O(l) Increasing the temperature of the above reaction will increase the rate of reaction. Which of the following is NOT a reason that increased temperature increases reaction rate?,The reactants will be more likely to overcome the activation energy.,The number of collisions between reactant molecules will increase.,A greater distribution of reactant molecules will have high velocities.,Alternate reaction pathways become available at higher temperatures.,D,False,0.10377206653356552,0.11758916825056076,0.5269981026649475,0.24893628060817719
The relationship between the vapor pressure of a liquid and the heat of vaporization is expressed in the,Rydberg equation,Gibbs free energy equation,Clausius-Clapeyron equation,Arrhenius equation,C,True,0.34064847230911255,0.059195827692747116,0.43740129470825195,0.160910964012146
"Of the following pairs of elements, which pair has the second element with the larger electronegativity based on its position in the periodic table?","Oxygen, chromium","Chlorine, iodine","Calcium, cesium","Sulfur, nitrogen",D,False,0.05567782744765282,0.07149174064397812,0.7686086893081665,0.10401987284421921
"The units for R, the ideal gas law equation constant, may be",L atm mol-1 K-1,J mol-1 K-1,volt coulomb mol-1 K-1,"(A), (B), and (C)",D,False,0.03307495266199112,0.02006097324192524,0.8530142903327942,0.08990704268217087
Which of the following pair of liquids is expected to be immiscible?,H2O and CH3OH,C6H6 and C5H12,C10H22 and CH2CH2CH2OH,CH3CH2NH2 and CH3CH2CH2OH,C,True,0.12501254677772522,0.09735988080501556,0.6348661780357361,0.14165779948234558
"Of the following, the most important experimental information used to deduce the structure of the atom was",the density of each element,the specific heat capacity,"the emission spectrum of the elements, particularly hydrogen",the X-rays emitted from each element,C,True,0.0805651843547821,0.06274423003196716,0.7643811702728271,0.09129231423139572
"para-dichlorobenzene is used as ""mothballs."" This compound can also be named","1,2-dichlorobenzene","1,3-dichlorobenzene","2,4-dichlorobenzene","1,4-dichlorobenzene",D,False,0.38386788964271545,0.04584648087620735,0.558524489402771,0.011591805145144463
Radon is a health hazard because,it is a gas that can be inhaled and then it may decay to a solid that resides in the lungs,"it is a gas that is extremely soluble in the bloodstream, and it decays in vital organs",it is a gas that enters the body easily and targets the thyroid because it is chemically similar to iodine,it is a gas that enters the body easily and targets bones because it is chemically similar to calcium,A,True,0.46020063757896423,0.16929836571216583,0.27912580966949463,0.09061887115240097
"Each resonance form of the nitrate ion, NO3-, has how many sigma and how many pi bonds?",1 sigma and 2 pi,2 sigma and 1 pi,1 sigma and 1 pi,3 sigma and 1 pi,D,False,0.3697108030319214,0.1541184037923813,0.41893723607063293,0.05669698864221573
Which of the following can form hydrogen bonds?,CH3OCH2CH3,HCN,CH3OCH2Br,CH3NH2,D,False,0.17676784098148346,0.08349920809268951,0.6169803738594055,0.12149062752723694
The functional group that represents an organic acid is written as (Note: R represents the rest of the molecule),RCHO,ROH,RCOOH,RCl,C,True,0.1426243782043457,0.04630335792899132,0.7243064045906067,0.08650606125593185
"A certain radioactive material has a half-life of 36 minutes. Starting with 10.00 grams of this material, how many grams will be left after 2 hours?",1.00 grams,1.5 × 10^-4 grams,3.33 grams,0.25 gram,A,False,0.09881068021059036,0.14376869797706604,0.6443265676498413,0.11196716129779816
What is the pH of a solution prepared by dissolving 0.1665 mole of hypochlorous acid (HClO) in enough water to make 500 mL of solution? The Ka is 3.0 × 10^-4,1,2,5.4 × 10^-3,1.76,B,False,0.059093356132507324,0.059093356132507324,0.7199044227600098,0.1606324017047882
Iron(III) hydroxide has Ksp = 1.6 × 10^-39. What is the molar solubility of this compound?,8.8 × 10^-11 M,2.0 × 10^-10 M,7.4 × 10^-14 mol/L,9.4 × 10^-6 mol/L,A,False,0.17577627301216125,0.13689470291137695,0.6135194301605225,0.07327444851398468
The subatomic particle with the most penetrating ability is,a beta particle,a neutron,a proton,an alpha particle,A,False,0.2150108367204666,0.13041065633296967,0.5844599604606628,0.06980378925800323
"Consider the Lewis structures for the following molecules: CO2, CO32-, NO2-, and NO3-. Which molecule or molecules exhibit sp2 hybridization around the central atom?",CO2 and CO32-,NO2- and NO3-,CO32- and NO3-,"CO32-, NO2- and NO3-",D,False,0.29493921995162964,0.04523039609193802,0.6243863105773926,0.03522546961903572
The photoelectron spectrum of carbon has three equally sized peaks. What peak is at the lowest energy?,The 1s peak has the lowest energy.,The 2s peak has the lowest energy.,The 2p peak has the lowest energy.,The 1p peak has the lowest energy.,C,False,0.6815207004547119,0.018161911517381668,0.28410008549690247,0.01602783054113388
The electrolysis of molten magnesium bromide is expected to produce,magnesium at the anode and bromine at the cathode,magnesium at the cathode and bromine at the anode,magnesium at the cathode and oxygen at the anode,bromine at the anode and hydrogen at the cathode,B,False,0.4777819514274597,0.07327023893594742,0.421641081571579,0.026954615488648415
The Arrhenius equation may be used to determine,the activation energy of a reaction,the rate constant at various temperatures,the shelf life of a consumer product or drug,all of the above,D,False,0.11949212849140167,0.0387934185564518,0.687629759311676,0.15343093872070312
"Nickel (Z = 28, A = 59) has a first ionization energy of 737 kJ/mol and a boiling point of 2913 °C, while Pt (Z = 78, A = 195) has a first ionization energy of 870 kJ/mol and a boiling point of 3825 °C. Which of the following are the most reasonable values of ionization energy and boiling point for palladium?",-200 kJ/mol and 3524 °C,795 kJ/mol and 2436 °C,804 kJ/mol and 2963 °C,932 kJ/mol and 3416 °C,C,True,0.07827867567539215,0.18778078258037567,0.6554192900657654,0.07827867567539215
"In acid solution the bromate ion, BrO3- can react with other substances, resulting in Br2. Balance the half-reaction for bromate ions forming bromine. The balanced half-reaction has",6 electrons on the left,6 electrons on the right,3 electrons on the left,10 electrons on the left,D,False,0.42616239190101624,0.13835467398166656,0.42616239190101624,0.008844718337059021
"0.0025 mol of a weak, monoprotic acid is dissolved in 0.250 L of distilled water. The pH was then measured as 4.26. What is the pKa of this weak acid?",4.26,8.52,7.92,6.52,D,False,0.13979576528072357,0.07482728362083435,0.7099415063858032,0.07482728362083435
"Potassium-40 is a minor isotope found in naturally occurring potassium. It is radioactive and can be detected on simple radiation counters. How many protons, neutrons, and electrons does potassium-40 have when it is part of K2SO4?","21 neutrons, 19 protons, 18 electrons","20 neutrons, 19 protons, 19 electrons","21 neutrons, 19 protons, 19 electrons","19 neutrons, 19 protons, 19 electrons",A,False,0.316531777381897,0.13195008039474487,0.46055102348327637,0.09068786352872849
Which of the following reactions is expected to have the greatest decrease in entropy?,HCl(aq) + NaOH(aq) → NaCl(aq) + H2O(l),CH4(g) + 2 O2(g) → CO2(g) + 2 H2O(l),C(s) + O2(g) → CO2(g),2 SO2(g) + O2(g) → 2 SO3(g),B,False,0.35323402285575867,0.21424727141857147,0.35323402285575867,0.07881716638803482
"What is the ionization constant, Ka, for a weak monoprotic acid if a 0.060 molar solution has a pH of 2.0?",2.0 × 10^-3,2.0 × 10^-1,1.7 × 10^-1,5.0 × 10^-3,A,False,0.2578011751174927,0.1379910260438919,0.4816359877586365,0.12177664786577225
"Solvents A and B form an ideal solution. Solvent A has a vapor pressure of 345 torr at room temperature. At the same temperature, solvent B has a vapor pressure of 213 torr. What is the vapor pressure of a mixture where the mole fraction of A is 0.285?",213 torr,345 torr,568 torr,251 torr,D,False,0.0972074419260025,0.06680963188409805,0.8139079213142395,0.02168991044163704
Which of the following is the strongest Brønsted-Lowry acid?,HBrO,HBrO3,HBrO2,HBrO4,D,False,0.1227625384926796,0.045161813497543335,0.8005122542381287,0.031039228662848473
Which of the following molecules cannot hydrogen bond with molecules identical to itself but can hydrogen bond with one of the molecules above or below it in the following responses?,CH3CH2OH,CH3CH2COOH,CH3CH2CHO,C6H5CHO,C,True,0.15927059948444366,0.12404006719589233,0.5559089779853821,0.15927059948444366
Which following pair of substances can be used to make a buffer solution?,NaCl and HCl,HC2H3O2 and KC2H3O2,NaBr and KBr,HIO3 and KClO3,B,False,0.05317124351859093,0.060250911861658096,0.6477583646774292,0.2382970005273819
In which of the following is the negative end of the bond written last?,O—S,Br—N,N—C,P—Cl,D,False,0.08157248795032501,0.030008841305971146,0.6027437448501587,0.2847159802913666
When will Kp and Kc have the same numerical value?,At absolute zero for all reactions,When the concentrations are at standard state,When the concentrations are all 1.00 molar,When the reaction exhibits no change in pressure at constant volume,D,False,0.04591378942131996,0.11014146357774734,0.7182125449180603,0.12480661273002625
"Silver metal, often amalgamated with mercury, is used to reduce substances to a desired oxidation state. If the silver metal amalgam cannot be used because of concerns about mercury, which of the following would be a reasonable and safe substitute?",H+(aq),Na(s),Ca2+(aq),Mg(s),D,False,0.2262416034936905,0.19965754449367523,0.5427253842353821,0.030618473887443542
PCl3(g) + Cl2(g) ↔ PCl5(g) ΔH = -92.5 kJ/mol In which of the following ways could the reaction above be manipulated to create more product?,Decreasing the concentration of PCl3,Increasing the pressure,Increasing the temperature,None of the above,B,False,0.21302059292793274,0.14640675485134125,0.5790499448776245,0.061031412333250046
A 25 g sample of a liquid was heated to 100 °C and then quickly transferred to an insulated container holding 100 g of water at 22 °C. The temperature of the mixture rose to reach a final temperature of 35 °C. Which of the following can be concluded?,The sample temperature changed more than the water temperature did; therefore the sample lost more heat energy than the water gained.,"The sample temperature changed more than the water temperature did, but the sample lost the same amount of heat energy as the water gained.",The sample temperature changed more than the water temperature did; therefore the CP of the sample must be greater than the CP of the water.,The final temperature is less than the average starting temperature of the sample and the water; therefore the total energy of the sample and water decreased.,B,False,0.4163626432418823,0.15317127108573914,0.3242635428905487,0.10527296364307404
"A sample of oxygen gas at 50 °C is heated, reaching a final temperature of 100 °C. Which statement best describes the behavior of the gas molecules?",Their velocity increases by a factor of two.,Their velocity increases by a factor of four.,Their kinetic energy increases by a factor of 2.,Their kinetic energy increases by a factor of less than 2.,D,False,0.13835583627223969,0.10775163769721985,0.7026289105415344,0.050898268818855286
"What is the empirical formula of a compound that is 51.9% carbon, 4.86% hydrogen, and 43.2% bromine",C7H5Br,C6H4Br3,C8H9Br,C12H22Br,C,True,0.08974108099937439,0.04803493991494179,0.5851853489875793,0.27642199397087097
"Three steel containers hold gas samples. The containers are all the same size and at the same temperature. One container has 4.0 g of helium, another has 28.0 g of nitrogen, and the third has 44.0 g of carbon dioxide. Pick the FALSE statement from the following list:",The densities increase in the order helium < nitrogen < carbon dioxide.,The number of molecules in all the containers is the same.,The pressure in all three containers is the same.,The average speed of all the molecules is the same.,D,False,0.05799884349107742,0.0956239253282547,0.706570565700531,0.13913199305534363
"Determine the final temperature, in °C, of a sample of helium gas. The sample initially occupied a volume of 5.00 L at 127°C and 875 mm Hg. The sample was heated, at constant pressure, until it occupied a volume of 10.00 L.",454°C,527°C,45°C,181°C,B,False,0.0478789396584034,0.08944962918758392,0.848674476146698,0.01371754426509142
Substances whose Lewis structures must be drawn with an unpaired electron are called,ionic compounds,free radicals,resonance structures,polar molecules,B,False,0.06997982412576675,0.029171930626034737,0.8525288105010986,0.04809638485312462
Which of the following molecules is expected to have the highest normal boiling point?,CH3CH2CH2CH3,CH3CH2CH2CH2OH,CH3CH2CH2CH2Cl,CH3CH2CH2CH2Br,B,False,0.1355511099100113,0.08221591264009476,0.6883853673934937,0.09316283464431763
Which net ionic equation below represents a possible reaction that takes place when a strip of magnesium metal is oxidized by a solution of chromium (III) nitrate?,Mg(s) + Cr(NO3)3(aq) → Mg2+(aq) + Cr3+(aq) + 3NO3-(aq),3Mg(s) + 2Cr3+ → 3Mg2+ + 2Cr(s),Mg(s) + Cr3+ → Mg2+ + Cr(s),3Mg(s) + 2Cr(NO3)3(aq) → 3Mg2+(aq) + 2Cr(s) + NO3-(aq),B,False,0.5050582885742188,0.21053962409496307,0.270338237285614,0.013459348119795322
What is the conjugate acid of the H2PO4- ion?,HPO42-,H2PO4-,H3PO4,PO43-,C,True,0.09026669710874557,0.03762875497341156,0.7557937502861023,0.11590473353862762
